Provider Name,Federal Provider Number,Provider Address,Provider City,County,Residents Total Confirmed COVID-19,Residents Total Suspected COVID-19,Residents Total All Deaths,Residents Total COVID-19 Deaths,Total Number of Occupied Beds,Staff Total Confirmed COVID-19,Staff Total Suspected COVID-19,Staff Total COVID-19 Deaths
BEACH TERRACE CARE CENTER,335024,640 WEST BROADWAY,LONG BEACH,Nassau,,,,,,,,
DIAMOND HILL NURSING AND REHABILITATION CENTER,335377,100 NEW TURNPIKE ROAD,TROY,Rensselaer,,,,,,,,
SODUS REHABILITATION & NURSING CENTER,335378,6884 MAPLE AVE,SODUS,Wayne,,,,,,,,
"THE COMMONS ON ST ANTHONY, A S N F & SHORT T R C",335382,3 ST ANTHONY STREET,AUBURN,Cayuga,,,,,,,,
MIDWAY NURSING HOME,335472,69 95 QUEENS MIDTOWN EXPRESSWAY,MASPETH,Queens,,,,,,,,
FOLTSBROOK CENTER FOR NURSING AND REHABILITATION,335510,104 NORTH WASHINGTON STREET,HERKIMER,Herkimer,,,,,,,,
THE GRAND PAVILION FOR RHB & NRSG AT ROCKVILLE CTR,335297,41 MAINE AVENUE,ROCKVILLE CENTRE,Nassau,6,0,11,8,128,1,0,0
SPLIT ROCK REHABILITION AND HEALTH CARE CENTER,335321,3525 BAYCHESTER AVE,BRONX,Bronx,3,2,3,3,215,0,0,0
MONROE COMMUNITY HOSPITAL,335197,435 EAST HENRIETTA ROAD,ROCHESTER,Monroe,2,6,18,0,519,13,134,0
ELDERWOOD AT AMHERST,335056,4459 BAILEY AVE,AMHERST,Erie,,,,,,,,
CROWN PARK REHABILITATION AND NURSING CENTER,335392,28 KELLOGG ROAD,CORTLAND,Cortland,0,0,0,0,165,0,0,0
TOLSTOY FOUNDATION REHABILITATION AND NRSG CENTER,335311,"100 LAKE ROAD, PO BOX 319",VALLEY COTTAGE,Rockland,,,,,,,,
CEDAR MANOR NURSING & REHABILITATION CENTER,335185,"CEDAR LANE, PO BOX 928",OSSINING,Westchester,57,74,30,11,116,36,35,0
SANDS POINT CENTER FOR HEALTH AND REHABILITATION,335022,1440 PORT WASHINGTON BLVD,PORT WASHINGTON,Nassau,20,7,4,1,119,2,0,1
THE PINES AT CATSKILL CENTER FOR NURSING & REHAB,335256,154 JEFFERSON HEIGHTS,CATSKILL,Greene,89,4,18,14,106,41,0,0
ABSOLUT CTR FOR NURSING & REHAB ENDICOTT L L C,335371,301 NANTUCKET DRIVE,ENDICOTT,Broome,0,0,0,0,140,0,0,0
COBBLE HILL HEALTH CENTER INC,335174,380 HENRY STREET,BROOKLYN,Kings,52,2,6,3,232,3,7,0
THE VILLAGES OF ORLEANS HEALTH AND REHAB CENTER,335212,14012 ROUTE 31,ALBION,Orleans,85,20,27,24,110,22,2,0
SEA VIEW HOSPITAL REHABILITATION CENTER AND HOME,335108,460 BRIELLE AVE,STATEN ISLAND,Richmond,11,11,13,6,269,16,30,0
HILAIRE REHAB & NURSING,335040,9 HILAIRE DRIVE,HUNTINGTON,Suffolk,0,0,1,0,56,0,0,0
"WHITE PLAINS CENTER FOR NURSING CARE, L L C",335224,220 WEST POST ROAD,WHITE PLAINS,Westchester,0,0,0,0,67,0,0,0
WASHINGTON CENTER FOR REHAB AND HEALTHCARE,335413,ROUTE 40,ARGYLE,Washington,0,0,0,0,120,0,4,0
ST JAMES REHABILITATION & HEALTHCARE CENTER,335301,275 MORICHES ROAD,ST JAMES,Suffolk,166,5,66,24,195,61,10,0
BAINBRIDGE NURSING & REHABILITATION CENTER,335373,3518 BAINBRIDGE AVENUE,BRONX,Bronx,,,,,,,,
"SENECA NURSING & REHABILITATION CENTER, L L C",335400,200 DOUGLAS DRIVE,WATERLOO,Seneca,0,0,0,0,68,0,0,0
MOMENTUM AT SOUTH BAY FOR REHAB AND NURSING,335401,340 EAST MONTAUK HIGHWAY,EAST ISLIP,Suffolk,2,0,4,1,126,1,6,0
ELDERWOOD AT WILLIAMSVILLE,335326,200 BASSETT ROAD,WILLIAMSVILLE,Erie,0,1,4,0,167,3,6,0
ST ANNS COMMUNITY,335081,1500 PORTLAND AVENUE,ROCHESTER,Monroe,50,0,77,5,322,45,14,0
FRANKLIN CENTER FOR REHABILITATION AND NURSING,335426,142 27 FRANKLIN AVENUE,FLUSHING,Queens,0,0,0,0,230,0,0,0
ST JOHNS HEALTH CARE CORPORATION,335008,150 HIGHLAND AVENUE,ROCHESTER,Monroe,61,0,70,18,320,35,0,0
THE RIVERSIDE,335334,150 RIVERSIDE DRIVE,NEW YORK,New York,48,0,4,4,435,21,0,0
WATERS EDGE AT PORT JEFFERSON FOR REHAB AND NRSG,335410,150 DARK HOLLOW ROAD,PORT JEFFERSON,Suffolk,22,0,6,4,85,18,0,0
REGENCY EXTENDED CARE CENTER,335080,65 ASHBURTON AVENUE,YONKERS,Westchester,3,16,1,0,224,0,0,0
BISHOP REHABILITATION AND NURSING CENTER,335338,918 JAMES STREET,SYRACUSE,Onondaga,155,0,45,34,339,54,0,0
"THE SHORE WINDS, L L C",335082,425 BEACH AVENUE,ROCHESTER,Monroe,38,0,11,8,188,5,0,0
VAN DUYN CENTER FOR REHABILITATION AND NURSING,335184,5075 WEST SENECA TURNPIKE,SYRACUSE,Onondaga,80,1,51,20,406,23,0,0
LUTHERAN RETIREMENT HOME,335268,715 FALCONER STREET,JAMESTOWN,Chautauqua,0,0,25,0,125,0,0,0
GOLD CREST CARE CENTER,335079,2316 BRUNER AVENUE,BRONX,Bronx,36,32,40,26,154,13,20,2
N Y S VETERANS HOME,335097,4211 STATE HIGHWAY 220,OXFORD,Chenango,4,0,0,0,150,3,0,0
COOPERSTOWN CENTER FOR REHABILITATION AND NURSING,335412,128 PHOENIX MILLS CROSS ROAD,COOPERSTOWN,Otsego,0,2,3,0,163,0,0,0
VERRAZANO NURSING HOME,335273,100 CASTLETON AVENUE,STATEN ISLAND,Richmond,11,10,7,22,86,7,8,1
CONESUS LAKE NURSING HOME,335069,6131 BIG TREE ROAD BOX F,LIVONIA,Livingston,0,0,0,0,46,0,0,0
KATHERINE LUTHER RESIDENTIAL HLTH CARE & REHAB,335006,110 UTICA ROAD,CLINTON,Oneida,1,2,6,0,222,9,0,0
FORT HUDSON NURSING CENTER INC,335300,319 UPPER BROADWAY,FORT EDWARD,Washington,0,0,8,6,175,1,2,0
SOUTH SHORE REHABILITATION AND NURSING CENTER,335156,275 W MERRICK ROAD,FREEPORT,Nassau,0,2,0,0,79,0,0,0
"EXCEL AT WOODBURY FOR REHAB AND NURSING, L L C",335231,8533 JERICHO TPKE,WOODBURY,Nassau,0,0,2,1,82,0,0,0
"HORNELL GARDENS, L L C",335322,434 MONROE AVENUE,HORNELL,Steuben,3,0,1,1,37,2,0,0
MARGARET TIETZ CENTER FOR NURSING CARE INC,335336,164 11 CHAPIN PARKWAY,JAMAICA,Queens,16,84,77,37,178,49,0,0
WEDGEWOOD NURSING REHABILITATION CENTER,335408,5 CHURCH STREET,SPENCERPORT,Monroe,,,,,,,,
THE ELEANOR NURSING CARE CENTER,335323,419 NORTH QUAKER LANE,HYDE PARK,Dutchess,0,0,1,0,104,1,0,0
MERCY LIVING CENTER,335220,114 WAWBEEK AVE,TUPPER LAKE,Franklin,0,0,0,0,51,0,0,0
LEWIS COUNTY GENERAL HOSPITAL-NURSING HOME UNIT,335428,7785 NORTH STATE STREET,LOWVILLE,Lewis,0,0,4,0,137,4,4,0
SCHOELLKOPF HEALTH CENTER,335376,621 TENTH STREET,NIAGARA FALLS,Niagara,33,3,3,0,97,25,3,0
ELCOR NURSING  AND REHABILITATION CENTER,335053,48 COLONIAL DRIVE,HORSEHEADS,Chemung,0,0,4,0,293,1,3,0
WYOMING COUNTY COMMUNITY HOSPITAL S N F,335034,400 NORTH MAIN STREET,WARSAW,Wyoming,3,0,3,0,131,0,0,0
THE EMERALD PEEK REHABILITATION AND NURSING CENTER,335003,2000 EAST MAIN STREET,PEEKSKILL,Westchester,0,0,3,2,73,1,0,0
BETH ABRAHAM CENTER FOR REHABILITATION AND NURSING,335201,612 ALLERTON AVENUE,BRONX,Bronx,89,108,5,3,402,0,1,1
TARRYTOWN HALL CARE CENTER,335421,20 WOOD COURT,TARRYTOWN,Westchester,0,0,0,0,82,0,0,0
THE GRAND REHABILITATION AND NURSING AT BATAVIA,335202,257 STATE ST,BATAVIA,Genesee,0,0,2,0,61,0,0,0
SAN SIMEON BY THE SOUND CENTER FOR NURSING & REHAB,335274,61700 ROUTE 48 -  PO BOX 2122,GREENPORT,Suffolk,0,0,0,0,97,0,0,0
OCEANVIEW NURSING & REHABILITATION CARE CENTER,335168,315 BEACH 9TH STREET,FAR ROCKAWAY,Queens,,,,,,,,
SPRAIN BROOK MANOR REHAB,335320,77 JACKSON AVE,SCARSDALE,Westchester,4,16,5,5,72,0,0,0
MORRIS PARK REHABILITATION AND NURSING CENTER,335347,1235 PELHAM PARKWAY NORTH,BRONX,Bronx,7,9,4,3,149,4,0,0
UPPER EAST SIDE REHABILITATION AND NURSING CENTER,335232,211 EAST 79 ST,NEW YORK,New York,110,281,112,89,383,68,0,0
RESORT NURSING HOME,335199,430 BEACH 68TH STREET,ARVERNE,Queens,8,0,2,0,171,0,0,0
THE ENCLAVE AT PORT CHESTER REHAB AND NURSING CTR,335312,1000 HIGH ST,PORT CHESTER,Westchester,0,0,0,0,,0,0,0
SPRING CREEK REHABILITATION & NURSING CARE CENTER,335125,660 LOUISIANA AVE,BROOKLYN,Kings,18,4,4,2,144,0,2,0
JEWISH HOME OF ROCHESTER,335105,2021 WINTON ROAD SOUTH,ROCHESTER,Monroe,0,0,4,0,299,1,2,0
COLONIAL PARK REHABILITATION AND NURSING CENTER,335233,950 FLOYD AVENUE,ROME,Oneida,14,0,0,0,70,5,3,0
NEW PALTZ CENTER FOR REHABILITATION AND NURSING,335188,1 JANSEN ROAD PO BOX 909,NEW PALTZ,Ulster,0,0,0,0,76,1,2,0
COLER REHABILITATION AND NURSING CARE CENTER,335063,900 MAIN ST,ROOSEVELT ISLAND,New York,30,16,2,2,482,26,6,0
EGER HEALTH CARE AND REHABILITATION CENTER,335332,140 MEISNER AVENUE,STATEN ISLAND,Richmond,15,110,74,39,298,70,0,0
ELDERWOOD AT WAVERLY,335346,37 NORTH CHEMUNG STREET,WAVERLY,Tioga,,,,,,,,
MARTINE CENTER FOR REHABILITATION AND NURSING,335424,12 TIBBITS AVENUE,WHITE PLAINS,Westchester,8,3,3,0,172,1,1,1
WINDSOR PARK REHAB & NURSING CENTER,335155,212 40 HILLSIDE AVENUE,QUEENS VILLAGE,Queens,19,4,17,12,57,17,3,0
"CATON PARK REHAB AND NURSING CENTER, L L C",335245,1312 CATON AVENUE,BROOKLYN,Kings,1,0,5,2,81,0,2,0
REGEIS CARE CENTER,335019,3200 BAYCHESTER AVENUE,BRONX,Bronx,0,0,3,2,190,0,0,0
BRONX PARK REHABILITATION & NURSING CENTER,335358,3845 CARPENTER AVE,BRONX,Bronx,0,0,0,0,209,1,0,0
NEWARK MANOR NURSING HOME INC,335219,222 WEST PEARL STREET,NEWARK,Wayne,0,0,1,0,60,0,0,0
RENAISSANCE REHABILITATION AND NURSING CARE CENTER,335404,4975 ALBANY POST ROAD,STAATSBURG,Dutchess,0,0,0,0,114,0,0,0
MEDINA MEMORIAL HOSPITAL S N F,335313,200 OHIO STREET,MEDINA,Orleans,0,0,0,0,29,0,0,0
CORNING CENTER FOR REHABILITATION AND HEALTHCARE,335330,205 EAST FIRST STREET,CORNING,Steuben,0,0,0,0,106,0,3,0
VALLEY VIEW MANOR NURSING HOME,335208,40 PARK STREET,NORWICH,Chenango,,,,,,,,
SEA CREST NURSING AND REHABILITATION CENTER,335411,3035 WEST 24TH ST,BROOKLYN,Kings,52,146,93,61,235,22,69,0
JEWISH HOME OF CENTRAL NEW YORK,335190,4101 E GENESEE ST,SYRACUSE,Onondaga,24,28,7,7,105,20,3,0
"NEW CARLTON REHAB AND NURSING CENTER, L L C",335131,405 CARLTON AVE,BROOKLYN,Kings,4,0,3,2,116,0,0,0
FULTON CENTER FOR REHABILITATION AND HEALTHCARE,335091,847 COUNTY  HIGHWAY 122,GLOVERSVILLE,Fulton,73,17,16,16,150,19,9,1
LONG ISLAND CARE CENTER INC,335294,144-61 38TH AVE,FLUSHING,Queens,0,0,3,1,136,1,0,0
ST CATHERINE LABOURE HEALTH CARE CENTER,335419,2157 MAIN STREET,BUFFALO,Erie,12,0,2,4,66,7,0,0
SCHAFFER EXTENDED CARE CENTER,335337,16 GUION PLACE,NEW ROCHELLE,Westchester,25,0,1,0,127,4,0,0
HUMBOLDT HOUSE REHABILITATION AND NURSING CENTER,335164,64 HAGER STREET,BUFFALO,Erie,0,0,16,0,128,0,0,0
MERCY HOSPITAL SKILLED NURSING FACILITY,335308,55 MELROY AVENUE,LACKAWANNA,Erie,0,0,0,0,82,3,0,0
AUBURN REHABILITATION & NURSING CENTER,335004,85 THORNTON AVENUE,AUBURN,Cayuga,0,0,0,0,78,0,0,0
M M EWING CONTINUING CARE CENTER,335345,350 PARRISH STREET,CANANDAIGUA,Ontario,0,0,0,0,168,0,2,0
UNIVERSITY CENTER FOR REHABILITATION AND NURSING,335061,2505 GRAND AVE,BRONX,Bronx,0,0,1,1,43,0,0,0
"CLOVE LAKES HEALTH CARE AND REHAB CENTER, INC",335239,25 FANNING STREET,STATEN ISLAND,Richmond,78,50,39,75,337,122,21,0
ELM MANOR NURSING AND REHABILITATION CENTER,335255,210 N MAIN STREET,CANANDAIGUA,Ontario,,,,,,,,
OCEANSIDE CARE CENTER INC,335158,2914 LINCOLN AVENUE,OCEANSIDE,Nassau,1,1,4,3,69,1,2,0
THE PINES AT GLENS FALLS CTR FOR NURSING & REHAB,335325,170 WARREN STREET,GLENS FALLS,Warren,44,0,8,7,91,9,6,0
HERITAGE VILLAGE REHAB AND SKILLED NURSING INC.,335353,4570 ROUTE 60,GERRY,Chautauqua,0,0,0,0,119,0,0,0
BRIARCLIFF MANOR CENTER FOR REHAB AND NURSING CARE,335005,620 SLEEPY HOLLOW ROAD,BRIARCLIFF MANOR,Westchester,10,6,3,7,91,14,10,1
LORETTO HEALTH AND REHABILITATION CENTER,335136,700 EAST BRIGHTON AVENUE,SYRACUSE,Onondaga,37,0,2,0,535,10,0,0
THE GRAND REHABILITATION AND NURSING AT MOHAWK,335386,99 SIXTH AVENUE,ILION,Herkimer,0,0,0,0,104,0,0,0
"NEW GLEN OAKS NURSING HOME, INC",335299,260 01 79TH AVENUE,GLEN OAKS,Queens,8,14,1,0,40,2,0,0
"OASIS REHABILITATION AND NURSING, LLC",335402,6 FROWEIN ROAD,CENTER MORICHES,Suffolk,2,1,7,5,74,7,2,0
STEUBEN CENTER FOR REHABILITATION AND HEALTHCARE,335309,7009 RUMSEY STREET EXTENSION,BATH,Steuben,0,0,0,0,103,0,0,0
ROSS CENTER FOR NURSING AND REHABILITATION,335159,839 SUFFOLK AVENUE,BRENTWOOD,Suffolk,13,2,0,0,97,0,0,0
PALM GARDENS CENTER FOR NURSING AND REHABILITATION,335328,615 AVENUE C,BROOKLYN,Kings,50,25,24,9,229,7,21,0
MAYFAIR CARE CENTER,335279,100 BALDWIN ROAD,HEMPSTEAD,Nassau,7,29,44,16,147,40,0,1
BEECHTREE CENTER FOR REHABILITATION AND NURSING,335017,318 SOUTH ALBANY STREET,ITHACA,Tompkins,0,0,0,0,102,0,0,0
FOREST VIEW CENTER FOR REHABILITATION & NURSING,335310,71 20 110TH STREET,FOREST HILLS,Queens,0,0,2,1,128,1,0,0
SHAKER PLACE REHABILITATION AND NURSING CENTER,335425,780 ALBANY SHAKER ROAD,ALBANY,Albany,66,0,62,16,164,58,0,1
"NORTHERN RIVERVIEW HEALTH CARE, INC",335418,87 SOUTH ROUTE 9W,HAVERSTRAW,Rockland,14,3,10,6,154,0,0,0
VILLAGE CARE REHABILITATION AND NURSING CENTER,335027,214 W HOUSTON STREET,NEW YORK,New York,47,13,7,1,65,10,3,0
THE HURLBUT,335341,1177 EAST HENRIETTA RD,ROCHESTER,Monroe,1,0,5,2,76,1,0,0
PINE VALLEY CENTER FOR REHABILITATION AND NURSING,335285,661 N MAIN ST,SPRING VALLEY,Rockland,10,0,6,2,112,1,1,0
NEW RIVERDALE REHAB AND NURSING,335096,641 WEST 230TH ST,BRONX,Bronx,1,13,19,16,116,7,6,0
"SAFIRE REHABILITATION OF NORTHTOWNS, L L C",335180,2799 SHERIDAN DRIVE,TONAWANDA,Erie,34,0,3,2,59,6,0,0
WILLIAMSBRIDGE CENTER FOR REHABILITATION AND NRSG,335048,1540 TOMLINSON AVENUE,BRONX,Bronx,6,2,2,2,66,0,0,0
SAPPHIRE NURSING AT WAPPINGERS,335275,37 MESIER AVENUE,WAPPINGERS FALLS,Dutchess,0,22,0,0,60,0,3,0
"LAWRENCE NURSING CARE CENTER, INC",335415,350 BEACH 54TH STREET,ARVERNE,Queens,0,0,0,0,,0,0,0
PARKER JEWISH INSTITUTE FOR HEALTH CARE & REHAB,335132,271-11 76TH AVE,NEW HYDE PARK,Queens,24,4,13,9,358,20,39,0
ELIZABETH CHURCH MANOR NURSING HOME,335090,863 FRONT STREET,BINGHAMTON,Broome,0,0,40,0,100,0,0,0
PROMENADE REHABILITATION AND HEALTH CARE CENTER,335292,140 BEACH 114TH STREET,ROCKAWAY PARK,Queens,19,38,2,2,171,54,38,0
GLENS FALLS CENTER FOR REHABILITATION AND NURSING,335306,152 SHERMAN AVENUE,GLENS FALLS,Warren,4,1,12,12,82,1,0,0
BRIDGE VIEW NURSING HOME,335327,143 10 20TH AVE,WHITESTONE,Queens,0,0,1,0,165,1,0,0
MEADOW PARK REHABILITATION AND HEALTH CENTER L L C,335143,78-10 164TH STREET,FLUSHING,Queens,0,0,1,0,107,1,1,0
GRANVILLE CENTER FOR REHABILITATION AND NURSING,335331,17 MADISON STREET,GRANVILLE,Washington,0,0,2,0,120,0,0,0
CARING FAMILY NURSING AND REHABILITATION CENTER,335165,22-41 NEW HAVEN AVENUE,FAR ROCKAWAY,Queens,29,36,33,25,158,27,3,0
"THE NEW JEWISH HOME, SARAH NEUMAN",335296,845 PALMER AVENUE,MAMARONECK,Westchester,23,0,5,4,239,0,0,0
NORTH WESTCHESTER RESTORATIVE THERAPY & NRSG CRT,335342,3550 LEXINGTON AVENUE,MOHEGAN LAKE,Westchester,11,1,3,3,90,3,2,0
BRIDGEWATER CENTER FOR REHAB & NURSING L L C,335228,159 163 FRONT STREET - BOX 765,BINGHAMTON,Broome,1,0,0,0,341,0,0,0
SCHERVIER NURSING CARE CENTER,335015,2975 INDEPENDENCE AVE,BRONX,Bronx,81,22,2,1,293,21,77,0
PREMIER GENESEE CENTER FOR NRSG AND REHABILITATION,335423,278 BANK STREET,BATAVIA,Genesee,0,2,21,0,139,2,10,0
ELDERWOOD OF UIHLEIN AT LAKE PLACID,335267,185 OLD MILITARY ROAD,LAKE PLACID,Essex,1,0,2,0,94,0,0,0
"SUSQUEHANNA NURSING & REHABILITATION CENTER, L L C",335393,282 RIVERSIDE DR,JOHNSON CITY,Broome,42,0,12,11,111,13,1,0
SAPPHIRE CTR FOR REHAB & NRSG OF CTRL QUEENS,335133,35 15 PARSONS BLVD,FLUSHING,Queens,35,0,1,1,135,17,0,0
FORT TRYON CENTER FOR REHABILITATION AND NURSING,335257,801 W 190TH ST,NEW YORK,New York,0,1,0,0,186,0,0,0
FERNCLIFF NURSING HOME CO INC,335405,21 FERNCLIFF DRIVE,RHINEBECK,Dutchess,35,1,0,0,275,0,21,0
BROOKLYN CTR FOR REHAB AND RESIDENTIAL HEALTH CARE,335178,170 BUFFALO AVENUE,BROOKLYN,Kings,2,9,1,0,142,0,0,0
ELDERWOOD AT GRAND ISLAND,335391,2850 GRAND ISLAND BLVD,GRAND ISLAND,Erie,1,0,5,1,83,4,5,0
GREENFIELD HEALTH & REHAB CENTER,335182,5949 BROADWAY,LANCASTER,Erie,0,3,0,0,151,0,20,0
SCHULMAN AND SCHACHNE INST FOR NURSING & REHAB,335381,555 ROCKAWAY PARKWAY,BROOKLYN,Kings,2,1,2,2,335,0,0,0
SUNNYSIDE CARE CENTER,335409,7000 COLLAMER RD,EAST SYRACUSE,Onondaga,0,0,0,0,80,6,0,0
WATERVIEW HILLS REHABILITATION AND NURSING CENTER,335259,537 ROUTE 22,PURDY STATION,Westchester,33,0,8,5,92,10,0,0
CHASEHEALTH REHAB AND RESIDENTIAL CARE,335344,ONE TERRACE HEIGHTS,NEW BERLIN,Chenango,0,0,0,0,66,0,0,0
WORKMENS CIRCLE MULTICARE CENTER,335227,3155 GRACE AVENUE,BRONX,Bronx,29,131,110,61,493,57,50,1
CATSKILL REGIONAL MEDICAL CENTER,335639,68 BUSHVILLE ROAD,HARRIS,Sullivan,,,,,,,,
CENTRAL PARK REHABILITATION AND NURSING CENTER,335253,116 EAST CASTLE STREET,SYRACUSE,Onondaga,1,0,7,5,118,5,0,0
BELAIR CARE CENTER INC,335140,2478 JERUSALEM AVE,BELLMORE,Nassau,13,4,5,3,77,48,3,0
ACADIA CENTER FOR NURSING AND REHABILITATION,335254,1146 WOODCREST AVENUE,RIVERHEAD,Suffolk,51,0,19,14,94,16,0,0
FOREST HILLS CARE CENTER,335139,71 44 YELLOWSTONE BLVD,FOREST HILLS,Queens,0,0,2,1,76,1,0,0
THE PARAMOUNT AT SOMERS REHAB AND NURSING CENTER,335261,ROUTE 100,SOMERS,Westchester,38,4,10,6,261,2,2,0
WAYNE HEALTH CARE,335403,100 SUNSET DRIVE,NEWARK,Wayne,0,0,1,0,171,1,0,0
A HOLLY PATTERSON EXTENDED CARE FACILITY,335023,875 JERUSALEM AVENUE,UNIONDALE,Nassau,,,,,,,,
VAN RENSSELAER MANOR,335265,85 BLOOMINGROVE DRIVE,TROY,Rensselaer,1,21,46,0,341,3,104,0
THE WILLOWS AT RAMAPO REHAB AND NURSING CENTER,335148,30 CRAGMERE ROAD,SUFFERN,Rockland,8,1,4,1,134,1,0,0
ST PETERS NURSING AND REHABILITATION CENTER,335128,301 HACKETT BLVD,ALBANY,Albany,28,0,4,3,122,20,0,0
LIVINGSTON HILLS NURSING AND REHABILITATION CENTER,335389,"2781 ROUTE 9 , P O BOX 95",LIVINGSTON,Columbia,0,0,1,0,90,0,0,0
THE CITADEL REHAB AND NURSING CTR AT KINGSBRIDGE,335028,3400 -26  CANNON PLACE,BRONX,Bronx,,,,,,,,
PUTNAM NURSING & REHABILITATION CENTER,335229,404 LUDINGTONVILLE ROAD,HOLMES,Putnam,12,0,0,0,84,2,4,0
DRY HARBOR NURSING HOME,335416,61 35 DRY HARBOR ROAD,MIDDLE VILLAGE,Queens,1,4,8,6,278,13,0,0
CARILLON NURSING AND REHABILITATION CENTER,335286,830 PARK AVENUE,HUNTINGTON,Suffolk,119,157,58,50,230,43,63,0
PENINSULA NURSING AND REHABILITATION CENTER,335387,50 15 BEACH CHANNEL DRIVE,FAR ROCKAWAY,Queens,45,102,48,34,183,24,30,0
CHENANGO MEMORIAL HOSPITAL INC S N F,335355,179 NORTH BROAD STREET,NORWICH,Chenango,0,0,0,0,45,0,0,0
WELLS NURSING HOME INC,335314,201 W MADISON AVENUE,JOHNSTOWN,Fulton,0,0,0,0,76,0,0,0
BROOKSIDE MULTICARE NURSING CENTER,335175,7 ROUTE 25A,SMITHTOWN,Suffolk,10,0,3,2,314,3,0,0
THE WARTBURG HOME,335269,BRADLEY AVENUE,MOUNT VERNON,Westchester,0,0,1,0,123,0,0,1
CYPRESS GARDEN CENTER FOR NURSING AND REHAB,335446,139 66 35TH AVENUE,FLUSHING,Queens,0,4,4,2,190,13,1,0
"PARKVIEW CARE AND REHABILITATION CENTER, INC",335074,5353 MERRICK ROAD,MASSAPEQUA,Nassau,0,1,0,0,128,0,0,0
THE CHATEAU AT BROOKLYN REHAB AND NURSING CENTER,335290,3457 NOSTRAND AVENUE,BROOKLYN,Kings,5,3,5,3,137,3,0,0
THE GRAND REHABILITATION AND NURSING AT QUEENS,335130,157 15 19TH AVENUE,WHITESTONE,Queens,25,0,3,0,147,0,0,0
HENRY J CARTER SKILLED NURSING FACILITY,335092,1752 PARK AVE,MANHATTAN,New York,1,1,0,0,160,2,23,0
LACONIA NURSING HOME,335388,1050 EAST 230TH STREET,BRONX,Bronx,13,0,1,1,194,1,0,0
WILLOW POINT REHABILITATION AND NURSING CENTER,335291,3700 OLD VESTAL ROAD,VESTAL,Broome,15,18,9,1,274,7,7,0
THE PINES HEALTHCARE & REHAB CENTERS OLEAN CAMPUS,335357,2245 WEST STATE STREET,OLEAN,Cattaraugus,0,0,0,0,107,2,1,0
CHURCH HOME OF THE PROTESTANT EPISCOPAL CHURCH,335263,505 MT HOPE AVENUE,ROCHESTER,Monroe,0,0,0,0,,0,0,0
SOLDIERS AND SAILORS MEMORIAL HOSPITAL E C U,335289,418 NORTH MAIN STREET,PENN YAN,Yates,15,1,34,8,108,8,9,0
OXFORD NURSING HOME,335163,144 SO OXFORD ST,BROOKLYN,Kings,0,0,1,1,170,3,0,0
WATERVIEW NURSING CARE CENTER,335154,119 15 27TH AVENUE,FLUSHING,Queens,8,1,2,0,155,0,2,0
VESTAL PARK REHABILITATION AND NURSING CENTER,335226,"1501 ROUTE 26 SOUTH,",VESTAL,Broome,12,6,9,5,142,2,0,0
SURGE REHABILITATION AND NURSING LLC,335390,49 OAKCREST AVE,MIDDLE ISLAND,Suffolk,4,0,2,4,117,0,2,0
MOSHOLU PARKWAY NURSING & REHABILITATION CENTER,335030,3356 PERRY AVENUE,BRONX,Bronx,12,58,24,24,92,32,1,0
SANS SOUCI REHABILITATION AND NURSING CENTER,335398,115 PARK AVENUE,YONKERS,Westchester,0,0,1,1,91,16,0,0
CENTRAL ISLAND HEALTHCARE,335284,825 OLD COUNTRY RD,PLAINVIEW,Nassau,56,13,0,0,145,8,0,0
BEZALEL REHABILITATION AND NURSING CENTER,335666,29 38 FAR ROCKAWAY BLVD,FAR ROCKAWAY,Queens,0,0,1,1,98,0,0,0
HILL HAVEN NURSING HOME,335247,1550 EMPIRE BLVD,WEBSTER,Monroe,52,50,2,2,264,26,9,0
CLIFTON SPRINGS HOSPITAL AND CLINIC EXTENDED CARE,335361,2 COULTER ROAD,CLIFTON SPRINGS,Ontario,0,0,2,0,103,1,1,0
SILVER LAKE SPECIALIZED REHAB AND CARE CENTER,335196,275 CASTLETON AVENUE,STATEN ISLAND,Richmond,1,2,42,2,206,45,12,0
SCHUYLER HOSPITAL INC & LONG TERM CARE UNIT,335375,220 STEUBEN STREET,MONTOUR FALLS,Schuyler,0,0,0,0,114,5,0,0
"WOODCREST REHAB & RESIDENTIAL H C CENTER, L L C",335266,119 09 26TH AVENUE,FLUSHING,Queens,0,3,0,0,147,3,0,0
MASSAPEQUA CENTER REHABILITATION & NURSING,335213,101 LOUDEN AVE,AMITYVILLE,Suffolk,0,5,9,4,240,1,0,0
LYNBROOK RESTORATIVE THERAPY AND NURSING,335160,243 ATLANTIC AVENUE,LYNBROOK,Nassau,,,,,,,,
THE GRAND REHABILITATION AND NURSING AT SOUTH POIN,335162,ONE LONG BEACH ROAD,ISLAND PARK,Nassau,1,2,2,0,164,6,11,0
THE HERITAGE REHABILITATION AND HEALTH CARE CENTER,335104,5606 15TH AVE,BROOKLYN,Kings,12,1,9,3,65,8,1,0
NYACK RIDGE REHABILITATION AND NURSING CENTER,335365,476 CHRISTIAN HERALD ROAD,VALLEY COTTAGE,Rockland,7,0,1,0,118,0,0,0
PARK NURSING HOME,335093,128 BEACH 115TH STREET,ROCKAWAY PARK,Queens,0,8,1,0,157,0,1,0
HOLLIS PARK MANOR NURSING HOME,335333,191 06 HILLSIDE AVENUE,HOLLIS,Queens,16,18,22,18,61,7,7,0
RIVER VIEW REHABILITATION AND NURSING CARE CENTER,335103,510 FIFTH AVENUE,OWEGO,Tioga,0,0,3,0,68,0,0,0
NORTHERN MANOR GERIATRIC CENTER INC,335046,199 N MIDDLETOWN ROAD,NANUET,Rockland,8,16,10,3,203,0,0,0
CLIFFSIDE REHAB & RESIDENTIAL HEALTH CARE CENTER,335349,119 - 19 GRAHAM COURT,FLUSHING,Queens,0,0,1,1,170,0,0,0
OZANAM HALL OF QUEENS NURSING HOME INC,335363,42 41 201ST STREET,BAYSIDE,Queens,55,1,117,61,217,40,80,0
ROSA COPLON JEWISH HOME AND INFIRMARY,335176,2700 NORTH FOREST ROAD,GETZVILLE,Erie,23,0,46,11,129,7,1,0
HERITAGE PARK REHAB & SKILLED NURSING,335142,150 PRATHER AVENUE,JAMESTOWN,Chautauqua,0,0,0,0,133,0,0,0
PARK RIDGE NURSING HOME,335369,1555 LONG POND ROAD,ROCHESTER,Monroe,0,1,3,0,113,0,2,0
TROY CENTER FOR REHABILITATION AND NURSING,335280,49 MARVIN AVENUE,TROY,Rensselaer,0,0,0,0,77,0,0,0
HIGHLAND PARK REHABILITATION AND NURSING CENTER,335210,160 SENECA ST,WELLSVILLE,Allegany,0,0,4,0,74,0,3,0
ST PATRICKS HOME,335011,66 VAN CORTLANDT PARK SOUTH,BRONX,Bronx,0,0,0,0,166,1,0,0
NATHAN LITTAUER HOSPITAL NURSING HOME,335351,99 EAST STATE STREET,GLOVERSVILLE,Fulton,19,0,7,0,76,6,15,0
DUMONT CENTER FOR REHABILITATION AND NURSING CARE,335271,676 PELHAM ROAD,NEW ROCHELLE,Westchester,0,0,55,15,143,1,0,1
"NORTHERN DUTCHESS RES HEALTH CARE FACILITY, INC",335348,"6526 SPRINGBROOK, PO BOX 514",RHINEBECK,Dutchess,,,,,,,,
FIELDSTON LODGE CARE CENTER,335248,666 KAPPOCK STREET,RIVERDALE,Bronx,1,22,28,17,161,8,8,0
BROTHERS OF MERCY NURSING & REHABILITATION CENTER,335112,10570 BERGTOLD ROAD,CLARENCE,Erie,31,0,5,0,223,31,0,0
THE PINES AT UTICA CENTER FOR NURSING AND REHAB,335374,1800 BUTTERFIELD AVE,UTICA,Oneida,0,0,0,0,107,0,0,0
DALEVIEW CARE CENTER,335161,574 FULTON STREET,EAST FARMINGDALE,Nassau,13,0,3,1,101,1,0,0
MARY MANNING WALSH NURSING HOME CO INC,335050,1339 YORK AVENUE,NEW YORK,New York,95,1,91,40,269,38,23,0
CHESTNUT PARK REHABILITATION AND NURSING CENTER,335243,330 CHESTNUT STREET,ONEONTA,Otsego,0,0,0,0,71,0,0,0
ORCHARD REHABILITATION & NURSING CENTER,335397,600 BATES ROAD,MEDINA,Orleans,,,,,,,,
SHORE VIEW NURSING  & REHABILITATION CENTER,335288,2865 BRIGHTON 3RD STREET,BROOKLYN,Kings,112,147,79,60,250,31,111,0
HIGHFIELD GARDENS CARE CENTER OF GREAT NECK,335250,199 COMMUNITY DRIVE,GREAT NECK,Nassau,90,126,34,28,149,22,0,0
FINGER LAKES HEALTH,335098,196-198 NORTH STREET,GENEVA,Ontario,0,0,88,0,44,0,6,0
AURELIA OSBORN FOX MEMORIAL HOSPITAL,335204,ONE NORTON AVENUE,ONEONTA,Otsego,0,0,4,0,127,0,0,0
ST JOSEPH'S HOSPITAL - SKILLED NURSING FACILITY,335072,555 EAST MARKET STREET,ELMIRA,Chemung,0,4,3,0,79,0,0,0
CROUSE COMMUNITY CENTER INC,335068,101 SOUTH STREET,MORRISVILLE,Madison,0,0,0,0,109,0,0,0
MOUNTAINSIDE RESIDENTIAL CARE CENTER,335339,42158 STATE HIGHWAY 28,MARGARETVILLE,Delaware,,,,,,,,
"THE COTTAGES AT GARDEN GROVE, A SKILLED NRSG COMM",335340,5460 MELTZER COURT,CICERO,Onondaga,7,19,2,0,118,8,0,0
THE VALLEY VIEW CENTER FOR NURSING CARE AND REHAB,335238,GLENMERE COVE RD PO BOX 59,GOSHEN,Orange,118,0,67,48,278,66,3,0
NORTHWOODS REHAB AND NURSING CENTER AT MORAVIA,335077,PO BOX 1079,MORAVIA,Cayuga,0,0,2,0,35,0,0,0
ISABELLA GERIATRIC CENTER INC,335100,515 AUDUBON AVENUE,NEW YORK,New York,3,40,11,7,505,3,14,0
FAIRVIEW NURSING CARE CENTER INC,335146,69 70 GRAND CENTRAL PARKWAY,FOREST HILLS,Queens,0,0,5,0,191,21,0,0
ROSCOE REGIONAL REHAB & RESIDENTIAL H C F,335316,420 ROCKLAND ROAD,ROSCOE,Sullivan,0,0,1,0,75,0,0,0
BROOKLYN GARDENS NURSING & REHABILITATION CENTER,335070,835 HERKIMER STREET,BROOKLYN,Kings,0,0,3,0,198,1,0,0
EASTCHESTER REHABILITATION AND HEALTH CARE CENTER,335214,2700 EASTCHESTER ROAD,BRONX,Bronx,52,0,38,20,150,35,0,0
PARK GARDENS REHABILITATION & NURSING CENTER L L C,335287,6585 BROADWAY,RIVERDALE,Bronx,0,0,0,0,171,0,0,0
WOODSIDE MANOR NURSING HOME INC,335366,2425 CLINTON AVENUE SOUTH,ROCHESTER,Monroe,0,0,0,0,33,1,0,0
APEX REHABILITATION & CARE CENTER,335067,78 BIRCHWOOD DR,HUNTINGTON STATION,Suffolk,0,0,3,0,134,0,0,0
SUTTON PARK CENTER FOR NURSING AND REHABILITATION,335350,31 LOCKWOOD AVENUE,NEW ROCHELLE,Westchester,,,,,,,,
ST JOSEPHS HOME,335087,950 LINDEN STREET,OGDENSBURG,St. Lawrence,0,0,0,0,82,3,0,0
HUDSON VALLEY REHABILITATION & EXTENDED CARE CTR,335399,"260 VINEYARD AVE, RT 44/55",HIGHLAND,Ulster,4,10,17,1,163,4,9,0
CAYUGA NURSING AND REHABILITATION CENTER,335249,1229 TRUMANSBURG ROAD,ITHACA,Tompkins,0,0,0,0,105,0,0,0
COMPREHENSIVE REHAB & NURSING CTR AT WILLIAMSVILLE,335172,147 REIST STREET,WILLIAMSVILLE,Erie,0,0,0,0,128,14,0,0
EMERGE NURSING AND REHABILITATION AT GLEN COVE,335141,2 MEDICAL PLAZA,GLEN COVE,Nassau,0,0,1,1,67,2,0,0
FAR ROCKAWAY CENTER FOR REHABILITATION AND NURSING,335044,13 11 VIRGINA ST,FAR ROCKAWAY,Queens,0,0,0,0,90,0,0,0
AVON NURSING HOME L L C,335216,215 CLINTON STREET,AVON,Livingston,4,1,4,2,29,1,0,0
OAK HILL REHABILITATION AND NURSING CARE CENTER,335225,602 HUDSON ST,ITHACA,Tompkins,0,0,16,0,52,0,0,0
BERKSHIRE NURSING & REHABILITATION CENTER,335083,10 BERKSHIRE ROAD,WEST BABYLON,Suffolk,0,0,2,1,129,0,0,0
GLENGARIFF HEALTH CARE CENTER,335211,141 DOSORIS LANE,GLEN COVE,Nassau,7,0,1,1,187,1,0,0
YORKTOWN REHABILITATION & NURSING CENTER,335078,2300 CATHERINE STREET,CORTLANDT MANOR,Westchester,9,10,4,4,92,9,4,0
ROBINSON TERRACE,335236,28652 STATE HIGHWAY 23,STAMFORD,Delaware,,,,,,,,
