Provider Name,Federal Provider Number,Provider Address,Provider City,County,Residents Total Confirmed COVID-19,Residents Total Suspected COVID-19,Residents Total All Deaths,Residents Total COVID-19 Deaths,Total Number of Occupied Beds,Staff Total Confirmed COVID-19,Staff Total Suspected COVID-19,Staff Total COVID-19 Deaths
CONSULATE HEALTH CARE OF SAFETY HARBOR,105549,1410 DR MARTIN LUTHER KING JR ST N,SAFETY HARBOR,Pinellas,0,0,10,0,110,3,0,0
JUPITER MEDICAL CENTER PAVILION INC,105047,1230 SOUTH OLD DIXIE HWY,JUPITER,Palm Beach,0,0,0,0,12,0,0,0
PALMS CARE CENTER,105336,3370 NW 47TH TERRACE,LAUDERDALE LAKES,Broward,29,0,11,7,89,21,0,0
"MIAMI JEWISH HEALTH SYSTEMS, INC",105030,5200 NE 2ND AVENUE,MIAMI,Miami-Dade,57,46,18,10,368,52,84,0
BRISTOL AT TAMPA REHAB AND NURSING CENTER LLC,105140,1818 E FLETCHER AVE,TAMPA,Hillsborough,15,1,8,5,154,12,0,0
LEXINGTON HEALTH AND REHABILITATION CENTER,105072,6300 46TH AVE N,SAINT PETERSBURG,Pinellas,3,44,5,1,149,31,77,0
FAIRWAY OAKS CENTER,105305,13806 N 46TH ST,TAMPA,Hillsborough,1,0,9,0,98,4,0,0
CORAL GABLES NURSING AND REHABILITATION CENTER,105005,7060 SW 8TH STREET,MIAMI,Miami-Dade,20,20,4,3,67,22,3,0
"OAKS OF CLEARWATER, THE",105323,420 BAY AVE,CLEARWATER,Pinellas,1,0,14,0,47,0,0,0
SUNSET POINT,105373,1980 SUNSET POINT RD,CLEARWATER,Pinellas,31,16,9,3,92,18,11,0
FOUNTAIN MANOR HEALTH & REHABILITATION CENTER,105172,390 NE 135TH ST,NORTH MIAMI,Miami-Dade,40,1,10,5,116,46,0,0
SEASIDE HEALTH AND REHABILITATION CENTER,105052,324 WILDER BLVD,DAYTONA BEACH,Volusia,,,,,,,,
LIFE CARE CENTER OF PUNTA GORDA,105289,450 SHREVE STREET,PUNTA GORDA,Charlotte,19,21,45,3,121,8,8,0
SHORE ACRES CARE CENTER,105050,4500 INDIANAPOLIS ST NE,SAINT PETERSBURG,Pinellas,0,0,21,0,85,11,18,0
BAYVIEW CENTER,105324,301 S BAY ST,EUSTIS,Lake,19,12,3,2,72,12,9,0
DAYTONA BEACH HEALTH AND REHABILITATION CENTER,105311,1055 3RD STREET,DAYTONA BEACH,Volusia,3,20,17,0,125,5,9,0
COMMUNITY CONVALESCENT CENTER,105029,2202 W OAK AVE,PLANT CITY,Hillsborough,19,9,40,20,93,7,6,0
EMERALD SHORES HEALTH AND REHABILITATION,105148,626 N TYNDALL PKWY,CALLAWAY,Bay,0,0,5,0,74,2,0,0
EAGLE LAKE NURSING AND REHAB CARE CENTER,105292,1100 66TH ST N,SAINT PETERSBURG,Pinellas,2,4,0,0,46,3,2,0
EGRET COVE CENTER,105293,550 62ND ST S,SAINT PETERSBURG,Pinellas,15,2,2,1,87,14,6,0
LAKE EUSTIS HEALTH AND REHABILITATION CENTER,105001,411 W WOODWARD AVE,EUSTIS,Lake,0,0,0,0,82,5,2,0
BOCA CIEGA CENTER,105271,1414 59TH ST S,GULFPORT,Pinellas,30,16,7,6,79,12,3,0
AVANTE AT INVERNESS INC,105308,304 S CITRUS AVE,INVERNESS,Citrus,,,,,,,,
PINES NURSING HOME,105057,301 NE 141 STREET,MIAMI,Miami-Dade,7,1,1,0,41,1,0,0
JOHN KNOX VILLAGE OF POMPANO BEACH,105255,700 SW 4TH STREET,POMPANO BEACH,Broward,0,0,19,0,142,4,0,0
HUNTINGTON PLACE,105250,1775 HUNTINGTON LANE,ROCKLEDGE,Brevard,0,6,2,0,82,1,4,0
BROWARD NURSING & REHABILITATION CENTER,105083,1330 S ANDREWS AVE,FORT LAUDERDALE,Broward,1,0,3,0,128,13,0,0
"AVANTE AT LEESBURG, INC",105304,2000 EDGEWOOD AVE,LEESBURG,Lake,0,0,0,0,100,2,0,0
TARPON BAYOU CENTER,105280,515 CHESAPEAKE DR,TARPON SPRINGS,Pinellas,0,9,0,0,97,42,15,0
SIGNATURE HEALTHCARE OF JACKSONVILLE,105287,2061 HYDE PARK RD,JACKSONVILLE,Duval,91,0,24,24,96,43,26,0
TERRACES OF LAKE WORTH CARE CENTER,105125,1711 6TH AVENUE SOUTH,LAKE WORTH,Palm Beach,1,0,2,0,78,12,1,0
BAYSIDE HEALTH AND REHABILITATION CENTER,105267,4343 LANGLEY AVENUE,PENSACOLA,Escambia,50,12,15,15,89,12,0,0
OCALA HEALTH AND REHABILITATION CENTER,105321,1201 SE 24TH RD,OCALA,Marion,0,9,31,0,159,0,2,0
"CRESTVIEW REHABILITATION CENTER, LLC",105190,1849 FIRST AVENUE EAST,CRESTVIEW,Okaloosa,0,0,0,0,140,2,0,0
CROSS POINTE CARE CENTER,105296,440 PHIPPEN WAITERS ROAD,DANIA BEACH,Broward,0,0,0,0,87,4,0,0
ISLAND HEALTH AND REHABILITATION CENTER,105325,125 ALMA BLVD,MERRITT ISLAND,Brevard,0,0,11,0,94,11,0,0
RIVERWOOD CENTER,105135,2802 PARENTAL HOME ROAD,JACKSONVILLE,Duval,0,0,5,0,180,12,10,0
ABBEY DELRAY,105335,2105 SW 11TH COURT,DELRAY BEACH,Palm Beach,2,0,0,0,93,4,0,0
ARCH PLAZA NURSING & REHABILITATION CENTER,105008,12505 NE 16TH AVE,NORTH MIAMI,Miami-Dade,1,0,7,1,87,3,0,0
OAK HAVEN REHAB AND NURSING CENTER,105302,919 OLD WINTER HAVEN RD,AUBURNDALE,Polk,1,0,3,0,98,14,0,0
OAKS OF KISSIMMEE HEALTH AND REHABILITATION CENTER,105379,320 N MITCHELL ST,KISSIMMEE,Osceola,1,0,4,0,47,2,0,0
HERITAGE PARK HEALTH AND REHABILITATION CENTER,105320,37135 COLEMAN AVE,DADE CITY,Pasco,0,0,0,0,114,0,0,0
"TERRACE AT HOBE SOUND, THE",105300,9555 SE FEDERAL HWY,HOBE SOUND,Martin,9,0,0,0,113,31,0,0
EDEN SPRINGS NURSING AND REHAB CENTER,105282,4679 CRAWFORDVILLE HWY,CRAWFORDVILLE,Wakulla,1,7,26,0,94,7,1,0
UNIVERSITY EAST REHABILITATION CENTER,105262,991 E NEW YORK AVE,DELAND,Volusia,,,,,,,,
STUART REHABILITATION AND HEALTHCARE,105277,1500 SE PALM BEACH RD,STUART,Martin,0,0,8,0,71,9,3,0
MANOR OAKS NURSING & REHABILITATION CENTER,105205,2121 E COMMERCIAL BLVD,FORT LAUDERDALE,Broward,0,0,1,0,82,4,0,0
LAKESIDE OAKS CARE CENTER,105132,1061 VIRGINIA ST,DUNEDIN,Pinellas,0,0,0,0,89,4,0,0
"AVANTE AT MT DORA, INC",105333,3050 BROWN AVE,MOUNT DORA,Lake,0,0,5,0,97,4,0,0
W FRANK WELLS NURSING HOME,105210,210 N 2ND ST,MACCLENNY,Baker,1,11,12,1,45,0,20,0
FT LAUDERDALE HEALTH & REHABILITATION CENTER,105298,2000 EAST COMMERCIAL BLVD,FORT LAUDERDALE,Broward,30,36,3,1,130,27,3,0
EMERALD COAST CENTER,105265,114 THIRD STREET SE,FORT WALTON BEACH,Okaloosa,4,0,0,0,97,32,0,0
LAKELAND HILLS CENTER,105283,610 E BELLA VISTA DR,LAKELAND,Polk,48,36,37,36,86,19,14,0
SANDGATE GARDENS REHAB AND NURSING CENTER,105382,703 S 29TH ST,FORT PIERCE,St. Lucie,9,2,6,0,84,17,6,0
KENILWORTH CARE & REHABILITATION CENTER,105352,3011 KENILWORTH BLVD,SEBRING,Highlands,0,19,1,0,66,4,29,0
RIVER GARDEN HEBREW HOME FOR THE AGED,105016,11401 OLD SAINT AUGUSTINE RD,JACKSONVILLE,Duval,8,3,7,1,131,17,12,0
NORTH BEACH REHABILITATION CENTER,105217,2201 NE 170TH STREET,NORTH MIAMI BEACH,Miami-Dade,13,1,14,5,83,18,2,0
MORTON PLANT REHABILITATION CENTER,105128,400 CORBETT ST,BELLEAIR,Pinellas,3,2,2,0,65,1,5,0
VENTURA HEALTH AND REHABILITATION CENTER,105146,7900 VENTURE CENTER WAY,BOYNTON BEACH,Palm Beach,19,8,13,5,78,18,1,0
PARKVIEW REHABILITATION CENTER AT WINTER PARK,105307,2075 LOCH LOMOND DRIVE,WINTER PARK,Orange,9,0,13,2,75,11,1,0
PARKSIDE HEALTH AND REHABILITATION CENTER,105145,451 S AMELIA AVE,DELAND,Volusia,3,24,1,0,101,8,3,0
GOLFCREST HEALTHCARE CENTER,105009,600 NORTH 17TH AVE,HOLLYWOOD,Broward,17,0,4,2,47,12,0,0
"AVANTE AT ORMOND BEACH, INC",105310,170 N KINGS ROAD,ORMOND BEACH,Volusia,0,0,0,0,89,2,0,0
ADVENTHEALTH CARE CENTER APOPKA SOUTH,105353,3355 E SEMORAN BLVD,APOPKA,Seminole,6,4,0,0,174,14,9,0
"FORT WALTON REHABILITATION CENTER, LLC",105295,1 LBJ SR DRIVE,FORT WALTON BEACH,Okaloosa,2,0,5,2,100,2,0,0
NORTH REHABILITATION CENTER,105149,1301 16TH ST N,SAINT PETERSBURG,Pinellas,28,0,14,6,34,22,38,0
BROOKSVILLE HEALTHCARE CENTER,105297,1114 CHATMAN BLVD,BROOKSVILLE,Hernando,1,2,23,0,120,4,0,0
ST MARK VILLAGE,105378,2655 NEBRASKA AVE,PALM HARBOR,Pinellas,0,0,6,1,47,4,0,0
"ST CATHERINE LABOURE MANOR, INC",105358,1750 STOCKTON ST,JACKSONVILLE,Duval,12,3,21,0,177,9,0,0
UNIVERSITY WEST REHABILITATION CENTER,105261,545 WEST EUCLID AVENUE,DELAND,Volusia,0,0,0,0,46,0,0,0
BAYSIDE CARE CENTER,105071,811 JACKSON ST N,SAINT PETERSBURG,Pinellas,2,0,7,0,78,15,1,0
REHAB & HEALTHCARE CENTER OF CAPE CORAL,105342,2629 DEL PRADO BLVD,CAPE CORAL,Lee,14,86,2,1,95,17,18,0
LAURELLWOOD CARE CENTER,105228,3127 57TH AVE N,SAINT PETERSBURG,Pinellas,0,0,1,0,41,3,9,0
WEST BROWARD REHABILITATION AND HEALTHCARE,105237,7751 W BROWARD BLVD,PLANTATION,Broward,0,0,1,0,104,10,4,0
SEAVIEW NURSING AND REHABILITATION CENTER,105258,2401 NE 2ND STREET,POMPANO BEACH,Broward,0,0,0,0,76,1,0,0
LONGWOOD HEALTH AND REHABILITATION CENTER,105377,1520 S GRANT ST,LONGWOOD,Seminole,5,36,9,0,111,4,0,0
LAKELAND NURSING & REHABILITATION,105354,1919 LAKELAND HILLS BLVD,LAKELAND,Polk,0,0,14,0,139,1,0,0
VILLA MARIA NURSING CENTER,105232,1050 NE 125TH STREET,NORTH MIAMI,Miami-Dade,20,7,1,1,169,11,1,0
WHISPERING OAKS,105299,1514 E CHELSEA ST,TAMPA,Hillsborough,6,0,0,0,230,14,4,0
SUN TERRACE HEALTH CARE CENTER,105319,105 TRINITY LAKES DR,SUN CITY CENTER,Hillsborough,1,1,0,0,100,1,4,0
WILLOWBROOKE COURT AT ST ANDREWS,105355,6152 N VERDE TRAIL,BOCA RATON,Palm Beach,17,3,7,2,66,30,0,0
WINTER PARK CARE & REHABILITATION CENTER,105332,2970 SCARLETT RD,WINTER PARK,Orange,0,0,3,0,86,5,6,0
SIGNATURE HEALTHCARE OF PORT CHARLOTTE,105363,4033 BEAVER LANE,PORT CHARLOTTE,Charlotte,22,3,4,4,109,17,0,0
GREENBRIAR REHABILITATION AND NURSING CENTER,105159,210 21ST AVE W,BRADENTON,Manatee,0,0,2,0,69,3,3,0
SOUTH HERITAGE HEALTH & REHABILITATION CENTER,105117,718 LAKEVIEW AVE S,SAINT PETERSBURG,Pinellas,3,2,1,0,55,17,5,0
CASA MORA REHABILITATION AND EXTENDED CARE,105327,1902 59TH ST W,BRADENTON,Manatee,7,40,12,0,165,7,0,0
VALENCIA HILLS HEALTH AND REHABILITATION CENTER,105301,1350 SLEEPY HILL RD,LAKELAND,Polk,0,0,8,0,182,1,24,0
"OCEAN VIEW NURSING & REHABILITATION CENTER, LLC",105038,2810 SOUTH ATLANTIC AVENUE,NEW SMYRNA BEACH,Volusia,20,39,7,0,114,4,8,0
JACKSON MEMORIAL PERDUE MEDICAL CENTER,105252,19590 OLD CUTLER ROAD,CUTLER BAY,Miami-Dade,0,2,1,0,155,18,5,0
CLEARWATER CENTER,105274,1270 TURNER ST,CLEARWATER,Pinellas,0,1,0,0,100,2,7,0
HEALTH AND REHABILITATION CENTRE AT DOLPHINS VIEW,105012,1820 SHORE DR S,SOUTH PASADENA,Pinellas,10,3,5,5,40,11,3,0
SANDALWOOD REHABILITATION AND NURSING CENTER,105002,1001 S BEACH STREET,DAYTONA BEACH,Volusia,0,0,0,0,86,0,0,0
PLANTATION NURSING & REHABILITATION CENTER,105175,4250 NW 5TH ST,PLANTATION,Broward,0,0,0,0,77,3,0,0
"AVANTE AT LAKE WORTH, INC.",105372,2501 N A ST,LAKE WORTH,Palm Beach,0,0,2,4,97,9,0,0
SOUTHERN PINES HEALTHCARE CENTER,105275,6140 CONGRESS ST,NEW PORT RICHEY,Pasco,0,0,1,0,102,2,0,0
BOCA RATON REHABILITATION CENTER,105219,755 MEADOWS ROAD,BOCA RATON,Palm Beach,2,3,0,0,107,5,0,0
THE LODGE HEALTH AND REHABILITATION CENTER,105196,635 SE 17TH STREET,OCALA,Marion,1,0,0,0,91,3,0,0
APOLLO HEALTH AND REHABILITATION CENTER,105202,1000 24TH ST N,SAINT PETERSBURG,Pinellas,,,,,,,,
CALUSA HARBOUR,105384,2525 FIRST ST,FORT MYERS,Lee,2,0,0,0,44,8,0,0
PINES OF SARASOTA,105147,1501 N ORANGE AVE,SARASOTA,Sarasota,5,22,1,0,155,4,11,0
SOUTH CAMPUS CARE CENTER,105375,715 E DIXIE AVE,LEESBURG,Lake,11,2,0,0,95,20,0,0
HARDEE MANOR HEALTHCARE CENTER,105362,401 ORANGE PLACE,WAUCHULA,Hardee,6,2,14,4,56,8,2,0
MANOR PINES CONVALESCENT CENTER,105089,1701 NE 26TH ST,FORT LAUDERDALE,Broward,0,1,4,3,101,2,3,0
HEATHER HILL HEALTHCARE CENTER,105343,6630 KENTUCKY AVE,NEW PORT RICHEY,Pasco,0,0,27,0,81,3,28,0
FORT PIERCE HEALTH CARE,105257,611 S 13TH ST,FORT PIERCE,St. Lucie,7,0,3,0,140,2,2,0
MADISON POINTE CARE CENTER,105166,6020 INDIANA AVE,NEW PORT RICHEY,Pasco,2,0,0,0,93,2,2,0
"SANDS AT SOUTH BEACH CARE CENTER, THE",105229,42 COLLINS AVENUE,MIAMI BEACH,Miami-Dade,65,12,17,9,169,45,11,0
KRYSTAL BAY NURSING AND REHABILITATION,105120,16650 W DIXIE HWY,NORTH MIAMI BEACH,Miami-Dade,4,0,10,6,84,6,0,0
TAMARAC REHABILITATION AND HEALTH CENTER,105360,7901 NW 88TH AVENUE,TAMARAC,Broward,4,1,1,2,69,11,0,0
WEST MELBOURNE HEALTH & REHABILITATION CENTER,105376,2125 WEST NEW HAVEN AVE,WEST MELBOURNE,Brevard,1,15,22,0,141,4,1,0
MEDICANA NURSING AND REHAB CENTER,105259,1710 LAKE WORTH ROAD,LAKE WORTH,Palm Beach,13,0,14,8,81,7,0,0
HEALTHCARE CENTER OF JACKSONVILLE,105138,5377 MONCRIEF ROAD,JACKSONVILLE,Duval,7,2,6,0,118,17,4,0
HERITAGE HEALTHCARE & REHABILITATION CENTER,105178,777 9TH ST N,NAPLES,Collier,1,0,0,0,35,2,0,0
SIGNATURE HEALTHCARE OF ORANGE PARK,105381,2029 PROFESSIONAL CENTER DR,ORANGE PARK,Clay,27,28,3,3,69,37,16,0
"PALMS OF SEBRING, THE",105037,725 S PINE ST,SEBRING,Highlands,2,15,5,0,71,2,5,0
CRYSTAL RIVER HEALTH AND REHABILITATION CENTER,105317,136 NORTHEAST 12TH AVENUE,CRYSTAL RIVER,Citrus,0,2,23,0,131,0,7,0
BARTOW CENTER,105286,2055 E GEORGIA ST,BARTOW,Polk,10,22,5,0,107,22,14,0
AVALON HEALTHCARE CENTER,105346,1270 SW MAIN BLVD,LAKE CITY,Columbia,0,0,26,0,85,1,0,0
OAK MANOR HEALTHCARE & REHABILITATION CENTER,105248,3500 OAK MANOR LANE,LARGO,Pinellas,2,57,0,0,126,3,50,0
PARK MEADOWS HEALTH AND REHABILITATION CENTER,105193,3250 SW 41ST PLACE,GAINESVILLE,Alachua,0,0,24,0,131,0,0,0
BRADEN RIVER REHABILITATION CENTER LLC,105045,2010 MANATEE AVE E,BRADENTON,Manatee,5,0,4,0,115,8,0,0
ST JOHNS NURSING CENTER,105371,3075 NW 35TH AVE,LAUDERDALE LAKES,Broward,12,11,7,2,153,10,45,0
LIFE CARE CENTER OF MELBOURNE,105291,606 E SHERIDAN RD,MELBOURNE,Brevard,0,0,0,0,113,1,0,0
HEARTLAND HEALTH CARE CENTER OF SOUTH JACKSONVILLE,105366,3648 UNIVERSITY BLVD S,JACKSONVILLE,Duval,0,0,0,0,86,0,2,0
MAJESTIC OAKS,105374,901 VETERAN'S MEMORIAL PARKWAY,ORANGE CITY,Volusia,0,2,11,0,124,2,1,0
REHABILITATION AND HEALTHCARE CENTER OF TAMPA,105234,4411 N HABANA AVE,TAMPA,Hillsborough,14,4,9,4,139,10,2,0
BOULEVARD REHABILITATION CENTER,105067,2839 S SEACREST BLVD,BOYNTON BEACH,Palm Beach,3,0,16,3,124,14,0,0
AVENTURA REHAB AND NURSING CENTER,105331,1800 N E 168TH STREET,NORTH MIAMI BEACH,Miami-Dade,3,2,9,8,77,1,0,2
ROCKLEDGE HEALTH AND REHABILITATION CENTER,105251,587 BARTON BLVD,ROCKLEDGE,Brevard,11,5,8,2,92,23,4,0
SARASOTA HEALTH AND REHABILITATION CENTER,105155,1524 EAST AVENUE SOUTH,SARASOTA,Sarasota,15,39,10,3,101,24,8,0
GROVES CENTER,105269,512 S 11TH ST,LAKE WALES,Polk,0,0,0,0,112,1,0,0
CANTERBURY TOWERS INC,105326,3501 BAYSHORE BLVD,TAMPA,Hillsborough,0,1,0,0,30,0,7,0
CROSS TERRACE REHABILITATION CENTER,105350,1351 SAN CHRISTOPHER DR,DUNEDIN,Pinellas,7,0,0,0,68,6,0,0
ALLIANCE HEALTH AND REHABILITATION CENTER,105349,130 W ARMSTRONG AVENUE,DELAND,Volusia,0,0,7,0,60,7,2,0
PINECREST REHABILITATION CENTER,105153,13650 NE 3RD COURT,NORTH MIAMI,Miami-Dade,13,0,2,1,74,12,1,0
CONCORDIA VILLAGE OF TAMPA,105351,4100 E FLETCHER AVE,TAMPA,Hillsborough,4,2,17,0,139,2,6,0
LAKESIDE HEALTH CENTER,105268,2501 N AUSTRALIAN AVENUE,WEST PALM BEACH,Palm Beach,2,0,0,0,94,10,0,0
WINTER HAVEN HEALTH AND REHABILITATION CENTER,105176,202 AVE O NE,WINTER HAVEN,Polk,36,34,15,13,111,24,14,0
HERITAGE PARK REHABILITATION AND HEALTHCARE,105238,2826 CLEVELAND AVE,FORT MYERS,Lee,,,,,,,,
ST AUGUSTINE HEALTH AND REHABILITATION CENTER,105315,51 SUNRISE BLVD,SAINT AUGUSTINE,St. Johns,0,2,9,0,109,1,12,0
TALLAHASSEE MEMORIAL HOSPITAL EXTENDED CARE,105158,1609 MEDICAL DR,TALLAHASSEE,Leon,0,0,0,0,47,5,1,0
LIFE CARE CENTER OF ALTAMONTE SPRINGS,105365,989 ORIENTA AVE,ALTAMONTE SPRINGS,Seminole,48,39,4,3,189,23,16,0
SEVEN HILLS HEALTH & REHABILITATION CENTER,105364,3333 CAPITAL MEDICAL BLVD,TALLAHASSEE,Leon,0,2,6,0,129,4,9,0
SANTA ROSA CENTER FOR REHABILITATION AND HEALING,105328,5386 BROAD ST,MILTON,Santa Rosa,5,9,15,0,82,4,6,0
WILTON MANORS HEALTH & REHABILITATION CENTER,105119,2675 N ANDREWS AVE,WILTON MANORS,Broward,7,0,0,0,120,8,0,0
WAVE CREST HEALTH AND REHABILITATION CENTER,105207,1415 S HICKORY ST,MELBOURNE,Brevard,9,4,7,2,84,13,1,0
"REHABILITATION CENTER OF THE PALM BEACHES,THE",105039,301 NORTHPOINTE PARKWAY,WEST PALM BEACH,Palm Beach,2,2,3,1,101,11,0,0
PALM GARDEN OF WINTER HAVEN,105566,1120 CYPRESS GARDENS BLVD,WINTER HAVEN,Polk,8,0,21,6,89,6,1,0
GANDY CROSSING CARE CENTER,105491,4610 S MANHATTAN AVE,TAMPA,Hillsborough,1,2,2,0,146,16,12,0
HERITAGE HEALTHCARE CENTER AT TALLAHASSEE,105433,3101 GINGER DR,TALLAHASSEE,Leon,0,0,8,0,152,3,3,0
ALHAMBRA HEALTH AND REHABILITATION CENTER,105712,7501 38TH AVE N,SAINT PETERSBURG,Pinellas,0,0,4,0,55,2,0,0
BARTRAM CROSSING,105645,6209 BROOKS BARTRAM DRIVE,JACKSONVILLE,Duval,1,1,3,0,88,17,0,0
NSPIRE HEALTHCARE LAUDERHILL,105680,2599 NW 55TH AVE,LAUDERHILL,Broward,,,,,,,,
SOLARIS HEALTHCARE PARKWAY,105687,800 SE CENTRAL PKWY,STUART,Martin,8,0,29,2,149,16,0,0
SAVANNAH COVE,105886,1301 W MAITLAND BLVD,MAITLAND,Orange,3,0,1,0,30,5,0,0
ROYAL OAKS NURSING AND REHAB CENTER,105793,2225 KNOX MCRAE DR,TITUSVILLE,Brevard,0,0,1,0,103,1,0,0
CONSULATE HEALTH CARE OF WEST PALM BEACH,105492,1626 DAVIS RD,WEST PALM BEACH,Palm Beach,,,,,,,,
NORTHBROOK CENTER FOR REHABILITATION AND HEALING,105606,575 LAMAR AVE,BROOKSVILLE,Hernando,0,0,1,0,82,8,0,0
AYERS HEALTH AND REHABILITATION CENTER,105401,606 NE 7TH ST,TRENTON,Gilchrist,0,14,11,0,98,2,86,0
"WATERFORD, THE",105404,601 UNIVERSE BLVD,JUNO BEACH,Palm Beach,0,0,5,0,56,0,0,0
MACCLENNY NURSING AND REHAB CENTER,105737,755 S 5TH ST,MACCLENNY,Baker,2,2,14,0,80,3,0,0
SILVERCREST HEALTH AND REHABILITATION CENTER,105612,910 BROOKMEADE DRIVE,CRESTVIEW,Okaloosa,0,0,0,0,54,0,0,0
GLEN OAKS HEALTH AND REHABILITATION CENTER,105634,1100 N PINE ST,CLEARWATER,Pinellas,0,5,3,0,68,8,7,0
COVENANT VILLAGE CARE CENTER,105604,9211 W BROWARD BLVD,PLANTATION,Broward,0,1,2,0,49,4,1,0
OAKHURST CENTER,105465,1501 SE 24TH RD,OCALA,Marion,3,2,11,0,132,2,2,0
EDGEWOOD NURSING CENTER,105826,1771 EDGEWOOD AVE W,JACKSONVILLE,Duval,1,0,7,0,56,11,0,0
FOURAKER HILLS REHAB AND NURSING CENTER,105707,1650 FOURAKER RD,JACKSONVILLE,Duval,25,28,6,2,77,19,4,0
DARCY HALL OF LIFE CARE,105516,2170 PALM BEACH LAKES BLVD,WEST PALM BEACH,Palm Beach,42,3,14,2,165,46,2,0
"MIRACLE HILL NURSING & REHABILITATION CENTER, INC",105810,1329 ABRAHAM STREET,TALLAHASSEE,Leon,1,0,7,0,93,4,0,0
REGENTS PARK OF JACKSONVILLE,105533,8700 A C SKINNER PARKWAY,JACKSONVILLE,Duval,0,24,3,0,112,35,1,0
FORUM AT DEER CREEK,105691,3001 DEER CREEK COUNTRY CLUB,DEERFIELD BEACH,Broward,4,1,1,0,42,5,0,0
PARK SUMMIT AT CORAL SPRINGS,105503,8500 ROYAL PALM BLVD,CORAL SPRINGS,Broward,0,0,1,0,21,2,0,0
SOLARIS HEALTHCARE PLANT CITY,105515,701 N WILDER RD,PLANT CITY,Hillsborough,2,0,2,0,159,3,0,0
CARRINGTON PLACE OF ST PETE,105616,10501 ROOSEVELT BLVD N,SAINT PETERSBURG,Pinellas,,,,,,,,
CROSSWINDS HEALTH AND REHABILITATION CENTER,105824,13455 W US HWY 90,GREENVILLE,Madison,0,0,0,0,48,6,0,0
SUWANNEE VALLEY NURSING CENTER,105825,427 15TH AVENUE NORTHWEST,JASPER,Hamilton,0,0,0,0,60,1,0,0
HEARTLAND HEALTH CARE CENTER FORT MYERS,105723,1600 MATTHEW DRIVE,FORT MYERS,Lee,35,29,11,5,60,27,6,0
ORCHARD RIDGE,105438,4927 VOORHEES RD,NEW PORT RICHEY,Pasco,27,8,21,1,79,13,8,0
HARBOR BEACH NURSING AND REHABILITATION CENTER,105578,1615 MIAMI RD,FORT LAUDERDALE,Broward,0,0,0,0,48,3,0,0
NSPIRE HEALTHCARE MIAMI LAKES,105709,5725 NW 186 STREET,HIALEAH,Miami-Dade,,,,,,,,
CONSULATE HEALTH CARE OF NEW PORT RICHEY,105459,8417 OLD COUNTY RD 54,NEW PORT RICHEY,Pasco,0,0,30,0,115,32,7,0
SALERNO BAY HEALTH AND REHABILITATION CENTER,105509,4801 SE COVE RD,STUART,Martin,14,14,10,2,100,16,8,0
THE CEDAR AT MEASE LIFE,105732,910 NEW YORK AVE,DUNEDIN,Pinellas,0,0,6,0,49,4,3,0
PALM CITY NURSING & REHAB CENTER,105831,2505 SW MARTIN HWY,PALM CITY,Martin,22,3,7,1,81,20,3,0
PORT CHARLOTTE REHABILITATION CENTER,105524,25325 RAMPART BLVD,PORT CHARLOTTE,Charlotte,,,,,,,,
FLEET LANDING,105743,ONE FLEET LANDING BLVD,ATLANTIC BEACH,Duval,3,0,0,0,55,4,0,0
LAKEWOOD NURSING CENTER,105808,100 N LAKE ST,CRESCENT CITY,Putnam,6,4,0,0,71,17,14,0
AVANTE VILLA AT JACKSONVILLE BEACH INC,105617,1504 SEABREEZE AVE,JACKSONVILLE BEACH,Duval,0,0,0,0,120,3,0,0
CARLTON SHORES HEALTH AND REHABILITATION CENTER,105580,1350 S NOVA RD,DAYTONA BEACH,Volusia,0,0,3,0,109,3,0,0
"COURT AT PALM AIRE, THE",105627,2701 N COURSE DR,POMPANO BEACH,Broward,20,0,0,6,43,12,0,0
PALM GARDEN OF WEST PALM BEACH,105607,300 EXECUTIVE CENTER DRIVE,WEST PALM BEACH,Palm Beach,15,8,27,39,117,12,43,0
GRAND BOULEVARD HEALTH AND REHABILITATION CENTER,105601,138 SANDESTIN LANE,MIRAMAR BEACH,Walton,0,0,15,0,79,4,0,0
"TERRACE OF KISSIMMEE, THE",105839,221 PARK PLACE BLVD,KISSIMMEE,Osceola,1,0,4,0,112,7,1,0
CLEWISTON NURSING & REHABILITATION,105462,301 SOUTH GLORIA ST,CLEWISTON,Hendry,4,1,13,11,104,4,5,0
ROYAL CARE OF AVON PARK,105812,1213 W STRATFORD RD,AVON PARK,Highlands,0,0,1,0,86,0,0,0
HEALTHPARK CARE CENTER,105779,16131 ROSERUSH COURT,FORT MYERS,Lee,13,16,4,4,45,16,9,0
SPRINGWOOD CENTER,105407,4602 NORTHGATE COURT,SARASOTA,Sarasota,0,0,7,0,96,6,1,0
SIGNATURE HEALTHCARE CENTER OF WATERFORD,105554,8333 W OKEECHOBEE ROAD,HIALEAH GARDENS,Miami-Dade,61,3,41,22,146,65,13,0
STRATFORD COURT OF PALM HARBOR,105758,45 KATHERINE BLVD,PALM HARBOR,Pinellas,0,0,11,0,48,0,0,0
WESTMINSTER OAKS,105854,4449 MEANDERING WAY,TALLAHASSEE,Leon,3,3,6,0,102,5,11,0
CROSS CARE CENTER,105721,5888 BLANDING BLVD,JACKSONVILLE,Duval,0,0,0,0,98,3,3,0
PALM GARDEN OF CLEARWATER,105581,3480 MCMULLEN BOOTH RD,CLEARWATER,Pinellas,11,0,1,1,144,8,3,0
BAY TREE CENTER,105394,2600 HIGHLANDS BLVD N,PALM HARBOR,Pinellas,7,4,8,1,91,3,0,0
PALM GARDEN OF TAMPA,105591,3612 E 138TH AVE,TAMPA,Hillsborough,6,8,9,1,105,5,2,0
RULEME CENTER,105855,2810 RULEME ST,EUSTIS,Lake,2,6,0,0,94,4,7,0
"PONCE THERAPY CARE CENTER, THE",105468,1999 OLD MOULTRIE ROAD,SAINT AUGUSTINE,St. Johns,4,0,5,0,108,6,0,0
FLETCHER HEALTH AND REHABILITATION CENTER,105644,518 W FLETCHER AVE,TAMPA,Hillsborough,7,0,4,2,90,16,2,0
COQUINA CENTER,105589,170 N CENTER STREET,ORMOND BEACH,Volusia,3,0,8,6,60,3,2,0
EAST BAY REHABILITATION CENTER,105697,4470 E BAY DR,CLEARWATER,Pinellas,2,0,0,0,103,12,0,0
LEHIGH ACRES HEALTH AND REHABILITATION CENTER,105522,1550 LEE BOULEVARD,LEHIGH ACRES,Lee,42,34,16,8,107,54,66,0
SUNSET LAKE HEALTH AND REHABILITATION CENTER,105761,832 SUNSET LAKE BOULEVARD,VENICE,Sarasota,1,1,0,0,106,2,5,0
SAMANTHA WILSON CARE CENTER,105816,161A MARINE STREET,SAINT AUGUSTINE,St. Johns,0,0,0,0,104,5,14,0
GOLFVIEW HEALTHCARE CENTER,105409,3636 10TH AVE N,SAINT PETERSBURG,Pinellas,3,0,1,0,42,6,4,0
SAVANNAH COVE OF THE PALM BEACHES,105875,2090 N CONGRESS AVE,WEST PALM BEACH,Palm Beach,0,0,1,0,24,0,0,0
NSPIRE HEALTHCARE TAMARAC,105609,5901 NW 79TH AVENUE,TAMARAC,Broward,1,0,1,1,123,5,0,0
NORTHDALE REHABILITATION CENTER,105700,3030 BEARSS AVE,TAMPA,Hillsborough,2,0,9,0,100,8,0,0
ALPINE HEALTH AND REHABILITATION CENTER,105713,3456 21ST AVE S,SAINT PETERSBURG,Pinellas,0,2,0,0,54,9,22,0
OCOEE HEALTH CARE CENTER,105706,1556 MAGUIRE RD,OCOEE,Orange,9,12,3,2,88,4,13,0
CYPRESS COVE CARE CENTER,105437,700 SE 8TH AVE,CRYSTAL RIVER,Citrus,0,0,0,0,97,0,0,0
WILLISTON CARE CENTER,105467,300 NW 1ST AVE,WILLISTON,Levy,3,0,12,1,92,6,5,0
OASIS HEALTH AND REHABILITATION CENTER,105659,1201 12TH AVENUE SOUTH,LAKE WORTH,Palm Beach,0,0,9,4,80,7,0,0
EDWARD J HEALEY REHABILITATION AND NURSING CENTER,105838,5101 WEST BLUE HERON BLVD,RIVIERA BEACH,Palm Beach,0,3,0,0,112,25,10,0
"AVANTE AT BOCA RATON, INC.",105521,1130 NW 15TH STREET,BOCA RATON,Palm Beach,7,2,2,0,93,7,4,0
WESTMINSTER TOWERS,105757,70 WEST LUCERNE CIRCLE,ORLANDO,Orange,0,0,0,0,107,11,0,0
OAKS AT AVON,105780,1010 US 27 N,AVON PARK,Highlands,0,0,0,0,91,0,0,0
"MANOR AT CARPENTERS, THE",105660,1001 CARPENTERS WAY,LAKELAND,Polk,0,1,12,0,54,2,1,0
ROYAL PALM BEACH HEALTH AND REHABILITATION CENTER,105494,600 BUSINESS PARK WAY,ROYAL PALM BEACH,Palm Beach,3,15,8,0,100,21,2,0
WINTER GARDEN REHABILITATION AND NURSING CENTER,105518,12751 W COLONIAL DRIVE,WINTER GARDEN,Orange,6,3,3,1,78,2,0,0
CHAUTAUQUA REHABILITATION AND NURSING CENTER,105626,785 S 2ND STREET,DEFUNIAK SPRINGS,Walton,39,64,20,10,123,27,13,0
BON SECOURS MARIA MANOR NURSING CARE CENTER,105688,10300 4TH ST N,SAINT PETERSBURG,Pinellas,62,43,45,14,194,54,26,0
MOULTRIE CREEK NURSING AND REHAB CENTER,105548,200 MARINER HEALTH WAY,SAINT AUGUSTINE,St. Johns,0,0,0,0,97,5,0,0
WILLOWBROOKE COURT SKILLED CARE CENTER - EDGEWATER,105489,23305 BLUE WATER CIRCLE,BOCA RATON,Palm Beach,0,0,0,0,57,6,0,0
HABANA HEALTH CARE CENTER,105417,2916 HABANA WAY,TAMPA,Hillsborough,1,0,0,0,131,12,0,0
HEARTLAND HEALTH CARE & REHABILITATION CENTER,105842,5401 SAWYER RD,SARASOTA,Sarasota,0,3,6,0,86,6,4,0
HEALTH CENTER AT BRENTWOOD,105461,2333 N BRENTWOOD CIR,LECANTO,Citrus,0,0,9,0,104,0,0,0
CROSS LANDINGS HEALTH AND REHABILITATION CENTER,105802,1780 N JEFFERSON ST,MONTICELLO,Jefferson,0,0,2,0,27,1,0,0
BRIDGEVIEW CENTER,105402,350 S RIDGEWOOD AVENUE,ORMOND BEACH,Volusia,1,0,6,0,97,2,3,0
SPRINGS AT LAKE POINTE WOODS,105567,3280 LAKE POINTE BLVD,SARASOTA,Sarasota,8,0,12,0,80,5,0,0
PALM GARDEN OF PORT SAINT LUCIE,105600,1751 SE HILLMOOR DRIVE,PORT SAINT LUCIE,St. Lucie,3,0,0,0,97,3,0,0
CARROLLWOOD CARE CENTER,105553,15002 HUTCHINSON RD,TAMPA,Hillsborough,,,,,,,,
SPRINGTREE REHABILITATION & HEALTH CARE CENTER,105686,4251 SPRINGTREE DRIVE,SUNRISE,Broward,4,1,3,0,75,16,0,0
WESTCHESTER GARDENS HEALTH & REHABILITATION,105654,3301 N MCMULLEN BOOTH RD,CLEARWATER,Pinellas,0,3,7,0,107,0,2,0
PALM GARDEN OF OCALA,105562,2700 SW 34TH ST,OCALA,Marion,1,0,0,0,130,3,0,0
"NURSING CENTER AT FREEDOM VILLAGE, THE",105655,6410 21ST AVE W,BRADENTON,Manatee,2,19,21,0,62,9,1,0
MADISON HEALTH AND REHABILITATION CENTER,105807,2481 WEST US 90,MADISON,Madison,6,5,0,0,49,7,15,0
LIFE CARE CENTER OF HILLIARD,105756,3756 W THIRD ST,HILLIARD,Nassau,5,1,0,0,101,5,0,0
"CROSSROADS, THE",105777,206 W ORANGE ST,DAVENPORT,Polk,0,0,2,0,52,4,2,0
LIFE CARE CENTER OF WINTER HAVEN,105792,1510 CYPRESS GARDENS BLVD,WINTER HAVEN,Polk,0,0,8,0,148,5,1,0
SPRING LAKE REHABILITATION CENTER,105730,1540 6TH ST NW,WINTER HAVEN,Polk,0,0,0,0,121,36,0,0
PLANTATION BAY REHABILITATION CENTER,105888,4641 OLD CANOE CREEK ROAD,SAINT CLOUD,Osceola,0,2,16,0,111,8,8,0
CONSULATE HEALTH CARE OF VERO BEACH,105474,1310 37TH ST,VERO BEACH,Indian River,1,12,4,0,124,3,12,0
COASTAL HEALTH AND REHABILITATION CENTER,105565,820 N CLYDE MORRIS BLVD,DAYTONA BEACH,Volusia,1,0,4,0,103,7,3,0
SIGNATURE HEALTHCARE OF NORTH FLORIDA,105662,1083 SANDERS AVENUE,GRACEVILLE,Jackson,3,10,3,0,145,2,10,0
RIVERWOOD HEALTH & REHABILITATION CENTER,105488,808 S COLLEY RD,STARKE,Bradford,14,16,8,0,103,0,0,0
SINAI PLAZA NURSING & REHAB CENTER,105711,201 NE 112TH STREET,MIAMI,Miami-Dade,1,0,7,1,117,13,0,0
CYPRESS CARE CENTER,105649,490 S OLD WIRE RD,WILDWOOD,Sumter,2,0,4,0,160,9,1,0
CONSULATE HEALTH CARE OF LAKE PARKER,105693,2020 W LAKE PARKER DR,LAKELAND,Polk,0,0,5,0,104,2,0,0
CONSULATE HEALTH CARE OF BAYONET POINT,105786,8132 HUDSON AVENUE,HUDSON,Pasco,2,2,6,0,108,1,0,0
COUNTRYSIDE REHAB AND HEALTHCARE CENTER,105587,3825 COUNTRYSIDE BLVD N,PALM HARBOR,Pinellas,,,,,,,,
