SAINT JOSEPH VILLA,395278,110 WEST WISSAHICKON AVE,FLOURTOWN,Montgomery,14,15,7,4,83,10,17,0
MID-VALLEY HEALTH CARE CENTER,395644,81 STURGES ROAD,PECKVILLE,Lackawanna,1,0,5,0,32,2,4,0
WILLIAM PENN HEALTHCARE AND REHABILITATION CENTER,395335,163 SUMMIT DRIVE,LEWISTOWN,Mifflin,0,8,35,0,111,1,4,0
STATESMAN HEALTH & REHABILITATION CENTER,395259,2629 TRENTON ROAD,LEVITTOWN,Bucks,54,46,17,11,78,18,6,0
MILFORD HEALTHCARE AND REHABILITATION CENTER,395466,264 ROUTE 6 & 209,MILFORD,Pike,0,0,15,0,67,0,0,0
PHILADELPHIA NURSING HOME,395478,GIRARD AND CORINTHIAN AVE,PHILADELPHIA,Philadelphia,129,10,22,9,257,38,15,0
OAK HILL HEALTHCARE AND REHABILITATION CENTER,395646,827 GEORGES STATION ROAD,GREENSBURG,Westmoreland,5,0,9,0,39,7,0,0
KUTZTOWN MANOR,395680,120 TREXLER AVENUE,KUTZTOWN,Berks,44,0,23,15,97,7,2,0
PRESBYTERIAN HOMES-PRESBY,395530,220 NEWRY STREET,HOLLIDAYSBURG,Blair,15,14,13,1,56,15,10,0
CHANDLER HALL HEALTH SERVICES,395305,99 BARCLAY STREET,NEWTOWN,Bucks,12,3,21,2,39,10,1,0
HARBORVIEW REHABILITATION AND CARE CENTER AT LANSD,395256,25 WEST FIFTH STREET,LANSDALE,Montgomery,50,72,0,0,101,12,12,0
LAUREL LAKES REHABILITATION AND WELLNESS CENTER,395613,201 FRANKLIN FARM LANE,CHAMBERSBURG,Franklin,6,0,17,0,176,4,10,0
BRANDYWINE HALL,395740,800 WEST MINER STREET,WEST CHESTER,Chester,116,4,47,30,134,27,2,0
BETHANY VILLAGE RETIREMENT CENTER,395386,5225 WILSON LANE,MECHANICSBURG,Cumberland,0,0,65,0,69,13,0,0
MANORCARE HEALTH SERVICES-CARLISLE,395746,940 WALNUT BOTTOM ROAD,CARLISLE,Cumberland,19,63,19,4,124,6,30,0
WESLEY ENHANCED LIVING MAIN LINE REHAB AND SKD NSG,395498,100 HALCYON DRIVE,MEDIA,Delaware,23,0,10,10,50,16,0,0
SPIRITRUST LUTHERAN THE VILLAGE AT GETTYSBURG,395647,1075 OLD HARRISBURG ROAD,GETTYSBURG,Adams,1,0,5,0,44,6,5,0
GROVE MANOR,395510,435 NORTH BROAD STREET,GROVE CITY,Mercer,0,0,9,0,48,0,0,0
SILVER STREAM NURSING AND REHABILITATION CENTER,395354,905 PENLLYN PIKE,SPRING HOUSE,Montgomery,16,8,31,0,72,3,3,0
DEER MEADOWS REHABILITATION CENTER,395425,8301 ROOSEVELT BOULEVARD,PHILADELPHIA,Philadelphia,10,11,12,3,184,5,2,0
RICHLAND HEALTHCARE AND REHABILITATION CENTER,395610,349 VOTECH DRIVE,JOHNSTOWN,Cambria,1,46,24,0,73,6,15,0
FOREST CITY NURSING AND REHAB CENTER,395554,915 DELAWARE STREET,FOREST CITY,Susquehanna,17,6,16,7,77,7,14,0
DUNMORE HEALTH CARE CENTER,395567,1000 MILL STREET,DUNMORE,Lackawanna,6,1,5,0,74,1,3,0
BRADFORD MANOR,395700,50 LANG MAID LANE,BRADFORD,McKean,0,20,26,0,87,0,9,0
UNITED ZION RETIREMENT COMMUNI,395631,722 FURNACE HILL PIKE,LITITZ,Lancaster,32,13,50,19,57,29,24,0
GREENSBURG CARE CENTER,395604,119 INDUSTRIAL PARK ROAD,GREENSBURG,Westmoreland,,,,,,,,
"GARDENS AT WEST SHORE, THE",395223,770 POPLAR CHURCH ROAD,CAMP HILL,Cumberland,36,65,30,20,168,6,77,0
HOMELAND CENTER,395475,1901 NORTH FIFTH STREET,HARRISBURG,Dauphin,30,1,21,1,91,38,0,0
CALVARY FELLOWSHIP HOMES INC,395349,502 ELIZABETH DRIVE,LANCASTER,Lancaster,0,0,2,0,40,2,5,0
MANORCARE HEALTH SERVICES-YEADON,395374,LANSDOWNE AND LINCOLN AVE,YEADON,Delaware,12,22,13,10,135,10,13,0
BRIDGEVILLE REHABILITATION & CARE CENTER,395596,3590 WASHINGTON PIKE,BRIDGEVILLE,Allegheny,3,6,33,0,137,5,3,0
"GREEN HOME, INC, THE",395318,37 CENTRAL AVENUE,WELLSBORO,Tioga,0,19,26,0,99,2,5,0
HILLCREST CENTER,395481,1245 CHURCH ROAD,WYNCOTE,Montgomery,122,0,43,26,149,25,2,0
SWAIM HEALTH CENTER,395375,210 BIG SPRING ROAD,NEWVILLE,Cumberland,13,0,28,0,65,11,32,0
COLONIAL PARK CARE CENTER,395395,800 KING RUSS ROAD,HARRISBURG,Dauphin,26,3,113,6,158,9,2,0
"GARDENS AT STROUD, THE",395288,221 EAST BROWN STREET,EAST STROUDSBURG,Monroe,0,3,12,0,95,1,1,0
ROSEWOOD REHABILITATION & NURSING CENTER,395416,401 UNIVERSITY DRIVE,SCHUYLKILL HAVEN,Schuylkill,0,0,10,0,132,0,0,0
WAYNESBURG HEALTHCARE AND REHABILITATION CENTER,395675,300 CENTER AVENUE,WAYNESBURG,Greene,1,0,30,0,106,1,0,0
"GARDENS AT STEVENS, THE",395575,400 LANCASTER AVENUE,STEVENS,Lancaster,0,6,15,0,74,2,38,0
"PAVILION AT ST LUKE VILLAGE, THE",395265,1000 STACIE DRIVE,HAZLETON,Luzerne,2,0,35,0,90,6,0,0
EDISON MANOR NURSING & REHABILITATION CENTER,395536,222 WEST EDISON AVENUE,NEW CASTLE,Lawrence,0,1,26,0,89,1,1,0
"HOMESTEAD VILLAGE, INC",395720,1800 VILLAGE CIRCLE,LANCASTER,Lancaster,25,0,19,14,41,25,4,0
NORTHAMPTON COUNTY-GRACEDALE,395476,GRACEDALE AVENUE,NAZARETH,Northampton,114,98,115,43,535,17,20,0
TRANSITIONS HEALTHCARE NORTH HUNTINGDON,395585,8850 BARNES LAKE ROAD,NORTH HUNTINGDON,Westmoreland,0,0,9,0,104,0,0,0
ST MONICA CENTER FOR REHABILITATION & HEALTHCARE,395558,2509 SOUTH FOURTH STREET,PHILADELPHIA,Philadelphia,43,4,18,15,149,2,0,1
ELLEN MEMORIAL HEALTH CARE CENTER,395357,23 ELLEN MEMORIAL LANE,HONESDALE,Wayne,0,0,13,0,93,0,1,0
BROOKLINE MANOR AND REHABILITATIVE SERVICES,395418,2 MANOR BOULEVARD,MIFFLINTOWN,Juniata,6,0,33,0,70,0,0,0
JOHN J KANE REGIONAL CENTER-RO,395606,110 MCINTYRE ROAD,PITTSBURGH,Allegheny,2,46,35,0,129,6,79,0
ST IGNATIUS NURSING & REHAB CENTER,395686,4401 HAVERFORD AVENUE,PHILADELPHIA,Philadelphia,83,0,33,23,106,36,3,0
COLE PLACE,395228,1001 EAST SECOND STREET,COUDERSPORT,Potter,0,0,1,0,35,0,0,0
SPANG CREST MANOR,395365,945 DUKE STREET,LEBANON,Lebanon,2,40,145,0,96,7,13,0
CONCORDIA LUTHERAN HEALTH AND HUMAN CARE,395684,134 MARWOOD ROAD,CABOT,Butler,1,3,45,0,142,2,14,0
LANGHORNE GARDENS HEALTH & REHABILITATION CENTER,395521,350 MANOR AVENUE,LANGHORNE,Bucks,15,2,17,6,94,12,6,0
MEADOWS NURSING AND REHABILITATION CENTER,395587,4 EAST CENTER STREET,DALLAS,Luzerne,0,1,328,0,94,1,1,0
MANORCARE HEALTH SERVICES-BETHLEHEM (2021),395429,2021 WESTGATE DRIVE,BETHLEHEM,Lehigh,10,46,27,14,155,4,8,0
MANORCARE HEALTH SERVICES-WILLIAMSPORT NORTH,395364,300 LEADER DRIVE,WILLIAMSPORT,Lycoming,0,29,13,0,106,0,21,0
BARNES-KASSON COUNTY HOSPITAL,395285,2872 TURNPIKE STREET,SUSQUEHANNA,Susquehanna,36,17,20,12,41,21,3,0
BRADFORD COUNTY MANOR,395586,15900 ROUTE 6,TROY,Bradford,0,0,0,0,138,1,0,0
EPWORTH HEALTHCARE AND REHABILITATION CENTER,395393,951 WASHINGTON AVENUE,TYRONE,Blair,0,0,21,0,88,0,0,0
KADIMA REHABILITATION & NURSING AT LUZERNE,395484,463 NORTH HUNTER HWY,DRUMS,Luzerne,0,0,1,0,33,0,1,0
"GARDENS AT GETTYSBURG, THE",395247,741 CHAMBERSBURG ROAD,GETTYSBURG,Adams,0,3,10,0,89,0,6,0
HERMITAGE NURSING AND REHABILITATION,395231,500 CLARKSVILLE ROAD,HERMITAGE,Mercer,0,0,8,0,87,2,5,0
CARING HEIGHTS COMMUNITY CARE & REHAB CTR,395603,234 CORAOPOLIS ROAD,CORAOPOLIS,Allegheny,5,0,13,2,92,7,0,0
TRANSITIONS HEALTHCARE AUTUMN GROVE CARE CENTER,395248,555 SOUTH MAIN STREET,HARRISVILLE,Butler,0,0,0,0,89,0,0,0
HIGHLANDS HEALTHCARE AND REHABILITATION CENTER,395683,918 MAIN STREET,LAPORTE,Sullivan,0,0,15,0,104,0,0,0
ALLIED SERVICES MEADE STREET SKILLED NURSING,395324,200 S. MEADE STREET,WILKES BARRE,Luzerne,0,16,182,0,107,0,11,0
CRESTVIEW CENTER,395459,262 TOLL GATE ROAD,LANGHORNE,Bucks,113,8,46,24,130,38,6,0
ALLIED SERVICES CENTER CITY SKILLED NURSING,395581,80 E. NORTHAMPTON STREET,WILKES BARRE,Luzerne,0,2,9,0,41,0,1,0
"GROVE AT NORTH HUNTINGDON, THE",395382,249 MAUS DRIVE,NORTH HUNTINGDON,Westmoreland,2,10,7,0,110,1,0,0
SPIRITRUST LUTHERAN THE VILLAGE AT SPRENKLE DRIVE,395612,1801 FOLKEMER CIRCLE,YORK,York,0,7,14,0,81,7,25,0
"PARAMOUNT NURSING AND REHAB AT FAYETTEVILLE, LLC",395721,6375 CHAMBERSBURG ROAD,FAYETTEVILLE,Franklin,21,64,29,15,84,9,5,0
ELK HAVEN NURSING HOME,395341,785 JOHNSONBURG ROAD,SAINT MARYS,Elk,1,0,19,0,96,4,3,0
CEDARBROOK SENIOR CARE AND REHABILITATION,395465,350 S. CEDARBROOK ROAD,ALLENTOWN,Lehigh,288,120,123,105,502,161,14,0
BELLE HAVEN HEALTHCARE AND REHABILITATION CEN,395574,1320 MILL ROAD,QUAKERTOWN,Bucks,36,4,16,5,48,3,1,0
"BALL PAVILION, THE",395401,5416 EAST LAKE ROAD,ERIE,Erie,0,5,11,0,55,1,21,0
MT MACRINA MANOR,395629,520 WEST MAIN STREET,UNIONTOWN,Fayette,4,0,4,0,101,5,0,0
NURSING AND REHABILITATION AT THE MANSION,395482,1040-52 MARKET STREET,SUNBURY,Northumberland,0,2,28,0,65,3,5,0
POCOPSON HOME,395384,1695 LENAPE ROAD,WEST CHESTER,Chester,17,2,32,5,202,11,14,0
BROAD ACRES HEALTH AND REHAB,395352,1883 SHUMWAY HILL ROAD,WELLSBORO,Tioga,0,0,0,0,102,0,0,0
RYDAL PARK OF PHILADELPHIA PRS,395321,1515 FAIRWAY,RYDAL,Montgomery,35,37,38,14,80,30,6,0
WILLOWBROOKE CTSKDCARECTR AT FORTWASHINGTONESTATES,395496,735 SUSQUEHANNA ROAD,FORT WASHINGTON,Montgomery,5,0,3,0,38,0,0,0
MAYBROOK HILLS REHABILITATION AND HEALTHCARE CENTE,395514,301 VALLEY VIEW BOULEVARD,ALTOONA,Blair,0,0,22,0,194,6,0,0
EMBASSY OF PARK AVENUE,395588,14714 PARK AVE EXTENSION,MEADVILLE,Crawford,2,75,16,0,135,1,5,0
ELKINS CREST HEALTH & REHABILITATION CENTER,395711,265 E. TOWNSHIP LINE ROAD,ELKINS PARK,Montgomery,21,73,8,7,131,10,7,0
WYOMISSING HEALTH AND REHABILITATION CENTER,395237,1000 EAST WYOMISSING BLVD,READING,Berks,40,2,7,7,82,16,16,0
ASBURY HEALTH CENTER,395391,700 BOWER HILL ROAD,PITTSBURGH,Allegheny,17,10,0,0,117,14,7,0
"SPRINGS AT THE WATERMARK, THE",395662,2 FRANKLIN TOWN BLVD,PHILADELPHIA,Philadelphia,0,0,8,4,66,8,3,0
"PREMIER AT PERRY VILLAGE FOR NURSING AND REHAB, LL",395426,213 EAST MAIN STREET,NEW BLOOMFIELD,Perry,0,2,1,0,96,5,7,0
PINECREST MANOR,395279,763 JOHNSONBURG RD,ST MARYS,Elk,0,5,17,0,112,0,14,0
ATTLEBORO NURSING AND REHAB CE,395710,300 EAST WINCHESTER AVE,LANGHORNE,Bucks,60,93,32,10,118,42,55,1
ROLLING HILLS HEALTHCARE AND REHABILITATION CENTER,395614,17350 OLD TURNPIKE ROAD,MILLMONT,Union,0,1,14,0,53,0,0,0
EMBASSY OF WOODLAND PARK,395697,18889 CROGHAN PIKE,ORBISONIA,Huntingdon,0,11,16,0,123,3,2,0
HILLVIEW HEALTHCARE AND REHABILITATION CENTER,395241,700 S. CAYUGA AVENUE,ALTOONA,Blair,3,0,23,0,104,3,0,0
MANORCARE HEALTH SERVICES-DALLASTOWN,395451,100 WEST QUEEN STREET,DALLASTOWN,York,2,33,26,1,160,1,12,0
BERWICK HEALTH AND REHABILITATION,395421,801 EAST 16TH STREET,BERWICK,Columbia,,,,,,,,
CLARVIEW NURSING AND REHAB CEN,395458,14663 ROUTE 68,SLIGO,Clarion,2,0,20,0,73,10,4,0
TRANSITIONS HEALTHCARE WASHINGTON PA,395692,90 HUMBERT LANE,WASHINGTON,Washington,0,0,28,0,100,0,2,0
CARLETON HEALTHCARE AND REHABILITATION CENTER,395712,10 WEST AVENUE,WELLSBORO,Tioga,1,0,7,0,15,0,0,0
NEWPORT MEADOWS HEALTH AND REHABILITATION CENTER,395403,41 NEWPORT AVENUE,CHRISTIANA,Lancaster,24,1,14,4,100,2,15,0
"PHOENIX CENTER FOR REHABILITATION AND NURSING,THE",395284,833 SOUTH MAIN STREET,PHOENIXVILLE,Chester,57,16,21,11,83,22,1,0
"GARDENS FOR MEMORY CARE AT EASTON, THE",395708,500 WASHINGTON STREET,EASTON,Northampton,1,1,22,17,92,9,1,0
CROSSLANDS,395388,PO BOX 100 RT 926,KENNETT SQUARE,Chester,1,17,15,0,48,2,23,0
MEADOWVIEW REHABILITATION AND NURSING CENTER,395296,9209 RIDGE PIKE,WHITE MARSH,Philadelphia,57,5,63,14,224,52,0,0
"PLEASANT VALLEY MANOR, INC",395491,4227 MANOR DRIVE,STROUDSBURG,Monroe,3,0,9,5,93,1,1,0
LAUREL RIDGE CENTER,395243,75 HICKLE STREET,UNIONTOWN,Fayette,0,0,9,0,52,3,0,0
JOHN J KANE REGIONAL CENTER-GL,395643,955 RIVERMONT DRIVE,PITTSBURGH,Allegheny,83,72,64,21,156,58,51,0
PENNSBURG MANOR,395555,530 MACOBY STREET,PENNSBURG,Montgomery,39,3,29,11,89,27,2,0
WILLIAM HOOD DUNWOODY CARE CTR,395329,3500 WEST CHESTER PIKE,NEWTOWN SQUARE,Delaware,0,4,20,14,63,4,7,0
WESLEY  ENHANCED LIVING AT STAPELEY,395715,6300 GREENE STREET,PHILADELPHIA,Philadelphia,11,13,8,5,106,3,0,0
"PAVILION AT BRMC, THE",395355,200 PLEASANT STREET,BRADFORD,McKean,0,0,5,0,74,0,0,0
QUARRYVILLE PRESBYTERIAN RETIREMENT COMMUNITY,395336,625 ROBERT FULTON HIGHWAY,QUARRYVILLE,Lancaster,1,5,6,0,84,8,22,0
CHELTENHAM NURSING AND REHAB C,395330,600 W CHELTENHAM AVENUE,PHILADELPHIA,Montgomery,1,2,11,0,162,4,1,0
"GROVE AT HARMONY, THE",395758,191 EVERGREEN MILL ROAD,HARMONY,Butler,2,0,9,0,107,0,2,0
TEL HAI RETIREMENT COMMUNITY,395562,1200 TEL HAI CIRCLE,HONEY BROOK,Chester,2,0,14,0,109,7,28,0
BROOKMONT HEALTHCARE CENTER LLC,395462,510 BROOKMONT DRIVE,EFFORT,Monroe,51,49,29,6,81,22,10,0
SWEDEN VALLEY MANOR,395699,1028 EAST SECOND STREET,COUDERSPORT,Potter,0,3,3,0,100,0,14,0
GREENERY CENTER FOR REHAB AND NURSING,395695,2200 HILL CHURCH-HOUSTON ROAD,CANONSBURG,Washington,0,0,8,0,93,1,0,0
WEATHERWOOD HEALTHCARE AND REHABILITATION  CENTER,395464,1000 EVERGREEN AVENUE,WEATHERLY,Carbon,11,1,62,16,144,29,3,0
MESSIAH LIFEWAYS AT MESSIAH VILLAGE,395445,100 MOUNT ALLEN DRIVE,MECHANICSBURG,Cumberland,0,0,0,0,160,1,0,0
BROAD MOUNTAIN HEALTH AND REHABILITATION CENTER,395286,500 WEST LAUREL STREET,FRACKVILLE,Schuylkill,0,4,9,0,94,0,0,0
"WILLIAMSPORT HOME, THE",395678,1900 RAVINE ROAD,WILLIAMSPORT,Lycoming,0,1,14,0,124,0,13,0
PARKHOUSE REHABILITATION AND NURSING CENTER,395454,1600 BLACK ROCK ROAD,ROYERSFORD,Montgomery,113,24,110,52,257,46,10,0
SHENANDOAH MANOR NURSING CENTE,395556,101 E. WASHINGTON ST,SHENANDOAH,Schuylkill,34,0,43,5,92,17,1,0
MANORCARE HEALTH SERVICES - WALLINGFORD,395685,115 SOUTH PROVIDENCE ROAD,WALLINGFORD,Delaware,0,13,30,10,140,5,1,0
ELM TERRACE GARDENS,395507,660 NORTH BROAD STREET,LANSDALE,Montgomery,0,0,26,0,65,6,2,0
HAMPTON HOUSE,395249,1548 SANS SOUCI PARKWAY,WILKES BARRE,Luzerne,0,7,6,0,78,0,10,0
GETTYSBURG CENTER,395733,867 YORK ROAD,GETTYSBURG,Adams,0,2,21,0,98,2,0,0
"LAFAYETTE-REDEEMER, THE",395704,8580 VERREE ROAD,PHILADELPHIA,Philadelphia,79,46,36,25,60,73,22,0
LAUREL SQUARE HEALTHCARE AND REHABILITATION CENTER,395535,1020 OAK LANE AVENUE,PHILADELPHIA,Philadelphia,63,2,24,21,53,16,5,0
PROVIDENCE CARE CENTER,395682,900 THIRD AVE,BEAVER FALLS,Beaver,26,6,7,2,144,37,11,0
MORAVIAN MANOR,395325,300 WEST LEMON STREET,LITITZ,Lancaster,0,1,13,0,87,4,12,0
WESTMORELAND MANOR,395435,2480 SOUTH GRAND BLVD,GREENSBURG,Westmoreland,0,2,35,0,357,4,30,0
RIVERWOODS,395283,3201 RIVER ROAD,LEWISBURG,Union,0,5,2,0,120,2,46,0
PREMIER ARMSTRONG REHABILITATION AND NURSING FAC,395471,265 SOUTH MCKEAN STREET,KITTANNING,Armstrong,13,0,9,1,81,0,1,0
RIVERSIDE CARE CENTER,395719,100 EIGHTH AVENUE,MCKEESPORT,Allegheny,2,0,10,0,97,4,0,0
YORK NURSING AND REHABILITATION CENTER,395687,7101 OLD YORK ROAD,OAK LANE,Montgomery,7,16,16,4,165,2,0,0
UNIONTOWN HEALTHCARE AND REHABILITATION CENTER,395674,129 FRANKLIN AVENUE,UNIONTOWN,Fayette,2,48,33,0,103,9,5,0
HAMILTON ARMS CENTER,395224,336 SOUTH WEST END AVENUE,LANCASTER,Lancaster,58,4,37,28,63,33,1,0
WAYNE CENTER,395332,30 WEST AVENUE,WAYNE,Chester,64,0,45,17,76,12,2,0
TOWNE MANOR WEST,395346,205 EAST JOHNSON HIGHWAY,NORRISTOWN,Montgomery,35,70,16,13,65,10,12,0
KADIMA REHABILITATION & NURSING AT LITITZ,395590,125 SOUTH BROAD STREET,LITITZ,Lancaster,0,0,1,0,38,0,1,0
BEAVER VALLEY HEALTHCARE AND REHABILITATION CENTER,395266,257 GEORGETOWN ROAD,BEAVER FALLS,Beaver,0,0,36,0,99,12,0,0
EMBASSY OF HILLSDALE PARK,395569,383 MOUNTAIN VIEW DRIVE,HILLSDALE,Indiana,2,1,1,0,71,0,1,0
MT LEBANON REHABILITATION AND WELLNESS CENTER,395434,350 OLD GILKESON ROAD,PITTSBURGH,Allegheny,,,,,,,,
SMITH HEALTH CARE LTD,395716,453 SOUTH MAIN ROAD,MOUNTAIN TOP,Luzerne,0,1,21,0,30,1,2,0
DONAHOE MANOR,395221,136 DONAHOE MANOR ROAD,BEDFORD,Bedford,0,1,28,0,58,0,7,0
MORRISONS COVE HOME,395563,429 SOUTH MARKET STREET,MARTINSBURG,Blair,0,3,39,0,111,2,5,0
HOLY FAMILY MANOR,395250,1200 SPRING STREET,BETHLEHEM,Northampton,27,1,24,7,138,46,2,0
FRIENDSHIP VILLAGE OF SOUTH HI,395688,1290 BOYCE ROAD,PITTSBURGH,Allegheny,1,1,10,0,71,2,3,0
DOCK TERRACE,395557,275 DOCK DRIVE,LANSDALE,Montgomery,47,85,43,21,56,42,44,0
PLEASANT RIDGE MANOR EAST/WEST,395361,8300 WEST RIDGE ROAD,GIRARD,Erie,9,1,23,0,232,9,0,0
SOUTHMONT OF PRESBYTERIAN SENIORCARE,395671,835 SOUTH MAIN STREET,WASHINGTON,Washington,11,44,48,1,120,25,18,0
RIVER RUN HEALTHCARE AND REHABILITATION CENTER,395345,615 WYOMING AVENUE,KINGSTON,Luzerne,0,0,20,0,71,2,3,0
HAVENCREST HEALTHCARE AND REHABILITATION CENTER,395633,1277 COUNTRY CLUB ROAD,MONONGAHELA,Washington,0,0,13,0,40,0,0,0
MANORCARE HEALTH SERVICES-LEBANON,395472,900 TUCK STREET,LEBANON,Lebanon,50,39,24,9,115,15,21,0
RICHBORO REHABILITATION & NURSING CENTER,395217,253 TWINING FORD ROAD,RICHBORO,Bucks,45,6,30,10,59,18,4,0
"CHESWICK REHABILITATION AND WELLNESS CENTER, LLC",395538,3876 SAXONBURG BOULEVARD,CHESWICK,Allegheny,0,2,18,0,110,0,1,0
KINZUA HEALTHCARE AND REHABILITATION CENTER,395363,205 WATER STREET,WARREN,Warren,0,0,14,0,86,0,0,0
MORAVIAN HALL SQUARE HEALTH AND WELLNESS CENTER,395752,175 WEST NORTH STREET,NAZARETH,Northampton,0,1,27,0,55,6,2,0
REGINA COMMUNITY NURSING CENTE,395483,550 EAST FORNANCE STREET,NORRISTOWN,Montgomery,58,98,33,74,85,30,18,0
UPMC HERITAGE PLACE,395732,5701 PHILLIPS AVENUE,PITTSBURGH,Allegheny,0,4,13,0,104,1,10,0
SOUTHWESTERN NURSING CARE CENTER,395742,500 LEWIS RUN ROAD,PITTSBURGH,Allegheny,15,13,33,10,98,4,0,0
CLAREMONT NRC OF CUMBERLAND CO,395660,1000 CLAREMONT ROAD,CARLISLE,Cumberland,2,4,65,0,222,11,27,0
MANORCARE HEALTH SERVICES-CAMP HILL,395440,1700 MARKET STREET,CAMP HILL,Cumberland,0,28,10,0,106,0,25,0
HEMPFIELD MANOR,395705,1118 WOODWARD DRIVE,GREENSBURG,Westmoreland,1,24,13,0,112,0,103,0
MANORCARE HEALTH SERVICES-CHAMBERSBURG,395348,1070 STOUFFER AVENUE,CHAMBERSBURG,Franklin,44,33,21,14,138,9,38,0
CHAPEL MANOR,395449,1104 WELSH ROAD,PHILADELPHIA,Philadelphia,131,13,52,37,149,58,14,0
LACKAWANNA HEALTH AND REHAB CENTER,395414,108 TERRACE DRIVE,OLYPHANT,Lackawanna,1,33,20,0,169,0,4,0
MANORCARE HEALTH SERVICES-SHADYSIDE,395251,5609 FIFTH AVENUE,PITTSBURGH,Allegheny,48,62,19,13,92,21,22,0
OHESSON MANOR,395373,276 GREEN AVE EXTENDED,LEWISTOWN,Mifflin,0,3,14,0,125,0,0,0
KADIMA REHABILITATION & NURSING AT PALMYRA,395506,341 NORTH RAILROAD ST,PALMYRA,Lebanon,0,0,1,0,37,0,0,0
BRETHREN VILLAGE,395328,3001 LITITZ PIKE,LANCASTER,Lancaster,15,0,43,7,90,11,1,0
TREMONT HEALTH & REHABILITATION CENTER,395499,44 DONALDSON ROAD,TREMONT,Schuylkill,0,22,36,0,163,1,16,0
HICKORY HOUSE NURSING HOME,395436,3120 HORSESHOE PIKE,HONEY BROOK,Chester,23,20,31,8,75,16,19,1
SARAH A TODD MEMORIAL HOME,395677,1000 WEST SOUTH STREET,CARLISLE,Cumberland,66,14,169,22,85,35,4,0
"COMMUNITY AT ROCKHILL, THE",395497,3250 STATE ROAD,SELLERSVILLE,Bucks,5,8,26,2,49,4,16,0
WEXFORD HEALTHCARE CENTER,395300,9850 OLD PERRY HIGHWAY,WEXFORD,Allegheny,1,20,41,0,134,1,14,0
ABINGTON MANOR,395701,100 EDELLA ROAD,CLARKS SUMMIT,Lackawanna,1,11,25,0,100,3,13,0
PAPERMILL ROAD NURSING AND REHABILITATION CENTER,395545,850 PAPERMILL ROAD,GLENSIDE,Montgomery,63,0,20,19,73,16,0,0
"LECOM AT PRESQUE ISLE, INC",395404,4114 SCHAPER AVENUE,ERIE,Erie,9,0,26,4,117,0,1,0
SOUDERTON MENNONITE HOMES,395634,207 WEST SUMMIT AVENUE,SOUDERTON,Montgomery,0,23,11,0,64,3,227,0
MUNCY PLACE,395571,215 EAST WATER STREET,MUNCY,Lycoming,0,0,16,0,113,0,0,0
WESLEY VILLAGE,395602,209 ROBERTS ROAD,PITTSTON,Luzerne,0,9,26,0,164,0,10,0
ROUSE WARREN COUNTY HOME,395609,701 ROUSE AVENUE,YOUNGSVILLE,Warren,2,8,19,0,144,2,7,0
"LUTHERAN HOME AT JOHNSTOWN, THE",395439,807 GOUCHER STREET,JOHNSTOWN,Cambria,0,1,8,0,45,0,2,0
FELLOWSHIP MANOR,395763,3000 FELLOWSHIP DRIVE,WHITEHALL,Lehigh,25,0,45,7,120,12,6,0
ST FRANCIS CENTER FOR REHABILITATION & HEALTHCARE,395282,1412 LANSDOWNE AVENUE,DARBY,Delaware,48,8,19,4,168,1,1,0
FAIRVIEW MANOR,395572,900 MANCHESTER ROAD,FAIRVIEW,Erie,0,27,23,0,105,1,8,0
MEYERSDALE HEALTHCARE AND REHABILITATION CENTER,395661,201 HOSPITAL DRIVE,MEYERSDALE,Somerset,0,0,24,0,59,1,0,0
MANORCARE HEALTH SERVICES-ALLENTOWN,395760,1265 SOUTH CEDAR CREST BLVD,ALLENTOWN,Lehigh,10,4,15,7,113,8,12,0
MANORCARE HEALTH SERVICES-WEST READING NORTH,395351,425 BUTTONWOOD STREET,WEST READING,Berks,0,2,6,0,139,1,21,0
HOSPITALITY CARE CENTER OF HER,395232,3726 EAST STATE STREET,HERMITAGE,Mercer,0,1,1,0,25,0,0,0
BRIARLEAF NURSING AND CONVAL C,395409,252 BELMONT AVENUE,DOYLESTOWN,Bucks,95,3,62,20,132,11,0,0
"GARDENS AT TUNKHANNOCK, THE",395433,30 VIRGINIA DRIVE,TUNKHANNOCK,Wyoming,0,3,1799,0,102,1,13,0
IMMACULATEMARYCENTER FOR REHABILITATION&HEALTHCARE,395338,2990 HOLME AVENUE,PHILADELPHIA,Philadelphia,134,87,69,33,208,24,31,1
PICKERING MANOR HOME,395597,226 NORTH LINCOLN AVE,NEWTOWN,Bucks,0,0,0,0,31,2,0,0
MANORCARE HEALTH SERVICES-POTTSVILLE,395344,420 PULASKI DRIVE,POTTSVILLE,Schuylkill,73,27,24,15,90,26,30,0
QUALITY LIFE SERVICES - APOLLO,395371,151 GOODVIEW DRIVE,APOLLO,Westmoreland,2,4,3,0,129,5,14,0
FULTON COUNTY MEDICAL CENTER,395387,214 PEACH ORCHARD ROAD,MCCONNELLSBURG,Fulton,,,,,,,,
HOPKINS CENTER,395342,8100 WASHINGTON LANE,WYNCOTE,Montgomery,47,6,21,10,88,15,3,0
MANORCARE HEALTH SERVICES-JERSEY SHORE,395359,1008 THOMPSON STREET,JERSEY SHORE,Lycoming,46,11,31,23,78,13,19,0
SHIPPENVILLE HEALTHCARE AND REHABILITATION CENTER,395607,21158 PAINT BOULEVARD,SHIPPENVILLE,Clarion,0,1,24,0,70,0,3,0
MANORCARE HEALTH SERVICES-YORK NORTH,395442,1770 BARLEY ROAD,YORK,York,78,120,51,18,104,46,28,0
MILTON REHABILITATION AND NURSING CENTER,395570,743 MAHONING STREET,MILTON,Northumberland,98,152,63,29,45,56,129,0
MANORCARE HEALTH SERVICES-SUNBURY,395512,901 COURT STREET,SUNBURY,Northumberland,58,10,33,7,85,23,17,0
PENNSWOOD VILLAGE,395473,ROUTE 413,NEWTOWN,Bucks,1,11,17,0,34,7,16,0
HIGHLAND VIEW HEALTHCARE AND REHABILITATION CENTER,395877,90 MAIN STREET,BROCKWAY,Jefferson,4,3,7,0,38,9,0,0
SAINT JOHN XXIII HOME,395794,2250 SHENANGO FREEWAY,HERMITAGE,Mercer,0,3,36,0,62,26,0,0
CONTINUING CARE  AT MARIS GROVE,396123,500 MARIS GROVE WAY,GLEN MILLS,Delaware,14,9,50,6,53,13,28,0
FAIRVIEW NURSING AND REHABILITATION CENTER,395782,184 BETHLEHEM PIKE,PHILADELPHIA,Philadelphia,5,1,55,28,136,13,0,0
CLEPPER MANOR,396071,959 EAST STATE STREET,SHARON,Mercer,0,0,50,0,46,0,0,0
VALLEY VIEW REHAB AND NURSING CENTER,395895,2140 WARRENSVILLE ROAD,MONTOURSVILLE,Lycoming,0,3,3,0,135,9,7,0
MANORCARE HEALTH SERVICES-MONROEVILLE,396003,885 MACBETH DRIVE,MONROEVILLE,Allegheny,1,47,8,0,102,1,13,0
PENNWOOD NURSING AND REHABILITATION CENTER LLC,395883,909 WEST STREET,PITTSBURGH,Allegheny,3,0,2,1,77,4,0,0
MON VALLEY CARE CENTER,396085,200 STOOPS DRIVE,MONONGAHELA,Washington,0,0,3,0,54,0,0,0
ARBUTUS PARK MANOR,396069,207 OTTAWA STREET,JOHNSTOWN,Cambria,0,0,16,0,111,0,17,0
HOMEWOOD AT MARTINSBURG PA INC,395896,437 GIVLER DRIVE,MARTINSBURG,Blair,0,2,0,0,121,0,0,0
HCC AT WHITE HORSE VILLAGE,395833,535 GRADYVILLE ROAD,NEWTOWN SQUARE,Delaware,15,3,8,3,41,23,6,0
KIRKLAND VILLAGE,395916,2335 MADISON AVENUE,BETHLEHEM,Northampton,37,7,24,10,37,32,0,0
ELIZABETHTOWN HEALTHCARE AND REHAB CENTER,395844,141 HEISEY AVENUE,ELIZABETHTOWN,Lancaster,43,0,14,7,43,8,2,0
BALA NURSING AND RETIREMENT CE,396076,4001 FORD ROAD,PHILADELPHIA,Philadelphia,104,0,34,25,122,39,0,0
WATSONTOWN REHABILITATION AND NURSING CENTER,395825,245 EAST EIGHTH STREET,WATSONTOWN,Northumberland,1,13,23,0,108,0,5,0
STONEBRIDGE HEALTH & REHABILITATION CENTER,395785,102 CHANDRA DRIVE,DUNCANNON,Perry,0,2,9,0,56,0,2,0
CRAWFORD COUNTY CARE CENTER,395853,20881 STATE HIGHWAY 198,SAEGERTOWN,Crawford,0,0,0,0,124,1,9,0
CONCORDIA AT REBECCA RESIDENCE,396067,3746 CEDAR RIDGE ROAD,ALLISON PARK,Allegheny,0,0,26,0,55,0,0,0
THE PINES AT PHILADELPHIA REHAB AND HEALTHCARE CTR,396070,8410 ROOSEVELT BLVD,PHILADELPHIA,Philadelphia,25,14,5,3,33,8,12,0
ATHENS HEALTH AND REHABILITATION CENTER,396137,200 SOUTH MAIN ST,ATHENS,Bradford,0,0,0,0,63,0,0,0
MARGARET E. MOUL HOME,396064,2050 BARLEY ROAD,YORK,York,0,0,3,0,80,2,0,0
OLD ORCHARD HEALTH CARE CENTER,396077,4100 FREEMANSBURG AVENUE,EASTON,Northampton,23,14,33,13,114,4,12,0
SUNNYVIEW NURSING AND REHABILITATION CENTER,395788,107 SUNNYVIEW CIRCLE,BUTLER,Butler,1,11,6,0,208,0,6,0
CENTENNIAL HEALTHCARE AND REHABILITATION CENTER,395950,4400 WEST GIRARD AVENUE,PHILADELPHIA,Philadelphia,1,2,4,0,144,2,1,0
POWERBACK REHABILITATION 3485 DAVISVILLE ROAD,396017,3485 DAVISVILLE ROAD,HATBORO,Montgomery,5,4,15,1,80,5,7,0
MANORCARE HEALTH SERVICES-NORTH HILLS,395826,1105 PERRY HIGHWAY,PITTSBURGH,Allegheny,110,34,38,24,110,48,37,0
KINGSTON HEALTH CARE CENTER,395905,702 THIRD AVENUE,KINGSTON,Luzerne,0,17,5,0,55,0,4,0
THORNWALD HOME,395802,442 WALNUT BOTTOM ROAD,CARLISLE,Cumberland,1,0,15,0,74,1,1,0
MERCY CENTER NURSING UNIT INC,395850,"P O BOX 370, LAKE STREET",DALLAS,Luzerne,0,0,10,0,53,0,0,0
LOYALHANNA CARE CENTER,395860,535 MCFARLAND ROAD,LATROBE,Westmoreland,,,,,,,,
VIBRA REHABILITATION CENTER,396133,707 SHEPERDSTOWN RD,MECHANICSBURG,Cumberland,1,0,0,0,28,9,0,0
NORTH HILLS HEALTH AND REHABILITATION CENTER,395903,194 SWINDERMAN ROAD,WEXFORD,Allegheny,0,0,9,0,50,0,0,0
HARMAR VILLAGE CARE CENTER,396048,715 FREEPORT ROAD,CHESWICK,Allegheny,8,18,29,0,109,15,31,0
HIGHLANDS AT WYOMISSING,395800,2000 CAMBRIDGE AVENUE,WYOMISSING,Berks,21,44,43,11,46,24,3,0
HOLLIDAYSBURG VETERANS HOME,39A437,PO BOX 319,HOLLIDAYSBURG,Blair,2,62,8,0,201,0,215,0
SCRANTON HEALTH CARE CENTER,396095,2933 MCCARTHY STREET,SCRANTON,Lackawanna,3,0,5,0,40,0,0,0
"CHURCH OF GOD HOME, INC",395784,801 N. HANOVER STREET,CARLISLE,Cumberland,0,0,121,0,99,1,3,0
JAMESON CARE CENTER,396049,3349 WILMINGTON ROAD,NEW CASTLE,Lawrence,0,0,0,0,70,0,0,0
ANN'S CHOICE,396107,16000 ANN'S CHOICE WAY,WARMINSTER,Bucks,2,1,13,0,65,2,21,0
ROSE VIEW NURSING AND REHABILITATION CENTER,395767,1201 RURAL AVENUE,WILLIAMSPORT,Lycoming,0,25,9,0,108,0,16,0
MARIAN MANOR CORPORATION,395765,2695 WINCHESTER DRIVE,PITTSBURGH,Allegheny,17,0,40,3,67,7,11,0
WAYNE WOODLANDS MANOR,395936,37 WOODLANDS DRIVE,WAYMART,Wayne,0,0,163,0,77,0,0,0
STERLING HEALTH CARE AND REHAB CENTER,396083,318 SOUTH ORANGE STREET,MEDIA,Delaware,0,0,14,11,114,13,2,0
LEBANON VALLEY HOME THE,395832,550 EAST MAIN STREET,ANNVILLE,Lebanon,0,0,6,0,52,0,0,0
WESTMINSTER WOODS AT HUNTINGDO,396015,360 WESTMINSTER DRIVE,HUNTINGDON,Huntingdon,7,1,0,0,52,12,6,0
SUGAR CREEK STATION SKILLED NURSING AND REHABILITA,395777,351 CAUSEWAY DRIVE,FRANKLIN,Venango,0,1,9,0,105,0,1,0
POWERBACK REHABILITATION  EXTON,396144,501 THOMAS JONES WAY,EXTON,Chester,20,14,19,4,96,83,28,0
SAINT MARY'S AT ASBURY RIDGE,396081,4855 WEST RIDGE ROAD,ERIE,Erie,0,1,33,0,68,0,1,0
HOMEWOOD AT PLUM CREEK,395898,425 WESTMINSTER AVENUE,HANOVER,York,1,23,20,1,104,2,60,0
ST MARTHA CENTER FOR REHABILITATION & HEALTHCARE,395815,470 MANOR AVE,DOWNINGTOWN,Chester,19,16,4,2,195,9,5,0
HEINZ TRANSITIONAL REHABILITATION UNIT,396109,150 MUNDY STREET,WILKES-BARRE,Luzerne,2,3,3,0,21,4,5,0
NORRITON SQUARE NURSING AND REHABILITATION CENTER,396009,1700 PINE STREET,NORRISTOWN,Montgomery,3,2,11,1,85,4,1,0
