SCHENECTADY CENTER FOR REHABILITATION AND NURSING,335014,526 ALTAMONT AVE,SCHENECTADY,Schenectady,0,0,13,0,232,2,0,0
ABSOLUT CTR FOR NURSING & REHAB AURORA PARK L L C,335281,292 MAIN STREET,EAST AURORA,Erie,142,3,83,56,220,46,6,0
"NEW VANDERBILT REHABILITATION AND CARE CENTER, INC",335372,135 VANDERBILT AVE,STATEN ISLAND,Richmond,4,0,6,2,227,16,0,0
ONEIDA HEALTH REHABILITATION AND EXTENDED CARE,335427,323 GENESEE STREET,ONEIDA,Madison,,,,,,,,
WESLEY HEALTH CARE CENTER INC,335394,131 LAWRENCE STREET,SARATOGA SPRINGS,Saratoga,0,3,8,0,318,1,6,0
HUDSON POINTE AT RIVERDALE CTR FOR NURSING & REHAB,335187,3220 HENRY HUDSON PARKWAY,BRONX,Bronx,37,15,33,28,138,13,29,2
NORTHERN METROPOLITAN RES HEALTH CARE FACILITY INC,335380,225 MAPLE AVENUE,MONSEY,Rockland,27,2,0,2,106,1,1,0
REGO PARK NURSING HOME,335379,111 26 CORONA AVENUE,FLUSHING,Queens,,,,,,,,
CUBA MEMORIAL HOSPITAL INC S N F,335364,140 WEST MAIN STREET,CUBA,Allegany,,,,,,,,
HEBREW HOME FOR THE AGED AT RIVERDALE,335020,5901 PALISADE AVENUE,RIVERDALE,Bronx,21,19,149,66,570,87,0,0
PENFIELD PLACE,335407,1700 PENFIELD RD,PENFIELD,Monroe,0,0,1,0,38,0,0,0
ST CAMILLUS RESIDENTIAL HEALTH CARE FACILITY,335283,813 FAY ROAD,SYRACUSE,Onondaga,54,18,16,10,206,27,0,0
ST CABRINI NURSING HOME,335383,115 BROADWAY,DOBBS FERRY,Westchester,31,0,3,2,229,72,1,1
MONTGOMERY NURSING AND REHABILITATION CENTER,335396,2817 ALBANY POST ROAD,MONTGOMERY,Orange,0,0,3,1,64,0,0,0
ALICE HYDE MEDICAL CENTER,335127,45 SIXTH STREET,MALONE,Franklin,0,0,3,0,125,0,0,0
RIVER RIDGE LIVING CENTER,335422,100 SANDY DRIVE,AMSTERDAM,Montgomery,0,0,0,0,93,0,0,0
WAYNE COUNTY NURSING HOME,335406,1529 NYE ROAD,LYONS,Wayne,0,0,4,0,183,0,3,0
GLENDALE HOME-SCHDY CNTY DEPT SOCIAL SERVICES,335252,59 HETCHELTOWN ROAD,SCOTIA,Schenectady,0,0,4,0,194,0,0,0
EVERGREEN COMMONS REHABILITATION AND NURSING CTR,335110,1070 LUTHER ROAD,EAST GREENBUSH,Rensselaer,0,0,0,0,217,1,0,0
CORTLAND PARK REHABILITATION AND NURSING CENTER,335218,193 CLINTON AVENUE,CORTLAND,Cortland,0,0,1,0,110,0,0,0
PARK TERRACE CARE CENTER,335317,59 20 VAN DOREN STREET,CORONA,Queens,,,,,,,,
HELEN HAYES HOSPITAL R H C F,335823,51 N RT 9W,WEST HAVERSTRAW,Rockland,8,0,0,0,3,20,2,0
RICHMOND CTR FOR REHAB AND SPECIALTY HEALTHCARE,335772,91 TOMPKINS AVENUE,STATEN ISLAND,Richmond,35,70,6,6,360,3,6,0
SKY VIEW REHABILITATION & HEALTH CARE CENTER L L C,335508,1280 ALBANY POST RD,CROTON ON HUDSON,Westchester,8,0,9,7,139,9,4,0
THE HAMPTONS CENTER FOR REHABILITATION AND NURSING,335850,64 COUNTY ROAD 39,SOUTH HAMPTON,Suffolk,35,55,37,19,208,27,16,0
ST JOHNSVILLE REHABILITATION AND NURSING CENTER,335704,7 TIMMERMAN AVENUE,SAINT JOHNSVILLE,Montgomery,0,0,5,0,116,0,0,0
"RUTLAND NURSING HOME, INC",335537,585 SCHENECTADY AVE,BROOKLYN,Kings,26,1,10,3,391,1,1,0
BAYBERRY NURSING HOME,335614,40 KEOGH LANE,NEW ROCHELLE,Westchester,13,2,5,2,45,13,1,0
ST JOHN'S PENFIELD HOMES,335863,65 SONOMA DRIVE,FAIRPORT,Monroe,0,0,1,0,18,1,0,0
JEANNE JUGAN RESIDENCE,335849,2999 SCHURZ AVENUE,BRONX,Bronx,0,0,0,0,29,0,0,0
HIGHBRIDGE WOODYCREST CENTER,335751,936 WOODYCREST AVENUE,BRONX,Bronx,,,,,,,,
BRIGHTON MANOR,335473,989 BLOSSOM ROAD,ROCHESTER,Monroe,,,,,,,,
MEADOWBROOK HEALTHCARE,335438,154 NORTH PROSPECT AVENUE,PLATTSBURGH,Clinton,0,15,5,0,222,1,12,0
EDDY VILLAGE GREEN,335697,421 W COLUMBIA STREET,COHOES,Albany,0,0,4,0,180,0,0,0
SUFFOLK CENTER FOR REHABILITATION AND NURSING,335596,25 SCHOENFELD BLVD,PATCHOGUE,Suffolk,10,6,5,2,95,1,0,0
WHITE OAKS REHABILITATION AND NURSING CENTER,335690,8565 JERICHO TURNPIKE,WOODBURY,Nassau,9,2,6,3,124,0,0,0
LUTHERAN CENTER AT POUGHKEEPSIE INC,335810,965 DUTCHESS TURNPIKE,POUGHKEEPSIE,Dutchess,5,9,1,0,137,6,13,0
ABSOLUT CTR FOR NURSING & REHAB GASPORT L L C,335533,4540 LINCOLN DRIVE,GASPORT,Niagara,0,0,0,0,66,0,0,0
ABSOLUT CTR FOR NURSING & REHAB THREE RIVERS L L C,335652,101 CREEKSIDE DRIVE,PAINTED POST,Steuben,0,0,0,0,102,0,0,0
THE GRAND REHABILITATION AND NURSING AT GREAT NECK,335483,15 ST PAULS PLACE,GREAT NECK,Nassau,1,0,0,0,141,0,0,0
NIAGARA REHABILITATION AND NURSING CENTER,335742,822 CEDAR AVENUE,NIAGARA FALLS,Niagara,6,3,5,2,136,0,2,0
OUR LADY OF MERCY LIFE CENTER,335767,2 MERCYCARE LANE,GUILDERLAND,Albany,0,0,13,11,112,3,0,0
GRANDELL REHABILITATION AND NURSING CENTER,335498,645 W BROADWAY,LONG BEACH,Nassau,54,12,4,3,190,41,2,0
EDEN REHABILITATION NURSING CENTER,335607,2806 GEORGE STREET,EDEN,Erie,0,0,0,0,35,0,0,0
CARTHAGE CENTER FOR REHABILITATION AND NURSING,335579,1045 WEST STREET,CARTHAGE,Jefferson,0,0,3,0,80,0,0,0
SETON HEALTH AT SCHUYLER RIDGE RESIDENTIAL H C,335774,1 ABELE DRIVE,CLIFTON PARK,Saratoga,1,0,1,0,107,0,5,0
BORO PARK CENTER FOR REHABILITATION AND HEALTHCARE,335470,4915 10TH AVE,BROOKLYN,Kings,17,15,15,4,407,14,2,2
"SAMARITAN SENIOR VILLAGE, INC",335865,22691 CAMPUS DRIVE,WATERTOWN,Jefferson,0,0,31,0,161,0,0,0
NEW YORK CENTER FOR REHABILITATION & NURSING,335838,26-13  21ST STREET,ASTORIA,Queens,0,0,0,1,194,0,0,0
KENDAL ON HUDSON,335848,ONE KENDAL WAY,SLEEPY HOLLOW,Westchester,1,0,0,0,18,0,0,0
ELDERWOOD AT NORTH CREEK,335429,112 SKI BOWL ROAD,NORTH CREEK,Warren,0,2,0,0,62,0,0,0
THE AMSTERDAM AT HARBORSIDE,335861,300 EAST OVERLOOK,PORT WASHINGTON,Nassau,12,4,4,4,46,7,2,0
HIGHLANDS LIVING CENTER,335786,500 HAHNEMANN TRAIL,PITTSFORD,Monroe,0,3,3,0,115,1,0,0
GARDEN GATE HEALTH CARE FACILITY,335634,2365 UNION ROAD,CHEEKTOWAGA,Erie,103,0,34,31,137,28,4,0
LUXOR NURSING AND REHABILITATION AT SAYVILLE,335761,300 BROADWAY AVENUE,SAYVILLE,Suffolk,14,10,1,1,145,27,3,0
BETHEL NURSING HOME COMPANY INC,335490,17 NARRAGANSETT AVENUE,OSSINING,Westchester,17,3,3,1,28,11,3,0
EDNA TINA WILSON LIVING CENTER,335769,700 ISLAND COTTAGE ROAD,ROCHESTER,Monroe,22,0,11,10,93,9,1,1
ALPINE REHABILITATION AND NURSING CENTER,335586,755 E MONROE STREET,LITTLE FALLS,Herkimer,0,0,4,0,79,0,1,0
NEW EAST SIDE NURSING HOME,335517,25 BIALYSTOKER PLACE,NEW YORK,New York,0,1,0,0,44,0,0,0
FOX RUN AT ORCHARD PARK,335854,ONE FOX RUN LANE,ORCHARD PARK,Erie,3,0,5,2,46,3,0,0
SILVERCREST,335724,144 45 87TH AVENUE,JAMAICA,Queens,0,0,13,1,269,0,11,2
PINE HAVEN HOME,335632,NY ROUTE 217,PHILMONT,Columbia,36,2,41,15,78,16,9,0
JEFFERSON'S FERRY,335833,500 MATHER DRIVE,SOUTH SETAUKET,Suffolk,38,0,22,12,36,5,9,0
GHENT REHABILITATION & NURSING CENTER,335766,1 WHITTIER WAY,GHENT,Columbia,0,0,1,0,116,0,0,0
ESSEX CENTER FOR REHABILITATION AND HEALTHCARE,335478,PO BOX 127,ELIZABETHTOWN,Essex,0,0,2,0,98,0,0,0
NORTHEAST CTR FOR REHABILITATION AND BRAIN INJURY,335845,300 GRANT AVENUE,LAKE KATRINE,Ulster,0,0,0,0,247,11,0,0
HUDSON PARK REHABILITATION AND NURSING CENTER,335812,325 NORTHERN BOULEVARD,ALBANY,Albany,1,0,5,1,165,0,0,0
RIVERSIDE CENTER FOR REHABILITATION AND NURSING,335525,90 NO MAIN STREET,CASTLETON ON HUDSON,Rensselaer,0,0,1,0,69,0,0,0
"LEROY VILLAGE GREEN RESIDENTIAL HEALTH C F, INC",335635,10 MUNSON STREET,LEROY,Genesee,0,0,2,0,130,0,0,0
GURWIN JEWISH NURSING AND REHABILITATION CENTER,335696,68 HAUPPAUGE ROAD,COMMACK,Suffolk,114,37,107,50,364,89,5,1
CHAPIN HOME FOR THE AGING,335631,165 01 CHAPIN PARKWAY,JAMAICA,Queens,4,0,1,0,132,3,0,0
KINGS HARBOR MULTICARE CENTER,335644,2000 E GUNHILL ROAD,BRONX,Bronx,,,,,,,,
CARMEL RICHMOND HEALTHCARE AND REHAB CENTER,335455,88 OLD TOWN ROAD,STATEN ISLAND,Richmond,128,41,93,74,232,78,71,0
QUEENS BOULEVARD EXTENDED CARE FACILITY,335791,61 11 QUEENS BOULEVARD,WOODSIDE,Queens,1,4,4,1,169,7,0,0
BENSONHURST CENTER FOR REHAB AND HEALTHCARE,335558,1740 84TH STREET,BROOKLYN,Kings,6,0,10,3,160,0,0,0
WESLEY GARDENS CORPORATION,335488,3 UPTON PARK,ROCHESTER,Monroe,,,,,,,,
UNITY LIVING CENTER,335620,89 GENESEE STREET,ROCHESTER,Monroe,0,1,0,0,114,1,1,0
EDDY VILLAGE GREEN AT BEVERWYCK,335860,40 AUTUMN DRIVE,SLINGERLANDS,Albany,0,0,0,0,24,0,0,0
WATERVILLE RESIDENTIAL CARE CENTER,335585,220 TOWER STREET,WATERVILLE,Oneida,0,0,0,0,87,0,0,0
FINGER LAKES CENTER FOR LIVING,335785,20 PARK AVENUE,AUBURN,Cayuga,0,0,0,0,67,0,0,0
SHEEPSHEAD NURSING & REHABILITATION CENTER,335677,2840 KNAPP ST,BROOKLYN,Kings,0,0,2,2,166,0,0,0
EDDY HERITAGE HOUSE NURSING AND REHABILITATION CTR,335760,2920 TIBBITS AVENUE,TROY,Rensselaer,0,0,0,0,101,2,11,0
UNITED HELPERS NURSING HOME,335454,8101 STATE HIGHWAY 68,OGDENSBURG,St. Lawrence,0,0,1,0,163,0,0,0
EAST HAVEN NURSING & REHABILITATION CENTER,335723,2323  EASTCHESTER ROAD,BRONX,Bronx,37,76,70,37,161,25,47,1
THE BAPTIST HOME AT BROOKMEADE,335613,46 BROOKMEADE DRIVE,RHINEBECK,Dutchess,0,0,19,0,108,2,0,0
QUEEN OF PEACE RESIDENCE,335606,110-30 221ST STREET,QUEENS VILLAGE,Queens,0,0,0,0,51,0,0,0
BELLHAVEN CENTER FOR REHAB AND NURSING CARE,335755,110 BEAVER DAM ROAD,BROOKHAVEN,Suffolk,28,28,6,4,203,12,11,0
TRUSTEES OF EASTERN STAR HALL & HOME OF THE N Y S,335497,8290 STATE RT 69,ORISKANY,Oneida,0,9,0,0,39,1,11,0
SCHERVIER PAVILION,335784,22 VAN DUZER PLACE,WARWICK,Orange,52,2,48,27,59,64,0,0
PINNACLE MULTICARE NURSING AND REHAB CENTER,335581,801 CO OP CITY BLVD,BRONX,Bronx,2,0,0,0,453,0,0,0
MONTEFIORE NYACK HOSPITAL T C U,335877,160 NORTH MIDLAND AVENUE,NYACK,Rockland,,,,,,,,
THE STEVEN AND ALEXANDRA COHEN PED L T C PAVILION,335874,95 BRADHURST AVE,VALHALLA,Westchester,0,0,0,0,23,1,0,0
IRA DAVENPORT MEMORIAL HOSPITAL S N F/ H R F,335706,7571 STATE ROUTE 54,BATH,Steuben,23,5,16,11,103,19,12,0
AARON MANOR REHABILITATION AND NURSING CENTER,335532,100 ST CAMILLUS WAY,FAIRPORT,Monroe,0,19,9,2,124,12,1,0
SUNRISE MANOR CTR FOR NURSING AND REHABILITATION,335568,1325 BRENTWOOD ROAD,BAY SHORE,Suffolk,52,2,24,22,59,12,1,0
HAMILTON PARK NURSING AND REHABILITATION CENTER,335710,691 92ND STREET,BROOKLYN,Kings,6,5,5,1,165,2,0,0
AFFINITY SKILLED LIVING AND REHABILITATION CENTER,335839,305 LOCUST AVENUE,OAKDALE,Suffolk,13,26,59,15,234,42,19,0
ELMHURST CARE CENTER INC,335814,100 17  23RD AVENUE,EAST ELMHURST,Queens,69,47,77,57,174,31,57,0
SALEM HILLS REHABILITATION AND NURSING CENTER,335687,539 ROUTE 22,PURDYS,Westchester,9,0,8,7,87,0,1,0
STATEN ISLAND CARE CENTER,335561,200 LAFAYETTE AVENUE,STATEN ISLAND,Richmond,3,1,8,2,223,0,0,0
YONKERS GARDENS CENTER FOR NURSING AND REHAB,335515,115 SOUTH BROADWAY,YONKERS,Westchester,2,4,4,1,124,36,12,1
ELLIS RESIDENTIAL & REHABILITATION CENTER,335705,600 MCCLELLAN STREET,SCHENECTADY,Schenectady,0,0,1,0,76,2,0,0
GOLDEN HILL NURSING AND REHABILITATION CENTER,335451,99 GOLDEN HILL DRIVE,KINGSTON,Ulster,0,0,1,0,240,6,1,0
HAYM SOLOMON HOME FOR THE AGED,335656,2340 CROPSEY AVENUE,BROOKLYN,Kings,25,2,10,36,152,15,10,0
TERRACE VIEW LONG TERM CARE FACILITY,335650,462 GRIDER STREET,BUFFALO,Erie,2,25,6,1,375,2,9,0
PATHWAYS NURSING AND REHABILITATION CENTER,335701,1805 PROVIDENCE AVENUE,NISKAYUNA,Schenectady,0,0,0,0,108,0,0,0
DAUGHTERS OF SARAH NURSING CENTER,335465,180 WASHINGTON AVE EXT,ALBANY,Albany,7,8,8,1,188,2,4,0
LATTA ROAD NURSING HOME WEST,335617,2100 LATTA ROAD,ROCHESTER,Monroe,0,0,0,0,39,2,0,0
EPIC REHABILITATION AND NURSING AT WHITE PLAINS,335878,120 CHURCH STREET,WHITE PLAINS,Westchester,6,1,0,0,49,6,2,0
THE PHOENIX REHABILITATION AND NURSING CENTER,335516,140 ST EDWARDS STREET,BROOKLYN,Kings,31,2,8,5,245,7,0,0
ONONDAGA CENTER FOR REHABILITATION AND NURSING,335548,217 EAST AVENUE,MINOA,Onondaga,0,0,0,0,77,0,0,0
"HAVEN MANOR HEALTH CARE CENTER, L L C",335676,1441 GATEWAY BOULEVARD,FAR ROCKAWAY,Queens,1,0,31,24,194,20,3,1
ELDERWOOD AT CHEEKTOWAGA,335752,225 BENNETT ROAD,CHEEKTOWAGA,Erie,0,0,0,0,145,1,0,0
UNITED HEALTH SVS HOSP INC - BINGHAMTON HOSP T C U,335851,10-42 MITCHELL AVENUE,BINGHAMTON,Broome,,,,,,,,
QUANTUM REHABILITATION AND NURSING L L C,335719,63 OAKCREST AVENUE,MIDDLE ISLAND,Suffolk,,,,,,,,
PELHAM PARKWAY NURSING CTR & REHAB FACILITY L L C,335486,2401 LACONIA AVE,BRONX,Bronx,,,,,,,,
ELLICOTT CENTER FOR REHABILITATION AND NURSING,335437,200 SEVENTH STREET,BUFFALO,Erie,19,14,4,2,147,5,4,0
"THE BRIGHTONIAN, INC",335554,1919 ELMWOOD AVENUE,ROCHESTER,Monroe,13,0,9,8,30,1,0,0
MASSENA REHABILITATION & NURSING CENTER,335592,89 GROVE STREET,MASSENA,St. Lawrence,0,0,0,0,128,0,0,0
CHEMUNG COUNTY HEALTH CENTER - NURSING FACILITY,335480,103 WASHINGTON STREET,ELMIRA,Chemung,0,0,0,0,164,0,0,0
UNITED HELPERS CANTON NURSING HOME,335566,205 STATE STREET ROAD,CANTON,St. Lawrence,1,0,7,0,89,1,6,0
INCARNATION CHILDRENS CENTER INC,335822,142 AUDOBON AVENUE,NEW YORK,New York,2,5,0,0,15,1,11,0
SMITHTOWN CENTER FOR REHABILITATION & NURSING CARE,335756,391 NORTH COUNTRY ROAD,SMITHTOWN,Suffolk,91,35,34,28,137,35,3,0
PENN YAN MANOR NURSING HOME INC,335494,655 N LIBERTY STREET,PENN YAN,Yates,0,0,0,0,46,0,0,0
HOPE CENTER FOR H I V AND NURSING CARE,335725,1401 UNIVERSITY AVENUE,BRONX,Bronx,0,2,0,0,61,0,0,0
SYRACUSE HOME ASSOCIATION,335713,7740 MEIGS ROAD,BALDWINSVILLE,Onondaga,3,0,0,0,104,0,0,0
NORTHWELL HEALTH STERN FAMILY CENTER FOR REHAB,335702,300 COMMUNITY DRIVE,MANHASSET,Nassau,2,0,4,4,147,60,4,0
WELLSVILLE MANOR CARE CENTER,335661,4192A BOLIVAR ROAD,WELLSVILLE,Allegany,0,0,32,0,109,0,0,0
"HARRIS HILL NURSING FACILITY, L L C",335757,2699 WEHRLE DRIVE,WILLIAMSVILLE,Erie,,,,,,,,
BETHLEHEM COMMONS CARE CENTER,335735,125 ROCKEFELLER ROAD,DELMAR,Albany,0,8,0,0,81,1,4,0
FLUSHING HOSPITAL MEDICAL CENTER T C U,335864,45TH AVENUE AND PARSONS BOULEVARD,FLUSHING,Queens,0,0,0,0,0,0,0,0
NEW YORK-PRESBYTERIAN / QUEENS T C U,335862,56-45 MAIN STREET,FLUSHING,Queens,,,,,,,,
SAMARITAN KEEP NURSING HOME INC,335431,133 PRATT ST,WATERTOWN,Jefferson,0,10,0,0,253,4,15,0
FIDDLERS GREEN MANOR REHAB AND NURSING CENTER,335457,168 WEST MAIN STREET,SPRINGVILLE,Erie,4,0,0,1,71,5,0,0
SAPPHIRE NURSING AND REHAB AT GOSHEN,335684,46 HARRIMAN DRIVE,GOSHEN,Orange,45,10,5,5,88,7,0,0
WINGATE OF DUTCHESS,335789,3 SUMMIT COURT,FISHKILL,Dutchess,2,25,0,0,121,4,2,0
BROOKHAVEN REHAB & HEALTH CARE CENTER L L C,335582,250 BEACH 17TH STREET,FAR ROCKAWAY,Queens,28,29,45,25,256,31,6,0
JOHN T MATHER MEMORIAL HOSP T C U,335853,75 NORTH COUNTRY ROAD,PORT JEFFERSON,Suffolk,0,0,0,0,0,0,0,0
HAMILTON MANOR NURSING HOME,335615,1172 LONG POND ROAD,ROCHESTER,Monroe,0,0,0,0,35,0,0,0
ELDERWOOD AT LIVERPOOL,335678,4800 BEAR ROAD,LIVERPOOL,Onondaga,0,0,25,0,135,1,7,0
NEW YORK STATE VETERANS HOME AT MONTROSE,335832,2090 ALBANY POST ROAD,MONTROSE,Westchester,0,0,1,1,175,0,0,0
REBEKAH REHAB AND EXTENDED CARE CENTER,335557,1072 HAVEMEYER AVENUE,BRONX,Bronx,31,54,52,29,205,12,0,0
LOCKPORT REHAB & HEALTH CARE CENTER,335573,909 LINCOLN AVE,LOCKPORT,Niagara,0,0,4,0,72,0,0,0
PROVIDENCE REST INC,335583,3304 WATERBURY AVENUE,BRONX,Bronx,33,0,67,17,132,59,55,1
TERENCE CARDINAL COOKE HEALTH CARE CENTER,335665,1249 FIFTH AVENUE,NEW YORK,New York,12,14,17,11,538,22,1,0
THROGS NECK REHABILITATION & NURSING CENTER,335771,707 THROGS NECK EXPRESSWAY,BRONX,Bronx,0,0,1,0,155,0,0,0
NEW GOUVERNEUR HOSPITAL S N F,335461,227 MADISON STREET,NEW YORK,New York,7,36,8,6,260,3,7,0
SENECA HEALTH CARE CENTER,335504,2987 SENECA STREET,WEST SENECA,Erie,94,0,35,17,115,29,3,0
THE PLAZA REHAB AND NURSING CENTER,335462,100 WEST KINGSBRIDGE ROAD,BRONX,Bronx,0,52,122,79,628,18,95,0
ELDERWOOD AT HAMBURG,335679,5775 MAELOU DRIVE,HAMBURG,Erie,0,8,25,0,130,2,0,0
BEACON REHABILITATION AND NURSING CENTER,335726,140 BEACH 113TH STREET,ROCKAWAY PARK,Queens,25,37,34,30,90,63,22,0
PONTIAC NURSING HOME,335590,303 EAST RIVER ROAD,OSWEGO,Oswego,0,0,0,0,48,0,0,0
ST JOHNLAND NURSING CENTER INC,335487,395 SUNKEN MEADOW ROAD,KINGS PARK,Suffolk,33,3,8,4,195,5,1,0
NORWICH REHABILITATION & NURSING CENTER,335759,88 CALVARY DRIVE,NORWICH,Chenango,0,0,0,0,81,3,0,0
IDEAL SENIOR LIVING CENTER,335520,601 HIGH AVENUE,ENDICOTT,Broome,0,0,19,0,142,0,7,0
MEDFORD MULTICARE CENTER FOR LIVING,335840,3115 HORSEBLOCK ROAD,MEDFORD,Suffolk,38,82,43,19,275,36,0,0
SUNHARBOR MANOR,335559,255 WARNER AVENUE,ROSLYN HEIGHTS,Nassau,,,,,,,,
WOODLAND POND AT NEW PALTZ,335858,100 WOODLAND POND CIRCLE,NEW PALTZ,Ulster,0,0,11,0,32,5,0,0
THE CENTER FOR NURSING AND REHAB AT HOOSICK FALLS,335601,21 DANFORTH STREET,HOOSICK FALLS,Rensselaer,0,0,1,0,61,1,0,0
THE FIVE TOWNS PREMIER REHAB & NURSING CENTER,335718,1050 CENTRAL AVENUE,WOODMERE,Nassau,45,5,1,14,225,0,1,1
GOWANDA REHABILITATION AND NURSING CENTER,335642,100 MILLER STREET,GOWANDA,Cattaraugus,0,0,1,0,111,0,0,0
ADIRA AT RIVERSIDE REHABILITATION AND NURSING,335829,120 ODELL AVENUE,YONKERS,Westchester,15,0,11,1,106,18,0,0
SARATOGA CENTER FOR REHAB & SKILLED NURSING CARE,335518,149 BALLSTON AVENUE,BALLSTON SPA,Saratoga,0,0,1,0,111,0,0,0
BROOKHAVEN HEALTH CARE FACILITY L L C,335694,801 GAZZOLA BLVD,EAST PATCHOGUE,Suffolk,63,45,22,9,128,23,0,0
GLEN ISLAND CENTER FOR NURSING AND REHABILITATION,335611,490 PELHAM ROAD,NEW ROCHELLE,Westchester,54,98,8,3,152,40,33,0
THE GRAND REHABILITATION AND NURSING AT UTICA,335600,1657 SUNSET AVE,UTICA,Oneida,0,0,4,0,205,2,6,0
AUTUMN VIEW HEALTH CARE FACILITY L L C,335662,S 4650 SOUTHWESTERN BLVD,HAMBURG,Erie,0,2,3,0,217,0,46,0
BUFFALO CENTER FOR REHABILITATION AND NURSING,335638,1014 DELAWARE AVE,BUFFALO,Erie,13,10,8,4,167,4,3,0
CHAUTAUQUA NURSING AND REHABILITATION CENTER,335485,10836 TEMPLE ROAD,DUNKIRK,Chautauqua,0,0,0,0,186,0,1,0
MVHS REHABILITATION AND NURSING CENTER,335801,1650 CHAMPLIN AVENUE,UTICA,Oneida,0,0,32,0,171,0,0,0
ELDERWOOD OF LAKESIDE AT BROCKPORT,335569,170 WEST AVENUE,BROCKPORT,Monroe,0,0,0,0,104,0,0,0
ELDERWOOD AT WHEATFIELD,335790,2600 NIAGARA FALLS BOULEVARD,NIAGARA FALLS,Niagara,0,1,3,0,92,0,5,0
NOTTINGHAM R H C F,335800,1305 NOTTINGHAM ROAD,JAMESVILLE,Onondaga,0,0,0,0,37,1,0,0
WILKINSON RESIDENTIAL HEALTH CARE FACILITY,335857,4988 STATE HWY 30,AMSTERDAM,Montgomery,2,0,2,0,137,0,0,0
PECONIC LANDING AT SOUTHOLD,335842,1500 BRECKNOCK ROAD,GREENPORT,Suffolk,0,1,5,2,39,0,0,0
SAPPHIRE NURSING AT MEADOW HILL,335464,172 MEADOW HILL ROAD,NEWBURGH,Orange,11,4,9,2,149,2,1,0
"THE NEW JEWISH HOME, MANHATTAN",335491,120 WEST 106TH STREET,NEW YORK,New York,6,15,10,6,426,5,9,0
VALLEY HEALTH SERVICES INC,335672,690 WEST GERMAN STREET,HERKIMER,Herkimer,0,3,1,0,142,0,4,0
WESTCHESTER CENTER FOR REHABILITATION & NURSING,335459,10 CLAREMONT AVE,MOUNT VERNON,Westchester,4,8,3,2,185,0,0,0
PALATINE NURSING HOME,335685,154  LAFAYETTE STREET,PALATINE BRIDGE,Montgomery,0,0,0,0,63,0,0,0
ST MARGARETS CENTER,335830,27 HACKETT BLVD,ALBANY,Albany,0,0,0,0,88,1,0,0
HEMPSTEAD PARK NURSING HOME,335808,800 FRONT STREET,HEMPSTEAD,Nassau,,,,,,,,
THE KNOLLS,335844,55 GRASSLAND ROAD,VALHALLA,Westchester,0,3,2,1,11,1,0,0
THE GRAND REHABILITATION AND NURSING AT ROME,335589,801 NORTH JAMES STREET,ROME,Oneida,1,1,0,0,134,11,0,0
HELEN HAYES HOSPITAL T C U,335873,51 N ROUTE 9W,WEST HAVERSTRAW,Rockland,0,0,0,0,0,0,0,0
ST VINCENT DEPAUL RESIDENCE,335763,900 INTERVALE AVENUE,BRONX,Bronx,3,0,0,2,99,0,0,0
"SAFIRE REHABILITATION OF SOUTHTOWN, L L C",335663,300 DORRANCE AVENUE,BUFFALO,Erie,0,0,0,0,105,0,0,0
FISHKILL CENTER FOR REHABILITATION AND NURSING,335750,22 ROBERT R. KASIN WAY,BEACON,Dutchess,0,2,1,0,140,2,8,0
WAYNE CENTER FOR NURSING & REHABILITATION,335495,3530 WAYNE AVENUE,BRONX,Bronx,,,,,,,,
GLEN ARDEN INC,335802,46 HARRIMAN DRIVE,GOSHEN,Orange,6,0,5,4,34,5,0,0
SAINTS JOACHIM & ANNE NURSING AND REHAB CENTER,335748,2720 SURF AVENUE,BROOKLYN,Kings,4,3,0,0,124,10,0,0
KINGSWAY ARMS NURSING CENTER INC,335466,323 KINGS ROAD,SCHENECTADY,Schenectady,0,0,1,0,149,0,0,0
CASA PROMESA,335780,308 EAST 175 STREET,BRONX,Bronx,,,,,,,,
UTICA REHABILITATION & NURSING CENTER,335471,2535 GENESEE STREET,UTICA,Oneida,0,0,0,0,90,0,0,0
ROSEWOOD REHABILITATION AND NURSING CENTER,335693,284 TROY ROAD,RENSSELAER,Rensselaer,6,7,1,0,65,0,0,0
OUR LADY OF PEACE NURSING CARE RESIDENCE,335843,5285 LEWISTON ROAD,LEWISTON,Niagara,0,0,2,0,214,1,1,0
FULTON COMMONS CARE CENTER INC,335831,60 MERRICK AVENUE,EAST MEADOW,Nassau,41,49,118,39,196,25,63,0
MANHATTANVILLE HEALTH CARE CENTER,335695,311 W 231ST STREET,BRONX,Bronx,24,18,126,40,144,52,0,0
KING STREET HOME INC,335447,787 KING STREET,PORT CHESTER,Westchester,4,2,0,0,62,12,1,0
JAMAICA HOSPITAL MEDICAL CENTER T C U,335856,8900 VAN WYCK EXPRESSWAY,JAMAICA,Queens,0,0,0,0,0,0,0,0
ST CATHERINE OF SIENA NRSG AND REHAB CARE CENTER,335821,52 ROUTE 25A,SMITHTOWN,Suffolk,3,0,7,3,160,2,13,0
GOOD SHEPHERD VILLAGE AT ENDWELL,335859,14 VILLAGE DRIVE,ENDWELL,Broome,,,,,,,,
UNION PLAZA CARE CENTER,335799,33 23 UNION STREET,FLUSHING,Queens,0,0,6,4,185,3,0,0
"WEST LAWRENCE CARE CENTER, L L C",335737,1410 SEAGIRT BLVD,FAR ROCKAWAY,Queens,28,52,64,37,183,13,24,0
THE GRAND REHABILITATION AND NURSING AT BARNWELL,335565,3230 CHURCH STREET,VALATIE,Columbia,,,,,,,,
MARIA REGINA RESIDENCE INC,335837,1725 BRENTWOOD ROAD,BRENTWOOD,Suffolk,83,10,73,34,116,61,0,0
SUNSHINE CHILDREN'S HOME AND REHAB CENTER,335667,15 SPRING VALLEY ROAD,OSSINING,Westchester,2,0,0,0,54,10,0,1
WESTHAMPTON CARE CENTER,335782,78 OLD COUNTRY ROAD,WESTHAMPTON,Suffolk,17,0,9,7,142,5,2,0
ELIZABETH SETON PEDIATRIC CENTER,33A246,300 CORPORATE BLVD SOUTH,YONKERS,Westchester,,,,,,,,
ISLAND NURSING AND REHAB CENTER,335835,5537 EXPRESSWAY DRIVE NORTH,HOLTSVILLE,Suffolk,0,0,1,1,60,0,0,0
GREENE MEADOWS NURSING AND REHABILITATION CENTER,335574,161 JEFFERSON HEIGHTS,CATSKILL,Greene,0,0,0,0,100,0,0,0
CLINTON COUNTY NURSING HOME,335598,16 FLYNN AVENUE,PLATTSBURGH,Clinton,0,0,0,0,71,0,0,0
THE HAMLET REHABILITATION AND HEALTHCARE CENTER AT,335674,100 SOUTHERN BOULEVARD,NESCONSET,Suffolk,0,0,10,8,190,8,1,0
PLATTSBURGH REHABILITATION AND NURSING CENTER,335528,8 BUSHEY BOULEVARD,PLATTSBURGH,Clinton,0,0,0,0,67,0,0,0
GROTON COMMUNITY HEALTH CARE CTR RES CARE FAC,335658,120 SYKES STREET,GROTON,Tompkins,0,0,1,0,64,0,1,0
KING DAVID CENTER FOR NURSING AND REHABILITATION,335545,2266 CROPSEY AVENUE,BROOKLYN,Kings,4,7,3,1,195,1,0,0
SCHOFIELD RESIDENCE,335603,3333 ELMWOOD AVENUE,KENMORE,Erie,0,0,0,0,111,0,0,0
REGAL HEIGHTS REHABILITATION AND HEALTH CARE CTR,335820,70-05 35 AVENUE,JACKSON HEIGHTS,Queens,0,2,2,1,245,1,1,0
DR SUSAN SMITH MCKINNEY NURSING AND REHAB CENTER,335805,594 ALBANY AVENUE,BROOKLYN,Kings,9,0,3,2,318,24,0,1
CREEKVIEW NURSING AND REHAB CENTER,335556,525 BEAHAN ROAD,ROCHESTER,Monroe,35,1,0,0,109,8,0,0
CHARLES T SITRIN HEALTH CARE CENTER INC,335475,2050 TILDEN AVE,NEW HARTFORD,Oneida,11,2,1,0,163,0,0,0
ELDERWOOD AT HORNELL,335691,ONE BETHESDA DRIVE,HORNELL,Steuben,0,0,3,1,90,0,0,0
CORTLANDT HEALTHCARE,335441,110 OREGON ROAD,CORTLANDT MANOR,Westchester,12,0,6,0,75,2,0,0
BRONX GARDENS REHABILITATION AND NURSING CENTER,335775,2175 QUARRY RD,BRONX,Bronx,0,1,2,2,181,0,0,0
BEDFORD CENTER FOR NURSING AND REHABILITATION,335626,40 HEYWARD STREET,BROOKLYN,Kings,3,1,6,2,176,0,0,0
GRAND MANOR NURSING & REHABILITATION CENTER,335744,700 WHITE PLAINS ROAD,BRONX,Bronx,9,2,0,0,197,0,0,0
ATRIUM CENTER FOR REHABILITATION AND NURSING,335720,630 E 104TH STREET,BROOKLYN,Kings,23,4,1,0,322,10,0,0
BRONX CENTER FOR REHABILITATION & HEALTH CARE,335506,1010 UNDERHILL AVE,BRONX,Bronx,2,12,0,0,181,5,1,0
BUENA VIDA REHAB AND NURSING CENTER,335826,48 CEDAR STREET,BROOKLYN,Kings,3,0,4,4,195,1,0,0
FORDHAM NURSING AND REHABILITATION CENTER,335659,2678 KINGSBRIDGE TERRACE,BRONX,Bronx,21,51,33,20,201,14,0,0
BUFFALO COMMUNITY HEALTHCARE CENTER,335640,1205 DELAWARE AVENUE,BUFFALO,Erie,0,0,3,0,74,0,2,0
BRONXCARE SPECIAL CARE CENTER,335753,1265 FULTON AVENUE,BRONX,Bronx,0,0,1,1,226,1,0,0
TOWNHOUSE CENTER FOR REHABILITATION & NURSING,335798,755 HEMPSTEAD TURNPIKE,UNIONDALE,Nassau,32,89,54,23,231,48,1,2
CAPSTONE CENTER FOR REHABILITATION AND NURSING,335543,302 SWART HILL ROAD,AMSTERDAM,Montgomery,0,0,0,0,106,0,0,0
LONG BEACH NURSING AND REHABILITATION CENTER,335432,375 EAST BAY DRIVE,LONG BEACH,Nassau,18,78,53,44,131,0,8,0
ROCKAWAY CARE CENTER,335571,353 BEACH 48TH STREET,FAR ROCKAWAY,Queens,5,2,0,0,154,0,0,0
AMSTERDAM NURSING HOME CORP (1992),335570,1060 AMSTERDAM AVENUE,NEW YORK,New York,78,111,93,73,312,40,16,1
THE GRAND REHABILITATION AND NURSING AT PAWLING,335458,9 RESERVOIR ROAD,PAWLING,Dutchess,9,2,5,4,96,1,1,0
WINGATE OF ULSTER,335803,ONE WINGATE WAY,HIGHLAND,Ulster,25,1,11,11,91,13,1,0
SALAMANCA REHABILITATION & NURSING CENTER,335534,451 BROAD STREET,SALAMANCA,Cattaraugus,0,0,0,0,83,0,0,0
CANTERBURY WOODS,335816,725 RENAISSANCE DRIVE,WILLIAMSVILLE,Erie,0,0,0,0,48,1,0,0
"ROCKVILLE SKILLED NURSING & REHAB CENTER, L L C",335747,50 MAINE AVENUE,ROCKVILLE CENTRE,Nassau,0,0,2,2,53,0,0,0
MASONIC CARE COMMUNITY OF NEW YORK,335541,2150 BLEECKER STREET,UTICA,Oneida,1,0,1,0,294,3,8,0
ABSOLUT CTR FOR NURSING & REHAB WESTFIELD L L C,335683,26 CASS STREET,WESTFIELD,Chautauqua,0,0,0,0,101,0,0,0
JAMES G JOHNSTON MEMORIAL NURSING HOME,335675,285 DEYO HILL ROAD,JOHNSON CITY,Broome,0,0,3,0,103,1,0,0
BROOKLYN UNITED METHODIST CHURCH HOME,335604,1485 DUMONT AVENUE,BROOKLYN,Kings,37,10,1,1,103,7,0,0
GLEN COVE CENTER FOR NURSING AND REHABILITATION,335716,6 MEDICAL PLAZA,GLEN COVE,Nassau,16,20,7,3,115,13,6,0
WINGATE AT BEACON,335828,10 HASTINGS DRIVE,BEACON,Dutchess,,,,,,,,
THE GRAND REHABILITATION AND NRSG AT GUILDERLAND,335540,428 STATE ROUTE 146,ALTAMONT,Albany,25,2,1,0,81,4,0,0
NEWFANE REHAB & HEALTH CARE CENTER,335481,2709 TRANSIT RD,NEWFANE,Niagara,,,,,,,,
DELHI REHABILITATION AND NURSING CENTER,335876,41861 STATE ROUTE 10,DELHI,Delaware,0,0,2,0,113,0,0,0
HERITAGE GREEN REHAB & SKILLED NURSING,335721,3023 ROUTE 430     PO BOX 400,GREENHURST,Chautauqua,0,0,0,0,128,0,0,0
METHODIST HOME FOR NURSING AND REHABILITATION,335524,4499 MANHATTAN COLLEGE PARKWAY,BRONX,Bronx,44,0,23,13,81,28,11,1
HIGHLAND CARE CENTER,335505,91 31 175TH STREET,JAMAICA,Queens,14,30,10,5,269,0,0,0
COLD SPRING HILLS CENTER FOR NURSING AND REHAB,335555,378 SYOSSET WOODBURY ROAD,WOODBURY,Nassau,13,4,25,11,466,8,1,1
BUSHWICK CENTER FOR REHABILITATION AND HEALTH CARE,335703,50 SHEFFIELD AVENUE,BROOKLYN,Kings,0,10,3,2,220,4,2,0
TRIBORO CENTER FOR REHABILITATION AND NURSING,335445,1160 TELLER AVE,BRONX,Bronx,5,3,12,8,384,5,2,0
BETHEL NURSING & REHABILITATION CENTER,335806,67 SPRINGVALE ROAD,CROTON ON HUDSON,Westchester,,,,,,,,
FAIRPORT BAPTIST HOMES,335576,4646 NINE MILE POINT ROAD,FAIRPORT,Monroe,0,0,0,0,126,0,0,0
MOUNT SINAI SOUTH NASSAU T C U,335871,1 HEALTHY WAY,OCEANSIDE,Nassau,,,,,,,,
THE FRIENDLY HOME,335476,3156 EAST AVENUE,ROCHESTER,Monroe,15,0,6,4,168,5,2,0
