SCHUYLKILL CENTER,395831,1000 SCHUYLKILL MANOR RD,POTTSVILLE,Schuylkill,1,1,44,0,170,10,4,0
NORMANDIE RIDGE,395902,1700 NORMANDIE DRIVE,YORK,York,0,0,4,0,53,2,13,0
LIBERTY CENTER FOR REHABILITATION AND NURSING,395764,7310 STENTON AVENUE,PHILADELPHIA,Philadelphia,31,0,25,12,67,24,2,0
"VILLA CREST, LLC",396147,1451 FRANKSTOWN ROAD,JOHNSTOWN,Cambria,0,0,0,0,2,0,0,0
"TCU AT NAZARETH HOSPITAL, THE",396002,2601 HOLME AVENUE,PHILADELPHIA,Philadelphia,2,2,0,0,10,4,4,0
UPMC NORTHWEST TRANSITIONAL CARE UNIT,395966,100 FAIRFIELD DRIVE,SENECA,Venango,0,0,0,0,6,0,0,0
ST ANNE'S RETIREMENT COMMUNITY,395806,3952 COLUMBIA AVENUE,COLUMBIA,Lancaster,0,12,57,0,82,8,9,0
MEADOWOOD,395768,3205 SKIPPACK PIKE PO BOX 670,WORCESTER,Montgomery,4,29,9,1,49,5,25,0
LITTLE SISTERS OF THE POOR,396116,1028 BENTON AVENUE,PITTSBURGH,Allegheny,2,5,7,0,39,2,6,0
PARAMOUNT NURSING AND REHABILITATION AT SOUTH HILL,396142,100 KNOEDLER ROAD,PITTSBURGH,Allegheny,0,0,0,0,0,0,0,0
SETON MANOR NURSING AND REHABILITATION CENTER,396063,1000 SETON DRIVE,ORWIGSBURG,Schuylkill,4,30,2,0,106,12,23,0
SENECA PLACE,395790,5360 SALTSBURG ROAD,VERONA,Allegheny,0,0,12,0,115,2,1,0
"TULIP SPECIAL CARE, LLC",396143,"3300 HENRY AVENUE, 7TH FLOOR",PHILADELPHIA,Philadelphia,0,15,18,0,53,4,7,0
LANDIS HOMES,395797,1001 EAST OREGON ROAD,LITITZ,Lancaster,29,55,33,3,86,41,180,0
JEFFERSON HILLS REHABILITATION AND WELLNESS CENTER,395948,540 COAL VALLEY ROAD,JEFFERSON HILLS,Allegheny,0,0,0,0,48,0,0,0
CONESTOGA VIEW,395774,900 EAST KING STREET,LANCASTER,Lancaster,163,150,45,27,326,96,148,0
MENNO HAVEN REHABILITATION CENTER,396145,2055 SCOTLAND AVENUE,CHAMBERSBURG,Franklin,0,0,7,0,39,1,0,0
FOXDALE VILLAGE,395838,500 E. MARYLYN AVENUE,STATE COLLEGE,Centre,0,0,7,0,40,0,6,0
PHILADELPHIA PROTESTANT HOME,395961,700 E GILHAM ST,PHILADELPHIA,Philadelphia,,,,,,,,
TRANSITIONS HEALTHCARE GETTYSBURG,395798,595 BIGLERVILLE ROAD,GETTYSBURG,Adams,3,3,20,0,120,4,4,0
CHERRY TREE NURSING CENTER,395977,410 TERRACE DRIVE,UNIONTOWN,Fayette,0,0,2,0,86,0,0,0
ALTOONA CENTER FOR NURSING CARE,395985,1020 GREEN AVENUE,ALTOONA,Blair,1,0,204,0,95,40,1,0
SCOTTDALE HEALTHCARE AND REHABILITATION CENTER,396035,900 PORTER AVENUE,SCOTTDALE,Westmoreland,0,0,6,0,23,0,0,0
RIVER'S EDGE REHABILITATION & HEALTHCARE CENTER,395843,9501 STATE ROAD,PHILADELPHIA,Philadelphia,72,49,21,14,106,26,17,0
SNU ARMSTRONG CO MEMORIAL HOSP,395890,ONE NOLTE DRIVE,KITTANNING,Armstrong,0,0,0,0,8,0,0,0
LITTLE FLOWER MANOR,395821,1201 SPRINGFIELD ROAD,DARBY,Delaware,26,58,36,6,89,13,31,0
HIGHLAND PARK CARE CENTER,395773,745 NORTH HIGHLAND AVENUE,PITTSBURGH,Allegheny,0,0,6,0,108,0,0,0
CONCORDIA AT VILLA ST JOSEPH,396026,1030 STATE STREET,BADEN,Beaver,22,23,52,4,105,15,63,0
LAKESIDE AT WILLOW VALLEY,395771,300 WILLOW VALLEY LAKES DRIVE,WILLOW STREET,Lancaster,28,12,10,8,65,19,13,0
LUTHERAN COMMUNITY AT TELFORD,395804,12 LUTHERAN HOME DRIVE,TELFORD,Montgomery,0,0,31,0,53,6,2,0
PROVIDENCE POINT HEALTHCARE RESIDENCE,396124,200 ADAMS AVE,PITTSBURGH,Allegheny,1,8,0,0,49,41,0,0
UPMC MCKEESPORT LONG TERM CARE,395925,1500 FIFTH AVENUE,MCKEESPORT,Allegheny,0,0,0,0,6,15,1,0
WILLIAM PENN CARE CENTER,396056,2020 ADER ROAD,JEANNETTE,Westmoreland,0,0,9,0,88,1,2,0
AVALON SPRINGS PLACE,396058,745 GREENVILLE ROAD,MERCER,Mercer,0,0,6,0,76,3,0,0
CHAMBERS POINTE HEALTH CARE CENTER,395944,1425 PHILADELPHIA AVENUE,CHAMBERSBURG,Franklin,0,0,240,0,56,5,0,0
QUALITY LIFE SERVICES - MARKLEYSBURG,395870,252 MAIN STREET,MARKLEYSBURG,Fayette,22,23,5,0,55,12,3,0
STONERIDGE POPLAR RUN,395927,450 EAST LINCOLN AVENUE,MYERSTOWN,Lebanon,21,0,5,0,53,9,3,0
SENA KEAN MANOR,395775,17083 ROUTE 6,SMETHPORT,McKean,2,40,15,0,114,7,3,0
POWERBACK REHABILITATION PHOENIXVILLE,396126,3000 BALFOUR CIRCLE,PHOENIXVILLE,Chester,2,1,2,1,18,3,1,0
WELLINGTON COURT NURSING AND REHAB CENTER,396117,1361 EAST BOOT ROAD,WEST CHESTER,Chester,25,1,3,11,26,18,16,0
AVENTURA AT CREEKSIDE,395984,45 NORTH SCOTT STREET,CARBONDALE,Lackawanna,0,2,10,0,65,0,9,0
MANORCARE HEALTH SERVICES-PETERS TOWNSHIP,395783,113 WEST MCMURRAY ROAD,MCMURRAY,Washington,59,55,27,9,73,29,22,0
MANORCARE HEALTH SERVICES-MONTGOMERYVILLE,395796,640 BETHLEHEM PIKE,MONTGOMERYVILLE,Montgomery,1,14,15,3,123,9,6,0
PROVIDENCE REHAB AND HLTHCARE CTRATMERCYFITZGERALD,395989,600 SOUTH WYCOMBE AVE,YEADON,Delaware,90,64,32,19,119,37,15,1
CHAPEL POINTE AT CARLISLE,395923,770 S. HANOVER STREET,CARLISLE,Cumberland,0,0,30,0,59,1,0,0
LAUREL VIEW VILLAGE,395891,2000 CAMBRIDGE DRIVE,DAVIDSVILLE,Somerset,0,0,0,0,52,2,0,0
"INN AT FREEDOM VILLAGE,THE",396062,35 FREEDOM BOULEVARD,WEST BRANDYWINE,Chester,16,8,28,10,41,4,2,0
SACRED HEART HOSPITAL TCF,395926,421 CHEW STREET,ALLENTOWN,Lehigh,0,0,2,2,14,0,5,0
MANORCARE HEALTH SERVICES-KING OF PRUSSIA,395834,600 WEST VALLEY FORGE ROAD,KING OF PRUSSIA,Montgomery,8,14,13,3,127,4,4,0
PHOEBE WYNCOTE,396120,208 FERNBROOK AVENUE,WYNCOTE,Montgomery,39,0,17,16,30,25,3,1
RESTORE HEALTH AT SHIPPENSBURG,395964,121 WALNUT BOTTOM ROAD,SHIPPENSBURG,Cumberland,92,13,61,31,95,28,16,0
SOUTHWESTERN VETERANS CENTER,39A438,7060 HIGHLAND DRIVE,PITTSBURGH,Allegheny,9,14,11,3,189,10,57,0
"HAVEN CONVALESCENT HOME, INC",396106,725 PAUL STREET,NEW CASTLE,Lawrence,75,0,26,8,82,17,0,0
LAURELWOOD CARE CENTER,395812,100 WOODMONT ROAD,JOHNSTOWN,Cambria,3,0,14,0,97,8,2,0
KEARSLEY REHABILITATION AND NURSING CENTER,395983,2100 NORTH 49TH STREET,PHILADELPHIA,Philadelphia,24,23,11,2,78,14,6,0
ABRAMSON SENIOR CARE AT LANKENAU MEDICAL CENTER,396001,100 LANCASTER AVENUE,WYNNEWOOD,Montgomery,0,0,20,9,25,1,0,0
MOUNTAIN VIEW CARE AND REHABILITATION CENTER,395881,2309 STAFFORD AVENUE,SCRANTON,Lackawanna,77,12,28,54,114,31,19,0
QUALITY LIFE SERVICES - WESTMONT,396132,787 GOUCHER STREET,JOHNSTOWN,Cambria,0,4,4,0,38,0,0,0
CHRIST'S HOME RETIREMENT COMMUNITY,396125,1 SHEPHERD'S WAY SUITE 100,WARMINSTER,Bucks,18,3,2,0,26,17,9,0
MILLCREEK MANOR,396072,5535 PEACH STREET,ERIE,Erie,0,3,20,0,144,3,33,0
PRESTON RESIDENCE,396090,200 SYCAMORE DRIVE,WEST GROVE,Chester,0,7,2,0,16,1,2,0
LEHIGH CENTER,395939,1718 SPRING CREEK ROAD,MACUNGIE,Lehigh,70,21,40,23,96,37,5,0
TRANSITIONAL SUB-ACUTE UNIT,395941,2802 PAPERMILL ROAD,WYOMISSING,Berks,3,2,1,1,50,10,1,0
RICHFIELD HEALTHCARE AND REHABILITATION CENTER,396093,"PO BOX 248, 631 MAIN STREET",RICHFIELD,Juniata,0,16,8,0,34,0,2,0
CONEMAUGH MEMORIAL MEDICAL CENTER TCU,396102,320 MAIN STREET,JOHNSTOWN,Cambria,0,0,0,0,15,2,3,0
WILLOW TERRACE,396129,ONE PENN BOULEVARD,PHILADELPHIA,Philadelphia,46,15,31,10,162,11,0,0
"COMMUNITIES AT INDIAN HAVEN,",395778,1675 SALTSBURG AVENUE,INDIANA,Indiana,4,0,15,0,71,0,0,0
SANATOGA CENTER,395904,225 EVERGREEN ROAD,POTTSTOWN,Montgomery,6,6,23,0,112,4,6,0
MANORCARE HEALTH SERVICES-HUNTINGDON VALLEY,395913,3430 HUNTINGDON PIKE,HUNTINGDON VALLEY,Montgomery,43,17,20,8,93,6,9,0
CLIVEDEN NURSING AND REHABILITATION CENTER,395852,6400 GREENE STREET,PHILADELPHIA,Philadelphia,29,19,48,13,142,12,7,0
MONTICELLO HOUSE,395974,1048 W BALTIMORE AVENUE,MEDIA,Delaware,3,5,4,3,64,4,1,0
LGAR HEALTH AND REHABILITATION,395873,800 ELSIE STREET,TURTLE CREEK,Allegheny,27,4,20,7,75,12,0,0
"VILLAGE AT PENN STATE,  THE",396092,260 LION'S HILL ROAD,STATE COLLEGE,Centre,0,0,9,0,33,1,1,0
CEDAR HAVEN HEALTHCARE CENTER,395770,590 SOUTH FIFTH AVENUE,LEBANON,Lebanon,44,48,38,13,236,39,68,0
MANCHESTER COMMONS OF PRESBYTERIAN SENIORCARE,395996,6351 WEST LAKE ROAD,ERIE,Erie,6,19,14,0,73,8,16,0
"GROVE AT LATROBE, THE",395892,576 FRED ROGERS DRIVE,LATROBE,Westmoreland,34,0,25,8,96,16,1,0
FOX SUBACUTE AT MECHANICSBURG,396122,120 SOUTH FILBERT ST,MECHANICSBURG,Cumberland,0,0,2,0,48,2,0,0
WHITESTONE CARE CENTER,396130,370 WHITE STONE CORNER ROAD,STROUDSBURG,Monroe,54,0,29,21,42,17,0,0
MAPLEWOOD NURSING AND REHAB  CENTER,395865,125 W SCHOOLHOUSE LANE,PHILADELPHIA,Philadelphia,18,35,22,18,121,7,6,0
WYNDMOOR HILLS REHABILITATION AND NURSING CENTER,396115,8601 STENTON AVENUE,WYNDMOOR,Montgomery,42,3,7,6,60,19,0,0
SPIRITRUST LUTHERAN THE VILLAGE AT UTZ TERRACE,396111,2100 UTZ TERRACE,HANOVER,York,0,0,4,0,34,6,15,0
SHENANGO PRESBYTERIAN SENIORCARE,396105,238 SOUTH MARKET STREET,NEW WILMINGTON,Lawrence,0,0,12,0,30,0,3,0
PLEASANT VIEW COMMUNITIES,395786,544 NORTH PENRYN ROAD,MANHEIM,Lancaster,0,3,14,0,89,4,7,0
HRH TRANSITIONAL CARE UNIT(A D/B/A ENTITY OF HRHS),395861,1648 HUNTINGDON PIKE,MEADOWBROOK,Montgomery,4,12,1,1,19,3,0,0
EPHRATA MANOR,395857,99 BETHANY ROAD,EPHRATA,Lancaster,17,9,19,4,105,22,25,0
SUNSET RIDGE HEALTHCARE AND REHABILITATION CENTER,395953,3298 RIDGE ROAD,BLOOMSBURG,Columbia,0,69,16,0,60,0,0,0
TOWNVIEW HEALTH AND REHABILITATION CENTER,395823,300 BARR STREET,CANONSBURG,Washington,0,0,6,0,98,0,0,0
EMMANUEL CENTER FOR NURSING,395824,600 SCHOOL HOUSE ROAD,DANVILLE,Montour,0,4,10,0,83,0,1,0
"GARDENS AT MILLVILLE, THE",395872,"P.O. BOX 320,  48 HAVEN LANE",MILLVILLE,Columbia,0,3,7,0,92,0,4,0
KITTANNING CARE CENTER,395986,120 KITTANNING CARE DRIVE,KITTANNING,Armstrong,1,2,11,0,94,1,2,0
DARWAY HEALTHCARE AND  REHABILITATION CENTER,395909,5865 ROUTE 154,FORKSVILLE,Sullivan,0,2,7,0,45,0,0,0
NAAMANS CREEK COUNTRY MANOR,395952,1194 NAAMANS CREEK ROAD,BOOTHWYN,Delaware,39,14,20,10,55,12,5,0
MT HOPE NAZARENE RETIREMENT COMMUNITY,396119,3026 MOUNT HOPE HOME ROAD,MANHEIM,Lancaster,23,10,16,13,39,11,3,0
LONGWOOD AT OAKMONT,395882,500 ROUTE 909,VERONA,Allegheny,6,2,17,0,59,3,4,0
"VALLEY VIEW HAVEN, INC",395787,4702 EAST MAIN STREET,BELLEVILLE,Mifflin,0,0,3,0,139,3,3,0
WESTON REHABILITATION & NURSING CENTER,396024,1896 LEITHSVILLE ROAD,HELLERTOWN,Northampton,0,0,0,0,19,0,0,0
"HEALTH CENTER AT THE HILL AT WHITEMARSH, THE",396113,4000 FOX HOUND DRIVE,LAFAYETTE HILL,Montgomery,0,0,6,1,30,7,0,0
TWIN PINES HEALTH CARE CENTER,396114,315 EAST LONDON GROVE ROAD,WEST GROVE,Chester,4,3,20,0,109,8,6,0
COUNTRY MEADOWS NURSING CENTER OF BETHLEHEM,396053,4025 GREEN POND ROAD,BETHLEHEM,Northampton,26,5,44,18,45,20,2,0
ARTMAN LUTHERAN HOME,395922,250 NORTH BETHLEHEM PIKE,AMBLER,Montgomery,,,,,,,,
HOMETOWN NURSING AND REHAB CEN,395875,149 LAFAYETTE AVENUE,TAMAQUA,Schuylkill,1,27,42,1,120,3,17,0
HARSTON HALL,395791,350 HAWS LANE,FLOURTOWN,Montgomery,65,9,27,17,74,23,2,0
LEHIGH VALLEY HOSPITAL TSU,395951,17TH & CHEW STS,ALLENTOWN,Lehigh,8,2,0,0,24,5,0,0
MEADVILLE MEDICAL CTR TCU,395894,1034 GROVE STREET,MEADVILLE,Crawford,0,0,0,0,16,0,2,0
JUNIPER VILLAGE AT BUCKS COUNTY REHAB AND SKD CARE,395864,3200 BENSALEM BOULEVARD,BENSALEM,Bucks,0,0,3,1,15,0,0,0
SPIRITRUST LUTHERAN THE VILLAGE AT LUTHER RIDGE,396146,2781 LUTHER DRIVE,CHAMBERSBURG,Adams,1,0,11,0,18,7,1,0
CONCORDIA AT THE CEDARS,396059,4363 NORTHERN PIKE,MONROEVILLE,Allegheny,1,0,13,0,54,1,0,0
"ORCHARD MANOR, INC",395793,20 ORCHARD DRIVE,GROVE CITY,Mercer,13,0,7,0,96,3,0,0
SUBURBAN WOODS HEALTH & REHA,395912,2751 DEKALB PIKE,NORRISTOWN,Montgomery,59,20,19,12,83,17,20,0
GINO J MERLI VETERANS CENTER,39A433,401 PENN AVENUE,SCRANTON,Lackawanna,2,14,12,0,159,1,35,0
LAKEVIEW HEALTHCARE AND REHABILITATION CENTER,395867,15 WEST WILLOW STREET,SMETHPORT,McKean,0,0,0,0,25,0,0,0
"CARING PLACE, THE",395959,103 N. THIRTEENTH STREET,FRANKLIN,Venango,0,0,5,0,77,0,0,0
PENNSYLVANIA SOLDIERS AND SAILORS HOME,39A434,PO BOX 6239,ERIE,Erie,0,0,0,0,92,1,2,0
FOX SUBACUTE AT SOUTH PHILADELPHIA,396141,1930 SOUTH BROAD STREET,PHILADELPHIA,Philadelphia,0,120,1,0,39,0,0,0
"LAFAYETTE MANOR, INC",395795,147 LAFAYETTE MANOR ROAD,UNIONTOWN,Fayette,0,0,8,0,85,0,2,0
CONCORDIA OF THE SOUTH HILLS,396089,1300 BOWER HILL ROAD,PITTSBURGH,Allegheny,0,0,13,0,45,2,0,0
QUALITY LIFE SERVICES - MERCER,395879,8221 LAMOR ROAD,MERCER,Mercer,25,0,6,0,34,24,21,0
HARMONY PHYSICAL REHABILITATION,396138,4365 NORTHERN PIKE,MONROEVILLE,Allegheny,0,0,6,0,22,0,0,0
MEADOW VIEW NURSING CENTER,395830,1404 HAY STREET,BERLIN,Somerset,0,0,0,0,119,1,0,0
THE WATERMARK AT BELLINGHAM PARK LANE,396082,1615 EAST BOOT ROAD  EAST GOSHEN,WEST CHESTER,Chester,1,14,10,1,31,4,15,0
PHOEBE BERKS,395880,1 HEIDELBERG DRIVE,WERNERSVILLE,Berks,36,5,25,9,94,21,21,0
GREEN VALLEY SKILLED NURSING AND REHABILITATION CE,396086,1 MATTHEW DRIVE,POTTSVILLE,Schuylkill,5,0,1,1,31,1,0,0
BRINTON MANOR NURSING AND REHABILITATION CENTER,395917,549 BALTIMORE PIKE,GLEN MILLS,Delaware,57,9,17,13,56,20,2,0
"PATRIOT, A CHOICE COMMUNITY THE",395840,495 WEST PATRIOT STREET,SOMERSET,Somerset,0,8,23,0,69,6,11,0
BLOOMSBURG CARE CENTER AND REHABILITATION CENTER,396065,211 EAST FIRST STREET,BLOOMSBURG,Columbia,10,17,3,3,94,16,51,0
MASONIC VILLAGE AT WARMINSTER,396054,850 NORRISTOWN ROAD,WARMINSTER,Bucks,13,1,18,7,32,11,0,0
"BRADFORD ECUMENICAL HOME, INC",395908,100 SAINT FRANCIS DRIVE,BRADFORD,McKean,0,0,12,0,92,0,0,0
GARDEN SPOT VILLAGE,396079,433 S KINZER AVENUE,NEW HOLLAND,Lancaster,0,42,14,0,72,14,10,0
MAPLE FARM,396128,604 OAK STREET,AKRON,Lancaster,3,0,8,0,43,3,2,0
ALLIED SERVICES TRANSITIONAL REHAB UNIT,396135,475 MORGAN HIGHWAY,SCRANTON,Lackawanna,0,2,0,0,25,1,2,0
RIDGEVIEW HEALTHCARE & REHAB CENTER,395929,200 PENNSYLVANIA AVENUE,SHENANDOAH,Schuylkill,0,0,0,0,100,1,0,0
TITUSVILLE HEALTHCARE AND REHABILITATION CENTER,395901,81 DILLON DRIVE,TITUSVILLE,Crawford,0,19,14,0,57,0,2,0
KINKORA PYTHIAN HOME,395915,25 COVE ROAD,DUNCANNON,Perry,0,0,13,0,43,0,0,0
CAMBRIA CARE CENTER,395828,429 MANOR DRIVE,EBENSBURG,Cambria,54,33,255,0,235,47,90,0
CARE PAVILION NURSING AND REHABILITATION CENTER,395893,6212 WALNUT STREET,PHILADELPHIA,Philadelphia,158,22,96,28,302,63,16,2
QUADRANGLE,395801,3300 DARBY ROAD,HAVERFORD,Delaware,30,4,26,26,31,11,1,0
DELAWARE VALLEY VETERAN'S HOME,39A436,2701 SOUTHAMPTON RD,PHILADELPHIA,Philadelphia,32,22,22,13,90,19,28,0
CUMBERLAND CROSSINGS RETIREMENT COMMUNITY,395876,1 LONGSDORF WAY,CARLISLE,Cumberland,,,,,,,,
AVALON PLACE,396075,3410 W. PITTSBURGH RD,NEW CASTLE,Lawrence,17,0,8,2,63,11,1,0
GOOD SHEPHERD HOME-BETHLEHEM,396108,2855 SCHOENERSVILLE ROAD,BETHLEHEM,Lehigh,0,5,12,0,58,1,7,0
REHABILITATION CENTER AT BRETHREN VILLAGE LLC,396140,3001 LITITZ PIKE,LANCASTER,Lancaster,0,1,1,0,15,0,0,0
SHOOK HOME THE,395918,55 SOUTH SECOND STREET,CHAMBERSBURG,Franklin,41,5,33,19,47,15,20,0
BELLE REVE HEALTH CARE CENTER,396080,404 EAST HARFORD STREET,MILFORD,Pike,0,0,0,0,0,0,0,0
VINCENTIAN DE MARILLAC,395842,5300 STANTON AVENUE,PITTSBURGH,Allegheny,0,0,9,0,41,0,7,0
REHAB AT SHANNONDELL,396101,5000 SHANNONDELL DRIVE,AUDUBON,Montgomery,3,0,4,4,48,11,0,0
FORESTVIEW,395907,2301 EDINBORO ROAD,ERIE,Erie,0,0,15,0,75,0,27,0
REDSTONE HIGHLANDS HEALTH CARE,396021,6 GARDEN CENTER DRIVE,GREENSBURG,Westmoreland,0,17,18,0,58,1,31,0
KADIMA REHABILITATION & NURSING AT CAMPBELLTOWN,395846,2880 HORSESHOE PIKE  PO BOX 137,PALMYRA,Lebanon,0,0,0,0,51,1,2,0
QUALITY LIFE SERVICES - HENRY CLAY,395906,5253 NATIONAL PIKE,MARKLEYSBURG,Fayette,0,0,0,0,73,8,12,0
EMBASSY OF HEARTHSIDE,395868,450 WAUPELANI DRIVE,STATE COLLEGE,Centre,0,2,19,0,129,0,2,0
SOUTHEASTERN PENNSYLVANIA VETERAN'S CENTER,39A435,ONE VETERANS DRIVE,SPRING CITY,Chester,23,114,21,3,148,5,7,0
FAIRMOUNT HOMES,395805,333 WHEAT RIDGE DRIVE,EPHRATA,Lancaster,35,19,27,11,75,29,9,0
GLEN AT WILLOW VALLEY,395956,675 WILLOW VALLEY SQUARE,LANCASTER,Lancaster,33,6,22,11,187,27,9,0
MASONIC VILLAGE AT LAFAYETTE HILL,395818,801 RIDGE PIKE,LAFAYETTE HILL,Montgomery,1,13,6,2,49,5,6,1
MISERICORDIA NURSING & REHABILITATION CENTER,395998,998 SOUTH RUSSELL STREET,YORK,York,0,1,5,0,44,1,0,0
CARING HEART REHABILITATION AND NURSING CENTER,395819,6445 GERMANTOWN AVENUE,PHILADELPHIA,Philadelphia,13,1,26,6,236,32,2,0
KADIMA REHABILITATION & NURSING AT POTTSTOWN,395827,3031 CHESTNUT HILL ROAD,POTTSTOWN,Montgomery,0,1,6,0,36,0,0,0
"MAPLE WINDS HEALTHCARE AND REHABILITATION, LLC",396088,4112 SPRING HILL ROAD,PORTAGE,Cambria,0,0,6,0,44,0,4,0
"GARDENS AT ORANGEVILLE, THE",395899,200 BERWICK ROAD,ORANGEVILLE,Columbia,22,2,12,9,98,3,0,0
CRANBERRY PLACE,395845,5 SAINT FRANCIS WAY,CRANBERRY TOWNSHIP,Butler,1,0,4,0,79,1,2,0
ALLIED SERVICES SKILLED NURSING CENTER,396074,303 SMALLACOMBE DRIVE,SCRANTON,Lackawanna,87,10,29,14,233,20,16,0
MORAVIAN VILLAGE OF BETHLEHEM,396096,634 EAST BROAD STREET,BETHLEHEM,Northampton,21,19,11,8,36,23,42,0
FAIR ACRES GERIATRIC CENTER,395780,340 N. MIDDLETOWN ROAD,LIMA,Delaware,248,48,175,77,465,112,58,0
FOX SUBACUTE AT CLARA BURKE,395847,251 STENTON AVENUE,PLYMOUTH MEETING,Montgomery,0,0,6,0,47,0,0,0
BERKSHIRE CENTER,395938,5501 PERKIOMEN AVENUE,READING,Berks,75,1,55,27,99,20,2,0
"NORTH STRABANE REHABILITATION AND WELLNESS CTR, LL",396073,100 TANDEM VILLAGE ROAD,CANONSBURG,Washington,0,0,0,0,58,0,0,0
"LUTHERAN HOME AT KANE, THE",395816,100 HIGH POINT DRIVE,KANE,McKean,0,0,10,0,75,0,0,0
REHAB & NURSING CTR GREATER PITTSBURGH,395851,890 WEATHERWOOD LANE,GREENSBURG,Westmoreland,2,3,15,0,102,1,6,0
BARCLAY FRIENDS,395848,700 NORTH FRANKLIN,WEST CHESTER,Chester,37,9,39,18,63,15,5,0
HORSHAM CENTER FOR JEWISH LIFE,396078,1425 HORSHAM ROAD,NORTH WALES,Montgomery,8,8,63,14,289,10,1,0
CENTRE CREST,395779,502 EAST HOWARD STREET,BELLEFONTE,Centre,6,21,0,0,215,24,10,0
UPMC MAGEE-WOMENS HOSPITAL TCU,396098,300 HALKET STREET,PITTSBURGH,Allegheny,0,0,0,0,13,2,0,0
MANORCARE HEALTH SERVICES-OXFORD VALLEY,395817,1480 OXFORD VALLEY ROAD,YARDLEY,Bucks,2,38,20,1,114,5,7,0
ORWIGSBURG NURSING AND REHABILITATION  CENTER,395878,1000 ORWIGSBURG MANOR DR,ORWIGSBURG,Schuylkill,1,44,12,0,92,1,19,0
MANORCARE HEALTH SERVICES-WHITEHALL BOROUGH,396066,505 WEYMAN ROAD,PITTSBURGH,Allegheny,1,19,13,0,124,20,5,0
PENN STATE HEALTH TRANSITIONAL CARE,396134,1135 WEST CHOCOLATE AVENUE 2ND FLOOR,HUMMELSTOWN,Dauphin,0,0,0,0,19,0,0,0
