Provider Name,Federal Provider Number,Provider Address,Provider City,County,Residents Total Confirmed COVID-19,Residents Total Suspected COVID-19,Residents Total All Deaths,Residents Total COVID-19 Deaths,Total Number of Occupied Beds,Staff Total Confirmed COVID-19,Staff Total Suspected COVID-19,Staff Total COVID-19 Deaths
LIGHTHOUSE REHABILITATION & HEALTHCARE CENTER,015413,2911 EARL GOODWIN PARKWAY,SELMA,Dallas,22,13,8,3,60,19,6,0
SHELBY RIDGE NURSING HOME,015411,881 3RD STREET NORTHEAST,ALABASTER,Shelby,56,68,45,13,120,35,68,0
ALTOONA  HEALTH & REHAB,015101,6532 WALNUT GROVE ROAD,ALTOONA,Etowah,34,3,5,5,45,33,1,0
GADSDEN HEALTH AND REHAB CENTER,015180,1945 DAVIS DRIVE,GADSDEN,Etowah,81,108,28,16,118,56,16,1
FALKVILLE HEALTH CARE CENTER,015136,10 WEST 3RD STREET  PO BOX 409,FALKVILLE,Morgan,70,21,16,10,74,33,22,0
ORCHARD REHABILITATION & HEALTHCARE CENTER,015442,629 STATE HIGHWAY 21 SOUTH,HAYNEVILLE,Lowndes,10,0,4,4,52,25,0,0
DIVERSICARE OF MONTGOMERY,015040,2020 NORTH COUNTRY CLUB DRIVE,MONTGOMERY,Montgomery,66,1,14,11,82,30,15,0
ALBERTVILLE NURSING HOME,015163,750 ALABAMA HIGHWAY 75 NORTH,ALBERTVILLE,Marshall,67,37,36,13,153,60,31,0
DIVERSICARE OF PELL CITY,015189,"510 WOLF CREEK ROAD, NORTH",PELL CITY,St. Clair,83,2,24,17,60,42,3,0
"TALLASSEE HEALTH AND REHABILITATION, LLC",015139,2639 GILMER AVENUE  P O BOX 780277,TALLASSEE,Elmore,3,1,23,0,85,13,8,0
MOBILE NURSING AND REHABILITATION CENTER,015379,7020 BRUNS DRIVE,MOBILE,Mobile,39,17,5,3,88,29,11,0
BARFIELD HEALTH CARE,015225,22444 HIGHWAY 431,GUNTERSVILLE,Marshall,23,20,44,6,86,13,49,0
DIVERSICARE OF OXFORD,015132,1130 SOUTH HALE STREET,OXFORD,Calhoun,82,0,18,11,111,32,0,0
"CRIMSON HEALTH AND REHAB, LLC",015037,3312 WOODLEY ROAD,MONTGOMERY,Montgomery,3,0,2,0,47,13,0,0
MONTGOMERY CHILDREN'S SPECIALTY CENTER,01A208,2853 FORBES DRIVE,MONTGOMERY,Montgomery,7,0,0,0,46,15,1,0
"HUNTER CREEK HEALTH AND REHABILITATION, LLC",015034,600 34TH ST,NORTHPORT,Tuscaloosa,43,6,16,4,70,14,8,0
MAGNOLIA RIDGE,015133,420 DEAN DRIVE,GARDENDALE,Jefferson,26,1,12,0,123,17,0,0
JACKSON HEALTH CARE FACILITY,015188,2616 NORTH COLLEGE AVENUE,JACKSON,Clarke,0,10,23,0,67,11,25,0
"LUVERNE HEALTH AND REHABILITATION, LLC",015336,142 WEST THIRD STREET,LUVERNE,Crenshaw,80,16,41,17,119,54,28,0
WILLOWBROOKE CT SKILLED CARE CTR WESTMINSTER VLG,015381,500 SPANISH FORT BLVD,SPANISH FORT,Baldwin,9,0,11,1,34,17,2,0
"RIDGEVIEW HEALTH SERVICES, INC",015155,"907 11TH STREET, NE",JASPER,Walker,106,48,51,20,91,92,71,0
"ASHLAND PLACE HEALTH AND REHABILITATION, LLC",015103,148 TUSCALOOSA ST,MOBILE,Mobile,82,19,42,21,116,28,5,0
ASPIRE PHYSICAL RECOVERY CENTER OF WEST ALABAMA,015465,2400 HOSPITAL DRIVE,NORTHPORT,Tuscaloosa,3,0,6,0,64,9,12,0
PERRY COUNTY NURSING HOME,015158,505 EAST LAFAYETTE STREET,MARION,Perry,37,1,6,2,56,34,12,0
BARON HOUSE OF HUEYTOWN,015404,190 BROOKLANE DRIVE,HUEYTOWN,Jefferson,13,0,21,12,30,26,23,0
MADISON MANOR NURSING HOME,015214,3891 SULLIVAN ST,MADISON,Madison,0,7,12,0,64,6,21,0
CUMBERLAND HEALTH AND REHAB,015420,47065 AL HIGHWAY 277,BRIDGEPORT,Jackson,5,0,7,0,76,12,13,0
COOSA VALLEY HEALTH AND REHAB,015174,513 PINEVIEW AVENUE,GLENCOE,Etowah,55,60,14,9,88,35,35,0
OAKVIEW MANOR HEALTH CARE CENTER,015216,929 MIXON SCHOOL ROAD,OZARK,Dale,77,21,34,18,91,39,48,0
"ASPIRE PHYSICAL RECOVERY CENTER AT HOOVER, LLC",015464,575 SOUTHLAND DRIVE,HOOVER,Jefferson,10,17,25,0,76,14,25,0
HARTFORD HEALTH CARE,015419,217 TORO ROAD,HARTFORD,Geneva,9,1,1,0,80,7,1,0
"BURNS NURSING HOME, INC.",015009,701 MONROE STREET NW,RUSSELLVILLE,Franklin,47,2,6,5,51,41,14,0
"VALLEY VIEW HEALTH AND REHABILITATION, LLC",015431,5968 WALL TRIANA HIGHWAY,MADISON,Madison,13,3,18,1,142,20,16,0
LAFAYETTE EXTENDED CARE,015197,805 HOSPITAL STREET SOUTHWEST,LAFAYETTE,Chambers,0,1,8,1,54,1,1,0
SYLACAUGA HEALTH AND REHAB SERVICES,015160,1007 W FORT WILLIAMS ST,SYLACAUGA,Talladega,49,60,46,11,115,48,17,0
HATLEY HEALTH CARE INC,015023,300 MEDICAL CENTER DRIVE,CLANTON,Chilton,104,20,29,20,101,82,50,0
"JACKSONVILLE HEALTH AND REHABILITATION, LLC",015391,410 WILSON DRIVE SOUTHWEST,JACKSONVILLE,Calhoun,78,9,31,15,143,57,10,0
CYPRESS COVE CARE CENTER,015392,200 ALABAMA AVENUE,MUSCLE SHOALS,Colbert,28,7,12,0,71,22,8,0
"WALKER REHABILITATION CENTER, INC",015408,350 NORTHEAST 4TH STREET     P O BOX 30,CARBON HILL,Walker,18,8,4,4,44,30,4,0
CHOCTAW HEALTH AND REHAB,015164,1406 EAST PUSHMATAHA STREET,BUTLER,Choctaw,50,50,15,9,53,24,24,0
CANTERBURY HEALTH CARE FACILITY,015382,1720 KNOWLES ROAD,PHENIX CITY,Russell,21,0,15,5,96,23,0,0
HENDRIX HEALTH AND REHABILITATION,015138,1000 HIGHWAY 33,DOUBLE SPRINGS,Winston,48,9,25,3,95,21,21,0
CLEBURNE COUNTY NURSING HOME,015053,122 BROCKFORD ROAD,HEFLIN,Cleburne,,,,,,,,
"HUNTSVILLE HEALTH & REHABILITATION, LLC",015440,4010 CHRIS DRIVE,HUNTSVILLE,Madison,5,5,14,1,92,9,8,0
PLANTATION MANOR NURSING HOME,015015,6450 OLD TUSCALOOSA HIGHWAY   P O BOX 97,MC CALLA,Jefferson,0,0,8,0,87,1,0,0
EL REPOSO NURSING FACILITY,015402,260 MILNER CHAPEL ROAD,FLORENCE,Lauderdale,2,3,15,1,53,3,14,0
COLLINSVILLE HEALTHCARE & REHAB,015207,685 NORTH VALLEY AVE,COLLINSVILLE,DeKalb,4,24,19,0,160,19,38,1
PIEDMONT HEALTH CARE CENTER,015194,30 ROUNDTREE DRIVE,PIEDMONT,Calhoun,38,4,25,11,57,15,10,0
AZALEA GARDENS OF MOBILE,015151,1758 SPRINGHILL AVE,MOBILE,Mobile,29,3,9,1,85,20,5,0
EXTENDICARE HEALTH CENTER,015152,950 SOUTH ST. ANDREWS STREET,DOTHAN,Houston,60,71,49,14,120,60,91,0
ALICEVILLE MANOR NURSING HOME,015137,703 17TH STREET NORTHWEST,ALICEVILLE,Pickens,15,25,6,2,73,19,27,0
CHARLTON PLACE REHAB AND HEALTHCARE CENTER,015460,65 CHARLTON PLACE,DEATSVILLE,Elmore,6,1,0,0,56,15,2,0
DIVERSICARE OF ONEONTA,015159,215 VALLEY ROAD,ONEONTA,Blount,28,1,13,0,106,49,7,1
MARION REGIONAL NURSING HOME,015167,184 SASSER DRIVE,HAMILTON,Marion,34,37,23,7,56,35,59,1
"PALM GARDENS HEALTH AND REHABILITATION, LLC",015403,3104 DAUPHIN SQUARE CONNECTOR,MOBILE,Mobile,41,5,28,7,68,34,6,0
TRUSSVILLE HEALTH & REHABILITATION CENTER,015467,119 WATTERSON PARKWAY,TRUSSVILLE,Jefferson,25,3,20,6,86,11,12,0
ATHENS HEALTH AND REHABILITATION LLC,015016,611 WEST MARKET STREET,ATHENS,Limestone,3,8,41,0,119,15,25,0
FAIRVIEW AT REDSTONE VILLAGE,015454,12000 TURNMEYER DRIVE,HUNTSVILLE,Madison,6,2,8,0,46,6,16,0
NORTHSIDE HEALTH CARE,015223,700 HUTCHINS AVENUE,GADSDEN,Etowah,34,4,4,1,82,40,8,0
WESTSIDE TERRACE HEALTH & REHABILITATION CENTER,015425,501 NORTH WOODBURN DRIVE,DOTHAN,Houston,6,13,13,0,151,16,24,0
MONROE MANOR HEALTH & REHABILITATION CENTER,015398,236 WEST CLAIBORNE STREET,MONROEVILLE,Monroe,54,14,7,5,66,55,24,0
WASHINGTON COUNTY NURSING HOME,015123,14600 ST STEPHENS AVENUE,CHATOM,Washington,24,21,11,4,78,24,16,1
SUMMERFORD NURSING HOME INC,015075,4087 HIGHWAY 31 SOUTHWEST,FALKVILLE,Morgan,9,27,41,0,190,23,117,0
"PHENIX CITY HEALTH CARE, INC",015331,3900 LAKEWOOD DRIVE,PHENIX CITY,Russell,0,0,9,0,71,16,1,0
GREENE COUNTY NURSING HOME,015178,509 WILSON AVE,EUTAW,Greene,22,0,12,12,36,4,0,0
ASPIRE PHYSICAL RECOVERY CENTER AT CAHABA RIVER,015468,3070 HEALTHY WAY,VESTAVIA,Jefferson,8,8,24,0,101,13,3,0
GALLERIA WOODS SKILLED NURSING FACILITY,015459,3850 GALLERIA WOODS DRIVE,BIRMINGHAM,Jefferson,0,1,2,0,30,5,0,0
CROWNE HEALTH CARE OF FT PAYNE,015156,403 13TH STREET NORTHWEST,FORT PAYNE,DeKalb,27,0,8,2,96,29,5,1
"CORDOVA HEALTH AND REHABILITATION, LLC",015115,70 HIGHLAND STREET WEST,CORDOVA,Walker,14,5,26,3,100,14,23,0
"SOUTH HAVEN HEALTH AND REHABILITATION, LLC",015321,3141 OLD COLUMBIANA ROAD,BIRMINGHAM,Jefferson,60,18,28,18,77,45,2,0
ATTALLA HEALTH AND REHAB,015203,915 STEWART AVENUE SOUTHEAST,ATTALLA,Etowah,43,0,17,7,84,87,13,0
"MONTGOMERY HEALTH AND REHAB, LLC",015228,4490 VIRGINIA LOOP ROAD,MONTGOMERY,Montgomery,26,3,7,1,81,25,14,0
WINDSOR HOUSE,015397,4411 MCALLISTER DRIVE,HUNTSVILLE,Madison,28,0,8,0,99,39,1,0
CAPITOL HILL HEALTHCARE CENTER,015390,520 SOUTH HULL STREET,MONTGOMERY,Montgomery,64,33,39,16,199,33,28,1
SANCTUARY AT THE WOODLANDS,015471,1910 CHEROKEE  AVENUE SW,CULLMAN,Cullman,,,,,,,,
LAUDERDALE CHRISTIAN NURSING HOME,015361,2019 COUNTY ROAD 394,KILLEN,Lauderdale,10,7,10,0,56,7,12,0
ENGLEWOOD HEALTH CARE CENTER,015322,2046 SOUTH ALABAMA AVE,MONROEVILLE,Monroe,25,5,14,3,71,21,9,0
MERRY WOOD LODGE,015019,P O BOX 130,ELMORE,Elmore,55,41,19,5,79,53,14,0
"NHC HEALTHCARE, MOULTON",015128,300 HOSPITAL STREET,MOULTON,Lawrence,70,1,27,24,87,50,2,0
DIVERSICARE OF FOLEY,015032,1701 NORTH ALSTON STREET,FOLEY,Baldwin,54,1,11,8,94,76,8,1
SELF HEALTH CARE & REHAB CENTER INC,015212,131 EAST CREST ROAD,HUEYTOWN,Jefferson,2,1,13,0,58,6,6,0
MITCHELL-HOLLINGSWORTH NURSING & REHABILITATION,015031,805 FLAGG CIRCLE,FLORENCE,Lauderdale,12,53,33,0,162,31,106,0
EVERGREEN NURSING HOME,015089,100 SANDERS DRIVE,EVERGREEN,Conecuh,41,0,8,6,47,23,0,0
OAKS ON PARKWOOD SKILLED NURSING FACILITY,015369,2625 LAUREL OAK DRIVE,BESSEMER,Jefferson,10,0,51,1,118,13,7,0
FATHER PURCELL MEMORIAL EXCEPTIONAL CHILDREN'S CTR,01A193,2048 W FAIRVIEW AVE,MONTGOMERY,Montgomery,11,0,0,0,49,12,0,0
"FOLSOM CENTER FOR REHABILITATION AND HEALTHCARE, T",015437,401 ARNOLD STREET N.E.,CULLMAN,Cullman,7,32,24,0,78,13,79,2
ATMORE NURSING CENTER,015129,715 EAST LAUREL STREET,ATMORE,Escambia,38,3,16,7,76,23,9,0
DIVERSICARE OF WINFIELD,015376,144 COUNTY HWY 14,WINFIELD,Marion,72,17,28,15,99,39,19,1
BROOKSHIRE HEALTHCARE CENTER,015127,4320 JUDITH LANE,HUNTSVILLE,Madison,39,1,10,4,101,15,7,0
NORTH MOBILE NURSING AND REHABILITATION CTR,015183,4525 ST STEPHENS ROAD,EIGHT MILE,Mobile,45,36,27,13,128,39,26,0
CLAY COUNTY NURSING HOME,015124,83825 HIGHWAY 9   P O BOX 1270,ASHLAND,Clay,59,22,17,13,57,27,37,1
OAK PARK,015452,1365 GATEWOOD DRIVE,AUBURN,Lee,8,14,7,0,76,4,22,0
LEGACY HEALTH AND REHABILITATION OF PLEASANT GROVE,015461,30 7TH STREET,PLEASANT GROVE,Jefferson,3,32,16,0,123,7,12,1
ANNISTON HEALTH AND REHAB SERVICES,015375,600 E 8TH STREET,ANNISTON,Calhoun,1,0,8,0,59,11,0,0
SENIOR REHAB & RECOVERY AT LIMESTONE HEALTH FACILI,015024,1600 WEST HOBBS STREET,ATHENS,Limestone,80,61,56,11,113,37,47,0
FAIRHOPE HEALTH & REHAB,015222,108 SOUTH CHURCH STREET,FAIRHOPE,Baldwin,3,4,0,0,61,15,0,0
TRAYLOR RETIREMENT COMMUNITY,015126,1235 YANCEY STREET  P O BOX 467,ROANOKE,Randolph,48,0,17,7,85,27,8,0
FLORALA HEALTH AND REHABILITATION LLC,015451,23621 GOLDENROD AVENUE,FLORALA,Covington,7,1,12,1,72,10,11,0
"HANCEVILLE NURSING & REHAB CENTER, INC",015073,420 MAIN STREET NE,HANCEVILLE,Cullman,27,25,20,3,183,17,21,0
WEST GATE VILLAGE,015035,100 PINEVIEW AND THIRD P.O. BOX 49,BREWTON,Escambia,68,11,11,8,98,42,15,0
TROY HEALTH & REHABILITATION CENTER,015213,515 ELBA HIGHWAY,TROY,Pike,25,45,16,3,134,18,35,0
WIREGRASS REHABILITATION CENTER & NURSING HOME,015150,1200 MAPLE AVENUE WEST,GENEVA,Geneva,32,3,18,6,83,38,28,0
"GEORGIANA HEALTH AND REHABILITATION, LLC",015182,206 PALMER AVENUE,GEORGIANA,Butler,29,1,14,2,80,10,4,0
ST MARTIN'S IN THE PINES,015433,4941 MONTEVALLO ROAD,BIRMINGHAM,Jefferson,14,0,21,0,89,24,0,0
"COLUMBIANA HEALTH AND REHABILITATION, LLC",015453,22969 HIGHWAY 25,COLUMBIANA,Shelby,50,18,30,10,47,46,14,0
ARLINGTON REHABILITATION & HEALTHCARE CENTER,015153,"1020 TUSCALOOSA AVENUE, SW",BIRMINGHAM,Jefferson,76,0,23,15,87,53,3,0
BIRMINGHAM NURSING AND REHABILITATION CENTER EAST,015134,733 MARY VANN LANE,BIRMINGHAM,Jefferson,6,0,6,0,117,22,0,0
DIVERSICARE OF LANETT,015196,702 SOUTH 13TH STREET,LANETT,Chambers,9,1,37,0,76,17,6,0
WILLOWBROOKE CT SKILLED CARE CTR AT MAGNOLIA TRACE,015450,ONE CROWN CIRCLE,HUNTSVILLE,Madison,4,0,8,1,40,9,0,0
DADEVILLE HEALTHCARE CENTER,015166,351 NORTH EAST STREET,DADEVILLE,Tallapoosa,54,2,19,8,89,20,1,0
MOUNT ROYAL TOWERS,015455,300 ROYAL TOWER DRIVE,BIRMINGHAM,Jefferson,1,1,11,0,113,9,7,0
TWIN OAKS REHABILITATION AND HEALTHCARE CENTER,015211,857 CRAWFORD LANE,MOBILE,Mobile,91,2,16,11,89,71,7,0
ADAMS NURSING HOME,015386,1555 HILLABEE STREET,ALEXANDER CITY,Tallapoosa,0,5,4,0,56,3,7,0
GOODWATER HEALTHCARE CENTER,015204,16 JONES HILL ROAD,GOODWATER,Coosa,0,0,4,0,64,1,0,0
EAST GLEN,015388,53 MEDICAL PARK DRIVE EAST,BIRMINGHAM,Jefferson,3,0,4,0,101,13,5,0
"TERRACE MANOR NURSING & REHABILITATION CENTER, INC",015066,390 UNDERWOOD ROAD,RUSSELLVILLE,Franklin,0,3,4,0,49,6,25,0
SOUTHLAND NURSING HOME,015104,500 SHIVERS TERRACE,MARION,Perry,,,,,,,,
SUNSET MANOR,015149,251 SUNSET PLACE,GUIN,Marion,2,8,6,0,64,4,6,0
"GENERATIONS OF RED BAY, LLC",015201,106 TENTH AVENUE NORTHWEST,RED BAY,Franklin,3,15,9,0,59,5,60,0
WEST HILL HEALTH AND REHAB,015303,1028 BESSEMER RD,BIRMINGHAM,Jefferson,61,1,12,1,62,25,0,0
LITTLE SISTERS OF THE POOR SACRED HEART RESIDENCE,015168,1655 MCGILL AVENUE,MOBILE,Mobile,25,1,8,2,59,50,1,0
HIGHLANDS HEALTH AND REHAB,015012,380 WOODS COVE ROAD,SCOTTSBORO,Jackson,2,34,13,0,38,8,37,0
CAMDEN NURSING FACILITY INC.,015374,210 PONDEROSA DRIVE,CAMDEN,Wilcox,30,4,11,6,49,36,13,0
SOUTH HAMPTON NURSING & REHABILITATION CENTER,015448,213 WILSON MANN ROAD,OWENS CROSS ROADS,Madison,0,1,3,0,56,3,6,0
EAMC LANIER NURSING HOME,015045,4800 48TH STREET,VALLEY,Chambers,1,42,19,1,85,16,82,0
CROWNE HEALTH CARE OF THOMASVILLE,015220,1425 MOSLEY DRIVE,THOMASVILLE,Clarke,4,1,9,0,69,14,0,0
REGENCY HEALTH CARE AND REHABILITATION CENTER,015372,"2061 POOLE DRIVE, NW",HUNTSVILLE,Madison,2,4,1,0,85,2,2,0
ARBOR WOODS HEALTH AND REHAB,015141,515 2ND AVENUE NORTHWEST,REFORM,Pickens,0,0,4,0,49,2,2,0
ALLEN HEALTH AND REHABILITATION,015098,735 SOUTH WASHINGTON AVENUE,MOBILE,Mobile,49,26,24,18,57,50,6,1
BROOKDALE UNIVERSITY PARK SNF (AL),015423,501 UNIVERSITY PARK DRIVE,BIRMINGHAM,Jefferson,5,2,24,0,43,10,15,0
EASTERN SHORE REHABILITATION AND HEALTH CENTER,015049,"101 VILLA DRIVE, P O BOX 1090",DAPHNE,Baldwin,16,39,31,1,71,16,16,0
DIVERSICARE OF RIVERCHASE,015145,2500 RIVERHAVEN DRIVE,BIRMINGHAM,Jefferson,62,26,16,13,93,39,11,0
CULLMAN HEALTH CARE CENTER,015048,1607 MAIN AVE NE,CULLMAN,Cullman,0,0,7,0,73,4,72,0
FAYETTE MEDICAL CENTER LONG TERM CARE UNIT,015154,1653 TEMPLE AVENUE NORTH,FAYETTE,Fayette,14,28,14,3,91,26,34,0
"MOUNDVILLE HEALTH AND REHABILITATION, LLC",015187,THIRD AVENUE    P O BOX 607,MOUNDVILLE,Hale,0,7,20,0,58,9,14,0
PARK PLACE,015084,100 PARK PLACE,SELMA,Dallas,46,0,12,12,82,50,1,0
HERITAGE HEALTH CARE & REHAB INC,015371,1101 SNOWS MILL AVENUE,TUSCALOOSA,Tuscaloosa,7,31,27,3,143,19,24,0
SHADESCREST HEALTH CARE CENTER,015114,331 WEST 25TH STREET,JASPER,Walker,47,9,14,5,79,36,50,0
KNOLLWOOD HEALTHCARE,015463,3151-A KNOLLWOOD DRIVE,MOBILE,Mobile,26,18,16,14,61,51,35,0
MCGUFFEY HEALTH & REHABILITATION CENTER,015202,2301 RAINBOW DRIVE,GADSDEN,Etowah,25,27,36,1,146,22,67,0
CROWNE HEALTH CARE OF SPRINGHILL,015426,3712 DAUPHIN ST,MOBILE,Mobile,2,0,3,0,23,5,0,0
"PARK MANOR HEALTH AND REHABILITATION, LLC",015326,2201 MCFARLAND BOULEVARD,NORTHPORT,Tuscaloosa,71,12,30,9,116,42,27,0
"OPP HEALTH AND REHABILITATION, LLC",015210,115 PAULK AVENUE  P O BOX 730,OPP,Covington,89,14,46,21,138,48,15,0
FAIR HAVEN,015076,1424 MONTCLAIR ROAD,BIRMINGHAM,Jefferson,38,1,46,4,202,27,2,0
"FLORENCE NURSING AND REHABILITATION CTR,  LLC",015169,2107 CLOYD BLVD,FLORENCE,Lauderdale,68,31,59,22,122,54,32,0
SIGNATURE HEALTHCARE OF WHITESBURG GARDENS,015116,105 TEAKWOOD DRIVE SW,HUNTSVILLE,Madison,78,2,26,8,85,60,0,0
ENTERPRISE HEALTH & REHABILITATION CENTER,015320,300 PLAZA DRIVE P O BOX 311227,ENTERPRISE,Coffee,28,0,49,0,170,54,32,0
"GULF COAST HEALTH AND REHABILITATION, LLC",015456,8002 GRELOT ROAD,MOBILE,Mobile,28,12,12,1,75,29,3,0
"PRATTVILLE HEALTH AND REHABILITATION, LLC",015065,601 JASMINE TRAIL,PRATTVILLE,Autauga,24,11,30,2,127,33,16,0
KENSINGTON HEALTH AND REHABILITATION,015429,550 CONGRESS STREET,MOBILE,Mobile,70,2,18,5,100,39,8,0
COOSA VALLEY HEALTHCARE CENTER,015010,260 WEST WALNUT STREET,SYLACAUGA,Talladega,7,33,2,2,64,9,42,0
"NORTHWAY HEALTH AND REHABILITATION, LLC",015047,1424 NORTH 25TH STREET,BIRMINGHAM,Jefferson,8,5,12,0,102,10,3,0
HENRY COUNTY HEALTH AND REHABILITATION FACILITY,015373,212 DOTHAN ROAD,ABBEVILLE,Henry,31,73,33,5,80,38,70,0
MEADOWVIEW NURSING CENTER,015400,7300 OLD HIGHWAY 78 EAST,PELL CITY,St. Clair,28,34,8,5,45,15,53,0
"CIVIC CENTER HEALTH AND REHABILITATION, LLC",015109,1201 22ND STREET NORTH,BIRMINGHAM,Jefferson,0,15,12,0,88,3,2,0
HILLVIEW TERRACE,015436,100 PERRY HILL RD,MONTGOMERY,Montgomery,52,7,43,12,127,42,0,0
GLENWOOD CENTER,015147,211 ANA DRIVE,FLORENCE,Lauderdale,10,7,21,0,102,9,24,0
"GENERATIONS OF VERNON, LLC",015227,1050 CONVALESCENT ROAD,VERNON,Lamar,13,13,4,0,111,24,39,0
"LINEVILLE HEALTH AND REHABILITATION, LLC",015142,88073 HIGHWAY 9,LINEVILLE,Clay,60,46,24,12,77,37,29,0
"CHAPMAN HEALTHCARE CENTER, INC",015221,3701 DADEVILLE ROAD,ALEXANDER CITY,Tallapoosa,6,0,16,1,146,6,0,0
RIVER CITY CENTER,015113,1350 FOURTEENTH AVENUE SOUTHEAST,DECATUR,Morgan,50,10,25,0,143,30,1,0
MARENGO NURSING HOME,015330,608 NORTH MAIN STREET,LINDEN,Marengo,2,3,8,0,59,8,8,0
"GRAND BAY CONVALESCENT HOME, INC.",015406,13750 HIGHWAY 90 WEST P.O. BOX 328,GRAND BAY,Mobile,1,2,10,0,64,12,0,0
"NHC HEALTHCARE, ANNISTON",015120,2300 COLEMAN RD,ANNISTON,Calhoun,58,43,70,12,111,71,103,0
CROWNE HEALTH CARE OF MOBILE,015100,954 NAVCO ROAD,MOBILE,Mobile,7,0,11,5,111,14,2,1
CROWNE HEALTH CARE OF GREENVILLE,015193,408 COUNTRY CLUB DRIVE,GREENVILLE,Butler,58,16,26,19,68,37,33,0
"OZARK HEALTH AND REHABILITATION, LLC",015208,312 BRYAN DRIVE,OZARK,Dale,78,7,45,21,107,67,4,0
PARKWOOD HEALTH CARE FACILITY,015179,3301 STADIUM DRIVE,PHENIX CITY,Russell,2,3,27,0,69,13,15,0
"SOUTH HEALTH AND REHABILITATION, LLC",015097,1220 SOUTH 17TH STREET,BIRMINGHAM,Jefferson,45,1,10,2,57,43,4,1
LYNWOOD NURSING HOME,015434,4164 HALLS MILL ROAD,MOBILE,Mobile,55,0,20,18,106,42,10,0
CLOVERDALE REHABILITATION AND NURSING CENTER,015184,412 CLOVERDALE ROAD,SCOTTSBORO,Jackson,36,15,27,6,121,24,59,0
AHC MILLENIUM,015458,5275 MILLENNIUM DRIVE,HUNTSVILLE,Madison,0,9,13,0,73,4,5,0
"CAREGIVERS OF PLEASANT GROVE, INC",015044,700 FIRST AVENUE,PLEASANT GROVE,Jefferson,35,21,15,11,46,18,3,0
DIVERSICARE OF BESSEMER,015209,820 GOLF COURSE ROAD,BESSEMER,Jefferson,76,2,40,26,127,53,3,1
COLONIAL HAVEN CARE & REHABILITATION CENTER,015396,616 ARMORY STREET,GREENSBORO,Hale,43,0,14,11,66,39,0,1
"OAK KNOLL HEALTH AND REHABILITATION, LLC",015117,824 SIXTH AVENUE WEST,BIRMINGHAM,Jefferson,2,10,9,0,90,9,0,0
EASTVIEW REHABILITATION & HEALTHCARE CENTER,015014,7755 FOURTH AVENUE SOUTH,BIRMINGHAM,Jefferson,30,5,6,0,70,30,1,0
WOODHAVEN MANOR NURSING HOME,015177,105 WEST WINDSOR ST,DEMOPOLIS,Marengo,10,16,6,1,64,11,18,0
"GLEN HAVEN HEALTH AND REHABILITATION, LLC",015186,2201 32ND STREET,NORTHPORT,Tuscaloosa,33,16,28,7,166,39,6,2
"SELMA HEALTH AND REHAB, LLC",015119,11 BELL ROAD,SELMA,Dallas,59,11,4,0,110,28,5,0
DIVERSICARE OF BOAZ,015063,600 CORLEY AVENUE,BOAZ,Marshall,8,0,9,0,94,19,0,0
ROANOKE REHABILITATION & HEALTHCARE CENTER,015424,680 SEYMOUR DRIVE,ROANOKE,Randolph,42,22,6,6,42,35,10,0
OAKWOOD-NORTH BALDWIN'S CENTER FOR LIVING,015417,2010 MEDICAL CENTER DRIVE,BAY MINETTE,Baldwin,23,13,10,3,64,23,37,0
"CROSSVILLE HEALTH AND REHABILITATION, LLC",015176,8922 HIGHWAY 227,CROSSVILLE,DeKalb,77,4,32,5,129,59,10,0
CHEROKEE COUNTY HEALTH AND REHABILITATION CENTER,015200,877 CEDAR BLUFF ROAD,CENTRE,Cherokee,77,3,46,16,133,78,2,0
MAGNOLIA HAVEN HEALTH AND REHABILITATION CENTER,015112,603 WRIGHT STREET,TUSKEGEE,Macon,,,,,,,,
SOUTHERN SPRINGS HEALTHCARE FACILITY,015171,745 SOUTHERN SPRINGS ROAD,UNION SPRINGS,Bullock,57,42,16,10,89,44,6,0
"WETUMPKA HEALTH AND REHABILITATION, LLC",015027,1825 HOLTVILLE ROAD,WETUMPKA,Elmore,59,3,37,5,90,38,6,0
LAFAYETTE NURSING HOME,015414,555 B STREET SW,LAFAYETTE,Chambers,5,0,6,0,47,3,1,0
DIVERSICARE OF ARAB,015148,235 THIRD STREET SE,ARAB,Marshall,1,0,8,0,80,2,10,0
COTTAGE OF THE SHOALS,015067,500 JOHN ALDRIDGE DRIVE,TUSCUMBIA,Colbert,18,8,11,1,74,25,19,0
AHAVA HEALTHCARE OF ALABASTER,015144,"850 9TH STREET, NORTHWEST",ALABASTER,Shelby,57,5,5,5,124,24,18,0
ROBERTSDALE REHABILITATION & HEALTHCARE CTR,015443,18700 U S HIGHWAY 90,ROBERTSDALE,Baldwin,48,5,3,0,116,40,7,0
KELLER LANDING,015028,813 KELLER LANE,TUSCUMBIA,Colbert,13,2,11,0,68,28,5,0
DIVERSICARE OF BIG SPRINGS,015111,500 ST. CLAIR AVENUE SOUTHWEST,HUNTSVILLE,Madison,85,4,11,9,104,30,7,1
MARSHALL MANOR NURSING HOME,015378,3120 NORTH STREET,GUNTERSVILLE,Marshall,1,2,17,0,75,11,13,0
HEALTH CARE INC,015407,P O BOX 130,ASHVILLE,St. Clair,0,0,4,0,48,3,5,0
BROWN NURSING HOME,015191,2334 WASHINGTON STREET,ALEXANDER CITY,Tallapoosa,2,9,7,0,61,1,20,0
DECATUR HEALTH & REHAB CENTER,015206,2326 MORGAN AVENUE SOUTHWEST,DECATUR,Morgan,58,82,23,9,69,32,19,0
WESLEY PLACE ON HONEYSUCKLE,015175,718 HONEYSUCKLE ROAD,DOTHAN,Houston,82,4,32,20,128,64,20,0
FOREST MANOR HEALTH AND REHAB,015143,2215 32ND STREET,NORTHPORT,Tuscaloosa,76,27,39,22,137,41,36,1
GREENBRIAR AT THE ALTAMONT SKILLED NURSING FACILIT,015446,2831 HIGHLAND AVENUE SOUTH,BIRMINGHAM,Jefferson,26,0,10,5,81,34,0,0
"RIDGEWOOD HEALTH SERVICES, INC.",015315,201 OAKHILL ROAD,JASPER,Walker,13,1,25,1,84,23,0,0
BIBB MED CENTER NURSING HOME,015215,208 PIERSON AVE,CENTREVILLE,Bibb,98,8,28,15,93,40,0,0
SPRINGHILL SENIOR RESIDENCE,015435,3717 DAUPHIN STREET,MOBILE,Mobile,0,30,17,0,68,4,63,0
"NORTH HILL NURSING AND REHABILITATION CTR, LLC",015091,200 NORTH PINE HILL ROAD,BIRMINGHAM,Jefferson,20,17,26,6,159,9,5,0
OAK TRACE CARE & REHABILITATION CENTER,015050,325 SELMA ROAD,BESSEMER,Jefferson,12,0,12,1,62,22,0,0
KIRKWOOD BY THE RIVER,015457,3605 RATLIFF ROAD,BIRMINGHAM,Jefferson,22,0,7,7,41,14,0,0
TERRACE OAKS CARE & REHABILITATION CENTER,015060,4201 BESSEMER SUPER HIGHWAY,BESSEMER,Jefferson,6,0,0,0,54,18,0,0
ANDALUSIA MANOR,015416,670 MOORE RD,ANDALUSIA,Covington,59,24,19,9,95,50,26,0
"ARBOR SPRINGS HEALTH AND REHAB CENTER, LTD",015192,1910 PEPPERELL PKWY,OPELIKA,Lee,69,0,61,19,111,63,2,0
CROWNE HEALTH CARE OF CITRONELLE,015121,19225 NORTH 4TH STREET,CITRONELLE,Mobile,46,2,12,5,64,42,1,1
RUSSELLVILLE HEALTH CARE INC,015071,705 NORTHEAST GANDY STREET,RUSSELLVILLE,Franklin,34,19,9,4,38,37,43,0
BIRMINGHAM NURSING AND REHABILITATION CTR LLC,015217,1000 DUGAN AVENUE,BIRMINGHAM,Jefferson,4,13,13,0,128,8,14,0
EAST ALABAMA MEDICAL CENTER SKILLED NURSING FACILI,015410,2000 PEPPERELL PARKWAY,OPELIKA,Lee,4,1,5,0,12,5,13,0
"TALLADEGA HEALTHCARE CENTER, INC",015162,616 CHAFFEE STREET,TALLADEGA,Talladega,111,214,14,5,193,54,59,0
HALEYVILLE HEALTH CARE CENTER,015157,2201 11TH AVENUE,HALEYVILLE,Winston,5,5,20,1,49,12,21,0
SPRINGHILL MANOR NURSING HOME,015415,3900 OLD SHELL ROAD,MOBILE,Mobile,4,2,2,0,0,8,2,0
WOODLAND VILLAGE REHABILITATION AND HEALTHCARE CEN,015383,1900 OLIVE STREET,CULLMAN,Cullman,3,13,42,1,113,5,30,0
TLC NURSING CENTER,015422,212 ELLEN STREET,ONEONTA,Blount,56,7,28,10,62,27,0,0
VILLAGE AT COOK SPRINGS SKILLED NURSING FACILITY,015195,415 COOK SPRINGS,PELL CITY,St. Clair,73,11,35,22,92,44,36,0
MONTROSE BAY HEALTH AND REHAB,015447,22670 MAIN STREET,FAIRHOPE,Baldwin,37,0,2,2,50,20,0,0
CROWNE HEALTH CARE OF MONTGOMERY,015393,1837 UPPER WETUMPKA ROAD,MONTGOMERY,Montgomery,44,2,49,8,132,26,8,0
CHERRY HILL REHABILITATION & HEALTHCARE CENTER,015445,1250 JEFF GERMANY PARKWAY,BIRMINGHAM,Jefferson,,,,,,,,
JOHN KNOX MANOR INC  I I,015135,4401 NARROW LANE ROAD,MONTGOMERY,Montgomery,0,1,8,0,44,5,9,0
"SUMTER HEALTH AND REHABILITATION, L L C",015042,1505 EAST 4TH AVENUE,YORK,Sumter,84,1,17,3,72,80,10,0
CROWNE HEALTH CARE OF EUFAULA,015199,430 RIVERS AVENUE,EUFAULA,Barbour,91,27,27,5,138,38,28,0
"ELBA NURSING AND REHABILITATION CENTER, LLC",015083,987 DRAYTON STREET,ELBA,Coffee,24,8,17,3,99,12,12,0
