WATERS EDGE HEALTH AND REHABILITATION,105828,1500 SW CAPRI ST,PALM CITY,Martin,0,1,3,0,26,10,1,0
FERNANDINA BEACH REHABILITATION AND NURSING CENTER,105470,1625 LIME STREET,FERNANDINA BEACH,Nassau,0,0,5,0,99,0,0,0
SOLARIS SENIOR LIVING NORTH NAPLES,105790,10949 PARNU STREET,NAPLES,Collier,4,0,2,0,55,7,0,0
UNITY HEALTH AND REHABILITATION CENTER,105510,1404 NW 22ND STREET,MIAMI,Miami-Dade,20,0,6,4,212,24,0,0
REGENTS PARK AT AVENTURA,105596,18905 NE 25TH AVE,AVENTURA,Miami-Dade,40,3,16,5,131,67,0,0
ST ANDREWS BAY SKILLED NURSING AND REHABILITATION,105543,2100 JENKS AVE,PANAMA CITY,Bay,1,0,1,0,108,7,1,0
ROSEWOOD HEALTH AND REHABILITATION CENTER,105480,3920 ROSEWOOD WAY,ORLANDO,Orange,2,0,4,0,108,10,0,0
SIGNATURE HEALTHCARE OF PALM BEACH,105466,4405 LAKEWOOD ROAD,LAKE WORTH,Palm Beach,45,14,14,12,74,28,4,0
CENTRE POINTE HEALTH AND REHAB CENTER,105563,2255 CENTERVILLE ROAD,TALLAHASSEE,Leon,0,0,2,0,117,3,0,0
MANORCARE HEALTH SERVICES,105481,375 NW 51ST STREET,BOCA RATON,Palm Beach,12,12,7,1,157,7,3,1
SEA BREEZE REHAB AND NURSING CENTER,105399,3663 15TH AVE,VERO BEACH,Indian River,2,0,0,0,94,12,0,0
WASHINGTON REHABILITATION AND NURSING CENTER,105727,879 USERY ROAD,CHIPLEY,Washington,45,31,18,12,124,25,43,0
UNIVERSITY HILLS HEALTH AND REHABILITATION,105445,10040 HILLVIEW ROAD,PENSACOLA,Escambia,2,4,4,0,108,5,22,0
MENORAH HOUSE,105685,9945 CENTRAL PARK BLVD N,BOCA RATON,Palm Beach,21,19,10,4,69,17,1,0
BEAR CREEK NURSING CENTER,105393,8041 STATE RD 52,HUDSON,Pasco,1,78,17,0,89,4,59,0
SOLARIS HEALTHCARE PENSACOLA,105561,8475 UNIVERSITY PARKWAY,PENSACOLA,Escambia,1,0,6,0,159,12,0,0
CORAL TRACE HEALTH CARE,105588,216 SANTA BARBARA BLVD,CAPE CORAL,Lee,0,0,7,0,108,3,0,0
"CROSSINGS, THE",105835,4445 PINE FOREST DR,LAKE WORTH,Palm Beach,16,0,23,3,25,9,1,0
PAGE REHABILITATION AND HEALTHCARE CENTER,105864,2310 N AIRPORT ROAD,FORT MYERS,Lee,67,39,23,13,124,34,73,0
STRATFORD COURT OF BOCA RATON,105851,6343 VIA DE SONRISA DEL SUR,BOCA RATON,Palm Beach,12,0,9,7,31,9,0,0
MAYFLOWER HEALTHCARE CENTER,105720,1620 MAYFLOWER COURT,WINTER PARK,Orange,3,0,3,0,41,4,4,0
ADVENTHEALTH CARE CENTER ZEPHYRHILLS SOUTH,105658,38250 A AVE,ZEPHYRHILLS,Pasco,1,0,6,0,105,7,4,0
BRANDYWYNE HEALTH CARE CENTER,105428,1801 N LAKE MARIAM DR,WINTER HAVEN,Polk,18,0,15,6,93,34,0,0
HEARTLAND OF ZEPHYRHILLS,105599,38220 HENRY DR,ZEPHYRHILLS,Pasco,4,25,5,1,75,0,15,0
AVANTE AT MELBOURNE INC,105671,1420 SOUTH OAK STREET,MELBOURNE,Brevard,,,,,,,,
HAMLIN PLACE OF BOYNTON BEACH,105485,2180 HYPOLUXO ROAD,LANTANA,Palm Beach,0,0,59,37,101,8,0,0
LAKE PLACID HEALTH AND REHABILITATION CENTER,105455,125 TOMOKA BLVD S,LAKE PLACID,Highlands,0,4,1,0,126,2,0,0
MARSHALL HEALTH AND REHABILITATION CENTER,105631,207 MARSHALL DR,PERRY,Taylor,0,0,43,0,110,2,0,0
HEALTH CENTRAL PARK,105479,411 NORTH DILLARD STREET,WINTER GARDEN,Orange,4,0,0,0,108,4,0,0
UNIVERSITY CROSSING,105820,6210 BEACH BLVD,JACKSONVILLE,Duval,4,0,10,0,85,9,2,0
SIGNATURE HEALTHCARE OF ORMOND,105458,103 NORTH CLYDE MORRIS BLVD,ORMOND BEACH,Volusia,0,0,12,0,46,3,3,0
HIALEAH NURSING AND REHABILITATION CENTER,105803,190 W 28TH STREET,HIALEAH,Miami-Dade,128,0,25,25,152,94,26,0
WESTWOOD NURSING AND REHABILITATION CENTER,105395,1001 MAR-WALT DRIVE,FORT WALTON BEACH,Okaloosa,0,0,4,0,51,1,1,0
TIFFANY HALL NURSING AND REHAB CENTER,105819,1800 SE HILLMOOR DRIVE,PORT SAINT LUCIE,St. Lucie,2,0,2,0,92,6,0,0
SURREY PLACE CARE CENTER,105597,110 SE LEE AVE,LIVE OAK,Suwannee,22,13,2,2,24,3,2,0
TERRA VISTA REHAB AND HEALTH CENTER,105546,1730 LUCERNE TERRACE,ORLANDO,Orange,1,0,1,0,97,3,0,0
PALMETTO CARE CENTER,105575,6750 WEST 22ND COURT,HIALEAH,Miami-Dade,20,2,5,5,60,15,4,0
HILLCREST HEALTH CARE AND REHABILITATION CENTER,105495,4200 WASHINGTON ST,HOLLYWOOD,Broward,49,2,13,8,170,21,1,0
TAYLOR CARE CENTER,105821,6535 CHESTER AVENUE,JACKSONVILLE,Duval,19,5,4,0,79,30,7,0
HIALEAH SHORES NURSING AND REHAB CENTER,105511,8785 NW 32ND AVENUE,MIAMI,Miami-Dade,2,1,2,0,96,5,0,0
NORTH FLORIDA REHABILITATION AND SPECIALTY CARE,105460,6700 NW 10TH PLACE,GAINESVILLE,Alachua,0,0,8,0,110,1,2,0
LAKESIDE PAVILION,105439,2900 12TH STREET N,NAPLES,Collier,1,0,7,0,,5,2,0
WINDSOR WOODS REHAB AND HEALTHCARE CENTER,105568,13719 DALLAS DR,HUDSON,Pasco,0,6,2,0,93,1,2,0
HEARTLAND HEALTH CARE AND REHABILITATION CENTER OF,105852,7225 BOCA DEL MAR DRIVE,BOCA RATON,Palm Beach,0,1,7,0,68,14,1,0
JOSEPH L MORSE HEALTH CENTER INC THE,105801,4847 FRED GLADSTONE DRIVE,WEST PALM BEACH,Palm Beach,18,25,50,0,269,34,15,0
SOLARIS HEALTHCARE BAYONET POINT,105544,7210 BEACON WOODS DR,HUDSON,Pasco,0,1,0,0,146,4,1,0
WINDSOR HEALTH AND REHABILITATION CENTER,105696,602 E LAURA ST,STARKE,Bradford,17,7,5,6,80,10,3,0
SUNRISE CITY POST-ACUTE AND REHABILITATION CENTER,105804,700 S 29TH STREET,FORT PIERCE,St. Lucie,0,0,0,0,53,3,0,0
"ROHR HOME, THE",105823,2120 MARSHALL EDWARDS DR,BARTOW,Polk,0,0,1,0,43,0,10,0
PLAZA WEST,105866,912 AMERICAN EAGLE BLVD,SUN CITY CENTER,Hillsborough,1,0,7,0,80,5,0,0
SANDY RIDGE CENTER FOR REHABILITATION AND HEALING,105552,5360 GLOVER LANE,MILTON,Santa Rosa,2,0,2,0,53,2,0,0
PALM GARDEN OF AVENTURA,105610,21251 E DIXIE HIGHWAY,NORTH MIAMI BEACH,Miami-Dade,0,0,0,5,92,1,0,0
JACKSON MEMORIAL LONG TERM CARE CENTER,105392,2500 NW 22ND AVE,MIAMI,Miami-Dade,17,7,8,4,209,49,3,0
TARPON POINT NURSING AND REHABILITATION CENTER,105702,5157 PARK CLUB DRIVE,SARASOTA,Sarasota,59,28,25,20,70,31,9,0
CONSULATE HEALTH CARE OF NORTH FORT MYERS,105507,991 PONDELLA RD,FORT MYERS,Lee,0,0,0,0,107,13,3,0
PARK RIDGE NURSING CENTER,105813,730 COLLEGE STREET,JACKSONVILLE,Duval,35,12,10,7,75,19,20,0
"WINDSOR CARE & REHAB, LLC",105805,501 S PALM AVE,PALATKA,Putnam,0,0,2,0,40,10,5,0
GOVERNORS CREEK HEALTH AND REHABILITATION,105663,803 OAK ST,GREEN COVE SPRINGS,Clay,0,0,0,0,73,1,0,0
BAY BREEZE SENIOR LIVING AND REHABILITATION CENTER,105487,3387 GULF BREEZE PARKWAY,GULF BREEZE,Santa Rosa,0,0,0,0,101,8,0,0
AVANTE AT ST CLOUD INC,105670,1301 KANSAS AVE,SAINT CLOUD,Osceola,2,0,1,0,105,2,0,0
SYLVAN HEALTH CENTER,105744,2770 REGENCY OAKS BLVD,CLEARWATER,Pinellas,0,1,140,0,35,8,12,0
ISLAND LAKE CENTER,105643,155 LANDOVER PLACE,LONGWOOD,Seminole,1,0,0,0,94,6,6,0
MANORCARE HEALTH SERVICES PALM HARBOR,105708,2851 TAMPA RD,PALM HARBOR,Pinellas,0,15,10,0,163,2,2,0
ADVANCED CARE CENTER,105478,401 FAIRWOOD AVE,CLEARWATER,Pinellas,0,0,4,0,104,4,3,0
FINNISH-AMERICAN VILLAGE,105827,1800 SOUTH DRIVE,LAKE WORTH,Palm Beach,5,3,0,0,41,7,1,0
HEARTLAND HEALTH CARE CENTER ORANGE PARK,105692,570 WELLS RD,ORANGE PARK,Clay,8,2,2,0,68,6,2,0
PALM GARDEN OF ORLANDO,105577,654 N ECONLOCKHATCHEE TRAIL,ORLANDO,Orange,2,0,0,0,120,7,0,0
DELANEY PARK HEALTH AND REHABILITATION CENTER,105791,215 ANNIE STREET,ORLANDO,Orange,2,26,1,0,78,8,3,0
FORT MYERS REHABILITATION AND NURSING CENTER,105427,7173 CYPRESS DRIVE SW,FORT MYERS,Lee,1,0,3,2,118,14,1,0
CONWAY LAKES HEALTH & REHABILITATION CENTER,105754,5201 CURRY FORD ROAD,ORLANDO,Orange,,,,,,,,
ORLANDO HEALTH AND REHABILITATION CENTER,105728,830 WEST 29TH STREET,ORLANDO,Orange,10,45,11,0,352,25,10,0
TIERRA PINES CENTER,105398,7380 ULMERTON RD,LARGO,Pinellas,0,10,0,0,101,2,4,0
BOYNTON BEACH REHABILITATION CENTER,105837,9600 LAWRENCE RD,BOYNTON BEACH,Palm Beach,7,0,6,1,124,21,0,0
PALM GARDEN OF SUN CITY,105736,3850 UPPER CREEK DR,SUN CITY CENTER,Hillsborough,6,0,0,0,113,4,4,0
SIGNATURE HEALTHCARE OF BROOKWOOD GARDENS,105550,1990 S CANAL DRIVE,HOMESTEAD,Miami-Dade,83,41,18,10,99,40,18,0
SIGNATURE HEALTHCARE AT COLLEGE PARK,105387,13755 GOLF CLUB PKWY,FORT MYERS,Lee,30,2,7,1,97,20,0,0
"CARE CENTER AT PINELLAS PARK, THE",105422,8701 49TH ST N,PINELLAS PARK,Pinellas,2,0,0,0,102,12,0,0
COURTENAY SPRINGS VILLAGE,105463,1100 SOUTH COURTENAY PARKWAY,MERRITT ISLAND,Brevard,3,0,0,0,59,2,0,0
PALACE AT KENDALL NURSING AND REHABILITATION CENTE,105719,11215 SW 84TH STREET,MIAMI,Miami-Dade,12,2,8,0,142,6,1,0
DELTONA HEALTH CARE,105447,1851 ELKCAM BLVD,DELTONA,Volusia,16,58,24,2,108,26,56,0
CENTURY CENTER FOR REHABILITATION AND HEALING,105860,6020 INDUSTRIAL BLVD,CENTURY,Escambia,0,0,4,0,81,6,1,0
LANIER REHABILITATION CENTER,105666,12740 LANIER ROAD,JACKSONVILLE,Duval,2,0,9,1,103,4,0,0
POMPANO HEALTH AND REHABILITATION CENTER,105572,51 W SAMPLE ROAD,POMPANO BEACH,Broward,12,0,6,1,112,18,0,0
SAN JOSE HEALTH AND REHABILITATION CENTER,105531,9355 SAN JOSE BLVD,JACKSONVILLE,Duval,0,0,3,0,105,3,0,0
BAYA POINTE NURSING AND REHABILITATION CENTER,105846,587 SE ERMINE AVE,LAKE CITY,Columbia,0,0,0,0,80,3,4,0
CITRUS HEALTH AND REHABILITATION CENTER,105858,701 MEDICAL COURT EAST,INVERNESS,Citrus,1,0,0,0,93,5,6,0
BAY VUE NURSING AND REHABILITATION CENTER,105551,105 15TH ST E,BRADENTON,Manatee,0,0,6,0,91,1,0,0
RENAISSANCE HEALTH AND REHABILITATION,105558,5065 WALLIS ROAD,WEST PALM BEACH,Palm Beach,1,0,0,0,94,6,0,0
NORTH PORT REHABILITATION AND NURSING CENTER,105523,6940 OUTREACH WAY,NORTH PORT,Sarasota,0,0,3,0,82,1,0,0
CYPRESS VILLAGE,105745,4600 MIDDLETON PARK CIR E,JACKSONVILLE,Duval,0,1,4,0,91,20,0,0
WILLOWBROOKE COURT AT AZALEA TRACE,105444,10100 HILLVIEW DR,PENSACOLA,Escambia,14,1,7,5,42,15,0,0
NORTH LAKE CARE CENTER,105640,750 BAYBERRY DRIVE,LAKE PARK,Palm Beach,4,0,1,1,60,29,0,0
MEMORIAL MANOR,105668,777 SOUTH DOUGLAS ROAD,PEMBROKE PINES,Broward,0,0,3,0,89,8,0,0
HERON POINTE HEALTH AND REHABILITATION,105413,1445 HOWELL AVE,BROOKSVILLE,Hernando,1,0,0,0,99,6,0,0
"GARDENS HEALTH & REHABILITATION CENTER, THE",105822,1704 HUNTINGTON VILLAGE CIRCLE,DAYTONA BEACH,Volusia,0,12,12,0,96,6,34,0
PALM GARDEN OF JACKSONVILLE,105682,5725 SPRING PARK ROAD,JACKSONVILLE,Duval,0,0,36,0,102,2,1,0
GUARDIAN CARE NURSING & REHABILITATION CENTER,105797,2500 W CHURCH STREET,ORLANDO,Orange,3,7,0,0,89,10,2,0
CONCORDIA MANOR,105714,321 13TH AVE N,SAINT PETERSBURG,Pinellas,0,0,0,0,29,1,0,0
RIVERSIDE CARE CENTER,105432,899 NW 4TH STREET,MIAMI,Miami-Dade,18,14,3,1,84,15,18,0
OKEECHOBEE HEALTH CARE FACILITY,105484,1646 HIGHWAY 441 N,OKEECHOBEE,Okeechobee,1,4,6,0,162,16,10,0
BAY POINTE NURSING PAVILION,105477,4201 31ST ST S,SAINT PETERSBURG,Pinellas,4,2,0,0,114,12,1,0
TUSKAWILLA NURSING AND REHAB CENTER,105872,1024 WILLA SPRINGS DR,WINTER SPRINGS,Seminole,3,2,3,0,83,4,2,0
PALM GARDEN OF GAINESVILLE,105571,227 SW 62ND BLVD,GAINESVILLE,Alachua,0,6,2,0,134,5,12,0
HARTS HARBOR HEALTH CARE CENTER,105632,11565 HARTS RD,JACKSONVILLE,Duval,1,0,1,0,171,3,1,0
CROSS SHORES CARE CENTER,105435,220 NINTH STREET,PORT SAINT JOE,Gulf,0,0,0,0,67,0,0,0
HOMESTEAD MANOR A PALACE COMMUNITY,105541,1330 NW 1ST AVE,HOMESTEAD,Miami-Dade,0,0,5,0,88,0,0,0
CHIPOLA HEALTH AND REHABILITATION CENTER,105729,4294 3RD AVENUE,MARIANNA,Jackson,0,2,3,0,57,0,2,0
PORT ST LUCIE REHABILITATION AND HEALTHCARE,105410,7300 OLEANDER AVE,PORT SAINT LUCIE,St. Lucie,27,0,0,0,110,97,0,0
"CHATEAU AT MOORINGS PARK, THE",105396,130 MOORINGS PARK DRIVE,NAPLES,Collier,0,0,0,0,71,6,0,0
WEST GABLES HEALTH CARE CENTER,105623,2525 SW 75TH AVENUE,MIAMI,Miami-Dade,54,35,9,4,71,30,34,0
MANORCARE HEALTH SERVICES SARASOTA,105454,5511 SWIFT ROAD,SARASOTA,Sarasota,0,14,5,0,146,3,16,0
WESTMINSTER WINTER PARK,105879,1111 S LAKEMONT AVE,WINTER PARK,Orange,0,0,0,0,58,26,0,0
CLERMONT HEALTH AND REHABILITATION CENTER,105512,151 E MINNEHAHA AVE,CLERMONT,Lake,0,19,4,0,165,23,16,0
FIRST COAST HEALTH & REHABILITATION CENTER,105429,7723 JASPER AVENUE,JACKSONVILLE,Duval,0,0,0,0,92,16,0,0
HEARTLAND HEALTH CARE CENTER PROSPERITY OAKS,105762,11375 PROSPERITY FARMS ROAD,PALM BEACH GARDENS,Palm Beach,21,4,7,2,72,21,11,0
HARBOURS EDGE,105598,401 E LINTON BLVD,DELRAY BEACH,Palm Beach,2,0,5,0,50,2,2,0
PALM GARDEN OF VERO BEACH,105592,1755 37TH STREET,VERO BEACH,Indian River,0,0,1,0,144,8,0,0
ADVENTHEALTH CARE CENTER ORLANDO EAST,105783,250 SOUTH CHICKASAW TRAIL,ORLANDO,Orange,0,0,25,0,108,15,0,0
CONSULATE HEALTH CARE OF TALLAHASSEE,105764,1650 PHILLIPS RD,TALLAHASSEE,Leon,0,0,0,0,110,3,0,0
KENSINGTON GARDENS REHAB AND NURSING CENTER,105453,2055 PALMETTO ST,CLEARWATER,Pinellas,7,0,6,0,118,15,1,0
SUSANNA WESLEY HEALTH CENTER,105498,5300 W 16TH AVENUE,HIALEAH,Miami-Dade,0,0,3,1,94,3,1,0
HEARTLAND HEALTH CARE CENTER JACKSONVILLE,105684,8495 NORMANDY BLVD,JACKSONVILLE,Duval,0,9,5,0,92,4,7,0
METRO WEST NURSING AND REHAB CENTER,105868,5900 WESTGATE DRIVE,ORLANDO,Orange,1,0,10,0,90,3,2,0
SPECIALTY HEALTH AND REHABILITATION CENTER,105751,6984 PINE FOREST ROAD,PENSACOLA,Escambia,4,37,24,0,104,3,2,0
SIGNATURE HEALTHCARE OF GAINESVILLE,105664,4000 SW 20TH AVE,GAINESVILLE,Alachua,0,0,0,0,86,0,1,0
PINEBROOK CENTER,105497,1240 PINEBROOK ROAD,VENICE,Sarasota,1,0,9,0,93,1,0,0
YBOR CITY CENTER FOR REHABILITATION AND HEALING,105891,1709 TALIAFERRO AVE,TAMPA,Hillsborough,16,2,4,0,56,11,2,0
HERITAGE PARK CARE AND REHABILITATION CENTER,105529,2302 59TH ST W,BRADENTON,Manatee,26,0,4,4,84,15,0,0
SOLARIS HEALTHCARE IMPERIAL,105738,900 IMPERIAL GOLF COURSE BLVD,NAPLES,Collier,0,0,3,0,86,8,1,0
HAMPTON COURT NURSING AND REHABILITATION CENTER,105715,16100 NW 2ND AVENUE,NORTH MIAMI BEACH,Miami-Dade,2,0,4,0,105,8,0,0
JUPITER REHABILITATION AND HEALTHCARE CENTER,105555,17781 THELMA AVE,JUPITER,Palm Beach,82,9,22,4,85,47,41,0
ADVENTHEALTH CARE CENTER APOPKA NORTH,105782,305 EAST OAK STREET,APOPKA,Orange,0,2,0,0,110,56,26,0
DEBARY HEALTH AND REHABILITATION CENTER,105514,60 N HWY 17/92,DEBARY,Volusia,11,1,3,0,96,17,1,0
NSPIRE HEALTHCARE KENDALL,105641,9400 SW 137TH AVENUE,KENDALL,Miami-Dade,21,0,7,4,105,8,7,0
HIGHLAND PINES REHABILITATION CENTER,105690,1111 S HIGHLAND AVE,CLEARWATER,Pinellas,27,2,1,0,97,7,16,0
PARKS HEALTHCARE AND REHABILITATION CENTER,105471,9311 S ORANGE BLOSSOM TRL,ORLANDO,Orange,0,0,0,0,104,6,0,0
EAST RIDGE RETIREMENT VILLAGE INC,105508,19225 SW 87TH AVE,CUTLER BAY,Miami-Dade,4,1,2,0,57,8,1,0
BAY BREEZE HEALTH AND REHABILITATION CENTER,105443,1026 ALBEE FARM RD,VENICE,Sarasota,0,0,4,0,107,1,1,0
VILLAGE ON THE GREEN,105556,500 VILLAGE PLACE,LONGWOOD,Seminole,0,1,66,0,44,0,0,0
CONSULATE HEALTH CARE OF ST PETERSBURG,105895,9393 PARK BLVD,SEMINOLE,Pinellas,3,2,0,0,84,11,0,0
OAK VIEW REHABILITATION CENTER,105586,833 KINGSLEY AVE,ORANGE PARK,Clay,0,0,0,0,97,2,0,0
ABBEY DELRAY SOUTH,105411,1717 HOMEWOOD BLVD,DELRAY BEACH,Palm Beach,12,0,13,2,47,9,6,0
BAYSHORE POINTE NURSING AND REHAB CENTER,105650,3117 W GANDY BLVD,TAMPA,Hillsborough,9,0,8,1,77,18,0,0
PENINSULA CARE AND REHABILITATION CENTER,105451,900 BECKETT WAY,TARPON SPRINGS,Pinellas,46,0,10,9,97,16,2,0
CONSULATE HEALTH CARE OF LAKELAND,105482,5245 N SOCRUM LOOP RD,LAKELAND,Polk,2,3,9,4,107,4,6,0
MANORCARE HEALTH SERVICES BOYNTON BEACH,105496,3001 SOUTH CONGRESS AVENUE,BOYNTON BEACH,Palm Beach,1,5,14,0,124,4,5,0
PLYMOUTH HARBOR INCORPORATED,105817,700 JOHN RINGLING BLVD,SARASOTA,Sarasota,0,7,0,0,33,3,1,0
SOLARIS HEALTHCARE PALATKA,105652,110 KAY LARKIN DR,PALATKA,Putnam,1,2,6,0,150,11,0,0
BISHOPS GLEN RETIREMENT CENTER,105526,900 LPGA BLVD,HOLLY HILL,Volusia,21,0,0,0,31,10,0,0
COURTYARDS OF ORLANDO CARE CENTER,105431,1900 MERCY DRIVE,ORLANDO,Orange,0,1,5,0,95,3,3,0
PREMIER PLACE AT THE GLENVIEW,105856,100 GLENVIEW PLACE,NAPLES,Collier,,,,,,,,
LAKE PARK OF MADISON NURSING AND REHABILITATION CE,105892,259 SW CAPTAIN BROWN RD,MADISON,Madison,22,3,16,3,88,23,40,0
ABBEY REHABILITATION AND NURSING CENTER,105749,7101 DR MARTIN LUTHER KING JR ST N,SAINT PETERSBURG,Pinellas,0,0,0,0,122,9,1,0
VISTA MANOR,105530,1550 JESS PARRISH CT,TITUSVILLE,Brevard,0,0,0,0,93,0,0,0
DIAMOND RIDGE HEALTH AND REHABILITATION CENTER,105657,2730 W MARC KNIGHTON CT,LECANTO,Citrus,0,1,4,0,99,1,1,0
LAKE VIEW CARE CENTER AT DELRAY,105475,5430 LINTON BLVD,DELRAY BEACH,Palm Beach,19,27,12,7,79,21,6,0
INDIGO MANOR,105570,595 N WILLIAMSON BLVD,DAYTONA BEACH,Volusia,2,1,0,0,108,24,15,2
MARGATE HEALTH AND REHABILITATION CENTER,105505,5951 COLONIAL DRIVE,MARGATE,Broward,46,0,19,9,126,14,0,0
GOOD SAMARITAN SOCIETY-DAYTONA,105651,325 S SEGRAVE STREET,DAYTONA BEACH,Volusia,0,0,4,0,76,0,0,0
ANCHOR CARE AND REHABILITATION CENTER,105464,1515 PORT MALABAR BLVD NE,PALM BAY,Brevard,0,0,2,0,91,0,0,0
SOLARIS HEALTHCARE LAKE CITY,105769,560 SW MCFARLANE AVE,LAKE CITY,Columbia,5,11,14,0,106,14,10,0
ORANGE CITY NURSING AND REHAB CENTER,105735,2810 ENTERPRISE RD,DEBARY,Volusia,3,3,2,0,103,6,17,0
SABAL PALMS HEALTH & REHABILITATION,105694,499 ALTERNATE KEENE RD NE,LARGO,Pinellas,5,9,33,0,214,9,33,0
BONIFAY NURSING AND REHAB CENTER,105624,306 WEST BROCK AVENUE,BONIFAY,Holmes,7,0,4,0,159,8,0,0
CONSULATE HEALTH CARE OF ORANGE PARK,105653,1215 KINGSLEY AVE,ORANGE PARK,Clay,3,0,1,0,114,3,0,0
"ST ANNES NURSING CENTER, ST ANNES RESIDENCE INC",105560,11855 QUAIL ROOST DRIVE,MIAMI,Miami-Dade,2,0,0,0,175,12,2,0
ROYAL OAK NURSING CENTER,105385,37300 ROYAL OAK LANE,DADE CITY,Pasco,19,4,16,7,87,17,2,0
VICAR'S LANDING NURSING HOME,105630,1003 YORK ROAD,PONTE VEDRA BEACH,St. Johns,0,1,27,0,30,0,0,0
HEALTHCARE AND REHAB OF SANFORD,105539,950 MELLONVILLE AVE,SANFORD,Seminole,11,0,22,0,83,24,2,0
SEMINOLE PAVILION REHABILITATION & NURSING SERVICE,105412,10800 TEMPLE TERRACE,SEMINOLE,Pinellas,3,42,1,0,52,8,22,0
RIO PINAR HEALTH CARE,105564,7950 LAKE UNDERHILL ROAD,ORLANDO,Orange,0,0,0,0,171,11,0,0
EDGEWATER AT WATERMAN VILLAGE,105796,300 BROOKFIELD AVE,MOUNT DORA,Lake,0,0,5,0,68,1,0,0
THE GARDENS AT DEPUGH,105785,550 W MORSE BLVD,WINTER PARK,Orange,0,0,3,0,36,0,0,0
COLONIAL LAKES HEALTH CARE,105440,15204 W COLONIAL DR,WINTER GARDEN,Orange,2,4,8,0,164,5,0,0
SPRINGS AT BOCA CIEGA BAY,105537,"1255 PASADENA AVE S, SUITE C",SOUTH PASADENA,Pinellas,0,0,4,0,89,5,1,0
MANORCARE NURSING AND REHABILITATION CENTER,105421,3601 LAKEWOOD BLVD,NAPLES,Collier,21,63,4,3,62,14,3,0
PORT ORANGE NURSING AND REHAB CENTER,105776,5600 VICTORIA GARDENS BLVD,PORT ORANGE,Volusia,0,0,0,0,89,2,0,0
CONSULATE HEALTH CARE OF BRANDON,105520,701 VICTORIA ST,BRANDON,Hillsborough,44,6,13,7,83,27,9,0
"HOME ASSOCIATION, THE",105725,1203 E 22ND AVE,TAMPA,Hillsborough,0,0,0,0,91,2,0,0
CONSULATE HEALTH CARE OF MELBOURNE,105861,3033 SARNO RD,MELBOURNE,Brevard,0,0,17,0,148,3,0,0
WILLOWBROOKE COURT AT INDIAN RIVER ESTATES,105593,2440 CITRUS BLOSSOM CIR,VERO BEACH,Indian River,1,0,4,0,96,2,0,0
REHABILITATION CENTER AT PARK PLACE,105628,1717 W AVERY ST,PENSACOLA,Escambia,0,6,0,0,99,2,6,0
PLAZA HEALTH AND REHAB,105434,4842 SW ARCHER ROAD,GAINESVILLE,Alachua,1,0,14,0,156,2,21,0
HEARTLAND HEALTH CARE CENTER - NORTH SARASOTA,105389,3250 12TH ST,SARASOTA,Sarasota,0,4,5,0,74,1,2,0
DEERFIELD BEACH HEALTH AND REHABILITATION CENTER,105622,401 EAST SAMPLE ROAD,POMPANO BEACH,Broward,15,46,1,1,166,17,3,0
WINKLER COURT,105882,3250 WINKLER AVENUE EXTENSION,FORT MYERS,Lee,0,4,5,1,105,23,10,0
COMMONS AT ORLANDO LUTHERAN TOWERS,105731,210 LAKE AVENUE,ORLANDO,Orange,0,1,7,0,153,0,0,0
HEARTLAND HEALTH CARE CENTER BOYNTON BEACH,105755,3600 OLD BOYNTON ROAD,BOYNTON BEACH,Palm Beach,24,15,14,7,92,7,3,0
SOLARIS HEALTHCARE MERRITT ISLAND,105701,500 CROCKETT BLVD,MERRITT ISLAND,Brevard,1,1,22,0,151,11,5,0
FLAGLER HEALTH AND REHABILITATION CENTER,105547,300 DR CARTER BOULEVARD,BUNNELL,Flagler,0,3,0,0,87,1,2,0
CORAL BAY HEALTHCARE AND REHABILITATION,105795,2939 S HAVERHILL RD,WEST PALM BEACH,Palm Beach,11,0,6,1,97,7,0,0
ENCORE AT BOCA RATON REHABILITATION AND NURSING CE,105506,7300 DEL PRADO CIRCLE SOUTH,BOCA RATON,Palm Beach,3,1,6,0,119,8,1,0
OCALA OAKS REHABILITATION CENTER,105724,3930 E SILVER SPRINGS BLVD,OCALA,Marion,7,0,6,0,101,9,9,0
ROSEWOOD HEALTHCARE AND REHABILITATION CENTER,105747,3107 NORTH H STREET,PENSACOLA,Escambia,14,5,2,1,131,14,1,0
REGENTS PARK NURSING & REHABILITATION CENTER,105476,6363 VERDE TRAIL,BOCA RATON,Palm Beach,32,23,12,8,140,25,24,0
EXCEL CARE CENTER,105884,2811 CAMPUS HILL DR,TAMPA,Hillsborough,11,1,2,0,97,14,1,0
BARRINGTON TERRACE OF BOYNTON BEACH,105850,1425 S CONGRESS AVE,BOYNTON BEACH,Palm Beach,3,0,0,0,20,8,0,0
GOOD SAMARITAN CENTER,105809,10676 MARVIN JONES BLVD,LIVE OAK,Suwannee,0,0,15,0,138,4,0,0
HAWTHORNE HEALTH AND REHAB OF OCALA,105602,4100 SW 33RD AVE,OCALA,Marion,1,0,4,0,83,2,1,0
CENTRAL PARK HEALTHCARE AND REHABILITATION CENTER,105718,702 S KINGS AVE,BRANDON,Hillsborough,5,10,5,0,557,11,13,0
WEST BAY OF TAMPA,105419,3865 TAMPA RD,OLDSMAR,Pinellas,10,3,2,0,107,9,1,0
DESTIN HEALTHCARE AND REHABILITATION CENTER,105862,195 MATTIE M KELLY BLVD,DESTIN,Okaloosa,49,0,2,1,101,12,0,0
TRI-COUNTY NURSING HOME,105770,7280 SW STATE RD 26,TRENTON,Gilchrist,0,10,0,0,69,0,2,0
HIGHLANDS LAKE CENTER,105620,4240 LAKELAND HIGHLANDS RD,LAKELAND,Polk,4,5,9,5,37,3,4,0
"TERRACE OF ST CLOUD, THE",105528,3855 OLD CANOE CREEK ROAD,SAINT CLOUD,Osceola,27,1,13,10,79,20,0,0
MANORCARE HEALTH SERVICES DUNEDIN,105436,870 PATRICIA AVE,DUNEDIN,Pinellas,1,4,8,0,103,1,5,0
HAINES CITY REHABILITATION AND NURSING CENTER,105442,409 S 10TH ST,HAINES CITY,Polk,1,0,0,0,114,1,0,0
SOLARIS HEALTHCARE CHARLOTTE HARBOR,105859,4000 KINGS HWY,PORT CHARLOTTE,Charlotte,18,30,18,13,129,17,61,0
EMERALD HEALTH CARE CENTER,105579,1655 SE WALTON ROAD,PORT SAINT LUCIE,St. Lucie,,,,,,,,
PINELLAS POINT NURSING AND REHAB CENTER,105878,5601 31ST ST S,SAINT PETERSBURG,Pinellas,2,0,0,0,48,10,1,0
RIVER VALLEY REHABILITATION CENTER,105473,17884 NE CROZIER ST,BLOUNTSTOWN,Calhoun,0,0,12,0,128,6,1,0
CROSS GARDENS CARE CENTER,105765,190 NE 191ST STREET,MIAMI,Miami-Dade,23,4,3,2,99,10,1,0
BENEVA LAKES HEALTHCARE AND REHABILITATION CENTER,105416,741 SOUTH BENEVA ROAD,SARASOTA,Sarasota,0,0,3,0,117,1,0,0
PARKLANDS CARE CENTER,105638,1000 SW 16TH AVE,GAINESVILLE,Alachua,44,5,12,7,102,21,0,0
TIMBERRIDGE NURSING & REHABILITATION CENTER,105717,9848 SW 110TH ST,OCALA,Marion,1,0,0,0,156,5,0,0
HARBOUR HEALTH CENTER,105538,23013 WESTCHESTER BLVD,PORT CHARLOTTE,Charlotte,1,3,4,0,76,5,2,0
EMORY L BENNETT MEMORIAL VETERANS NURSING HOME,105840,1920 MASON AVENUE,DAYTONA BEACH,Volusia,3,0,9,0,101,12,3,0
LIFE CARE CENTER OF CITRUS COUNTY,105870,3325 W JERWAYNE LN,LECANTO,Citrus,0,10,37,0,89,1,7,0
REGENTS PARK OF SUNRISE,105679,9711 W OAKLAND PARK BLVD,SUNRISE,Broward,2,10,0,0,108,1,0,0
CLARIDGE HOUSE NURSING & REHABILITATION CENTER,105513,13900 NE 3RD COURT,NORTH MIAMI,Miami-Dade,8,1,80,63,190,31,5,0
SURREY PLACE HEALTHCARE AND REHABILITATION,105629,5525 21ST AVE W,BRADENTON,Manatee,0,5,2,0,50,0,4,0
INDIAN RIVER CENTER,105673,7201 GREENBORO DR,WEST MELBOURNE,Brevard,0,0,5,0,148,1,2,0
MANORCARE AT LELY PALMS,105499,6135 RATTLESNAKE HAMMOCK ROAD,NAPLES,Collier,2,66,9,3,84,19,1,0
CONSULATE HEALTH CARE AT WEST ALTAMONTE,105843,1099 WEST TOWN PARKWAY,ALTAMONTE SPRINGS,Seminole,2,0,0,0,81,2,0,1
CROSSBREEZE CARE CENTER,105774,1755 18TH ST,SARASOTA,Sarasota,11,0,5,1,87,1,0,0
MELBOURNE TERRACE REHABILITATION CENTER,105635,251 FLORIDA AVE,MELBOURNE,Brevard,12,0,0,0,165,29,0,0
MIAMI SHORES NURSING AND REHAB CENTER,105449,9380 NW 7TH AVENUE,MIAMI,Miami-Dade,47,0,5,3,67,32,22,0
SUWANNEE HEALTH AND REHABILITATION CENTER,105613,1620 HELVENSTON ST SE,LIVE OAK,Suwannee,75,35,31,18,105,69,43,0
SOLARIS HEALTHCARE OSCEOLA,105734,4201 W NEW NOLTE ROAD,SAINT CLOUD,Osceola,0,2,1,0,108,1,0,0
NORTH CAMPUS REHABILITATION AND NURSING CENTER,105621,700 N PALMETTO ST,LEESBURG,Lake,0,0,9,0,81,0,0,0
LOURDES-NOREEN MCKEEN RESIDENCE FOR GERIATRIC CARE,105420,315 S FLAGLER DR,WEST PALM BEACH,Palm Beach,5,0,3,0,104,18,8,0
"TERRACE OF JACKSONVILLE, THE",105423,10680 OLD ST AUGUSTINE RD,JACKSONVILLE,Duval,9,0,10,0,175,11,0,0
GOOD SAMARITAN SOCIETY-KISSIMMEE VILLAGE,105559,1500 SOUTHGATE DRIVE,KISSIMMEE,Osceola,1,3,6,0,131,2,7,0
ARBOR TRAIL REHAB AND SKILLED NURSING CENTER,105703,611 TURNER CAMP RD,INVERNESS,Citrus,3,0,3,0,93,1,5,0
JACKSONVILLE NURSING AND REHAB CENTER,105710,4134 DUNN AVENUE,JACKSONVILLE,Duval,10,0,1,1,127,18,0,0
MARIANNA HEALTH AND REHABILITATION CENTER,105637,4295 FIFTH AVENUE,MARIANNA,Jackson,21,0,0,0,139,3,0,0
PALM GARDEN OF LARGO,105574,10500 STARKEY RD,LARGO,Pinellas,12,0,8,0,127,5,1,0
MANATEE SPRINGS REHABILITATION AND NURSING CENTER,105525,5627 9TH ST E,BRADENTON,Manatee,55,0,16,12,100,33,3,0
GULF COAST VILLAGE,105672,1333 SANTA BARBARA BLVD,CAPE CORAL,Lee,0,0,9,0,92,4,0,0
SUNRISE HEALTH & REHABILITATION CENTER,105441,4800 N NOB HILL RD,SUNRISE,Broward,4,0,4,0,170,16,0,0
"CATHEDRAL GERONTOLOGY CENTER, INC",105834,333 E ASHLEY ST,JACKSONVILLE,Duval,2,0,6,0,100,7,1,0
OAKBROOK HEALTH AND REHABILITATION CENTER,105683,250 BROWARD AVE,LABELLE,Hendry,15,2,6,6,77,12,5,0
"MANOR AT BLUE WATER BAY, THE",105784,1500 NORTH WHITE POINT ROAD,NICEVILLE,Okaloosa,1,1,9,0,102,1,0,0
HAWTHORNE HEALTH AND REHAB OF BRANDON,105881,851 WEST LUMSDEN RD,BRANDON,Hillsborough,23,4,12,8,55,16,9,0
BELLEAIR HEALTH CARE CENTER,105636,1150 PONCE DE LEON BLVD,CLEARWATER,Pinellas,0,0,0,0,108,1,0,0
EVERGREEN WOODS,105397,7045 EVERGREEN WOODS TRL,SPRING HILL,Hernando,0,2,0,0,107,11,4,0
MARION AND BERNARD L SAMSON NURSING CENTER,105504,255 59TH ST N,SAINT PETERSBURG,Pinellas,21,2,14,2,124,56,2,0
WOODBRIDGE CARE CENTER,105426,8720 JACKSON SPRINGS RD,TAMPA,Hillsborough,1,3,0,0,101,13,0,0
GATEWAY CARE CENTER,105486,8600 US HWY 19 N,PINELLAS PARK,Pinellas,0,0,2,0,110,7,1,0
LAKE HARRIS HEALTH CENTER,105705,701 LAKE PORT BLVD,LEESBURG,Lake,0,2,7,0,59,1,0,0
TREASURE ISLE CARE CENTER,105408,1735 N TREASURE DRIVE,NORTH BAY VILLAGE,Miami-Dade,0,2,2,2,170,11,0,0
OAKTREE HEALTHCARE,105665,650 REED CANAL RD,SOUTH DAYTONA,Volusia,0,0,0,0,59,2,1,0
RIVIERA PALMS REHABILITATION CENTER,105603,926 HABEN BLVD,PALMETTO,Manatee,2,0,10,0,73,1,0,0
WOOD LAKE HEALTH AND REHABILITATION CENTER,105611,6414 13TH RD S,GREEN ACRES,Palm Beach,0,0,3,0,97,10,0,0
VILLAGE ON THE ISLE,105472,910 TAMIAMI TRAIL SOUTH,VENICE,Sarasota,0,0,0,0,55,1,0,0
REGENTS PARK OF WINTER PARK,105618,558 N SEMORAN BLVD,WINTER PARK,Orange,0,0,6,0,107,1,1,0
ENGLEWOOD HEALTHCARE AND REHAB,105452,1111 DRURY LN,ENGLEWOOD,Sarasota,1,0,0,0,110,0,0,0
WRIGHTS HEALTHCARE AND REHABILITATION CENTER,105849,11300 110TH AVE N,SEMINOLE,Pinellas,0,5,0,0,42,2,2,0
"GARDENS OF PORT ST LUCIE, THE",105832,1699 SE LYNGATE DRIVE,PORT SAINT LUCIE,St. Lucie,0,0,4,0,25,0,0,0
VIERA HEALTH AND REHABILITATION CENTER,105885,8050 SPYGLASS HILL RD,VIERA,Brevard,8,2,11,1,103,22,7,0
PALM GARDEN OF PINELLAS,105733,200 16TH AVE SE,LARGO,Pinellas,5,0,0,0,101,9,0,0
