"REHABILITATION CENTER OF WINTER PARK, THE",105430,1700 MONROE AVE,MAITLAND,Orange,2,37,9,0,136,6,1,0
NSPIRE HEALTHCARE PLANTATION,105519,6931 W SUNRISE BLVD,PLANTATION,Broward,,,,,,,,
TITUSVILLE REHABILITATION & NURSING CENTER,105448,1705 JESS PARRISH CT,TITUSVILLE,Brevard,1,0,0,0,125,12,0,0
ARCADIA HEALTH & REHABILITATION CENTER,105532,10095 HILLVIEW ROAD,PENSACOLA,Escambia,9,0,5,0,134,18,0,0
SARASOTA MEMORIAL NURSING AND REHABILITATION CENTE,105584,5640 RAND BLVD,SARASOTA,Sarasota,0,0,14,0,90,4,0,0
JACARANDA MANOR,105390,4250 66TH ST N,SAINT PETERSBURG,Pinellas,241,40,66,50,193,76,38,0
LAKESIDE NURSING AND REHABILITATION CENTER,105980,11411 ARMSDALE ROAD,JACKSONVILLE,Duval,2,3,19,0,99,9,8,0
RIDGECREST NURSING AND REHABILITATION CENTER,106061,1200 NORTH STONE STREET,DELAND,Volusia,16,8,52,2,129,18,22,0
JACKSON PLAZA NURSING AND REHABILITATION CENTER,106034,1861 NW 8TH AVENUE,MIAMI,Miami-Dade,37,10,10,3,84,21,0,0
WESTMINSTER WOODS ON JULINGTON CREEK,105901,25 STATE ROAD 13,JACKSONVILLE,St. Johns,0,0,0,0,50,2,0,0
LAKEVIEW TERRACE REHAB AND HEALTH CARE CENTER,106068,110 LODGE TERRACE DR,ALTOONA,Lake,0,0,0,0,22,2,1,0
CHATSWORTH AT PGA NATIONAL,106013,347 HIATT DRIVE,PALM BEACH GARDENS,Palm Beach,3,2,4,2,37,9,6,0
WESTMINSTER SUNCOAST,105926,1095 PINELLAS POINT DR S,SAINT PETERSBURG,Pinellas,17,0,0,0,87,4,0,0
GRACE REHABILITATION CENTER OF VERO BEACH,106075,2180 10TH AVENUE,VERO BEACH,Indian River,3,2,6,0,49,1,3,0
PRUITTHEALTH - SANTA ROSA,106048,5530 NORTHROP ROAD,MILTON,Santa Rosa,2,2,24,0,109,6,0,0
SOUTH DADE NURSING AND REHABILITATION CENTER,106132,17475 S DIXIE HWY,MIAMI,Miami-Dade,45,1,8,3,158,34,3,0
ATLANTIC SHORES NURSING AND REHAB CENTER,105904,4251 STACK BLVD,MELBOURNE,Brevard,3,0,0,0,91,5,0,0
BAY VILLAGE OF SARASOTA,106085,8400 VAMO ROAD,SARASOTA,Sarasota,1,2,0,0,50,2,14,0
WESTMINSTER ST AUGUSTINE,106040,230 TOWERVIEW DRIVE,SAINT AUGUSTINE,St. Johns,0,0,0,0,20,0,0,0
GOLDEN GLADES NURSING AND REHABILITATION CENTER,106131,220 SIERRA DRIVE,MIAMI,Miami-Dade,34,105,22,5,149,25,0,0
CONSULATE HEALTH CARE OF WINTER HAVEN,105998,2701 LAKE ALFRED RD,WINTER HAVEN,Polk,53,7,11,4,78,13,7,0
"VICTORIA NURSING & REHABILITATION CENTER, INC.",106031,955 NW 3RD ST,MIAMI,Miami-Dade,7,0,10,0,241,23,0,0
FREEDOM POINTE AT THE VILLAGES REHABILITATION AND,106083,1460 EL CAMINO REAL DRIVE,THE VILLAGES,Lake,0,7,4,0,48,2,0,0
RENAISSANCE AT THE TERRACES,106104,26475 SOUTH TAMIAMI TRAIL,BONITA SPRINGS,Lee,0,0,2,0,28,11,0,0
LAKESIDE NEUROLOGIC,106054,1962 VANDOLAH RD,WAUCHULA,Hardee,0,0,0,0,12,1,0,0
OAKBRIDGE HEALTHCARE CENTER,106138,3110 OAKBRIDGE BLVD E,LAKELAND,Polk,0,0,5,5,82,1,5,0
SHOAL CREEK REHABILITATION CENTER,106028,500 HOSPITAL DRIVE,CRESTVIEW,Okaloosa,44,5,0,0,106,11,3,0
ST JAMES HEALTH AND REHABILITATION CENTER,106081,239 CROOKED RIVER ROAD,CARRABELLE,Franklin,0,9,3,0,72,0,4,0
CHILDRENS COMPREHENSIVE CARE CENTER INC,106110,200 SE 19TH AVENUE,POMPANO BEACH,Broward,0,0,0,0,35,0,0,0
BROOKDALE PALMER RANCH SNF,106022,5111 PALMER RANCH PARKWAY,SARASOTA,Sarasota,0,2,3,0,47,5,5,0
FLORIDA PRESBYTERIAN HOMES INC,105949,909 LAKESIDE AVE,LAKELAND,Polk,2,5,7,0,39,2,0,0
"PAVILION FOR HEALTH CARE, THE",106096,3465 CAROLINE BLVD,PENNEY FARMS,Clay,0,0,3,0,36,0,0,0
CONSULATE HEALTH CARE OF JACKSONVILLE,105917,4101 SOUTHPOINT DRIVE EAST,JACKSONVILLE,Duval,0,0,0,0,113,7,0,0
CHATHAM GLEN HEALTHCARE AND REHABILITATION CENTER,106139,16605 SE 74TH SOULLIERE AVENUE,THE VILLAGES,Marion,0,0,0,0,9,3,6,0
LIFE CARE CENTER OF PORT SAINT LUCIE,106012,3720 SE JENNINGS RD,PORT SAINT LUCIE,St. Lucie,42,11,18,11,59,18,99,0
PRUITTHEALTH - FLEMING ISLAND,106124,2040 TOWN CENTER BLVD,FLEMING ISLAND,Clay,0,13,0,0,79,3,0,0
SUNNYSIDE NURSING HOME,106053,5201 BAHIA VISTA STREET,SARASOTA,Sarasota,0,0,2,0,45,0,0,0
GOOD SAMARITAN SOCIETY-FLORIDA LUTHERAN,105937,450 NORTH MCDONALD AVENUE,DELAND,Volusia,0,4,7,0,51,3,0,0
SPRING HILL HEALTH AND REHABILITATION CENTER,105996,12170 CORTEZ BLVD,BROOKSVILLE,Hernando,0,0,12,0,114,5,0,0
LIFE CARE CENTER OF ORLANDO,105974,3211 ROUSE ROAD,ORLANDO,Orange,4,4,6,0,100,9,1,0
ADVENTHEALTH DADE CITY,106125,13100 FORT KING RD,DADE CITY,Pasco,0,0,0,0,32,0,0,0
MANORCARE HEALTH SERVICES,105965,1450 EAST VENICE AVENUE,VENICE,Sarasota,0,4,11,0,86,0,0,0
TERRACE HEALTH & REHABILITATION CENTER,106046,7207 SW 24TH AVE,GAINESVILLE,Alachua,1,0,4,0,114,7,1,0
DESOTO HEALTH AND REHAB,106070,475 NURSING HOME DR,ARCADIA,DeSoto,0,0,2,0,37,2,1,0
UNIVERSITY PLAZA REHABILITATION AND NURSING CENTER,106100,724 NW 19TH ST,MIAMI,Miami-Dade,2,0,11,4,135,19,0,0
PRUITTHEALTH - SOUTHWOOD,106140,2301 BLUFF OAK WAY,TALLAHASSEE,Leon,0,0,2,2,20,0,0,0
WESTMINSTER POINT PLEASANT,106030,1533 4TH AVE W,BRADENTON,Manatee,30,0,9,0,98,5,0,0
CORAL REEF NURSING & REHABILITATION CENTER,105910,9869 SW 152ND STREET,MIAMI,Miami-Dade,54,53,20,15,117,47,14,0
BLOUNTSTOWN HEALTH AND REHABILITATION CENTER,105924,16690 SW CHIPOLA RD,BLOUNTSTOWN,Calhoun,14,2,15,8,60,1,1,0
GULFPORT REHABILITATION CENTER,106103,1430 PASADENA AVE S,PASADENA,Pinellas,0,0,0,0,80,3,0,0
BENTLEY CARE CENTER,106062,875 RETREAT DRIVE,NAPLES,Collier,8,4,5,4,55,16,9,0
ORLANDO HEALTH CENTER FOR REHABILITATION,106130,1300 HEMPEL AVENUE,OCOEE,Orange,0,0,0,0,65,3,0,0
OAK HAMMOCK AT THE UNIVERSITY OF FLORIDA INC,106066,2660 SW 53RD LN,GAINESVILLE,Alachua,10,0,17,2,58,2,0,0
FAIR HAVENS CENTER,106128,201 CURTISS PKWY,MIAMI SPRINGS,Miami-Dade,18,6,2,10,42,31,0,0
"LODGE AT CYPRESS COVE, THE",106019,10500 CYPRESS COVE DR,FORT MYERS,Lee,1,0,16,1,42,5,1,0
BRYNWOOD HEALTH AND REHABILITATION CENTER,106045,1656 SOUTH JEFFERSON STREET,MONTICELLO,Jefferson,0,0,0,0,79,0,0,0
MANORCARE HEALTH SERVICES,106020,13881 EAGLE RIDGE DRIVE,FORT MYERS,Lee,33,50,19,4,81,29,19,0
GULF COAST MEDICAL CENTER SKILLED NURSING UNIT,106122,13960 PLANTATION ROAD,FORT MYERS,Lee,,,,,,,,
WOODLAND GROVE HEALTH & REHABILITATION CENTER,106058,4325 SOUTHPOINT BOULEVARD,JACKSONVILLE,Duval,6,4,0,0,116,34,10,0
OLIVE BRANCH HEALTH AND REHAB CENTER,106117,8325 UNIVERSITY PARKWAY,PENSACOLA,Escambia,1,0,0,0,88,7,1,0
COMMUNITY HEALTH AND REHABILITATION CENTER,105975,3611 TRANSMITTER ROAD,PANAMA CITY,Bay,0,0,0,0,0,0,0,0
FRANCO NURSING & REHABILITATION CENTER,105903,800 NW 95TH STREET,MIAMI,Miami-Dade,11,4,6,3,108,9,0,0
VILLA HEALTH & REHABILITATION CENTER,105930,120 CHIPOLA AVE,DELAND,Volusia,0,0,5,0,114,19,0,0
STEWARD SEBASTIAN RIVER MEDICAL CENTER,106101,13695 US 1,SEBASTIAN,Indian River,0,0,0,0,25,1,0,0
PRUITTHEALTH - PANAMA CITY,106121,3212 JENKS AVENUE,PANAMA CITY,Bay,0,1,0,0,74,4,0,0
KINDRED HOSPITAL SOUTH FLORIDA HOLLYWOOD,106109,1859 VAN BUREN ST,HOLLYWOOD,Broward,0,0,2,0,23,5,1,0
SOUTHERN OAKS CARE CENTER,106051,600 W GREGORY ST,PENSACOLA,Escambia,95,0,15,6,169,18,3,0
GARDENS COURT,105921,3803 PGA BOULEVARD,PALM BEACH GARDENS,Palm Beach,4,3,4,1,85,7,0,0
RIVIERA HEALTH RESORT,106094,6901 YUMURI STREET,CORAL GABLES,Miami-Dade,3,2,65,0,219,13,7,0
BRIGHTON GARDENS OF TAMPA,106015,16702 NORTH DALE MABRY HWY,TAMPA,Hillsborough,1,0,3,0,30,0,0,0
HAVEN OF OUR LADY OF PEACE,106052,1900 SUMMIT BOULEVARD,PENSACOLA,Escambia,14,0,0,0,78,19,4,0
THE PRESERVE,106137,14750 HOPE CENTER LOOP,FORT MYERS,Lee,0,0,0,0,23,2,0,0
WESTMINSTER COMMUNITIES OF BRADENTON WESTMINSTER,105919,1700 21ST AVE W,BRADENTON,Manatee,0,0,5,0,54,7,2,0
INN AT SARASOTA BAY CLUB,106035,1303 NORTH TAMIAMI TRAIL,SARASOTA,Sarasota,0,0,2,0,36,1,0,0
CONSULATE HEALTH CARE OF PORT CHARLOTTE,105982,18480 COCHRAN BLVD,PORT CHARLOTTE,Charlotte,0,0,0,0,107,0,0,0
GULF SHORE CARE CENTER,105978,6767 86TH AVE N,PINELLAS PARK,Pinellas,59,0,7,3,77,15,0,0
CONSULATE HEALTH CARE OF KISSIMMEE,106011,2511 JOHN YOUNG PARKWAY NORTH,KISSIMMEE,Osceola,0,0,1,0,99,8,6,0
CONSULATE HEALTH CARE OF PENSACOLA,105935,235 WEST AIRPORT BLVD,PENSACOLA,Escambia,0,2,0,0,101,4,0,0
RIVERCHASE HEALTH AND REHABILITATION CENTER,106043,1017 STRONG RD,QUINCY,Gadsden,25,5,6,3,97,24,11,0
DOLPHIN POINTE HEALTH CARE CENTER,106135,5355 DOLPHIN POINT BLVD,JACKSONVILLE,Duval,0,0,0,0,83,5,0,0
PALMETTO SUBACUTE CARE CENTER,105939,7600 SW 8TH STREET,MIAMI,Miami-Dade,47,52,15,12,50,33,31,0
FREEDOM SQUARE HEALTH CARE CENTER,106042,10801 JOHNSON BLVD,SEMINOLE,Pinellas,0,5,7,3,65,3,8,0
LAKES OF CLERMONT HEALTH AND REHABILITATION CENTER,106134,1775 HOOKS STREET,CLERMONT,Lake,0,0,0,0,25,5,0,0
GRACE HEALTHCARE OF LAKE WALES,106069,730 N SCENIC HWY,LAKE WALES,Polk,1,0,0,0,73,4,112,0
"FLORIDEAN NURSING AND REHABILITATION CENTER, THE",106007,47 NW 32ND PLACE,MIAMI,Miami-Dade,2,1,9,4,78,1,6,0
GARDENS AT TERRACINA HEALTH & REHABILITATION,106129,6869 DAVIS BOULEVARD,NAPLES,Collier,0,0,0,0,20,2,0,0
LAKE MARY HEALTH AND REHABILITATION CENTER,106029,710 NORTH SUN DRIVE,LAKE MARY,Seminole,2,0,0,0,117,0,0,0
"THE ARLINGTON OF NAPLES, INC,",106108,8000 ARLINGTON CIRCLE,NAPLES,Collier,0,14,5,0,26,10,15,0
LIFE CARE CENTER OF NEW PORT RICHEY,106049,7400 TROUBLE CREEK ROAD,NEW PORT RICHEY,Pasco,0,0,22,0,113,1,37,0
HEALTH CENTER AT SINAI RESIDENCES,106111,21044 95TH AVENUE SOUTH,BOCA RATON,Palm Beach,6,1,0,0,39,12,1,0
PONCE PLAZA NURSING & REHABILITATION CENTER,106021,335 SW 12 AVENUE,MIAMI,Miami-Dade,9,0,10,4,140,33,0,0
GLADES HEALTH CARE CENTER,106018,230 SOUTH BARFIELD HIGHWAY,PAHOKEE,Palm Beach,24,1,30,17,55,34,24,0
BRIDGEWATER PARK HEALTH & REHABILITATION CENTER,106115,9280 SOUTH WEST 81ST CT,OCALA,Marion,0,0,0,0,88,4,3,0
SCOTT LAKE HEALTH AND REHABILITATION CENTER,106120,800 E COUNTY RD 540A,LAKELAND,Polk,0,0,2,0,52,0,1,0
VIERA DEL MAR HEALTH AND REHABILITATION CENTER,106123,2355 VIDINA DRIVE,VIERA,Brevard,7,2,9,0,67,4,1,0
VILLAGES REHABILITATION AND NURSING CENTER (THE),106099,900 HIGHWAY 466,LADY LAKE,Lake,5,0,3,0,99,1,0,0
BARDMOOR OAKS HEALTHCARE AND REHABILITATION CENTE,106116,9035 BRYAN DAIRY RD,LARGO,Pinellas,20,2,38,4,110,5,8,0
ADDINGTON PLACE AT WELLINGTON GREEN,106091,10330 NUVISTA AVENUE,WELLINGTON,Palm Beach,4,0,0,0,47,12,0,0
BRADENTON HEALTH CARE,106017,6305 CORTEZ RD W,BRADENTON,Manatee,12,0,20,19,43,20,3,0
MAGNOLIA HEALTH AND REHABILITATION CENTER,106032,1507 S TUTTLE AVE,SARASOTA,Sarasota,11,1,11,3,104,6,0,0
TAMPA LAKES HEALTH AND REHABILITATION CENTER,106112,750 HAYES RD,LUTZ,Hillsborough,0,4,1,0,119,2,2,0
LIFE CARE CENTER OF PALM BAY,106060,175 VILLA NUEVA AVE,PALM BAY,Brevard,0,0,23,0,128,6,2,0
BALDOMERO LOPEZ MEMORIAL VETERANS NURSING HOME,106006,6919 PARKWAY BLVD,LAND O LAKES,Pasco,22,0,4,0,86,13,3,0
CONSULATE HEALTH CARE OF SARASOTA,105983,4783 FRUITVILLE ROAD,SARASOTA,Sarasota,0,0,10,4,72,0,0,0
LEE MEMORIAL HOSPITAL SKILLED NURSING UNIT,106113,2776 CLEVELAND AVENUE,FORT MYERS,Lee,0,0,0,0,13,3,3,0
KEY WEST HEALTH AND REHABILITATION CENTER,106089,5860 W JUNIOR COLLEGE RD,KEY WEST,Monroe,0,0,3,0,102,2,1,0
"AVANTE AT OCALA, INC",106084,2021 SW 1ST AVE,OCALA,Alachua,0,0,0,0,125,4,1,0
SHANDS JACKSONVILLE MEDICAL CENTER,105961,580 W 8TH STREET,JACKSONVILLE,Duval,0,0,0,0,35,1,0,0
DE LUNA HEALTH AND REHABILITATION CENTER,106136,9310 FOWLER AVE,PENSACOLA,Escambia,0,0,3,3,27,1,2,0
ADVENTHEALTH CARE CENTER WATERMAN,106119,4501 WATERMAN WAY,TAVARES,Lake,0,0,0,0,97,11,5,0
SHELL POINT NURSING PAVILION,105966,15071 SHELL POINT BLVD,FORT MYERS,Lee,0,0,18,0,132,17,1,0
NORTH DADE NURSING AND REHABILITATION CENTER,106133,1255 NE 135TH STREET,NORTH MIAMI,Miami-Dade,25,12,17,7,184,19,0,0
ISLE HEALTH & REHABILITATION CENTER,106065,1125 FLEMING PLANTATION BLVD,ORANGE PARK,Clay,4,2,10,2,96,0,0,0
"CRYSTAL HEALTH AND REHAB CENTER, LLC",106092,48 HIGH POINT ROAD,TAVERNIER,Monroe,124,6,20,6,66,48,0,0
KR AT COLLEGE HARBOR,105959,4600 54TH AVE S,SAINT PETERSBURG,Pinellas,1,0,0,0,48,1,0,0
LIFE CARE CENTER OF ESTERO,106057,3850 WILLIAMS ROAD,ESTERO,Lee,20,0,8,6,115,11,0,0
HAWTHORNE HEALTH AND REHAB OF SARASOTA,106098,5381 DESOTO ROAD,SARASOTA,Sarasota,5,0,4,0,80,5,0,0
FLORIDA HOSPITAL NORTH PINELLAS,105912,1395 S PINELLAS AVE,TARPON SPRINGS,Pinellas,0,0,0,0,26,0,0,0
ADVENTHEALTH CARE CENTER CELEBRATION,106127,1290 CELEBRATION BLVD,KISSIMMEE,Osceola,0,1,0,0,35,1,0,0
TRINITY REGIONAL REHAB CENTER,106079,2144 WELBILT BLVD,TRINITY,Pasco,0,0,0,0,114,7,0,0
LIFE CARE CENTER AT WELLS CROSSING,105962,355 CROSSING BLVD,ORANGE PARK,Clay,3,16,15,0,90,5,9,0
WEDGEWOOD HEALTHCARE CENTER,106002,1010 CARPENTERS WAY,LAKELAND,Polk,1,0,0,0,103,2,0,0
ADVENTHEALTH CARE CENTER ORLANDO NORTH,106024,730 COURTLAND STREET,ORLANDO,Orange,0,0,3,0,101,5,6,0
HARBOURWOOD CARE CENTER,106041,549 SKY HARBOR DR,CLEARWATER,Pinellas,4,10,10,0,96,7,1,0
SIGNATURE HEALTHCARE AT THE COURTYARD,105970,2600 FOREST GLEN TRAIL,MARIANNA,Jackson,1,1,0,0,104,8,4,0
HUNTERS CREEK NURSING AND REHAB CENTER,105987,14155 TOWN LOOP BLVD,ORLANDO,Orange,4,0,0,0,97,6,0,0
"ALEXANDER ""SANDY"" NININGER STATE VETERANS NURSING",106038,8401 W CYPRESS DR,PEMBROKE PINES,Broward,86,4,41,28,86,53,14,0
BENDERSON FAMILY SKILLED NURSING AND REHAB CENTER,106090,1959 N HONORE AVE,SARASOTA,Sarasota,0,0,4,0,34,0,0,0
MANORCARE HEALTH SERVICES WEST PALM BEACH,105911,2300 VILLAGE BLVD,WEST PALM BEACH,Palm Beach,5,26,8,0,95,4,0,0
SOLARIS HEALTHCARE LAKE BENNET,105967,1091 KELTON AVE,OCOEE,Orange,0,14,25,0,100,4,4,0
FLORIDA BAPTIST RETIREMENT CENTER,106097,1006 33RD ST,VERO BEACH,Indian River,3,0,0,0,15,2,0,0
MANORCARE HEALTH SERVICES,106005,16200 JOG ROAD,DELRAY BEACH,Palm Beach,1,6,3,0,76,3,4,0
WESTMINSTER BALDWIN PARK,106118,2653 LAKE BALDWIN LANE,ORLANDO,Orange,0,0,0,0,35,5,0,0
OSPREY POINT NURSING CENTER,106008,1104 NORTH MAIN STREET,BUSHNELL,Sumter,0,0,2,0,47,2,0,0
KEYSTONE REHABILITATION AND HEALTH CENTER,106074,1120 W DONEGAN AVE,KISSIMMEE,Osceola,1,0,4,0,96,1,0,0
DOUGLAS JACOBSON STATE VETERANS NURSING HOME,106059,21281 GRAYTON TERRACE,PORT CHARLOTTE,Charlotte,0,6,7,0,95,1,0,0
VI AT LAKESIDE VILLAGE,105968,2792 DONNELLY DRIVE,LANTANA,Palm Beach,1,0,0,0,36,1,0,0
"GROVE HEALTH & REHABILITATION CENTER, THE",106036,124 W NORVELL BRYANT HWY,HERNANDO,Citrus,0,0,4,0,113,2,54,0
ST PETERSBURG NURSING & REHABILITATION,106033,521 69TH AVE N,SAINT PETERSBURG,Pinellas,45,31,0,0,68,36,3,0
FOUNTAINS REHABILITATION AT MILL COVE,105927,9960 ATRIUM WAY,JACKSONVILLE,Duval,14,12,0,0,49,17,3,0
CLYDE E LASSEN STATE VETERANS NURSING HOME,106088,4650 STATE RD 16,SAINT AUGUSTINE,St. Johns,0,1,16,0,102,4,17,0
VILLAGE PLACE HEALTH AND REHABILITATION CENTER,106072,2370 HARBOR BLVD,PORT CHARLOTTE,Charlotte,0,2,2,0,92,0,0,0
SOLARIS HEALTHCARE COCONUT CREEK,105979,4125 WEST SAMPLE RD,COCONUT CREEK,Broward,7,22,46,0,94,15,16,0
LADY LAKE SPECIALTY CARE CENTER,106003,630 GRIFFIN AVENUE,LADY LAKE,Lake,15,1,8,0,139,21,6,0
MIAMI CARE CENTER INC,106141,5959 NW 7TH ST,MIAMI,Miami-Dade,,,,,,,,
CLUB HEALTH AND REHABILITATION CENTER AT THE VILLA,106095,16529 SE 86TH BELLE MEADE CIRCLE,THE VILLAGES,Alachua,2,0,6,0,59,0,0,0
"REHABILITATION CENTER OF LAKE CITY, THE",106126,298 SW PROSPERITY PLACE,LAKE CITY,Columbia,3,2,4,0,68,5,0,0
EVANS HEALTH CARE,106000,3735 EVANS AVE,FORT MYERS,Lee,12,0,6,3,82,3,0,0
LIFE CARE CENTER OF INVERRARY,106047,4300 ROCK ISLAND ROAD,LAUDERHILL,Broward,5,0,1,1,84,10,0,0
LIFE CARE CENTER OF JACKSONVILLE,106064,4813 LENOIR AVENUE,JACKSONVILLE,Duval,0,0,0,0,93,4,1,0
HARBORCHASE OF VENICE,105955,950 PINEBROOK ROAD,VENICE,Sarasota,7,3,27,0,19,5,4,0
SKYTOP VIEW REHABILITATION CENTER,106105,2145 NORTH DON WICKHAM DRIVE,CLERMONT,Lake,1,1,0,0,22,2,0,0
MARTIN NURSING AND REHABILITATION,105972,6011 SE TOWER DR,STUART,Martin,0,9,0,0,96,6,5,0
VILLA MARIA WEST SKILLED NURSING FACILITY,106080,8850 NW 122 ST,HIALEAH GARDENS,Miami-Dade,2,1,1,1,17,2,0,0
VI AT AVENTURA,106076,19333 WEST COUNTRY CLUB DRIVE,AVENTURA,Miami-Dade,1,2,9,1,23,3,0,0
SARASOTA POINT REHABILITATION CENTER,106102,2600 COURTLAND STREET,SARASOTA,Sarasota,3,44,5,4,73,17,15,0
"NURSING CENTER AT LA POSADA, THE",106067,3600 MASTERPIECE WAY,PALM BEACH GARDENS,Palm Beach,0,1,3,0,29,3,4,0
NORTHWEST FLORIDA COMMUNITY HOSPITAL (SNU),106055,1360 BRICKYARD RD,CHIPLEY,Washington,0,0,1,0,29,0,0,0
CROSS CITY NURSING AND REHABILITATION CENTER,106009,583 NE 351 HWY,CROSS CITY,Dixie,0,2,0,0,56,7,7,0
SOLARIS HEALTHCARE DAYTONA,105915,550 NATIONAL HEALTHCARE DRIVE,DAYTONA BEACH,Volusia,0,0,0,0,68,19,1,0
GLADES WEST REHABILITATION AND NURSING C,106106,15955 BASS CREEK ROAD,PEMBROKE PINES,Broward,5,0,13,0,105,3,0,0
CLIFFORD CHESTER SIMS STATE VETERANS NURSING HOME,106056,4419 TRAM ROAD,PANAMA CITY,Bay,2,0,19,0,93,11,0,0
AVANTE AT ORLANDO INC,106027,2000 NORTH SEMORAN BOULEVARD,ORLANDO,Orange,17,4,4,0,86,9,6,0
ADVENTHEALTH CARE CENTER ZEPHYRHILL NORTH,105986,7350 DAIRY RD,ZEPHYRHILLS,Pasco,1,4,0,0,80,0,2,0
MOOSEHAVEN,106077,1701 PARK AVENUE,ORANGE PARK,Clay,0,31,17,0,34,4,53,0
GLENRIDGE ON PALMER RANCH INC.,106063,7333 SCOTLAND WAY,SARASOTA,Sarasota,0,0,0,0,45,7,0,0
LIFE CARE CENTER OF OCALA,105999,2800 SW 41ST ST,OCALA,Marion,0,2,13,0,105,3,4,0
BRANDON HEALTH AND REHABILITATION CENTER,105951,1465 OAKFIELD DR,BRANDON,Hillsborough,0,1,0,0,101,10,0,0
LAFAYETTE NURSING AND REHABILITATION CENTER,105963,512 W MAIN ST,MAYO,Lafayette,1,0,3,0,49,0,1,0
ASTORIA HEALTH AND REHABILITATION CENTER,106086,701 OVERLOOK DR SE,WINTER HAVEN,Polk,13,31,2,1,86,17,24,0
SOLARIS HEALTHCARE WINDERMERE,105960,4875 CASON COVE DRIVE,ORLANDO,Orange,9,12,9,0,104,6,0,0
BUFFALO CROSSING HEALTHCARE AND REHABILITATION CEN,106114,3875 WEDGEWOOD LANE,THE VILLAGES,Alachua,0,0,2,0,79,0,0,0
"PALMS REHABILITATION AND HEALTHCARE CENTER, THE",105985,5405 BABCOCK ST NE,PALM BAY,Brevard,0,0,5,0,112,6,9,0
KR AT HILLSBOROUGH LAKES,106093,19091 N DALE MABRY HWY,LUTZ,Hillsborough,0,2,0,0,82,9,10,0
LUTHERAN HAVEN NURSING HOME,106050,1525 HAVEN DRIVE,OVIEDO,Seminole,0,0,4,0,43,3,0,0
LIFE CARE CENTER OF SARASOTA,106025,8104 TUTTLE AVE,SARASOTA,Manatee,0,0,6,0,99,10,0,0
GRAND OAKS HEALTH AND REHABILITATION CENTER,105952,3001 PALM COAST PARKWAY SE,PALM COAST,Flagler,0,0,5,0,113,3,4,0
LIFE CARE CENTER OF PENSACOLA,106073,3291 EAST OLIVE RD,PENSACOLA,Escambia,0,12,6,0,105,5,16,0
HARBORCHASE OF NAPLES,105995,7801 AIRPORT PULLING ROAD N,NAPLES,Collier,0,0,0,0,34,10,1,0
LIFE CARE CENTER OF ORANGE PARK,105928,2145 KINGSLEY AVE,ORANGE PARK,Clay,5,0,10,1,144,7,0,0
KENDALL LAKES HEALTH AND REHABILITATION CENTER,686123,5280 SW 157 AVENUE,MIAMI,Miami-Dade,0,0,5,0,139,8,0,0
HARMONY HEALTH CENTER,686124,9820 N KENDALL DRIVE,MIAMI,Miami-Dade,3,2,5,1,185,5,1,0
