BALA NURSING AND RETIREMENT CE,396076,4001 FORD ROAD,PHILADELPHIA,Philadelphia,107,0,34,25,126,47,0,0
SENECA PLACE,395790,5360 SALTSBURG ROAD,VERONA,Allegheny,34,0,27,8,97,13,3,0
HOMEWOOD AT MARTINSBURG PA INC,395896,437 GIVLER DRIVE,MARTINSBURG,Blair,37,3,12,4,101,34,108,0
LAURELWOOD CARE CENTER,395812,100 WOODMONT ROAD,JOHNSTOWN,Cambria,98,1,31,5,94,69,8,0
THE PINES AT PHILADELPHIA REHAB AND HEALTHCARE CTR,396070,8410 ROOSEVELT BLVD,PHILADELPHIA,Philadelphia,44,14,5,3,25,16,12,0
SPIRITRUST LUTHERAN THE VILLAGE AT LUTHER RIDGE,396146,2781 LUTHER DRIVE,CHAMBERSBURG,Adams,1,0,17,0,22,8,1,0
HARSTON HALL,395791,350 HAWS LANE,FLOURTOWN,Montgomery,72,9,30,17,76,25,2,0
"HEALTH CENTER AT THE HILL AT WHITEMARSH, THE",396113,4000 FOX HOUND DRIVE,LAFAYETTE HILL,Montgomery,1,0,24,2,34,10,0,0
VINCENTIAN DE MARILLAC,395842,5300 STANTON AVENUE,PITTSBURGH,Allegheny,0,1,12,0,42,2,10,0
EMBASSY OF HEARTHSIDE,395868,450 WAUPELANI DRIVE,STATE COLLEGE,Centre,115,4,55,23,105,60,20,0
GLEN AT WILLOW VALLEY,395956,675 WILLOW VALLEY SQUARE,LANCASTER,Lancaster,34,6,37,12,182,43,9,0
RIDGEVIEW HEALTHCARE & REHAB CENTER,395929,200 PENNSYLVANIA AVENUE,SHENANDOAH,Schuylkill,77,9,16,14,80,22,3,0
ORWIGSBURG NURSING AND REHABILITATION  CENTER,395878,1000 ORWIGSBURG MANOR DR,ORWIGSBURG,Schuylkill,3,76,18,0,90,5,42,0
THE WATERMARK AT BELLINGHAM PARK LANE,396082,1615 EAST BOOT ROAD  EAST GOSHEN,WEST CHESTER,Chester,12,17,12,1,34,14,21,0
SUNNYVIEW NURSING AND REHABILITATION CENTER,395788,107 SUNNYVIEW CIRCLE,BUTLER,Butler,25,12,29,0,200,19,11,0
FOX SUBACUTE AT SOUTH PHILADELPHIA,396141,1930 SOUTH BROAD STREET,PHILADELPHIA,Philadelphia,0,120,1,0,40,3,0,0
FOXDALE VILLAGE,395838,500 E. MARYLYN AVENUE,STATE COLLEGE,Centre,0,0,14,0,41,9,19,0
SOUTHEASTERN PENNSYLVANIA VETERAN'S CENTER,39A435,ONE VETERANS DRIVE,SPRING CITY,Chester,30,172,29,3,142,28,12,0
QUALITY LIFE SERVICES - MERCER,395879,8221 LAMOR ROAD,MERCER,Mercer,28,0,10,0,38,25,24,0
PARAMOUNT NURSING AND REHABILITATION AT SOUTH HILL,396142,100 KNOEDLER ROAD,PITTSBURGH,Allegheny,2,0,0,0,14,3,1,0
HIGHLANDS AT WYOMISSING,395800,2000 CAMBRIDGE AVENUE,WYOMISSING,Berks,22,49,50,11,47,30,3,0
KADIMA REHABILITATION & NURSING AT POTTSTOWN,395827,3031 CHESTNUT HILL ROAD,POTTSTOWN,Montgomery,0,1,6,0,,0,0,0
FAIRMOUNT HOMES,395805,333 WHEAT RIDGE DRIVE,EPHRATA,Lancaster,35,19,34,12,109,45,13,0
"GROVE AT LATROBE, THE",395892,576 FRED ROGERS DRIVE,LATROBE,Westmoreland,34,0,32,8,99,17,1,0
"GARDENS AT ORANGEVILLE, THE",395899,200 BERWICK ROAD,ORANGEVILLE,Columbia,23,2,19,9,101,3,0,0
FOX SUBACUTE AT CLARA BURKE,395847,251 STENTON AVENUE,PLYMOUTH MEETING,Montgomery,0,0,13,0,54,2,0,0
ROSE VIEW NURSING AND REHABILITATION CENTER,395767,1201 RURAL AVENUE,WILLIAMSPORT,Lycoming,4,29,12,0,114,4,22,0
ABRAMSON SENIOR CARE AT LANKENAU MEDICAL CENTER,396001,100 LANCASTER AVENUE,WYNNEWOOD,Montgomery,0,0,20,9,18,1,0,0
"ORCHARD MANOR, INC",395793,20 ORCHARD DRIVE,GROVE CITY,Mercer,16,0,12,0,91,5,0,0
PENN STATE HEALTH TRANSITIONAL CARE,396134,1135 WEST CHOCOLATE AVENUE 2ND FLOOR,HUMMELSTOWN,Dauphin,1,0,0,0,11,1,0,0
JAMESON CARE CENTER,396049,3349 WILMINGTON ROAD,NEW CASTLE,Lawrence,42,0,0,0,38,62,5,0
"BRADFORD ECUMENICAL HOME, INC",395908,100 SAINT FRANCIS DRIVE,BRADFORD,McKean,0,0,23,0,93,2,0,0
PENNWOOD NURSING AND REHABILITATION CENTER LLC,395883,909 WEST STREET,PITTSBURGH,Allegheny,5,0,2,1,92,5,0,0
WESTON REHABILITATION & NURSING CENTER,396024,1896 LEITHSVILLE ROAD,HELLERTOWN,Northampton,0,0,0,0,22,1,0,0
LEHIGH VALLEY HOSPITAL TSU,395951,17TH & CHEW STS,ALLENTOWN,Lehigh,9,2,1,1,31,13,0,0
CARING HEART REHABILITATION AND NURSING CENTER,395819,6445 GERMANTOWN AVENUE,PHILADELPHIA,Philadelphia,49,1,36,9,218,53,2,0
NORRITON SQUARE NURSING AND REHABILITATION CENTER,396009,1700 PINE STREET,NORRISTOWN,Montgomery,9,3,14,1,84,16,4,0
GARDEN SPOT VILLAGE,396079,433 S KINZER AVENUE,NEW HOLLAND,Lancaster,0,42,21,0,71,16,13,0
LANDIS HOMES,395797,1001 EAST OREGON ROAD,LITITZ,Lancaster,29,59,42,3,91,66,216,0
ALLIED SERVICES SKILLED NURSING CENTER,396074,303 SMALLACOMBE DRIVE,SCRANTON,Lackawanna,91,14,44,14,242,24,23,0
DELAWARE VALLEY VETERAN'S HOME,39A436,2701 SOUTHAMPTON RD,PHILADELPHIA,Philadelphia,54,40,27,13,68,38,82,0
MASONIC VILLAGE AT WARMINSTER,396054,850 NORRISTOWN ROAD,WARMINSTER,Bucks,13,1,22,7,38,14,5,0
CONCORDIA AT VILLA ST JOSEPH,396026,1030 STATE STREET,BADEN,Beaver,43,23,70,4,100,26,74,0
"PATRIOT, A CHOICE COMMUNITY THE",395840,495 WEST PATRIOT STREET,SOMERSET,Somerset,56,26,30,3,54,49,23,0
MONTICELLO HOUSE,395974,1048 W BALTIMORE AVENUE,MEDIA,Delaware,3,5,4,3,70,8,1,0
POWERBACK REHABILITATION  EXTON,396144,501 THOMAS JONES WAY,EXTON,Chester,20,19,28,4,91,86,50,0
SAINT MARY'S AT ASBURY RIDGE,396081,4855 WEST RIDGE ROAD,ERIE,Erie,20,1,35,0,72,0,2,0
WILLIAM PENN CARE CENTER,396056,2020 ADER ROAD,JEANNETTE,Westmoreland,0,4,18,0,90,5,4,0
HOLLIDAYSBURG VETERANS HOME,39A437,PO BOX 319,HOLLIDAYSBURG,Blair,40,72,41,11,168,34,295,0
"LAFAYETTE MANOR, INC",395795,147 LAFAYETTE MANOR ROAD,UNIONTOWN,Fayette,3,0,16,0,72,3,2,0
HCC AT WHITE HORSE VILLAGE,395833,535 GRADYVILLE ROAD,NEWTOWN SQUARE,Delaware,17,3,14,3,47,23,7,0
MT HOPE NAZARENE RETIREMENT COMMUNITY,396119,3026 MOUNT HOPE HOME ROAD,MANHEIM,Lancaster,23,10,22,14,42,12,5,0
BLOOMSBURG CARE CENTER AND REHABILITATION CENTER,396065,211 EAST FIRST STREET,BLOOMSBURG,Columbia,11,39,4,4,110,25,90,0
KINKORA PYTHIAN HOME,395915,25 COVE ROAD,DUNCANNON,Perry,0,0,17,0,46,1,8,0
LAKEVIEW HEALTHCARE AND REHABILITATION CENTER,395867,15 WEST WILLOW STREET,SMETHPORT,McKean,0,0,1,0,25,0,0,0
MANORCARE HEALTH SERVICES-OXFORD VALLEY,395817,1480 OXFORD VALLEY ROAD,YARDLEY,Bucks,4,50,34,1,116,8,26,0
MANORCARE HEALTH SERVICES-NORTH HILLS,395826,1105 PERRY HIGHWAY,PITTSBURGH,Allegheny,114,50,49,28,126,54,49,0
MARGARET E. MOUL HOME,396064,2050 BARLEY ROAD,YORK,York,15,2,3,0,80,30,1,0
RICHFIELD HEALTHCARE AND REHABILITATION CENTER,396093,"PO BOX 248, 631 MAIN STREET",RICHFIELD,Juniata,29,21,14,4,28,20,5,0
ST ANNE'S RETIREMENT COMMUNITY,395806,3952 COLUMBIA AVENUE,COLUMBIA,Lancaster,3,16,68,0,80,11,13,0
SUGAR CREEK STATION SKILLED NURSING AND REHABILITA,395777,351 CAUSEWAY DRIVE,FRANKLIN,Venango,5,3,17,0,100,2,6,0
MISERICORDIA NURSING & REHABILITATION CENTER,395998,998 SOUTH RUSSELL STREET,YORK,York,12,2,14,5,34,10,1,0
PENNSYLVANIA SOLDIERS AND SAILORS HOME,39A434,PO BOX 6239,ERIE,Erie,26,0,2,2,82,18,14,0
WHITESTONE CARE CENTER,396130,370 WHITE STONE CORNER ROAD,STROUDSBURG,Monroe,55,3,34,21,34,26,6,0
CHERRY TREE NURSING CENTER,395977,410 TERRACE DRIVE,UNIONTOWN,Fayette,1,0,2,0,91,2,0,0
HIGHLAND VIEW HEALTHCARE AND REHABILITATION CENTER,395877,90 MAIN STREET,BROCKWAY,Jefferson,4,3,12,0,37,13,0,0
MANORCARE HEALTH SERVICES-HUNTINGDON VALLEY,395913,3430 HUNTINGDON PIKE,HUNTINGDON VALLEY,Montgomery,45,25,27,8,96,12,10,0
PHOEBE BERKS,395880,1 HEIDELBERG DRIVE,WERNERSVILLE,Berks,36,5,31,9,102,22,21,0
BERKSHIRE CENTER,395938,5501 PERKIOMEN AVENUE,READING,Berks,78,2,75,27,108,24,6,0
HOMEWOOD AT PLUM CREEK,395898,425 WESTMINSTER AVENUE,HANOVER,York,68,81,44,10,95,43,163,0
QUADRANGLE,395801,3300 DARBY ROAD,HAVERFORD,Delaware,30,4,26,26,39,14,1,0
UPMC NORTHWEST TRANSITIONAL CARE UNIT,395966,100 FAIRFIELD DRIVE,SENECA,Venango,3,0,0,0,6,3,0,0
MILLCREEK MANOR,396072,5535 PEACH STREET,ERIE,Erie,3,3,36,0,118,19,53,0
NAAMANS CREEK COUNTRY MANOR,395952,1194 NAAMANS CREEK ROAD,BOOTHWYN,Delaware,52,16,25,10,65,21,8,0
"NORTH STRABANE REHABILITATION AND WELLNESS CTR, LL",396073,100 TANDEM VILLAGE ROAD,CANONSBURG,Washington,0,0,0,0,57,2,1,0
MAPLE FARM,396128,604 OAK STREET,AKRON,Lancaster,4,0,19,1,39,4,2,0
KADIMA REHABILITATION & NURSING AT CAMPBELLTOWN,395846,2880 HORSESHOE PIKE  PO BOX 137,PALMYRA,Lebanon,0,0,0,0,53,1,2,0
CUMBERLAND CROSSINGS RETIREMENT COMMUNITY,395876,1 LONGSDORF WAY,CARLISLE,Cumberland,,,,,,,,
FAIR ACRES GERIATRIC CENTER,395780,340 N. MIDDLETOWN ROAD,LIMA,Delaware,266,50,201,79,448,156,68,0
JEFFERSON HILLS REHABILITATION AND WELLNESS CENTER,395948,540 COAL VALLEY ROAD,JEFFERSON HILLS,Allegheny,4,0,0,0,47,4,0,0
MANORCARE HEALTH SERVICES-PETERS TOWNSHIP,395783,113 WEST MCMURRAY ROAD,MCMURRAY,Washington,60,57,44,11,102,32,23,0
WESTMINSTER WOODS AT HUNTINGDO,396015,360 WESTMINSTER DRIVE,HUNTINGDON,Huntingdon,43,1,39,32,38,57,19,0
TITUSVILLE HEALTHCARE AND REHABILITATION CENTER,395901,81 DILLON DRIVE,TITUSVILLE,Crawford,26,28,17,1,57,12,5,0
CRAWFORD COUNTY CARE CENTER,395853,20881 STATE HIGHWAY 198,SAEGERTOWN,Crawford,1,3,0,0,124,19,16,0
MERCY CENTER NURSING UNIT INC,395850,"P O BOX 370, LAKE STREET",DALLAS,Luzerne,1,0,13,0,55,1,0,0
"CHURCH OF GOD HOME, INC",395784,801 N. HANOVER STREET,CARLISLE,Cumberland,8,0,433,0,88,13,4,0
MEADOWOOD,395768,3205 SKIPPACK PIKE PO BOX 670,WORCESTER,Montgomery,24,31,19,3,47,14,27,0
PHOEBE WYNCOTE,396120,208 FERNBROOK AVENUE,WYNCOTE,Montgomery,40,0,38,32,36,31,3,1
SETON MANOR NURSING AND REHABILITATION CENTER,396063,1000 SETON DRIVE,ORWIGSBURG,Schuylkill,11,60,7,0,99,13,53,0
PROVIDENCE REHAB AND HLTHCARE CTRATMERCYFITZGERALD,395989,600 SOUTH WYCOMBE AVE,YEADON,Delaware,102,64,32,19,108,40,15,1
TOWNVIEW HEALTH AND REHABILITATION CENTER,395823,300 BARR STREET,CANONSBURG,Washington,1,1,16,0,89,3,2,0
LOYALHANNA CARE CENTER,395860,535 MCFARLAND ROAD,LATROBE,Westmoreland,,,,,,,,
CONCORDIA AT THE CEDARS,396059,4363 NORTHERN PIKE,MONROEVILLE,Allegheny,14,0,31,1,38,8,0,0
HEINZ TRANSITIONAL REHABILITATION UNIT,396109,150 MUNDY STREET,WILKES-BARRE,Luzerne,10,5,3,0,19,21,5,0
"LUTHERAN HOME AT KANE, THE",395816,100 HIGH POINT DRIVE,KANE,McKean,6,0,19,0,74,6,2,0
STONEBRIDGE HEALTH & REHABILITATION CENTER,395785,102 CHANDRA DRIVE,DUNCANNON,Perry,0,2,9,0,55,0,5,0
"VILLA CREST, LLC",396147,1451 FRANKSTOWN ROAD,JOHNSTOWN,Cambria,0,0,0,0,7,0,2,0
"GARDENS AT MILLVILLE, THE",395872,"P.O. BOX 320,  48 HAVEN LANE",MILLVILLE,Columbia,1,3,13,0,97,5,4,0
MOUNTAIN VIEW CARE AND REHABILITATION CENTER,395881,2309 STAFFORD AVENUE,SCRANTON,Lackawanna,77,14,41,54,118,32,19,0
SHOOK HOME THE,395918,55 SOUTH SECOND STREET,CHAMBERSBURG,Franklin,58,5,38,24,44,47,20,0
AVALON SPRINGS PLACE,396058,745 GREENVILLE ROAD,MERCER,Mercer,0,0,11,0,75,6,0,0
BARCLAY FRIENDS,395848,700 NORTH FRANKLIN,WEST CHESTER,Chester,38,9,43,19,73,23,6,0
SAINT JOHN XXIII HOME,395794,2250 SHENANGO FREEWAY,HERMITAGE,Mercer,0,3,45,0,67,32,8,0
CENTENNIAL HEALTHCARE AND REHABILITATION CENTER,395950,4400 WEST GIRARD AVENUE,PHILADELPHIA,Philadelphia,1,2,8,18,154,8,2,0
WILLOW TERRACE,396129,ONE PENN BOULEVARD,PHILADELPHIA,Philadelphia,63,15,37,10,161,20,0,0
PLEASANT VIEW COMMUNITIES,395786,544 NORTH PENRYN ROAD,MANHEIM,Lancaster,1,5,30,0,83,11,11,0
SCOTTDALE HEALTHCARE AND REHABILITATION CENTER,396035,900 PORTER AVENUE,SCOTTDALE,Westmoreland,1,0,10,0,26,2,0,0
RESTORE HEALTH AT SHIPPENSBURG,395964,121 WALNUT BOTTOM ROAD,SHIPPENSBURG,Cumberland,116,16,81,34,91,45,16,0
NORMANDIE RIDGE,395902,1700 NORMANDIE DRIVE,YORK,York,2,0,7,0,54,10,13,0
REDSTONE HIGHLANDS HEALTH CARE,396021,6 GARDEN CENTER DRIVE,GREENSBURG,Westmoreland,5,17,28,0,55,17,33,0
ALLIED SERVICES TRANSITIONAL REHAB UNIT,396135,475 MORGAN HIGHWAY,SCRANTON,Lackawanna,0,2,0,0,21,3,2,0
LITTLE FLOWER MANOR,395821,1201 SPRINGFIELD ROAD,DARBY,Delaware,26,75,50,6,87,15,47,0
HARMONY PHYSICAL REHABILITATION,396138,4365 NORTHERN PIKE,MONROEVILLE,Allegheny,1,0,7,0,18,0,0,0
"TULIP SPECIAL CARE, LLC",396143,"3300 HENRY AVENUE, 7TH FLOOR",PHILADELPHIA,Philadelphia,1,15,23,0,47,7,15,0
"INN AT FREEDOM VILLAGE,THE",396062,35 FREEDOM BOULEVARD,WEST BRANDYWINE,Chester,16,9,35,10,39,5,2,0
ATHENS HEALTH AND REHABILITATION CENTER,396137,200 SOUTH MAIN ST,ATHENS,Bradford,56,0,10,6,47,32,3,0
LGAR HEALTH AND REHABILITATION,395873,800 ELSIE STREET,TURTLE CREEK,Allegheny,28,4,25,7,73,15,0,0
SPIRITRUST LUTHERAN THE VILLAGE AT UTZ TERRACE,396111,2100 UTZ TERRACE,HANOVER,York,0,1,6,0,36,17,147,0
MANORCARE HEALTH SERVICES-MONROEVILLE,396003,885 MACBETH DRIVE,MONROEVILLE,Allegheny,5,69,18,0,105,10,26,0
REHABILITATION CENTER AT BRETHREN VILLAGE LLC,396140,3001 LITITZ PIKE,LANCASTER,Lancaster,0,1,2,0,18,2,0,0
HIGHLAND PARK CARE CENTER,395773,745 NORTH HIGHLAND AVENUE,PITTSBURGH,Allegheny,18,0,13,0,103,8,0,0
WELLINGTON COURT NURSING AND REHAB CENTER,396117,1361 EAST BOOT ROAD,WEST CHESTER,Chester,25,1,3,11,28,21,16,0
MANCHESTER COMMONS OF PRESBYTERIAN SENIORCARE,395996,6351 WEST LAKE ROAD,ERIE,Erie,7,25,28,0,70,11,38,0
WATSONTOWN REHABILITATION AND NURSING CENTER,395825,245 EAST EIGHTH STREET,WATSONTOWN,Northumberland,29,13,26,0,104,8,5,0
HARMAR VILLAGE CARE CENTER,396048,715 FREEPORT ROAD,CHESWICK,Allegheny,9,19,40,0,109,18,41,0
SCHUYLKILL CENTER,395831,1000 SCHUYLKILL MANOR RD,POTTSVILLE,Schuylkill,109,1,100,22,124,60,4,0
LAKESIDE AT WILLOW VALLEY,395771,300 WILLOW VALLEY LAKES DRIVE,WILLOW STREET,Lancaster,28,12,10,8,69,26,15,0
WYNDMOOR HILLS REHABILITATION AND NURSING CENTER,396115,8601 STENTON AVENUE,WYNDMOOR,Montgomery,43,3,8,6,51,20,0,0
GOOD SHEPHERD HOME-BETHLEHEM,396108,2855 SCHOENERSVILLE ROAD,BETHLEHEM,Lehigh,1,16,24,0,60,4,31,0
STONERIDGE POPLAR RUN,395927,450 EAST LINCOLN AVENUE,MYERSTOWN,Lebanon,27,0,8,0,56,11,3,0
"CARING PLACE, THE",395959,103 N. THIRTEENTH STREET,FRANKLIN,Venango,14,3,9,1,80,7,0,0
DARWAY HEALTHCARE AND  REHABILITATION CENTER,395909,5865 ROUTE 154,FORKSVILLE,Sullivan,0,2,7,0,48,0,0,0
JUNIPER VILLAGE AT BUCKS COUNTY REHAB AND SKD CARE,395864,3200 BENSALEM BOULEVARD,BENSALEM,Bucks,1,0,4,1,8,0,0,0
EPHRATA MANOR,395857,99 BETHANY ROAD,EPHRATA,Lancaster,36,9,32,4,98,39,27,0
KIRKLAND VILLAGE,395916,2335 MADISON AVENUE,BETHLEHEM,Northampton,37,7,30,10,45,34,2,0
MON VALLEY CARE CENTER,396085,200 STOOPS DRIVE,MONONGAHELA,Washington,14,0,4,0,37,6,0,0
PHILADELPHIA PROTESTANT HOME,395961,700 E GILHAM ST,PHILADELPHIA,Philadelphia,,,,,,,,
HORSHAM CENTER FOR JEWISH LIFE,396078,1425 HORSHAM ROAD,NORTH WALES,Montgomery,10,9,80,14,332,13,2,0
"HAVEN CONVALESCENT HOME, INC",396106,725 PAUL STREET,NEW CASTLE,Lawrence,78,0,36,8,88,19,0,0
FORESTVIEW,395907,2301 EDINBORO ROAD,ERIE,Erie,0,0,29,0,74,1,35,0
BRINTON MANOR NURSING AND REHABILITATION CENTER,395917,549 BALTIMORE PIKE,GLEN MILLS,Delaware,57,9,19,13,62,21,2,0
POWERBACK REHABILITATION PHOENIXVILLE,396126,3000 BALFOUR CIRCLE,PHOENIXVILLE,Chester,2,1,3,1,18,3,5,0
QUALITY LIFE SERVICES - HENRY CLAY,395906,5253 NATIONAL PIKE,MARKLEYSBURG,Fayette,0,0,0,0,71,11,12,0
CHAMBERS POINTE HEALTH CARE CENTER,395944,1425 PHILADELPHIA AVENUE,CHAMBERSBURG,Franklin,0,0,250,0,54,7,1,0
FAIRVIEW NURSING AND REHABILITATION CENTER,395782,184 BETHLEHEM PIKE,PHILADELPHIA,Philadelphia,7,2,56,29,134,14,0,0
LITTLE SISTERS OF THE POOR,396116,1028 BENTON AVENUE,PITTSBURGH,Allegheny,2,7,7,0,44,2,6,0
NORTH HILLS HEALTH AND REHABILITATION CENTER,395903,194 SWINDERMAN ROAD,WEXFORD,Allegheny,6,0,15,0,44,1,0,0
HOMETOWN NURSING AND REHAB CEN,395875,149 LAFAYETTE AVENUE,TAMAQUA,Schuylkill,2,30,52,1,111,9,18,0
QUALITY LIFE SERVICES - MARKLEYSBURG,395870,252 MAIN STREET,MARKLEYSBURG,Fayette,22,23,10,0,57,16,4,0
CONTINUING CARE  AT MARIS GROVE,396123,500 MARIS GROVE WAY,GLEN MILLS,Delaware,17,10,63,6,58,13,58,0
UPMC MAGEE-WOMENS HOSPITAL TCU,396098,300 HALKET STREET,PITTSBURGH,Allegheny,0,0,0,0,9,3,5,0
MANORCARE HEALTH SERVICES-KING OF PRUSSIA,395834,600 WEST VALLEY FORGE ROAD,KING OF PRUSSIA,Montgomery,10,29,21,3,112,11,14,0
ANN'S CHOICE,396107,16000 ANN'S CHOICE WAY,WARMINSTER,Bucks,3,1,36,1,63,9,56,0
CHRIST'S HOME RETIREMENT COMMUNITY,396125,1 SHEPHERD'S WAY SUITE 100,WARMINSTER,Bucks,19,3,4,0,32,24,10,0
MANORCARE HEALTH SERVICES-WHITEHALL BOROUGH,396066,505 WEYMAN ROAD,PITTSBURGH,Allegheny,34,39,28,3,110,29,29,0
UPMC MCKEESPORT LONG TERM CARE,395925,1500 FIFTH AVENUE,MCKEESPORT,Allegheny,0,0,0,0,9,15,1,0
SUNSET RIDGE HEALTHCARE AND REHABILITATION CENTER,395953,3298 RIDGE ROAD,BLOOMSBURG,Columbia,0,69,19,0,58,1,0,0
KINGSTON HEALTH CARE CENTER,395905,702 THIRD AVENUE,KINGSTON,Luzerne,1,17,7,0,55,3,4,0
THORNWALD HOME,395802,442 WALNUT BOTTOM ROAD,CARLISLE,Cumberland,19,1,27,3,60,23,1,0
PROVIDENCE POINT HEALTHCARE RESIDENCE,396124,200 ADAMS AVE,PITTSBURGH,Allegheny,1,8,0,0,43,44,0,0
CONESTOGA VIEW,395774,900 EAST KING STREET,LANCASTER,Lancaster,174,166,59,27,351,114,158,0
"COMMUNITIES AT INDIAN HAVEN,",395778,1675 SALTSBURG AVENUE,INDIANA,Indiana,50,0,25,3,67,22,0,0
CEDAR HAVEN HEALTHCARE CENTER,395770,590 SOUTH FIFTH AVENUE,LEBANON,Lebanon,171,57,82,37,202,115,115,0
POWERBACK REHABILITATION 3485 DAVISVILLE ROAD,396017,3485 DAVISVILLE ROAD,HATBORO,Montgomery,15,15,19,1,84,24,9,0
AVENTURA AT CREEKSIDE,395984,45 NORTH SCOTT STREET,CARBONDALE,Lackawanna,0,2,13,0,63,0,9,0
CRANBERRY PLACE,395845,5 SAINT FRANCIS WAY,CRANBERRY TOWNSHIP,Butler,14,2,4,0,78,7,6,0
SACRED HEART HOSPITAL TCF,395926,421 CHEW STREET,ALLENTOWN,Lehigh,0,0,2,2,11,1,10,0
SCRANTON HEALTH CARE CENTER,396095,2933 MCCARTHY STREET,SCRANTON,Lackawanna,3,0,10,0,39,1,0,0
GREEN VALLEY SKILLED NURSING AND REHABILITATION CE,396086,1 MATTHEW DRIVE,POTTSVILLE,Schuylkill,6,0,2,1,33,3,0,0
ELIZABETHTOWN HEALTHCARE AND REHAB CENTER,395844,141 HEISEY AVENUE,ELIZABETHTOWN,Lancaster,43,0,15,7,45,8,2,0
KITTANNING CARE CENTER,395986,120 KITTANNING CARE DRIVE,KITTANNING,Armstrong,91,38,41,21,60,53,23,0
SHENANGO PRESBYTERIAN SENIORCARE,396105,238 SOUTH MARKET STREET,NEW WILMINGTON,Lawrence,0,0,14,0,31,2,7,0
MEADVILLE MEDICAL CTR TCU,395894,1034 GROVE STREET,MEADVILLE,Crawford,0,0,0,0,16,7,2,0
SNU ARMSTRONG CO MEMORIAL HOSP,395890,ONE NOLTE DRIVE,KITTANNING,Armstrong,1,0,0,0,4,5,0,0
CENTRE CREST,395779,502 EAST HOWARD STREET,BELLEFONTE,Centre,54,42,0,0,169,92,27,0
CLEPPER MANOR,396071,959 EAST STATE STREET,SHARON,Mercer,2,0,54,0,44,8,0,0
WAYNE WOODLANDS MANOR,395936,37 WOODLANDS DRIVE,WAYMART,Wayne,0,0,434,0,71,0,0,0
OLD ORCHARD HEALTH CARE CENTER,396077,4100 FREEMANSBURG AVENUE,EASTON,Northampton,25,17,50,13,123,5,20,0
TRANSITIONAL SUB-ACUTE UNIT,395941,2802 PAPERMILL ROAD,WYOMISSING,Berks,4,3,1,1,42,25,1,0
LUTHERAN COMMUNITY AT TELFORD,395804,12 LUTHERAN HOME DRIVE,TELFORD,Montgomery,0,0,42,0,56,10,2,0
