EDDY MEMORIAL GERIATRIC CENTER,335680,2256 BURDETT AVENUE,TROY,Rensselaer,9,0,31,17,67,4,0,0
QUEENS NASSAU REHABILITATION AND NURSING CENTER,335448,520 BEACH 19TH STREET,FAR ROCKAWAY,Queens,14,4,1,1,171,0,0,0
BEACH GARDENS REHAB AND NURSING CENTER,335682,17 11 BROOKHAVEN AVENUE,FAR ROCKAWAY,Queens,3,6,1,1,112,0,0,0
THE OSBORN,335797,101 THEALL ROAD,RYE,Westchester,0,0,0,0,57,3,2,0
NORTH GATE HEALTH CARE FACILITY,335649,7264 NASH ROAD,NORTH TONAWANDA,Niagara,18,15,4,0,176,14,22,0
THE BROOK AT HIGH FALLS NURSING HOME AND REHAB CTR,335825,2150 ST PAUL STREET,ROCHESTER,Monroe,,,,,,,,
HOUGHTON REHABILITATION & NURSING CENTER,335641,9876 LUCKEY DRIVE,HOUGHTON,Allegany,,,,,,,,
SENECA HILL MANOR INC,335815,20 MANOR DRIVE,OSWEGO,Oswego,,,,,,,,
JENNIE B RICHMOND CHAFFEE NURSING HOME COMPANY INC,335435,222 EAST MAIN STREET,SPRINGVILLE,Erie,0,0,10,1,56,4,0,0
DITMAS PARK CARE CENTER,335648,2107 DITMAS AVENUE,BROOKLYN,Kings,9,63,50,41,144,9,11,0
NORTHERN MANHATTAN REHABILITATION AND NURSING CTR,335792,116 EAST 125TH ST,NEW YORK,New York,37,35,79,56,227,25,8,0
FATHER BAKER MANOR,335777,6400 POWERS ROAD,ORCHARD PARK,Erie,,,,,,,,
THE PAVILION AT QUEENS FOR REHABILITATION & NRSING,335804,36 17 PARSONS BOULEVARD,FLUSHING,Queens,3,5,8,2,238,0,0,0
HUNTINGTON HILLS CTR FOR HEALTH AND REHABILITATION,335818,400 SOUTH SERVICE ROAD,MELVILLE,Suffolk,66,4,116,60,214,84,14,1
ABSOLUT CTR FOR NURSING & REHAB ALLEGANY L L C,335610,2178 NORTH FIFTH STREET,ALLEGANY,Cattaraugus,0,0,0,0,34,0,0,0
LONG ISLAND STATE VETERANS HOME,335758,100 PATRIOTS ROAD,STONYBROOK,Suffolk,42,0,12,10,243,23,0,0
MORNINGSIDE NURSING AND REHABILITATION CENTER,335484,1000 PELHAM PARKWAY SOUTH,BRONX,Bronx,54,116,72,38,293,30,17,0
THE PINES HEALTHCARE & REHAB CTRS MACHIAS CAMPUS,335578,9822 ROUTE 16,MACHIAS,Cattaraugus,0,0,33,0,111,6,0,0
WOODHAVEN NURSING HOME,335514,1360 ROUTE 112,PORT JEFFERSON STATI,Suffolk,3,48,1,1,111,4,7,0
"BETSY ROSS REHABILITATION CENTER, INC",335727,1 ELSIE STREET,ROME,Oneida,0,0,6,0,108,0,0,0
"FRIEDWALD CENTER FOR REHAB AND NURSING, L L C",335734,475 NEW HEMPSTEAD ROAD,NEW CITY,Rockland,0,0,11,10,147,2,1,0
ELDERWOOD AT LANCASTER,335577,1818 COMO PARK BLVD,LANCASTER,Erie,4,0,0,0,79,4,0,0
ELDERWOOD AT TICONDEROGA,335482,1019 WICKER STREET,TICONDEROGA,Essex,0,1,0,0,76,0,1,0
ST JOSEPHS PLACE,335692,160 EAST MAIN STREET,PORT JERVIS,Orange,29,1,16,9,27,22,0,0
DEGRAFF MEMORIAL HOSPITAL-SKILLED NURSING FACILITY,335669,445 TREMONT STREET,NORTH TONAWANDA,Niagara,0,0,4,0,70,0,0,0
KENDAL AT ITHACA,335793,2230 NORTH TRIPHAMMER ROAD,ITHACA,Tompkins,0,0,10,0,42,0,0,0
"ROME MEMORIAL HOSPITAL, INC - R H C F",335563,1500 NORTH JAMES STREET,ROME,Oneida,27,1,6,9,60,5,0,0
WARREN CENTER FOR REHABILITATION AND NURSING,335549,42 GURNEY LANE,QUEENSBURY,Warren,0,0,0,0,77,0,0,0
SEAGATE REHABILITATION AND NURSING CENTER,335513,3015 W 29 ST,BROOKLYN,Kings,10,14,6,5,264,22,0,0
PUTNAM RIDGE,335824,46 MT EBO ROAD NORTH,BREWSTER,Putnam,8,10,6,2,120,0,0,0
VICTORIA HOME,335714,25 N MALCOLM STREET,OSSINING,Westchester,6,4,2,1,26,1,0,0
WESTERN NEW YORK STATE VETERANS HOME,335788,220 RICHMOND AVENUE,BATAVIA,Genesee,0,0,0,0,109,1,1,0
GUTHRIE CORTLAND MEDICAL CENTER,335768,134 HOMER AVENUE,CORTLAND,Cortland,0,0,0,0,68,2,2,0
"SUNSET NURSING AND REHABILITATION CENTER, INC",335587,232 ACADEMY STREET,BOONVILLE,Oneida,0,0,0,0,96,0,0,0
HIGHPOINTE ON MICHIGAN HEALTH CARE FACILITY,335834,1031 MICHIGAN AVE,BUFFALO,Erie,0,0,3,0,260,1,0,0
ST MARYS CENTER INC,335762,516 WEST 126TH STREET,NEW YORK,New York,8,0,6,2,33,6,8,0
MIDDLETOWN PARK REHAB & HEALTH CARE CENTER,335655,121 DUNNING ROAD,MIDDLETOWN,Orange,80,36,43,12,152,46,0,0
BETHANY GARDENS SKILLED LIVING CENTER,335732,800 WEST CHESTNUT STREET,ROME,Oneida,0,0,20,0,95,0,8,0
UPSTATE UNIVERSITY HOSP AT COMMUNITY GENERAL T C U,335870,4900 BROAD ROAD,SYRACUSE,Onondaga,0,0,0,0,14,0,0,0
EAST NECK NURSING & REHABILITATION CENTER,335681,134 GREAT EAST NECK ROAD,WEST BABYLON,Suffolk,108,168,69,49,242,62,52,1
BAPTIST HEALTH NURSING AND REHABILITATION CENTER,335612,297 N BALLSTON AVE,SCOTIA,Schenectady,0,4,20,0,206,4,0,0
HILLSIDE MANOR REHAB & EXTENDED CARE CENTER,335531,182 15 HILLSIDE AVENUE,JAMAICA EST,Queens,144,16,89,54,271,86,43,0
LINDEN CENTER FOR NURSING AND REHABILITATION,335811,2237 LINDEN BOULEVARD,BROOKLYN,Kings,0,7,2,1,241,0,0,0
HIGHLAND REHABILITATION AND NURSING CENTER,335526,120 HIGHLAND AVENUE,MIDDLETOWN,Orange,34,0,26,20,91,1,0,0
"HARLEM CTR FOR NURSING AND REHABILITATION, L L C",335522,30 WEST 138TH STREET,NEW YORK,New York,33,13,1,1,178,26,14,0
BETHANY NURSING HOME & HEALTH RELATED FACILITY INC,335645,3005 WATKINS ROAD,HORSEHEADS,Chemung,1,6,22,0,107,0,13,0
MORNINGSTAR RESIDENTIAL CARE CENTER,335489,17 SUNRISE TERRACE,OSWEGO,Oswego,0,0,1,0,103,0,0,0
SLATE VALLEY CENTER FOR REHABILITATION AND NURSING,335711,10421 STATE ROUTE 40,GRANVILLE,Washington,0,0,3,0,84,0,0,0
DOWNTOWN BROOKLYN NURSING & REHABILITATION CENTER,335625,520 PROSPECT PLACE,BROOKLYN,Kings,52,105,61,46,273,27,3,0
HIGHLAND NURSING HOME INC,335619,182 HIGHLAND ROAD,MASSENA,St. Lawrence,0,0,0,0,81,0,0,0
NORWEGIAN CHRISTIAN HOME AND HEALTH CENTER,335523,1270 67TH STREET,BROOKLYN,Kings,40,27,37,14,124,15,20,0
ST MARYS HOSPITAL FOR CHILDREN,33A081,29 01 216 STREET,BAYSIDE,Queens,0,0,0,0,126,35,0,0
TERESIAN HOUSE NURSING HOME CO INC,335627,200 WASHINGTON AVE EXT,ALBANY,Albany,2,0,13,4,213,4,2,0
THE GROVE AT VALHALLA REHAB AND NURSING CENTER,335809,61 GRASSLANDS ROAD,VALHALLA,Westchester,18,8,10,3,138,4,0,0
"WILLIAMSVILLE SUBURBAN, L L C",335647,163 SOUTH UNION ROAD,WILLIAMSVILLE,Erie,38,0,6,1,162,5,3,0
THE PINES AT POUGHKEEPSIE CTR FOR NURSING & REHAB,335440,100 FRANKLIN STREET,POUGHKEEPSIE,Dutchess,26,0,13,10,151,9,2,0
FOUR SEASONS NURSING AND REHABILITATION CENTER,335673,1555 ROCKAWAY PARKWAY,BROOKLYN,Kings,38,0,6,3,199,5,4,0
THE HIGHLANDS AT BRIGHTON,335778,5901 LAC DE VILLE BLVD,ROCHESTER,Monroe,0,0,0,0,134,4,2,0
OUR LADY OF CONSOLATION NURSING AND REHAB CARE CTR,335539,111 BEACH DRIVE,WEST ISLIP,Suffolk,9,8,6,5,266,13,7,0
CHAMPLAIN VALLEY PHYSICIANS HOSP MED CTR S N F,335442,75 BEEKMAN STREET,PLATTSBURGH,Clinton,0,0,0,0,33,0,1,0
UNITED HEBREW GERIATRIC CENTER,335621,391 PELHAM ROAD,NEW ROCHELLE,Westchester,34,1,6,1,258,19,2,0
IROQUOIS NURSING HOME INC,335764,4600 SOUTHWOOD HEIGHTS DRIVE,JAMESVILLE,Onondaga,0,0,7,0,140,2,0,0
EAST SIDE NURSING HOME,335511,62 PROSPECT ST,WARSAW,Wyoming,0,0,0,0,74,1,0,0
LATTA ROAD NURSING HOME EAST,335618,2102 LATTA ROAD,ROCHESTER,Monroe,7,0,3,1,37,17,0,0
GOLDEN GATE REHABILITATION & HEALTH CARE CENTER,335502,191 BRADLEY AVE,STATEN ISLAND,Richmond,4,0,2,2,179,3,0,0
BROOKLYN QUEENS NURSING HOME,335637,2749 LINDEN BLVD,BROOKLYN,Kings,10,4,0,0,104,16,11,1
THE PEARL NURSING CENTER OF ROCHESTER,335439,1335 PORTLAND AVE,ROCHESTER,Monroe,0,0,0,0,105,0,0,0
PECONIC BAY SKILLED NURSING FACILITY,335688,1300 ROANOKE AVENUE,RIVERHEAD,Suffolk,6,3,37,24,43,23,0,0
MEADOWBROOK CARE CENTER,335796,320 WEST MERRICK ROAD,FREEPORT,Nassau,28,6,2,0,200,5,1,0
KIRKHAVEN,335668,254 ALEXANDER STREET,ROCHESTER,Monroe,41,1,38,25,113,18,0,0
CROWN HEIGHTS CENTER FOR NURSING AND REHAB,335609,810 20 ST MARKS AVENUE,BROOKLYN,Kings,5,14,5,4,241,5,8,0
N Y S VETERANS HOME IN N Y C,335770,178 50 LINDEN BLVD,JAMAICA,Queens,45,0,15,6,140,22,0,0
GARDEN CARE CENTER,335817,135 FRANKLIN AVENUE,FRANKLIN SQUARE,Nassau,7,0,5,3,86,2,0,0
MAPLEWOOD NURSING HOME INC,335572,100 DANIEL DRIVE,WEBSTER,Monroe,0,0,0,0,72,1,0,0
GOOD SAMARITAN NURSING HOME,335636,101 ELM ST,SAYVILLE,Suffolk,0,0,6,4,68,2,0,0
CONCORD NURSING AND REHABILITATION CENTER,335538,300 MADISON STREET,BROOKLYN,Kings,1,0,3,0,130,0,0,0
SULLIVAN COUNTY ADULT CARE CENTER,335628,256 SUNSET LAKE ROAD,LIBERTY,Sullivan,54,0,2,2,90,3,0,0
HORIZON CARE CENTER,335738,64 11 BEACH CHANNEL DRIVE,ARVERNE,Queens,2,18,1,1,226,5,0,0
PARK AVENUE EXTENDED CARE FACILITY,335819,425 NATIONAL BOULEVARD,LONG BEACH,Nassau,3,7,4,3,160,2,2,0
CONCOURSE REHABILITATION AND NURSING CENTER INC,335493,1072 GRAND CONCOURSE,BRONX,Bronx,80,26,57,35,194,21,13,2
ST ANNS COMMUNITY,335730,920 CHERRY RIDGE BLVD,WEBSTER,Monroe,0,0,0,0,68,0,13,0
THE GRAND REHABILITATION AND NRSG AT CHITTENANGO,335588,331 RUSSELL STREET,CHITTENANGO,Madison,28,0,5,1,57,1,4,0
ANDRUS ON HUDSON,335795,185 OLD BROADWAY,HASTINGS ON HUDSON,Westchester,9,0,3,2,176,1,0,0
THE GRAND REHABILITATION AND NRSG AT RIVER VALLEY,335827,140 MAIN STREET,POUGHKEEPSIE,Dutchess,1,1,0,0,149,2,2,0
MCAULEY RESIDENCE,335433,1503 MILITARY ROAD,KENMORE,Erie,0,3,13,2,47,29,0,1
PRESBYTERIAN HOME FOR CENTRAL NEW YORK INC,335546,4290 MIDDLE SETTLEMENT ROAD,NEW HARTFORD,Oneida,15,2,5,2,151,10,0,0
LIVINGSTON COUNTY CENTER FOR NURSING AND REHAB,335562,11 MURRAY HILL DRIVE,MOUNT MORRIS,Livingston,0,0,23,0,223,1,0,0
NASSAU REHABILITATION & NURSING CENTER,335787,ONE GREENWICH STREET,HEMPSTEAD,Nassau,0,0,0,0,224,0,0,0
NORTH SHORE - L I J ORZAC CTR FOR REHABILITATION,335700,900 FRANKLIN AVENUE,VALLEY STREAM,Nassau,1,0,5,3,61,5,1,0
ELDERWOOD AT LOCKPORT,335500,104 OLD NIAGARA ROAD,LOCKPORT,Niagara,0,0,18,1,112,0,0,0
HOPKINS CENTER FOR REHABILITATION AND HEALTHCARE,335847,155 DEAN STREET,BROOKLYN,Kings,30,0,2,2,184,2,0,0
CREST MANOR LIVING AND REHABILITATION CENTER,335467,6745 PITTSFORD PALMYRA ROAD,FAIRPORT,Monroe,0,0,0,0,71,0,0,0
BEECHWOOD HOMES,335468,2235 MILLERSPORT HIGHWAY,GETZVILLE,Erie,,,,,,,,
DUNKIRK REHABILITATION & NURSING CENTER,335595,447 449 LAKE SHORE DRIVE WEST,DUNKIRK,Chautauqua,0,0,0,0,34,0,0,0
ONEIDA CENTER FOR REHABILITATION AND NURSING,335794,1445 KEMBLE STREET,UTICA,Oneida,0,0,0,0,116,0,0,0
JAMAICA HOSPITAL NURSING HOME CO INC,335436,89-40  135TH  STREET,JAMAICA,Queens,29,0,61,34,153,45,2,0
LUXOR NURSING AND REHABILITATION AT MILLS POND,335739,273 MORICHES ROAD,ST JAMES,Suffolk,0,10,4,4,222,2,0,0
NORTHERN WESTCHESTER HOSPITAL T C U,335869,400 EAST MAIN STREET,MOUNT KISCO,Westchester,0,0,0,0,2,0,0,0
GOOD SHEPHERD-FAIRVIEW HOME INC,335527,80 FAIRVIEW AVENUE,BINGHAMTON,Broome,,,,,,,,
HOLLISWOOD CTR FOR REHABILITATION AND HEALTHCARE,335503,195 44 WOODHULL AVENUE,HOLLIS,Queens,82,23,7,2,294,1,0,0
"N Y CONGREGATIONAL NURSING CENTER, INC",335560,135 LINDEN BOULEVARD,BROOKLYN,Kings,51,47,95,60,114,29,32,2
CAMPBELL HALL REHABILITATION CENTER INC,335657,23 KIERNAN RD,CAMPBELL HALL,Orange,0,0,12,13,90,2,0,0
ACHIEVE REHAB AND NURSING FACILITY,335449,170 LAKE STREET,LIBERTY,Sullivan,17,0,5,3,118,41,0,0
LITTLE NECK CARE CENTER,335434,260 19 NASSAU BLVD,LITTLE NECK,Queens,0,0,2,0,108,1,0,0
ONTARIO CENTER FOR REHABILITATION AND HEALTHCARE,335564,3062 COUNTY COMPLEX DRIVE,CANANDAIGUA,Ontario,0,0,1,0,92,0,0,0
MENORAH HOME & HOSPITAL FOR AGED & INFIRM,335653,1516 ORIENTAL BLVD,BROOKLYN,Kings,7,19,20,15,294,2,9,1
TEN BROECK COMMONS,335765,ONE COMMONS DRIVE,LAKE KATRINE,Ulster,88,0,43,25,189,57,16,0
ST LUKE RESIDENTIAL HEALTH CARE FACILITY INC,335746,299 EAST RIVER ROAD,OSWEGO,Oswego,0,0,1,0,175,1,1,0
