Provider Name,Federal Provider Number,Provider Address,Provider City,County,Residents Total Confirmed COVID-19,Residents Total Suspected COVID-19,Residents Total All Deaths,Residents Total COVID-19 Deaths,Total Number of Occupied Beds,Staff Total Confirmed COVID-19,Staff Total Suspected COVID-19,Staff Total COVID-19 Deaths
OAK TRACE CARE & REHABILITATION CENTER,015050,325 SELMA ROAD,BESSEMER,Jefferson,1,0,6,0,65,7,0,0
CROWNE HEALTH CARE OF MONTGOMERY,015393,1837 UPPER WETUMPKA ROAD,MONTGOMERY,Montgomery,2,0,16,0,155,7,4,0
CROWNE HEALTH CARE OF EUFAULA,015199,430 RIVERS AVENUE,EUFAULA,Barbour,43,22,14,3,133,12,19,0
REGENCY HEALTH CARE AND REHABILITATION CENTER,015372,"2061 POOLE DRIVE, NW",HUNTSVILLE,Madison,1,1,0,0,68,1,2,0
"CHAPMAN HEALTHCARE CENTER, INC",015221,3701 DADEVILLE ROAD,ALEXANDER CITY,Tallapoosa,6,0,8,1,142,4,0,0
MERRY WOOD LODGE,015019,P O BOX 130,ELMORE,Elmore,53,40,14,5,72,45,11,0
TERRACE OAKS CARE & REHABILITATION CENTER,015060,4201 BESSEMER SUPER HIGHWAY,BESSEMER,Jefferson,5,0,0,0,54,14,0,0
AZALEA GARDENS OF MOBILE,015151,1758 SPRINGHILL AVE,MOBILE,Mobile,13,1,2,0,86,8,5,0
"ASHLAND PLACE HEALTH AND REHABILITATION, LLC",015103,148 TUSCALOOSA ST,MOBILE,Mobile,81,19,31,21,87,21,5,0
DIVERSICARE OF MONTGOMERY,015040,2020 NORTH COUNTRY CLUB DRIVE,MONTGOMERY,Montgomery,52,0,13,11,84,25,15,0
FAYETTE MEDICAL CENTER LONG TERM CARE UNIT,015154,1653 TEMPLE AVENUE NORTH,FAYETTE,Fayette,3,17,4,2,98,7,7,0
DIVERSICARE OF OXFORD,015132,1130 SOUTH HALE STREET,OXFORD,Calhoun,0,0,2,0,136,1,0,0
CAMDEN NURSING FACILITY INC.,015374,210 PONDEROSA DRIVE,CAMDEN,Wilcox,25,4,10,6,51,22,7,0
EXTENDICARE HEALTH CENTER,015152,950 SOUTH ST. ANDREWS STREET,DOTHAN,Houston,30,56,28,2,128,20,55,0
WESLEY PLACE ON HONEYSUCKLE,015175,718 HONEYSUCKLE ROAD,DOTHAN,Houston,31,4,10,6,144,25,20,0
ARLINGTON REHABILITATION & HEALTHCARE CENTER,015153,"1020 TUSCALOOSA AVENUE, SW",BIRMINGHAM,Jefferson,16,0,0,0,99,14,3,0
"LUVERNE HEALTH AND REHABILITATION, LLC",015336,142 WEST THIRD STREET,LUVERNE,Crenshaw,1,15,23,0,139,5,27,0
ANNISTON HEALTH AND REHAB SERVICES,015375,600 E 8TH STREET,ANNISTON,Calhoun,1,0,1,0,59,2,0,0
WESTSIDE TERRACE HEALTH & REHABILITATION CENTER,015425,501 NORTH WOODBURN DRIVE,DOTHAN,Houston,6,9,7,0,131,5,13,0
"CIVIC CENTER HEALTH AND REHABILITATION, LLC",015109,1201 22ND STREET NORTH,BIRMINGHAM,Jefferson,0,4,8,0,85,1,1,0
MADISON MANOR NURSING HOME,015214,3891 SULLIVAN ST,MADISON,Madison,0,7,6,0,69,1,10,0
MEADOWVIEW NURSING CENTER,015400,7300 OLD HIGHWAY 78 EAST,PELL CITY,St. Clair,0,4,0,0,52,0,20,0
LEGACY HEALTH AND REHABILITATION OF PLEASANT GROVE,015461,30 7TH STREET,PLEASANT GROVE,Jefferson,1,32,9,0,119,6,10,1
"NHC HEALTHCARE, MOULTON",015128,300 HOSPITAL STREET,MOULTON,Lawrence,1,1,0,0,117,0,0,0
LAFAYETTE EXTENDED CARE,015197,805 HOSPITAL STREET SOUTHWEST,LAFAYETTE,Chambers,0,0,2,1,53,0,1,0
BARON HOUSE OF HUEYTOWN,015404,190 BROOKLANE DRIVE,HUEYTOWN,Jefferson,3,0,17,11,27,23,23,0
"CROSSVILLE HEALTH AND REHABILITATION, LLC",015176,8922 HIGHWAY 227,CROSSVILLE,DeKalb,67,4,23,2,123,38,10,0
ATMORE NURSING CENTER,015129,715 EAST LAUREL STREET,ATMORE,Escambia,33,2,7,6,69,20,7,0
MCGUFFEY HEALTH & REHABILITATION CENTER,015202,2301 RAINBOW DRIVE,GADSDEN,Etowah,4,15,10,0,141,2,22,0
"GENERATIONS OF RED BAY, LLC",015201,106 TENTH AVENUE NORTHWEST,RED BAY,Franklin,1,9,8,0,61,2,41,0
BIRMINGHAM NURSING AND REHABILITATION CENTER EAST,015134,733 MARY VANN LANE,BIRMINGHAM,Jefferson,1,0,5,0,131,1,0,0
PARKWOOD HEALTH CARE FACILITY,015179,3301 STADIUM DRIVE,PHENIX CITY,Russell,1,2,20,0,64,4,7,0
ATTALLA HEALTH AND REHAB,015203,915 STEWART AVENUE SOUTHEAST,ATTALLA,Etowah,40,0,11,1,59,52,13,0
MOUNT ROYAL TOWERS,015455,300 ROYAL TOWER DRIVE,BIRMINGHAM,Jefferson,1,1,4,0,115,7,6,0
ARBOR WOODS HEALTH AND REHAB,015141,515 2ND AVENUE NORTHWEST,REFORM,Pickens,0,0,1,0,55,0,0,0
GREENE COUNTY NURSING HOME,015178,509 WILSON AVE,EUTAW,Greene,21,0,11,11,38,1,0,0
CROWNE HEALTH CARE OF THOMASVILLE,015220,1425 MOSLEY DRIVE,THOMASVILLE,Clarke,4,0,0,0,73,10,0,0
DIVERSICARE OF BESSEMER,015209,820 GOLF COURSE ROAD,BESSEMER,Jefferson,62,2,37,26,129,38,3,1
"MOUNDVILLE HEALTH AND REHABILITATION, LLC",015187,THIRD AVENUE    P O BOX 607,MOUNDVILLE,Hale,0,5,14,0,58,5,10,0
ALTOONA  HEALTH & REHAB,015101,6532 WALNUT GROVE ROAD,ALTOONA,Etowah,1,0,0,0,48,2,0,0
NORTHSIDE HEALTH CARE,015223,700 HUTCHINS AVENUE,GADSDEN,Etowah,8,0,1,0,90,8,5,0
SANCTUARY AT THE WOODLANDS,015471,1910 CHEROKEE  AVENUE SW,CULLMAN,Cullman,,,,,,,,
"GENERATIONS OF VERNON, LLC",015227,1050 CONVALESCENT ROAD,VERNON,Lamar,1,4,0,0,111,1,17,0
"RIDGEVIEW HEALTH SERVICES, INC",015155,"907 11TH STREET, NE",JASPER,Walker,88,42,21,15,96,71,58,0
ASPIRE PHYSICAL RECOVERY CENTER OF WEST ALABAMA,015465,2400 HOSPITAL DRIVE,NORTHPORT,Tuscaloosa,2,0,5,0,57,4,12,0
CUMBERLAND HEALTH AND REHAB,015420,47065 AL HIGHWAY 277,BRIDGEPORT,Jackson,1,0,2,0,81,1,11,0
"PALM GARDENS HEALTH AND REHABILITATION, LLC",015403,3104 DAUPHIN SQUARE CONNECTOR,MOBILE,Mobile,2,5,14,0,76,5,6,0
SOUTH HAMPTON NURSING & REHABILITATION CENTER,015448,213 WILSON MANN ROAD,OWENS CROSS ROADS,Madison,0,1,3,0,61,0,5,0
MAGNOLIA RIDGE,015133,420 DEAN DRIVE,GARDENDALE,Jefferson,26,1,5,0,121,11,0,0
"SOUTH HAVEN HEALTH AND REHABILITATION, LLC",015321,3141 OLD COLUMBIANA ROAD,BIRMINGHAM,Jefferson,58,18,25,18,59,34,2,0
EASTERN SHORE REHABILITATION AND HEALTH CENTER,015049,"101 VILLA DRIVE, P O BOX 1090",DAPHNE,Baldwin,4,20,25,0,75,6,3,0
SOUTHLAND NURSING HOME,015104,500 SHIVERS TERRACE,MARION,Perry,,,,,,,,
KENSINGTON HEALTH AND REHABILITATION,015429,550 CONGRESS STREET,MOBILE,Mobile,62,2,6,3,98,32,8,0
EASTVIEW REHABILITATION & HEALTHCARE CENTER,015014,7755 FOURTH AVENUE SOUTH,BIRMINGHAM,Jefferson,12,0,2,0,74,18,0,0
ROBERTSDALE REHABILITATION & HEALTHCARE CTR,015443,18700 U S HIGHWAY 90,ROBERTSDALE,Baldwin,39,0,0,0,112,29,0,0
PLANTATION MANOR NURSING HOME,015015,6450 OLD TUSCALOOSA HIGHWAY   P O BOX 97,MC CALLA,Jefferson,0,0,3,0,82,0,0,0
GADSDEN HEALTH AND REHAB CENTER,015180,1945 DAVIS DRIVE,GADSDEN,Etowah,20,38,6,1,156,8,5,0
"PHENIX CITY HEALTH CARE, INC",015331,3900 LAKEWOOD DRIVE,PHENIX CITY,Russell,0,0,4,0,79,0,1,0
JOHN KNOX MANOR INC  I I,015135,4401 NARROW LANE ROAD,MONTGOMERY,Montgomery,0,1,0,0,54,2,8,0
DIVERSICARE OF BIG SPRINGS,015111,500 ST. CLAIR AVENUE SOUTHWEST,HUNTSVILLE,Madison,2,4,0,0,102,6,7,0
CROWNE HEALTH CARE OF FT PAYNE,015156,403 13TH STREET NORTHWEST,FORT PAYNE,DeKalb,0,0,0,0,99,3,0,0
"SUMTER HEALTH AND REHABILITATION, L L C",015042,1505 EAST 4TH AVENUE,YORK,Sumter,80,1,12,3,61,70,10,0
HATLEY HEALTH CARE INC,015023,300 MEDICAL CENTER DRIVE,CLANTON,Chilton,0,18,5,0,123,1,16,0
MARION REGIONAL NURSING HOME,015167,184 SASSER DRIVE,HAMILTON,Marion,34,37,19,7,57,25,55,1
DIVERSICARE OF BOAZ,015063,600 CORLEY AVENUE,BOAZ,Marshall,3,0,6,0,97,8,0,0
SENIOR REHAB & RECOVERY AT LIMESTONE HEALTH FACILI,015024,1600 WEST HOBBS STREET,ATHENS,Limestone,57,50,43,4,124,20,33,0
CYPRESS COVE CARE CENTER,015392,200 ALABAMA AVENUE,MUSCLE SHOALS,Colbert,23,3,7,0,77,12,4,0
EVERGREEN NURSING HOME,015089,100 SANDERS DRIVE,EVERGREEN,Conecuh,41,0,4,4,50,13,0,0
TROY HEALTH & REHABILITATION CENTER,015213,515 ELBA HIGHWAY,TROY,Pike,22,45,13,3,136,10,34,0
WASHINGTON COUNTY NURSING HOME,015123,14600 ST STEPHENS AVENUE,CHATOM,Washington,19,19,8,4,73,14,13,1
MARSHALL MANOR NURSING HOME,015378,3120 NORTH STREET,GUNTERSVILLE,Marshall,1,2,13,0,74,1,3,0
"COLUMBIANA HEALTH AND REHABILITATION, LLC",015453,22969 HIGHWAY 25,COLUMBIANA,Shelby,39,18,18,9,51,33,10,0
FLORALA HEALTH AND REHABILITATION LLC,015451,23621 GOLDENROD AVENUE,FLORALA,Covington,5,0,6,0,69,6,1,0
"GULF COAST HEALTH AND REHABILITATION, LLC",015456,8002 GRELOT ROAD,MOBILE,Mobile,4,12,6,0,77,11,2,0
CROWNE HEALTH CARE OF GREENVILLE,015193,408 COUNTRY CLUB DRIVE,GREENVILLE,Butler,57,12,22,19,51,30,9,0
CHEROKEE COUNTY HEALTH AND REHABILITATION CENTER,015200,877 CEDAR BLUFF ROAD,CENTRE,Cherokee,18,1,20,6,147,6,0,0
HEALTH CARE INC,015407,P O BOX 130,ASHVILLE,St. Clair,0,0,2,0,49,0,4,0
BROWN NURSING HOME,015191,2334 WASHINGTON STREET,ALEXANDER CITY,Tallapoosa,1,7,3,0,65,0,13,0
"VALLEY VIEW HEALTH AND REHABILITATION, LLC",015431,5968 WALL TRIANA HIGHWAY,MADISON,Madison,0,3,10,0,119,7,14,0
LITTLE SISTERS OF THE POOR SACRED HEART RESIDENCE,015168,1655 MCGILL AVENUE,MOBILE,Mobile,5,0,5,1,65,14,1,0
WOODHAVEN MANOR NURSING HOME,015177,105 WEST WINDSOR ST,DEMOPOLIS,Marengo,8,14,3,1,60,3,14,0
PIEDMONT HEALTH CARE CENTER,015194,30 ROUNDTREE DRIVE,PIEDMONT,Calhoun,0,0,7,0,76,0,1,0
DADEVILLE HEALTHCARE CENTER,015166,351 NORTH EAST STREET,DADEVILLE,Tallapoosa,48,2,9,6,86,16,1,0
GLENWOOD CENTER,015147,211 ANA DRIVE,FLORENCE,Lauderdale,3,5,13,0,108,4,20,0
DIVERSICARE OF RIVERCHASE,015145,2500 RIVERHAVEN DRIVE,BIRMINGHAM,Jefferson,61,25,16,13,97,32,11,0
MONTGOMERY CHILDREN'S SPECIALTY CENTER,01A208,2853 FORBES DRIVE,MONTGOMERY,Montgomery,1,0,0,0,46,8,1,0
"ARBOR SPRINGS HEALTH AND REHAB CENTER, LTD",015192,1910 PEPPERELL PKWY,OPELIKA,Lee,68,0,50,19,110,42,2,0
"FLORENCE NURSING AND REHABILITATION CTR,  LLC",015169,2107 CLOYD BLVD,FLORENCE,Lauderdale,32,13,23,8,119,27,9,0
WINDSOR HOUSE,015397,4411 MCALLISTER DRIVE,HUNTSVILLE,Madison,15,0,4,0,101,16,1,0
CROWNE HEALTH CARE OF CITRONELLE,015121,19225 NORTH 4TH STREET,CITRONELLE,Mobile,26,2,6,0,62,25,1,0
AHC MILLENIUM,015458,5275 MILLENNIUM DRIVE,HUNTSVILLE,Madison,0,9,7,0,84,0,5,0
PARK PLACE,015084,100 PARK PLACE,SELMA,Dallas,16,0,6,6,83,25,0,0
MARENGO NURSING HOME,015330,608 NORTH MAIN STREET,LINDEN,Marengo,0,3,5,0,63,5,4,0
"ELBA NURSING AND REHABILITATION CENTER, LLC",015083,987 DRAYTON STREET,ELBA,Coffee,15,8,11,1,98,4,6,0
FAIRHOPE HEALTH & REHAB,015222,108 SOUTH CHURCH STREET,FAIRHOPE,Baldwin,0,0,0,0,64,2,0,0
LYNWOOD NURSING HOME,015434,4164 HALLS MILL ROAD,MOBILE,Mobile,55,0,20,18,80,38,9,0
DIVERSICARE OF ARAB,015148,235 THIRD STREET SE,ARAB,Marshall,0,0,7,0,75,0,2,0
BROOKDALE UNIVERSITY PARK SNF (AL),015423,501 UNIVERSITY PARK DRIVE,BIRMINGHAM,Jefferson,5,2,18,0,36,9,14,0
SELF HEALTH CARE & REHAB CENTER INC,015212,131 EAST CREST ROAD,HUEYTOWN,Jefferson,1,1,4,0,63,2,3,0
"NORTH HILL NURSING AND REHABILITATION CTR, LLC",015091,200 NORTH PINE HILL ROAD,BIRMINGHAM,Jefferson,13,12,13,5,173,3,2,0
"GEORGIANA HEALTH AND REHABILITATION, LLC",015182,206 PALMER AVENUE,GEORGIANA,Butler,28,1,10,2,71,8,4,0
VILLAGE AT COOK SPRINGS SKILLED NURSING FACILITY,015195,415 COOK SPRINGS,PELL CITY,St. Clair,0,8,1,0,133,3,13,0
MOBILE NURSING AND REHABILITATION CENTER,015379,7020 BRUNS DRIVE,MOBILE,Mobile,0,1,0,0,103,3,6,0
CLAY COUNTY NURSING HOME,015124,83825 HIGHWAY 9   P O BOX 1270,ASHLAND,Clay,3,2,1,0,72,1,8,0
OAKVIEW MANOR HEALTH CARE CENTER,015216,929 MIXON SCHOOL ROAD,OZARK,Dale,43,17,16,5,111,21,25,0
"CRIMSON HEALTH AND REHAB, LLC",015037,3312 WOODLEY ROAD,MONTGOMERY,Montgomery,0,0,0,0,47,2,0,0
OAKS ON PARKWOOD SKILLED NURSING FACILITY,015369,2625 LAUREL OAK DRIVE,BESSEMER,Jefferson,0,0,32,0,122,2,3,0
GOODWATER HEALTHCARE CENTER,015204,16 JONES HILL ROAD,GOODWATER,Coosa,0,0,1,0,64,0,0,0
SOUTHERN SPRINGS HEALTHCARE FACILITY,015171,745 SOUTHERN SPRINGS ROAD,UNION SPRINGS,Bullock,57,42,12,9,87,41,6,0
"TERRACE MANOR NURSING & REHABILITATION CENTER, INC",015066,390 UNDERWOOD ROAD,RUSSELLVILLE,Franklin,0,3,1,0,52,0,15,0
"MONTGOMERY HEALTH AND REHAB, LLC",015228,4490 VIRGINIA LOOP ROAD,MONTGOMERY,Montgomery,0,3,3,0,73,9,14,0
BROOKSHIRE HEALTHCARE CENTER,015127,4320 JUDITH LANE,HUNTSVILLE,Madison,2,0,3,2,116,2,0,0
HERITAGE HEALTH CARE & REHAB INC,015371,1101 SNOWS MILL AVENUE,TUSCALOOSA,Tuscaloosa,0,31,18,0,141,1,22,0
"PRATTVILLE HEALTH AND REHABILITATION, LLC",015065,601 JASMINE TRAIL,PRATTVILLE,Autauga,17,10,21,2,116,16,12,0
HILLVIEW TERRACE,015436,100 PERRY HILL RD,MONTGOMERY,Montgomery,50,7,32,10,125,39,0,0
"NHC HEALTHCARE, ANNISTON",015120,2300 COLEMAN RD,ANNISTON,Calhoun,2,8,39,0,126,10,44,0
"CAREGIVERS OF PLEASANT GROVE, INC",015044,700 FIRST AVENUE,PLEASANT GROVE,Jefferson,28,21,14,11,47,8,0,0
CHARLTON PLACE REHAB AND HEALTHCARE CENTER,015460,65 CHARLTON PLACE,DEATSVILLE,Elmore,1,1,0,0,54,2,0,0
BIBB MED CENTER NURSING HOME,015215,208 PIERSON AVE,CENTREVILLE,Bibb,1,0,5,0,121,1,0,0
"PARK MANOR HEALTH AND REHABILITATION, LLC",015326,2201 MCFARLAND BOULEVARD,NORTHPORT,Tuscaloosa,1,10,12,0,130,5,17,0
"WETUMPKA HEALTH AND REHABILITATION, LLC",015027,1825 HOLTVILLE ROAD,WETUMPKA,Elmore,40,3,27,4,92,32,5,0
MONROE MANOR HEALTH & REHABILITATION CENTER,015398,236 WEST CLAIBORNE STREET,MONROEVILLE,Monroe,31,7,1,0,67,40,19,0
AHAVA HEALTHCARE OF ALABASTER,015144,"850 9TH STREET, NORTHWEST",ALABASTER,Shelby,1,4,0,0,150,6,17,0
ALLEN HEALTH AND REHABILITATION,015098,735 SOUTH WASHINGTON AVENUE,MOBILE,Mobile,9,23,6,2,80,20,6,0
EAMC LANIER NURSING HOME,015045,4800 48TH STREET,VALLEY,Chambers,0,19,12,0,91,8,35,0
HARTFORD HEALTH CARE,015419,217 TORO ROAD,HARTFORD,Geneva,1,1,0,0,81,1,1,0
KELLER LANDING,015028,813 KELLER LANE,TUSCUMBIA,Colbert,9,2,6,0,65,21,4,0
CHERRY HILL REHABILITATION & HEALTHCARE CENTER,015445,1250 JEFF GERMANY PARKWAY,BIRMINGHAM,Jefferson,,,,,,,,
LAUDERDALE CHRISTIAN NURSING HOME,015361,2019 COUNTY ROAD 394,KILLEN,Lauderdale,0,5,5,0,53,1,9,0
MAGNOLIA HAVEN HEALTH AND REHABILITATION CENTER,015112,603 WRIGHT STREET,TUSKEGEE,Macon,14,8,6,0,89,17,2,0
PERRY COUNTY NURSING HOME,015158,505 EAST LAFAYETTE STREET,MARION,Perry,32,1,3,2,55,29,12,0
TRUSSVILLE HEALTH & REHABILITATION CENTER,015467,119 WATTERSON PARKWAY,TRUSSVILLE,Jefferson,1,0,6,0,123,0,2,0
COOSA VALLEY HEALTHCARE CENTER,015010,260 WEST WALNUT STREET,SYLACAUGA,Talladega,0,32,0,0,75,3,32,0
"LONGLEAF HEALTH AND REHAB, LLC",015469,1300 E SOUTH BLVD,MONTGOMERY,Montgomery,0,0,0,0,0,0,0,0
"HUNTSVILLE HEALTH & REHABILITATION, LLC",015440,4010 CHRIS DRIVE,HUNTSVILLE,Madison,2,5,9,0,83,3,5,0
"SOUTH HEALTH AND REHABILITATION, LLC",015097,1220 SOUTH 17TH STREET,BIRMINGHAM,Jefferson,45,1,3,1,52,41,3,1
NORTH MOBILE NURSING AND REHABILITATION CTR,015183,4525 ST STEPHENS ROAD,EIGHT MILE,Mobile,45,36,19,13,130,30,26,0
SHADESCREST HEALTH CARE CENTER,015114,331 WEST 25TH STREET,JASPER,Walker,20,8,5,3,80,22,35,0
EAST ALABAMA MEDICAL CENTER SKILLED NURSING FACILI,015410,2000 PEPPERELL PARKWAY,OPELIKA,Lee,2,0,3,0,18,1,4,0
COLONIAL HAVEN CARE & REHABILITATION CENTER,015396,616 ARMORY STREET,GREENSBORO,Hale,41,0,13,11,62,34,0,1
"NORTHWAY HEALTH AND REHABILITATION, LLC",015047,1424 NORTH 25TH STREET,BIRMINGHAM,Jefferson,2,5,6,0,103,1,3,0
RIVER CITY CENTER,015113,1350 FOURTEENTH AVENUE SOUTHEAST,DECATUR,Morgan,21,4,16,0,131,10,1,0
ASPIRE PHYSICAL RECOVERY CENTER AT CAHABA RIVER,015468,3070 HEALTHY WAY,VESTAVIA,Jefferson,4,1,13,0,100,2,2,0
OAK PARK,015452,1365 GATEWOOD DRIVE,AUBURN,Lee,0,6,4,0,77,1,13,0
ROANOKE REHABILITATION & HEALTHCARE CENTER,015424,680 SEYMOUR DRIVE,ROANOKE,Randolph,30,11,2,2,47,32,8,0
WILLOWBROOKE CT SKILLED CARE CTR WESTMINSTER VLG,015381,500 SPANISH FORT BLVD,SPANISH FORT,Baldwin,8,0,9,1,29,8,2,0
ANDALUSIA MANOR,015416,670 MOORE RD,ANDALUSIA,Covington,22,12,6,3,103,26,21,0
MONTROSE BAY HEALTH AND REHAB,015447,22670 MAIN STREET,FAIRHOPE,Baldwin,0,0,0,0,59,3,0,0
TRAYLOR RETIREMENT COMMUNITY,015126,1235 YANCEY STREET  P O BOX 467,ROANOKE,Randolph,35,0,13,7,81,16,4,0
WILLOWBROOKE CT SKILLED CARE CTR AT MAGNOLIA TRACE,015450,ONE CROWN CIRCLE,HUNTSVILLE,Madison,3,0,4,1,48,3,0,0
SUMMERFORD NURSING HOME INC,015075,4087 HIGHWAY 31 SOUTHWEST,FALKVILLE,Morgan,2,23,35,0,189,4,73,0
WEST HILL HEALTH AND REHAB,015303,1028 BESSEMER RD,BIRMINGHAM,Jefferson,55,1,12,1,63,20,0,0
CAPITOL HILL HEALTHCARE CENTER,015390,520 SOUTH HULL STREET,MONTGOMERY,Montgomery,50,26,20,9,188,20,21,0
TLC NURSING CENTER,015422,212 ELLEN STREET,ONEONTA,Blount,1,0,11,0,89,2,0,0
SUNSET MANOR,015149,251 SUNSET PLACE,GUIN,Marion,0,5,3,0,63,0,3,0
LIGHTHOUSE REHABILITATION & HEALTHCARE CENTER,015413,2911 EARL GOODWIN PARKWAY,SELMA,Dallas,15,11,8,3,57,10,5,0
"JACKSONVILLE HEALTH AND REHABILITATION, LLC",015391,410 WILSON DRIVE SOUTHWEST,JACKSONVILLE,Calhoun,0,2,12,0,159,0,1,0
WOODLAND VILLAGE REHABILITATION AND HEALTHCARE CEN,015383,1900 OLIVE STREET,CULLMAN,Cullman,2,13,35,0,114,3,30,0
ALICEVILLE MANOR NURSING HOME,015137,703 17TH STREET NORTHWEST,ALICEVILLE,Pickens,0,8,4,0,79,2,14,0
COTTAGE OF THE SHOALS,015067,500 JOHN ALDRIDGE DRIVE,TUSCUMBIA,Colbert,7,4,6,0,69,13,11,0
KNOLLWOOD HEALTHCARE,015463,3151-A KNOLLWOOD DRIVE,MOBILE,Mobile,23,18,16,14,52,43,35,0
HALEYVILLE HEALTH CARE CENTER,015157,2201 11TH AVENUE,HALEYVILLE,Winston,2,2,14,1,53,2,14,0
OAKWOOD-NORTH BALDWIN'S CENTER FOR LIVING,015417,2010 MEDICAL CENTER DRIVE,BAY MINETTE,Baldwin,0,7,0,0,67,1,18,0
FATHER PURCELL MEMORIAL EXCEPTIONAL CHILDREN'S CTR,01A193,2048 W FAIRVIEW AVE,MONTGOMERY,Montgomery,10,0,0,0,47,3,0,0
FALKVILLE HEALTH CARE CENTER,015136,10 WEST 3RD STREET  PO BOX 409,FALKVILLE,Morgan,51,13,6,6,85,29,22,0
GREENBRIAR AT THE ALTAMONT SKILLED NURSING FACILIT,015446,2831 HIGHLAND AVENUE SOUTH,BIRMINGHAM,Jefferson,25,0,7,4,71,29,0,0
DECATUR HEALTH & REHAB CENTER,015206,2326 MORGAN AVENUE SOUTHWEST,DECATUR,Morgan,46,79,7,4,73,19,16,0
"HUNTER CREEK HEALTH AND REHABILITATION, LLC",015034,600 34TH ST,NORTHPORT,Tuscaloosa,43,6,7,4,64,10,8,0
SIGNATURE HEALTHCARE OF WHITESBURG GARDENS,015116,105 TEAKWOOD DRIVE SW,HUNTSVILLE,Madison,7,1,0,0,119,4,0,0
ALBERTVILLE NURSING HOME,015163,750 ALABAMA HIGHWAY 75 NORTH,ALBERTVILLE,Marshall,49,32,22,5,126,34,25,0
"LINEVILLE HEALTH AND REHABILITATION, LLC",015142,88073 HIGHWAY 9,LINEVILLE,Clay,0,8,8,0,96,1,15,0
CLEBURNE COUNTY NURSING HOME,015053,122 BROCKFORD ROAD,HEFLIN,Cleburne,,,,,,,,
SPRINGHILL MANOR NURSING HOME,015415,3900 OLD SHELL ROAD,MOBILE,Mobile,0,1,2,0,31,2,2,0
ADAMS NURSING HOME,015386,1555 HILLABEE STREET,ALEXANDER CITY,Tallapoosa,0,2,2,0,58,2,6,0
COLLINSVILLE HEALTHCARE & REHAB,015207,685 NORTH VALLEY AVE,COLLINSVILLE,DeKalb,0,9,5,0,157,12,23,1
SYLACAUGA HEALTH AND REHAB SERVICES,015160,1007 W FORT WILLIAMS ST,SYLACAUGA,Talladega,0,7,20,0,132,0,13,0
CLOVERDALE REHABILITATION AND NURSING CENTER,015184,412 CLOVERDALE ROAD,SCOTTSBORO,Jackson,1,4,20,0,126,1,32,0
WEST GATE VILLAGE,015035,100 PINEVIEW AND THIRD P.O. BOX 49,BREWTON,Escambia,65,10,5,5,97,33,15,0
ATHENS HEALTH AND REHABILITATION LLC,015016,611 WEST MARKET STREET,ATHENS,Limestone,0,6,24,0,125,1,14,0
"HANCEVILLE NURSING & REHAB CENTER, INC",015073,420 MAIN STREET NE,HANCEVILLE,Cullman,20,19,5,1,189,8,8,0
JACKSON HEALTH CARE FACILITY,015188,2616 NORTH COLLEGE AVENUE,JACKSON,Clarke,0,8,12,0,66,3,14,0
"GLEN HAVEN HEALTH AND REHABILITATION, LLC",015186,2201 32ND STREET,NORTHPORT,Tuscaloosa,14,13,16,1,169,16,6,1
HENDRIX HEALTH AND REHABILITATION,015138,1000 HIGHWAY 33,DOUBLE SPRINGS,Winston,38,8,14,0,89,17,12,0
"TALLASSEE HEALTH AND REHABILITATION, LLC",015139,2639 GILMER AVENUE  P O BOX 780277,TALLASSEE,Elmore,1,0,18,0,84,4,8,0
"SELMA HEALTH AND REHAB, LLC",015119,11 BELL ROAD,SELMA,Dallas,34,0,0,0,108,7,3,0
EAST GLEN,015388,53 MEDICAL PARK DRIVE EAST,BIRMINGHAM,Jefferson,0,0,0,0,96,0,3,0
"OAK KNOLL HEALTH AND REHABILITATION, LLC",015117,824 SIXTH AVENUE WEST,BIRMINGHAM,Jefferson,0,0,5,0,90,0,0,0
"OZARK HEALTH AND REHABILITATION, LLC",015208,312 BRYAN DRIVE,OZARK,Dale,55,1,22,5,125,33,3,0
KIRKWOOD BY THE RIVER,015457,3605 RATLIFF ROAD,BIRMINGHAM,Jefferson,12,0,5,5,43,4,0,0
"BURNS NURSING HOME, INC.",015009,701 MONROE STREET NW,RUSSELLVILLE,Franklin,45,1,6,5,47,35,14,0
"TALLADEGA HEALTHCARE CENTER, INC",015162,616 CHAFFEE STREET,TALLADEGA,Talladega,61,94,1,1,165,32,52,0
"FOLSOM CENTER FOR REHABILITATION AND HEALTHCARE, T",015437,401 ARNOLD STREET N.E.,CULLMAN,Cullman,2,25,19,0,82,5,53,0
ENTERPRISE HEALTH & REHABILITATION CENTER,015320,300 PLAZA DRIVE P O BOX 311227,ENTERPRISE,Coffee,2,0,36,0,174,18,23,0
DIVERSICARE OF ONEONTA,015159,215 VALLEY ROAD,ONEONTA,Blount,8,0,9,0,103,16,6,0
FAIR HAVEN,015076,1424 MONTCLAIR ROAD,BIRMINGHAM,Jefferson,28,1,16,2,208,8,0,0
BARFIELD HEALTH CARE,015225,22444 HIGHWAY 431,GUNTERSVILLE,Marshall,0,9,28,0,105,1,29,0
EL REPOSO NURSING FACILITY,015402,260 MILNER CHAPEL ROAD,FLORENCE,Lauderdale,0,3,6,0,58,0,7,0
RUSSELLVILLE HEALTH CARE INC,015071,705 NORTHEAST GANDY STREET,RUSSELLVILLE,Franklin,33,16,5,3,42,21,23,0
TWIN OAKS REHABILITATION AND HEALTHCARE CENTER,015211,857 CRAWFORD LANE,MOBILE,Mobile,10,0,0,0,115,29,5,0
DIVERSICARE OF PELL CITY,015189,"510 WOLF CREEK ROAD, NORTH",PELL CITY,St. Clair,15,2,4,0,68,17,3,0
"GRAND BAY CONVALESCENT HOME, INC.",015406,13750 HIGHWAY 90 WEST P.O. BOX 328,GRAND BAY,Mobile,0,2,6,0,63,4,0,0
"WALKER REHABILITATION CENTER, INC",015408,350 NORTHEAST 4TH STREET     P O BOX 30,CARBON HILL,Walker,18,8,4,4,40,13,1,0
MITCHELL-HOLLINGSWORTH NURSING & REHABILITATION,015031,805 FLAGG CIRCLE,FLORENCE,Lauderdale,12,37,19,0,154,15,51,0
ST MARTIN'S IN THE PINES,015433,4941 MONTEVALLO ROAD,BIRMINGHAM,Jefferson,2,0,9,0,94,18,0,0
SHELBY RIDGE NURSING HOME,015411,881 3RD STREET NORTHEAST,ALABASTER,Shelby,25,47,23,4,121,16,44,0
ORCHARD REHABILITATION & HEALTHCARE CENTER,015442,629 STATE HIGHWAY 21 SOUTH,HAYNEVILLE,Lowndes,2,0,3,3,54,5,0,0
GALLERIA WOODS SKILLED NURSING FACILITY,015459,3850 GALLERIA WOODS DRIVE,BIRMINGHAM,Jefferson,0,0,2,0,27,3,0,0
HENRY COUNTY HEALTH AND REHABILITATION FACILITY,015373,212 DOTHAN ROAD,ABBEVILLE,Henry,23,70,26,5,84,21,60,0
DIVERSICARE OF FOLEY,015032,1701 NORTH ALSTON STREET,FOLEY,Baldwin,11,0,0,0,114,9,4,0
CULLMAN HEALTH CARE CENTER,015048,1607 MAIN AVE NE,CULLMAN,Cullman,0,0,6,0,77,0,24,0
COOSA VALLEY HEALTH AND REHAB,015174,513 PINEVIEW AVENUE,GLENCOE,Etowah,11,12,4,0,108,8,11,0
CANTERBURY HEALTH CARE FACILITY,015382,1720 KNOWLES ROAD,PHENIX CITY,Russell,12,0,3,0,96,16,0,0
"RIDGEWOOD HEALTH SERVICES, INC.",015315,201 OAKHILL ROAD,JASPER,Walker,12,1,14,1,86,12,0,0
"ASPIRE PHYSICAL RECOVERY CENTER AT HOOVER, LLC",015464,575 SOUTHLAND DRIVE,HOOVER,Jefferson,2,17,16,0,99,4,24,0
FOREST MANOR HEALTH AND REHAB,015143,2215 32ND STREET,NORTHPORT,Tuscaloosa,41,24,23,9,134,32,35,1
CROWNE HEALTH CARE OF SPRINGHILL,015426,3712 DAUPHIN ST,MOBILE,Mobile,1,0,1,0,20,3,0,0
SPRINGHILL SENIOR RESIDENCE,015435,3717 DAUPHIN STREET,MOBILE,Mobile,0,27,8,0,64,4,59,0
HIGHLANDS HEALTH AND REHAB,015012,380 WOODS COVE ROAD,SCOTTSBORO,Jackson,2,29,8,0,40,3,28,0
DIVERSICARE OF LANETT,015196,702 SOUTH 13TH STREET,LANETT,Chambers,2,1,30,0,74,6,6,0
"CORDOVA HEALTH AND REHABILITATION, LLC",015115,70 HIGHLAND STREET WEST,CORDOVA,Walker,10,5,17,2,95,0,22,0
"OPP HEALTH AND REHABILITATION, LLC",015210,115 PAULK AVENUE  P O BOX 730,OPP,Covington,76,4,31,13,130,35,5,0
ENGLEWOOD HEALTH CARE CENTER,015322,2046 SOUTH ALABAMA AVE,MONROEVILLE,Monroe,0,2,6,0,75,6,9,0
DIVERSICARE OF WINFIELD,015376,144 COUNTY HWY 14,WINFIELD,Marion,56,13,21,13,86,25,18,0
BIRMINGHAM NURSING AND REHABILITATION CTR LLC,015217,1000 DUGAN AVENUE,BIRMINGHAM,Jefferson,0,13,8,0,125,1,12,0
LAFAYETTE NURSING HOME,015414,555 B STREET SW,LAFAYETTE,Chambers,4,0,5,0,47,2,0,0
CHOCTAW HEALTH AND REHAB,015164,1406 EAST PUSHMATAHA STREET,BUTLER,Choctaw,46,50,13,9,51,20,24,0
FAIRVIEW AT REDSTONE VILLAGE,015454,12000 TURNMEYER DRIVE,HUNTSVILLE,Madison,0,2,7,0,49,1,7,0
CROWNE HEALTH CARE OF MOBILE,015100,954 NAVCO ROAD,MOBILE,Mobile,5,0,8,5,105,4,2,1
WIREGRASS REHABILITATION CENTER & NURSING HOME,015150,1200 MAPLE AVENUE WEST,GENEVA,Geneva,0,0,5,0,89,1,9,0
