Provider Name,Federal Provider Number,Provider Address,Provider City,County,Residents Total Confirmed COVID-19,Residents Total Suspected COVID-19,Residents Total All Deaths,Residents Total COVID-19 Deaths,Total Number of Occupied Beds,Staff Total Confirmed COVID-19,Staff Total Suspected COVID-19,Staff Total COVID-19 Deaths
DAMAS HOSPITAL SNF,405023,2213 PONCE BY PASS,PONCE,Ponce,0,0,2,0,15,0,0,0
MILLENNIUM INSTITUTE FOR ADVANCE NURSING CARE INC,405030,CALLE COSME REPARTO SAN LUCAS ENTRADA SECTOR CANEJ,RIO PIEDRAS,San Juan,0,0,0,0,15,0,1,0
CENTRO MEDICO WILMA N VAZQUEZ SNF,405025,ROAD 2 KM 39 5 BO ALGARROBO,VEGA BAJA,Vega Baja,0,0,0,0,16,0,0,0
RYDER MEMORIAL HOSPITAL INC,405018,355 AVE  FONT MARTELO,HUMACAO,Humacao,0,0,0,0,26,0,0,0
SERVICIOS INTEGRADOS DE REHABILITACION (SIRO) INC,405029,CALLE 4-L-10 URB COLINAS DEL OESTE,HORMIGUEROS,Hormigueros,,,,,,,,
HIMA SAN PABLO CUPEY SNF,405031,CARR 844 KM 0 5 CUPEY BAJO,RIO PIEDRAS,San Juan,1,1,0,0,15,1,4,0
