MCAULEY HALL HEALTH CARE CENTE,315337,1633 HIGHWAY 22,WATCHUNG,Somerset,28,1,20,6,53,29,0,0
COUNTY MANOR REHABILITATION & HCC,315164,133 COUNTY ROAD,TENAFLY,Bergen,31,17,12,11,40,13,11,0
CARE ONE AT WELLINGTON,315152,301 UNION STREET,HACKENSACK,Bergen,2,0,6,4,88,5,2,0
ARBOR RIDGE REHABILITATION AND HEALTHCARE CENTER,315234,261 TERHUNE DRIVE,WAYNE,Passaic,42,3,21,6,100,9,0,0
ANDOVER SUBACUTE AND REHAB II,315248,99 MULFORD ROAD,ANDOVER,Sussex,146,31,107,64,341,79,40,1
MEADOWVIEW NURSING AND REHABILITATION CENTER,315358,235 DOLPHIN AVE,NORTHFIELD,Atlantic,99,0,95,90,98,30,0,0
ALARIS HEALTH AT CEDAR GROVE,315357,110 GROVE AVE,CEDAR GROVE,Essex,11,0,0,0,131,16,1,0
MASONIC VILLAGE AT BURLINGTON,315166,902 JACKSONVILLE ROAD,BURLINGTON,Burlington,41,14,26,15,98,49,6,0
CARE ONE AT VALLEY,315369,300 OLD HOOK ROAD,WESTWOOD,Bergen,5,0,6,1,79,7,0,0
SUMMER HILL NURSING HOME,315381,111 ROUTE 516,OLD BRIDGE,Middlesex,28,0,8,4,93,28,1,1
NORTH CAPE CENTER,315350,700 TOWNBANK ROAD,CAPE MAY,Cape May,55,4,22,12,78,32,9,0
MONMOUTH CARE CENTER,315284,229 BATH AVENUE,LONG BRANCH,Monmouth,6,0,15,13,84,8,0,0
BRAKELEY PARK CENTER,315316,290 RED SCHOOL LANE,PHILLIPSBURG,Warren,97,0,36,26,93,34,0,0
"OAKS AT DENVILLE, THE",315329,21 POCONO ROAD,DENVILLE,Morris,15,5,17,4,49,7,0,0
ST JOSEPH'S HEALTHCARE AND REHAB CENTER,315194,315 EAST LINDSLEY ROAD,CEDAR GROVE,Essex,85,0,46,26,94,51,0,1
SOUTH JERSEY EXTENDED CARE,315061,99 MANHEIM AVENUE,BRIDGETON,Cumberland,59,2,2,2,115,34,4,0
ASPEN HILLS HEALTHCARE CENTER,315260,600 PEMBERTON BROWN MILLS RD,PEMBERTON,Burlington,47,0,13,9,166,16,1,1
SEASHORE GARDENS LIVING CENTER,315340,22 WEST JIMMIE LEEDS ROAD,GALLOWAY TOWNSHIP,Atlantic,2,0,3,0,113,4,0,0
BERGEN COUNTY HEALTH CARE CTR,315436,35 B PIERMONT ROAD,ROCKLEIGH,Bergen,1,0,5,2,55,7,0,0
DEPTFORD CENTER FOR REHABILITATION AND HEALTHCARE,315174,1511 CLEMENTS BRIDGE RD,DEPTFORD,Gloucester,49,26,42,33,191,14,2,1
CUMBERLAND MANOR NURSING AND REHABILITATION CENTER,315396,154 SUNNY SLOPE DRIVE,BRIDGETON,Cumberland,2,0,1,0,154,8,2,0
ALARIS HEALTH AT THE FOUNTAINS,315476,595 COUNTY AVENUE,SECAUCUS,Hudson,56,2,8,7,197,25,2,1
MANORCARE HEALTH SERVICES - VOORHEES,315500,1086 DUMONT CIRCLE,VOORHEES,Camden,46,10,73,14,81,19,6,0
ROOSEVELT CARE CENTER AT OLD BRIDGE,315509,1133 MARLBORO ROAD,OLD BRIDGE,Middlesex,10,0,18,0,163,5,0,1
"JEWISH HOME FOR REHABILITATION AND NURSING, THE",315528,1151 WEST MAIN STREET,FREEHOLD,Monmouth,15,6,22,8,87,17,6,0
"VILLA AT FLORHAM PARK, INC THE",315480,190  PARK AVENUE,FLORHAM PARK,Morris,5,1,10,8,28,7,0,0
ATRIUM POST ACUTE CARE OF HAMILTON,315519,3 HAMILTON HEALTH PLACE,HAMILTON,Mercer,51,5,19,14,18,26,21,0
LUTHERAN SOCIAL MINISTRIES CRANES MILL,315457,459 PASSAIC AVENUE,WEST CALDWELL,Essex,0,0,0,0,23,0,0,0
ATRIUM POST ACUTE CARE OF LIVINGSTON,315526,348 EAST CEDAR STREET,LIVINGSTON,Essex,26,0,10,10,43,26,0,0
"BARNERT SUBACUTE REHABILITATION CENTER, LLC",315507,680 BROADWAY SUITE 301,PATERSON,Passaic,,,,,,,,
WEDGWOOD GARDENS CARE CENTER,315504,3419 HIGHWAY 9,FREEHOLD,Monmouth,2,0,4,1,86,7,0,0
"POWERBACK REHABILITATION, ROUTE 73",315513,113 SOUTH ROUTE 73,VOORHEES,Camden,8,0,7,0,69,4,3,0
CONTINUING CARE AT LANTERN HILL,315523,537 MOUNTAIN AVENUE,NEW PROVIDENCE,Union,1,3,1,0,21,2,2,0
PREFERRED CARE AT MERCER,315487,1201 PARKWAY AVENUE,EWING,Mercer,,,,,,,,
CARE ONE AT WALL,315485,2621 HIGHWAY 138,WALL,Monmouth,13,12,23,17,93,14,6,0
SYCAMORE LIVING AT EAST HANOVER,315529,ONE SOUTH RIDGEDALE AVENUE,EAST HANOVER,Morris,0,0,0,0,35,0,0,0
VIRTUA H & R C AT BERLIN,315461,100 LONG-A-COMING LANE,BERLIN,Camden,4,0,9,0,83,11,0,0
HACKENSACK MERIDIAN HEALTH PROSPECT HEIGHTS CARE C,315460,336 PROSPECT AVE,HACKENSACK,Bergen,,,,,,,,
TALLWOODS CARE CENTER,315462,18 BUTLER BOULEVARD,BAYVILLE,Ocean,40,3,15,11,147,15,0,0
COMMUNITY MEDICAL CENTER TCU,315490,99 ROUTE 37 WEST,TOMS RIVER,Ocean,0,0,1,0,14,2,0,0
ATRIUM POST ACUTE CARE OF MATAWAN,315463,38 FRENEAU AVENUE,MATAWAN,Monmouth,59,1,20,13,88,39,5,0
CHILDRENS SPECIALIZED HOSPITAL TOMS RIVER,315443,94 STEVENS ROAD,TOMS RIVER,Ocean,2,2,0,0,20,13,6,0
CARE ONE AT MADISON AVENUE,315488,151 MADISON AVENUE,MORRISTOWN,Morris,7,17,14,5,86,5,3,0
CARE ONE AT EVESHAM,315464,870 EAST ROUTE 70,MARLTON,Burlington,,,,,,,,
ATRIUM POST ACUTE CARE OF PARK RIDGE,315438,120 NOYES DRIVE,PARK RIDGE,Bergen,94,9,57,31,77,52,3,1
BRIDGEWAY CARE AND REHAB CENTER AT HILLSBOROUGH,315510,395 AMWELL ROAD,HILLSBOROUGH,Somerset,22,26,25,8,110,44,6,0
LAUREL BROOK REHABILITATION AND HEALTHCARE CENTER,315524,3718 CHURCH ROAD,MOUNT LAUREL,Burlington,74,97,33,16,157,36,29,0
BOONTON CARE CENTER,315492,199 POWERVILLE ROAD,BOONTON,Morris,47,0,34,16,53,29,5,0
BAPTIST HOME OF SOUTH JERSEY,315448,303 BANK AVE,RIVERTON,Burlington,21,44,18,2,38,10,10,0
LITTLE BROOK NURSING AND CONVALESCENT HOME,315467,78 SLIKER ROAD,CALIFON,Hunterdon,0,0,0,0,27,0,0,0
CARE ONE AT HANOVER TOWNSHIP,315511,101 WHIPPANY ROAD,WHIPPANY,Morris,0,0,3,2,31,7,1,0
RENAISSANCE PAVILION,315495,61 W JIMMIE LEEDS ROAD,POMONA,Atlantic,7,2,0,0,13,19,0,0
CONTINUING CARE AT SEABROOK,315469,3002 ESSEX ROAD,TINTON FALLS,Monmouth,2,4,13,2,52,3,9,0
CARE ONE AT MORRIS,315468,100 MAZDABROOK ROAD,PARSIPPANY TROY HILL,Morris,24,6,13,2,84,3,0,0
ALARIS HEALTH AT THE CHATEAU,315494,96 PARKWAY,ROCHELLE PARK,Bergen,0,0,2,2,41,3,0,0
"VENETIAN CARE & REHABILITATION CENTER, THE",315518,275 JOHN T O'LEARY BOULEVARD,SOUTH AMBOY,Middlesex,15,0,1,0,142,8,0,0
LIONS GATE,315499,1100 LAUREL OAK ROAD,VOORHEES,Camden,56,0,28,14,70,42,38,0
EGG HARBOR CARE CENTER,315514,6818 DELILAH ROAD,EGG HARBOR TOWNSHIP,Atlantic,28,12,62,28,62,13,20,2
"ARBOR AT LAUREL CIRCLE, THE",315445,100 MONROE STREET,BRIDGEWATER,Somerset,21,0,8,6,27,8,2,0
ATRIUM POST ACUTE CARE OF WOODBURY,315521,467 COOPER STREET,WOODBURY,Gloucester,72,3,8,7,60,20,20,0
PEACE CARE ST JOSEPH'S,315452,537 PAVONIA AVENUE,JERSEY CITY,Hudson,8,5,6,2,84,7,1,0
"ATRIUM AT NAVESINK HARBOR, THE",315515,40 RIVERSIDE AVENUE,RED BANK,Monmouth,4,4,129,3,33,9,1,0
JEWISH HOME AT ROCKLEIGH,315473,10 LINK DRIVE,ROCKLEIGH,Bergen,88,0,61,23,127,63,12,0
COMPLETE CARE AT SHORROCK,315453,75 OLD TOMS RIVER ROAD,BRICK,Ocean,11,2,7,4,90,4,0,0
POWERBACK REHABILITATION PISCATAWAY,315522,10 STERLING DRIVE,PISCATAWAY,Middlesex,,,,,,,,
SHORE MEADOWS REHAB & NURSING CENTER,315454,231 WARNER STREET,TOMS RIVER,Ocean,6,0,3,0,105,10,0,0
"HUDSON HILLS SENIOR LIVING, LLC",315525,3161 KENNEDY BLVD,NORTH BERGEN,Hudson,16,14,14,6,49,12,1,0
ROYAL SUITES HEALTH CARE & REHABILITATION,315503,214 WEST JIMMIE LEEDS ROAD,GALLOWAY TOWNSHIP,Atlantic,58,0,7,5,132,21,0,0
CARE ONE AT WAYNE - SNF,315477,493 BLACK OAK RIDGE ROAD,WAYNE,Passaic,3,1,5,1,48,6,1,0
NEW JERSEY VETERANS MEMORIAL VINELAND,315496,524 NORTH WEST BLVD,VINELAND,Cumberland,5,0,12,3,264,25,0,0
SOUTHERN OCEAN MEDICAL CENTER,315478,1140 ROUTE 72 WEST,MANAHAWKIN,Ocean,0,2,0,0,10,0,1,0
ADVANCED SUBACUTE REHABILITATION CENTER AT SEWELL,315516,685 SALINA ROAD,SEWELL,Gloucester,,,,,,,,
ROYAL HEALTH GATE NRSG REHAB,315455,1314 BRUNSWICK AVENUE,TRENTON,Mercer,5,1,1,0,110,6,1,0
CARE ONE AT LIVINGSTON,315479,68 PASSAIC AVENUE,LIVINGSTON,Essex,2,0,1,1,62,18,0,0
MYSTIC MEADOWS REHAB & NURSING CENTER,315456,151 NINTH AVENUE,LITTLE EGG HARBOR TW,Ocean,27,5,5,4,106,14,0,1
CARE ONE AT TEANECK,315502,544 TEANECK ROAD,TEANECK,Bergen,3,2,3,1,68,12,0,0
CARE ONE AT MOORESTOWN,315482,895 WESTFIELD ROAD,MOORESTOWN,Burlington,10,5,2,0,53,3,4,0
NEW VISTA,315458,300 BROADWAY,NEWARK,Essex,318,72,3,2,206,9,0,0
NEW JERSEY VETERANS MEMORIAL HOME MENLO,315459,132 EVERGREEN RD,EDISON,Middlesex,13,4,22,10,171,29,0,1
PLAZA HEALTHCARE & REHABILITATION CENTER,315483,456 RAHWAY AVENUE,ELIZABETH,Union,55,0,28,19,77,22,0,0
UNITED METHODIST COMMUNITIES AT BRISTOL GLEN,315439,200 BRISTOL GLEN DRIVE,NEWTON,Sussex,0,0,0,0,46,11,0,0
MANORCARE HEALTH SERVICES-WASHINGTON TOWNSHIP,315506,378 FRIES MILL ROAD,SEWELL,Gloucester,9,1,18,1,87,9,1,0
MERIDIAN SUBACUTE REHABILITATION,315501,1725 MERIDIAN TRAIL,WALL,Monmouth,29,0,17,13,81,34,10,1
SOMERSET WOODS REHABILITATION & NURSING CENTER,315520,780 OLD NEW BRUNSWICK ROAD,SOMERSET,Somerset,10,0,0,0,111,6,0,0
VICTORIA MANOR,315508,3809 BAYSHORE ROAD,NORTH CAPE MAY,Cape May,51,0,26,17,69,25,0,0
POWERBACK REHABILITATION MOORESTOWN,315517,212 MARTER AVENUE,MOORESTOWN,Burlington,37,0,18,11,105,49,0,0
MANHATTANVIEW NURSING HOME,315465,3200 HUDSON AVENUE,UNION CITY,Hudson,1,0,3,0,72,2,0,0
CEDAR CREST/MOUNTAINVIEW GARDENS,315491,4 CEDAR CREST VILLAGE DRIVE,POMPTON PLAINS,Morris,9,6,20,6,83,4,11,0
TRINITAS HOSPITAL,315442,655 EAST JERSEY STREET,ELIZABETH,Union,52,55,18,13,92,33,36,0
WINCHESTER GARDENS HEALTH CARE CENTER,315527,333 ELMWOOD AVENUE,MAPLEWOOD,Essex,1,0,2,0,12,1,0,0
HOBOKEN UNIVERSITY MEDICAL CENTER TCU,315512,308 WILLOW AVENUE,HOBOKEN,Hudson,0,0,0,0,7,5,2,0
ALARIS HEALTH AT WEST ORANGE,315449,5 BROOK END DRIVE,WEST ORANGE,Essex,4,0,3,0,84,1,1,0
"ELMS OF CRANBURY, THE",315451,61 MAPLEWOOD AVENUE,CRANBURY,Middlesex,26,14,5,3,89,6,3,0
ST CATHERINE OF SIENA,315471,7 RYERSON AVENUE,CALDWELL,Essex,14,0,2,0,20,19,0,0
ALLENDALE NURSING HOME,315497,85 HARRETON ROAD,ALLENDALE,Bergen,76,2,28,21,156,37,1,0
CARE ONE AT EAST BRUNSWICK,315472,599 CRANBURY ROAD,EAST BRUNSWICK,Middlesex,8,0,7,3,77,11,0,0
