Provider Name,Federal Provider Number,Provider Address,Provider City,County,Residents Total Confirmed COVID-19,Residents Total Suspected COVID-19,Residents Total All Deaths,Residents Total COVID-19 Deaths,Total Number of Occupied Beds,Staff Total Confirmed COVID-19,Staff Total Suspected COVID-19,Staff Total COVID-19 Deaths
GATEWAY CARE CENTER,315177,139 GRANT AVE,EATONTOWN,Monmouth,41,1,0,12,114,21,0,0
ARMENIAN NURSING AND REHABILITATION CENTER,315402,70 MAIN STREET,EMERSON,Bergen,23,11,26,13,31,33,0,0
ARISTACARE AT WHITING,315309,23 SCHOOLHOUSE ROAD,WHITING,Ocean,80,48,21,19,99,33,0,0
TOWER LODGE CARE CENTER,315069,1506 GULLY ROAD,WALL,Monmouth,1,4,1,0,52,4,4,0
WYNWOOD REHABILITATION AND HEALTHCARE CENTER,315047,1700 WYNWOOD DRIVE,CINNAMINSON,Burlington,64,0,27,20,107,16,0,0
ALARIS HEALTH AT BOULEVARD EAST,315254,6819 BOULEVARD EAST,GUTTENBERG,Hudson,3,0,2,0,0,2,0,0
WATERVIEW CENTER,315216,536 RIDGE ROAD,CEDAR GROVE,Essex,68,4,59,24,126,29,2,0
CANTERBURY AT CEDAR GROVE,315204,398 POMPTON AVENUE,CEDAR GROVE,Essex,42,13,14,8,102,40,6,0
FOUNTAIN VIEW CARE CENTER,315327,527 RIVER AVE,LAKEWOOD,Ocean,72,13,27,9,93,25,7,0
ARISTACARE AT CEDAR OAKS,315214,1311 DURHAM AVENUE,SOUTH PLAINFIELD,Middlesex,11,1,28,3,169,4,0,0
ATRIUM POST ACUTE CARE OF WAYNE,315335,1120 ALPS ROAD,WAYNE,Passaic,115,2,50,36,128,36,0,0
CARE ONE AT SOMERSET VALLEY,315002,1621 ROUTE 22 WEST,BOUND BROOK,Somerset,6,0,7,0,46,5,1,1
"GARDENS AT MONROE HEALTHCARE AND REHABILITATION, T",315336,189 APPLEGARTH ROAD,MONROE TOWNSHIP,Middlesex,44,1,16,16,74,29,2,0
COURT HOUSE CENTER,315228,144 MAGNOLIA DRIVE,CAPE MAY COURT HOUSE,Cape May,5,10,31,0,101,3,0,0
BRAKELEY PARK CENTER,315316,290 RED SCHOOL LANE,PHILLIPSBURG,Warren,99,1,46,26,95,35,0,0
PREMIER CADBURY OF CHERRY HILL,315183,2150 ROUTE 38,CHERRY HILL,Camden,5,0,13,3,107,9,0,0
ARBOR RIDGE REHABILITATION AND HEALTHCARE CENTER,315234,261 TERHUNE DRIVE,WAYNE,Passaic,42,3,30,6,94,12,0,0
DAUGHTERS OF ISRAEL PLEASANT VALLEY HOME,315029,1155 PLEASANT VALLEY WAY,WEST ORANGE,Essex,6,55,28,18,173,49,0,0
CRYSTAL LAKE HLTHCARE & REHAB,315125,395 LAKESIDE BLVD,BAYVILLE,Ocean,75,0,42,126,156,50,2,0
ALARIS HEALTH AT HARBOR VIEW,315310,178-198 OGDEN AVE,JERSEY CITY,Hudson,3,14,4,0,113,4,0,0
SOUTHGATE HEALTH CARE CTR,315237,449 S PENNSVILLE-AUBURN ROAD,CARNEYS POINT,Salem,59,12,40,28,93,33,13,0
MILLVILLE CENTER,315243,54 N SHARP STREET,MILLVILLE,Cumberland,106,1,55,27,100,35,23,0
BRIDGEWAY CARE AND REHAB CENTER AT BRIDGEWATER,315182,270 ROUTE 28,BRIDGEWATER,Somerset,77,37,61,21,117,27,74,0
STERLING MANOR,315149,794 N FORKLANDING ROAD,MAPLE SHADE,Burlington,6,1,0,0,83,10,0,0
KING MANOR CARE AND REHABILITATION CENTER,315299,2303 WEST BANGS AVE,NEPTUNE,Monmouth,6,0,3,0,82,7,0,0
ASPEN HILLS HEALTHCARE CENTER,315260,600 PEMBERTON BROWN MILLS RD,PEMBERTON,Burlington,47,0,23,9,151,18,1,1
HEALTH CENTER AT BLOOMINGDALE,315348,255 UNION AVE,BLOOMINGDALE,Passaic,55,59,41,18,79,17,29,0
SEASHORE GARDENS LIVING CENTER,315340,22 WEST JIMMIE LEEDS ROAD,GALLOWAY TOWNSHIP,Atlantic,2,0,5,0,106,11,0,0
BRIGHTON GARDENS OF EDISON,315351,1801 OAKTREE ROAD,EDISON,Middlesex,15,2,11,8,22,13,1,0
FAMILY OF CARING HEALTHCARE AT RIDGEWOOD,315434,304 S. VAN DIEN AVE,RIDGEWOOD,Bergen,45,2,37,17,70,38,2,0
COMPLETE CARE AT FAIR LAWN EDGE,315331,77 EAST 43RD STREET,PATERSON,Passaic,29,7,24,12,114,11,2,0
PHILLIPSBURG CENTER,315311,843 WILBUR AVENUE,PHILLIPSBURG,Warren,3,4,7,0,50,2,1,0
HACKENSACK MERIDIAN HEALTH NURSING & REHAB,315286,100 CHAPIN AVENUE,RED BANK,Monmouth,8,0,11,4,126,46,7,0
WILLOW SPRINGS REHABILITATION AND HEALTHCARE CTR,315213,1049 BURNT TAVERN ROAD,BRICK,Ocean,99,44,75,36,124,58,3,0
EMERSON HEALTH CARE CENTER,315360,100 KINDERKAMACK ROAD,EMERSON,Bergen,20,2,60,1,109,21,0,1
WHITE HOUSE HLTHCR & REHAB CTR,315372,560 BERKELEY AVENUE,ORANGE,Essex,17,0,12,1,127,3,0,0
LAKELAND HEALTH CARE CENTER,315261,25 FIFTH AVENUE,HASKELL,Passaic,0,1,4,0,94,3,1,0
"COMPLETE CARE AT LINWOOD, LLC",315185,201 NEW ROAD AND CENTRAL AVE,LINWOOD,Atlantic,21,8,41,27,111,40,4,0
ATRIUM POST ACUTE CARE OF WAYNEVIEW,315291,2020 ROUTE 23 NORTH,WAYNE,Passaic,77,4,55,21,99,41,2,3
COMPLETE CARE AT GREEN ACRES,315265,1931 LAKEWOOD ROAD,TOMS RIVER,Ocean,72,5,51,14,124,48,0,0
"ST JOSEPH'S HOME AL & NC, INC",315318,1-3 ST JOSEPH'S TERRACE,WOODBRIDGE,Middlesex,2,0,4,0,30,3,2,0
"VOORHEES CARE & REHABILITATION CENTER, THE",315187,1302 LAUREL OAK ROAD,VOORHEES,Camden,119,64,38,25,159,38,32,0
HAMMONTON CENTER FOR REHABILITATION AND HEALTHCARE,315209,43 N WHITE HORSE PIKE,HAMMONTON,Atlantic,57,13,38,26,204,19,5,0
MERCERVILLE CENTER,315094,2240 WHITEHORSE-MERCERVILLE ROAD,MERCERVILLE,Mercer,62,3,33,19,75,45,1,0
UNITED METHODIST COMMUNITIES AT COLLINGSWOOD,315404,460 HADDON AVE,COLLINGSWOOD,Camden,34,7,26,14,43,49,11,0
MAYWOOD CENTER FOR HEALTH AND REHABILITATION,315386,100 WEST MAGNOLIA AVENUE,MAYWOOD,Bergen,92,6,25,19,94,37,2,0
CRANBURY CENTER,315353,292 APPLEGARTH ROAD,MONROE TOWNSHIP,Middlesex,58,5,44,29,99,30,1,1
LINCOLN PARK RENAISSANCE REHAB & NURSING,315042,521 PINE BROOK ROAD,LINCOLN PARK,Morris,10,4,20,13,123,33,1,0
HARROGATE,315262,400 LOCUST STREET,LAKEWOOD,Ocean,0,0,8,2,56,0,0,0
SINAI POST ACUTE NURSING AND REHAB CENTER,315236,65 JAY STREET,NEWARK,Essex,128,68,80,19,298,75,33,1
ROOSEVELT CARE CENTER,315039,118 PARSONAGE ROAD,EDISON,Middlesex,31,3,21,7,153,15,0,2
FOREST MANOR HCC,315224,145 STATE PARK ROAD,HOPE,Warren,82,96,40,25,75,29,44,0
VIRTUA HEALTH & REHAB MT HOLLY,315128,62 RICHMOND AVENUE,LUMBERTON,Burlington,72,0,23,19,103,36,0,1
CHESTNUT HILL CONV CENTER,315085,360 CHESTNUT STREET,PASSAIC,Passaic,17,8,16,7,49,13,6,2
MADISON CENTER,315015,625 STATE HIGHWAY 34,MATAWAN,Monmouth,89,1,38,21,110,17,2,0
FOREST HILL HEALTHCARE CENTER,315375,497 MT PROSPECT AVE,NEWARK,Essex,1,0,6,0,64,4,0,0
OAKLAND REHABILITATION AND HEALTHCARE  CENTER,315171,20 BREAKNECK ROAD,OAKLAND,Bergen,117,19,46,44,154,66,13,4
"DOCTORS SUBACUTE HEALTHCARE, LLC",315096,59 BIRCH STREET,PATERSON,Passaic,38,0,11,1,45,32,0,0
MORRIS VIEW HEALTHCARE CENTER,315303,540 WEST HANOVER AVENUE,MORRISTOWN,Morris,120,42,112,28,217,35,31,0
ELIZABETH NURSING AND REHAB,315106,1048 GROVE STREET,ELIZABETH,Union,6,0,33,20,53,18,0,0
"PREFERRED CARE AT OLD BRIDGE, LLC",315321,6989 RT18,OLD BRIDGE,Middlesex,52,30,31,27,92,42,2,0
MERIDIAN NURSING & REHAB AT SHREWSBURY,315136,89 AVENUE AT THE COMMON,SHREWSBURY,Monmouth,3,11,24,0,119,8,15,0
"ACTORS FUND HOME, THE",315377,175 WEST HUDSON AVE,ENGLEWOOD,Bergen,26,38,27,13,123,21,5,0
CARE ONE AT WELLINGTON,315152,301 UNION STREET,HACKENSACK,Bergen,12,0,14,6,93,5,2,0
ST MARY'S CENTER FOR REHABILITATION & HEALTHCARE,315060,210 ST MARY'S DRIVE,CHERRY HILL,Camden,1,8,22,22,162,36,0,10
LAKEVIEW REHABILITATION AND CARE CENTER,315110,130 TERHUNE DRIVE,WAYNE,Passaic,34,5,35,20,75,22,15,0
ALARIS HEALTH AT CASTLE HILL,315344,615 23RD STREET,UNION CITY,Hudson,5,23,8,13,120,11,3,3
MONTCLAIR CARE CENTER,315363,111-115 GATES AVENUE,MONTCLAIR,Essex,1,0,1,1,44,6,1,0
BARTLEY HEALTHCARE NURSING & REHABILITATION,315288,175 BARTLEY ROAD,JACKSON,Ocean,14,2,30,13,123,15,3,0
BISHOP MCCARTHY CENTER FOR REHABILITATION & HC,315126,1045 E CHESTNUT AVE,VINELAND,Cumberland,86,13,26,17,131,57,7,4
ALARIS HEALTH AT KEARNY,315192,206 BERGEN AVE,KEARNY,Hudson,13,11,10,6,100,24,1,0
"COMPLETE CARE AT LAURELTON, LLC",315274,475 JACK MARTIN BLVD,BRICK,Ocean,71,1,28,14,75,25,0,0
MEDFORD LEAS,315144,ONE MEDFORD LEAS WAY,MEDFORD,Burlington,2,0,3,2,5,4,0,0
"SPRINGPOINT AT CRESTWOOD, INC",315298,50 LACEY ROAD,WHITING,Ocean,33,9,38,23,51,18,7,0
HACKENSACK-UMC MOUNTAINSIDE,315389,ONE BAY AVE,MONTCLAIR,Essex,0,0,0,0,8,0,0,0
ST LAWRENCE REHAB CENTER,315127,2381 LAWRENCEVILLE ROAD,LAWRENCEVILLE,Mercer,6,0,0,0,34,24,6,0
FAMILY OF CARING HEALTHCARE AT MONTCLAIR,315435,42 NORTH MOUNTAIN AVE,MONTCLAIR,Essex,26,0,21,18,52,2,0,0
JFK HARTWYCK AT EDISON ESTATES,315279,10 BRUNSWICK AVENUE,EDISON,Middlesex,134,0,29,27,176,38,4,0
ALARIS HEALTH AT ROCHELLE PARK,315308,96 PARKWAY AVENUE,ROCHELLE PARK,Bergen,25,8,40,15,130,49,3,0
SOUTHERN OCEAN CENTER,315332,1361 ROUTE 72 WEST,MANAHAWKIN,Ocean,58,5,45,15,101,19,0,0
NEW GROVE MANOR,315147,101 NORTH GROVE STREET,EAST ORANGE,Essex,108,11,47,20,121,9,39,2
REGENCY GRANDE NURS & REHAB CE,315355,65 NORTH SUSSEX STREET,DOVER,Morris,28,0,38,18,122,18,0,0
SKILLED NURSING AT FELLOWSHIP VILLAGE,315356,8000 FELLOWSHIP DRIVE,BASKING RIDGE,Somerset,8,8,0,12,41,11,4,0
WESTFIELD CENTER,315122,1515 LAMBERTS MILL ROAD,WESTFIELD,Union,61,3,56,16,121,55,1,2
COMPLETE CARE AT WOODLANDS,315273,1400 WOODLAND AVE,PLAINFIELD,Union,1,1,3,0,79,4,0,0
CARE ONE AT HOLMDEL,315092,188 HIGHWAY 34,HOLMDEL,Monmouth,31,11,39,10,100,11,4,0
JERSEY SHORE CENTER,315364,3 INDUSTRIAL WAY EAST,EATONTOWN,Monmouth,15,4,39,1,130,11,0,0
SHADY LANE GLOUCESTER CO HOME,315405,256 COUNTY HOUSE ROAD,CLARKSBORO,Gloucester,,,,,,,,
HUNTERDON CARE CENTER,315226,1 LEISURE COURT,FLEMINGTON,Hunterdon,3,2,18,2,144,8,0,2
ARNOLD WALTER NURSING HOME,315119,622 S LAUREL AVENUE,HAZLET,Monmouth,13,9,16,8,81,21,2,1
CAMBRIDGE REHABILITATION AND HEALTHCARE CENTER,315201,255 EAST MAIN ST,MOORESTOWN,Burlington,67,7,26,17,74,27,0,0
LOPATCONG CENTER,315202,390 RED SCHOOL LANE,PHILLIPSBURG,Warren,98,11,44,33,106,27,3,0
CREST HAVEN NURSING AND REHABILITATION CENTER,315294,4 MOORE ROAD,CAPE MAY COURT HOUSE,Cape May,1,2,13,0,82,12,170,0
"MANOR, THE",315153,689 WEST MAIN ST,FREEHOLD,Monmouth,12,0,38,29,80,12,0,2
HARTWYCK AT OAK TREE,315251,2048 OAK TREE ROAD,EDISON,Middlesex,47,38,27,1,104,70,22,0
AVISTA HEALTHCARE,315068,3025 CHAPEL AVENUE WEST,CHERRY HILL,Camden,5,1,4,0,69,5,0,1
WILLOWBROOKE COURT SKILLED CARE AT EVERGREENS,315077,309 BRIDGEBORO ROAD,MOORESTOWN,Burlington,2,0,4,1,22,11,1,0
ARISTACARE AT CHERRY HILL,315245,1399 CHAPEL AVE WEST,CHERRY HILL,Camden,14,1,19,15,87,19,0,0
HOMESTEAD REHABILITATION & HEALTH CARE CENTER,315378,129 MORRIS TURNPIKE,NEWTON,Sussex,55,12,35,18,81,12,10,0
SEACREST VILLAGE,315218,1001 CENTER ST,LITTLE EGG HARBOR TW,Ocean,0,15,18,0,146,5,4,0
PINE ACRES CONVALESCENT CENTER,315053,51 MADISON AVE,MADISON,Morris,38,0,12,4,84,8,0,1
LAUREL MANOR HEALTHCARE AND REHABILITATION CENTER,315008,18 W LAUREL ROAD,STRATFORD,Camden,12,0,16,3,88,8,0,0
SILVER HEALTHCARE CENTER,315280,1417 BRACE ROAD,CHERRY HILL,Camden,120,143,35,24,121,32,32,0
WARDELL GARDENS AT TINTON FALLS,315414,524 WARDELL ROAD,TINTON FALLS,Monmouth,5,8,5,0,46,7,1,0
DEPTFORD CENTER FOR REHABILITATION AND HEALTHCARE,315174,1511 CLEMENTS BRIDGE RD,DEPTFORD,Gloucester,52,27,56,33,199,19,2,1
LLANFAIR HOUSE CARE & REHABILITATION CENTER,315142,1140 BLACK OAK RIDGE ROAD,WAYNE,Passaic,23,2,27,13,108,11,5,0
N J EASTERN STAR HOME,315419,111 FINDERNE AVENUE,BRIDGEWATER,Somerset,35,122,25,13,58,32,5,0
BERGEN COUNTY HEALTH CARE CTR,315436,35 B PIERMONT ROAD,ROCKLEIGH,Bergen,3,2,8,2,52,11,0,0
BARN HILL CARE CENTER,315137,249 HIGH STREET,NEWTON,Sussex,5,0,28,2,116,14,0,1
TROY HILLS CENTER,315138,200 REYNOLDS AVE,PARSIPPANY,Morris,48,1,32,10,81,17,0,0
"HAMILTON GROVE HEALTHCARE AND REHABILITATION, LLC",315423,2300 HAMILTON AVE,HAMILTON,Mercer,59,7,44,25,149,19,10,0
MEDFORD CARE CENTER,315176,185 TUCKERTON ROAD,MEDFORD,Burlington,58,46,13,8,96,12,6,0
PEACE CARE ST ANN'S,315413,198 OLD BERGEN ROAD,JERSEY CITY,Hudson,44,0,29,11,89,34,0,0
ST JOSEPH'S HEALTHCARE AND REHAB CENTER,315194,315 EAST LINDSLEY ROAD,CEDAR GROVE,Essex,85,0,46,26,89,54,0,1
ARISTACARE AT DELAIRE,315200,400 W STIMPSON AVE,LINDEN,Union,131,4,53,79,183,46,0,0
STRATFORD MANOR REHABILITATION AND CARE CENTER,315066,787 NORTHFIELD AVE,WEST ORANGE,Essex,63,1,33,21,121,18,7,0
MEADOW LAKES,315022,300 MEADOW LAKES,EAST WINDSOR,Mercer,18,9,37,10,48,38,1,0
MAJESTIC CENTER FOR REHAB & SUB-ACUTE CARE,315205,TWO COOPER PLAZA,CAMDEN,Camden,58,0,8,8,86,11,0,0
ROSE GARDEN NURSING AND REHABILITATION CENTER,315421,1579 OLD FREEHOLD ROAD,TOMS RIVER,Ocean,51,1,3,9,95,32,6,0
RIDGEWOOD CENTER,315158,330 FRANKLIN TPK,RIDGEWOOD,Bergen,61,5,21,12,58,28,3,0
AUTUMN LAKE HEALTHCARE AT OCEANVIEW,315179,2721 ROUTE 9,OCEAN VIEW,Cape May,35,18,23,13,99,13,16,0
DE LA SALLE HALL,315374,810 NEWMAN SPRINGS RD,LINCROFT,Monmouth,0,0,3,0,25,0,0,0
ASHBROOK CARE & REHABILITATION CENTER,315064,1610 RARITAN ROAD,SCOTCH PLAINS,Union,15,2,8,6,84,21,0,0
MANAHAWKIN CONV CTR,315206,1211 RT 72 WEST,MANAHAWKIN,Ocean,12,3,21,19,92,5,2,0
PARK PLACE CENTER,315362,2 DEER PARK DRIVE,MONMOUTH JUNCTION,Middlesex,44,5,32,19,74,23,1,1
HEATH VILLAGE,315072,430 SCHOOLEY'S MOUNTAIN RD,HACKETTSTOWN,Morris,42,100,33,9,77,46,61,0
ABINGDON CARE & REHABILITATION CENTER,315141,303 ROCK AVE,GREEN BROOK,Somerset,24,1,9,4,114,4,0,0
CONCORD HEALTHCARE & REHABILITATION CENTER,315275,963 OCEAN AVE,LAKEWOOD,Ocean,31,14,11,8,75,32,13,0
WINDSOR GARDENS CARE CENTER,315178,140 PARK AVE,EAST ORANGE,Essex,63,0,21,13,139,13,1,0
DWELLING PLACE AT ST CLARES,315019,400 WEST BLACKWELL ST,DOVER,Morris,0,0,6,0,17,4,1,0
ANDOVER SUBACUTE AND REHAB I,315044,1 O'BRIEN LANE,ANDOVER,Sussex,48,34,31,19,105,26,11,1
ALARIS HEALTH AT ST MARY'S,315352,135 SOUTH CENTER STREET,ORANGE,Essex,10,11,13,13,131,43,16,0
ALARIS HEALTH AT HAMILTON PARK,315300,525 MONMOUTH STREET,JERSEY CITY,Hudson,1,0,7,5,143,32,0,0
HUDSONVIEW HEALTH CARE CENTER,315112,9020 WALL STREET,NORTH BERGEN,Hudson,22,24,26,3,206,28,0,0
MERIDIAN NURSING AND REHABILITATION AT BRICK,315342,415 JACK MARTIN BLVD,BRICK,Ocean,56,86,14,19,95,36,43,0
CLOVER MEADOWS HEALTHCARE AND REHABILITATION CENTE,315113,112 FRANKLIN CORNER ROAD,LAWRENCEVILLE,Mercer,53,0,27,21,72,18,9,0
CRANFORD REHAB & NURSING CENTER,315091,205 BIRCHWOOD AVE,CRANFORD,Union,15,1,21,7,127,6,0,0
RIVERFRONT REHABILITATION AND HEALTHCARE CENTER,315225,5101 NORTH PARK DRIVE,PENNSAUKEN,Camden,66,16,28,11,167,33,4,0
TEANECK NURSING CENTER,315037,1104 TEANECK ROAD,TEANECK,Bergen,10,0,4,1,81,0,0,0
MONMOUTH CARE CENTER,315284,229 BATH AVENUE,LONG BRANCH,Monmouth,6,0,23,13,77,10,0,0
BROADWAY HOUSE FOR CONTINUING,315343,298 BROADWAY,NEWARK,Essex,18,0,19,9,64,28,0,0
ABIGAIL HOUSE FOR NURSING & REHABILITATION,315267,1105 -1115 LINDEN STREET,CAMDEN,Camden,61,0,17,4,144,21,2,0
"PALACE REHABILITATION AND CARE CENTER, THE",315263,315 WEST MILL ROAD,MAPLE SHADE,Burlington,108,24,22,15,154,30,0,0
VOORHEES PEDIATRIC FACILITY,315289,1304 LAUREL OAK ROAD,VOORHEES,Camden,4,12,5,0,107,17,5,0
HARBORAGE (THE),315307,7600 RIVER ROAD,NORTH BERGEN,Hudson,137,5,60,41,168,55,47,2
HOUSE OF THE GOOD SHEPHERD,315422,798 WILLOW GROVE STREET,HACKETTSTOWN,Warren,,,,,,,,
BAYSHORE HEALTH CARE CENTER,315252,715 NORTH BEERS STREET,HOLMDEL,Monmouth,4,0,23,12,160,12,16,0
COMPLETE CARE AT HOLIDAY CITY,315320,4 PLAZA DRIVE,TOMS RIVER,Ocean,47,18,86,20,110,34,10,0
REHAB AT RIVER'S EDGE,315140,633 ROUTE 28,RARITAN,Somerset,18,0,23,8,100,3,1,0
ST JOSEPH'S HOME FOR ELDERLY,315388,140 SHEPHERD LANE,TOTOWA,Passaic,8,5,10,4,62,17,4,0
ATLANTIC COAST REHAB & HEALTH,315115,485 RIVER AVE,LAKEWOOD,Ocean,97,15,33,19,111,24,0,0
COMPLETE CARE AT WHITING,315293,3000 HILLTOP ROAD,WHITING,Ocean,52,10,24,16,102,43,14,0
MERWICK CARE & REHABILITATION CENTER,315001,100 PLAINSBORO ROAD,PLAINSBORO,Middlesex,20,18,52,27,145,21,5,0
ARBOR GLEN CENTER,315036,25 E LINDSLEY ROAD,CEDAR GROVE,Essex,38,0,33,10,87,22,2,0
MORRIS HALL/ST JOSEPH'S NURSING CENTER,315338,1 BISHOPS DRIVE,LAWRENCEVILLE,Mercer,71,30,43,28,136,33,0,0
PREFERRED CARE AT WALL,315397,2350 HOSPITAL ROAD,ALLENWOOD,Monmouth,61,18,23,17,94,9,5,0
"PARKER AT SOMERSET, INC",315253,15 DELLWOOD LANE,SOMERSET,Somerset,11,0,24,3,102,6,0,0
RUNNELLS CENTER FOR REHABILITATION & HEALTHCARE,315009,40 WATCHUNG WAY,BERKELEY HEIGHTS,Union,29,4,226,5,185,89,19,0
OCEANA REHABILITATION AND NC,315193,502 ROUTE 9 NORTH,CAPE MAY COURT HOUSE,Cape May,25,4,8,1,101,10,1,0
ATRIUM POST ACUTE CARE OF PRINCETON,315370,5000 WINDROW DRIVE,PRINCETON,Mercer,71,108,39,19,104,24,2,0
ARISTACARE AT NORWOOD TERRACE,315217,40 NORWOOD AVENUE,PLAINFIELD,Union,7,5,12,4,74,3,2,0
COMPLETE CARE AT SUMMIT RIDGE,315038,20 SUMMIT STREET,WEST ORANGE,Essex,64,0,45,24,94,22,17,0
CHESHIRE HOME,315383,9 RIDGEDALE AVE,FLORHAM PARK,Morris,0,0,0,0,35,0,0,0
ALARIS HEALTH AT BELGROVE,315366,195 BELGROVE DRIVE,KEARNY,Hudson,7,5,7,0,52,20,0,0
HAMILTON PLACE AT THE PINES AT WHITING,315347,507 ROUTE 530,WHITING,Ocean,0,0,8,2,47,4,2,0
UNITED METHODIST COMMUNITIES AT PITMAN,315427,535 N OAK AVE,PITMAN,Gloucester,3,0,32,0,61,10,8,0
MEADOWVIEW NURSING AND REHABILITATION CENTER,315358,235 DOLPHIN AVE,NORTHFIELD,Atlantic,99,1,163,145,109,31,0,0
NEW COMMUNITY EXTENDED CARE FACILITY,315393,266 S ORANGE AVE,NEWARK,Essex,55,6,47,12,100,27,0,2
REFORMED CHURCH HOME,315417,1990 ROUTE 18 NORTH,OLD BRIDGE,Middlesex,48,0,23,1,83,23,0,0
OUR LADY'S CENTER FOR REHABILITATION & HC,315054,1100 CLEMATIS AVE,PLEASANTVILLE,Atlantic,14,10,22,9,122,10,8,0
"OAKS AT DENVILLE, THE",315329,21 POCONO ROAD,DENVILLE,Morris,15,5,24,4,53,8,0,0
DELLRIDGE HEALTH & REHABILITATION CENTER,315129,532 FARVIEW AVE,PARAMUS,Bergen,,,,,,,,
CHATHAM HILLS SUBACUTE CARE CENTER,315120,415 SOUTHERN BLVD,CHATHAM,Morris,14,46,17,4,81,10,4,0
NORTH CAPE CENTER,315350,700 TOWNBANK ROAD,CAPE MAY,Cape May,58,7,31,13,78,33,13,0
ALARIS HEALTH AT JERSEY CITY,315083,198 STEVENS AVE,JERSEY CITY,Hudson,2,29,17,5,109,42,3,0
MORRISTOWN POST ACUTE REHAB AND NURSING CENTER,315157,77 MADISON AVENUE,MORRISTOWN,Morris,127,43,56,32,152,25,28,0
AUTUMN LAKE HEALTHCARE AT BERKELEY HEIGHTS,315195,35 COTTAGE STREET,BERKELEY HEIGHTS,Union,2,0,9,0,63,5,0,0
ANCHOR CARE AND REHABILITATION CENTER,315314,3325 HIGHWAY 35,HAZLET,Monmouth,64,23,31,18,130,34,3,3
COMPLETE CARE AT WILLOW CREEK,315131,1165 EASTON AVE,SOMERSET,Somerset,59,0,29,15,91,17,27,0
ELMWOOD HILLS HEALTHCARE CENTER LLC,315159,425 WOODBURY-TURNERSVILLE ROAD,BLACKWOOD,Camden,154,13,60,38,249,51,15,0
CORAL HARBOR REHABILITATION AND HEALTHCARE CENTER,315105,2050 SIXTH AVE,NEPTUNE CITY,Monmouth,10,7,23,0,86,6,14,0
NEPTUNE GARDENS NURSING AND REHAB LLC,315056,101 WALNUT ST,NEPTUNE,Monmouth,62,150,6,0,71,54,0,0
PHOENIX CENTER FOR REHABILITATION AND PEDIATRICS,315229,1433 RINGWOOD AVE,HASKELL,Passaic,3,5,5,1,174,7,1,0
CLARK NURSING AND REHAB CNTR,315341,1213 WESTFIELD AVENUE,CLARK,Union,64,3,32,23,90,27,13,5
PREFERRED CARE AT HAMILTON,315111,1501 STATE HWY 33,HAMILTON SQUARE,Mercer,24,26,44,8,91,7,3,1
PREAKNESS HEALTHCARE CENTER,315361,305 OLDHAM ROAD,WAYNE,Passaic,14,2,31,12,278,53,5,0
CEDAR GROVE RESPIRATORY AND NURSING CENTER,315257,1420 SOUTH BLACK HORSE PIKE,WILLIAMSTOWN,Gloucester,16,6,80,3,149,19,0,0
AMBOY CARE CENTER,315305,1 LINDBERG AVENUE,PERTH AMBOY,Middlesex,42,4,11,16,114,5,0,0
WOODCLIFF LAKE HEALTH & REHABILITATION CENTER,315133,555 CHESTNUT RIDGE ROAD,WOODCLIFF LAKE,Bergen,13,5,29,5,72,50,0,2
ELMORA HILLS HEALTH & REHABILITATION CENTER,315010,225 W JERSEY STREET,ELIZABETH,Union,77,0,44,18,141,8,0,0
ROLLING HILLS CARE CENTER,315302,16 CRATETOWN ROAD,LEBANON,Hunterdon,8,10,14,6,48,17,8,0
CARE ONE AT ORADELL,315339,600 KINDERKAMACK ROAD,ORADELL,Bergen,6,37,3,2,89,14,6,0
REGENCY GARDENS NURSING CENTER,315103,296 HAMBURG TURNPIKE,WAYNE,Passaic,0,0,1,1,109,1,0,0
JFK HARTWYCK AT CEDAR BROOK,315101,1340 PARK AVE,PLAINFIELD,Union,51,0,25,15,91,23,6,0
CARE ONE AT THE HIGHLANDS,315132,1350 INMAN AVENUE,EDISON,Middlesex,7,2,9,1,101,5,1,0
DAUGHTERS OF MIRIAM CENTER,315021,155 HAZEL STREET,CLIFTON,Passaic,24,6,12,13,136,41,0,0
EASTERN PINES CONV CTR,315317,29 NORTH VERMONT AVE,ATLANTIC CITY,Atlantic,5,0,5,0,85,9,0,0
ALLAIRE REHAB & NURSING,315387,115 DUTCH LANE ROAD,FREEHOLD,Monmouth,45,16,13,7,114,23,9,0
JEFFERSON HEALTH CARE CENTER,315231,535 EGG HARBOR ROAD,SEWELL,Gloucester,30,5,14,4,142,12,13,0
FRIENDS VILLAGE AT WOODSTOWN,315161,ONE FRIENDS DRIVE,WOODSTOWN,Salem,16,0,19,9,35,22,1,0
MERRY HEART NURSING HOME,315057,200 RT 10 WEST,SUCCASUNNA,Morris,2,0,32,0,82,2,0,0
MILFORD MANOR,315276,69 MAPLE ROAD,WEST MILFORD,Passaic,5,0,42,19,86,5,0,0
WATERS EDGE HEALTHCARE & REHAB,315324,512 UNION STREET,TRENTON,Mercer,113,0,34,29,105,69,0,1
CARE ONE AT CRESSKILL,315313,221 COUNTY ROAD,CRESSKILL,Bergen,2,3,5,2,55,6,1,0
CORNELL HALL CARE & REHABILITATION CENTER,315104,234 CHESTNUT STREET,UNION,Union,7,0,15,3,88,3,1,0
ARISTACARE AT MANCHESTER,315196,1770 TOBIAS AVENUE,MANCHESTER,Ocean,97,9,55,23,126,35,9,0
PINE BROOK CARE CENTER,315282,104 PENSION ROAD,ENGLISHTOWN,Monmouth,6,0,8,4,63,2,0,0
LEISURE PARK HEALTH CENTER,315256,1400 ROUTE 70,LAKEWOOD,Ocean,1,0,4,4,36,2,0,2
CRANFORD PARK REHABILITATION & HEALTHCARE CENTER,315390,600 LINCOLN PARK EAST,CRANFORD,Union,2,0,5,3,48,75,0,0
CHILDRENS SPECIALIZED HOSPITAL MOUNTAINSIDE,315239,150 NEW PROVIDENCE ROAD,MOUNTAINSIDE,Union,2,9,0,0,41,20,13,0
HAMILTON CONTINUING CARE,315223,1059 EDINBURG ROAD,HAMILTON,Mercer,104,2,56,40,112,47,2,0
MASONIC VILLAGE AT BURLINGTON,315166,902 JACKSONVILLE ROAD,BURLINGTON,Burlington,42,66,26,15,101,57,9,0
"COMPLETE CARE AT HAMILTON, LLC",315221,56 HAMILTON AVENUE,PASSAIC,Passaic,,,,,,,,
SOUTH JERSEY EXTENDED CARE,315061,99 MANHEIM AVENUE,BRIDGETON,Cumberland,64,3,2,2,111,37,4,0
UNITED METHODIST COMMUNITIES AT THE SHORES,315394,2201 BAY AVENUE,OCEAN CITY,Cape May,2,1,6,1,50,7,9,0
LINCOLN PARK CARE CENTER,315249,499 PINE BROOK ROAD,LINCOLN PARK,Morris,148,172,105,63,434,82,88,0
ALARIS HEALTH AT RIVERTON,315198,1777 LAWRENCE STREET,RAHWAY,Union,4,0,9,0,70,13,1,0
ALARIS HEALTH AT CEDAR GROVE,315357,110 GROVE AVE,CEDAR GROVE,Essex,14,0,0,0,132,19,1,0
ANDOVER SUBACUTE AND REHAB II,315248,99 MULFORD ROAD,ANDOVER,Sussex,146,31,115,67,367,93,40,1
BERGEN NEW BRIDGE MEDICAL CENTER,315017,230 E RIDGEWOOD AVE,PARAMUS,Bergen,254,41,17,64,392,120,2,1
"COMPLETE CARE AT BEY LEA, LLC",315264,1351 OLD FREEHOLD ROAD,TOMS RIVER,Ocean,73,49,45,23,84,32,26,0
REGENCY HERITAGE NURSING AND REHABILITATION CENTER,315367,380 DEMOTT LANE,SOMERSET,Somerset,69,40,75,35,162,24,32,0
LEISURE CHATEAU REHABILITATION,315190,962 RIVER AVE,LAKEWOOD,Ocean,80,73,27,21,184,44,2,0
IMPERIAL CARE CENTER,315199,919 GREEN GROVE ROAD,NEPTUNE,Monmouth,1,1,9,1,81,1,0,0
HACKENSACK MERIDIAN HEALTH WEST CALDWELL C,315247,165 FAIRFIELD AVE,WEST CALDWELL,Essex,6,1,11,4,106,5,0,0
BURLINGTON WOODS,315050,115 SUNSET ROAD,BURLINGTON,Burlington,85,1,52,23,118,39,1,0
CARE ONE AT RIDGEWOOD AVENUE,315426,W-90 RIDGEWOOD AVE,PARAMUS,Bergen,14,9,23,9,71,7,2,0
BARCLAYS REHABILITATION AND HEALTHCARE CENTER,315013,1412 MARLTON PIKE,CHERRY HILL,Camden,29,0,23,12,90,8,0,0
WARREN HAVEN REHAB AND NURSING CENTER,315304,350 OXFORD ROAD,OXFORD,Warren,56,64,41,17,76,11,12,0
MAPLE GLEN CENTER,315328,12-15 SADDLE RIVER ROAD,FAIRLAWN,Bergen,78,10,45,29,89,43,0,0
COMPLETE CARE AT GREEN KNOLL,315134,875 ROUTE 202-206 NORTH,BRIDGEWATER,Somerset,49,11,9,3,105,6,23,2
HACKENSACK MERIDIAN HEALTH NURSING & REHAB,315295,50 POLIFLY ROAD,HACKENSACK,Bergen,0,3,15,2,136,7,0,1
MCAULEY HALL HEALTH CARE CENTE,315337,1633 HIGHWAY 22,WATCHUNG,Somerset,28,1,25,6,55,29,0,0
COUNTY MANOR REHABILITATION & HCC,315164,133 COUNTY ROAD,TENAFLY,Bergen,31,21,16,11,46,13,15,0
FOOTHILL ACRES REHABILITATION & NURSING CENTER,315425,39 EAST MOUNTAIN ROAD,HILLSBOROUGH,Somerset,86,4,55,36,111,21,0,0
ALARIS HEALTH AT ESSEX,315359,155 FORTIETH STREET,IRVINGTON,Essex,14,0,8,1,128,12,0,0
CARE ONE AT VALLEY,315369,300 OLD HOOK ROAD,WESTWOOD,Bergen,12,3,8,1,81,7,0,0
INGLEMOOR CENTER,315349,333 GRAND AVE,ENGLEWOOD,Bergen,19,3,13,10,42,12,0,0
HAMPTON RIDGE HEALTHCARE AND REHABILITATION,315312,94 STEVENS ROAD,TOMS RIVER,Ocean,101,8,47,18,164,43,16,0
VILLAGE POINT,315269,THREE DAVID BRAINERD DRIVE,MONROE TOWNSHIP,Middlesex,25,3,13,18,83,21,0,0
ROSE MOUNTAIN CARE CENTER,315384,ROUTE 1 & 18,NEW BRUNSWICK,Middlesex,42,0,30,20,63,20,0,0
GREENWOOD HOUSE HOME FOR THE JEWISH AGED,315215,53 WALTER STREET,TRENTON,Mercer,,,,,,,,
SUMMER HILL NURSING HOME,315381,111 ROUTE 516,OLD BRIDGE,Middlesex,28,0,8,4,88,29,1,1
ALLEGRIA AT THE FOUNTAINS,315297,114 HAYES MILL ROAD,ATCO,Camden,0,0,14,0,52,14,0,0
HOLLY MANOR CENTER,315143,84 COLD HILL ROAD,MENDHAM,Morris,58,0,37,23,79,18,1,1
GOLDEN REHABILITATION AND NURSING CENTER,315058,438 SALEM-WOODSTOWN ROAD,SALEM,Salem,2,0,0,0,70,7,0,0
PROVIDENCE NURSING AND REHABILITATION CENTER,315124,439 BELLEVUE AVENUE,TRENTON,Mercer,0,0,0,0,83,1,0,2
APPLEWOOD ESTATES,315292,APPLEWOOD DRIVE,FREEHOLD,Monmouth,6,0,21,2,39,5,0,0
MARCELLA CENTER,315330,2305 RANCOCAS ROAD,BURLINGTON,Burlington,75,2,64,22,79,41,4,1
CUMBERLAND MANOR NURSING AND REHABILITATION CENTER,315396,154 SUNNY SLOPE DRIVE,BRIDGETON,Cumberland,3,0,1,0,155,9,2,0
COMPLETE CARE AT ARBORS,315333,1750 ROUTE 37 WEST,TOMS RIVER,Ocean,37,0,12,8,67,21,24,0
VALLEY VIEW REHABILITATION AND HEALTHCARE CTR,315409,1 SUMMIT AVENUE,NEWTON,Sussex,8,6,1,0,16,6,1,0
CARE ONE AT NEW MILFORD,315306,800 RIVER ROAD,NEW MILFORD,Bergen,15,5,23,3,178,8,1,1
CLOVER REST HOME,315429,28 WASHINGTON STREET,COLUMBIA,Warren,0,0,0,0,30,0,6,0
EAGLEVIEW HEALTH AND REHABILITATION,315014,849 BIG OAK ROAD,PITTSGROVE,Salem,4,0,5,0,68,4,1,0
PRINCETON CARE CENTER,315108,728 BUNN DRIVE,PRINCETON,Mercer,8,0,38,12,76,7,1,0
CARE ONE AT KING JAMES,315087,1040 ROUTE 36,ATLANTIC HIGHLANDS,Monmouth,11,0,19,10,95,11,2,0
ALAMEDA CENTER FOR REHABILITATION AND HEALTHCARE,315180,303 ELM STREET,PERTH AMBOY,Middlesex,81,10,55,25,161,79,2,2
VOORHEES CENTER,315219,3001 EVESHAM ROAD,VOORHEES,Camden,124,0,57,42,134,42,2,0
CHRISTIAN HEALTH CARE CENTER,315376,301 SICOMAC AVE,WYCKOFF,Bergen,17,0,40,11,226,55,0,0
CAREPOINT HEALTH - BAYONNE HOSPITAL CENTER TCU,315431,29 EAST 29TH STREET,BAYONNE,Hudson,0,0,1,0,7,2,0,0
GREEN HILL,315416,103 PLEASANT VALLEY WAY,WEST ORANGE,Essex,14,5,19,3,75,20,3,1
KRESSON VIEW CENTER,315207,2601 EVESHAM ROAD,VOORHEES,Camden,74,5,46,13,155,49,6,0
"HEALTH CENTER AT GALLOWAY, THE",315210,66 WEST JIMMIE LEEDS ROAD,GALLOWAY TOWNSHIP,Atlantic,50,22,25,22,82,15,11,0
SUNNYSIDE MANOR,315354,2500 RIDGEWOOD ROAD,WALL,Monmouth,0,0,14,0,40,4,2,0
"BUCKINGHAM AT NORWOOD, THE",315290,100 MCCLELLAN STREET,NORWOOD,Bergen,51,0,29,4,155,28,3,1
PARK CRESCENT HEALTHCARE & REHABILITATION CENTER,315266,480 PARKWAY DRIVE,EAST ORANGE,Essex,90,2,58,41,142,34,0,1
