Provider Name,Federal Provider Number,Provider Address,Provider City,County,Residents Total Confirmed COVID-19,Residents Total Suspected COVID-19,Residents Total All Deaths,Residents Total COVID-19 Deaths,Total Number of Occupied Beds,Staff Total Confirmed COVID-19,Staff Total Suspected COVID-19,Staff Total COVID-19 Deaths
WICOMICO NURSING HOME,215007,P.O. BOX 2378 900 BOOTH ST,SALISBURY,Wicomico,8,0,12,1,74,5,0,0
BALLENGER CREEK CENTER,215001,347 BALLENGER DRIVE,FREDERICK,Frederick,102,24,32,16,97,51,10,0
CADIA HEALTHCARE - ANNAPOLIS,215005,900 VAN BUREN STREET,ANNAPOLIS,Anne Arundel,0,0,7,0,72,8,5,1
PEAK HEALTHCARE AT THE PINES,215010,610 DUTCHMAN'S LANE,EASTON,Talbot,17,5,36,9,88,17,46,0
FAIRLAND CENTER,215015,2101 FAIRLAND ROAD,SILVER SPRING,Montgomery,9,32,6,1,70,19,1,0
FUTURE CARE NORTHPOINT,215147,1046 OLD NORTH POINT ROAD,BALTIMORE,Baltimore,44,20,25,6,130,30,60,0
MEADOW PARK REHABILITATION AND HEALTHCARE CENTER,215347,1525 NORTH ROLLING ROAD,CATONSVILLE,Baltimore,60,63,28,14,103,23,4,0
FUTURE CARE COLD SPRING,215253,4700 HARFORD ROAD,BALTIMORE,Baltimore City,0,0,13,0,119,3,0,0
MANOKIN CENTER FOR REHABILITATION AND HEALTHCARE,215179,11974 EDGEHILL TERRACE,PRINCESS ANNE,Somerset,66,0,2,2,100,23,0,0
ALICE BYRD TAWES NURSING HOME,215058,201 HALL HIGHWAY,CRISFIELD,Somerset,27,0,11,2,52,21,2,0
SNOW HILL NURSING & REHAB CTR,215121,430 WEST MARKET STREET,SNOW HILL,Worcester,26,9,18,7,48,27,18,0
"REGENCY CARE OF SILVER SPRING, LLC",215060,9101 SECOND AVENUE,SILVER SPRING,Montgomery,2,0,3,4,47,2,0,0
MARYLAND MASONIC HOMES LTD,215361,300 INTERNATIONAL CIRCLE,COCKEYSVILLE,Baltimore,26,17,28,7,60,27,24,0
MANOR CARE HEALTH SERVICES - BETHESDA,215095,6530 DEMOCRACY BOULEVARD,BETHESDA,Montgomery,55,6,20,12,67,8,2,1
RIDGEWAY MANOR NURSING & REHABILITATION CENTER,215227,5743 EDMONDSON AVENUE,CATONSVILLE,Baltimore,14,2,13,7,39,14,16,0
MARYLAND BAPTIST AGED HOME,215360,2801 RAYNER AVENUE,BALTIMORE,Baltimore City,0,0,1,0,22,0,0,0
ST. JOSEPH'S  NURSING  HOME,21E104,1222 TUGWELL DRIVE,CATONSVILLE,Baltimore,0,0,8,0,42,3,0,0
HOLLY HILL HEALTHCARE CENTER,215204,531 STEVENSON LANE,TOWSON,Baltimore,53,0,8,2,67,14,14,0
ALLEGANY HEALTH NURSING AND REHAB,215230,730 FURNACE STREET,CUMBERLAND,Allegany,1,0,35,0,108,3,0,0
WESTMINSTER HEALTHCARE CENTER,215094,1234 WASHINGTON BOULEVARD,WESTMINSTER,Carroll,0,0,16,5,114,6,2,0
"VILLA ROSA NURSING AND REHABILITATION, LLC",215350,3800 LOTTSFORD VISTA ROAD,MITCHELLVILLE,Prince George's,26,25,14,1,69,9,15,0
PEAK HEALTHCARE AT SLIGO CREEK,215327,7525 CARROLL AVENUE,TAKOMA PARK,Montgomery,31,1,7,5,74,17,1,0
THE VILLAGE AT ROCKVILLE,215125,9701 VEIRS DRIVE,ROCKVILLE,Montgomery,45,8,68,12,121,31,4,0
RIDERWOOD VILLAGE,215343,3160 GRACEFIELD ROAD,SILVER SPRING,Prince George's,10,1,31,5,54,11,2,0
HILLHAVEN NURSING AND REHABILITATION CENTER,215212,3210 POWDER MILL ROAD,ADELPHI,Prince George's,3,0,11,0,50,5,0,0
FREDERICK HEALTH & REHABILITATION CENTER,215184,30 NORTH PLACE,FREDERICK,Frederick,35,1,39,15,92,30,0,0
PICKERSGILL RETIREMENT COMMUNITY,215259,615 CHESTNUT AVE,TOWSON,Baltimore,1,0,7,0,34,12,13,0
FAYETTE HEALTH AND REHABILITATION CENTER,215183,1217 WEST FAYETTE STREET,BALTIMORE,Baltimore City,4,6,2,0,119,4,0,1
MULTI-MEDICAL CENTER,215096,7700 YORK ROAD,TOWSON,Baltimore,0,55,23,0,93,14,8,0
ARCOLA HEALTH AND REHABILITATION CENTER,215014,901 ARCOLA AVENUE,SILVER SPRING,Montgomery,25,0,30,7,125,21,0,0
AUTUMN LAKE HEALTHCARE AT RIVERVIEW,215203,1 EASTERN BOULEVARD,ESSEX,Baltimore,61,31,29,7,186,38,11,0
THE LUTHERAN VILLAGE AT MILLER'S GRANT,215363,9000 FATHERS LEGACY,ELLICOTT CITY,Howard,1,2,3,1,12,4,1,0
FT WASHINGTON HEALTH CENTER,215146,12021 LIVINGSTON ROAD,FORT WASHINGTON,Prince George's,0,0,14,0,132,12,0,0
SOUTH RIVER HEALTHCARE CENTER,215297,144 WASHINGTON ROAD,EDGEWATER,Anne Arundel,1,0,15,1,81,11,0,0
FUTURE CARE CHARLES VILLAGE,215324,2327 N. CHARLES ST,BALTIMORE,Baltimore City,3,1,14,2,82,12,2,0
FUTURE CARE PINEVIEW,215328,9106 PINEVIEW LANE,CLINTON,Prince George's,70,0,27,7,142,36,4,0
THE NURSING AND REHAB CENTER AT STADIUM PLACE,215356,1010 EAST 33RD STREET,BALTIMORE,Baltimore City,1,3,2,0,52,7,0,0
LARKIN CHASE CENTER,215264,15005 HEALTH CENTER DRIVE,BOWIE,Prince George's,81,3,45,19,92,36,0,0
HAGERSTOWN HEALTHCARE CENTER,215336,750 DUAL HIGHWAY,HAGERSTOWN,Washington,0,0,7,0,123,7,3,0
COFFMAN NURSING HOME,215352,1304 PENNSYLVANIA AVE,HAGERSTOWN,Washington,0,1,14,0,45,2,0,0
WESTGATE HILLS REHAB & HEALTHCARE CTR,215299,10 N. ROCK GLEN ROAD,BALTIMORE,Baltimore City,62,2,29,15,102,28,1,1
ASBURY SOLOMONS,215304,11750 ASBURY CIRCLE,SOLOMONS,Calvert,0,0,11,0,45,4,0,0
BUCKINGHAM'S CHOICE,215329,3200 BAKER CIRCLE,ADAMSTOWN,Frederick,8,0,12,0,20,6,0,1
GLEN BURNIE HEALTH AND REHABILITATION CENTER,215266,7355 FURNACE BRANCH ROAD EAST,GLEN BURNIE,Anne Arundel,51,0,40,7,126,18,0,0
TRANSITIONAL CARE SERVICES AT MERCY MEDICAL CENTER,215283,301 ST. PAUL PLACE,BALTIMORE,Baltimore City,0,0,0,0,22,4,0,0
"MARIA HEALTH CARE CENTER, INC.",215300,6401 N. CHARLES STREET,BALTIMORE,Baltimore,,,,,,,,
CLINTON HEALTHCARE  CENTER,215231,9211 STUART LANE,CLINTON,Prince George's,6,3,33,2,212,13,12,1
FRIENDS NURSING HOME,215211,17340 QUAKER LANE,SANDY SPRING,Montgomery,1,0,8,2,50,6,0,0
BROADMEAD,215123,13801 YORK ROAD,COCKEYSVILLE,Baltimore,14,26,15,5,23,32,8,0
OAK CREST VILLAGE,215308,8800 WALTHER BOULEVARD,PARKVILLE,Baltimore,7,0,40,0,119,11,16,0
PEAK HEALTHCARE AT CHESTERTOWN,215260,415 MORGNEC ROAD,CHESTERTOWN,Kent,0,0,12,0,67,0,0,1
CARRIAGE HILL BETHESDA,215234,5215 CEDAR LANE,BETHESDA,Montgomery,13,1,24,5,48,18,0,0
LEVINDALE HEBREW GER CTR & HSP,215033,2434 W. BELVEDERE AVENUE,BALTIMORE,Baltimore City,67,1,192,8,191,39,24,0
FRANKLIN WOODS CENTER,215261,9200 FRANKLIN SQUARE DRIVE,BALTIMORE,Baltimore,10,16,13,0,84,14,1,0
SPA CREEK CENTER,215258,35 MILKSHAKE LANE,ANNAPOLIS,Anne Arundel,40,3,21,3,97,20,1,0
MANOR CARE HEALTH SERVICES - POTOMAC,215171,10714 POTOMAC TENNIS LANE,POTOMAC,Montgomery,45,8,32,20,131,15,5,0
LAURELWOOD HEALTHCARE CENTER,215111,100 LAUREL DRIVE,ELKTON,Cecil,0,0,5,0,99,2,1,0
CITIZENS CARE CENTER,215039,415 S. MARKET STREET,HAVRE DE GRACE,Harford,6,0,19,0,101,9,2,0
WESTERN MD HOSPITAL CENTER,215110,1500 PENNSYLVANIA AVENUE,HAGERSTOWN,Washington,0,2,2,0,35,9,41,0
LORIEN NSG & REHAB CTR BELAIR,215341,1909 EMORTON ROAD,BEL AIR,Harford,2,0,6,0,52,9,0,0
BEDFORD COURT HEALTHCARE CENT.,215246,3701 INTERNATIONAL DRIVE,SILVER SPRING,Montgomery,1,2,6,0,38,6,6,0
MANOR CARE HEALTH SERVICES - RUXTON,215077,7001 CHARLES STREET,TOWSON,Baltimore,78,33,26,17,122,24,40,1
PERRING PARKWAY CENTER,215081,1801 WENTWORTH ROAD,BALTIMORE,Baltimore,42,4,16,4,86,25,0,0
HERITAGE CENTER,215135,7232 GERMAN HILL ROAD,DUNDALK,Baltimore,62,18,25,7,144,27,5,0
OAK MANOR CENTER FOR REHABILITATION AND HEALTHCARE,215315,3415 GREENCASTLE ROAD,BURTONSVILLE,Montgomery,27,27,25,7,91,17,6,0
AUTUMN RIDGE AT NORTH OAKS,215229,725 MOUNT WILSON LANE,BALTIMORE,Baltimore,11,3,7,5,13,11,19,1
CHESAPEAKE WOODS CENTER,215221,525 GLENBURN AVENUE,CAMBRIDGE,Dorchester,28,23,26,1,85,26,15,0
BROOKE GROVE REHAB. & NSG CTR,215200,18131 SLADE SCHOOL ROAD,SANDY SPRING,Montgomery,4,2,5,4,157,11,1,0
AUTUMN LAKE HEALTHCARE AT CHERRY LANE,215177,9001 CHERRY LANE,LAUREL,Prince George's,41,29,30,20,130,47,1,1
LORIEN HEALTH SYSTEMS - COLUMBIA,215112,6334 CEDAR LANE,COLUMBIA,Howard,37,9,25,11,151,73,52,0
CAROLINE CENTER FOR REHABILITATION AND HEALTHCARE,215083,520 KERR AVENUE,DENTON,Caroline,59,21,11,5,71,28,4,0
AUTUMN LAKE HEALTHCARE AT PIKESVILLE,215082,7 SUDBROOK LANE,PIKESVILLE,Baltimore,16,9,17,11,99,15,10,0
BEL AIR HEALTH AND REHABILITATION CENTER,215312,410 EAST MCPHAIL ROAD,BEL AIR,Harford,88,0,45,20,112,29,0,0
LITTLE SISTERS OF THE POOR,215354,601 MAIDEN CHOICE LANE,BALTIMORE,Baltimore,0,0,6,0,32,9,1,0
RAVENWOOD NURSING CARE CENTER,215113,1183 LUTHER DRIVE,HAGERSTOWN,Washington,0,0,1,0,67,2,0,0
FUTURE CARE CHERRYWOOD,215192,12020 REISTERSTOWN ROAD,REISTERSTOWN,Baltimore,48,0,26,14,113,29,33,0
LONG GREEN CENTER,215031,115 EAST MELROSE AVENUE,BALTIMORE,Baltimore City,1,7,23,0,114,15,1,0
LARGO NURSING AND REHABILIATION CENTER,215331,600 LARGO ROAD,GLENARDEN,Prince George's,36,13,6,2,106,7,3,0
BIRCH MANOR CENTER FOR REHABILITATION & HEALTHCARE,215136,7309 SECOND AVENUE,SYKESVILLE,Carroll,58,32,36,26,69,4,9,0
LORIEN MAYS CHAPEL,215351,12230 ROUND WOOD ROAD,TIMONIUM,Baltimore,5,3,11,1,72,13,3,0
BAYLEIGH CHASE,215137,501 DUTCHMAN'S LANE,EASTON,Talbot,1,0,18,0,42,7,0,0
PLEASANT VIEW NSG HOME,215268,4101 OLD NATIONAL PIKE,MOUNT AIRY,Carroll,,,,,,,,
RESTORE HEALTH REHABILITATION CENTER,215362,4615 EINSTEIN PLACE,WHITE PLAINS,Charles,11,5,20,2,44,11,0,0
ST. ELIZABETH REHAB. & NSG. CE,215044,3320 BENSON AVENUE,BALTIMORE,Baltimore City,38,2,38,13,112,32,7,0
FOX CHASE REHABILITATION AND NURSING CENTER,215197,2015 EAST-WEST HIGHWAY,SILVER SPRING,Montgomery,3,0,3,0,46,4,1,0
KESWICK MULTI-CARE CENTER,215037,700 WEST 40TH STREET,BALTIMORE,Baltimore City,16,60,33,4,194,22,22,0
HERITAGE HARBOUR HEALTH AND REHABILITATION CENTER,215325,2700 SOUTH HAVEN ROAD,ANNAPOLIS,Anne Arundel,32,1,40,10,116,9,0,0
"LORIEN TANEYTOWN, INC",215348,100 ANTRIM BLVD,TANEYTOWN,Carroll,3,8,9,0,48,6,32,1
PEAK HEALHTCARE AT CATON MANOR,215085,3330 WILKENS AVENUE,BALTIMORE,Baltimore City,1,0,13,10,78,16,0,0
"GSNH OPERATOR, LLC",215241,1601 E. BELVEDERE AVENUE,BALTIMORE,Baltimore City,6,0,9,1,112,17,0,0
MOUNTAIN CITY CENTER FOR REHABILITATION & NURSING,215277,48 TARN TERRACE,FROSTBURG,Allegany,0,0,15,0,65,5,1,0
AUTUMN LAKE HEALTHCARE AT OAKVIEW,215338,2700 BARKER STREET,SILVER SPRING,Montgomery,7,2,4,0,105,5,12,0
STERLING CARE AT FROSTBURG VILLAGE,215115,1 KAYLOR CIRCLE,FROSTBURG,Allegany,9,2,15,0,92,5,0,0
FREDERICK VILLA NURSING & REHAB CENTER,215178,711 ACADEMY ROAD,CATONSVILLE,Baltimore,59,0,27,17,70,42,2,0
LONG VIEW CENTER FOR REHABILITATION AND HEALTHCARE,215017,3332 MAIN STREET,MANCHESTER,Carroll,40,14,80,54,93,39,9,3
CORSICA HILLS CENTER,215114,205 ARMSTRONG STREET,CENTREVILLE,Queen Anne's,49,13,33,17,79,31,18,1
KENSINGTON HEALTHCARE  CENTER,215043,3000 MCCOMAS AVENUE,KENSINGTON,Montgomery,4,1,3,3,121,19,3,0
PATUXENT RIVER HEALTH AND REHABILITATION CENTER,215141,14200 LAUREL PARK DRIVE,LAUREL,Prince George's,51,0,31,8,97,20,0,0
"POWERBACK REHABILITATION, BRIGHTWOOD CAMPUS",215226,515 BRIGHTFIELD ROAD,LUTHERVILLE,Baltimore,15,54,9,0,80,11,13,0
LORIEN BULLE ROCK,215359,1501 BLENHEIM FARM LANE,HAVRE DE GRACE,Harford,0,0,12,0,51,3,1,0
JULIA MANOR NURSING AND REHABILITATION  CENTER,215321,333 MILL STREET,HAGERSTOWN,Washington,7,0,35,0,100,5,3,0
GLEN MEADOWS RETIREMENT COM.,215278,11630 GLEN ARM ROAD,GLEN ARM,Baltimore,9,0,3,3,19,3,2,0
NORTHAMPTON MANOR NURSING AND REHABILITATION CENTE,215217,200 EAST 16TH STREET,FREDERICK,Frederick,77,130,72,26,97,31,93,0
AUTUMN LAKE HEALTHCARE AT ALICE MANOR,215215,2095 ROCKROSE AVENUE,BALTIMORE,Baltimore City,0,12,2,0,96,3,6,0
FUTURE CARE CHESAPEAKE,215186,305 COLLEGE PARKWAY,ARNOLD,Anne Arundel,11,0,25,4,114,32,1,0
FOREST HAVEN NURSING AND REHABILITATION CTR,215252,701 EDMONDSON AVENUE,CATONSVILLE,Baltimore,82,17,31,11,126,41,10,0
BAYWOODS OF ANNAPOLIS,215345,7101 BAY FRONT DRIVE,ANNAPOLIS,Anne Arundel,9,6,8,3,15,14,5,0
FUTURE CARE SANDTOWN-WINCHESTER,215271,1000 N. GILMORE STREET,BALTIMORE,Baltimore City,80,43,19,10,107,69,35,0
WAUGH CHAPEL CENTER,215148,1221 WAUGH CHAPEL ROAD,GAMBRILLS,Anne Arundel,,,,,,,,
PATAPSCO HEALTH AND REHABILITATION,215084,9109 LIBERTY ROAD,RANDALLSTOWN,Baltimore,60,3,27,8,100,24,0,2
FAIRFIELD NURSING & REHABILITATION CENTER,215236,1454 FAIRFIELD LOOP ROAD,CROWNSVILLE,Anne Arundel,35,0,26,8,74,29,2,0
MAPLEWOOD PARK PLACE,215287,9707 OLD GEORGETOWN ROAD,BETHESDA,Montgomery,4,0,12,0,15,15,0,0
GINGER COVE,215174,4000 RIVER CRESCENT DRIVE,ANNAPOLIS,Anne Arundel,0,0,13,4,38,10,2,0
WILLIAMSPORT NURSING HOME,215198,154 N. ARTIZAN STREET,WILLIAMSPORT,Washington,2,13,12,0,102,3,10,0
CHESAPEAKE SHORES,215142,21412 GREAT MILLS ROAD,LEXINGTON PARK,St. Mary's,2,12,16,0,114,6,2,0
CADIA HEALTHCARE - HAGERSTOWN,215365,14014 MARSH PIKE,HAGERSTOWN,Washington,11,26,11,1,45,10,46,0
DEVLIN MANOR NURSING AND REHABILITATION CENTER,215244,10301 NORTH EAST CHRISTIE ROAD,CUMBERLAND,Allegany,0,9,2,0,98,3,5,0
HOMEWOOD AT CRUMLAND FARMS,215245,7407  WILLOW ROAD,FREDERICK,Frederick,26,18,23,10,75,30,12,0
CHAPEL HILL NURSING CENTER,215220,4511 ROBOSSON ROAD,RANDALLSTOWN,Baltimore,0,0,1,0,39,3,4,0
MANOR CARE HEALTH SERVICES - ROLAND PARK,215301,4669 FALLS ROAD,BALTIMORE,Baltimore,45,0,14,1,85,11,2,0
CADIA HEALTHCARE - WHEATON,215025,4011 RANDOLPH ROAD,WHEATON,Montgomery,18,8,17,9,82,12,5,0
AUTUMN LAKE HEALTHCARE POST-ACUTE CARE CENTER,215330,5009 FRANKFORD AVENUE,BALTIMORE,Baltimore City,46,3,25,8,196,96,5,0
BERLIN NURSING AND REHABILITATION CENTER,215126,9715 HEALTHWAY DRIVE,BERLIN,Worcester,69,0,55,20,79,35,2,0
STERLING CARE RIVERSIDE,215233,1123 BELCAMP GARTH,BELCAMP,Harford,3,0,8,0,100,11,2,0
PEAK HEALTHCARE AT  DENTON,215149,420 COLONIAL DR,DENTON,Caroline,0,0,8,0,81,1,1,0
CRESCENT CITIES NURSING & REHABILITATION CENTER,215323,4409 EAST WEST HIGHWAY,RIVERDALE,Prince George's,11,2,19,4,140,15,2,0
ELLICOTT CITY HEALTHCARE CENTER,215160,3000 NORTH RIDGE RD.,ELLICOTT CITY,Howard,4,0,18,2,148,5,0,0
CHESTNUT GRN HLTH CTR BLAKEHUR,215255,1055 WEST JOPPA ROAD,TOWSON,Baltimore,0,0,9,0,34,5,0,0
INGLESIDE AT KING FARM,215353,701 KING FARM BOULEVARD,ROCKVILLE,Montgomery,0,0,3,0,18,5,1,0
FUTURE CARE CAPITAL REGION,215364,1051 BRIGHTSEAT ROAD,LANDOVER,Prince George's,10,0,16,1,127,13,0,0
CATONSVILLE COMMONS,215097,16 FUSTING AVENUE,CATONSVILLE,Baltimore,56,8,30,16,99,23,1,0
OVERLEA HEALTH AND REHABILITATION CENTER,215209,6116 BELAIR ROAD,BALTIMORE,Baltimore City,54,3,41,17,100,40,0,1
SIGNATURE HEALTHCARE AT MALLARD BAY,215191,520 GLENBURN AVENUE,CAMBRIDGE,Dorchester,37,6,11,7,83,12,5,0
ADELPHI NURSING AND REHABILITATION CENTER,215064,1801 METZEROTT ROAD,ADELPHI,Prince George's,1,0,14,0,120,7,0,0
WILSON HEALTH CARE CENTER,215099,301 RUSSELL AVENUE,GAITHERSBURG,Montgomery,77,6,103,22,177,44,8,0
OAKWOOD CARE CENTER,215181,1300 WINDLASS DRIVE,BALTIMORE,Baltimore,4,2,31,0,110,10,0,0
FUTURE CARE CANTON HARBOR,215176,1300 S. ELLWOOD AVENUE,BALTIMORE,Baltimore City,3,0,12,1,125,17,2,0
NORTHWEST HEALTHCARE CENTER,215346,4601 PALL MALL ROAD,BALTIMORE,Baltimore City,0,0,0,0,80,0,0,0
BEL PRE HEALTHCARE CENTER,215065,2601 BEL PRE ROAD,SILVER SPRING,Montgomery,50,0,9,2,86,11,0,0
MORAN  NURSING AND REHABILITATION CENTER,215240,25701 SHADY LANE S. W.,WESTERNPORT,Allegany,2,12,2,0,69,2,8,0
WALDORF  CENTER,215273,4140 OLD WASHINGTON HIGHWAY,WALDORF,Charles,3,34,21,0,100,10,15,0
CITIZENS CARE AND REHABILITATION CENTER OF FREDERI,215105,1920 ROSEMONT AVENUE,FREDERICK,Frederick,14,0,24,4,142,15,10,0
VINDOBONA NURSING AND REHABILITATION CENTER,215199,6012 JEFFERSON BLVD,FREDERICK,Frederick,0,3,0,0,43,1,0,0
HOMEWOOD AT WILLIAMSPORT MD,215225,16505 VIRGINIA AVENUE,WILLIAMSPORT,Washington,0,0,15,0,62,1,5,0
NORTHWEST HOSP. CTR. SUB. UNIT,215291,5401 OLD COURT ROAD,RANDALLSTOWN,Baltimore,,,,,,,,
"GOODWILL MENNONITE HOME, INC.",215250,891 DORSEY HOTEL ROAD,GRANTSVILLE,Garrett,0,0,14,0,98,4,3,0
ALTHEA WOODLAND NURSING HOME,215228,1000 DALEVIEW DRIVE,SILVER SPRING,Montgomery,3,0,3,0,41,2,0,0
"COURTLAND, LLC",215128,7920 SCOTTS LEVEL ROAD,BALTIMORE,Baltimore,63,20,20,12,121,13,0,0
SAGEPOINT NURSING AND REHABILITATION CENTER,215106,10200 LA PLATA ROAD,LA PLATA,Charles,11,2,17,1,115,5,3,1
SALISBURY REHABILITATION AND NURSING CENTER,215067,200 CIVIC AVENUE,SALISBURY,Wicomico,101,14,72,19,203,54,37,0
MARLEY NECK HEALTH AND REHABILITATION CENTER,215138,7575 E. HOWARD ROAD,GLEN BURNIE,Anne Arundel,13,2,18,0,77,9,3,0
ROLAND PARK PLACE,215154,830 W 40 STREET,BALTIMORE,Baltimore City,18,4,4,1,29,15,5,0
FORESTVILLE HEALTHCARE CENTER,215020,7420 MARLBORO PIKE,FORESTVILLE,Prince George's,3,1,10,0,144,5,0,0
CHARLOTTE HALL VETERANS HOME,215161,29449 CHARLOTTE HALL ROAD,CHARLOTTE HALL,St. Mary's,203,68,89,60,206,97,36,1
FUTURE CARE HOMEWOOD,215249,2700 N. CHARLES ST.,BALTIMORE,Baltimore City,7,5,19,1,113,9,2,0
CARROLL LUTHERAN VILLAGE,215133,200 ST. LUKE'S CIRCLE,WESTMINSTER,Carroll,7,7,43,11,77,3,7,0
CALVERT MANOR CENTER FOR REHABILITATION AND HEALTH,215189,1881 TELEGRAPH ROAD,RISING SUN,Cecil,5,1,19,5,121,12,3,0
ORCHARD HILL REHABILITATION AND HEALTHCARE CENTER,215069,111 WEST ROAD,TOWSON,Baltimore,69,43,36,18,104,11,6,0
BETHESDA HEALTH AND REHABILITATION,215187,5721 GROSVENOR LANE,BETHESDA,Montgomery,86,4,33,19,138,27,0,0
RESIDENCES AT VANTAGE POINT,215344,5400 VANTAGE POINT RD.,COLUMBIA,Howard,0,0,7,0,15,2,1,0
KING DAVID NURSING AND REHABILITATION CENTER,215022,4204 OLD MILFORD MILL ROAD,BALTIMORE,Baltimore,44,44,21,8,76,13,8,1
DEER'S HEAD CENTER,215132,351 DEER'S HEAD HOSPITAL ROAD,SALISBURY,Wicomico,0,0,5,0,39,17,4,0
ST JOSEPH'S MINISTRIES,215267,331 SOUTH SETON AVENUE,EMMITSBURG,Frederick,0,14,22,0,73,1,2,0
AUTUMN LAKE HEALTHCARE AT ARLINGTON WEST,215349,3939 PENHURST AVENUE,BALTIMORE,Baltimore City,1,5,14,0,72,6,2,0
FUTURE CARE IRVINGTON,215219,22 SOUTH ATHOL AVENUE,BALTIMORE,Baltimore City,36,3,46,19,160,36,0,0
LAPLATA CENTER,215151,1 MAGNOLIA DRIVE,LAPLATA,Charles,36,8,27,4,127,30,3,0
STERLING CARE ROCKVILLE NURSING,215107,303 ADCLARE ROAD,ROCKVILLE,Montgomery,2,4,15,4,48,12,0,0
AUTUMN LAKE HEALTHCARE AT BRIDGEPARK,215195,4017 LIBERTY HEIGHTS AVE.,BALTIMORE,Baltimore City,60,21,20,7,76,26,4,0
SACRED HEART HOME INC,21E009,5805 QUEENS CHAPEL ROAD,HYATTSVILLE,Prince George's,3,0,7,3,52,11,0,0
RESORTS AT CHESTER RIVER MANOR CORP,215262,200 MORGNEC ROAD,CHESTERTOWN,Kent,113,27,19,19,70,84,0,0
FAIRHAVEN,215130,7200 THIRD AVENUE,SYKESVILLE,Carroll,22,0,9,4,34,46,1,0
CALVERT COUNTY NURSING CTR.,215188,85 HOSPITAL ROAD,PRINCE FREDERICK,Calvert,2,3,7,0,105,4,2,0
WHITE OAK REHABILITATION AND NURSING CENTER,215024,6500 RIGGS ROAD,HYATTSVILLE,Prince George's,14,4,31,5,127,10,3,1
HEBREW HOME OF GREATER WASHINGTON,215071,6121 MONTROSE ROAD,ROCKVILLE,Montgomery,103,1,126,34,407,121,1,0
LAYHILL NURSING AND REHABILITATION CENTER,215168,3227 BEL PRE ROAD,SILVER SPRING,Montgomery,20,0,23,7,119,36,3,0
DENNETT ROAD MANOR,215216,1113 MARY DRIVE,OAKLAND,Garrett,7,0,31,0,81,20,2,0
BRIGHTON GARDENS OF TUCKERMAN LANE,215320,5550 TUCKERMAN LANE,NORTH BETHESDA,Montgomery,0,1,1,1,24,5,1,0
HEARTHSTONE NURSING AND REHABILITATION CENTER,215073,901 SETON DRIVE,CUMBERLAND,Allegany,1,2,22,0,77,3,0,0
DOCTORS COMMUNITY REHABILITATION AND PATIENT CARE,215108,6710 MALLERY DRIVE,LANHAM,Prince George's,33,19,24,7,121,33,4,0
MANOR CARE HEALTH SERVICES - ROSSVILLE,215109,6600 RIDGE ROAD,BALTIMORE,Baltimore,9,1,11,10,105,10,5,0
FAHRNEY-KEEDY MEMORIAL HOME,215337,8507 MAPLEVILLE ROAD,BOONSBORO,Washington,2,1,13,0,89,11,3,0
ENCORE AT TURF VALLEY,215355,11150 RESORT ROAD,ELLICOTT CITY,Howard,7,0,0,0,71,14,0,0
PEAK HEALTHCARE AT HARTLEY,215134,1006 MARKET STREET,POCOMOKE CITY,Worcester,21,8,7,0,55,19,23,0
STERLING CARE AT SOUTH MOUNTAIN,215144,141 SOUTH MAIN STREET,BOONSBORO,Washington,67,2,30,15,103,21,6,0
POTOMAC VALLEY REHABILITATION AND HEALTHCARE,215026,1235 POTOMAC VALLEY ROAD,ROCKVILLE,Montgomery,43,1,29,13,152,19,0,1
BRADFORD OAKS CENTER,215165,7520 SURRATTS ROAD,CLINTON,Prince George's,89,34,37,12,140,61,17,0
HOMEWOOD CENTER,215074,6000 BELLONA AVENUE,BALTIMORE,Baltimore City,42,15,18,4,83,49,18,0
"LOCHEARN NURSING HOME, LLC",215207,4800 SETON DRIVE,BALTIMORE,Baltimore City,10,0,21,6,183,27,0,0
SHADY GROVE NURSING AND REHABILITATION CENTER,215164,9701 MEDICAL CENTER DRIVE,ROCKVILLE,Montgomery,54,12,27,3,120,36,6,0
MANOR CARE HEALTH SERVICES - CHEVY CHASE,215029,8700 JONES MILL ROAD,CHEVY CHASE,Montgomery,65,3,13,11,126,19,8,0
MANOR  CARE HEALTH SERVICES  -SILVER SPRING,215224,2501 MUSGROVE ROAD,SILVER SPRING,Montgomery,16,0,11,5,118,10,9,0
FOREST HILL HEALTH AND REHABILITATION CENTER,215194,109 FOREST VALLEY DRIVE,FOREST HILL,Harford,92,0,31,14,112,34,0,0
SUMMIT PARK HEALTH AND REHABILITATION CENTER,215326,1502  FREDERICK ROAD,CATONSVILLE,Baltimore,41,3,25,7,94,21,0,0
COLLINGTON EPISCOPAL LIFE CARE,215180,10450 LOTTSFORD ROAD,MITCHELLVILLE,Prince George's,2,0,4,3,21,13,2,0
CROMWELL CENTER,215129,8710 EMGE ROAD,BALTIMORE,Baltimore,63,5,36,12,102,26,3,1
AUGSBURG VILLAGE,215193,6811 CAMPFIELD ROAD,BALTIMORE,Baltimore,6,2,15,7,85,5,4,0
LORIEN NURSING & REHAB CTR - ELKRIDGE,215357,7615 WASHINGTON BOULEVARD,ELKRIDGE,Howard,3,1,12,3,54,5,6,0
OAKLAND NURSING & REHABILITATION CENTER,215232,706 EAST ALDER STREET,OAKLAND,Garrett,0,11,20,0,49,0,23,0
GREATER BALTIMORE MEDICAL CENTER SUB ACUTE UNIT,215314,6701 NORTH CHARLES STREET,BALTIMORE,Baltimore,0,0,2,0,20,1,0,0
MANOR CARE HEALTH SERVICES - WHEATON,215048,11901 GEORGIA AVENUE,WHEATON,Montgomery,4,0,25,15,73,20,0,0
ELKTON NURSING AND REHABILITATION CENTER,215269,1 PRICE DRIVE,ELKTON,Cecil,0,0,20,0,165,8,0,0
SEVERNA PARK CENTER,215143,310 GENESIS WAY,SEVERNA PARK,Anne Arundel,40,9,37,5,108,24,3,1
CROFTON CONVALESCENT CENTER,215120,2131 DAVIDSONVILLE ROAD,CROFTON,Anne Arundel,41,5,35,6,130,32,32,0
CHARLESTOWN COMMUNITY INC,215223,709 MAIDEN CHOICE LANE,CATONSVILLE,Baltimore,16,1,41,13,119,45,86,0
BRINTON WOODS NURSING & REHABILITATION CENTER,215247,1442 BUCKHORN ROAD,SYKESVILLE,Carroll,30,8,3,0,36,0,1,0
PEAK HEALTHCARE AT COPPER RIDGE,215265,710 OBRECHT ROAD,SYKESVILLE,Carroll,4,0,25,1,58,7,0,0
SOLOMONS NURSING AND REHAB CENTER,215270,"13325 DOWELL RD, P.O. BOX 1509",SOLOMONS,Calvert,1,0,12,0,76,5,0,0
CADIA HEALTHCARE - SPRINGBROOK,215052,12325 NEW HAMPSHIRE AVENUE,SILVER SPRING,Montgomery,5,0,9,1,74,4,0,0
HAMMONDS LANE CENTER,215088,613 HAMMONDS LANE,BROOKLYN PARK,Anne Arundel,1,5,9,0,94,6,0,0
"STELLA MARIS, INC.",215117,2300 DULANEY VALLEY RD,TIMONIUM,Baltimore,124,77,139,16,304,125,167,0
HERON POINT OF CHESTERTOWN,215235,501 CAMPUS AVENUE,CHESTERTOWN,Kent,0,0,6,0,28,8,0,0
CADIA HEALTHCARE - HYATTSVILLE,215145,4922 LASALLE ROAD,HYATTSVILLE,Prince George's,77,147,64,14,234,72,133,0
LOCH RAVEN CENTER,215090,8720 EMGE ROAD,BALTIMORE,Baltimore,84,3,29,18,73,41,1,0
NORTH ARUNDEL HEALTH AND REHABILITATION CENTER,215316,313 HOSPITAL DRIVE,GLEN BURNIE,Anne Arundel,50,0,45,12,77,14,0,0
CUMBERLAND HEALTHCARE CENTER,215055,512 WINIFRED ROAD,CUMBERLAND,Allegany,90,16,31,14,102,40,9,0
ANCHORAGE HEALTHCARE  CENTER,215339,105 TIMES SQUARE,SALISBURY,Wicomico,0,0,5,2,88,3,0,0
FUTURE CARE OLD COURT,215118,5412 OLD COURT ROAD,RANDALLSTOWN,Baltimore,9,1,15,0,116,11,1,0
ST. MARY'S NURSING CENTER INC,215013,21585 PEABODY STREET,LEONARDTOWN,St. Mary's,25,0,18,5,109,30,0,0
EGLE NURSING HOME,215307,57 JACKSON STREET,LONACONING,Allegany,0,0,12,0,62,2,1,0
GARRETT COUNTY SUBACUTE UNIT,215310,251 NORTH FOURTH STREET,OAKLAND,Garrett,1,0,6,0,3,0,0,0
MANOR CARE HEALTH SERVICES -TOWSON,215054,509 EAST JOPPA ROAD,TOWSON,Baltimore,25,15,13,3,100,17,10,0
MONTGOMERY VILLAGE HEALTH CARE CENTER,215272,19301 WATKINS MILL ROAD,GAITHERSBURG,Montgomery,4,3,6,0,88,13,4,2
LORIEN HEALTH SYSTEMS MT AIRY,215335,705 MIDWAY AVENUE,MOUNT AIRY,Carroll,1,2,8,0,46,6,2,0
BLUE POINT HEALTHCARE CENTER,215340,2525 WEST BELVEDERE AVE,BALTIMORE,Baltimore City,4,0,5,0,111,0,0,0
GLADE VALLEY CENTER,215313,56 WEST FREDERICK STREET,WALKERSVILLE,Frederick,27,0,25,3,101,20,4,0
COLLINGSWOOD REHABILITATION AND HEALTHCARE CENTER,215092,299 HURLEY AVENUE,ROCKVILLE,Montgomery,90,2,66,39,128,41,2,1
