BRONXCARE SPECIAL CARE CENTER,335753,1265 FULTON AVENUE,BRONX,Bronx,0,0,2,2,228,19,0,0
SETON HEALTH AT SCHUYLER RIDGE RESIDENTIAL H C,335774,1 ABELE DRIVE,CLIFTON PARK,Saratoga,1,14,3,0,112,2,5,0
ESSEX CENTER FOR REHABILITATION AND HEALTHCARE,335478,PO BOX 127,ELIZABETHTOWN,Essex,0,0,3,0,93,2,0,0
EDDY VILLAGE GREEN,335697,421 W COLUMBIA STREET,COHOES,Albany,0,0,15,0,183,5,0,0
GLEN ISLAND CENTER FOR NURSING AND REHABILITATION,335611,490 PELHAM ROAD,NEW ROCHELLE,Westchester,63,98,8,3,146,48,33,0
OUR LADY OF CONSOLATION NURSING AND REHAB CARE CTR,335539,111 BEACH DRIVE,WEST ISLIP,Suffolk,13,9,22,7,238,25,9,0
NASSAU REHABILITATION & NURSING CENTER,335787,ONE GREENWICH STREET,HEMPSTEAD,Nassau,9,0,11,0,217,1,0,0
SCHOFIELD RESIDENCE,335603,3333 ELMWOOD AVENUE,KENMORE,Erie,0,0,0,0,103,1,0,0
THE PINES AT POUGHKEEPSIE CTR FOR NURSING & REHAB,335440,100 FRANKLIN STREET,POUGHKEEPSIE,Dutchess,27,4,27,13,161,16,12,0
LUTHERAN CENTER AT POUGHKEEPSIE INC,335810,965 DUTCHESS TURNPIKE,POUGHKEEPSIE,Dutchess,7,15,8,0,134,20,13,0
PARK AVENUE EXTENDED CARE FACILITY,335819,425 NATIONAL BOULEVARD,LONG BEACH,Nassau,4,13,15,3,188,19,7,0
THE FIVE TOWNS PREMIER REHAB & NURSING CENTER,335718,1050 CENTRAL AVENUE,WOODMERE,Nassau,60,14,5,16,222,37,2,1
MORNINGSTAR RESIDENTIAL CARE CENTER,335489,17 SUNRISE TERRACE,OSWEGO,Oswego,0,0,12,0,106,1,0,0
DEGRAFF MEMORIAL HOSPITAL-SKILLED NURSING FACILITY,335669,445 TREMONT STREET,NORTH TONAWANDA,Niagara,0,0,9,0,74,4,0,0
IROQUOIS NURSING HOME INC,335764,4600 SOUTHWOOD HEIGHTS DRIVE,JAMESVILLE,Onondaga,0,0,38,0,146,20,0,0
HOLLISWOOD CTR FOR REHABILITATION AND HEALTHCARE,335503,195 44 WOODHULL AVENUE,HOLLIS,Queens,87,23,15,2,289,49,0,0
CHAPIN HOME FOR THE AGING,335631,165 01 CHAPIN PARKWAY,JAMAICA,Queens,10,0,8,1,122,23,0,0
UNION PLAZA CARE CENTER,335799,33 23 UNION STREET,FLUSHING,Queens,5,1,15,4,201,26,0,0
THE GRAND REHABILITATION AND NRSG AT GUILDERLAND,335540,428 STATE ROUTE 146,ALTAMONT,Albany,27,2,9,0,119,9,1,0
THE CENTER FOR NURSING AND REHAB AT HOOSICK FALLS,335601,21 DANFORTH STREET,HOOSICK FALLS,Rensselaer,0,0,7,0,58,2,0,0
LATTA ROAD NURSING HOME WEST,335617,2100 LATTA ROAD,ROCHESTER,Monroe,0,0,1,0,38,6,0,0
JAMAICA HOSPITAL NURSING HOME CO INC,335436,89-40  135TH  STREET,JAMAICA,Queens,29,0,63,36,186,62,2,0
"SAMARITAN SENIOR VILLAGE, INC",335865,22691 CAMPUS DRIVE,WATERTOWN,Jefferson,0,0,38,0,163,3,1,0
ST VINCENT DEPAUL RESIDENCE,335763,900 INTERVALE AVENUE,BRONX,Bronx,6,13,3,3,89,5,1,0
LONG ISLAND STATE VETERANS HOME,335758,100 PATRIOTS ROAD,STONYBROOK,Suffolk,58,0,45,25,267,68,2,0
HIGHLAND REHABILITATION AND NURSING CENTER,335526,120 HIGHLAND AVENUE,MIDDLETOWN,Orange,36,4,32,20,92,4,0,0
ELDERWOOD AT LOCKPORT,335500,104 OLD NIAGARA ROAD,LOCKPORT,Niagara,8,0,23,1,110,1,0,0
FAIRPORT BAPTIST HOMES,335576,4646 NINE MILE POINT ROAD,FAIRPORT,Monroe,5,0,0,0,122,17,0,0
AFFINITY SKILLED LIVING AND REHABILITATION CENTER,335839,305 LOCUST AVENUE,OAKDALE,Suffolk,18,42,76,15,200,60,20,0
ST MARGARETS CENTER,335830,27 HACKETT BLVD,ALBANY,Albany,0,0,0,0,84,12,0,0
"ROCKVILLE SKILLED NURSING & REHAB CENTER, L L C",335747,50 MAINE AVENUE,ROCKVILLE CENTRE,Nassau,0,0,9,2,48,3,0,0
PINNACLE MULTICARE NURSING AND REHAB CENTER,335581,801 CO OP CITY BLVD,BRONX,Bronx,11,1,0,0,460,25,0,0
CHEMUNG COUNTY HEALTH CENTER - NURSING FACILITY,335480,103 WASHINGTON STREET,ELMIRA,Chemung,0,0,12,0,13,1,0,0
WESTERN NEW YORK STATE VETERANS HOME,335788,220 RICHMOND AVENUE,BATAVIA,Genesee,0,0,0,0,98,16,41,0
ELDERWOOD AT LIVERPOOL,335678,4800 BEAR ROAD,LIVERPOOL,Onondaga,0,1,25,0,139,3,7,0
WILKINSON RESIDENTIAL HEALTH CARE FACILITY,335857,4988 STATE HWY 30,AMSTERDAM,Montgomery,2,11,16,0,140,4,5,0
YONKERS GARDENS CENTER FOR NURSING AND REHAB,335515,115 SOUTH BROADWAY,YONKERS,Westchester,29,14,7,2,116,57,12,1
GOWANDA REHABILITATION AND NURSING CENTER,335642,100 MILLER STREET,GOWANDA,Cattaraugus,2,0,12,0,112,9,0,0
CREST MANOR LIVING AND REHABILITATION CENTER,335467,6745 PITTSFORD PALMYRA ROAD,FAIRPORT,Monroe,0,0,0,0,71,17,0,0
CROWN HEIGHTS CENTER FOR NURSING AND REHAB,335609,810 20 ST MARKS AVENUE,BROOKLYN,Kings,7,31,16,6,233,33,9,0
KINGSWAY ARMS NURSING CENTER INC,335466,323 KINGS ROAD,SCHENECTADY,Schenectady,0,0,10,0,142,47,0,0
OUR LADY OF PEACE NURSING CARE RESIDENCE,335843,5285 LEWISTON ROAD,LEWISTON,Niagara,2,2,19,2,198,7,4,0
ST JOSEPHS PLACE,335692,160 EAST MAIN STREET,PORT JERVIS,Orange,29,1,19,9,36,23,0,0
THE PLAZA REHAB AND NURSING CENTER,335462,100 WEST KINGSBRIDGE ROAD,BRONX,Bronx,1,52,141,86,593,81,95,0
HORIZON CARE CENTER,335738,64 11 BEACH CHANNEL DRIVE,ARVERNE,Queens,3,19,2,1,220,42,0,0
NORTHERN MANHATTAN REHABILITATION AND NURSING CTR,335792,116 EAST 125TH ST,NEW YORK,New York,47,49,91,57,224,31,8,0
ELDERWOOD AT LANCASTER,335577,1818 COMO PARK BLVD,LANCASTER,Erie,7,0,0,0,90,4,0,0
GUTHRIE CORTLAND MEDICAL CENTER,335768,134 HOMER AVENUE,CORTLAND,Cortland,0,0,0,0,66,5,3,0
UNITED HELPERS NURSING HOME,335454,8101 STATE HIGHWAY 68,OGDENSBURG,St. Lawrence,0,0,18,0,169,1,0,0
COOPERSTOWN CENTER FOR REHABILITATION AND NURSING,335412,128 PHOENIX MILLS CROSS ROAD,COOPERSTOWN,Otsego,0,2,14,0,159,5,1,0
HIGHLAND CARE CENTER,335505,91 31 175TH STREET,JAMAICA,Queens,18,32,18,5,279,41,0,0
BETHANY NURSING HOME & HEALTH RELATED FACILITY INC,335645,3005 WATKINS ROAD,HORSEHEADS,Chemung,1,6,37,0,105,1,13,0
CREEKVIEW NURSING AND REHAB CENTER,335556,525 BEAHAN ROAD,ROCHESTER,Monroe,39,3,11,2,121,20,3,0
RIVERSIDE CENTER FOR REHABILITATION AND NURSING,335525,90 NO MAIN STREET,CASTLETON ON HUDSON,Rensselaer,82,0,5,2,54,48,0,0
GROTON COMMUNITY HEALTH CARE CTR RES CARE FAC,335658,120 SYKES STREET,GROTON,Tompkins,0,0,6,0,66,0,2,0
ABSOLUT CTR FOR NURSING & REHAB THREE RIVERS L L C,335652,101 CREEKSIDE DRIVE,PAINTED POST,Steuben,0,0,3,0,110,5,0,0
COLD SPRING HILLS CENTER FOR NURSING AND REHAB,335555,378 SYOSSET WOODBURY ROAD,WOODBURY,Nassau,26,7,71,14,463,27,18,1
JENNIE B RICHMOND CHAFFEE NURSING HOME COMPANY INC,335435,222 EAST MAIN STREET,SPRINGVILLE,Erie,0,0,16,1,56,4,4,0
HIGHLAND NURSING HOME INC,335619,182 HIGHLAND ROAD,MASSENA,St. Lawrence,0,1,0,0,87,5,0,0
ELDERWOOD AT NORTH CREEK,335429,112 SKI BOWL ROAD,NORTH CREEK,Warren,0,2,0,0,68,0,0,0
JEFFERSON'S FERRY,335833,500 MATHER DRIVE,SOUTH SETAUKET,Suffolk,39,0,25,12,44,17,9,0
GREENE MEADOWS NURSING AND REHABILITATION CENTER,335574,161 JEFFERSON HEIGHTS,CATSKILL,Greene,0,0,0,0,104,0,0,0
"LEROY VILLAGE GREEN RESIDENTIAL HEALTH C F, INC",335635,10 MUNSON STREET,LEROY,Genesee,0,0,14,0,135,0,0,0
THE GROVE AT VALHALLA REHAB AND NURSING CENTER,335809,61 GRASSLANDS ROAD,VALHALLA,Westchester,24,8,20,4,134,22,0,0
MIDDLETOWN PARK REHAB & HEALTH CARE CENTER,335655,121 DUNNING ROAD,MIDDLETOWN,Orange,80,37,59,18,184,69,2,0
ELDERWOOD AT TICONDEROGA,335482,1019 WICKER STREET,TICONDEROGA,Essex,0,2,0,0,71,1,4,0
EDDY MEMORIAL GERIATRIC CENTER,335680,2256 BURDETT AVENUE,TROY,Rensselaer,11,0,38,17,70,10,0,0
"THE BRIGHTONIAN, INC",335554,1919 ELMWOOD AVENUE,ROCHESTER,Monroe,13,0,12,9,40,13,0,0
HUNTINGTON HILLS CTR FOR HEALTH AND REHABILITATION,335818,400 SOUTH SERVICE ROAD,MELVILLE,Suffolk,113,4,139,69,250,132,15,1
WASHINGTON CENTER FOR REHAB AND HEALTHCARE,335413,ROUTE 40,ARGYLE,Washington,0,0,5,0,119,3,8,0
MVHS REHABILITATION AND NURSING CENTER,335801,1650 CHAMPLIN AVENUE,UTICA,Oneida,0,0,48,0,180,7,0,0
THE PINES HEALTHCARE & REHAB CTRS MACHIAS CAMPUS,335578,9822 ROUTE 16,MACHIAS,Cattaraugus,0,0,46,0,105,6,0,0
BROOKLYN UNITED METHODIST CHURCH HOME,335604,1485 DUMONT AVENUE,BROOKLYN,Kings,65,19,1,1,96,17,0,0
ELMHURST CARE CENTER INC,335814,100 17  23RD AVENUE,EAST ELMHURST,Queens,89,47,82,58,154,82,57,0
ST CATHERINE LABOURE HEALTH CARE CENTER,335419,2157 MAIN STREET,BUFFALO,Erie,13,0,2,4,69,7,0,0
REGAL HEIGHTS REHABILITATION AND HEALTH CARE CTR,335820,70-05 35 AVENUE,JACKSON HEIGHTS,Queens,5,17,16,1,231,82,3,0
QUEENS NASSAU REHABILITATION AND NURSING CENTER,335448,520 BEACH 19TH STREET,FAR ROCKAWAY,Queens,61,6,1,1,165,23,5,0
WINGATE AT BEACON,335828,10 HASTINGS DRIVE,BEACON,Dutchess,40,35,35,20,87,19,1,0
DRY HARBOR NURSING HOME,335416,61 35 DRY HARBOR ROAD,MIDDLE VILLAGE,Queens,16,5,11,6,244,44,0,0
EDEN REHABILITATION NURSING CENTER,335607,2806 GEORGE STREET,EDEN,Erie,1,1,0,0,36,0,0,0
QUEEN OF PEACE RESIDENCE,335606,110-30 221ST STREET,QUEENS VILLAGE,Queens,0,0,1,0,51,10,1,0
TEN BROECK COMMONS,335765,ONE COMMONS DRIVE,LAKE KATRINE,Ulster,88,0,55,28,204,64,22,0
NIAGARA REHABILITATION AND NURSING CENTER,335742,822 CEDAR AVENUE,NIAGARA FALLS,Niagara,22,4,13,3,130,0,2,0
HEMPSTEAD PARK NURSING HOME,335808,800 FRONT STREET,HEMPSTEAD,Nassau,2,2,0,0,200,9,3,0
METHODIST HOME FOR NURSING AND REHABILITATION,335524,4499 MANHATTAN COLLEGE PARKWAY,BRONX,Bronx,44,0,27,13,90,37,11,1
GRANDELL REHABILITATION AND NURSING CENTER,335498,645 W BROADWAY,LONG BEACH,Nassau,70,15,4,3,199,70,3,1
ALPINE REHABILITATION AND NURSING CENTER,335586,755 E MONROE STREET,LITTLE FALLS,Herkimer,0,0,11,0,73,3,1,0
JOHN T MATHER MEMORIAL HOSP T C U,335853,75 NORTH COUNTRY ROAD,PORT JEFFERSON,Suffolk,0,0,0,0,7,1,0,0
DELHI REHABILITATION AND NURSING CENTER,335876,41861 STATE ROUTE 10,DELHI,Delaware,0,0,7,0,120,1,8,0
BENSONHURST CENTER FOR REHAB AND HEALTHCARE,335558,1740 84TH STREET,BROOKLYN,Kings,8,0,32,4,175,27,0,0
WHITE OAKS REHABILITATION AND NURSING CENTER,335690,8565 JERICHO TURNPIKE,WOODBURY,Nassau,13,2,18,3,122,8,0,0
GOOD SHEPHERD-FAIRVIEW HOME INC,335527,80 FAIRVIEW AVENUE,BINGHAMTON,Broome,0,0,6,0,50,6,0,0
CHARLES T SITRIN HEALTH CARE CENTER INC,335475,2050 TILDEN AVE,NEW HARTFORD,Oneida,17,2,17,0,173,7,0,0
TOWNHOUSE CENTER FOR REHABILITATION & NURSING,335798,755 HEMPSTEAD TURNPIKE,UNIONDALE,Nassau,91,90,68,23,232,103,1,2
SMITHTOWN CENTER FOR REHABILITATION & NURSING CARE,335756,391 NORTH COUNTRY ROAD,SMITHTOWN,Suffolk,97,44,50,30,145,46,4,0
CARTHAGE CENTER FOR REHABILITATION AND NURSING,335579,1045 WEST STREET,CARTHAGE,Jefferson,1,0,9,0,78,4,0,0
WINGATE OF DUTCHESS,335789,3 SUMMIT COURT,FISHKILL,Dutchess,2,25,15,0,118,7,2,0
"NORTHERN RIVERVIEW HEALTH CARE, INC",335418,87 SOUTH ROUTE 9W,HAVERSTRAW,Rockland,26,7,14,6,148,13,1,0
HILLSIDE MANOR REHAB & EXTENDED CARE CENTER,335531,182 15 HILLSIDE AVENUE,JAMAICA EST,Queens,152,20,104,54,259,100,43,0
ST JOHN'S PENFIELD HOMES,335863,65 SONOMA DRIVE,FAIRPORT,Monroe,0,0,3,0,16,2,1,0
PELHAM PARKWAY NURSING CTR & REHAB FACILITY L L C,335486,2401 LACONIA AVE,BRONX,Bronx,4,1,1,0,150,6,0,0
GARDEN CARE CENTER,335817,135 FRANKLIN AVENUE,FRANKLIN SQUARE,Nassau,9,0,6,4,94,9,0,0
EPIC REHABILITATION AND NURSING AT WHITE PLAINS,335878,120 CHURCH STREET,WHITE PLAINS,Westchester,7,1,1,0,54,15,2,0
FATHER BAKER MANOR,335777,6400 POWERS ROAD,ORCHARD PARK,Erie,,,,,,,,
MARIA REGINA RESIDENCE INC,335837,1725 BRENTWOOD ROAD,BRENTWOOD,Suffolk,84,10,79,34,123,72,0,0
GOLDEN GATE REHABILITATION & HEALTH CARE CENTER,335502,191 BRADLEY AVE,STATEN ISLAND,Richmond,9,0,11,3,183,19,0,0
REBEKAH REHAB AND EXTENDED CARE CENTER,335557,1072 HAVEMEYER AVENUE,BRONX,Bronx,31,54,58,30,182,25,0,0
CASA PROMESA,335780,308 EAST 175 STREET,BRONX,Bronx,0,0,0,0,86,3,1,0
THE HAMPTONS CENTER FOR REHABILITATION AND NURSING,335850,64 COUNTY ROAD 39,SOUTH HAMPTON,Suffolk,55,62,52,20,206,38,16,0
THE PEARL NURSING CENTER OF ROCHESTER,335439,1335 PORTLAND AVE,ROCHESTER,Monroe,0,0,4,0,99,7,0,0
SUNHARBOR MANOR,335559,255 WARNER AVENUE,ROSLYN HEIGHTS,Nassau,18,3,19,11,164,4,4,0
SYRACUSE HOME ASSOCIATION,335713,7740 MEIGS ROAD,BALDWINSVILLE,Onondaga,3,1,9,0,101,10,0,0
MEDFORD MULTICARE CENTER FOR LIVING,335840,3115 HORSEBLOCK ROAD,MEDFORD,Suffolk,42,88,49,23,252,45,1,0
SUNSHINE CHILDREN'S HOME AND REHAB CENTER,335667,15 SPRING VALLEY ROAD,OSSINING,Westchester,2,0,1,0,53,10,0,1
INCARNATION CHILDRENS CENTER INC,335822,142 AUDOBON AVENUE,NEW YORK,New York,2,5,0,0,12,4,12,0
EDDY VILLAGE GREEN AT BEVERWYCK,335860,40 AUTUMN DRIVE,SLINGERLANDS,Albany,0,0,3,0,24,2,0,0
BRONX GARDENS REHABILITATION AND NURSING CENTER,335775,2175 QUARRY RD,BRONX,Bronx,11,19,17,5,179,42,9,0
