Provider Name,Federal Provider Number,Provider Address,Provider City,County,Residents Total Confirmed COVID-19,Residents Total Suspected COVID-19,Residents Total All Deaths,Residents Total COVID-19 Deaths,Total Number of Occupied Beds,Staff Total Confirmed COVID-19,Staff Total Suspected COVID-19,Staff Total COVID-19 Deaths
LAKE WAY NURSING AND REHABILITATION CENTER,185258,2607 MAIN STREET HWY 641 SOUTH,BENTON,Marshall,0,0,18,0,74,1,0,0
HILLSIDE CENTER,185012,1500 PRIDE AVENUE,MADISONVILLE,Hopkins,1,6,7,0,59,7,0,0
BRADFORD HEIGHTS NURSING & REHABILITATION,185076,950 HIGHPOINT DRIVE,HOPKINSVILLE,Christian,10,0,0,0,82,23,0,0
CRITTENDEN COUNTY HEALTH & REHABILITATION CENTER,185269,201 WATSON STREET,MARION,Crittenden,1,1,0,0,71,2,0,0
PROVIDENCE POINTE HEALTHCARE,185227,100 MARSHALL COURT,PADUCAH,McCracken,2,0,0,0,72,26,7,0
"PIONEER TRACE GROUP, LLC",185314,115 PIONEER TRACE,FLEMINGSBURG,Fleming,0,0,8,0,70,2,0,0
TUG VALLEY ARH SKILLED NURSING FACILITY,185172,260 HOSPITAL DRIVE,SOUTH WILLIAMSON,Pike,11,0,0,0,8,2,0,0
HYDEN HEALTH AND REHABILITATION CENTER,185193,21040 US HWY 421 SOUTH,HYDEN,Leslie,0,1,0,0,86,3,1,0
CUMBERLAND VALLEY MANOR,185270,"301 SOUTH MAIN STREET, PO BOX 438",BURKESVILLE,Cumberland,1,3,9,0,70,12,0,0
SIGNATURE HEALTHCARE AT JACKSON MANOR REHAB & WELL,185249,96 HIGHWAY 3444,ANNVILLE,Jackson,,,,,,,,
CARTER NURSING AND REHABILITATION,185253,250 MCDAVID BLVD,GRAYSON,Carter,0,1,7,0,115,2,1,0
LANDMARK OF LAUREL CREEK REHABILITATION AND NURSIN,185293,1033 NORTH HIGHWAY 11,MANCHESTER,Clay,2,0,0,0,96,7,1,0
SIGNATURE HEALTHCARE OF CARROLLTON REHAB & WELLNES,185205,1206 ELEVENTH STREET,CARROLLTON,Carroll,41,4,4,3,59,11,2,0
OWENSBORO CENTER,185236,1205 LEITCHFIELD ROAD,OWENSBORO,Daviess,3,8,13,0,113,9,1,0
WOODCREST NURSING AND REHABILITATION CENTER,185445,3876 TURKEYFOOT ROAD,ELSMERE,Kenton,36,5,21,7,71,31,4,0
SIGNATURE HEALTHCARE OF MONROE COUNTY REHAB & WELL,185168,706 NORTH MAGNOLIA STREET,TOMPKINSVILLE,Monroe,42,12,1,1,90,37,17,0
HARDINSBURG NURSING AND REHABILITATION CENTER,185302,101 FAIRGROUNDS ROAD,HARDINSBURG,Breckinridge,0,3,2,0,50,2,5,0
LANDMARK OF ELKHORN CITY REHABILITATION AND NURSIN,185230,945 WEST RUSSELL STREET,ELKHORN CITY,Pike,1,0,0,0,91,3,0,0
TREYTON OAK TOWERS,185175,211 WEST OAK STREET,LOUISVILLE,Jefferson,31,0,30,16,40,23,1,0
MAYSVILLE NURSING AND REHABILITATION FACILITY,185207,620 PARKER ROAD,MAYSVILLE,Mason,2,4,14,0,94,6,6,0
PRINCETON NURSING & REHABILITATION,185316,1333 WEST MAIN STREET,PRINCETON,Caldwell,0,0,33,0,81,20,0,0
"CHRISTIAN CARE CENTER OF KUTTAWA, LLC",185318,1253 LAKE BARKLEY DRIVE,KUTTAWA,Lyon,0,0,13,0,48,2,1,0
CRESTVIEW CENTER,185409,1871 MIDLAND TRAIL,SHELBYVILLE,Shelby,0,0,8,0,57,1,0,0
PRESTONSBURG HEALTH CARE CENTER,185304,147 NORTH HIGHLAND AVENUE,PRESTONSBURG,Floyd,0,0,5,0,45,2,0,0
CHRISTIAN HEALTH CENTER,185232,116 SOUTH COMMONWEALTH AVENUE,CORBIN,Whitley,49,5,18,6,88,28,5,0
MIDDLESBORO NURSING AND REHABILITATION FACILITY,185240,235 NEW WILSON LANE,MIDDLESBORO,Bell,57,20,11,5,89,42,104,0
CORBIN HEALTH AND REHABILITATION CENTER,185366,270 BACON CREEK ROAD,CORBIN,Whitley,31,0,1,1,77,19,0,0
"FRIENDSHIP HEALTH AND REHAB, LLC",185281,7400 FRIENDSHIP DRIVE,PEWEE VALLEY,Oldham,27,13,12,4,115,7,6,0
NORTHPOINT/LEXINGTON HEALTHCARE CENTER,185197,1500 TRENT BOULEVARD,LEXINGTON,Fayette,49,13,23,8,111,35,30,0
BOWLING GREEN NURSING AND REHABILITATION CENTER,185224,1561 NEWTON AVE.,BOWLING GREEN,Warren,34,24,13,1,52,31,26,0
SPRINGHURST HEALTH AND REHAB,185305,3001 N. HURSTBOURNE PARKWAY,LOUISVILLE,Jefferson,4,1,16,1,39,9,0,0
WOLFE COUNTY HEALTH AND REHABILITATION CENTER,185213,850 HWY 191,CAMPTON,Wolfe,18,9,0,0,93,14,0,0
LITTLE SISTERS OF THE POOR,185260,15 AUDUBON PLAZA DRIVE,LOUISVILLE,Jefferson,3,2,9,2,40,4,12,0
KNOTT COUNTY HEALTH AND REHABILITATION CENTER,185150,388 PERKINS MADDEN ROAD,HINDMAN,Knott,45,0,17,8,77,16,1,0
CREEKWOOD NURSING & REHABILITATION,185313,107 BOYLES DRIVE,RUSSELLVILLE,Logan,,,,,,,,
THE JORDAN CENTER,185131,270 E CLAYTON LANE,LOUISA,Lawrence,0,10,11,0,67,4,12,0
SIGNATURE HEALTHCARE AT HILLCREST,185120,3740 OLD HARTFORD ROAD,OWENSBORO,Daviess,27,0,6,5,110,16,0,0
LANDMARK OF BARDSTOWN REHABILITATION AND NURSING,185149,120 LIFE CARE WAY,BARDSTOWN,Nelson,1,0,3,0,81,11,13,0
COLONIAL CENTER,185048,2365 NASHVILLE ROAD,BOWLING GREEN,Warren,4,2,12,2,39,3,9,0
PARKVIEW NURSING & REHABILITATION CENTER,185171,544 LONE OAK ROAD,PADUCAH,McCracken,91,15,7,1,178,59,44,0
SOMERWOODS NURSING AND REHABILITATION CENTER,185152,555 BOURNE AVENUE,SOMERSET,Pulaski,0,0,9,0,118,0,0,0
GRAYSON NURSING AND REHABILITATION,185177,505 WILLIAM THOMASON BYWAY,LEITCHFIELD,Grayson,43,34,15,9,66,18,53,0
LANDMARK OF LOUISVILLE REHABILITATION AND NURSING,185122,1155 EASTERN PARKWAY,LOUISVILLE,Jefferson,99,52,34,15,194,54,1,0
HEARTHSTONE PLACE,185400,506 ALLENSVILLE ROAD,ELKTON,Todd,16,9,9,6,48,17,3,0
THE GRANDVIEW NURSING AND REHABILITATION FACILITY,185042,640 WATER TOWER BYPASS,CAMPBELLSVILLE,Taylor,8,2,4,1,74,9,8,0
WELLINGTON PARC OF OWENSBORO,185436,2885 NEW HARTFORD ROAD,OWENSBORO,Daviess,4,3,2,0,42,6,4,0
FOUNTAIN CIRCLE CARE & REHABILITATION CENTER,185146,200 GLENWAY ROAD,WINCHESTER,Clark,74,0,13,6,122,41,0,0
MORGANTOWN CARE & REHABILITATION CENTER,185006,201 SOUTH WARREN STREET,MORGANTOWN,Butler,72,3,37,15,102,46,0,0
RICHWOOD NURSING & REHAB,185438,1012 RICHWOOD WAY,LA GRANGE,Oldham,37,21,12,6,,20,6,0
KENWOOD HEALTH AND REHABILITATION CENTER,185061,130 MEADOWLARK DRIVE,RICHMOND,Madison,1,0,20,0,76,9,2,0
AUBURN HEALTH CARE,185049,139 PEARL ST.,AUBURN,Logan,46,0,3,2,41,21,0,0
RIDGEWOOD TERRACE NURSING HOME,185306,150 CORNWALL DRIVE,MADISONVILLE,Hopkins,68,46,21,25,67,33,64,0
MAPLE HEALTH AND REHABILITATION,185294,515 GREENE DRIVE,GREENVILLE,Muhlenberg,0,4,6,0,90,6,11,0
FLORENCE PARK CARE CENTER,185174,6975 BURLINGTON PIKE,FLORENCE,Boone,81,24,44,28,88,39,21,0
HICKS GOLDEN YEARS NURSING HOME,185298,1901 WEST HIGHWAY 90 BYPASS,MONTICELLO,Wayne,3,5,14,0,49,9,10,0
CHEROKEE PARK REHABILITATION,185237,2100 MILLVALE ROAD,LOUISVILLE,Jefferson,20,0,0,0,73,17,0,0
SIGNATURE HEALTHCARE AT SUMMIT MANOR REHAB & WELLN,185052,400 BOMAR HEIGHTS,COLUMBIA,Adair,71,32,26,16,66,30,27,2
SPRING VIEW NURSING & REHABILITATION,185309,718 GOODWIN LANE,LEITCHFIELD,Grayson,24,3,7,3,60,14,0,0
GALLATIN NURSING & REHAB,185360,499 CENTER STREET,WARSAW,Gallatin,40,8,26,8,100,11,8,0
"GREEN HILL REHAB AND CARE, LLC",185257,213 INDUSTRIAL ROAD,GREENSBURG,Green,77,1,14,10,80,46,7,0
RIVERSIDE CARE & REHABILITATION CENTER,185209,190 EAST HWY 136,CALHOUN,McLean,51,5,22,4,60,22,15,0
REDBANKS,185124,851 KIMSEY LANE,HENDERSON,Henderson,56,12,76,68,120,68,10,0
"OWSLEY COUNTY HEALTH CARE CENTER, INC",185273,20 COUNTY BARN ROAD,BOONEVILLE,Owsley,0,30,15,0,74,3,21,0
KINGSBROOK LIFECARE CENTER,185449,2500 STATE ROUTE 5,ASHLAND,Boyd,4,10,34,1,121,7,17,0
ESSEX NURSING AND REHABILITATION CENTER,185288,9600 LAMBORNE BOULEVARD,LOUISVILLE,Jefferson,53,7,24,10,85,32,16,0
GREENVILLE NURSING AND REHABILITATION,185317,521 GREENE DRIVE,GREENVILLE,Muhlenberg,2,0,15,0,57,13,0,0
HILLCREST HEALTH AND REHABILITATION CENTER,185125,1245 AMERICAN GREETING ROAD,CORBIN,Whitley,59,9,26,14,81,95,28,0
CHRISTIAN HEALTH CENTER,185147,200 STERLING DRIVE,HOPKINSVILLE,Christian,59,3,19,9,76,48,0,0
SPRINGFIELD NURSING AND REHABILITATION CENTER,185336,420 EAST GRUNDY AVENUE,SPRINGFIELD,Washington,2,0,3,0,63,3,0,0
THE EPISCOPAL CHURCH HOME,185310,7504 WESTPORT ROAD,LOUISVILLE,Jefferson,0,0,21,0,83,7,0,0
CHRISTIAN HEALTH CENTER,185419,1800 WESTEN AVENUE,BOWLING GREEN,Warren,2,0,0,0,40,15,0,0
HENDERSON NURSING AND REHABILITATION CENTER,185402,2500 NORTH ELM STREET,HENDERSON,Henderson,54,1,6,4,69,39,2,0
THE WILLOWS AT HARRODSBURG,185210,180 LUCKY MAN WAY,HARRODSBURG,Mercer,0,1,14,0,33,1,0,0
NIM HENSON GERIATRIC CENTER,185112,420 JETT DRIVE,JACKSON,Breathitt,4,0,167,1,51,6,0,0
RIVERVIEW HEALTH CARE CENTER,185151,79 SPARROW LANE,PRESTONSBURG,Floyd,66,26,11,0,94,21,17,0
LORETTO MOTHERHOUSE INFIRMARY,185276,515 NERINX ROAD,NERINX,Marion,1,1,13,0,54,16,2,0
GLASGOW STATE NURSING FACILITY,185363,207 STATE AVENUE,GLASGOW,Barren,2,4,8,0,60,9,16,0
LEE COUNTY CARE AND REHABILITATION CENTER,185337,246 EAST MAIN STREET,BEATTYVILLE,Lee,,,,,,,,
RIVER'S BEND RETIREMENT COMMUNITY,185410,300 BEECH STREET,KUTTAWA,Lyon,0,0,4,0,35,1,0,0
FRANKLIN-SIMPSON NURSING AND REHABILITATION CENTER,185331,414 ROBEY STREET,FRANKLIN,Simpson,1,0,9,0,86,3,0,0
"MADISONVILLE HEALTH AND REHABILITATION, LLC",185015,419 NORTH SEMINARY ST,MADISONVILLE,Hopkins,1,6,17,0,82,14,24,1
OAKMONT MANOR,185250,1100 GRANDVIEW DRIVE,FLATWOODS,Greenup,40,2,17,7,69,29,10,0
NEW CASTLE NURSING & REHAB,185362,50 ADAMS STREET,NEW CASTLE,Henry,1,0,2,0,57,2,2,0
WURTLAND NURSING & REHABILITATION,185261,100 WURTLAND AVENUE,WURTLAND,Greenup,0,0,0,0,98,4,0,0
THE TRANSITIONAL CARE CENTER OF OWENSBORO,185396,1201 PLEASANT VALLEY ROAD,OWENSBORO,Daviess,0,0,0,0,8,19,10,0
CHRISTIAN HEIGHTS NURSING AND REHABILITATION CENTE,185338,124 WEST NASHVILLE STREET,PEMBROKE,Christian,3,0,4,0,54,5,1,0
SIGNATURE HEALTHCARE OF GEORGETOWN,185141,102 POCAHONTAS TRAIL,GEORGETOWN,Scott,0,8,2,0,57,4,23,0
LAKE CUMBERLAND REGIONAL HOSPITAL SCU,185407,305 LANGDON STREET,SOMERSET,Pulaski,,,,,,,,
THE PAVILION AT KENTON,185038,401 EAST 20TH STREET,COVINGTON,Kenton,1,0,1,0,78,3,0,0
MORGANFIELD NURSING AND REHABILITATION CENTER,185329,509 NORTH CARRIER STREET,MORGANFIELD,Union,61,0,1,1,45,28,0,0
IRVINE NURSING AND REHABILITATION CENTER,185339,411 BERTHA WALLACE DRIVE,IRVINE,Estill,70,35,24,8,65,31,8,0
THE HERITAGE,185434,192 BACON CREEK ROAD,CORBIN,Whitley,2,0,14,0,70,16,1,0
SIGNATURE HEALTHCARE OF EAST LOUISVILLE,185350,2529 SIX MILE LANE,LOUISVILLE,Jefferson,16,6,16,0,97,20,20,0
"THE VILLAGE OF LEBANON II, LLC",185437,105 VILLAGE WAY,LEBANON,Marion,1,1,0,0,41,8,3,0
EDGEMONT HEALTHCARE,185389,323 WEBSTER AVENUE,CYNTHIANA,Harrison,0,0,0,0,63,2,3,0
"HARBORVIEW DOVER, LLC",185295,112 DOVER DRIVE,GEORGETOWN,Scott,65,4,124,80,58,18,2,0
THE TERRACE NURSING AND REHABILITATION CENTER,185103,1043 BROOKLYN BOULEVARD,BEREA,Madison,4,1,9,0,97,18,11,0
T J SAMSON COMMUNITY HOSPITAL,185387,1301 N RACE STREET,GLASGOW,Barren,4,2,0,0,2,11,0,0
BRANDENBURG NURSING AND REHABILITATION CENTER,185353,814 OLD EKRON ROAD,BRANDENBURG,Meade,2,2,0,0,47,4,1,0
"FULTON NURSING AND REHABILITATION, LLC",185047,1004 HOLIDAY LANE,FULTON,Fulton,26,8,11,4,36,28,9,0
GLENVIEW HEALTH CARE FACILITY,185271,1002 GLENVIEW DRIVE,GLASGOW,Barren,36,0,24,14,45,26,1,0
STANTON NURSING AND REHABILITATION CENTER,185352,31 DERICKSON LANE,STANTON,Powell,0,0,6,0,66,0,0,0
OAKVIEW NURSING & REHABILITATION CENTER,185195,10456 US HIGHWAY 62,CALVERT CITY,Marshall,0,0,28,0,70,6,9,0
CARMEL HOME,185226,2501 OLD HARTFORD ROAD,OWENSBORO,Daviess,4,0,1,0,35,12,2,0
CAMPBELLSVILLE NURSING AND REHABILITATION CENTER,185330,1980 OLD GREENSBURG ROAD,CAMPBELLSVILLE,Taylor,1,1,10,0,53,2,10,0
"CAMBRIDGE PLACE GROUP, LLC",185444,2020 CAMBRIDGE DRIVE,LEXINGTON,Fayette,28,4,8,0,99,17,2,0
LANDMARK OF IROQUOIS PARK REHAB AND NURSING CENTER,185096,900 GAGEL AVENUE,LOUISVILLE,Jefferson,35,2,15,0,78,7,5,0
SIGNATURE HEALTHCARE OF BOWLING GREEN,185089,550 HIGH ST.,BOWLING GREEN,Warren,51,4,11,2,115,47,3,0
CEDAR RIDGE HEALTH CAMPUS,185145,1217 US HIGHWAY 62 E,CYNTHIANA,Harrison,0,0,8,0,54,2,0,0
WESTMINSTER TERRACE,185137,2116 BUECHEL BANK ROAD,LOUISVILLE,Jefferson,68,0,20,6,77,52,0,0
HIGHLANDS NURSING AND REHABILITATION,185039,1705 STEVENS AVENUE,LOUISVILLE,Jefferson,83,22,19,8,120,38,4,0
CLARK REGIONAL MEDICAL CENTER,185428,175 HOSPITAL DRIVE,WINCHESTER,Clark,0,0,0,0,18,0,0,0
BRIDGE POINT CENTER,185090,7300 WOODSPOINT DRIVE,FLORENCE,Boone,81,28,15,4,114,41,13,0
SIGNATURE HEALTHCARE OF GLASGOW REHAB & WELLNESS C,185340,220 WESTWOOD ST.,GLASGOW,Barren,,,,,,,,
NAZARETH HOME,185138,2000 NEWBURG ROAD,LOUISVILLE,Jefferson,11,18,78,1,90,19,39,0
GREEN ACRES HEALTHCARE,185341,402 W. FARTHING STREET,MAYFIELD,Graves,19,5,11,4,53,13,0,1
KLONDIKE CENTER,185333,3802 KLONDIKE LANE,LOUISVILLE,Jefferson,4,1,7,0,56,1,0,0
OWENTON CENTER,185364,905 HWY 127 NORTH,OWENTON,Owen,0,1,18,0,90,1,3,0
JOHNSON MATHERS NURSING HOME,185028,2323 CONCRETE ROAD,CARLISLE,Nicholas,1,0,11,0,98,3,0,0
KENSINGTON CENTER,185443,225 SAINT JOHN ROAD,ELIZABETHTOWN,Hardin,2,15,23,2,71,11,8,0
MAYFIELD HEALTH AND REHABILITATION,185142,401 INDIANA AVE,MAYFIELD,Graves,6,0,1,0,63,8,2,0
"LYNDON WOODS CARE & REHAB, LLC",185165,1101 LYNDON LANE,LOUISVILLE,Jefferson,8,1,30,0,105,11,0,0
VILLAGE CARE CENTER,185440,2990 RIGGS AVENUE,ERLANGER,Kenton,25,37,32,0,87,16,121,0
DAWSON SPRINGS HEALTH AND REHABILITATION CENTER,185263,213 WATER STREET,DAWSON SPRINGS,Hopkins,1,0,3,0,50,7,0,0
BEDFORD SPRINGS HEALTH AND REHABILITATION,185358,50 SHEPHERD LANE,BEDFORD,Trimble,4,6,10,0,42,3,0,0
"BEAVER DAM NURSING & REHAB CENTER, INC",185334,1595 S US HIGHWAY 231,BEAVER DAM,Ohio,2,14,0,0,57,7,57,0
HARLAN HEALTH AND REHABILITATION CENTER,185166,200 MEDICAL CENTER DRIVE,HARLAN,Harlan,2,0,9,0,131,7,0,0
LIBERTY CARE AND REHABILITATION CENTER,185408,616 S WALLACE WILKINSON BLVD,LIBERTY,Casey,55,15,14,11,74,21,5,0
NAZARETH HOME CLIFTON,185442,2120 PAYNE STREET,LOUISVILLE,Jefferson,54,11,28,17,79,38,57,1
SIGNATURE HEALTHCARE AT COLONIAL REHAB & WELLNESS,185342,708 BARTLEY AVENUE,BARDSTOWN,Nelson,3,0,1,0,44,3,2,0
KINDRED HOSPITAL - LOUISVILLE,185361,1313 ST. ANTHONY PLACE,LOUISVILLE,Jefferson,0,0,10,0,39,13,2,0
"NHC HEALTHCARE, GLASGOW",185093,109  HOMEWOOD BLVD.,GLASGOW,Barren,70,14,39,1,152,36,1,0
SIGNATURE HEALTHCARE AT TANBARK REHAB & WELLNESS C,185201,1121 TANBARK ROAD,LEXINGTON,Fayette,17,0,0,0,21,22,3,0
BRADFORD SQUARE CENTER,185170,1040 US 127 SOUTH,FRANKFORT,Franklin,2,3,24,0,84,2,8,0
VALHALLA POST ACUTE,185455,300 SHELBY STATION DRIVE,LOUISVILLE,Jefferson,60,139,12,10,96,23,0,0
SOUTH SHORE NURSING & REHABILITATION,185282,JAMES E. HANNAH DRIVE,SOUTH SHORE,Greenup,0,0,7,0,52,2,1,0
EDMONSON CENTER,185401,813 SOUTH MAIN STREET,BROWNSVILLE,Edmonson,31,2,19,9,61,5,2,0
THE FORUM AT BROOKSIDE,185194,200 BROOKSIDE DRIVE,LOUISVILLE,Jefferson,21,6,23,6,39,25,20,0
EDGEWOOD ESTATES,185423,195 BERRYMAN ROAD,FRENCHBURG,Menifee,8,0,8,0,40,6,0,0
BRECKINRIDGE MEMORIAL NURSING FACILITY,185285,1011 OLD HIGHWAY 60,HARDINSBURG,Breckinridge,0,2,1,0,18,3,7,0
SIGNATURE HEALTHCARE AT HERITAGE HALL REHAB & WELL,185277,331 SOUTH MAIN STREET,LAWRENCEBURG,Anderson,0,0,7,0,80,5,0,0
PIKEVILLE NURSING AND REHAB CENTER,185094,260 SOUTH MAYO TRAIL,PIKEVILLE,Pike,79,20,33,6,71,47,24,0
MASONIC HOME OF SHELBYVILLE,185378,711 FRANKFORT ROAD,SHELBYVILLE,Shelby,73,12,17,10,76,60,8,0
HOPKINS CENTER,185167,460 SOUTH COLLEGE STREET,WOODBURN,Warren,51,17,25,10,39,35,11,0
SIGNATURE HEALTHCARE AT SUMMERFIELD REHAB & WELLNE,185300,1877 FARNSLEY ROAD,LOUISVILLE,Jefferson,52,0,24,7,112,36,0,0
COUNTRYSIDE CENTER FOR REHABILITATION AND NURSING,185382,47 MARGO AVENUE,BARDWELL,Carlisle,0,3,12,0,55,6,4,0
SIGNATURE HEALTHCARE OF HART COUNTY REHAB & WELLNE,185381,1505 SOUTH DIXIE STREET,HORSE CAVE,Hart,4,6,16,0,82,14,1,0
"BRIGHTON CORNERSTONE GROUP, LLC",185013,55 EAST NORTH STREET,MADISONVILLE,Hopkins,9,0,3,0,49,14,0,0
WEST LIBERTY NURSING AND REHABILITATION,185274,"774 LIBERTY ROAD, PO BOX 219",WEST LIBERTY,Morgan,0,0,2,0,45,3,0,0
TRI-CITIES NURSING AND REHABILITATION CENTER,185433,19101 US HIGHWAY 119 NORTH,CUMBERLAND,Harlan,1,0,12,0,66,1,0,0
BARREN COUNTY NURSING AND REHABILITATION,185229,300 WESTWOOD STREET,GLASGOW,Barren,1,0,18,0,85,8,1,0
PARKVIEW POST-ACUTE AND REHABILITATION CENTER,185256,200 NURSING HOME LANE,PIKEVILLE,Pike,26,9,56,2,109,26,20,0
RIDGEWAY NURSING & REHABILITATION FACILITY,185254,406 WYOMING ROAD,OWINGSVILLE,Bath,7,0,21,0,92,6,4,0
REGIS WOODS,185301,4604 LOWE ROAD,LOUISVILLE,Jefferson,77,3,34,14,118,41,2,0
SIGNATURE HEALTHCARE OF HARTFORD REHAB & WELLNESS,185275,114 MCMURTRY AVENUE,HARTFORD,Ohio,29,18,18,7,96,43,33,0
LETCHER MANOR,185200,73 PIEDMONT DRIVE,WHITESBURG,Letcher,4,0,0,0,126,7,0,0
BLUEGRASS CARE & REHABILITATION CENTER,185446,3576 PIMLICO PARKWAY,LEXINGTON,Fayette,13,0,0,0,106,18,0,0
ELLIOTT NURSING AND REHABILITATION,185415,"RT 32  EAST, HOWARD CREEK RD",SANDY HOOK,Elliott,0,0,12,0,65,5,1,0
WESTERN STATE NURSING FACILITY,185228,2400 RUSSELLVILLE ROAD,HOPKINSVILLE,Christian,4,0,6,0,91,6,1,0
MAGNOLIA VILLAGE,185435,1381 CAMPBELL LANE,BOWLING GREEN,Warren,45,3,24,13,45,25,5,0
"STANFORD CARE AND REHAB, LLC",185244,105 HARMON HEIGHTS,STANFORD,Lincoln,86,41,23,22,93,43,45,0
MASONIC HOME OF LOUISVILLE,185388,240 MASONIC HOME DRIVE,MASONIC HOME,Jefferson,20,4,37,2,137,38,7,0
GREENWOOD NURSING & REHABILITATION CENTER,185187,5079 SCOTTSVILLE RD.,BOWLING GREEN,Warren,57,5,19,7,113,23,1,0
CLINTON COUNTY CARE AND REHABILITATION CENTER,185315,404 NORTH WASHINGTON STREET,ALBANY,Clinton,20,0,6,1,45,20,6,0
LANDMARK OF DANVILLE REHABILITATION AND NURSING CE,185264,203 BRUCE COURT,DANVILLE,Boyle,1,7,12,0,79,2,2,0
"HILLCREEK REHAB AND CARE, LLC",185095,3116 BRECKINRIDGE LANE,LOUISVILLE,Jefferson,33,1,12,6,113,17,0,0
HOMESTEAD POST ACUTE,185144,1608 VERSAILLES ROAD,LEXINGTON,Fayette,71,74,24,11,112,48,23,0
"FRANKFORT REHAB AND CARE, LLC",185159,117 OLD SOLDIERS LANE,FRANKFORT,Franklin,41,0,5,5,68,30,0,0
RIVER HAVEN NURSING AND REHABILITATION CENTER,185272,867 MCGUIRE AVENUE,PADUCAH,McCracken,2,0,5,0,70,4,10,0
VILLASPRING OF ERLANGER,185447,4220 HOUSTON ROAD,ERLANGER,Kenton,23,0,28,0,121,20,2,0
BAPTIST HEALTH HARDIN,185427,913 NORTH DIXIE AVENUE,ELIZABETHTOWN,Hardin,1,0,0,0,8,10,3,0
CHRISTIAN HEALTH CENTER,185029,920 SOUTH FOURTH STREET,LOUISVILLE,Jefferson,29,1,5,3,90,13,0,0
SIGNATURE HEALTHCARE AT JEFFERSON MANOR REHAB & WE,185169,1801 LYNN WAY,LOUISVILLE,Jefferson,32,10,31,11,59,21,1,0
SHADY LAWN NURSING AND REHABILITATION CENTER,185252,2582 CERULEAN ROAD,CADIZ,Trigg,1,0,9,0,37,2,4,0
CLINTON-HICKMAN COUNTY NURSING FACILITY,185326,366 SOUTH WASHINGTON STREET,CLINTON,Hickman,24,0,8,1,35,8,1,0
ROSEDALE GREEN,185225,4250 GLENN AVENUE,COVINGTON,Kenton,91,23,86,31,127,44,3,0
TRADEWATER POINTE,185133,100 WEST RAMSEY,DAWSON SPRINGS,Hopkins,21,3,9,0,45,18,0,0
MADONNA MANOR,185241,2344 AMSTERDAM ROAD,VILLA HILLS,Kenton,0,0,3,1,56,6,0,0
SANSBURY CARE CENTER,185297,2625 BARDSTOWN ROAD,SAINT CATHARINE,Washington,2,5,4,0,52,12,7,0
BOYD NURSING AND REHABILITATION,185418,12100 PRINCELAND SPUR,ASHLAND,Boyd,55,23,18,9,46,45,29,1
MAYFAIR MANOR,185069,3300 TATES CREEK ROAD,LEXINGTON,Fayette,2,0,0,0,79,18,0,0
FAIR OAKS HEALTH AND REHABILITATION,185286,1 SPARKS AVENUE,JAMESTOWN,Russell,14,0,23,1,97,6,0,0
HERMITAGE CARE AND REHABILITATION CENTER,185346,1614 WEST PARRISH AVENUE,OWENSBORO,Daviess,0,0,4,0,79,8,14,0
HELMWOOD HEALTHCARE CENTER,185183,106 DIECKS DRIVE,ELIZABETHTOWN,Hardin,27,1,3,2,50,21,1,0
CEDARS OF LEBANON NURSING CENTER,185267,337 SOUTH HARRISON STREET,LEBANON,Marion,40,10,25,10,34,22,39,0
GRANT CENTER,185265,201 KIMBERLY LANE,WILLIAMSTOWN,Grant,5,16,12,1,92,8,3,0
SYCAMORE HEIGHTS HEALTH AND REHABILITATION,185348,2141 SYCAMORE AVENUE,LOUISVILLE,Jefferson,22,0,8,1,64,20,1,0
SIGNATURE HEALTHCARE OF SPENCER COUNTY,185327,625 TAYLORSVILLE RD,TAYLORSVILLE,Spencer,0,0,15,0,82,6,1,0
FLAGET MEMORIAL HOSPITAL NF,185422,4305 NEW SHEPHERDSVILLE ROAD,BARDSTOWN,Nelson,0,0,2,0,0,0,0,0
SIGNATURE HEALTHCARE AT ROCKFORD REHAB & WELLNESS,185311,4700 QUINN DRIVE,LOUISVILLE,Jefferson,0,0,12,1,90,14,7,0
SIGNATURE HEALTHCARE AT JEFFERSON PLACE REHAB & WE,185349,1705 HERR LANE,LOUISVILLE,Jefferson,24,1,22,7,57,13,15,0
LOUISVILLE EAST POST ACUTE,185178,4200 BROWNS LANE,LOUISVILLE,Jefferson,77,28,29,9,143,26,7,0
ELIZABETHTOWN NURSING AND REHABILITATION CENTER,185266,1101 WOODLAND DRIVE,ELIZABETHTOWN,Hardin,9,1,8,1,58,18,5,0
MOUNTAIN VIEW NURSING AND REHABILITATION CENTER,185243,39 FERNDALE APARTMENTS ROAD,PINEVILLE,Bell,53,12,15,3,57,42,4,0
"CLIFTON OAKS CARE AND REHAB CENTER, LLC",185176,446 MT. HOLLY AVENUE,LOUISVILLE,Jefferson,0,0,3,1,84,10,0,0
MADISON HEALTH AND REHABILITATION CENTER,185262,131 MEADOWLARK DRIVE,RICHMOND,Madison,0,11,10,0,71,5,33,0
LEXINGTON COUNTRY PLACE,185160,700 MASON HEADLEY ROAD,LEXINGTON,Fayette,34,8,9,0,83,11,16,0
REGENCY CENTER,185290,1550 RAYDALE DRIVE,LOUISVILLE,Jefferson,1,2,14,0,90,5,0,0
PINE MEADOWS POST ACUTE,185215,1608 HILL RISE DRIVE,LEXINGTON,Fayette,106,15,27,22,109,53,5,0
HIGHLANDSPRING OF FT THOMAS,185383,960 HIGHLAND AVENUE,FORT THOMAS,Campbell,2,0,28,1,122,36,8,0
"VANCEBURG REHAB AND CARE, LLC",185238,58 EASTHAM STREET,VANCEBURG,Lewis,55,31,17,13,66,73,89,0
GOOD SHEPHERD HEALTH AND REHABILITATION,185222,60 PHILLIPS BRANCH ROAD,PHELPS,Pike,,,,,,,,
HARRODSBURG HEALTH & REHABILITATION CENTER,185287,853 LEXINGTON ROAD,HARRODSBURG,Mercer,68,5,28,18,76,25,5,0
ST ELIZABETH FT THOMAS SNF,185328,85 NORTH GRAND AVENUE,FORT THOMAS,Campbell,16,29,7,6,11,11,0,0
NICHOLASVILLE NURSING & REHABILITATION,185220,100 SPARKS AVENUE,NICHOLASVILLE,Jessamine,2,0,2,0,65,1,0,0
HOME OF THE INNOCENTS,185154,1100 EAST MARKET STREET,LOUISVILLE,Jefferson,1,0,0,0,74,23,0,0
"ST MATTHEWS CARE AND REHAB CENTER, LLC",185192,227 BROWNS LANE,LOUISVILLE,Jefferson,43,18,11,4,95,18,9,0
BAPTIST HEALTH LA GRANGE,185190,1025 NEW MOODY LANE,LA GRANGE,Oldham,0,0,2,0,10,5,2,0
SIGNATURE HEALTHCARE AT NORTH HARDIN REHAB & WELLN,185180,599 ROGERSVILLE ROAD,RADCLIFF,Hardin,93,8,33,12,92,32,22,0
SIGNATURE HEALTHCARE OF MCCREARY COUNTY REHAB & WE,185211,58 CAL HILL ROAD,PINE KNOT,McCreary,2,0,0,0,54,13,8,0
SALYERSVILLE NURSING AND REHABILITATION CENTER,185221,662 PARKWAY DRIVE,SALYERSVILLE,Magoffin,23,19,2,1,103,15,18,0
OWENSBORO HEALTH MUHLENBERG COMMUNITY HOSPITAL LTC,185008,440 HOPKINSVILLE STREET,GREENVILLE,Muhlenberg,7,1,7,2,38,9,7,0
LIFE CARE CENTER OF LA CENTER,185320,252 W. 5TH STREET,LA CENTER,Ballard,0,2,8,0,48,3,0,0
LIFE CARE CENTER OF MOREHEAD,185155,933 NORTH TOLLIVER ROAD,MOREHEAD,Rowan,3,2,16,0,87,14,2,0
BARBOURVILLE HEALTH AND REHABILITATION CENTER,185164,65 MINTON HICKORY FARM ROAD,BARBOURVILLE,Knox,97,0,17,11,108,32,0,0
DANVILLE CENTRE FOR HEALTH & REHABILITATION,185127,642 NORTH THIRD STREET,DANVILLE,Boyle,21,0,16,3,74,14,0,0
BEREA HEALTH AND REHABILITATION,185384,601 RICHMOND ROAD,BEREA,Madison,0,0,0,0,76,8,2,0
SOMERSET NURSING AND REHABILITATION FACILITY,185218,106 GOVER STREET,SOMERSET,Pulaski,14,7,43,1,103,20,19,0
JEFFERSONTOWN REHABILITATION,185268,3500 GOOD SAMARITAN WAY,JEFFERSONTOWN,Jefferson,4,9,21,1,79,6,0,0
COVINGTON'S CONVALESCENT CENTER,185343,115 CAYCE STREET,HOPKINSVILLE,Christian,13,0,17,11,39,12,0,0
ST ELIZABETH FLORENCE SNF,185394,4900 HOUSTON ROAD,FLORENCE,Boone,2,40,2,2,14,1,0,0
SUNRISE MANOR NURSING HOME,185057,717 NORTH LINCOLN BOULEVARD,HODGENVILLE,Larue,3,3,10,0,112,10,27,0
CALVERT CITY CONVALESCENT CENTER,185234,1201 FIFTH AVE,CALVERT CITY,Marshall,0,7,30,1,77,4,4,0
WESLEY MANOR,185136,5012 EAST MANSLICK RD,LOUISVILLE,Jefferson,2,2,33,0,59,10,8,0
ROCKCASTLE HEALTH AND REHABILITATION CENTER,185246,371 WEST MAIN STREET,BRODHEAD,Rockcastle,63,0,11,4,69,46,10,0
TWIN RIVERS NURSING AND REHABILITATION CENTER,185087,2420 WEST THIRD STREET,OWENSBORO,Daviess,3,9,12,0,89,20,70,0
ROBERTSON COUNTY HEALTH CARE FACILITY,185359,"1030 KENTONTOWN ROAD, P O BOX 170",MOUNT OLIVET,Robertson,5,0,11,0,53,1,1,0
WILLIAMSBURG HEALTH AND REHABILITATION CENTER,185148,287 N ELEVENTH STREET,WILLIAMSBURG,Whitley,65,0,11,8,97,46,0,0
CUMBERLAND NURSING AND REHABILITATION CENTER,185173,200 NORFLEET DRIVE,SOMERSET,Pulaski,79,33,0,0,71,35,58,0
HEARTLAND VILLA CENTER,185399,8005 US HWY 60 WEST,LEWISPORT,Hancock,31,3,12,5,31,20,3,0
ST CLAIRE MEDICAL CENTER,185430,222 MEDICAL CIRCLE,MOREHEAD,Rowan,0,0,0,0,5,2,0,0
LAUREL HEIGHTS HOME FOR THE ELDERLY,185003,208 WEST TWELFTH STREET,LONDON,Laurel,8,0,10,0,133,7,1,0
GRAND HAVEN NURSING HOME,185332,105 RODGERS PARK,CYNTHIANA,Harrison,0,0,1,0,50,1,0,0
RIVER VALLEY NURSING HOME,185355,305 TAYLOR STREET #402,BUTLER,Pendleton,0,0,5,0,50,5,0,0
CARMEL MANOR,185208,100 CARMEL MANOR ROAD,FORT THOMAS,Campbell,20,6,8,8,51,17,0,0
FORDSVILLE NURSING AND REHABILITATION CENTER,185354,313 MAIN STREET,FORDSVILLE,Ohio,3,0,1,0,60,1,0,0
FRANCISCAN HEALTH CARE CENTER,185132,3625 FERN VALLEY ROAD,LOUISVILLE,Jefferson,0,0,9,0,63,8,0,0
STONECREEK HEALTH AND REHABILITATION,185312,4747 ALBEN BARKLEY DRIVE,PADUCAH,McCracken,50,0,7,5,78,22,1,0
MARTIN COUNTY HEALTH CARE FACILITY,185379,62 MAUDE ROAD,INEZ,Martin,3,0,3,0,59,8,1,0
METCALFE HEALTH CARE CENTER,185217,701 SKYLINE DRIVE,EDMONTON,Metcalfe,27,23,15,0,68,22,2,0
WOODLAND OAKS,185392,1820 OAKVIEW ROAD,ASHLAND,Boyd,4,36,4,1,102,7,55,1
LANDMARK OF LANCASTER REHABILITATION AND NURSING C,185065,308 WEST MAPLE AVENUE,LANCASTER,Garrard,54,8,17,8,80,22,7,0
BRACKEN COUNTY NURSING & REHABILITATION CENTER,185344,5269 ASBURY ROAD,AUGUSTA,Bracken,0,0,0,0,22,1,0,0
CAL TURNER REHAB AND SPECIALTY CARE,185325,456 BURNLEY ROAD,SCOTTSVILLE,Allen,21,3,21,3,93,22,12,0
RIVERS EDGE NURSING AND REHABILITATION CENTER,185259,6301 BASS ROAD,PROSPECT,Jefferson,5,0,0,0,86,6,0,0
SALEM SPRINGLAKE HEALTH & REHABILITATION CENTER,185046,509 NORTH HAYDEN AVENUE,SALEM,Livingston,0,0,1,0,52,1,2,0
SIGNATURE HEALTHCARE OF SOUTH LOUISVILLE,185335,1120 CRISTLAND ROAD,LOUISVILLE,Jefferson,29,0,3,2,76,35,1,1
TELFORD TERRACE,185451,1025 ROBERT L TELFORD DRIVE,RICHMOND,Madison,19,1,4,4,22,19,0,0
SPRING CREEK HEALTH CARE,185005,1401 SOUTH 16TH STREET,MURRAY,Calloway,29,6,21,2,101,35,16,0
MILLS NURSING & REHABILITATION,185279,500 BECK LANE,MAYFIELD,Graves,42,1,25,18,88,40,0,0
SAYRE CHRISTIAN VILLAGE NURSING HOME,185248,3775 BELLEAU WOOD DRIVE,LEXINGTON,Fayette,70,0,29,4,115,51,0,0
ROCKCASTLE REGIONAL HOSPITAL AND RESPIRATORY CARE,185157,145 NEWCOMB AVENUE,MOUNT VERNON,Rockcastle,1,6,47,0,121,31,5,0
REDBANKS COLONIAL TERRACE,185291,142 ROGER POWELL RD,SEBREE,Webster,33,0,0,0,57,15,0,0
HAZARD HEALTH AND REHABILITATION CENTER,185134,390 PARK AVENUE,HAZARD,Perry,1,39,15,0,187,4,26,0
MOUNTAIN MANOR OF PAINTSVILLE,185414,1025 EUCLID AVENUE,PAINTSVILLE,Johnson,6,0,9,0,100,5,1,0
BOURBON HEIGHTS NURSING HOME,185283,2000 SOUTH MAIN STREET,PARIS,Bourbon,6,2,0,0,88,4,25,0
