M M EWING CONTINUING CARE CENTER,335345,350 PARRISH STREET,CANANDAIGUA,Ontario,0,3,19,0,171,0,7,0
"PARKVIEW CARE AND REHABILITATION CENTER, INC",335074,5353 MERRICK ROAD,MASSAPEQUA,Nassau,6,4,4,0,128,9,0,0
WINDSOR PARK REHAB & NURSING CENTER,335155,212 40 HILLSIDE AVENUE,QUEENS VILLAGE,Queens,24,4,21,12,61,23,3,0
THE GRAND REHABILITATION AND NURSING AT MOHAWK,335386,99 SIXTH AVENUE,ILION,Herkimer,0,0,0,0,102,3,2,0
ACHIEVE REHAB AND NURSING FACILITY,335449,170 LAKE STREET,LIBERTY,Sullivan,34,2,7,4,110,68,0,0
SHEEPSHEAD NURSING & REHABILITATION CENTER,335677,2840 KNAPP ST,BROOKLYN,Kings,0,0,12,2,153,1,0,0
ATRIUM CENTER FOR REHABILITATION AND NURSING,335720,630 E 104TH STREET,BROOKLYN,Kings,43,7,13,1,312,22,0,0
BETHEL NURSING HOME COMPANY INC,335490,17 NARRAGANSETT AVENUE,OSSINING,Westchester,17,5,4,1,29,23,3,0
KIRKHAVEN,335668,254 ALEXANDER STREET,ROCHESTER,Monroe,44,1,45,26,120,25,1,0
EDDY HERITAGE HOUSE NURSING AND REHABILITATION CTR,335760,2920 TIBBITS AVENUE,TROY,Rensselaer,3,39,0,0,110,2,11,0
ST LUKE RESIDENTIAL HEALTH CARE FACILITY INC,335746,299 EAST RIVER ROAD,OSWEGO,Oswego,1,0,16,0,168,2,2,0
JAMAICA HOSPITAL MEDICAL CENTER T C U,335856,8900 VAN WYCK EXPRESSWAY,JAMAICA,Queens,0,0,0,0,0,0,0,0
ELDERWOOD AT CHEEKTOWAGA,335752,225 BENNETT ROAD,CHEEKTOWAGA,Erie,0,0,14,0,145,6,1,0
HOPKINS CENTER FOR REHABILITATION AND HEALTHCARE,335847,155 DEAN STREET,BROOKLYN,Kings,30,0,11,2,167,62,0,0
FORDHAM NURSING AND REHABILITATION CENTER,335659,2678 KINGSBRIDGE TERRACE,BRONX,Bronx,30,52,39,21,178,42,0,0
FRANKLIN CENTER FOR REHABILITATION AND NURSING,335426,142 27 FRANKLIN AVENUE,FLUSHING,Queens,6,0,2,0,240,7,0,0
NORTH SHORE - L I J ORZAC CTR FOR REHABILITATION,335700,900 FRANKLIN AVENUE,VALLEY STREAM,Nassau,1,0,9,4,60,7,1,0
PLATTSBURGH REHABILITATION AND NURSING CENTER,335528,8 BUSHEY BOULEVARD,PLATTSBURGH,Clinton,0,0,2,0,70,1,3,0
ST ANNS COMMUNITY,335730,920 CHERRY RIDGE BLVD,WEBSTER,Monroe,0,0,0,0,72,2,13,0
NEW YORK-PRESBYTERIAN / QUEENS T C U,335862,56-45 MAIN STREET,FLUSHING,Queens,0,0,0,0,0,0,0,0
CORTLANDT HEALTHCARE,335441,110 OREGON ROAD,CORTLANDT MANOR,Westchester,18,0,6,0,91,25,0,0
TARRYTOWN HALL CARE CENTER,335421,20 WOOD COURT,TARRYTOWN,Westchester,0,0,3,2,101,3,0,0
HOPE CENTER FOR H I V AND NURSING CARE,335725,1401 UNIVERSITY AVENUE,BRONX,Bronx,0,2,0,0,62,9,0,0
BELLHAVEN CENTER FOR REHAB AND NURSING CARE,335755,110 BEAVER DAM ROAD,BROOKHAVEN,Suffolk,28,28,11,4,204,21,12,0
ELIZABETH SETON PEDIATRIC CENTER,33A246,300 CORPORATE BLVD SOUTH,YONKERS,Westchester,0,0,0,0,169,0,0,0
BEACH GARDENS REHAB AND NURSING CENTER,335682,17 11 BROOKHAVEN AVENUE,FAR ROCKAWAY,Queens,14,11,6,2,0,16,3,0
THE BROOK AT HIGH FALLS NURSING HOME AND REHAB CTR,335825,2150 ST PAUL STREET,ROCHESTER,Monroe,1,0,0,0,26,2,0,0
PUTNAM RIDGE,335824,46 MT EBO ROAD NORTH,BREWSTER,Putnam,12,14,13,3,133,15,0,0
FISHKILL CENTER FOR REHABILITATION AND NURSING,335750,22 ROBERT R. KASIN WAY,BEACON,Dutchess,0,8,6,0,148,6,9,0
KINGS HARBOR MULTICARE CENTER,335644,2000 E GUNHILL ROAD,BRONX,Bronx,47,2,19,3,494,87,12,0
EAST HAVEN NURSING & REHABILITATION CENTER,335723,2323  EASTCHESTER ROAD,BRONX,Bronx,44,79,77,37,164,52,68,1
OUR LADY OF MERCY LIFE CENTER,335767,2 MERCYCARE LANE,GUILDERLAND,Albany,3,0,21,11,124,11,0,0
ONEIDA HEALTH REHABILITATION AND EXTENDED CARE,335427,323 GENESEE STREET,ONEIDA,Madison,0,0,4,0,142,2,0,0
NEWFANE REHAB & HEALTH CARE CENTER,335481,2709 TRANSIT RD,NEWFANE,Niagara,0,0,5,2,122,4,0,0
ABSOLUT CTR FOR NURSING & REHAB ALLEGANY L L C,335610,2178 NORTH FIFTH STREET,ALLEGANY,Cattaraugus,0,0,0,0,37,0,0,0
BEACON REHABILITATION AND NURSING CENTER,335726,140 BEACH 113TH STREET,ROCKAWAY PARK,Queens,38,37,41,32,80,111,23,0
"THE NEW JEWISH HOME, MANHATTAN",335491,120 WEST 106TH STREET,NEW YORK,New York,46,55,34,6,420,41,14,0
SENECA HEALTH CARE CENTER,335504,2987 SENECA STREET,WEST SENECA,Erie,100,0,48,21,128,38,4,0
RICHMOND CTR FOR REHAB AND SPECIALTY HEALTHCARE,335772,91 TOMPKINS AVENUE,STATEN ISLAND,Richmond,64,74,19,6,359,47,6,0
PONTIAC NURSING HOME,335590,303 EAST RIVER ROAD,OSWEGO,Oswego,0,0,0,0,53,0,0,0
GARDEN GATE HEALTH CARE FACILITY,335634,2365 UNION ROAD,CHEEKTOWAGA,Erie,117,0,52,33,174,67,5,0
LATTA ROAD NURSING HOME EAST,335618,2102 LATTA ROAD,ROCHESTER,Monroe,14,0,19,15,25,24,0,0
HUDSON PARK REHABILITATION AND NURSING CENTER,335812,325 NORTHERN BOULEVARD,ALBANY,Albany,4,0,7,3,164,15,0,0
MEADOWBROOK CARE CENTER,335796,320 WEST MERRICK ROAD,FREEPORT,Nassau,33,14,24,12,201,49,18,0
BEECHWOOD HOMES,335468,2235 MILLERSPORT HIGHWAY,GETZVILLE,Erie,111,0,158,32,204,89,0,0
NEW YORK STATE VETERANS HOME AT MONTROSE,335832,2090 ALBANY POST ROAD,MONTROSE,Westchester,0,0,12,5,149,24,0,0
CARMEL RICHMOND HEALTHCARE AND REHAB CENTER,335455,88 OLD TOWN ROAD,STATEN ISLAND,Richmond,128,41,105,77,246,120,71,0
MOUNT SINAI SOUTH NASSAU T C U,335871,1 HEALTHY WAY,OCEANSIDE,Nassau,0,0,0,0,14,0,0,0
GOOD SAMARITAN NURSING HOME,335636,101 ELM ST,SAYVILLE,Suffolk,1,0,10,4,71,5,0,0
NORTHEAST CTR FOR REHABILITATION AND BRAIN INJURY,335845,300 GRANT AVENUE,LAKE KATRINE,Ulster,0,0,3,0,243,17,0,0
UPSTATE UNIVERSITY HOSP AT COMMUNITY GENERAL T C U,335870,4900 BROAD ROAD,SYRACUSE,Onondaga,0,0,0,0,15,7,0,0
WOODLAND POND AT NEW PALTZ,335858,100 WOODLAND POND CIRCLE,NEW PALTZ,Ulster,0,0,11,0,34,8,0,0
GLEN COVE CENTER FOR NURSING AND REHABILITATION,335716,6 MEDICAL PLAZA,GLEN COVE,Nassau,30,29,13,4,119,27,7,1
EDNA TINA WILSON LIVING CENTER,335769,700 ISLAND COTTAGE ROAD,ROCHESTER,Monroe,24,0,25,11,100,11,1,1
UNITY LIVING CENTER,335620,89 GENESEE STREET,ROCHESTER,Monroe,1,2,0,0,109,2,1,0
NEW EAST SIDE NURSING HOME,335517,25 BIALYSTOKER PLACE,NEW YORK,New York,0,1,1,0,44,5,0,0
MASONIC CARE COMMUNITY OF NEW YORK,335541,2150 BLEECKER STREET,UTICA,Oneida,1,0,21,0,283,20,18,0
FINGER LAKES CENTER FOR LIVING,335785,20 PARK AVENUE,AUBURN,Cayuga,1,0,0,0,69,1,0,0
KING STREET HOME INC,335447,787 KING STREET,PORT CHESTER,Westchester,10,2,3,1,64,29,1,0
SAINTS JOACHIM & ANNE NURSING AND REHAB CENTER,335748,2720 SURF AVENUE,BROOKLYN,Kings,23,4,0,0,133,33,1,0
SAMARITAN KEEP NURSING HOME INC,335431,133 PRATT ST,WATERTOWN,Jefferson,0,10,5,0,264,9,17,0
ST JOHNSVILLE REHABILITATION AND NURSING CENTER,335704,7 TIMMERMAN AVENUE,SAINT JOHNSVILLE,Montgomery,0,0,11,0,118,5,1,0
PATHWAYS NURSING AND REHABILITATION CENTER,335701,1805 PROVIDENCE AVENUE,NISKAYUNA,Schenectady,0,0,0,0,107,10,0,0
MONTEFIORE NYACK HOSPITAL T C U,335877,160 NORTH MIDLAND AVENUE,NYACK,Rockland,0,0,0,0,13,0,0,0
SHAKER PLACE REHABILITATION AND NURSING CENTER,335425,780 ALBANY SHAKER ROAD,ALBANY,Albany,66,0,75,17,169,71,0,1
DUNKIRK REHABILITATION & NURSING CENTER,335595,447 449 LAKE SHORE DRIVE WEST,DUNKIRK,Chautauqua,0,0,0,0,33,0,0,0
CAMPBELL HALL REHABILITATION CENTER INC,335657,23 KIERNAN RD,CAMPBELL HALL,Orange,0,0,12,13,93,2,0,0
EAST NECK NURSING & REHABILITATION CENTER,335681,134 GREAT EAST NECK ROAD,WEST BABYLON,Suffolk,121,168,95,54,204,87,52,1
SUNRISE MANOR CTR FOR NURSING AND REHABILITATION,335568,1325 BRENTWOOD ROAD,BAY SHORE,Suffolk,53,2,30,22,61,15,1,0
AMSTERDAM NURSING HOME CORP (1992),335570,1060 AMSTERDAM AVENUE,NEW YORK,New York,110,118,112,74,325,73,16,1
UNITED HEALTH SVS HOSP INC - BINGHAMTON HOSP T C U,335851,10-42 MITCHELL AVENUE,BINGHAMTON,Broome,0,0,0,0,17,2,0,0
ELDERWOOD OF LAKESIDE AT BROCKPORT,335569,170 WEST AVENUE,BROCKPORT,Monroe,0,0,3,0,107,3,0,0
CAPSTONE CENTER FOR REHABILITATION AND NURSING,335543,302 SWART HILL ROAD,AMSTERDAM,Montgomery,3,0,8,0,114,2,0,0
BETHLEHEM COMMONS CARE CENTER,335735,125 ROCKEFELLER ROAD,DELMAR,Albany,0,8,5,0,108,2,4,0
ELDERWOOD AT WHEATFIELD,335790,2600 NIAGARA FALLS BOULEVARD,NIAGARA FALLS,Niagara,2,4,9,0,104,4,17,0
QUEENS BOULEVARD EXTENDED CARE FACILITY,335791,61 11 QUEENS BOULEVARD,WOODSIDE,Queens,17,4,7,1,187,46,0,0
TRUSTEES OF EASTERN STAR HALL & HOME OF THE N Y S,335497,8290 STATE RT 69,ORISKANY,Oneida,0,10,2,0,40,2,12,0
ONEIDA CENTER FOR REHABILITATION AND NURSING,335794,1445 KEMBLE STREET,UTICA,Oneida,0,0,1,0,114,5,0,0
BROOKHAVEN HEALTH CARE FACILITY L L C,335694,801 GAZZOLA BLVD,EAST PATCHOGUE,Suffolk,63,45,29,9,129,29,0,0
MCAULEY RESIDENCE,335433,1503 MILITARY ROAD,KENMORE,Erie,0,3,13,3,109,31,0,1
ELLIS RESIDENTIAL & REHABILITATION CENTER,335705,600 MCCLELLAN STREET,SCHENECTADY,Schenectady,0,0,7,0,73,9,2,0
THE PAVILION AT QUEENS FOR REHABILITATION & NRSING,335804,36 17 PARSONS BOULEVARD,FLUSHING,Queens,7,8,34,2,248,41,0,0
KENDAL AT ITHACA,335793,2230 NORTH TRIPHAMMER ROAD,ITHACA,Tompkins,0,0,16,0,45,0,0,0
N Y S VETERANS HOME IN N Y C,335770,178 50 LINDEN BLVD,JAMAICA,Queens,49,0,19,7,135,70,0,0
ST MARYS HOSPITAL FOR CHILDREN,33A081,29 01 216 STREET,BAYSIDE,Queens,0,0,0,0,123,74,6,0
FOUR SEASONS NURSING AND REHABILITATION CENTER,335673,1555 ROCKAWAY PARKWAY,BROOKLYN,Kings,38,1,23,3,200,17,12,0
ADIRA AT RIVERSIDE REHABILITATION AND NURSING,335829,120 ODELL AVENUE,YONKERS,Westchester,27,2,18,1,102,31,5,0
MASSENA REHABILITATION & NURSING CENTER,335592,89 GROVE STREET,MASSENA,St. Lawrence,0,0,0,0,122,4,1,0
MENORAH HOME & HOSPITAL FOR AGED & INFIRM,335653,1516 ORIENTAL BLVD,BROOKLYN,Kings,16,39,53,19,297,70,13,1
BRIGHTON MANOR,335473,989 BLOSSOM ROAD,ROCHESTER,Monroe,25,0,3,2,,11,0,0
KING DAVID CENTER FOR NURSING AND REHABILITATION,335545,2266 CROPSEY AVENUE,BROOKLYN,Kings,8,15,13,2,206,25,1,0
THE PHOENIX REHABILITATION AND NURSING CENTER,335516,140 ST EDWARDS STREET,BROOKLYN,Kings,41,2,25,6,255,47,8,0
THE FRIENDLY HOME,335476,3156 EAST AVENUE,ROCHESTER,Monroe,15,0,20,5,169,13,13,0
WATERS EDGE AT PORT JEFFERSON FOR REHAB AND NRSG,335410,150 DARK HOLLOW ROAD,PORT JEFFERSON,Suffolk,26,0,14,4,88,32,2,0
BUSHWICK CENTER FOR REHABILITATION AND HEALTH CARE,335703,50 SHEFFIELD AVENUE,BROOKLYN,Kings,8,10,9,2,209,23,3,0
LUXOR NURSING AND REHABILITATION AT SAYVILLE,335761,300 BROADWAY AVENUE,SAYVILLE,Suffolk,21,12,6,3,120,35,4,0
SULLIVAN COUNTY ADULT CARE CENTER,335628,256 SUNSET LAKE ROAD,LIBERTY,Sullivan,121,0,4,2,89,23,1,0
GHENT REHABILITATION & NURSING CENTER,335766,1 WHITTIER WAY,GHENT,Columbia,0,0,9,0,108,2,0,0
ST MARYS CENTER INC,335762,516 WEST 126TH STREET,NEW YORK,New York,9,0,6,2,30,13,8,0
HELEN HAYES HOSPITAL R H C F,335823,51 N RT 9W,WEST HAVERSTRAW,Rockland,8,0,0,0,0,20,2,0
HOUGHTON REHABILITATION & NURSING CENTER,335641,9876 LUCKEY DRIVE,HOUGHTON,Allegany,0,0,0,0,95,2,0,0
DITMAS PARK CARE CENTER,335648,2107 DITMAS AVENUE,BROOKLYN,Kings,10,67,59,43,144,41,11,0
"WEST LAWRENCE CARE CENTER, L L C",335737,1410 SEAGIRT BLVD,FAR ROCKAWAY,Queens,38,52,76,38,164,18,24,0
GURWIN JEWISH NURSING AND REHABILITATION CENTER,335696,68 HAUPPAUGE ROAD,COMMACK,Suffolk,121,41,143,59,374,120,10,1
CONCOURSE REHABILITATION AND NURSING CENTER INC,335493,1072 GRAND CONCOURSE,BRONX,Bronx,82,27,57,35,192,21,13,2
SARATOGA CENTER FOR REHAB & SKILLED NURSING CARE,335518,149 BALLSTON AVENUE,BALLSTON SPA,Saratoga,0,0,13,0,97,3,3,0
BETHEL NURSING & REHABILITATION CENTER,335806,67 SPRINGVALE ROAD,CROTON ON HUDSON,Westchester,26,2,9,1,120,26,0,0
FOX RUN AT ORCHARD PARK,335854,ONE FOX RUN LANE,ORCHARD PARK,Erie,3,0,6,2,50,5,0,0
NORTH GATE HEALTH CARE FACILITY,335649,7264 NASH ROAD,NORTH TONAWANDA,Niagara,77,28,47,5,160,62,53,0
UNITED HEBREW GERIATRIC CENTER,335621,391 PELHAM ROAD,NEW ROCHELLE,Westchester,44,20,25,1,255,90,10,0
SEA CREST NURSING AND REHABILITATION CENTER,335411,3035 WEST 24TH ST,BROOKLYN,Kings,73,146,105,61,192,49,69,0
BEZALEL REHABILITATION AND NURSING CENTER,335666,29 38 FAR ROCKAWAY BLVD,FAR ROCKAWAY,Queens,9,3,7,1,96,6,0,0
JAMES G JOHNSTON MEMORIAL NURSING HOME,335675,285 DEYO HILL ROAD,JOHNSON CITY,Broome,2,3,12,1,105,12,3,0
HIGHLANDS LIVING CENTER,335786,500 HAHNEMANN TRAIL,PITTSFORD,Monroe,0,3,9,0,109,8,0,0
WARREN CENTER FOR REHABILITATION AND NURSING,335549,42 GURNEY LANE,QUEENSBURY,Warren,0,1,2,0,70,0,0,0
CLINTON COUNTY NURSING HOME,335598,16 FLYNN AVENUE,PLATTSBURGH,Clinton,1,0,8,0,62,1,0,0
WAYNE CENTER FOR NURSING & REHABILITATION,335495,3530 WAYNE AVENUE,BRONX,Bronx,11,7,20,0,207,23,4,0
LOCKPORT REHAB & HEALTH CARE CENTER,335573,909 LINCOLN AVE,LOCKPORT,Niagara,6,1,7,0,74,9,1,0
ROCKAWAY CARE CENTER,335571,353 BEACH 48TH STREET,FAR ROCKAWAY,Queens,26,4,0,0,154,9,0,0
BUENA VIDA REHAB AND NURSING CENTER,335826,48 CEDAR STREET,BROOKLYN,Kings,22,2,7,6,190,22,0,0
VICTORIA HOME,335714,25 N MALCOLM STREET,OSSINING,Westchester,6,4,3,1,25,11,0,0
PECONIC BAY SKILLED NURSING FACILITY,335688,1300 ROANOKE AVENUE,RIVERHEAD,Suffolk,6,4,43,24,57,26,0,0
DOWNTOWN BROOKLYN NURSING & REHABILITATION CENTER,335625,520 PROSPECT PLACE,BROOKLYN,Kings,65,105,74,48,254,30,3,0
TERRACE VIEW LONG TERM CARE FACILITY,335650,462 GRIDER STREET,BUFFALO,Erie,2,67,28,1,361,14,27,0
THE GRAND REHABILITATION AND NURSING AT PAWLING,335458,9 RESERVOIR ROAD,PAWLING,Dutchess,9,4,7,4,90,11,1,0
CHAMPLAIN VALLEY PHYSICIANS HOSP MED CTR S N F,335442,75 BEEKMAN STREET,PLATTSBURGH,Clinton,0,0,0,0,33,2,5,0
THE GRAND REHABILITATION AND NRSG AT CHITTENANGO,335588,331 RUSSELL STREET,CHITTENANGO,Madison,30,0,13,1,67,11,6,0
LINDEN CENTER FOR NURSING AND REHABILITATION,335811,2237 LINDEN BOULEVARD,BROOKLYN,Kings,3,12,6,1,248,23,12,0
BORO PARK CENTER FOR REHABILITATION AND HEALTHCARE,335470,4915 10TH AVE,BROOKLYN,Kings,28,17,42,6,416,58,3,2
NORWEGIAN CHRISTIAN HOME AND HEALTH CENTER,335523,1270 67TH STREET,BROOKLYN,Kings,42,56,51,16,128,24,20,0
SUFFOLK CENTER FOR REHABILITATION AND NURSING,335596,25 SCHOENFELD BLVD,PATCHOGUE,Suffolk,20,6,14,2,100,10,0,0
DR SUSAN SMITH MCKINNEY NURSING AND REHAB CENTER,335805,594 ALBANY AVENUE,BROOKLYN,Kings,22,0,15,2,316,31,1,1
BETHANY GARDENS SKILLED LIVING CENTER,335732,800 WEST CHESTNUT STREET,ROME,Oneida,0,0,27,0,96,6,8,0
BEDFORD CENTER FOR NURSING AND REHABILITATION,335626,40 HEYWARD STREET,BROOKLYN,Kings,8,2,16,3,183,50,0,0
THE HAMLET REHABILITATION AND HEALTHCARE CENTER AT,335674,100 SOUTHERN BOULEVARD,NESCONSET,Suffolk,19,1,33,10,173,25,1,0
THE GRAND REHABILITATION AND NURSING AT GREAT NECK,335483,15 ST PAULS PLACE,GREAT NECK,Nassau,9,4,3,0,134,19,0,0
QUANTUM REHABILITATION AND NURSING L L C,335719,63 OAKCREST AVENUE,MIDDLE ISLAND,Suffolk,42,0,20,17,96,20,0,0
THE GRAND REHABILITATION AND NURSING AT UTICA,335600,1657 SUNSET AVE,UTICA,Oneida,1,0,15,0,206,12,6,0
NORWICH REHABILITATION & NURSING CENTER,335759,88 CALVARY DRIVE,NORWICH,Chenango,0,0,10,0,79,3,0,0
"LAWRENCE NURSING CARE CENTER, INC",335415,350 BEACH 54TH STREET,ARVERNE,Queens,14,27,20,3,177,33,0,1
MORNINGSIDE NURSING AND REHABILITATION CENTER,335484,1000 PELHAM PARKWAY SOUTH,BRONX,Bronx,80,118,104,47,252,48,17,0
MANHATTANVILLE HEALTH CARE CENTER,335695,311 W 231ST STREET,BRONX,Bronx,29,118,135,43,149,73,16,0
IDEAL SENIOR LIVING CENTER,335520,601 HIGH AVENUE,ENDICOTT,Broome,0,5,33,0,146,0,13,0
WESTHAMPTON CARE CENTER,335782,78 OLD COUNTRY ROAD,WESTHAMPTON,Suffolk,22,0,28,12,148,26,3,0
SKY VIEW REHABILITATION & HEALTH CARE CENTER L L C,335508,1280 ALBANY POST RD,CROTON ON HUDSON,Westchester,41,2,27,21,137,43,11,1
BRONX CENTER FOR REHABILITATION & HEALTH CARE,335506,1010 UNDERHILL AVE,BRONX,Bronx,11,29,2,0,174,58,1,0
"FRIEDWALD CENTER FOR REHAB AND NURSING, L L C",335734,475 NEW HEMPSTEAD ROAD,NEW CITY,Rockland,0,2,37,14,148,27,1,0
PENN YAN MANOR NURSING HOME INC,335494,655 N LIBERTY STREET,PENN YAN,Yates,0,0,3,0,46,1,0,0
"WILLIAMSVILLE SUBURBAN, L L C",335647,163 SOUTH UNION ROAD,WILLIAMSVILLE,Erie,62,1,24,9,147,21,4,0
HIGHPOINTE ON MICHIGAN HEALTH CARE FACILITY,335834,1031 MICHIGAN AVE,BUFFALO,Erie,0,0,13,0,240,19,0,0
ELLICOTT CENTER FOR REHABILITATION AND NURSING,335437,200 SEVENTH STREET,BUFFALO,Erie,41,25,23,13,139,18,6,0
MIDWAY NURSING HOME,335472,69 95 QUEENS MIDTOWN EXPRESSWAY,MASPETH,Queens,20,4,8,2,138,28,0,0
UTICA REHABILITATION & NURSING CENTER,335471,2535 GENESEE STREET,UTICA,Oneida,0,0,0,0,100,9,0,0
VALLEY HEALTH SERVICES INC,335672,690 WEST GERMAN STREET,HERKIMER,Herkimer,0,11,10,0,145,3,23,0
PRESBYTERIAN HOME FOR CENTRAL NEW YORK INC,335546,4290 MIDDLE SETTLEMENT ROAD,NEW HARTFORD,Oneida,61,24,37,23,128,60,11,0
HAMILTON PARK NURSING AND REHABILITATION CENTER,335710,691 92ND STREET,BROOKLYN,Kings,29,12,21,1,168,40,0,0
AARON MANOR REHABILITATION AND NURSING CENTER,335532,100 ST CAMILLUS WAY,FAIRPORT,Monroe,0,19,20,2,124,15,1,0
SENECA HILL MANOR INC,335815,20 MANOR DRIVE,OSWEGO,Oswego,0,0,0,0,117,2,0,0
GLEN ARDEN INC,335802,46 HARRIMAN DRIVE,GOSHEN,Orange,6,0,7,4,35,9,4,0
RIVER RIDGE LIVING CENTER,335422,100 SANDY DRIVE,AMSTERDAM,Montgomery,9,0,8,0,86,8,3,0
LITTLE NECK CARE CENTER,335434,260 19 NASSAU BLVD,LITTLE NECK,Queens,4,0,10,0,98,10,0,0
ELDERWOOD AT HORNELL,335691,ONE BETHESDA DRIVE,HORNELL,Steuben,0,0,4,1,107,0,0,0
FULTON COMMONS CARE CENTER INC,335831,60 MERRICK AVENUE,EAST MEADOW,Nassau,69,49,128,39,181,61,67,0
BROOKHAVEN REHAB & HEALTH CARE CENTER L L C,335582,250 BEACH 17TH STREET,FAR ROCKAWAY,Queens,50,33,53,26,252,74,6,1
WESTCHESTER CENTER FOR REHABILITATION & NURSING,335459,10 CLAREMONT AVE,MOUNT VERNON,Westchester,6,8,7,2,171,7,0,0
SCHERVIER PAVILION,335784,22 VAN DUZER PLACE,WARWICK,Orange,53,2,52,27,63,65,0,0
ROSEWOOD REHABILITATION AND NURSING CENTER,335693,284 TROY ROAD,RENSSELAER,Rensselaer,6,7,13,2,59,0,4,0
THE KNOLLS,335844,55 GRASSLAND ROAD,VALHALLA,Westchester,1,3,2,1,10,1,0,0
MARTINE CENTER FOR REHABILITATION AND NURSING,335424,12 TIBBITS AVENUE,WHITE PLAINS,Westchester,14,4,14,0,160,19,1,1
SAPPHIRE NURSING AT MEADOW HILL,335464,172 MEADOW HILL ROAD,NEWBURGH,Orange,57,18,33,16,139,17,1,1
ST JOHNLAND NURSING CENTER INC,335487,395 SUNKEN MEADOW ROAD,KINGS PARK,Suffolk,37,9,16,5,203,22,1,0
"N Y CONGREGATIONAL NURSING CENTER, INC",335560,135 LINDEN BOULEVARD,BROOKLYN,Kings,51,49,95,60,134,44,32,2
GRAND MANOR NURSING & REHABILITATION CENTER,335744,700 WHITE PLAINS ROAD,BRONX,Bronx,29,20,0,0,191,29,0,0
ANDRUS ON HUDSON,335795,185 OLD BROADWAY,HASTINGS ON HUDSON,Westchester,25,0,21,2,185,23,0,0
SAPPHIRE NURSING AND REHAB AT GOSHEN,335684,46 HARRIMAN DRIVE,GOSHEN,Orange,51,39,18,10,103,20,0,0
ONTARIO CENTER FOR REHABILITATION AND HEALTHCARE,335564,3062 COUNTY COMPLEX DRIVE,CANANDAIGUA,Ontario,1,0,7,0,91,4,0,0
SILVERCREST,335724,144 45 87TH AVENUE,JAMAICA,Queens,16,0,39,2,261,25,13,2
BAPTIST HEALTH NURSING AND REHABILITATION CENTER,335612,297 N BALLSTON AVE,SCOTIA,Schenectady,0,4,38,0,192,26,0,0
WOODHAVEN NURSING HOME,335514,1360 ROUTE 112,PORT JEFFERSON STATI,Suffolk,3,48,1,1,114,4,7,0
THROGS NECK REHABILITATION & NURSING CENTER,335771,707 THROGS NECK EXPRESSWAY,BRONX,Bronx,1,1,13,0,169,37,0,0
PECONIC LANDING AT SOUTHOLD,335842,1500 BRECKNOCK ROAD,GREENPORT,Suffolk,0,1,7,2,47,5,0,0
HIGHBRIDGE WOODYCREST CENTER,335751,936 WOODYCREST AVENUE,BRONX,Bronx,23,2,0,0,83,4,0,0
CONCORD NURSING AND REHABILITATION CENTER,335538,300 MADISON STREET,BROOKLYN,Kings,4,0,7,2,130,22,0,0
HAYM SOLOMON HOME FOR THE AGED,335656,2340 CROPSEY AVENUE,BROOKLYN,Kings,27,2,10,36,199,36,10,0
TERENCE CARDINAL COOKE HEALTH CARE CENTER,335665,1249 FIFTH AVENUE,NEW YORK,New York,42,30,28,14,549,123,1,0
SALEM HILLS REHABILITATION AND NURSING CENTER,335687,539 ROUTE 22,PURDYS,Westchester,12,2,13,7,82,17,1,0
EAST SIDE NURSING HOME,335511,62 PROSPECT ST,WARSAW,Wyoming,0,0,0,0,75,2,0,0
FLUSHING HOSPITAL MEDICAL CENTER T C U,335864,45TH AVENUE AND PARSONS BOULEVARD,FLUSHING,Queens,0,0,0,0,0,0,0,0
ST CATHERINE OF SIENA NRSG AND REHAB CARE CENTER,335821,52 ROUTE 25A,SMITHTOWN,Suffolk,6,0,19,4,182,8,13,0
SEAGATE REHABILITATION AND NURSING CENTER,335513,3015 W 29 ST,BROOKLYN,Kings,25,15,14,5,282,67,0,0
PINE HAVEN HOME,335632,NY ROUTE 217,PHILMONT,Columbia,49,2,47,15,78,22,9,0
AUTUMN VIEW HEALTH CARE FACILITY L L C,335662,S 4650 SOUTHWESTERN BLVD,HAMBURG,Erie,2,3,16,1,218,32,64,0
THE BAPTIST HOME AT BROOKMEADE,335613,46 BROOKMEADE DRIVE,RHINEBECK,Dutchess,0,0,30,0,114,3,0,0
BROOKLYN QUEENS NURSING HOME,335637,2749 LINDEN BLVD,BROOKLYN,Kings,19,8,1,0,133,45,11,1
WATERVILLE RESIDENTIAL CARE CENTER,335585,220 TOWER STREET,WATERVILLE,Oneida,0,0,0,0,86,0,0,0
BUFFALO CENTER FOR REHABILITATION AND NURSING,335638,1014 DELAWARE AVE,BUFFALO,Erie,31,10,20,7,174,23,4,0
"SUNSET NURSING AND REHABILITATION CENTER, INC",335587,232 ACADEMY STREET,BOONVILLE,Oneida,0,0,0,0,99,18,3,0
PROVIDENCE REST INC,335583,3304 WATERBURY AVENUE,BRONX,Bronx,43,3,75,21,136,93,55,2
GOLDEN HILL NURSING AND REHABILITATION CENTER,335451,99 GOLDEN HILL DRIVE,KINGSTON,Ulster,0,2,11,0,251,23,1,0
NORTHERN WESTCHESTER HOSPITAL T C U,335869,400 EAST MAIN STREET,MOUNT KISCO,Westchester,0,0,0,0,5,0,0,0
WELLSVILLE MANOR CARE CENTER,335661,4192A BOLIVAR ROAD,WELLSVILLE,Allegany,0,0,46,0,108,1,0,0
"HARRIS HILL NURSING FACILITY, L L C",335757,2699 WEHRLE DRIVE,WILLIAMSVILLE,Erie,,,,,,,,
"BETSY ROSS REHABILITATION CENTER, INC",335727,1 ELSIE STREET,ROME,Oneida,1,0,16,0,98,1,0,0
WESLEY GARDENS CORPORATION,335488,3 UPTON PARK,ROCHESTER,Monroe,1,0,0,0,47,3,1,0
LEWIS COUNTY GENERAL HOSPITAL-NURSING HOME UNIT,335428,7785 NORTH STATE STREET,LOWVILLE,Lewis,0,0,0,0,139,35,4,0
"SAFIRE REHABILITATION OF SOUTHTOWN, L L C",335663,300 DORRANCE AVENUE,BUFFALO,Erie,1,0,0,0,99,5,0,0
NOTTINGHAM R H C F,335800,1305 NOTTINGHAM ROAD,JAMESVILLE,Onondaga,0,0,0,0,35,6,0,0
ABSOLUT CTR FOR NURSING & REHAB WESTFIELD L L C,335683,26 CASS STREET,WESTFIELD,Chautauqua,0,0,0,0,101,16,5,0
TRIBORO CENTER FOR REHABILITATION AND NURSING,335445,1160 TELLER AVE,BRONX,Bronx,53,4,29,12,381,28,4,0
CATSKILL REGIONAL MEDICAL CENTER,335639,68 BUSHVILLE ROAD,HARRIS,Sullivan,3,0,7,0,57,0,0,0
STATEN ISLAND CARE CENTER,335561,200 LAFAYETTE AVENUE,STATEN ISLAND,Richmond,11,6,13,2,219,73,0,0
BAYBERRY NURSING HOME,335614,40 KEOGH LANE,NEW ROCHELLE,Westchester,13,2,7,2,46,16,2,0
MEADOWBROOK HEALTHCARE,335438,154 NORTH PROSPECT AVENUE,PLATTSBURGH,Clinton,0,36,30,0,209,4,46,0
IRA DAVENPORT MEMORIAL HOSPITAL S N F/ H R F,335706,7571 STATE ROUTE 54,BATH,Steuben,25,7,23,11,98,25,15,0
PREMIER GENESEE CENTER FOR NRSG AND REHABILITATION,335423,278 BANK STREET,BATAVIA,Genesee,0,2,38,0,149,3,11,0
THE STEVEN AND ALEXANDRA COHEN PED L T C PAVILION,335874,95 BRADHURST AVE,VALHALLA,Westchester,0,0,0,0,24,7,0,0
"ROME MEMORIAL HOSPITAL, INC - R H C F",335563,1500 NORTH JAMES STREET,ROME,Oneida,30,2,12,16,50,9,1,0
ELDERWOOD AT HAMBURG,335679,5775 MAELOU DRIVE,HAMBURG,Erie,0,8,38,0,130,5,0,0
CYPRESS GARDEN CENTER FOR NURSING AND REHAB,335446,139 66 35TH AVENUE,FLUSHING,Queens,13,4,22,3,192,73,1,0
LIVINGSTON COUNTY CENTER FOR NURSING AND REHAB,335562,11 MURRAY HILL DRIVE,MOUNT MORRIS,Livingston,1,0,33,0,211,5,0,0
DAUGHTERS OF SARAH NURSING CENTER,335465,180 WASHINGTON AVE EXT,ALBANY,Albany,12,12,24,2,189,22,4,0
HERITAGE GREEN REHAB & SKILLED NURSING,335721,3023 ROUTE 430     PO BOX 400,GREENHURST,Chautauqua,0,0,0,0,132,1,0,0
ABSOLUT CTR FOR NURSING & REHAB GASPORT L L C,335533,4540 LINCOLN DRIVE,GASPORT,Niagara,0,0,8,0,73,10,1,0
THE HIGHLANDS AT BRIGHTON,335778,5901 LAC DE VILLE BLVD,ROCHESTER,Monroe,0,0,0,0,129,9,2,0
"RUTLAND NURSING HOME, INC",335537,585 SCHENECTADY AVE,BROOKLYN,Kings,64,3,38,6,388,20,1,0
BUFFALO COMMUNITY HEALTHCARE CENTER,335640,1205 DELAWARE AVENUE,BUFFALO,Erie,6,1,8,0,87,16,2,0
THE OSBORN,335797,101 THEALL ROAD,RYE,Westchester,1,0,1,1,68,20,4,0
"HARLEM CTR FOR NURSING AND REHABILITATION, L L C",335522,30 WEST 138TH STREET,NEW YORK,New York,36,14,10,3,175,62,15,0
CHAUTAUQUA NURSING AND REHABILITATION CENTER,335485,10836 TEMPLE ROAD,DUNKIRK,Chautauqua,0,0,1,0,177,11,13,0
SALAMANCA REHABILITATION & NURSING CENTER,335534,451 BROAD STREET,SALAMANCA,Cattaraugus,0,0,1,0,95,3,0,0
"HAVEN MANOR HEALTH CARE CENTER, L L C",335676,1441 GATEWAY BOULEVARD,FAR ROCKAWAY,Queens,5,1,33,24,190,29,3,1
LUXOR NURSING AND REHABILITATION AT MILLS POND,335739,273 MORICHES ROAD,ST JAMES,Suffolk,3,20,20,6,197,11,0,0
GOOD SHEPHERD VILLAGE AT ENDWELL,335859,14 VILLAGE DRIVE,ENDWELL,Broome,0,0,1,0,32,4,1,0
KENDAL ON HUDSON,335848,ONE KENDAL WAY,SLEEPY HOLLOW,Westchester,2,0,5,1,18,4,0,0
UNITED HELPERS CANTON NURSING HOME,335566,205 STATE STREET ROAD,CANTON,St. Lawrence,1,0,16,0,88,2,6,0
FIDDLERS GREEN MANOR REHAB AND NURSING CENTER,335457,168 WEST MAIN STREET,SPRINGVILLE,Erie,5,0,0,1,69,5,0,0
PALATINE NURSING HOME,335685,154  LAFAYETTE STREET,PALATINE BRIDGE,Montgomery,0,0,0,0,67,5,0,0
NEW YORK CENTER FOR REHABILITATION & NURSING,335838,26-13  21ST STREET,ASTORIA,Queens,10,25,9,1,232,21,0,0
THE GRAND REHABILITATION AND NRSG AT RIVER VALLEY,335827,140 MAIN STREET,POUGHKEEPSIE,Dutchess,2,16,2,0,147,14,6,0
HELEN HAYES HOSPITAL T C U,335873,51 N ROUTE 9W,WEST HAVERSTRAW,Rockland,0,0,0,0,0,0,0,0
FOLTSBROOK CENTER FOR NURSING AND REHABILITATION,335510,104 NORTH WASHINGTON STREET,HERKIMER,Herkimer,27,0,5,3,128,19,0,0
TERESIAN HOUSE NURSING HOME CO INC,335627,200 WASHINGTON AVE EXT,ALBANY,Albany,3,0,26,5,221,33,3,0
ISLAND NURSING AND REHAB CENTER,335835,5537 EXPRESSWAY DRIVE NORTH,HOLTSVILLE,Suffolk,2,0,4,2,56,7,0,0
LONG BEACH NURSING AND REHABILITATION CENTER,335432,375 EAST BAY DRIVE,LONG BEACH,Nassau,25,78,60,45,110,31,14,0
NEW GOUVERNEUR HOSPITAL S N F,335461,227 MADISON STREET,NEW YORK,New York,29,36,21,6,262,14,11,0
THE AMSTERDAM AT HARBORSIDE,335861,300 EAST OVERLOOK,PORT WASHINGTON,Nassau,12,5,15,4,40,21,12,0
NORTHWELL HEALTH STERN FAMILY CENTER FOR REHAB,335702,300 COMMUNITY DRIVE,MANHASSET,Nassau,6,0,12,4,182,63,4,0
JEANNE JUGAN RESIDENCE,335849,2999 SCHURZ AVENUE,BRONX,Bronx,0,0,1,0,27,4,0,0
MAPLEWOOD NURSING HOME INC,335572,100 DANIEL DRIVE,WEBSTER,Monroe,0,0,1,0,71,5,0,0
ONONDAGA CENTER FOR REHABILITATION AND NURSING,335548,217 EAST AVENUE,MINOA,Onondaga,1,0,6,0,76,9,1,0
SLATE VALLEY CENTER FOR REHABILITATION AND NURSING,335711,10421 STATE ROUTE 40,GRANVILLE,Washington,0,0,14,0,81,0,0,0
CANTERBURY WOODS,335816,725 RENAISSANCE DRIVE,WILLIAMSVILLE,Erie,0,0,4,0,46,1,0,0
THE GRAND REHABILITATION AND NURSING AT BARNWELL,335565,3230 CHURCH STREET,VALATIE,Columbia,20,0,9,6,148,14,0,0
THE GRAND REHABILITATION AND NURSING AT ROME,335589,801 NORTH JAMES STREET,ROME,Oneida,17,4,3,0,115,29,0,0
HAMILTON MANOR NURSING HOME,335615,1172 LONG POND ROAD,ROCHESTER,Monroe,0,0,1,0,32,4,0,0
