Provider Name,Federal Provider Number,Provider Address,Provider City,County,Residents Total Confirmed COVID-19,Residents Total Suspected COVID-19,Residents Total All Deaths,Residents Total COVID-19 Deaths,Total Number of Occupied Beds,Staff Total Confirmed COVID-19,Staff Total Suspected COVID-19,Staff Total COVID-19 Deaths
SOUTHWIND NURSING & REHABILITATION CENTER,195563,804 CROWLEY-RAYNE HWY,CROWLEY,Acadia,0,1,0,0,103,5,6,0
LOUISIANA WAR VETERANS HOME,195629,4739 HIGHWAY 10,JACKSON,East Feliciana,0,0,0,0,113,0,0,0
HERITAGE MANOR OF OPELOUSAS,195321,7941 I-49 SOUTH SERVICE ROAD,OPELOUSAS,St. Landry,0,0,6,0,98,0,0,0
OUR LADY OF WISDOM HEALTH CARE CENTER,195509,5600 GENERAL DEGAULLE DR,NEW ORLEANS,Orleans,16,0,34,8,118,10,1,0
HIGHLAND PLACE REHAB AND NURSING CENTER,195350,1736 IRVING PLACE,SHREVEPORT,Caddo,63,13,12,11,116,25,15,0
GRAND COVE NURSING & REHABILITATION CENTER,195376,1525 W MCNEESE ST.,LAKE CHARLES,Calcasieu,0,0,2,0,93,0,0,0
TOWN AND COUNTRY HEALTH & REHAB,195532,614 WESTON STREET,MINDEN,Webster,1,0,0,0,132,2,0,0
LULING LIVING CENTER,195358,1125 PAUL MAILLARD RD,LULING,St. Charles,48,1,20,9,74,16,1,0
MID CITY COMMUNITY NURSING AND REHAB,195505,4005 NORTH BLVD,BATON ROUGE,East Baton Rouge,,,,,,,,
MARY ANNA NURSING HOME,195605,125 TURNER STREET,WISNER,Franklin,0,1,0,0,40,0,0,0
CLAIBORNE HEALTHCARE CENTER,195316,1536 CLAIBORNE AVENUE,SHREVEPORT,Caddo,0,0,0,0,51,0,0,0
HERITAGE MANOR OF BATON ROUGE I I,195389,9301 OXFORD PLACE AVE,BATON ROUGE,East Baton Rouge,0,0,15,0,104,2,3,0
VILLA FELICIANA CHRONIC DISEASE,195150,5002 HIGHWAY 10,JACKSON,East Feliciana,3,0,0,0,141,5,1,0
EAST JEFFERSON HOSPITAL SNF,195199,4200 HOUMA BLVD,METAIRIE,Jefferson,0,0,0,0,19,0,0,0
SHADY LAKE NURSING HOME,195585,5976 HIGHWAY 65 NORTH,LAKE PROVIDENCE,East Carroll,0,1,1,0,56,0,1,0
LEGRAND HEALTHCARE AND REHABILITATION CENTER,195554,2650 HOLT STREET,BASTROP,Morehouse,0,0,0,0,82,0,2,0
LANDMARK NURSING CENTER HAMMOND,195484,42250 NORTH OAKS DR,HAMMOND,Tangipahoa,9,0,5,4,138,4,0,0
VERMILION HEALTH CARE CENTER,195442,14008 CHENEAU ROAD,KAPLAN,Vermilion,0,0,0,0,108,0,0,0
CAPITOL HOUSE NURSING AND REHAB CENTER,195476,11546 FLORIDA BLVD,BATON ROUGE,East Baton Rouge,2,1,1,3,87,1,0,0
NOTTINGHAM REGIONAL REHAB CENTER,195488,2828 WESTFORK,BATON ROUGE,East Baton Rouge,31,0,2,1,94,5,2,0
AUDUBON HEALTH AND REHAB,195275,2110 AUDUBON AVENUE,THIBODAUX,Lafourche,62,2,29,22,103,28,1,3
BAYSIDE HEALTHCARE CENTER,195309,3201 WALL BLVD,GRETNA,Jefferson,11,5,27,17,69,8,5,0
SOUTHWEST LOUISIANA WAR VETERANS HOME,195608,1610 EVANGELINE HIGHWAY,JENNINGS,Jefferson Davis,0,0,0,0,132,0,0,0
RIVERVIEW CARE CENTER,195497,4820 MEDICAL DRIVE,BOSSIER CITY,Bossier,0,0,1,0,122,0,0,0
MAISON TECHE NURSING CENTER,195574,7307 OLD SPANISH TRAIL,JEANERETTE,Iberia,44,0,12,10,65,6,1,0
"FOREST HAVEN NURSING & REHAB CTR, LLC",195463,171 THRASHER DRIVE,JONESBORO,Jackson,34,33,10,6,110,14,8,0
POINTE COUPEE HEALTHCARE,195620,1820 FALSE RIVER ROAD,NEW ROADS,Pointe Coupee,15,8,7,6,84,11,5,0
"GARDEN PARK NURSING & REHAB CTR, LLC",195248,9111 LINWOOD AVENUE,SHREVEPORT,Caddo,67,0,49,23,100,21,1,0
RIVIERE DE SOLEIL COMMUNITY CARE CENTER,195489,7408 HWY 1,MANSURA,Avoyelles,0,1,3,0,120,0,0,0
"RUSTON NURSING AND REHABILITATION CENTER,LLC",195510,3720 HWY 80 EAST,RUSTON,Lincoln,0,3,0,0,136,0,0,0
MAISON DE'VILLE NURSING HOME,195307,107 SOUTH HOLLYWOOD DRIVE,HOUMA,Terrebonne,0,0,5,1,114,3,0,0
OAK WOODS HOME FOR THE ELDERLY,195598,1400 DAVENPORT AVENUE,MER ROUGE,Morehouse,,,,,,,,
ST LUKE'S LIVING CENTER,195631,4201 WOODLAND DRIVE,NEW ORLEANS,Orleans,28,6,27,13,80,5,3,0
LOUISIANA EXTENDED CARE HOSPITAL OF LAFAYETTE,195639,"2810 AMBASSADOR CAFFERY PARKWAY, 5TH FLOOR",LAFAYETTE,Lafayette,0,0,0,0,0,0,0,0
ELLINGTON ( THE ),195464,308 AMELIA STREET,RAYNE,Acadia,0,0,0,0,106,0,0,0
CAPITAL OAKS NURSING & REHABILITATION CENTER LLC,195635,4100 NORTH BLVD,BATON ROUGE,East Baton Rouge,29,0,7,6,104,2,3,0
MEADOWVIEW HEALTH & REHAB CENTER,195281,400 MEADOWVIEW DRIVE,MINDEN,Webster,0,0,21,0,110,0,0,0
LEXINGTON HOUSE,195424,16 HEYMAN LANE,ALEXANDRIA,Rapides,0,0,0,0,125,0,4,0
SOUTHERN HILLS HEALTHCARE AND REHABILITATION,195519,9105 BAIRD ROAD,SHREVEPORT,Caddo,2,0,0,0,77,6,5,1
LODGE AT LANE (THE),195617,6300 MAIN STREET,ZACHARY,East Baton Rouge,0,0,0,0,33,0,0,0
LEGACY NURSING AND REHABILITATION OF PLAQUEMINE,195343,59215 RIVER WEST DRIVE,PLAQUEMINE,Iberville,32,2,28,11,85,20,0,0
ASSUMPTION HEALTHCARE AND REHABILITATION,195498,252 HWY. 402,NAPOLEONVILLE,Assumption,,,,,,,,
GUEST HOUSE SKILLED NURSING REHABILITATION (THE),195380,9225 NORMANDIE DRIVE,SHREVEPORT,Caddo,9,0,0,0,147,10,0,0
"RIVER PALMS NURSING & REHAB, L L C",195341,5301 TULLIS DRIVE,NEW ORLEANS,Orleans,0,0,5,3,166,0,1,0
WALDON HEALTH CARE CENTER,195203,2401 IDAHO STREET,KENNER,Jefferson,19,0,19,2,83,11,0,0
ST JOSEPH CONTINUING CARE CENTER,195359,2301 STERLINGTON ROAD,MONROE,Ouachita,24,0,1,0,78,11,0,0
HERITAGE MANOR HEALTH & REHAB,195291,110 SERIO BLVD,FERRIDAY,Concordia,0,0,0,0,45,6,0,0
LEGACY NURSING AND REHABILITATION OF TALLULAH,195443,32 CROTHERS DRIVE,TALLULAH,Madison,0,1,0,0,99,2,8,0
FLANNERY OAKS GUEST HOUSE,195477,1642 N. FLANNERY ROAD,BATON ROUGE,East Baton Rouge,9,25,34,4,92,8,20,0
"PARK PLACE HEALTHCARE, LLC",195176,535 COMMERCE STREET,GRETNA,Jefferson,3,0,2,1,53,3,1,0
DELTA GRANDE SKILLED NURSING AND REHABILITATION,195530,3001 SOUTH GRANDE STREET,MONROE,Ouachita,0,0,0,0,63,0,6,0
"NATCHITOCHES NURSING AND REHABILITATION CENTER,LLC",195293,750 KEYSER AVENUE,NATCHITOCHES,Natchitoches,51,0,10,10,52,21,0,0
COLONIAL MANOR NURSING & REHABILITATION HOME,195394,307 FOSTER STREET,RAYVILLE,Richland,0,0,0,0,62,1,0,0
SAGE REHABILITATION HOSPITAL SNF,195621,8000 SUMMA AVENUE,BATON ROUGE,East Baton Rouge,,,,,,,,
LEGACY NURSING AND REHABILITATION OF PORT ALLEN,195599,403 15TH STREET,PORT ALLEN,West Baton Rouge,54,0,24,16,98,12,0,1
PELICAN POINTE HEALTHCARE AND REHABILITATION,195342,405 MILTON ROAD,MAURICE,Vermilion,0,13,21,0,107,0,4,0
MANY HEALTHCARE AND REHABILITATION CENTER,195310,120 NATCHITOCHES HWY 6 EAST,MANY,Sabine,0,0,2,0,69,1,4,0
OLD JEFFERSON COMMUNITY CARE CENTER,195571,8340 BARINGER FOREMAN ROAD.,BATON ROUGE,East Baton Rouge,53,0,32,26,84,19,2,1
GUEST HOUSE NURSING AND REHABILITATION,195551,109 GUEST HOUSE DRIVE,WEST MONROE,Ouachita,0,2,3,0,106,1,0,0
BELLE MAISON NURSING & REHABILITATION L L C,195523,15704 MEDICAL ARTS PLAZA,HAMMOND,Tangipahoa,,,,,,,,
OCHSNER MEDICAL CENTER SKILLED NURSING FACILITY,195180,"2614 JEFFERSON HWY, 3RD FLOOR",JEFFERSON,Jefferson,0,0,0,0,29,0,0,0
PILGRIM MANOR SKILLED NURSING AND REHABILITATION,195594,1524 DOCTORS DRIVE,BOSSIER CITY,Bossier,0,0,0,0,131,0,0,0
WOODS HAVEN SR CITIZENS HOME,195249,8275 HIGHWAY 165,POLLOCK,Grant,0,0,0,0,54,0,0,0
OAKS (THE),195542,1000 MCKEEN PLACE,MONROE,Ouachita,16,0,6,6,58,19,0,0
WILLOW WOOD AT WOLDENBERG VILLAGE,195156,3701 BEHRMAN PLACE,NEW ORLEANS,Orleans,0,0,0,0,89,0,0,0
SABINE RETIREMENT AND REHAB CENTER,195555,965 FISHER ROAD,MANY,Sabine,0,0,0,0,85,0,0,0
EASTRIDGE NURSING CENTER,195553,2305 RICHARD ST.,ABBEVILLE,Vermilion,0,0,0,0,80,0,0,0
CAMELOT PLACE,195544,2021 RAYNE CROWLEY HIGHWAY,RAYNE,Acadia,0,0,0,0,103,1,0,0
CARE CENTER OF DEQUINCY (THE),195527,602 NORTH DIVISION,DEQUINCY,Calcasieu,35,4,9,6,52,9,2,0
CAMELOT BROOKSIDE,195550,3330 FRONTAGE ROAD,JENNINGS,Jefferson Davis,0,0,14,0,110,0,0,0
HAVEN NURSING CENTER,195265,7726 US HWY. 165,COLUMBIA,Caldwell,0,0,10,0,72,0,0,0
"MAGNOLIA MANOR NURSING AND REHAB CTR, LLC",195406,1411 CLAIBORNE AVENUE,SHREVEPORT,Caddo,,,,,,,,
HERITAGE MANOR OF BOSSIER,195323,2575 AIRLINE DRIVE,BOSSIER CITY,Bossier,0,0,0,0,50,0,0,0
MAGNOLIA ESTATES,195573,1511 DULLES DRIVE,LAFAYETTE,Lafayette,11,0,30,2,133,5,1,0
PRINCETON PLACE-RUSTON,195520,1405 WHITE STREET,RUSTON,Lincoln,0,7,4,3,61,6,21,0
"JEFF DAVIS LIVING CENTER, LLC",195314,1338 NORTH CUTTING AVENUE,JENNINGS,Jefferson Davis,0,0,0,0,63,0,0,0
OAK HAVEN COMMUNITY CARE CENTER,195575,1515 HIGHWAY 107,CENTER POINT,Avoyelles,,,,,,,,
"RINGGOLD NURSING AND REHABILITATION CENTER, LLC",195407,2501 KENNETH STREET,RINGGOLD,Bienville,0,0,0,0,84,1,0,0
ST JUDE'S NURSING HOME,195517,1539 DELACHAISE ST.,NEW ORLEANS,Orleans,0,0,1,0,50,0,0,1
LAKE CHARLES CARE CENTER,195413,2701 ERNEST STREET,LAKE CHARLES,Calcasieu,16,0,2,2,143,2,0,0
SAVOY CARE CENTER,195619,906 CHERRY STREET,MAMOU,Evangeline,0,0,0,0,62,0,1,0
LEGACY NURSING AND REHABILITATION OF MORGAN CITY,195386,740 JUSTA STREET,MORGAN CITY,St. Mary,0,0,0,0,71,0,0,0
"GOLDEN AGE OF WELSH, LLC",195522,410 SOUTH SIMMONS STREET,WELSH,Jefferson Davis,0,0,0,0,86,0,0,0
ST FRANCES NSG & REHAB CENTER,195499,417 INDUSTRIAL DRIVE,OBERLIN,Allen,0,0,4,0,76,0,0,0
NORTHWEST LOUISIANA VETERANS HOME,195623,3130 ARTHUR RAY TEAGUE PARKWAY,BOSSIER CITY,Bossier,0,0,0,0,128,1,2,0
LANDMARK SOUTH NURSING & REHABILITATION CENTER,195480,18180 JEFFERSON HWY,BATON ROUGE,East Baton Rouge,1,11,15,1,123,12,3,0
HIGH HOPE CARE CENTER,195601,475 HIGH HOPE ROAD,SULPHUR,Calcasieu,6,1,5,2,67,2,1,0
"WESTWOOD MANOR NURSING HOME, INC",195525,714 HIGH SCHOOL DRIVE,DERIDDER,Beauregard,0,0,13,0,90,0,0,0
"WILLOW RIDGE NURSING AND REHABILITATION CENTER,LLC",195346,660 FACTORY OUTLET DRIVE,ARCADIA,Bienville,83,0,17,17,70,27,0,1
LACOMBE NURSING CENTRE,195348,28119 HWY 190,LACOMBE,St. Tammany,0,0,0,0,79,0,3,0
RAYVILLE NURSING & REHABILITATION  CENTER INC,195373,294 HWY 3048,RAYVILLE,Richland,0,0,4,0,57,11,2,0
BAYOU CHATEAU NURSING CTR,195546,16232 HWY. 1,SIMMESPORT,Avoyelles,0,0,1,1,60,0,1,0
COLONIAL NURSING HOME,195445,426 NORTH WASHINGTON STREET,MARKSVILLE,Avoyelles,8,0,6,2,43,3,1,1
TIOGA COMMUNITY CARE CENTER,195500,5201 SHREVEPORT HWY,PINEVILLE,Rapides,0,1,4,0,85,1,0,0
"RIVERBEND NURSING AND REHABILITATION CENTER, INC",195481,13735 HIGHWAY 23,BELLE CHASSE,Plaquemines,24,0,16,10,92,13,0,0
LIVE OAK,195597,600 EAST FLOURNOY LUCAS ROAD,SHREVEPORT,Caddo,4,0,3,0,108,7,0,0
LANDMARK OF BATON ROUGE,195494,9105 OXFORD PLACE DRIVE,BATON ROUGE,East Baton Rouge,29,3,28,14,94,15,0,0
LAFOURCHE HOME FOR AGED & INFIRM,195449,1002 TIGER DRIVE,THIBODAUX,Lafourche,9,31,7,2,61,10,15,0
OAKS OF HOUMA (THE),195201,400 MONARCH DRIVE,HOUMA,Terrebonne,25,26,18,9,93,15,12,0
ACADIA ST. LANDRY GUEST HOUSE,195564,830 S. BROADWAY,CHURCH POINT,Acadia,0,0,0,0,106,0,0,0
HARVEST MANOR HEALTHCARE AND REHABILITATION CENTER,195501,839 NORTH RANGE AVENUE,DENHAM SPRINGS,Livingston,13,0,4,3,154,13,0,0
GOLDEN AGE HEALTHCARE AND REHABILITATION CENTER,195524,27090 HWY 16,DENHAM SPRINGS,Livingston,7,0,12,4,150,3,0,0
CHATEAU DE NOTRE DAME,195589,2832 BURDETTE STREET,NEW ORLEANS,Orleans,7,0,22,12,129,11,0,0
LAKEVIEW MANOR NURSING HOME,195446,400 HOSPITAL ROAD,NEW ROADS,Pointe Coupee,0,12,2,0,85,0,11,0
"WOODLANDS HEALTHCARE CENTER, LLC (THE)",195482,144 THAD BAILES RD,LEESVILLE,Vernon,0,0,0,0,130,0,1,0
VIVIAN HEALTHCARE CENTER,195325,912 SOUTH PECAN STREET,VIVIAN,Caddo,28,0,14,10,46,14,0,0
"AUTUMN LEAVES NURSING AND REHAB CTR, LLC",195412,342 COUNTRY CLUB ROAD,WINNFIELD,Winn,0,0,3,0,102,0,0,0
SUMMIT (THE),195560,2200 MEMORIAL DRIVE,ALEXANDRIA,Rapides,1,0,1,0,125,1,1,0
RIVER OAKS RETIREMENT MANOR,195502,2500 E. SIMCOE STREET,LAFAYETTE,Lafayette,0,0,0,0,79,1,0,0
LANDMARK OF LAKE CHARLES,195630,2335 OAK PARK BLVD,LAKE CHARLES,Calcasieu,0,3,0,0,127,1,9,0
J. MICHAEL MORROW MEMORIAL NURSING  HOME,195385,883 MAIN STREET,ARNAUDVILLE,St. Landry,1,0,1,3,116,0,3,0
CHRISTWOOD,195381,100 CHRISTWOOD BLVD.,COVINGTON,St. Tammany,0,0,0,0,16,0,0,0
CORNERSTONE AT THE RANCH,195565,103 WEST MARTIAL AVE,LAFAYETTE,Lafayette,0,0,0,0,65,0,0,0
ST JAMES PLACE NURSING CARE CENTER,195410,333 LEE DRIVE,BATON ROUGE,East Baton Rouge,1,1,0,0,71,3,0,0
BOOKER T.WASHINGTON SKILLED NURSING AND REHABILITA,195615,7605 LINE AVENUE,SHREVEPORT,Caddo,16,0,5,5,29,18,0,0
CAMELOT COMMUNITY CARE,195543,1560 HIGHWAY 51,PONCHATOULA,Tangipahoa,0,1,0,0,121,6,0,0
ALPINE SKILLED NURSING AND REHABILITATION,195538,2401 NORTH SERVICE ROAD,RUSTON,Lincoln,2,0,0,0,111,12,0,0
GREEN MEADOW HAVEN,195562,1110 RINGGOLD AVENUE,COUSHATTA,Red River,0,0,0,0,98,0,0,0
RESTHAVEN LIVING CENTER,195624,1301 HARRISON STREET,BOGALUSA,Washington,40,0,4,4,85,19,24,0
"PLANTATION MANOR NURSING AND REHAB CENTER, LLC",195257,6340 HIGHWAY 4,WINNSBORO,Franklin,0,0,0,0,119,5,1,1
STERLING PLACE,195382,3888 NORTH BLVD.,BATON ROUGE,East Baton Rouge,12,4,5,5,134,8,0,0
LADY OF THE OAKS RETIREMENT MANOR,195633,1005 ERASTE LANDRY ROAD,LAFAYETTE,Lafayette,0,0,3,0,114,0,0,0
PIERREMONT HEALTHCARE CENTER,195312,725 MITCHELL LANE,SHREVEPORT,Caddo,22,2,16,6,99,15,6,0
ST MARTIN DE PORRES MULTI-CARE CENTER,195467,200 TEAL ST.,LAKE CHARLES,Calcasieu,0,0,0,0,127,0,0,0
CHERRY RIDGE,195541,5980 CHERRY RIDGE RD,BASTROP,Morehouse,0,1,1,0,81,0,1,0
BASILE CARE CENTER,195582,2907 EAST SCHAMBERS,BASILE,Evangeline,0,0,0,0,58,0,0,0
HERITAGE MANOR OF FRANKLINTON,195324,2000 MAIN STREET,FRANKLINTON,Washington,0,0,0,0,63,1,0,0
COURTYARD MANOR NURSE CARE CENTER & ASSISTED LIV,195606,306 SYDNEY MARTIN ROAD,LAFAYETTE,Lafayette,0,0,0,0,73,0,0,0
COLONIAL OAKS SKILLED NURSING AND REHABILITATION,195604,4921 MEDICAL DRIVE,BOSSIER CITY,Bossier,0,0,0,0,111,0,0,0
BATON ROUGE HEALTH CARE CENTER,195361,5550 THOMAS ROAD,BATON ROUGE,East Baton Rouge,2,0,6,0,88,2,0,0
HERITAGE MANOR SOUTH,195408,9712 MANSFIELD ROAD,SHREVEPORT,Caddo,0,4,0,0,117,0,3,0
ST CLARE MANOR,195590,7435 BISHOP OTT DRIVE,BATON ROUGE,East Baton Rouge,34,2,14,9,128,8,1,0
CLAIBORNE REHABILITATION,195545,6942 HIGHWAY 79,HOMER,Claiborne,0,0,2,0,49,0,0,0
SPRING LAKE SKILLED NURSING AND REHABILITATION,195344,8622 LINE AVENUE,SHREVEPORT,Caddo,5,0,0,0,126,2,0,0
HAMMOND NURSING HOME,195611,501 OLD COVINGTON HIGHWAY,HAMMOND,Tangipahoa,1,0,67,0,99,0,0,0
BRADFORD SKILLED NURSING AND REHABILITATION (THE),195513,3050 BAIRD ROAD,SHREVEPORT,Caddo,34,0,3,3,103,16,0,0
PONTCHARTRAIN HEALTH CARE CENTER,195297,1401 HIGHWAY 190,MANDEVILLE,St. Tammany,1,4,1,1,76,2,2,0
JO ELLEN SMITH CONVALESCENT CENTER,195204,4502 GENERAL MEYER AVENUE,NEW ORLEANS,Orleans,14,2,4,3,116,3,0,0
PATTERSON HEALTHCARE CENTER,195425,910 LIA ST,PATTERSON,St. Mary,0,0,1,0,94,1,4,0
OLLIE STEELE BURDEN MANOR,195566,4250 ESSEN LANE,BATON ROUGE,East Baton Rouge,4,0,0,0,52,0,0,0
ALLEN OAKS NURSING AND REHAB CENTER,195584,909 EAST 6TH AVENUE,OAKDALE,Allen,0,0,0,0,75,0,0,0
EVANGELINE OAKS GUEST HOUSE,195578,240 ARCENEAUX ROAD,CARENCRO,Lafayette,0,0,1,0,113,0,0,0
NORTHEAST LA WAR VETERANS HOME,195628,6700 HIGHWAY 165 NORTH,MONROE,Ouachita,12,0,10,1,126,6,19,0
FERNCREST MANOR LIVING CENTER,195214,14500 HAYNES BLVD.,NEW ORLEANS,Orleans,14,28,1,0,146,23,1,0
COLUMNS COMMUNITY CARE CENTER ( THE ),195478,3025 FOURTH STREET,JONESVILLE,Catahoula,2,0,2,1,79,0,0,0
TWIN OAKS NURSING HOME,195303,506 WEST 5TH STREET,LAPLACE,St. John the Baptist,16,17,3,3,73,7,8,0
GOOD SAMARITAN LIVING CENTER,195612,605 HILLTOP AVENUE,FRANKLINTON,Washington,0,2,0,0,51,0,1,0
VALLEY VIEW HEALTH CARE FACILITY,195557,7119 HIGHWAY 1 SOUTH,MARKSVILLE,Avoyelles,0,5,1,0,76,0,2,0
"BERNICE NURSING AND REHABILITATION CENTER, LLC",195396,101 REEVES STREET,BERNICE,Union,0,0,0,0,90,0,4,0
MARY GOSS NURSING HOME,195596,3300 WHITE STREET,MONROE,Ouachita,0,0,0,0,52,8,0,0
TRI-COMMUNITY NURSING CENTER,195552,7014 HWY 71,PALMETTO,St. Landry,0,0,1,0,52,0,0,0
MAISON ORLEANS HEALTHCARE OF NEW ORLEANS,195174,1420 GENERAL TAYLOR,NEW ORLEANS,Orleans,1,0,3,0,173,0,0,0
FOREST MANOR NURSING AND REHABILITATION CENTER,195490,1330 OCHSNER BOULEVARD,COVINGTON,St. Tammany,6,1,21,16,118,8,0,0
AVALON PLACE,195492,4385 OLD STERLINGTON ROAD,MONROE,Ouachita,0,0,3,0,91,0,3,0
CAMELOT LEISURE LIVING,195516,6818 HIGHWAY 84 WEST,FERRIDAY,Concordia,0,0,0,0,58,0,0,0
KINDER RETIREMENT AND REHABILITATION CENTER,195493,13938 HWY 165,KINDER,Allen,0,0,0,0,67,0,0,0
NEW IBERIA MANOR NORTH,195328,1803 JANE STREET,NEW IBERIA,Iberia,2,3,1,1,58,1,6,0
IBERVILLE OAKS NURSING & REHAB,195329,59355 RIVER WEST DRIVE,PLAQUEMINE,Iberville,0,0,0,0,76,0,0,0
CHATEAU ST. JAMES REHAB AND RETIREMENT,195304,1980 JEFFERSON HWY,LUTCHER,St. James,13,0,2,4,86,7,11,0
OAKS CARE CENTER (THE),195529,50 PINECREST DRIVE,PINEVILLE,Rapides,11,2,6,1,105,12,0,0
ENCORE HEALTHCARE AND REHABILITATION CENTER (THE),195426,19110 CROWLEY-EUNICE HWY,CROWLEY,Acadia,58,12,3,3,64,18,8,0
AMELIA MANOR NURSING HOME,195469,903 CENTER STREET,LAFAYETTE,Lafayette,36,0,8,2,92,3,4,0
COLONIAL CARE RETIREMENT CENTER,195512,14686 OLD HAMMOND HWY.,BATON ROUGE,East Baton Rouge,,,,,,,,
OUR LADY OF PROMPT SUCCOR NURSING FACILITY,195369,954 E PRUDHOMME LANE,OPELOUSAS,St. Landry,30,0,12,3,90,11,4,0
VILLAGE HEALTH CARE AT THE GLEN,195533,403 E. FLOURNOY LUCAS,SHREVEPORT,Caddo,8,0,1,1,98,11,6,0
GONZALES HEALTHCARE CENTER,195327,905 WEST CORNERVIEW ROAD,GONZALES,Ascension,0,0,0,0,89,0,0,0
CARE CENTER THE,195537,11188 FLORIDA BLVD,BATON ROUGE,East Baton Rouge,56,7,3,2,66,17,8,0
METAIRIE HEALTH CARE CENTER,195278,6401 RIVERSIDE DRIVE,METAIRIE,Jefferson,13,2,31,26,70,0,0,0
JEFFERSON MANOR NURSING AND RE,195471,9919 JEFFERSON HWY.,BATON ROUGE,East Baton Rouge,16,12,13,4,87,6,2,0
GRACE NURSING HOME,195258,1181 HWY 19,SLAUGHTER,East Feliciana,4,9,8,3,85,0,1,0
HERITAGE MANOR OF SLIDELL,195220,106 MEDICAL CENTER DRIVE,SLIDELL,St. Tammany,18,17,8,8,85,12,2,0
COLFAX REUNION NURSING AND REHABILITATION CENTER,195430,366 WEBB SMITH DRIVE,COLFAX,Grant,0,0,11,0,99,0,0,0
MAISON DE LAFAYETTE,195365,2707 KALISTE SALOOM ROAD,LAFAYETTE,Lafayette,0,0,1,0,158,0,0,0
CHATEAU D'VILLE REHAB AND RETIREMENT,195491,401 VATICAN DRIVE,DONALDSONVILLE,Ascension,7,0,2,1,80,2,0,0
SHREVEPORT MANOR SKILLED NURSING & REHABILITATION,195515,3302 MANSFIELD ROAD,SHREVEPORT,Caddo,14,0,4,4,67,16,0,0
HERITAGE NURSING CENTER,195518,1745 BAILEY AVENUE,HAYNESVILLE,Claiborne,18,13,6,3,44,8,29,0
ST MARGARET'S DAUGHTERS HOME,195437,3525 BIENVILLE ST,NEW ORLEANS,Orleans,4,0,17,1,84,6,0,0
"WEST CARROLL CARE CENTER, INC",195398,706 ROSS STREET,OAK GROVE,West Carroll,8,1,0,0,72,2,0,0
CAMELOT OF BROUSSARD,195592,418 ALBERTSON PARKWAY,BROUSSARD,Lafayette,0,0,15,0,136,1,0,0
"DESOTO RETIREMENT & REHAB CTR, L L C",195556,635 SCHLEY STREET,MANSFIELD,De Soto,0,0,10,0,58,2,4,0
MAISON DE'VILLE NURSING HOME OF HARVEY,195403,2233 EIGHTH STREET,HARVEY,Jefferson,0,0,5,0,97,21,0,0
DERIDDER RETIREMENT & REHABILITATION CENTER,195535,1420 BLANKENSHIP DR,DERIDDER,Beauregard,0,0,0,0,53,0,1,0
ZACHARY MANOR NURSING AND REHABILITATION CENTER,195362,6161 MAIN STREET,ZACHARY,East Baton Rouge,0,0,6,0,77,0,0,0
ST FRANCIS MEDICAL CENTER SNF,195159,309 JACKSON STREET,MONROE,Ouachita,1,0,0,0,11,1,0,0
HERITAGE MANOR OF VILLE PLATTE,195507,2020 W. MAIN STREET,VILLE PLATTE,Evangeline,0,0,3,0,118,0,0,0
HERITAGE MANOR OF STRATMORE NURSING & REHAB CTR,195486,530 STRATMORE DRIVE,SHREVEPORT,Caddo,0,0,0,0,121,0,4,0
COVENANT HOME,195614,5919 MAGAZINE STREET,NEW ORLEANS,Orleans,0,0,0,0,65,2,0,0
"JENA NURSING AND REHABILITATION CENTER, LLC",195399,5877 AIMWELL ROAD,JENA,LaSalle,0,0,0,0,76,0,0,0
ASCENSION OAKS NURSING & REHABILITATION CENTER,195401,711 W. CORNERVIEW ROAD,GONZALES,Ascension,26,1,9,5,82,5,5,0
WYNHOVEN HEALTH CARE CENTER,195210,1050 MEDICAL CENTER,MARRERO,Jefferson,,,,,,,,
REGENCY HOUSE OF ALEXANDRIA,195637,5131 MASONIC DRIVE,ALEXANDRIA,Rapides,0,0,10,0,50,0,0,0
MANSFIELD NURSING CENTER,195539,1725 MCARTHUR DRIVE,MANSFIELD,De Soto,2,0,9,1,58,4,0,0
GARDENS AND GUARDIAN (THE),195636,1401 COUNTRY CLUB ROAD,LAKE CHARLES,Calcasieu,0,0,0,0,22,0,0,0
LANDMARK NURSING & REHAB CTR,195438,1611 WELLERMAN ROAD,WEST MONROE,Ouachita,,,,,,,,
SOUTHERN OAKS NURSING & REHABILITATION CENTER,195558,1524 GLEN OAKS PLACE,SHREVEPORT,Caddo,0,0,0,0,55,2,0,0
PRESBYTERIAN VILLAGE OF HOMER,195579,3700 HWY. 79 SOUTH,HOMER,Claiborne,0,0,0,0,46,0,0,0
NEW IBERIA MANOR SOUTH,195326,600 BAYARD ST,NEW IBERIA,Iberia,1,2,3,1,53,0,0,0
CONSOLATA HOME,195618,2319 EAST MAIN STREET,NEW IBERIA,Iberia,0,0,0,0,64,0,0,0
EUNICE MANOR,195547,3859 HIGHWAY 190,EUNICE,St. Landry,0,0,3,0,86,0,0,0
ST HELENA PARISH NURSING HOME,195610,32 NORTH 2ND STREET,GREENSBURG,St. Helena,0,0,2,0,55,0,0,0
GREENBRIAR COMMUNITY CARE CENTER,195301,505 ROBERT BLVD.,SLIDELL,St. Tammany,64,0,23,22,81,22,0,0
"WYATT MANOR NURSING AND REHAB CTR, INC",195568,4659 HIGHWAY 505,JONESBORO,Jackson,19,10,9,5,51,5,3,0
CHATEAU TERREBONNE HEALTH CARE,195602,1386 WEST TUNNEL BLVD.,HOUMA,Terrebonne,62,8,20,16,138,21,2,0
WHISPERING PINES COMMUNITY CARE CENTER,195363,309 S LOUISIANA ST,PLAIN DEALING,Bossier,0,0,0,0,54,0,1,0
SAGE SPECIALTY HOSPITAL,195640,8375 FLORIDA BLVD,DENHAM SPRINGS,Livingston,0,0,0,0,0,0,0,0
COLONIAL OAKS LIVING CENTER,195536,4312 ITHACA STREET,METAIRIE,Jefferson,0,0,7,5,62,0,0,0
ST CHRISTINA NURSING AND REHABILITATION CENTER,195613,122 HILLSDALE DRIVE,PINEVILLE,Rapides,,,,,,,,
CYPRESS POINT NURSING & REHABILITATION CENTER,195452,2901 DOUGLAS STREET,BOSSIER CITY,Bossier,0,0,0,9,71,0,0,1
JOHN J HAINKEL JR HOME AND REHABILITATION CENTER,195638,612 HENRY CLAY AVENUE,NEW ORLEANS,Orleans,0,0,1,0,71,3,0,0
HERITAGE MANOR WEST,195447,7060 COTTONWOOD BLVD,SHREVEPORT,Caddo,1,22,14,0,102,5,13,0
ROSEVIEW NURSING AND REHABILITATION CENTER,195496,3405 MANSFIELD ROAD,SHREVEPORT,Caddo,10,0,4,3,99,4,0,0
WEST JEFFERSON HEALTH CARE CENTER,195591,1020 MANHATTAN BLVD,HARVEY,Jefferson,1,0,0,0,101,0,0,0
HERITAGE HEALTHCARE  - HAMMOND,195526,1300 DEREK DRIVE,HAMMOND,Tangipahoa,0,0,4,0,69,0,1,0
OAK LANE WELLNESS & REHABILITATIVE CENTER,195588,1400 W MAGNOLIA,EUNICE,St. Landry,25,0,7,5,79,14,0,0
"WOODLEIGH OF BATON ROUGE, THE",195472,14333 OLD HAMMOND HWY.,BATON ROUGE,East Baton Rouge,1,1,2,2,64,0,0,0
LESLIE LAKES RETIREMENT CENTER,195572,1355 SIXTH STREET,ARCADIA,Bienville,0,0,2,1,87,1,0,0
"RESTHAVEN NURSING & REHAB CENTER, LLC",195414,1103 W MCNEESE,LAKE CHARLES,Calcasieu,0,1,1,0,129,0,0,0
"FARMERVILLE NURSING AND REHABILITATION CENTER, LLC",195439,813 N MAIN ST,FARMERVILLE,Union,33,0,5,5,78,17,0,0
"HARMONY HOUSE NURSING & REHAB CTR, INC",195404,1825 LAUREL ST.,SHREVEPORT,Caddo,,,,,,,,
NATCHITOCHES COMMUNITY CARE CENTER,195405,720 KEYSER AVENUE,NATCHITOCHES,Natchitoches,0,0,2,0,85,2,0,0
LAFON NURSING FACILITY OF THE HOLY FAMILY,195632,6900 CHEF MENTEUR HWY,NEW ORLEANS,Orleans,2,0,0,0,105,1,0,0
ST AGNES HEALTHCARE AND REHAB CENTER,195313,606 LATIOLAIS ROAD,BREAUX BRIDGE,St. Martin,0,0,1,1,85,0,0,0
MAISON DU MONDE LIVING CENTER,195567,4000 RODEO ROAD,ABBEVILLE,Vermilion,0,0,1,0,108,0,0,0
MARRERO HEALTHCARE CENTER,195336,5301 AUGUST AVENUE,MARRERO,Jefferson,0,0,0,0,57,0,0,0
PLANTATION OAKS NURSING & REHABILITATION CENTER,195504,110 MAPLE STREET,WISNER,Franklin,25,0,7,5,49,0,0,0
CHATEAU LIVING CENTER,195184,716 VILLAGE ROAD,KENNER,Jefferson,1,0,11,0,175,0,0,0
LASALLE NURSING HOME,195466,139 NINTH STREET,JENA,LaSalle,0,0,0,0,72,0,0,0
ORMOND NURSING & CARE CENTER,195221,22 PLANTATION ROAD,DESTREHAN,St. Charles,34,62,42,16,103,8,4,0
CARRINGTON PLACE OF BATON ROUGE,195483,8225 SUMMA AVENUE,BATON ROUGE,East Baton Rouge,,,,,,,,
TERREBONNE GENERAL MED CTR SNF,195185,8166 MAIN STREET,HOUMA,Terrebonne,0,0,0,0,3,0,0,0
COURTYARD OF NATCHITOCHES,195213,708 KEYSER AVENUE,NATCHITOCHES,Natchitoches,0,0,0,0,93,1,0,0
LEGACY NURSING AND REHABILITATION OF FRANKLIN,195388,1907 CHINABERRY STREET,FRANKLIN,St. Mary,0,2,3,3,88,0,1,0
ST JOSEPH OF HARAHAN,195374,405 FOLSE DRIVE,HARAHAN,Jefferson,7,3,7,3,129,3,0,0
CARRINGTON PLACE OF SPRINGHILL,195353,215 FIRST STREET N E,SPRINGHILL,Webster,0,0,0,0,55,9,0,0
SOUTH LAFOURCHE NURSING & REHAB,195305,146 E. 28TH STREET,CUT OFF,Lafourche,0,12,9,0,96,1,5,0
TOLEDO RETIREMENT AND REHABILITATION CENTER,195506,1009 N OBRIE STREET,ZWOLLE,Sabine,0,1,1,0,31,0,3,0
LAGNIAPPE HEALTHCARE,195593,1408 SUMMERLIN LANE,BASTROP,Morehouse,0,0,0,0,78,1,0,0
ST ANTHONY'S NURSING HOME,195570,6001 AIRLINE HWY.,METAIRIE,Jefferson,18,0,4,4,53,3,0,0
HERITAGE MANOR OF HOUMA,195485,852 CENTURION LANE,HOUMA,Terrebonne,0,0,14,0,102,0,0,0
THIBODAUX HEALTHCARE AND REHABILITATION CENTER,195319,1300 LAFOURCHE DRIVE,THIBODAUX,Lafourche,0,0,15,14,46,25,4,0
HILLTOP NURSING & REHABILITATION CENTER,195390,336 EDGEWOOD DRIVE,PINEVILLE,Rapides,33,0,0,0,101,0,6,0
NAOMI HEIGHTS NURSING & REHABILITATION CENTER,195420,2421 E. TEXAS AVENUE,ALEXANDRIA,Rapides,25,12,3,2,86,20,28,0
HERITAGE MANOR OF MANDEVILLE,195279,1820 W. CAUSEWAY APPROACH,MANDEVILLE,St. Tammany,38,78,10,11,96,8,22,0
GUEST HOUSE (THE),195473,10145 FLORIDA BLVD.,BATON ROUGE,East Baton Rouge,1,0,0,0,123,4,0,0
"ST FRANCISVILLE COUNTRY MANOR, LLC",195508,15243 HWY 10 EAST,SAINT FRANCISVILLE,West Feliciana,0,0,7,0,115,0,0,0
RIDGECREST COMMUNITY CARE CENTER,195528,1616 WELLERMAN ROAD,WEST MONROE,Ouachita,1,1,3,0,84,0,2,0
GOOD SAMARITAN REHABILITATION AND NURSING CTR,195356,4021 CADILLAC STREET,NEW ORLEANS,Orleans,36,0,30,10,89,17,0,0
"ROSEPINE RETIREMENT & REHAB CENTER, LLC",195416,18364 CENTRAL AVENUE,ROSEPINE,Vernon,0,1,0,0,72,0,0,0
HOLLY HILL HOUSE,195431,100 KINGSTON ROAD,SULPHUR,Calcasieu,,,,,,,,
LANDMARK OF ACADIANA,195487,1710 SMEDE HWY,SAINT MARTINVILLE,St. Martin,0,0,5,0,120,0,0,0
SOUTHEAST LOUISIANA WAR VETERANS HOME,195625,4080 W AIRLINE HWY,RESERVE,St. John the Baptist,1,0,9,5,88,14,0,0
MATTHEWS MEMORIAL HEALTH CARE CENTER,195600,5100 JACKSON STREET EXT.,ALEXANDRIA,Rapides,41,16,8,1,105,2,8,0
GARDEN COURT HEALTH AND REHABILITATION CENTER,195247,4405 AIRLINE DRIVE,BOSSIER CITY,Bossier,0,0,0,0,35,0,0,0
"BATON ROUGE GEN MED CTR, SNF",195139,3600 FLORIDA BLVD.,BATON ROUGE,East Baton Rouge,0,0,2,1,9,10,3,0
BAYOU VISTA COMMUNITY CARE CENTER,195603,323 EVERGREEN HWY,BUNKIE,Avoyelles,0,0,2,0,46,0,0,0
GUEYDAN MEMORIAL GUEST HOME,195458,1201 THIRD ST,GUEYDAN,Vermilion,0,0,0,0,54,0,0,0
BELLE TECHE NURSING & REHABILITATION CENTER,195460,1306 W ADMIRAL DOYLE DR,NEW IBERIA,Iberia,24,0,9,7,102,18,0,0
TRINITY NEUROLOGIC REHABILITATION CENTER,195177,1400 LINDBERG DRIVE,SLIDELL,St. Tammany,0,0,11,0,90,1,1,0
JEFFERSON HEALTHCARE CENTER,195272,2200 JEFFERSON HWY,JEFFERSON,Jefferson,11,26,5,2,144,0,0,0
PRAIRIE MANOR NURSING HOME,195577,1050 EDWIN ELLIOTT DRIVE,PINE PRAIRIE,Evangeline,0,0,0,0,86,0,0,0
LEGACY NURSING AND REHABILITATION OF WINNSBORO,195392,804 POLK STREET,WINNSBORO,Franklin,0,0,0,0,70,0,0,0
