HUNTERDON CARE CENTER,315226,1 LEISURE COURT,FLEMINGTON,Hunterdon,3,2,17,2,139,8,0,2
WINDSOR GARDENS CARE CENTER,315178,140 PARK AVE,EAST ORANGE,Essex,63,0,21,13,144,13,1,0
DWELLING PLACE AT ST CLARES,315019,400 WEST BLACKWELL ST,DOVER,Morris,0,0,5,0,18,3,1,0
PHOENIX CENTER FOR REHABILITATION AND PEDIATRICS,315229,1433 RINGWOOD AVE,HASKELL,Passaic,3,5,5,1,176,7,1,0
MAYWOOD CENTER FOR HEALTH AND REHABILITATION,315386,100 WEST MAGNOLIA AVENUE,MAYWOOD,Bergen,92,5,23,19,93,37,2,0
HOUSE OF THE GOOD SHEPHERD,315422,798 WILLOW GROVE STREET,HACKETTSTOWN,Warren,,,,,,,,
MAJESTIC CENTER FOR REHAB & SUB-ACUTE CARE,315205,TWO COOPER PLAZA,CAMDEN,Camden,54,0,8,8,91,11,0,0
MILFORD MANOR,315276,69 MAPLE ROAD,WEST MILFORD,Passaic,4,0,42,19,88,5,0,0
EMERSON HEALTH CARE CENTER,315360,100 KINDERKAMACK ROAD,EMERSON,Bergen,18,2,60,1,112,21,0,1
HUDSONVIEW HEALTH CARE CENTER,315112,9020 WALL STREET,NORTH BERGEN,Hudson,22,24,24,3,205,27,0,0
"PARKER AT SOMERSET, INC",315253,15 DELLWOOD LANE,SOMERSET,Somerset,11,0,23,3,105,6,0,0
REHAB AT RIVER'S EDGE,315140,633 ROUTE 28,RARITAN,Somerset,18,0,21,8,101,3,1,0
ASHBROOK CARE & REHABILITATION CENTER,315064,1610 RARITAN ROAD,SCOTCH PLAINS,Union,15,2,7,6,91,21,0,0
MANAHAWKIN CONV CTR,315206,1211 RT 72 WEST,MANAHAWKIN,Ocean,12,3,21,19,96,5,2,0
CLOVER MEADOWS HEALTHCARE AND REHABILITATION CENTE,315113,112 FRANKLIN CORNER ROAD,LAWRENCEVILLE,Mercer,53,0,27,21,74,18,9,0
ABINGDON CARE & REHABILITATION CENTER,315141,303 ROCK AVE,GREEN BROOK,Somerset,24,1,8,4,114,4,0,0
CANTERBURY AT CEDAR GROVE,315204,398 POMPTON AVENUE,CEDAR GROVE,Essex,40,13,11,8,102,40,6,0
SEASHORE GARDENS LIVING CENTER,315340,22 WEST JIMMIE LEEDS ROAD,GALLOWAY TOWNSHIP,Atlantic,2,0,5,0,105,11,0,0
HARBORAGE (THE),315307,7600 RIVER ROAD,NORTH BERGEN,Hudson,137,5,60,41,168,55,47,2
ANDOVER SUBACUTE AND REHAB I,315044,1 O'BRIEN LANE,ANDOVER,Sussex,48,34,29,19,105,22,11,1
PREFERRED CARE AT MERCER,315487,1201 PARKWAY AVENUE,EWING,Mercer,,,,,,,,
TALLWOODS CARE CENTER,315462,18 BUTLER BOULEVARD,BAYVILLE,Ocean,40,3,22,11,157,16,0,0
CARE ONE AT WALL,315485,2621 HIGHWAY 138,WALL,Monmouth,15,14,36,17,96,15,9,0
ROOSEVELT CARE CENTER AT OLD BRIDGE,315509,1133 MARLBORO ROAD,OLD BRIDGE,Middlesex,10,0,36,0,151,5,0,1
LAUREL BAY HEALTH & REHABILITATION CENTER,315437,32 LAUREL AVENUE,KEANSBURG,Monmouth,14,2,9,2,91,3,1,0
WEDGWOOD GARDENS CARE CENTER,315504,3419 HIGHWAY 9,FREEHOLD,Monmouth,5,0,8,1,81,10,0,0
POWERBACK REHABILITATION MOORESTOWN,315517,212 MARTER AVENUE,MOORESTOWN,Burlington,37,0,19,11,84,51,0,0
CONTINUING CARE AT LANTERN HILL,315523,537 MOUNTAIN AVENUE,NEW PROVIDENCE,Union,1,4,3,0,27,2,6,0
ALLENDALE NURSING HOME,315497,85 HARRETON ROAD,ALLENDALE,Bergen,77,2,33,22,163,37,1,0
CARE ONE AT EAST BRUNSWICK,315472,599 CRANBURY ROAD,EAST BRUNSWICK,Middlesex,11,0,7,3,87,14,0,0
"ELMS OF CRANBURY, THE",315451,61 MAPLEWOOD AVENUE,CRANBURY,Middlesex,27,14,6,3,96,13,3,0
PEACE CARE ST JOSEPH'S,315452,537 PAVONIA AVENUE,JERSEY CITY,Hudson,9,5,14,2,89,7,1,0
JEWISH HOME AT ROCKLEIGH,315473,10 LINK DRIVE,ROCKLEIGH,Bergen,92,0,73,23,136,70,12,0
ATRIUM POST ACUTE CARE OF WOODBURY,315521,467 COOPER STREET,WOODBURY,Gloucester,78,4,9,8,40,30,20,0
LIONS GATE,315499,1100 LAUREL OAK ROAD,VOORHEES,Camden,56,0,33,14,80,51,41,1
CARE ONE AT TEANECK,315502,544 TEANECK ROAD,TEANECK,Bergen,3,2,10,1,82,12,0,0
SHORE MEADOWS REHAB & NURSING CENTER,315454,231 WARNER STREET,TOMS RIVER,Ocean,7,1,3,0,104,11,0,0
COMPLETE CARE AT SHORROCK,315453,75 OLD TOMS RIVER ROAD,BRICK,Ocean,12,2,11,4,101,7,0,0
ALARIS HEALTH AT THE FOUNTAINS,315476,595 COUNTY AVENUE,SECAUCUS,Hudson,56,2,9,7,250,30,2,1
CARE ONE AT WAYNE - SNF,315477,493 BLACK OAK RIDGE ROAD,WAYNE,Passaic,3,1,8,1,50,6,1,0
ROYAL HEALTH GATE NRSG REHAB,315455,1314 BRUNSWICK AVENUE,TRENTON,Mercer,16,5,11,8,93,9,1,0
"VENETIAN CARE & REHABILITATION CENTER, THE",315518,275 JOHN T O'LEARY BOULEVARD,SOUTH AMBOY,Middlesex,15,0,1,0,140,10,0,0
SOUTHERN OCEAN MEDICAL CENTER,315478,1140 ROUTE 72 WEST,MANAHAWKIN,Ocean,0,2,0,0,11,0,1,0
MERIDIAN SUBACUTE REHABILITATION,315501,1725 MERIDIAN TRAIL,WALL,Monmouth,29,0,17,13,96,39,10,1
MYSTIC MEADOWS REHAB & NURSING CENTER,315456,151 NINTH AVENUE,LITTLE EGG HARBOR TW,Ocean,27,5,9,4,105,16,0,1
CARE ONE AT LIVINGSTON,315479,68 PASSAIC AVENUE,LIVINGSTON,Essex,3,0,4,1,70,18,0,0
ROYAL SUITES HEALTH CARE & REHABILITATION,315503,214 WEST JIMMIE LEEDS ROAD,GALLOWAY TOWNSHIP,Atlantic,61,0,29,5,132,23,0,0
ATRIUM POST ACUTE CARE OF HAMILTON,315519,3 HAMILTON HEALTH PLACE,HAMILTON,Mercer,53,7,21,16,24,27,21,0
"JEWISH HOME FOR REHABILITATION AND NURSING, THE",315528,1151 WEST MAIN STREET,FREEHOLD,Monmouth,15,6,35,8,86,21,6,0
POWERBACK REHABILITATION PISCATAWAY,315522,10 STERLING DRIVE,PISCATAWAY,Middlesex,,,,,,,,
ATRIUM POST ACUTE CARE OF PARK RIDGE,315438,120 NOYES DRIVE,PARK RIDGE,Bergen,96,9,61,31,76,63,3,1
MANORCARE HEALTH SERVICES - VOORHEES,315500,1086 DUMONT CIRCLE,VOORHEES,Camden,46,10,79,16,77,21,6,0
"POWERBACK REHABILITATION, ROUTE 73",315513,113 SOUTH ROUTE 73,VOORHEES,Camden,8,0,8,0,95,6,3,0
UNITED METHODIST COMMUNITIES AT BRISTOL GLEN,315439,200 BRISTOL GLEN DRIVE,NEWTON,Sussex,0,0,0,0,50,20,0,0
ATRIUM POST ACUTE CARE OF MATAWAN,315463,38 FRENEAU AVENUE,MATAWAN,Monmouth,59,1,24,13,85,40,5,0
BOONTON CARE CENTER,315492,199 POWERVILLE ROAD,BOONTON,Morris,47,1,37,16,48,31,5,0
ADVANCED SUBACUTE REHABILITATION CENTER AT SEWELL,315516,685 SALINA ROAD,SEWELL,Gloucester,,,,,,,,
CARE ONE AT MADISON AVENUE,315488,151 MADISON AVENUE,MORRISTOWN,Morris,7,17,21,5,77,5,3,0
TRINITAS HOSPITAL,315442,655 EAST JERSEY STREET,ELIZABETH,Union,52,57,24,13,95,34,41,0
CHILDRENS SPECIALIZED HOSPITAL TOMS RIVER,315443,94 STEVENS ROAD,TOMS RIVER,Ocean,2,2,0,0,18,13,10,0
SYCAMORE LIVING AT EAST HANOVER,315529,ONE SOUTH RIDGEDALE AVENUE,EAST HANOVER,Morris,2,0,0,0,36,0,0,0
BRIDGEWAY CARE AND REHAB CENTER AT HILLSBOROUGH,315510,395 AMWELL ROAD,HILLSBOROUGH,Somerset,37,30,36,9,100,53,7,0
MANHATTANVIEW NURSING HOME,315465,3200 HUDSON AVENUE,UNION CITY,Hudson,1,0,3,0,80,2,0,0
"ARBOR AT LAUREL CIRCLE, THE",315445,100 MONROE STREET,BRIDGEWATER,Somerset,21,0,10,6,31,12,2,0
LITTLE BROOK NURSING AND CONVALESCENT HOME,315467,78 SLIKER ROAD,CALIFON,Hunterdon,0,0,0,0,31,3,0,0
CEDAR CREST/MOUNTAINVIEW GARDENS,315491,4 CEDAR CREST VILLAGE DRIVE,POMPTON PLAINS,Morris,10,8,33,6,80,7,13,0
SOMERSET WOODS REHABILITATION & NURSING CENTER,315520,780 OLD NEW BRUNSWICK ROAD,SOMERSET,Somerset,67,2,3,3,108,20,0,0
CARE ONE AT MORRIS,315468,100 MAZDABROOK ROAD,PARSIPPANY TROY HILL,Morris,24,7,23,2,77,3,1,0
BAPTIST HOME OF SOUTH JERSEY,315448,303 BANK AVE,RIVERTON,Burlington,27,46,23,3,40,15,15,0
ALARIS HEALTH AT THE CHATEAU,315494,96 PARKWAY,ROCHELLE PARK,Bergen,0,0,3,2,52,6,0,0
CONTINUING CARE AT SEABROOK,315469,3002 ESSEX ROAD,TINTON FALLS,Monmouth,2,5,18,2,40,3,13,0
ALARIS HEALTH AT WEST ORANGE,315449,5 BROOK END DRIVE,WEST ORANGE,Essex,6,0,13,0,92,3,1,0
CARE ONE AT HANOVER TOWNSHIP,315511,101 WHIPPANY ROAD,WHIPPANY,Morris,0,0,6,3,44,8,1,0
ST CATHERINE OF SIENA,315471,7 RYERSON AVENUE,CALDWELL,Essex,14,0,6,0,18,19,0,0
COMMUNITY MEDICAL CENTER TCU,315490,99 ROUTE 37 WEST,TOMS RIVER,Ocean,0,0,2,0,18,2,0,0
EGG HARBOR CARE CENTER,315514,6818 DELILAH ROAD,EGG HARBOR TOWNSHIP,Atlantic,28,12,62,28,,14,20,2
NEW JERSEY VETERANS MEMORIAL VINELAND,315496,524 NORTH WEST BLVD,VINELAND,Cumberland,6,0,26,3,261,38,0,0
WINCHESTER GARDENS HEALTH CARE CENTER,315527,333 ELMWOOD AVENUE,MAPLEWOOD,Essex,1,0,2,0,19,5,0,0
LAUREL BROOK REHABILITATION AND HEALTHCARE CENTER,315524,3718 CHURCH ROAD,MOUNT LAUREL,Burlington,77,97,50,18,165,44,29,0
VICTORIA MANOR,315508,3809 BAYSHORE ROAD,NORTH CAPE MAY,Cape May,52,1,30,17,72,25,0,0
"VILLA AT FLORHAM PARK, INC THE",315480,190  PARK AVENUE,FLORHAM PARK,Morris,5,1,10,8,25,7,0,0
"ATRIUM AT NAVESINK HARBOR, THE",315515,40 RIVERSIDE AVENUE,RED BANK,Monmouth,4,4,129,3,39,12,1,0
RENAISSANCE PAVILION,315495,61 W JIMMIE LEEDS ROAD,POMONA,Atlantic,7,2,0,0,12,21,0,0
LUTHERAN SOCIAL MINISTRIES CRANES MILL,315457,459 PASSAIC AVENUE,WEST CALDWELL,Essex,0,0,1,0,27,2,0,0
ATRIUM POST ACUTE CARE OF LIVINGSTON,315526,348 EAST CEDAR STREET,LIVINGSTON,Essex,26,0,10,10,33,26,0,0
NEW VISTA,315458,300 BROADWAY,NEWARK,Essex,318,72,3,2,273,10,0,0
PLAZA HEALTHCARE & REHABILITATION CENTER,315483,456 RAHWAY AVENUE,ELIZABETH,Union,55,0,30,19,81,22,0,0
HOBOKEN UNIVERSITY MEDICAL CENTER TCU,315512,308 WILLOW AVENUE,HOBOKEN,Hudson,0,0,0,0,4,5,2,0
CLARA MAASS MEDICAL CENTER,315505,ONE CLARA MAASS DRIVE,BELLEVILLE,Essex,0,0,1,1,14,1,0,0
NEW JERSEY VETERANS MEMORIAL HOME MENLO,315459,132 EVERGREEN RD,EDISON,Middlesex,13,4,28,10,169,31,0,1
HACKENSACK MERIDIAN HEALTH PROSPECT HEIGHTS CARE C,315460,336 PROSPECT AVE,HACKENSACK,Bergen,,,,,,,,
"HUDSON HILLS SENIOR LIVING, LLC",315525,3161 KENNEDY BLVD,NORTH BERGEN,Hudson,16,14,18,6,49,13,1,0
STONEBRIDGE AT MONTGOMERY HEALTH CARE CENTER,315486,100 HOLLINSHEAD SPRING ROAD,SKILLMAN,Somerset,,,,,,,,
CARE ONE AT MOORESTOWN,315482,895 WESTFIELD ROAD,MOORESTOWN,Burlington,10,7,6,0,52,4,5,0
MANORCARE HEALTH SERVICES-WASHINGTON TOWNSHIP,315506,378 FRIES MILL ROAD,SEWELL,Gloucester,11,1,24,2,88,12,1,0
"BARNERT SUBACUTE REHABILITATION CENTER, LLC",315507,680 BROADWAY SUITE 301,PATERSON,Passaic,0,0,0,0,28,0,0,0
VIRTUA H & R C AT BERLIN,315461,100 LONG-A-COMING LANE,BERLIN,Camden,4,0,12,0,87,12,0,0
