Provider Name,Federal Provider Number,Provider Address,Provider City,County,Residents Total Confirmed COVID-19,Residents Total Suspected COVID-19,Residents Total All Deaths,Residents Total COVID-19 Deaths,Total Number of Occupied Beds,Staff Total Confirmed COVID-19,Staff Total Suspected COVID-19,Staff Total COVID-19 Deaths
SUNPLEX SUB-ACUTE CENTER,255244,6520 SUNSCOPE DRIVE,OCEAN SPRINGS,Jackson,0,0,0,0,45,0,0,0
PINE CREST GUEST HOME INC,255210,133 PINE STREET,HAZLEHURST,Copiah,0,4,0,0,51,0,0,0
RIVER HEIGHTS HEALTHCARE CENTER,255217,402 ARNOLD AVENUE,GREENVILLE,Washington,,,,,,,,
ARBOR WALK HEALTHCARE CENTER,255219,570 NORTH SOLOMON STREET,GREENVILLE,Washington,,,,,,,,
SARDIS COMMUNITY  NH,255279,613 EAST LEE STREET,SARDIS,Panola,0,0,4,0,54,0,0,0
LAMAR HEALTHCARE & REHABILITATION CENTER,255338,6428 US HIGHWAY 11,LUMBERTON,Lamar,,,,,,,,
COURTYARD REHABILITATION AND HEALTHCARE,255145,501 SOUTH LOCUST STREET,MCCOMB,Pike,,,,,,,,
WILLOW CREEK RETIREMENT CENTER,255300,49 WILLOW CREEK LANE,JACKSON,Hinds,0,0,0,0,79,0,0,0
MS CARE CENTER OF DEKALB,255251,220 WILLOW AVENUE,DE KALB,Kemper,34,4,7,6,48,19,1,1
WINDHAM HOUSE OF HATTIESBURG,255265,37 HILLCREST DRIVE,HATTIESBURG,Forrest,0,1,0,0,52,0,5,0
VICKSBURG CONVALESCENT CENTER,255253,1708 CHERRY STREET,VICKSBURG,Warren,0,0,0,0,77,0,0,0
PASS CHRISTIAN HEALTH AND REHABILIATION CENTER,255287,538 MENGE AVENUE,PASS CHRISTIAN,Harrison,0,0,0,0,52,0,0,0
"BAPTIST NURSING HOME-CALHOUN, INC",25A233,152 BURKE CALHOUN CITY ROAD,CALHOUN CITY,Calhoun,,,,,,,,
REGINALD P WHITE NURSING FACILITY,25A123,1451 NORTH LAKELAND DRIVE/PO BOX 4128,MERIDIAN,Lauderdale,24,0,7,7,43,21,0,0
JEFFERSON DAVIS COMMUNITY HOSPITAL ECF,255050,1320 WINFIELD STREET,PRENTISS,Jefferson Davis,0,0,1,1,50,1,1,0
METHODIST SPECIALTY CARE CENTER,25A414,1 LAYFAIR DRIVE SUITE 500,FLOWOOD,Rankin,0,0,0,0,60,0,0,0
WALTER B CROOK NURSING FACILITY,25A422,840 NORTH OAK AVENUE,RULEVILLE,Sunflower,0,0,0,0,59,0,0,0
YAZOO CITY REHABILITATION AND HEALTHCARE CENTER,255146,925 CALHOUN AVENUE,YAZOO CITY,Yazoo,7,1,9,1,153,10,17,0
SINGING RIVER SKILLED NURSING FACILITY,255346,2809 DENNY AVENUE,PASCAGOULA,Jackson,,,,,,,,
AZALEA GARDENS NURSING CENTER,255233,530 HALL ST,WIGGINS,Stone,0,0,1,0,73,1,0,0
NEW ALBANY HEALTH & REHAB CENTER,255268,118 SOUTH GLENFIELD ROAD,NEW ALBANY,Union,0,0,0,0,94,0,0,0
TISHOMINGO MANOR,255218,230 KHAKI STREET,IUKA,Tishomingo,0,5,6,0,97,0,1,0
GLENBURNEY HEALTH CARE AND REHABILITATION CENTER,255173,555 JOHN R. JUNKIN DRIVE,NATCHEZ,Adams,7,4,0,0,68,5,12,0
STARKVILLE MANOR HEALTH CARE AND REHABILITATION CE,255172,1001 HOSPITAL ROAD,STARKVILLE,Oktibbeha,2,18,2,1,107,0,27,1
COMFORT CARE NURSING CENTER,25A381,1100 WEST DRIVER,LAUREL,Jones,22,1,1,1,113,20,2,0
BOYINGTON HEALTH AND REHABILITATION,255092,1530 BROAD AVE,GULFPORT,Harrison,2,0,1,1,124,1,0,0
"BELHAVEN SENIOR CARE, LLC",255276,1004 NORTH ST,JACKSON,Hinds,6,0,0,0,53,1,0,0
THE NICHOLS CENTER,255304,1308 HIGHWAY 51 NORTH,MADISON,Madison,0,1,0,0,49,3,1,0
DIVERSICARE OF BROOKHAVEN,255175,519 BROOKMAN DRIVE,BROOKHAVEN,Lincoln,25,2,9,9,39,15,1,1
WISTERIA GARDENS,255325,5420 HIGHWAY 80 EAST,PEARL,Rankin,0,0,0,0,37,0,0,0
JONES CO REST HOME,255336,683 COUNTY HOME ROAD,ELLISVILLE,Jones,0,1,3,0,103,1,2,0
BEDFORD CARE CENTER OF PETAL,255149,908 S GEORGE STREET,PETAL,Forrest,0,3,0,0,56,2,2,0
RIVER PLACE NURSING CENTER,255305,"1126 EARL FRYE BOULEVARD, SOUTH",AMORY,Monroe,0,1,1,0,45,0,4,0
VAIDEN COMMUNITY LIVING CENTER,255283,868 MULBERRY STREET,VAIDEN,Carroll,,,,,,,,
MANHATTAN NURSING AND REHABILITATION CENTER LLC,255115,4540 MANHATTAN RD,JACKSON,Hinds,0,0,5,0,157,0,0,0
"POPLAR SPRINGS NURSING CTR, LLC",255315,6615 P0PLAR SPRINGS DR,MERIDIAN,Lauderdale,0,3,13,0,87,1,10,0
GULFPORT CARE CENTER,255341,11240 CANAL ROAD,GULFPORT,Harrison,0,2,5,0,62,0,0,0
RULEVILLE NURSING AND REHABILITATION CENTER LLC,255113,800 STANSEL DR/P O BOX 368,RULEVILLE,Sunflower,0,0,0,0,119,1,0,0
PLEASANT HILLS COM LIV CENTER,255112,1600 RAYMOND RD,JACKSON,Hinds,0,1,1,0,96,0,1,0
HERITAGE HOUSE NURSING CENTER,255284,3103 WISCONSIN AVENUE,VICKSBURG,Warren,36,14,6,5,52,7,14,0
WEST POINT COMMUNITY LIVING CENTER,255111,1122 N ESHMAN AVENUE,WEST POINT,Clay,0,0,0,0,75,2,0,0
BEDFORD CARE CENTER OF MARION,255328,6434 A DALE DR,MARION,Lauderdale,,,,,,,,
WINSTON COUNTY NURSING HOME,255072,17560 EAST MAIN STREET,LOUISVILLE,Winston,,,,,,,,
THE GROVE,255316,11 PECAN DRIVE,COLUMBIA,Marion,0,2,4,2,76,0,0,0
OCEAN SPRINGS HEALTH & REHABILITATION CENTER,255142,1199 OCEAN SPRINGS ROAD,OCEAN SPRINGS,Jackson,0,2,2,0,99,0,1,0
LANDMARK NURSING AND REHAB CENTER,255320,100 LAUREN DRIVE,BOONEVILLE,Prentiss,11,28,4,2,64,2,11,0
MEMORIAL STONE COUNTY NURSING & REHABILITATION CTR,255308,1436 EAST CENTRAL AVENUE,WIGGINS,Stone,0,5,1,0,40,0,7,0
DESOTO HEALTHCARE CENTER,255296,7805 SOUTHCREST PARKWAY,SOUTHAVEN,DeSoto,0,0,16,0,93,0,0,0
WINONA MANOR HEALTH CARE AND REHABILITATION CENTER,255171,627 MIDDLETON ROAD,WINONA,Montgomery,,,,,,,,
NATCHEZ REHABILITATION AND HEALTHCARE CENTER,255226,344 ARLINGTON AVENUE,NATCHEZ,Adams,0,0,0,0,47,0,0,0
BEDFORD CARE CENTER OF MENDENH,255150,925 WEST MANGUM AVENUE,MENDENHALL,Simpson,0,0,0,0,0,0,0,0
GLEN OAKS NURSING CENTER,255181,55 SUSANNE STREET,LUCEDALE,George,0,0,0,0,47,0,0,0
MS CARE CENTER OF MORTON,255250,96 OLD HIGHWAY 80 EAST/P. O. BOX 459,MORTON,Scott,17,34,14,29,110,19,37,0
GOLDEN AGE NURSING HOME,255307,2901 HIGHWAY 82 EAST,GREENWOOD,Leflore,1,0,1,0,123,1,0,0
MARTHA COKER GREEN HOUSE HOME,255327,2041 GRAND AVE,YAZOO CITY,Yazoo,,,,,,,,
HUMPHREYS CO NURSING CENTER,255259,500 CCC ROAD,BELZONI,Humphreys,11,3,3,2,41,0,3,0
BEDFORD CARE CENTER OF NEWTON,255153,1009 SOUTH MAIN STREET,NEWTON,Newton,0,0,1,0,96,3,5,0
BEDFORD ALZHEIMER'S CARE CENTER,25A416,298 CAHAL STREET,HATTIESBURG,Forrest,0,0,1,0,54,0,0,0
THE OAKS REHABILITATION AND HEALTHCARE CENTER,255261,3716 HIGHWAY 39 NORTH,MERIDIAN,Lauderdale,33,37,1,1,72,11,14,1
HILLTOP MANOR HEALTH AND REHABILITATION CENTER,255260,101 KIRKLAND STREET,UNION,Neshoba,,,,,,,,
ADAMS COUNTY NURSING CENTER,255169,587 JOHN R JUNKIN DRIVE,NATCHEZ,Adams,39,0,8,8,63,14,0,0
TREND HEALTH & REHAB OF MERIDIAN LLC,255348,517 33RD STREET,MERIDIAN,Lauderdale,15,4,5,4,41,10,1,0
BRUCE COMMUNITY LIVING CENTER,255324,176 HIGHWAY 9 SOUTH  BOX 1280,BRUCE,Calhoun,0,0,0,0,34,0,0,0
RIVERVIEW NURSING & REHABILITATION CENTER,255216,1600 WEST CLAIBORNE AVENUE EXTENDED,GREENWOOD,Leflore,0,0,1,1,65,0,0,0
JAMES T CHAMPION,25A418,1455 NORTH LAKELAND DRIVE,MERIDIAN,Lauderdale,18,1,2,1,94,16,0,0
"LEAKESVILLE REHABILITATION AND NURSING CENTER, INC",255179,1300 MELODY LANE/PO BOX 640,LEAKESVILLE,Greene,0,0,0,0,52,2,0,0
CARTHAGE HEALTH & REHAB CENTER,255345,1065 EAST FRANKLIN STREET,CARTHAGE,Leake,0,0,4,0,40,0,4,0
HAVEN HALL HEALTH CARE CENTER,255221,101 MILLS STREET,BROOKHAVEN,Lincoln,0,0,0,0,68,2,0,0
SINGING RIVER HEALTH AND REHABILITATION CENTER,255174,3401 MAIN STREET,MOSS POINT,Jackson,37,0,5,4,98,12,0,0
WOODLANDS REHABILITATION AND HEALTHCARE CENTER,255148,102 WOODCHASE PARK DRIVE,CLINTON,Hinds,56,13,8,8,98,8,7,1
CLEVELAND NURSING AND REHABILITATION CENTER,255114,4036 HIGHWAY 8 EAST,CLEVELAND,Bolivar,1,0,2,3,116,0,0,0
JEFFERSON COUNTY NURSING HOME,255164,910 MAIN STREET,FAYETTE,Jefferson,0,0,0,0,47,0,1,0
BRANDON NURSING AND REHABILITATION CENTER,255106,355 CROSSGATE BLVD,BRANDON,Rankin,0,0,0,0,220,0,0,0
TRINITY HEALTHCARE CENTER,255222,230 AIRLINE ROAD,COLUMBUS,Lowndes,0,0,0,0,54,0,0,0
ASHLAND HEALTH AND REHABILITATION,255138,16056 BOUNDRY DRIVE/PO BOX 490,ASHLAND,Benton,,,,,,,,
MS CARE CENTER OF GREENVILLE,255252,1221 EAST UNION STREET,GREENVILLE,Washington,5,0,10,1,98,4,0,0
WHITFIELD NURSING HOME,25E015,2101 EAST PROPER STREET,CORINTH,Alcorn,0,0,0,0,20,0,0,0
"LEXINGTON MANOR SENIOR CARE, LLC",255091,56 ROCKPORT ROAD,LEXINGTON,Holmes,7,0,2,2,46,8,0,0
CARE CENTER OF LAUREL,255095,935 WEST DR,LAUREL,Jones,23,28,9,5,93,13,29,0
DIVERSICARE OF EUPORA,255117,156 E WALNUT AVE,EUPORA,Webster,0,0,0,0,109,1,2,0
LAKELAND NURSING AND REHABILITATION CENTER LLC,255116,3680 LAKELAND LANE,JACKSON,Hinds,0,1,0,0,77,0,3,0
"HILLCREST NURSING CENTER, LLC",255278,1401 FIRST AVENUE NORTHEAST,MAGEE,Simpson,0,0,4,0,105,0,0,0
PEARL RIVER CO NURSING HOME,25A156,305 WEST MOODY STREET,POPLARVILLE,Pearl River,0,0,0,0,103,0,0,0
THE PILLARS OF BILOXI,255093,2279 ATKINSON ROAD,BILOXI,Harrison,0,0,3,0,159,0,0,0
PERRY COUNTY NURSING CENTER,255159,202 BAY AVENUE WEST,RICHTON,Perry,0,0,0,0,50,0,0,0
BILLDORA SENIOR CARE,255243,314 ENOCHS ST,TYLERTOWN,Walthall,0,0,0,0,54,0,0,0
BEDFORD CARE CENTER OF PICAYUNE,255343,2797 COOPER ROAD,PICAYUNE,Pearl River,0,0,0,0,56,0,0,0
RIVER CHASE VILLAGE,255289,5090 GAUTIER VANCLEAVE ROAD,GAUTIER,Jackson,0,0,1,0,45,0,0,0
VINEYARD COURT NURSING CENTER,255299,2002 5TH STREET NORTH,COLUMBUS,Lowndes,,,,,,,,
QUITMAN COUNTY HEALTH & REHAB LLC,255344,350 GETWELL DRIVE,MARKS,Quitman,0,0,1,0,48,0,0,0
"MYRTLES NURSING CENTER, LLC",255272,1018 ALBERTA AVENUE,COLUMBIA,Marion,0,3,8,0,83,0,3,0
CAMELLIA ESTATES,255280,1714 WHITE STREET,MCCOMB,Pike,13,0,7,6,15,5,2,0
DUNBAR VILLAGE TERRACE,255322,725 DUNBAR AVE,BAY SAINT LOUIS,Hancock,2,0,0,0,48,1,0,0
"SUNSHINE HEALTH CARE, INC",255319,1677 HIGHWAY 9 NORTH,PONTOTOC,Pontotoc,0,0,3,0,51,0,0,0
JNH-ADAMS INN,25A403,"3550 HIGHWAY 468 WEST PO BOX 207, BUILDING 31",WHITFIELD,Rankin,0,1,0,0,43,0,1,0
MADISON CO NH,255329,1421-A  EAST PEACE STREET/P. O. BOX 488,CANTON,Madison,0,3,0,0,94,1,3,0
SILVER CROSS HEALTH & REHAB,255310,503 SILVER CROSS DRIVE,BROOKHAVEN,Lincoln,47,0,12,10,9,26,0,0
ARRINGTON LIVING CENTER,255331,701 SOUTH HOLLY STREET,COLLINS,Covington,0,0,0,0,53,1,0,0
NOXUBEE COUNTY NURSING HOME,25A374,78 HOSPITAL RD,MACON,Noxubee,0,0,0,0,52,0,0,0
HATTIESBURG HEALTH & REHAB CENTER,255321,514 BAY STREET,HATTIESBURG,Forrest,0,0,1,0,164,0,0,0
"UNION CO HEALTH AND REHAB CENTER, INC",255312,1111 BRATTON ROAD,NEW ALBANY,Union,23,0,9,5,38,13,1,0
JASPER COUNTY NH,25A178,15 A SOUTH SIXTH STREET,BAY SPRINGS,Jasper,0,8,14,0,101,5,49,0
PONTOTOC NURSING HOME,25A380,176 SOUTH MAIN STREET,PONTOTOC,Pontotoc,0,5,0,0,44,1,0,0
QUEEN CITY NURSING CENTER,255166,1201 28TH AVENUE,MERIDIAN,Lauderdale,,,,,,,,
CLAIBORNE COUNTY SENIOR CARE,255192,2124 OLD HWY 61 SOUTH,PORT GIBSON,Claiborne,5,1,0,0,71,5,12,0
BAPTIST MEMORIAL HOSPITAL GT,255230,2520 5TH STREET NORTH,COLUMBUS,Lowndes,0,0,0,0,12,1,6,0
GREENBRIAR NURSING CENTER,255323,4347 WEST GAY ROAD,DIBERVILLE,Harrison,0,0,0,0,75,0,0,0
OXFORD HEALTH & REHAB CENTER,255269,1301 BELK BOULEVARD,OXFORD,Lafayette,0,7,0,0,131,5,0,0
COPIAH LIVING CENTER,255291,806 WEST GEORGETOWN STREET,CRYSTAL SPRINGS,Copiah,0,0,2,0,50,0,3,0
"CARRINGTON, LLC D/B/A THE CARRINGTON",255301,307 REED RD,STARKVILLE,Oktibbeha,2,6,3,0,42,0,2,0
SHEARER-RICHARDSON MEMORIAL NURSING HOME,25A162,512 ROCKWELL DRIVE / PO BOX 420,OKOLONA,Chickasaw,0,0,0,0,73,0,0,0
MEADVILLE CONVALESCENT HOME,255213,300 HWY 556/ROUTE 2 BOX 66,MEADVILLE,Franklin,1,1,0,0,46,2,2,0
NORTH POINTE HEALTH & REHABILITATION,255340,211 WINDMILL DRIVE,MERIDIAN,Lauderdale,3,10,3,0,56,4,17,0
LANDMARK OF DESOTO,255281,3068 NAIL ROAD WEST,HORN LAKE,DeSoto,0,0,11,0,49,0,15,0
COURTYARDS COMM LIVING CENTER,255212,907 EAST WALKER STREET/PO BOX 69,FULTON,Itawamba,0,0,0,0,50,0,0,0
GEORGE REGIONAL HEALTH & REHAB CENTER,255333,859 WINTER ST,LUCEDALE,George,0,0,0,0,35,0,0,0
BOLIVAR MEDICAL CENTER LTC,25A188,901 E SUNFLOWER RD,CLEVELAND,Bolivar,0,0,1,0,30,0,0,0
BRANDON COURT,255266,100 BURNHAM ROAD,BRANDON,Rankin,0,0,0,0,82,0,0,0
LAWRENCE CO NURSING CENTER,255214,700 JEFFERSON STREET SOUTH/PO BOX 398,MONTICELLO,Lawrence,0,0,0,0,54,2,0,0
HOLMES COUNTY LONG TERM CARE CENTER - DURANT,255332,15481 BOWLING GREEN ROAD,DURANT,Holmes,39,53,4,3,75,15,25,0
MEMORIAL WOODLAND VILLAGE NURSING CENTER,255163,5427 GEX ROAD,DIAMONDHEAD,Hancock,0,0,1,0,110,0,0,0
CEDARS HEALTH CENTER,255309,2800 WEST MAIN STREET,TUPELO,Lee,2,0,0,0,126,1,0,0
LAKESIDE HEALTH AND REHABILITATION CENTER,255288,191 HIGHWAY 511 EAST,QUITMAN,Clarke,3,0,1,1,102,13,0,1
HIGHLAND HOME,255274,638 HIGHLAND COLONY PARKWAY,RIDGELAND,Madison,0,0,3,0,82,0,1,0
SENATOBIA HEALTHCARE & REHAB,255302,402 GETWELL DR,SENATOBIA,Tate,0,0,0,0,77,3,0,0
BRIAR HILL REST HOME,255303,1201 GUNTER ROAD,FLORENCE,Rankin,0,0,1,0,54,1,0,0
DIVERSICARE OF SOUTHAVEN,255109,1730 DORCHESTER DR,SOUTHAVEN,DeSoto,17,2,3,1,121,17,6,0
CLINTON HEALTHCARE LLC - SNF,255282,1251 PINEHAVEN ROAD,CLINTON,Hinds,0,0,0,0,116,0,0,0
CHOCTAW NURSING AND REHABILITATION CENTER,255347,311 WEST CHERRY STREET,ACKERMAN,Choctaw,0,0,0,0,57,4,0,0
DUGAN MEMORIAL HOME,255313,26894 EAST MAIN STREET,WEST POINT,Clay,0,0,0,0,59,0,2,0
REST HAVEN HEALTH AND REHABILITATION,255247,103 CUNNINGHAM DRIVE,RIPLEY,Tippah,0,0,0,0,48,0,0,0
TALLAHATCHIE GENERAL HOSP ECF,25A190,201 SOUTH MARKET ST/P. O. BOX 230,CHARLESTON,Tallahatchie,0,0,0,0,92,0,0,0
THE BLUFFS REHABILITATION AND HEALTHCARE CENTER,255140,2850 PORTER'S CHAPEL ROAD,VICKSBURG,Warren,0,0,0,0,93,1,7,0
LIBERTY COMMUNITY LIVING CTR,255271,323 INDUSTRIAL PARK DRIVE,LIBERTY,Amite,7,1,0,0,63,2,4,0
WASHINGTON CARE CENTER,255314,1920 LISA DRIVE EXTENDED,GREENVILLE,Washington,1,0,0,0,52,1,1,0
NESHOBA COUNTY NURSING HOME,255137,1001 HOLLAND AVENUE,PHILADELPHIA,Neshoba,1,0,2,1,147,0,2,0
COUNTRYBROOK LIVING CENTER,255162,525 BROOKMAN DRIVE,BROOKHAVEN,Lincoln,0,0,3,0,70,0,0,0
LAKEVIEW NURSING CENTER,255182,16411 ROBINSON ROAD,GULFPORT,Harrison,0,0,0,0,84,0,0,0
PICAYUNE REHABILITATION AND HEALTHCARE CENTER,255141,1620 READ ROAD,PICAYUNE,Pearl River,0,1,3,1,91,1,1,0
TUPELO NURSING AND REHABILITATION CENTER,255136,1901 BRIAR RIDGE ROAD,TUPELO,Lee,3,6,1,0,109,6,1,0
PINE FOREST HEALTH AND REHABILITATION,255326,1116 FOREST AVENUE,JACKSON,Hinds,0,0,0,0,97,0,0,0
"TUNICA COUNTY HEALTH & REHAB, LLC",255334,1024 HIGHWAY 61 SOUTH,TUNICA,Tunica,21,0,7,4,49,6,12,0
DRIFTWOOD NURSING CENTER,255290,1500 BROAD AVENUE,GULFPORT,Harrison,0,0,1,0,119,0,0,0
COLUMBIA REHABILITATION AND HEALTHCARE CENTER,255227,1506 NORTH MAIN STREET,COLUMBIA,Marion,0,0,0,0,97,0,1,0
OAK GROVE RETIREMENT HOME,25E115,209 OAK CIRCLE/P. O. BOX 198,DUNCAN,Bolivar,13,16,0,0,57,9,0,0
MERIT HEALTH WESLEY,255168,5001 HARDY STREET,HATTIESBURG,Forrest,,,,,,,,
SHARKEY-ISSAQUENA NURSING HOME,255220,431 WEST RACE STREET,ROLLING FORK,Sharkey,0,0,0,0,45,0,0,0
SHELBY HEALTH AND REHABILITATION CENTER,255293,1108 CHURCH STREET,SHELBY,Bolivar,13,0,1,1,47,0,2,0
"MS CARE CENTER OF ALCORN COUNTY, INC-SNF",255110,3701 JOANNE DRIVE,CORINTH,Alcorn,0,1,0,0,107,1,2,0
GREAT OAKS REHABILITATION AND HEALTHCARE CENTER,255311,111 CHASE STREET,BYHALIA,Marshall,0,0,0,0,51,0,0,0
FOREST HILL NURSING CENTER,255273,927 COOPER RD,JACKSON,Hinds,0,0,0,0,75,0,0,0
DIVERSICARE OF BATESVILLE,255139,154 WOODLAND ROAD,BATESVILLE,Panola,0,0,1,0,107,0,1,0
JNH-MADISON INN,25A404,3550 HIGHWAY 468 WEST PO BOX 207 BLGS 28 &34,WHITFIELD,Rankin,0,3,1,0,62,0,3,0
THE WINDSOR PLACE,255257,81 WINDSOR BOULEVARD,COLUMBUS,Lowndes,0,0,25,0,118,0,10,0
SHADY LAWN HEALTH AND REHABILITATION,255234,60 SHADY LAWN PLACE,VICKSBURG,Warren,0,0,1,0,78,0,0,0
COMPERE NH INC,255249,865 NORTH STREET,JACKSON,Hinds,0,0,2,0,57,0,0,0
LEGACY MANOR NURSING AND REHABILITATION,255292,1935 NORTH THEOBOLD EXTENSION,GREENVILLE,Washington,0,0,1,0,52,0,0,0
COMMUNITY PLACE,255285,1129 LANGLEY AVE,JACKSON,Hinds,0,0,0,0,49,0,0,0
FLOY DYER MANOR NH,255306,1000 EAST MADISON,HOUSTON,Chickasaw,33,23,9,9,55,6,14,0
TREND HEALTH & REHAB OF CARTHAGE LLC,255108,1101 EAST FRANKLIN STREET,CARTHAGE,Leake,1,3,1,1,89,2,6,0
YALOBUSHA COUNTY NURSING HOME,25A174,630 SOUTH MAIN STREET,WATER VALLEY,Yalobusha,24,0,0,4,104,5,3,0
FORREST GENERAL HOSPITAL SKILLED NURSING UNIT,255335,6051 US HIGHWAY 49 SOUTH,HATTIESBURG,Forrest,1,0,0,0,11,5,0,0
JNH-JEFFERSON INN,25A402,3550 HWY 468 WEST - PO BOX 207 BLDG 33,WHITFIELD,Rankin,0,0,2,0,64,0,3,0
LANDMARK OF COLLINS,255215,1315 SOUTH FIR  AVE,COLLINS,Covington,0,0,0,0,51,0,3,0
PINEVIEW HEALTH AND REHABILITATION CENTER,255286,1304 WALNUT ST,WAYNESBORO,Wayne,0,0,12,0,88,0,1,0
JNH-JAQUITH INN,25A197,3550 HIGHWAY 468 WEST-  PO BOX207/BLDG 78,WHITFIELD,Rankin,0,0,0,0,50,1,1,0
DELTA REHABILITATION AND HEALTHCARE CENTER,255228,200 DR MARTIN LUTHER KING JR DRIVE,CLEVELAND,Bolivar,0,0,3,0,61,1,0,0
LOUISVILLE HEALTHCARE LLC,255096,543 EAST MAIN STREET/PO BOX 542,LOUISVILLE,Winston,,,,,,,,
CLARKSDALE NURSING CENTER,255267,1120 RITCHIE AVE,CLARKSDALE,Coahoma,0,0,2,0,68,0,2,0
LAURELWOOD COMMUNITY LIVING CENTER,255262,1036 WEST DRIVE,LAUREL,Jones,7,0,0,0,50,4,3,0
CORNERSTONE REHABILITATION AND HEALTHCARE CENTER,255232,302 ALCORN DRIVE,CORINTH,Alcorn,0,0,1,0,73,0,4,0
CHADWICK NURSING AND REHABILITATION CENTER LLC,255125,1900 CHADWICK DRIVE,JACKSON,Hinds,0,0,4,0,93,0,1,0
GREENBOUGH HEALTH AND REHABILITATION CENTER,255294,340 DESOTO AVE EXTENDED,CLARKSDALE,Coahoma,0,0,0,0,51,0,0,0
DIVERSICARE OF MERIDIAN,255118,4728 HIGHWAY 39 NORTH,MERIDIAN,Lauderdale,2,0,1,1,71,5,0,0
DIVERSICARE OF TUPELO,255105,2273 SOUTH EASON BOULEVARD,TUPELO,Lee,0,0,0,0,94,0,0,0
AURORA HEALTH AND REHABILITATION,255206,310 EMERALD DRIVE,COLUMBUS,Lowndes,0,0,1,0,100,1,0,0
"MAGNOLIA SENIOR CARE, LLC",255275,3701 PETER QUINN DRIVE,JACKSON,Hinds,0,0,0,0,53,0,0,0
LONGWOOD COMM LIVING CENTER,255264,200 LONG STREET/P. O. BOX 326,BOONEVILLE,Prentiss,0,0,1,0,40,0,2,0
CRYSTAL REHABILITATION AND HEALTHCARE CENTER,255154,902 SGT JOHN A PITTMAN DRIVE,GREENWOOD,Leflore,50,25,20,13,87,26,31,0
GRENADA LIVING CENTER,255104,1950 GRANDVIEW DRIVE,GRENADA,Grenada,0,2,7,2,79,0,2,0
GRENADA REHABILITATION AND HEALTHCARE CENTER,255156,1966 HILL DRIVE,GRENADA,Grenada,0,0,0,0,102,0,0,0
TISHOMINGO COMM LIVING CENTER,255127,1410 WEST QUITMAN STREET,IUKA,Tishomingo,0,0,0,0,66,0,6,0
CARE CENTER OF ABERDEEN,255097,505 JACKSON ST,ABERDEEN,Monroe,2,0,0,0,101,5,0,0
DIVERSICARE OF AMORY,255119,1215 EARL FRYE DRIVE,AMORY,Monroe,0,7,5,5,99,2,5,0
NMMC BALDWYN NURSING FACILITY,255161,739 4TH STREET SOUTH,BALDWYN,Lee,0,0,8,0,95,1,0,0
MS CARE CENTER OF RALEIGH,255342,309 MAGNOLIA DR/HIGHWAY 35 SOUTH,RALEIGH,Smith,37,52,10,8,99,15,39,0
PLAZA COMMUNITY LIVING CENTER,255207,4403 HOSPITAL ROAD,PASCAGOULA,Jackson,0,0,0,0,90,0,0,0
DANIEL HEALTH CARE INC DBA THE MEADOWS,255160,1905 SOUTH ADAMS STREET,FULTON,Itawamba,37,21,16,6,94,15,44,0
BEDFORD CARE CENTER OF HATTIESBURG,255158,10 MEDICAL BOULEVARD,HATTIESBURG,Forrest,21,2,5,12,67,11,2,1
DIVERSICARE OF TYLERTOWN,255100,200 MEDICAL CIRCLE,TYLERTOWN,Walthall,0,0,0,0,45,0,0,0
INDIANOLA REHABILITATION AND HEALTHCARE CENTER,255185,401 HIGHWAY 82 WEST,INDIANOLA,Sunflower,0,0,1,0,60,0,2,0
HOLLY SPRINGS REHABILITATION AND HEALTHCARE CENTER,255229,1315  HIGHWAY 4 EAST,HOLLY SPRINGS,Marshall,0,7,0,0,111,0,2,0
CHOCTAW RESIDENTIAL CENTER,255339,135 RESIDENTIAL CENTER RD,CHOCTAW,Neshoba,,,,,,,,
GREENE COUNTY HEALTH AND REHABILITATION,255277,1017 JACKSON STREET,LEAKESVILLE,Greene,0,0,3,0,58,0,0,0
WILKINSON COUNTY SENIOR CARE,255126,116 SOUTH LAFAYETTE STREET,CENTREVILLE,Wilkinson,,,,,,,,
EDGEWOOD HEALTH & REHABILITATION,255103,205 BYRAM PARKWAY,BYRAM,Hinds,0,1,3,0,110,1,4,0
WEBSTER HEALTH SERVICES NURSING FACILTY,25A389,70 MEDICAL PLAZA,EUPORA,Webster,0,0,0,0,35,2,1,0
ATTALA COUNTY NURSING CENTER,255191,326 HIGHWAY 12 WEST,KOSCIUSKO,Attala,3,7,7,5,86,0,8,0
MCCOMB NURSING AND REHABILITATION CENTER LLC,255101,415 MARION AVE,MCCOMB,Pike,0,0,0,0,119,0,1,0
TIPPAH COUNTY NURSING HOME,255130,1005 CITY AVENUE NORTH,RIPLEY,Tippah,0,0,1,0,35,0,0,0
DIVERSICARE OF RIPLEY,255102,101 CUNNINGHAM DR,RIPLEY,Tippah,0,0,0,0,119,0,1,0
PONTOTOC HEALTH & REHAB CENTER,255270,278 WEST EIGHTH STREET,PONTOTOC,Pontotoc,,,,,,,,
J G ALEXANDER NURSING CENTER,255318,25112 HIGHWAY 15,UNION,Newton,0,0,0,0,56,0,1,0
BEDFORD CARE CTR-MONROE HALL,255297,300 CAHAL STREET,HATTIESBURG,Forrest,0,0,0,0,75,0,2,0
