SODDY-DAISY HEALTH CARE CENTER,445408,701 SEQUOYAH ROAD,SODDY-DAISY,Hamilton,39,2,15,2,79,17,1,0
TREVECCA CENTER FOR REHABILITATION AND HEALING LLC,445112,329 MURFREESBORO RD,NASHVILLE,Davidson,76,19,34,5,220,26,4,0
"NHC HEALTHCARE, JOHNSON CITY",445024,3209 BRISTOL HWY,JOHNSON CITY,Washington,90,5,32,21,121,51,1,0
"QUINCE NURSING AND REHABILITATION CENTER, L L C",445197,6733 QUINCE ROAD,MEMPHIS,Shelby,55,46,45,25,134,50,50,0
WOODLAND TERRACE CARE AND REHAB,445205,8249 STANDIFER GAP ROAD,CHATTANOOGA,Hamilton,0,1,11,0,32,3,1,0
ALLENBROOKE NURSING AND REHABILITATION CENTER,445485,3933 ALLENBROOKE COVE,MEMPHIS,Shelby,44,38,39,2,160,48,23,0
DICKSON HEALTH AND REHAB,445477,901 N CHARLOTTE,DICKSON,Dickson,47,7,8,7,48,29,15,0
"LEXINGTON HEALTH CARE AND REHABILITATION, INC",445431,727 EAST CHURCH STREET,LEXINGTON,Henderson,58,46,33,14,72,69,15,0
SIGNATURE HEALTHCARE OF FENTRESS COUNTY,445362,208 DUNCAN ST N,JAMESTOWN,Fentress,50,3,22,6,93,63,15,0
SPRING CITY CARE AND REHABILITATION CENTER,445209,331 HINCH STREET,SPRING CITY,Rhea,49,1,20,7,68,33,17,0
HOLSTON MANOR,445295,3641 MEMORIAL BLVD,KINGSPORT,Sullivan,60,11,50,10,86,54,2,0
AHC HUMBOLDT,445454,"2031 AVONDALE STREET,  POBOX 446",HUMBOLDT,Gibson,6,0,25,14,51,20,5,0
LIFE CARE CENTER OF RED BANK,445240,1020 RUNYAN DR,CHATTANOOGA,Hamilton,1,0,10,0,80,86,0,0
ERWIN HEALTH CARE CENTER,445291,100 STALLING LANE,ERWIN,Unicoi,72,0,39,12,73,37,0,0
MADISONVILLE HEALTH AND REHAB CENTER,445457,465 ISBILL RD,MADISONVILLE,Monroe,25,0,15,2,33,20,0,0
AHC CUMBERLAND,445262,4343 ASHLAND CITY HIGHWAY,NASHVILLE,Davidson,1,0,4,0,103,22,2,0
AHAVA HEALTHCARE OF CLARKSVILLE,445433,111 USSERY ROAD,CLARKSVILLE,Montgomery,40,9,33,4,81,30,26,1
QUALITY CENTER FOR REHABILITATION AND HEALING LLC,445154,932 BADDOUR PARKWAY,LEBANON,Wilson,47,67,103,0,211,43,1,0
MAGNOLIA HEALTHCARE AND REHABILITATION CENTER,445465,1410 TROTWOOD AVENUE,COLUMBIA,Maury,41,0,6,4,91,54,6,0
LIFE CARE CENTER OF BLOUNT COUNTY,445520,1965 STEWART LANE,LOUISVILLE,Blount,18,0,5,2,77,30,0,0
DOUGLAS HEALTH AND REHABILITATION,445434,2084 W MAIN STREET,MILAN,Gibson,53,8,8,5,56,27,4,0
CHRISTIAN CARE CENTER OF MCKENZIE L L C,445357,150 OAK MANOR ROAD,MC KENZIE,Carroll,26,3,18,1,31,17,14,0
THE HIGHLANDS OF MEMPHIS HEALTH & REHABILITATION,445165,3549 NORRISWOOD,MEMPHIS,Shelby,79,4,22,10,128,70,1,0
ALLEN MORGAN HEALTH AND REHABILITATION CENTER,445133,177 NORTH HIGHLAND,MEMPHIS,Shelby,10,3,55,4,72,23,3,0
"LEBANON CENTER FOR REHABILITATION AND HEALING, LLC",445268,731 CASTLE HEIGHTS COURT,LEBANON,Wilson,15,1,4,2,53,16,0,0
NEWPORT HEALTH AND REHABILITATION CENTER,445504,135 GENERATION DRIVE,NEWPORT,Cocke,1,0,33,0,71,12,0,0
LIFE CARE CENTER OF GREENEVILLE,445228,725 CRUM STREET,GREENEVILLE,Greene,75,12,31,10,97,44,0,0
KNOLLWOOD MANOR,445410,405 TIMES AVE,LAFAYETTE,Macon,4,1,9,1,41,19,16,0
LIFE CARE CENTER OF COLUMBIA,445236,841 W. JAMES CAMPBELL BLVD.,COLUMBIA,Maury,0,3,27,0,87,9,8,0
"NHC HEALTHCARE, MCMINNVILLE",445076,928 OLD SMITHVILLE RD,MC MINNVILLE,Warren,29,3,51,3,101,25,12,0
CELINA HEALTH AND REHABILITATION CENTER,445445,120 PITCOCK LANE,CELINA,Clay,39,0,24,13,37,35,0,0
SWEETWATER NURSING CENTER,445456,978 HWY 11 SOUTH,SWEETWATER,Monroe,51,0,34,14,58,27,10,0
"HEALTH CENTER AT STANDIFER PLACE, THE",445111,2626 WALKER RD,CHATTANOOGA,Hamilton,78,13,138,8,365,50,51,0
"THE WATERS OF ROBERTSON, LLC",445137,104 WATSON ROAD,SPRINGFIELD,Robertson,38,2,10,7,52,19,3,1
WOODBURY HEALTH AND REHABILITATION CENTER,445435,119 WEST HIGH STREET,WOODBURY,Cannon,8,0,13,0,58,26,0,0
CLAIBORNE AND HUGHES HLTH CNTR,445157,200 STRAHL STREET,FRANKLIN,Williamson,79,1,25,6,99,34,0,0
LIFE CARE CENTER OF RHEA COUNTY,445494,10055 RHEA COUNTY HIGHWAY,DAYTON,Rhea,0,0,20,0,72,4,2,0
ALEXIAN VILLAGE OF TENNESSEE,445123,671 ALEXIAN WAY,SIGNAL MOUNTAIN,Hamilton,12,13,27,2,80,17,4,0
MOUNTAIN CITY CARE & REHABILITATION CENTER,445214,919 MEDICAL PARK DRIVE,MOUNTAIN CITY,Johnson,85,2,17,7,70,57,0,0
NHC PLACE AT THE TRACE,445525,8353 HIGHWAY 100,NASHVILLE,Davidson,4,12,23,3,78,32,11,0
ELK RIVER HEALTH AND REHABILITATION OF WINCHESTER,445319,32 MEMORIAL DRIVE,WINCHESTER,Franklin,50,29,22,5,47,40,23,0
ONEIDA NURSING AND REHAB CENTER,445254,18805 ALBERTA DR,ONEIDA,Scott,4,0,1,0,32,14,0,0
AHC VANAYER,445423,460 HANNINGS LANE,MARTIN,Weakley,23,27,15,3,52,24,20,0
HARDIN HOME,44E166,"1620 WAYNE ROAD, PO BOX 668",SAVANNAH,Hardin,10,0,4,0,30,6,1,0
GRACE HEALTHCARE OF DECATUR,445529,332 RIVER ROAD,DECATUR,Meigs,19,4,34,4,31,19,13,0
"STONES RIVER MANOR, INC",445534,205 HAYNES DRIVE,MURFREESBORO,Rutherford,21,0,5,3,19,23,8,0
HICKMAN COMMUNITY NURSING HOME,44E175,135 E SWAN ST,CENTERVILLE,Hickman,0,3,15,0,24,10,32,0
BLEDSOE COUNTY NURSING HOME,44E232,107 WHEELERTOWN AVENUE,PIKEVILLE,Bledsoe,2,0,9,0,35,1,3,0
CHRISTIAN CARE CENTER OF BRISTOL,445530,2830 HIGHWAY 394,BRISTOL,Anderson,74,0,20,5,101,40,0,0
LAURELBROOK NURSING HOME,445535,200 SANITARIUM CIRCLE,DAYTON,Rhea,35,1,16,8,33,31,3,0
PARK REST HARDIN COUNTY HEALTH CENTER,44E446,"85 SHELBY DRIVE, PO BOX 728",SAVANNAH,Hardin,7,0,3,0,46,14,2,0
TENNOVA NEWPORT CONVALESCENT CENTER,44E132,450 COLLEGE ST,NEWPORT,Cocke,1,3,3,0,50,5,0,0
SERENE MANOR MEDICAL CTR.,44E251,970 WRAY ST,KNOXVILLE,Knox,23,0,3,1,69,15,0,0
THE RESERVE AT SPRING HILL,445531,2000 RESERVE BOULEVARD,SPRING HILL,Maury,1,0,16,0,19,8,0,0
