HARLAN HEALTH AND REHABILITATION CENTER,185166,200 MEDICAL CENTER DRIVE,HARLAN,Harlan,2,0,8,0,126,7,0,0
OAKMONT MANOR,185250,1100 GRANDVIEW DRIVE,FLATWOODS,Greenup,40,2,16,7,71,29,10,0
CARDINAL HILL SKILLED REHABILITATION UNIT,185467,2050 VERSAILLES ROAD,LEXINGTON,Fayette,0,0,0,0,26,2,3,0
FOREST SPRINGS HEALTH CAMPUS,185478,4120 WOODED ACRE LANE,LOUISVILLE,Jefferson,4,0,12,0,42,8,0,0
"BEDROCK HC AT GREEN MEADOWS, LLC",185464,310 BOXWOOD RUN ROAD,MOUNT WASHINGTON,Bullitt,51,10,3,2,74,30,14,2
THE SEASONS AT ALEXANDRIA,185484,7341 E ALEXANDRIA PIKE,ALEXANDRIA,Campbell,1,7,19,2,113,3,2,0
THE SPRINGS AT STONY BROOK,185485,2200 STONY BROOK DRIVE,LOUISVILLE,Jefferson,9,1,5,0,53,5,0,0
LANDMARK OF RIVER CITY REHABILITATION AND NURSING,185468,1015 WEST MAGAZINE STREET,LOUISVILLE,Jefferson,,,,,,,,
THE HOME PLACE AT MIDWAY,185479,101 SEXTON WAY,MIDWAY,Woodford,0,0,4,0,25,3,0,0
CLINTON PLACE,185469,106 PADGETT DRIVE,CLINTON,Hickman,1,0,6,0,76,9,0,0
KINGS DAUGHTERS MEDICAL CENTER,185480,2201 LEXINGTON AVENUE,ASHLAND,Boyd,0,0,0,0,0,0,0,0
SENECA PLACE,185456,3526 DUTCHMANS LANE,LOUISVILLE,Jefferson,9,0,4,0,95,22,1,0
BRECKINRIDGE PLACE,185465,170 SYKES BOULEVARD,MORGANFIELD,Union,0,0,0,0,21,6,0,0
THE WILLOWS AT CITATION,185474,1376 SILVER SPRINGS DRIVE,LEXINGTON,Fayette,1,0,14,0,32,6,0,0
SIGNATURE HEALTHCARE AT STS MARY & ELIZABETH HOSPI,185477,"1850 BLUEGRASS AVENUE, UNIT 3C",LOUISVILLE,Jefferson,2,0,1,0,19,8,4,0
EMERALD TRACE,185481,3802 TURKEYFOOT ROAD,ELSMERE,Kenton,10,6,2,0,31,20,29,0
THE WILLOWS AT FRITZ FARM,185482,2710 MAN O' WAR BOULEVARD,LEXINGTON,Fayette,10,0,11,4,49,17,0,0
PAUL E PATTON EASTERN KY VETERANS CENTER,185471,200 VETERANS DRIVE,HAZARD,Perry,9,2,15,1,88,7,7,0
PARK TERRACE HEALTH CAMPUS,185462,9700 STONESTREET ROAD,LOUISVILLE,Jefferson,13,1,20,1,60,9,0,0
SANDERS RIDGE HEALTH CAMPUS,185487,119 EAST SANDERS LANE,MOUNT WASHINGTON,Bullitt,1,0,0,0,15,0,0,0
WESTPORT PLACE HEALTH CAMPUS,185466,4247 WESTPORT ROAD,LOUISVILLE,Jefferson,6,2,8,3,35,7,0,1
"BOONESPRING TRANSITIONAL CARE CENTER, LLC",185486,10250 US HWY 42,UNION,Boone,2,0,24,0,123,8,4,0
GLEN RIDGE HEALTH CAMPUS,185461,6415 CALM RIVER WAY,LOUISVILLE,Jefferson,0,0,9,0,41,5,0,0
COLDSPRING TRANSITIONAL CARE CENTER,185476,300 PLAZA DRIVE,COLD SPRING,Campbell,29,0,36,9,116,32,18,0
BROOKDALE RICHMOND PLACE SNF,185463,2770 PALUMBO DRIVE,LEXINGTON,Fayette,1,0,13,0,67,13,5,0
THE WILLOWS AT HAMBURG,185470,2531 OLD ROSEBUD ROAD,LEXINGTON,Fayette,0,0,14,0,59,7,0,0
RADCLIFF VETERANS CENTER,185483,100 VETERANS DRIVE,RADCLIFF,Hardin,0,3,5,0,58,11,9,0
JOSEPH EDDIE BALLARD WESTERN KENTUCKY VETERANS CEN,185472,926 VETERANS DRIVE,HANSON,Hopkins,0,71,20,0,74,4,61,0
THOMSON-HOOD VETERANS CENTER,185473,100 VETERANS DRIVE,WILMORE,Jessamine,75,1,10,9,120,53,4,0
