Provider Name,Federal Provider Number,Provider Address,Provider City,County,Residents Total Confirmed COVID-19,Residents Total Suspected COVID-19,Residents Total All Deaths,Residents Total COVID-19 Deaths,Total Number of Occupied Beds,Staff Total Confirmed COVID-19,Staff Total Suspected COVID-19,Staff Total COVID-19 Deaths
CLARA MAASS MEDICAL CENTER,315505,ONE CLARA MAASS DRIVE,BELLEVILLE,Essex,0,0,1,1,15,1,0,0
MERRY HEART NURSING HOME,315057,200 RT 10 WEST,SUCCASUNNA,Morris,0,0,16,0,84,0,0,0
HOLLY MANOR CENTER,315143,84 COLD HILL ROAD,MENDHAM,Morris,56,0,34,23,66,16,1,1
LINCOLN PARK CARE CENTER,315249,499 PINE BROOK ROAD,LINCOLN PARK,Morris,144,172,94,63,414,80,88,0
CARE ONE AT SOMERSET VALLEY,315002,1621 ROUTE 22 WEST,BOUND BROOK,Somerset,6,0,4,0,47,5,1,1
KRESSON VIEW CENTER,315207,2601 EVESHAM ROAD,VOORHEES,Camden,14,1,22,2,182,13,1,0
"SPRINGPOINT AT CRESTWOOD, INC",315298,50 LACEY ROAD,WHITING,Ocean,33,7,30,23,47,15,7,0
CAREPOINT HEALTH - BAYONNE HOSPITAL CENTER TCU,315431,29 EAST 29TH STREET,BAYONNE,Hudson,0,0,0,0,8,2,0,0
BISHOP MCCARTHY CENTER FOR REHABILITATION & HC,315126,1045 E CHESTNUT AVE,VINELAND,Cumberland,71,13,14,13,123,45,7,0
CHATHAM HILLS SUBACUTE CARE CENTER,315120,415 SOUTHERN BLVD,CHATHAM,Morris,14,46,10,4,73,10,4,0
STERLING MANOR,315149,794 N FORKLANDING ROAD,MAPLE SHADE,Burlington,6,1,0,0,84,9,0,0
ALARIS HEALTH AT JERSEY CITY,315083,198 STEVENS AVE,JERSEY CITY,Hudson,2,29,17,5,108,39,3,0
MILFORD MANOR,315276,69 MAPLE ROAD,WEST MILFORD,Passaic,1,0,37,19,75,2,0,0
NEW COMMUNITY EXTENDED CARE FACILITY,315393,266 S ORANGE AVE,NEWARK,Essex,55,6,47,12,100,27,0,2
LINCOLN SPECIALTY CARE CENTER,315233,1640 SOUTH LINCOLN AVENUE,VINELAND,Cumberland,1,1,3,0,149,8,0,2
JFK HARTWYCK AT CEDAR BROOK,315101,1340 PARK AVE,PLAINFIELD,Union,49,0,22,15,87,21,5,0
RUNNELLS CENTER FOR REHABILITATION & HEALTHCARE,315009,40 WATCHUNG WAY,BERKELEY HEIGHTS,Union,23,4,226,5,171,80,19,0
COMPLETE CARE AT SUMMIT RIDGE,315038,20 SUMMIT STREET,WEST ORANGE,Essex,62,0,42,24,89,20,17,0
ALARIS HEALTH AT BELGROVE,315366,195 BELGROVE DRIVE,KEARNY,Hudson,7,5,4,0,90,14,0,0
MANOR CARE MOUNTAINSIDE,315259,1180 ROUTE 22 WEST,MOUNTAINSIDE,Union,54,1,22,14,93,18,0,0
DELLRIDGE HEALTH & REHABILITATION CENTER,315129,532 FARVIEW AVE,PARAMUS,Bergen,,,,,,,,
HAMILTON CONTINUING CARE,315223,1059 EDINBURG ROAD,HAMILTON,Mercer,104,0,53,40,103,46,1,0
OUR LADY'S CENTER FOR REHABILITATION & HC,315054,1100 CLEMATIS AVE,PLEASANTVILLE,Atlantic,14,9,11,8,134,9,8,0
ROLLING HILLS CARE CENTER,315302,16 CRATETOWN ROAD,LEBANON,Hunterdon,8,10,12,6,43,14,8,0
CARE ONE AT HOLMDEL,315092,188 HIGHWAY 34,HOLMDEL,Monmouth,31,6,19,8,103,11,1,0
IMPERIAL CARE CENTER,315199,919 GREEN GROVE ROAD,NEPTUNE,Monmouth,1,1,3,1,77,1,0,0
DAUGHTERS OF MIRIAM CENTER,315021,155 HAZEL STREET,CLIFTON,Passaic,21,6,9,10,124,8,0,0
LOPATCONG CENTER,315202,390 RED SCHOOL LANE,PHILLIPSBURG,Warren,98,2,32,29,109,26,1,0
HUNTERDON CARE CENTER,315226,1 LEISURE COURT,FLEMINGTON,Hunterdon,3,2,6,2,134,0,0,2
ELMORA HILLS HEALTH & REHABILITATION CENTER,315010,225 W JERSEY STREET,ELIZABETH,Union,77,0,42,18,136,7,0,0
MEDFORD CARE CENTER,315176,185 TUCKERTON ROAD,MEDFORD,Burlington,57,46,13,8,100,11,6,0
ALLAIRE REHAB & NURSING,315387,115 DUTCH LANE ROAD,FREEHOLD,Monmouth,45,15,10,7,118,19,9,0
ROSE GARDEN NURSING AND REHABILITATION CENTER,315421,1579 OLD FREEHOLD ROAD,TOMS RIVER,Ocean,51,1,3,9,87,31,6,0
"PARKER AT SOMERSET, INC",315253,15 DELLWOOD LANE,SOMERSET,Somerset,5,0,13,3,98,5,0,0
"HAMILTON GROVE HEALTHCARE AND REHABILITATION, LLC",315423,2300 HAMILTON AVE,HAMILTON,Mercer,55,7,39,25,142,17,10,0
COMPLETE CARE AT WOODLANDS,315273,1400 WOODLAND AVE,PLAINFIELD,Union,0,1,3,0,68,4,0,0
SPRING GROVE REHABILITATION AND HEALTHCARE CENTER,315005,144 GALES DRIVE,NEW PROVIDENCE,Union,41,7,19,7,73,3,0,0
PREAKNESS HEALTHCARE CENTER,315361,305 OLDHAM ROAD,WAYNE,Passaic,13,0,15,11,288,44,3,0
FAMILY OF CARING HEALTHCARE AT MONTCLAIR,315435,42 NORTH MOUNTAIN AVE,MONTCLAIR,Essex,,,,,,,,
PINE ACRES CONVALESCENT CENTER,315053,51 MADISON AVE,MADISON,Morris,38,0,12,4,78,7,0,1
CLARK NURSING AND REHAB CNTR,315341,1213 WESTFIELD AVENUE,CLARK,Union,64,3,29,23,76,27,13,2
BURLINGTON WOODS,315050,115 SUNSET ROAD,BURLINGTON,Burlington,83,1,38,23,116,34,0,0
WYNWOOD REHABILITATION AND HEALTHCARE CENTER,315047,1700 WYNWOOD DRIVE,CINNAMINSON,Burlington,64,0,24,19,98,14,0,0
UNITED METHODIST COMMUNITIES AT COLLINGSWOOD,315404,460 HADDON AVE,COLLINGSWOOD,Camden,34,6,21,14,25,45,11,0
HACKENSACK-UMC MOUNTAINSIDE,315389,ONE BAY AVE,MONTCLAIR,Essex,0,0,0,0,6,0,0,0
MADISON CENTER,315015,625 STATE HIGHWAY 34,MATAWAN,Monmouth,88,1,30,21,108,15,2,0
STRATFORD MANOR REHABILITATION AND CARE CENTER,315066,787 NORTHFIELD AVE,WEST ORANGE,Essex,63,1,30,21,99,16,6,0
LAUREL MANOR HEALTHCARE AND REHABILITATION CENTER,315008,18 W LAUREL ROAD,STRATFORD,Camden,12,0,8,3,96,7,0,0
ALAMEDA CENTER FOR REHABILITATION AND HEALTHCARE,315180,303 ELM STREET,PERTH AMBOY,Middlesex,79,8,50,25,162,76,2,2
JERSEY SHORE CENTER,315364,3 INDUSTRIAL WAY EAST,EATONTOWN,Monmouth,14,1,19,1,127,7,0,0
ALARIS HEALTH AT HARBOR VIEW,315310,178-198 OGDEN AVE,JERSEY CITY,Hudson,1,14,3,0,104,3,0,0
MERIDIAN NURSING AND REHABILITATION AT BRICK,315342,415 JACK MARTIN BLVD,BRICK,Ocean,56,86,10,19,94,31,43,0
ARISTACARE AT CEDAR OAKS,315214,1311 DURHAM AVENUE,SOUTH PLAINFIELD,Middlesex,11,1,12,3,164,2,0,0
PARK CRESCENT HEALTHCARE & REHABILITATION CENTER,315266,480 PARKWAY DRIVE,EAST ORANGE,Essex,90,2,52,40,126,33,0,1
UNITED METHODIST COMMUNITIES AT THE SHORES,315394,2201 BAY AVENUE,OCEAN CITY,Cape May,2,0,2,1,47,7,7,0
ARNOLD WALTER NURSING HOME,315119,622 S LAUREL AVENUE,HAZLET,Monmouth,11,5,10,8,81,20,2,1
"GARDENS AT MONROE HEALTHCARE AND REHABILITATION, T",315336,189 APPLEGARTH ROAD,MONROE TOWNSHIP,Middlesex,44,1,16,16,77,27,2,0
TEANECK NURSING CENTER,315037,1104 TEANECK ROAD,TEANECK,Bergen,10,0,2,1,77,0,0,0
HACKENSACK MERIDIAN HEALTH NURSING & REHAB,315286,100 CHAPIN AVENUE,RED BANK,Monmouth,8,0,7,4,138,45,7,0
MONTCLAIR CARE CENTER,315363,111-115 GATES AVENUE,MONTCLAIR,Essex,1,0,1,1,44,5,0,0
MORRIS VIEW HEALTHCARE CENTER,315303,540 WEST HANOVER AVENUE,MORRISTOWN,Morris,120,42,97,28,202,33,31,0
APPLEWOOD ESTATES,315292,APPLEWOOD DRIVE,FREEHOLD,Monmouth,5,0,20,2,38,3,0,0
PHILLIPSBURG CENTER,315311,843 WILBUR AVENUE,PHILLIPSBURG,Warren,3,0,6,0,49,2,0,0
ROSE MOUNTAIN CARE CENTER,315384,ROUTE 1 & 18,NEW BRUNSWICK,Middlesex,42,0,30,20,61,20,0,0
BROADWAY HOUSE FOR CONTINUING,315343,298 BROADWAY,NEWARK,Essex,18,0,13,7,66,28,0,0
"DOCTORS SUBACUTE HEALTHCARE, LLC",315096,59 BIRCH STREET,PATERSON,Passaic,38,0,4,1,46,32,0,0
CRANFORD PARK REHABILITATION & HEALTHCARE CENTER,315390,600 LINCOLN PARK EAST,CRANFORD,Union,2,0,5,3,55,75,0,0
"ST JOSEPH'S HOME AL & NC, INC",315318,1-3 ST JOSEPH'S TERRACE,WOODBRIDGE,Middlesex,2,0,1,0,25,3,2,0
BARCLAYS REHABILITATION AND HEALTHCARE CENTER,315013,1412 MARLTON PIKE,CHERRY HILL,Camden,29,0,18,12,94,7,0,0
COMPLETE CARE AT ARBORS,315333,1750 ROUTE 37 WEST,TOMS RIVER,Ocean,37,0,12,8,59,18,24,0
ALARIS HEALTH AT CASTLE HILL,315344,615 23RD STREET,UNION CITY,Hudson,3,21,6,13,120,9,3,3
WILEY MISSION,315418,99 EAST MAIN STREET,MARLTON,Burlington,3,1,1,0,48,2,4,0
BARTLEY HEALTHCARE NURSING & REHABILITATION,315288,175 BARTLEY ROAD,JACKSON,Ocean,14,2,20,13,118,14,3,0
SUNNYSIDE MANOR,315354,2500 RIDGEWOOD ROAD,WALL,Monmouth,0,0,6,0,46,3,2,0
"PALACE REHABILITATION AND CARE CENTER, THE",315263,315 WEST MILL ROAD,MAPLE SHADE,Burlington,108,24,16,14,143,30,0,0
HOUSE OF THE GOOD SHEPHERD,315422,798 WILLOW GROVE STREET,HACKETTSTOWN,Warren,,,,,,,,
HOMESTEAD REHABILITATION & HEALTH CARE CENTER,315378,129 MORRIS TURNPIKE,NEWTON,Sussex,55,12,28,18,74,12,10,0
COMPLETE CARE AT HOLIDAY CITY,315320,4 PLAZA DRIVE,TOMS RIVER,Ocean,46,18,80,18,113,31,10,0
WILLOWBROOKE COURT SKILLED CARE AT EVERGREENS,315077,309 BRIDGEBORO ROAD,MOORESTOWN,Burlington,1,0,2,0,19,10,1,0
RIVERSIDE NURSING AND REHABILITATION CENTER,315235,325 JERSEY STREET,TRENTON,Mercer,56,119,38,13,106,62,52,1
CHRISTIAN HEALTH CARE CENTER,315376,301 SICOMAC AVE,WYCKOFF,Bergen,17,0,21,11,205,54,0,0
"PREFERRED CARE AT OLD BRIDGE, LLC",315321,6989 RT18,OLD BRIDGE,Middlesex,49,30,29,27,82,42,2,0
HARROGATE,315262,400 LOCUST STREET,LAKEWOOD,Ocean,0,0,5,2,53,0,0,0
SKILLED NURSING AT FELLOWSHIP VILLAGE,315356,8000 FELLOWSHIP DRIVE,BASKING RIDGE,Somerset,8,5,0,12,42,9,3,0
REGENCY GRANDE NURS & REHAB CE,315355,65 NORTH SUSSEX STREET,DOVER,Morris,26,0,30,18,119,18,0,0
INGLEMOOR REHABILITATION AND CARE CENTER OF LIVING,315322,311 S LIVINGSTON AVE,LIVINGSTON,Essex,7,1,4,3,79,13,2,0
LAKELAND HEALTH CARE CENTER,315261,25 FIFTH AVENUE,HASKELL,Passaic,0,1,1,0,90,0,1,0
ATRIUM POST ACUTE CARE OF WAYNE,315335,1120 ALPS ROAD,WAYNE,Passaic,114,2,50,36,118,35,0,0
CLOVER REST HOME,315429,28 WASHINGTON STREET,COLUMBIA,Warren,0,0,0,0,32,0,6,0
CORNELL HALL CARE & REHABILITATION CENTER,315104,234 CHESTNUT STREET,UNION,Union,7,0,10,3,92,3,1,0
CARE ONE AT CRESSKILL,315313,221 COUNTY ROAD,CRESSKILL,Bergen,2,3,5,2,56,6,1,0
OCEANA REHABILITATION AND NC,315193,502 ROUTE 9 NORTH,CAPE MAY COURT HOUSE,Cape May,21,4,2,1,99,9,1,0
PREFERRED CARE AT ABSECON,315244,1020 PITNEY ROAD,ABSECON,Atlantic,89,0,22,14,119,36,5,0
ALARIS HEALTH AT KEARNY,315192,206 BERGEN AVE,KEARNY,Hudson,13,5,8,6,68,21,1,0
WARDELL GARDENS AT TINTON FALLS,315414,524 WARDELL ROAD,TINTON FALLS,Monmouth,4,8,1,0,51,5,0,0
WATERVIEW CENTER,315216,536 RIDGE ROAD,CEDAR GROVE,Essex,67,1,48,24,116,27,2,0
ARISTACARE AT WHITING,315309,23 SCHOOLHOUSE ROAD,WHITING,Ocean,80,47,21,19,100,31,0,0
SOUTHGATE HEALTH CARE CTR,315237,449 S PENNSVILLE-AUBURN ROAD,CARNEYS POINT,Salem,59,12,30,28,82,33,13,0
N J VETERANS MEM HOME PARAMUS,315346,1 VETERANS DRIVE,PARAMUS,Bergen,126,2,122,79,194,91,0,1
WATERS EDGE HEALTHCARE & REHAB,315324,512 UNION STREET,TRENTON,Mercer,112,0,30,28,105,68,0,1
CARE ONE AT THE HIGHLANDS,315132,1350 INMAN AVENUE,EDISON,Middlesex,7,2,2,1,96,5,1,0
ARISTACARE AT NORWOOD TERRACE,315217,40 NORWOOD AVENUE,PLAINFIELD,Union,6,5,8,3,74,1,2,0
ANCHOR CARE AND REHABILITATION CENTER,315314,3325 HIGHWAY 35,HAZLET,Monmouth,60,23,24,18,131,33,3,3
HAMILTON PLACE AT THE PINES AT WHITING,315347,507 ROUTE 530,WHITING,Ocean,0,0,0,0,54,1,2,0
VOORHEES PEDIATRIC FACILITY,315289,1304 LAUREL OAK ROAD,VOORHEES,Camden,0,2,3,0,111,1,1,0
MORRIS HALL/ST JOSEPH'S NURSING CENTER,315338,1 BISHOPS DRIVE,LAWRENCEVILLE,Mercer,71,30,34,28,125,32,0,0
PREMIER CADBURY OF CHERRY HILL,315183,2150 ROUTE 38,CHERRY HILL,Camden,5,0,3,2,95,6,0,0
MORRISTOWN POST ACUTE REHAB AND NURSING CENTER,315157,77 MADISON AVENUE,MORRISTOWN,Morris,126,42,50,32,144,24,28,0
MERIDIAN NURSING AND REHABILITATION AT OCEAN GROVE,315365,160 MAIN STREET,OCEAN GROVE,Monmouth,42,2,6,10,96,18,3,0
CARE CONNECTION RAHWAY,315146,865 STONE STREET,RAHWAY,Union,10,6,15,2,4,2,0,0
UNITED METHODIST COMMUNITIES AT PITMAN,315427,535 N OAK AVE,PITMAN,Gloucester,2,0,26,0,58,9,8,0
FOOTHILL ACRES REHABILITATION & NURSING CENTER,315425,39 EAST MOUNTAIN ROAD,HILLSBOROUGH,Somerset,86,4,48,36,110,19,0,0
ALARIS HEALTH AT ESSEX,315359,155 FORTIETH STREET,IRVINGTON,Essex,12,0,6,1,134,12,0,0
VIRTUA HEALTH & REHAB MT HOLLY,315128,62 RICHMOND AVENUE,LUMBERTON,Burlington,72,0,19,19,82,33,0,1
CARE ONE AT ORADELL,315339,600 KINDERKAMACK ROAD,ORADELL,Bergen,5,37,2,2,86,13,5,0
"VOORHEES CARE & REHABILITATION CENTER, THE",315187,1302 LAUREL OAK ROAD,VOORHEES,Camden,119,64,30,24,145,35,28,0
HEATH VILLAGE,315072,430 SCHOOLEY'S MOUNTAIN RD,HACKETTSTOWN,Morris,40,98,23,9,72,44,52,0
AUTUMN LAKE HEALTHCARE AT BERKELEY HEIGHTS,315195,35 COTTAGE STREET,BERKELEY HEIGHTS,Union,2,0,3,0,61,4,0,0
JOB HAINES HOME FOR AGED PEOPL,315392,250 BLOOMFIELD AVE,BLOOMFIELD,Essex,,,,,,,,
CARE ONE AT RIDGEWOOD AVENUE,315426,W-90 RIDGEWOOD AVE,PARAMUS,Bergen,14,9,14,9,83,6,1,0
HEALTH CENTER AT BLOOMINGDALE,315348,255 UNION AVE,BLOOMINGDALE,Passaic,55,59,31,18,71,17,29,0
FOUNTAIN VIEW CARE CENTER,315327,527 RIVER AVE,LAKEWOOD,Ocean,72,10,21,9,87,24,7,0
PARK PLACE CENTER,315362,2 DEER PARK DRIVE,MONMOUTH JUNCTION,Middlesex,44,5,26,19,65,22,1,1
LAUREL BAY HEALTH & REHABILITATION CENTER,315437,32 LAUREL AVENUE,KEANSBURG,Monmouth,14,2,5,2,84,3,1,0
ELMWOOD HILLS HEALTHCARE CENTER LLC,315159,425 WOODBURY-TURNERSVILLE ROAD,BLACKWOOD,Camden,140,9,38,31,244,46,15,0
"MANOR, THE",315153,689 WEST MAIN ST,FREEHOLD,Monmouth,12,0,31,27,81,10,0,2
ST JOSEPH'S HOME FOR ELDERLY,315388,140 SHEPHERD LANE,TOTOWA,Passaic,7,5,8,4,61,15,4,0
PROVIDENCE NURSING AND REHABILITATION CENTER,315124,439 BELLEVUE AVENUE,TRENTON,Mercer,0,0,0,0,79,1,0,1
VALLEY VIEW REHABILITATION AND HEALTHCARE CTR,315409,1 SUMMIT AVENUE,NEWTON,Sussex,8,6,0,0,18,3,1,0
ARBOR GLEN CENTER,315036,25 E LINDSLEY ROAD,CEDAR GROVE,Essex,38,0,28,10,81,21,2,0
REGENCY HERITAGE NURSING AND REHABILITATION CENTER,315367,380 DEMOTT LANE,SOMERSET,Somerset,67,40,65,35,159,24,32,0
BROOKHAVEN HEALTH CARE CENTER,315268,120 PARK END PLACE,EAST ORANGE,Essex,6,0,0,0,100,1,0,0
CARE ONE AT KING JAMES,315087,1040 ROUTE 36,ATLANTIC HIGHLANDS,Monmouth,11,0,13,10,83,11,2,0
FOREST MANOR HCC,315224,145 STATE PARK ROAD,HOPE,Warren,82,84,35,24,81,28,33,0
WHITE HOUSE HLTHCR & REHAB CTR,315372,560 BERKELEY AVENUE,ORANGE,Essex,17,0,9,1,117,2,0,0
ATRIUM POST ACUTE CARE OF PRINCETON,315370,5000 WINDROW DRIVE,PRINCETON,Mercer,69,22,35,19,100,21,2,0
AMBOY CARE CENTER,315305,1 LINDBERG AVENUE,PERTH AMBOY,Middlesex,42,4,11,16,122,5,0,0
MANORCARE HEALTH SERVICES-WEST DEPTFORD,315246,550 JESSUP ROAD,WEST DEPTFORD,Gloucester,47,3,37,27,95,43,1,2
REFORMED CHURCH HOME,315417,1990 ROUTE 18 NORTH,OLD BRIDGE,Middlesex,47,0,12,1,77,18,0,0
ROOSEVELT CARE CENTER,315039,118 PARSONAGE ROAD,EDISON,Middlesex,29,3,13,7,143,12,0,2
VOORHEES CENTER,315219,3001 EVESHAM ROAD,VOORHEES,Camden,123,0,52,42,119,40,2,0
CRANFORD REHAB & NURSING CENTER,315091,205 BIRCHWOOD AVE,CRANFORD,Union,15,1,10,5,122,6,0,0
HACKENSACK MERIDIAN HEALTH NURSING & REHAB,315295,50 POLIFLY ROAD,HACKENSACK,Bergen,0,3,8,2,126,7,0,1
CREST HAVEN NURSING AND REHABILITATION CENTER,315294,4 MOORE ROAD,CAPE MAY COURT HOUSE,Cape May,1,2,5,0,89,7,165,0
ALARIS HEALTH AT HAMILTON PARK,315300,525 MONMOUTH STREET,JERSEY CITY,Hudson,0,0,4,4,95,26,0,0
CARNEYS POINT REHABILITATION AND NURSING CENTER,315271,201 FIFTH AVENUE,CARNEYS POINT,Salem,77,38,0,0,103,76,34,0
HARTWYCK AT OAK TREE,315251,2048 OAK TREE ROAD,EDISON,Middlesex,35,38,19,1,97,61,22,0
ATRIUM POST ACUTE CARE OF WAYNEVIEW,315291,2020 ROUTE 23 NORTH,WAYNE,Passaic,76,4,52,21,106,41,2,3
CANTERBURY AT CEDAR GROVE,315204,398 POMPTON AVENUE,CEDAR GROVE,Essex,39,10,7,7,103,30,6,0
CONCORD HEALTHCARE & REHABILITATION CENTER,315275,963 OCEAN AVE,LAKEWOOD,Ocean,31,14,9,8,77,32,13,0
MEDFORD LEAS,315144,ONE MEDFORD LEAS WAY,MEDFORD,Burlington,2,0,2,2,7,3,0,0
"COMPLETE CARE AT LAURELTON, LLC",315274,475 JACK MARTIN BLVD,BRICK,Ocean,71,1,21,14,76,23,0,0
LINCOLN PARK RENAISSANCE REHAB & NURSING,315042,521 PINE BROOK ROAD,LINCOLN PARK,Morris,9,3,20,13,116,33,1,0
VILLAGE POINT,315269,THREE DAVID BRAINERD DRIVE,MONROE TOWNSHIP,Middlesex,15,3,9,18,83,14,0,0
COMPLETE CARE AT GREEN ACRES,315265,1931 LAKEWOOD ROAD,TOMS RIVER,Ocean,72,5,44,14,126,47,0,0
"HEALTH CENTER AT GALLOWAY, THE",315210,66 WEST JIMMIE LEEDS ROAD,GALLOWAY TOWNSHIP,Atlantic,49,22,22,22,82,15,11,0
REHAB AT RIVER'S EDGE,315140,633 ROUTE 28,RARITAN,Somerset,18,0,15,8,108,2,1,0
TOWER LODGE CARE CENTER,315069,1506 GULLY ROAD,WALL,Monmouth,1,1,0,0,54,2,3,0
BAYSHORE HEALTH CARE CENTER,315252,715 NORTH BEERS STREET,HOLMDEL,Monmouth,4,0,23,12,141,10,15,0
COUNTRY ARCH CARE CENTER,315433,114 PITTSTOWN ROAD,PITTSTOWN,Hunterdon,23,0,10,5,66,0,0,0
ALLEGRIA AT THE FOUNTAINS,315297,114 HAYES MILL ROAD,ATCO,Camden,0,0,9,0,57,0,0,0
PREFERRED CARE AT WALL,315397,2350 HOSPITAL ROAD,ALLENWOOD,Monmouth,59,12,15,13,100,6,5,0
PINE BROOK CARE CENTER,315282,104 PENSION ROAD,ENGLISHTOWN,Monmouth,6,0,4,4,60,1,0,0
BRIDGEWAY CARE AND REHAB CENTER AT BRIDGEWATER,315182,270 ROUTE 28,BRIDGEWATER,Somerset,77,37,41,21,121,26,71,0
CEDAR GROVE RESPIRATORY AND NURSING CENTER,315257,1420 SOUTH BLACK HORSE PIKE,WILLIAMSTOWN,Gloucester,15,4,55,3,157,12,0,0
MILLVILLE CENTER,315243,54 N SHARP STREET,MILLVILLE,Cumberland,105,0,44,27,85,29,18,0
KING MANOR CARE AND REHABILITATION CENTER,315299,2303 WEST BANGS AVE,NEPTUNE,Monmouth,5,0,3,0,85,1,0,0
N J EASTERN STAR HOME,315419,111 FINDERNE AVENUE,BRIDGEWATER,Somerset,35,122,24,13,49,32,5,0
CRYSTAL LAKE HLTHCARE & REHAB,315125,395 LAKESIDE BLVD,BAYVILLE,Ocean,75,0,42,26,152,48,2,0
COURT HOUSE CENTER,315228,144 MAGNOLIA DRIVE,CAPE MAY COURT HOUSE,Cape May,5,7,20,0,86,0,0,0
NEW GROVE MANOR,315147,101 NORTH GROVE STREET,EAST ORANGE,Essex,108,11,41,20,116,8,39,2
JEFFERSON HEALTH CARE CENTER,315231,535 EGG HARBOR ROAD,SEWELL,Gloucester,30,3,4,4,132,11,11,0
"ACTORS FUND HOME, THE",315377,175 WEST HUDSON AVE,ENGLEWOOD,Bergen,26,38,21,13,118,19,5,0
WILLOW SPRINGS REHABILITATION AND HEALTHCARE CTR,315213,1049 BURNT TAVERN ROAD,BRICK,Ocean,98,44,63,34,127,53,3,0
WINDSOR GARDENS CARE CENTER,315178,140 PARK AVE,EAST ORANGE,Essex,62,0,19,13,145,12,1,0
MERIDIAN NURSING & REHAB AT SHREWSBURY,315136,89 AVENUE AT THE COMMON,SHREWSBURY,Monmouth,3,7,11,0,110,7,6,0
LLANFAIR HOUSE CARE & REHABILITATION CENTER,315142,1140 BLACK OAK RIDGE ROAD,WAYNE,Passaic,23,2,16,9,113,10,5,0
SINAI POST ACUTE NURSING AND REHAB CENTER,315236,65 JAY STREET,NEWARK,Essex,124,67,67,19,278,73,33,1
GATEWAY CARE CENTER,315177,139 GRANT AVE,EATONTOWN,Monmouth,41,1,0,12,113,19,0,0
LAKEVIEW REHABILITATION AND CARE CENTER,315110,130 TERHUNE DRIVE,WAYNE,Passaic,34,5,34,19,80,22,15,0
SOUTH MOUNTAIN HC,315283,2385 SPRINGFIELD AVENUE,VAUXHALL,Union,52,6,1,1,129,14,0,1
FAMILY OF CARING HEALTHCARE AT RIDGEWOOD,315434,304 S. VAN DIEN AVE,RIDGEWOOD,Bergen,44,1,29,17,68,29,2,0
PEACE CARE ST ANN'S,315413,198 OLD BERGEN ROAD,JERSEY CITY,Hudson,44,0,27,11,88,33,0,0
MAJESTIC CENTER FOR REHAB & SUB-ACUTE CARE,315205,TWO COOPER PLAZA,CAMDEN,Camden,53,0,8,8,94,11,0,0
COMPLETE CARE AT WHITING,315293,3000 HILLTOP ROAD,WHITING,Ocean,47,10,17,16,91,41,14,0
"COMPLETE CARE AT LINWOOD, LLC",315185,201 NEW ROAD AND CENTRAL AVE,LINWOOD,Atlantic,18,6,34,27,105,31,3,0
MANAHAWKIN CONV CTR,315206,1211 RT 72 WEST,MANAHAWKIN,Ocean,12,3,13,13,103,5,2,0
CARE ONE AT NEW MILFORD,315306,800 RIVER ROAD,NEW MILFORD,Bergen,15,2,13,3,182,8,0,1
JFK HARTWYCK AT EDISON ESTATES,315279,10 BRUNSWICK AVENUE,EDISON,Middlesex,133,0,28,27,170,35,0,0
ALARIS HEALTH AT BOULEVARD EAST,315254,6819 BOULEVARD EAST,GUTTENBERG,Hudson,3,0,0,0,72,2,0,0
CORAL HARBOR REHABILITATION AND HEALTHCARE CENTER,315105,2050 SIXTH AVE,NEPTUNE CITY,Monmouth,5,7,16,0,90,4,14,0
AUTUMN LAKE HEALTHCARE AT OCEANVIEW,315179,2721 ROUTE 9,OCEAN VIEW,Cape May,31,18,19,13,91,12,10,0
MARCELLA CENTER,315330,2305 RANCOCAS ROAD,BURLINGTON,Burlington,73,2,54,19,72,35,4,1
ARISTACARE AT DELAIRE,315200,400 W STIMPSON AVE,LINDEN,Union,131,4,52,79,188,45,0,0
WESTFIELD CENTER,315122,1515 LAMBERTS MILL ROAD,WESTFIELD,Union,60,2,48,16,106,55,1,2
ARMENIAN NURSING AND REHABILITATION CENTER,315402,70 MAIN STREET,EMERSON,Bergen,23,9,24,13,22,26,0,0
CLOVER MEADOWS HEALTHCARE AND REHABILITATION CENTE,315113,112 FRANKLIN CORNER ROAD,LAWRENCEVILLE,Mercer,53,0,27,21,61,18,9,0
STONEBRIDGE AT MONTGOMERY HEALTH CARE CENTER,315486,100 HOLLINSHEAD SPRING ROAD,SKILLMAN,Somerset,,,,,,,,
OAKLAND REHABILITATION AND HEALTHCARE  CENTER,315171,20 BREAKNECK ROAD,OAKLAND,Bergen,117,19,44,44,142,63,13,4
EAGLEVIEW HEALTH AND REHABILITATION,315014,849 BIG OAK ROAD,PITTSGROVE,Salem,4,0,1,0,70,4,1,0
ATLANTIC COAST REHAB & HEALTH,315115,485 RIVER AVE,LAKEWOOD,Ocean,97,15,21,19,114,20,0,0
ALARIS HEALTH AT ROCHELLE PARK,315308,96 PARKWAY AVENUE,ROCHELLE PARK,Bergen,25,7,34,15,137,44,3,0
GOLDEN REHABILITATION AND NURSING CENTER,315058,438 SALEM-WOODSTOWN ROAD,SALEM,Salem,2,0,0,0,64,5,0,0
CHESTNUT HILL CONV CENTER,315085,360 CHESTNUT STREET,PASSAIC,Passaic,17,8,9,7,55,12,6,2
BRIGHTON GARDENS OF EDISON,315351,1801 OAKTREE ROAD,EDISON,Middlesex,15,2,9,8,14,13,1,0
ABINGDON CARE & REHABILITATION CENTER,315141,303 ROCK AVE,GREEN BROOK,Somerset,19,1,4,4,111,2,0,0
EASTERN PINES CONV CTR,315317,29 NORTH VERMONT AVE,ATLANTIC CITY,Atlantic,3,0,2,0,86,5,0,0
DWELLING PLACE AT ST CLARES,315019,400 WEST BLACKWELL ST,DOVER,Morris,0,0,4,0,18,3,0,0
PHOENIX CENTER FOR REHABILITATION AND PEDIATRICS,315229,1433 RINGWOOD AVE,HASKELL,Passaic,2,1,3,1,162,3,0,0
ALARIS HEALTH AT ST MARY'S,315352,135 SOUTH CENTER STREET,ORANGE,Essex,9,11,13,13,144,30,16,0
BERGEN NEW BRIDGE MEDICAL CENTER,315017,230 E RIDGEWOOD AVE,PARAMUS,Bergen,250,40,9,64,389,116,2,1
"COMPLETE CARE AT BEY LEA, LLC",315264,1351 OLD FREEHOLD ROAD,TOMS RIVER,Ocean,73,49,35,21,71,30,26,0
COMPLETE CARE AT FAIR LAWN EDGE,315331,77 EAST 43RD STREET,PATERSON,Passaic,27,7,14,10,120,10,2,0
SHADY LANE GLOUCESTER CO HOME,315405,256 COUNTY HOUSE ROAD,CLARKSBORO,Gloucester,,,,,,,,
MERCERVILLE CENTER,315094,2240 WHITEHORSE-MERCERVILLE ROAD,MERCERVILLE,Mercer,61,0,28,18,70,43,1,0
CRANBURY CENTER,315353,292 APPLEGARTH ROAD,MONROE TOWNSHIP,Middlesex,58,5,34,29,81,29,1,1
SEACREST VILLAGE,315218,1001 CENTER ST,LITTLE EGG HARBOR TW,Ocean,0,0,10,0,145,3,0,0
WARREN HAVEN REHAB AND NURSING CENTER,315304,350 OXFORD ROAD,OXFORD,Warren,56,59,38,16,77,11,11,0
PRINCETON CARE CENTER,315108,728 BUNN DRIVE,PRINCETON,Mercer,8,0,31,12,74,7,0,0
COMPLETE CARE AT WILLOW CREEK,315131,1165 EASTON AVE,SOMERSET,Somerset,58,0,28,15,92,14,27,0
SILVER HEALTHCARE CENTER,315280,1417 BRACE ROAD,CHERRY HILL,Camden,118,143,30,24,115,27,32,0
DE LA SALLE HALL,315374,810 NEWMAN SPRINGS RD,LINCROFT,Monmouth,0,0,1,0,25,0,0,0
FRIENDS VILLAGE AT WOODSTOWN,315161,ONE FRIENDS DRIVE,WOODSTOWN,Salem,16,0,12,9,34,20,1,0
WOODCLIFF LAKE HEALTH & REHABILITATION CENTER,315133,555 CHESTNUT RIDGE ROAD,WOODCLIFF LAKE,Bergen,13,5,21,5,75,49,0,2
"BUCKINGHAM AT NORWOOD, THE",315290,100 MCCLELLAN STREET,NORWOOD,Bergen,40,0,18,3,161,23,3,1
ST MARY'S CENTER FOR REHABILITATION & HEALTHCARE,315060,210 ST MARY'S DRIVE,CHERRY HILL,Camden,1,8,22,22,161,36,0,10
ST LAWRENCE REHAB CENTER,315127,2381 LAWRENCEVILLE ROAD,LAWRENCEVILLE,Mercer,3,0,0,0,45,12,0,0
ASHBROOK CARE & REHABILITATION CENTER,315064,1610 RARITAN ROAD,SCOTCH PLAINS,Union,9,1,3,4,98,10,0,0
SOUTHERN OCEAN CENTER,315332,1361 ROUTE 72 WEST,MANAHAWKIN,Ocean,57,5,35,15,96,18,0,0
RIDGEWOOD CENTER,315158,330 FRANKLIN TPK,RIDGEWOOD,Bergen,61,2,20,12,55,28,1,0
HAMPTON RIDGE HEALTHCARE AND REHABILITATION,315312,94 STEVENS ROAD,TOMS RIVER,Ocean,100,8,36,18,150,40,16,0
HARBORAGE (THE),315307,7600 RIVER ROAD,NORTH BERGEN,Hudson,137,5,59,40,160,55,47,2
TROY HILLS CENTER,315138,200 REYNOLDS AVE,PARSIPPANY,Morris,46,1,25,10,86,16,0,0
PREFERRED CARE AT HAMILTON,315111,1501 STATE HWY 33,HAMILTON SQUARE,Mercer,24,26,29,8,96,5,3,1
ARISTACARE AT MANCHESTER,315196,1770 TOBIAS AVENUE,MANCHESTER,Ocean,97,9,38,22,111,34,9,0
CHILDRENS SPECIALIZED HOSPITAL MOUNTAINSIDE,315239,150 NEW PROVIDENCE ROAD,MOUNTAINSIDE,Union,2,9,0,0,42,19,13,0
ABIGAIL HOUSE FOR NURSING & REHABILITATION,315267,1105 -1115 LINDEN STREET,CAMDEN,Camden,61,0,8,4,140,17,0,0
HUDSONVIEW HEALTH CARE CENTER,315112,9020 WALL STREET,NORTH BERGEN,Hudson,22,24,13,3,193,25,0,0
LEISURE PARK HEALTH CENTER,315256,1400 ROUTE 70,LAKEWOOD,Ocean,1,0,4,4,34,2,0,2
COMPLETE CARE AT GREEN KNOLL,315134,875 ROUTE 202-206 NORTH,BRIDGEWATER,Somerset,48,10,7,3,104,5,23,1
ELIZABETH NURSING AND REHAB,315106,1048 GROVE STREET,ELIZABETH,Union,6,0,33,20,46,18,0,0
"COMPLETE CARE AT HAMILTON, LLC",315221,56 HAMILTON AVENUE,PASSAIC,Passaic,,,,,,,,
GREENWOOD HOUSE HOME FOR THE JEWISH AGED,315215,53 WALTER STREET,TRENTON,Mercer,,,,,,,,
NEPTUNE GARDENS NURSING AND REHAB LLC,315056,101 WALNUT ST,NEPTUNE,Monmouth,62,148,6,0,72,48,0,0
ARISTACARE AT CHERRY HILL,315245,1399 CHAPEL AVE WEST,CHERRY HILL,Camden,14,0,19,15,84,18,0,0
FOREST HILL HEALTHCARE CENTER,315375,497 MT PROSPECT AVE,NEWARK,Essex,1,0,1,0,68,4,0,0
REGENCY GARDENS NURSING CENTER,315103,296 HAMBURG TURNPIKE,WAYNE,Passaic,0,0,1,1,106,1,0,0
CREST POINTE REHABILITATION AND HEALTHCARE CENTER,315135,1515 HULSE ROAD,PT PLEASANT,Ocean,85,3,18,14,88,19,2,0
ANDOVER SUBACUTE AND REHAB I,315044,1 O'BRIEN LANE,ANDOVER,Sussex,48,34,26,19,108,22,11,1
INGLEMOOR CENTER,315349,333 GRAND AVE,ENGLEWOOD,Bergen,19,3,9,9,37,11,0,0
CAMBRIDGE REHABILITATION AND HEALTHCARE CENTER,315201,255 EAST MAIN ST,MOORESTOWN,Burlington,67,7,23,17,78,24,0,0
CHESHIRE HOME,315383,9 RIDGEDALE AVE,FLORHAM PARK,Morris,0,0,0,0,35,0,0,0
BARNEGAT REHABILITATION AND NURSING CENTER,315222,859 WEST BAY AVE,BARNEGAT,Ocean,0,1,7,0,80,3,0,0
HACKENSACK MERIDIAN HEALTH WEST CALDWELL C,315247,165 FAIRFIELD AVE,WEST CALDWELL,Essex,4,0,10,4,110,1,0,0
LEISURE CHATEAU REHABILITATION,315190,962 RIVER AVE,LAKEWOOD,Ocean,79,73,27,21,162,43,2,0
DAUGHTERS OF ISRAEL PLEASANT VALLEY HOME,315029,1155 PLEASANT VALLEY WAY,WEST ORANGE,Essex,6,55,28,18,174,49,0,0
EMERSON HEALTH CARE CENTER,315360,100 KINDERKAMACK ROAD,EMERSON,Bergen,15,2,41,1,103,20,0,1
MAYWOOD CENTER FOR HEALTH AND REHABILITATION,315386,100 WEST MAGNOLIA AVENUE,MAYWOOD,Bergen,86,5,22,19,86,30,2,0
ALARIS HEALTH AT RIVERTON,315198,1777 LAWRENCE STREET,RAHWAY,Union,2,0,7,0,58,11,1,0
MEADOW LAKES,315022,300 MEADOW LAKES,EAST WINDSOR,Mercer,16,6,24,9,52,22,1,0
AVISTA HEALTHCARE,315068,3025 CHAPEL AVENUE WEST,CHERRY HILL,Camden,2,0,3,0,63,3,0,1
MERWICK CARE & REHABILITATION CENTER,315001,100 PLAINSBORO ROAD,PLAINSBORO,Middlesex,20,16,29,27,165,12,4,0
GREEN HILL,315416,103 PLEASANT VALLEY WAY,WEST ORANGE,Essex,14,5,18,3,79,20,2,1
MAPLE GLEN CENTER,315328,12-15 SADDLE RIVER ROAD,FAIRLAWN,Bergen,74,5,39,29,90,40,0,0
HAMMONTON CENTER FOR REHABILITATION AND HEALTHCARE,315209,43 N WHITE HORSE PIKE,HAMMONTON,Atlantic,55,13,30,24,200,13,4,0
BARN HILL CARE CENTER,315137,249 HIGH STREET,NEWTON,Sussex,5,0,15,2,116,12,0,1
RIVERFRONT REHABILITATION AND HEALTHCARE CENTER,315225,5101 NORTH PARK DRIVE,PENNSAUKEN,Camden,63,11,22,11,161,29,3,0
