Provider Name,Federal Provider Number,Provider Address,Provider City,County,Residents Total Confirmed COVID-19,Residents Total Suspected COVID-19,Residents Total All Deaths,Residents Total COVID-19 Deaths,Total Number of Occupied Beds,Staff Total Confirmed COVID-19,Staff Total Suspected COVID-19,Staff Total COVID-19 Deaths
BUTTERFIELD TRAIL VILLAGE,045125,1923 EAST JOYCE BLVD,FAYETTEVILLE,Washington,,,,,,,,
HOT SPRINGS NURSING AND REHABILITATION- A WATERS C,045098,552 GOLF LINKS ROAD,HOT SPRINGS,Garland,0,0,0,0,103,0,0,0
VALLEY SPRINGS REHABILITATION AND HEALTH CENTER,045138,228 POINTER TRAIL WEST,VAN BUREN,Crawford,0,0,11,0,89,0,1,0
SOMERSET SENIOR LIVING AT MCGEHEE,045139,700 MARK DRIVE,MCGEHEE,Desha,0,0,0,0,42,0,0,0
ROGERS HEALTH AND REHABILITATION CENTER,045070,1149 W NEW HOPE RD,ROGERS,Benton,1,3,8,0,71,0,1,0
SEARCY HEALTHCARE LLC,045140,1205 SKYLINE DRIVE,SEARCY,White,0,0,4,0,92,0,0,0
MAGNOLIA HEALTHCARE LLC,045135,2642 NORTH DUDNEY ROAD,MAGNOLIA,Columbia,0,0,4,0,73,0,0,0
JONESBORO WELLNESS LLC,045134,1705 LATOURETTE DRIVE,JONESBORO,Craighead,0,0,0,0,99,4,0,0
ENCORE HEALTHCARE AND REHABILITATION,045393,1820 WEST MOLINE STREET,MALVERN,Hot Spring,0,6,0,0,89,0,4,0
TIMBERLANE HEALTH & REHABILITATION,045416,2002 TIMBERWOOD ROAD,EL DORADO,Union,0,10,3,0,81,0,0,0
HILLCREST CARE AND REHAB,045306,1421 WEST SECOND ST NORTH,PRESCOTT,Nevada,0,0,0,0,76,0,0,0
SOUTHRIDGE VILLAGE NURSING AND REHAB,045196,400 SOUTHRIDGE PARKWAY,HEBER SPRINGS,Cleburne,0,0,1,0,91,0,0,0
SPRINGDALE HEALTH AND REHABILITATION CENTER,045167,102 NORTH GUTENSOHN,SPRINGDALE,Washington,0,5,13,0,104,0,7,0
GARDNER NURSING AND REHABILITATION,045269,702 NO DREW ST,STAR CITY,Lincoln,0,0,1,0,59,2,9,0
THE WOODS OF MONTICELLO HEALTH AND REHABILITATION,045176,1194 N CHESTER ST,MONTICELLO,Drew,0,1,11,0,67,0,1,0
"CRESTPARK STUTTGART, LLC",045303,707 WEST 20TH STREET,STUTTGART,Arkansas,0,0,1,0,63,0,0,0
HIRAM SHADDOX HEALTH AND REHAB,045471,1100 PINETREE LANE,MOUNTAIN HOME,Baxter,0,0,0,0,40,0,0,0
MONTGOMERY COUNTY NURSING HOME,045266,741 SOUTH DRIVE,MOUNT IDA,Montgomery,0,0,0,0,89,0,0,0
PARIS HEALTH AND REHABILITATION CENTER,045300,1414 S ELM ST,PARIS,Logan,0,0,3,0,105,0,4,0
WOODLAND HILLS HEALTHCARE AND REHABILITATION,045378,1320 WEST BRADEN STREET,JACKSONVILLE,Pulaski,0,0,0,0,81,3,0,0
GREENBRIER NURSING AND REHABILITATION CENTER,045381,#16 WILSON FARM ROAD,GREENBRIER,Faulkner,0,1,0,0,72,0,2,0
"SUPERIOR HEALTH & REHAB, LLC",045467,625 TOMMY LEWIS DR,CONWAY,Faulkner,0,0,1,0,61,0,0,0
SOMERSET SENIOR LIVING AT HARRISON,045197,115 ORENDORFF AVENUE,HARRISON,Boone,,,,,,,,
"CRESTPARK HELENA, LLC",045221,116 NOVEMBER DRIVE,HELENA,Phillips,0,0,0,0,56,0,0,0
NEWTON COUNTY NURSING HOME,04E090,610 EAST COURT STREET,JASPER,Newton,0,0,0,0,57,0,0,0
VAN BUREN HEALTHCARE AND REHABILITATION CENTER,045268,1404 NORTH 28TH STREET,VAN BUREN,Crawford,0,13,1,0,96,0,11,0
ATKINS NURSING AND REHABILITATION CENTER,045339,605 NORTHWEST 7TH STREET,ATKINS,Pope,0,0,1,0,59,0,0,0
"THE WATERS OF CUMBERLAND, LLC",045359,1516  CUMBERLAND ST,LITTLE ROCK,Pulaski,0,0,0,0,72,0,0,0
"THE WATERS OF NEWPORT, LLC",045334,326 LINDLEY LANE,NEWPORT,Jackson,0,0,0,0,80,0,1,0
RICH MOUNTAIN NURSING AND REHABILITATION CENTER,045358,306 HORNBECK AVENUE,MENA,Polk,0,0,15,0,77,0,6,0
PLEASANT MANOR NURSING & REHAB,045227,950 HOMESTEAD,ASHDOWN,Little River,0,0,1,0,73,0,0,0
MAPLE HEALTHCARE,045228,200 S MAPLE STREET,HAZEN,Prairie,0,0,0,0,43,0,0,0
"MITCHELL'S NURSING HOME, INC",045454,501 W 10TH,DANVILLE,Yell,0,7,0,0,94,0,5,0
"SILOAM HEALTHCARE, LLC",045356,811 WEST ELGIN STREET,SILOAM SPRINGS,Benton,0,0,1,0,96,0,0,0
"STONEGATE VILLA HEALTH AND REHABILITATION, LLC",045437,118 JERRY SELBY DRIVE,CROSSETT,Ashley,0,0,0,0,63,0,0,0
BARROW CREEK HEALTH AND REHAB,045432,2600  BARROW ROAD,LITTLE ROCK,Pulaski,0,0,0,0,86,0,0,0
"GREYSTONE NURSING AND REHAB, LLC",045453,121 SPRING VALLEY ROAD,CABOT,Lonoke,0,0,0,0,64,0,0,0
ST MICHAEL'S HEALTHCARE,045323,1311 NORTH PECAN ST,NEWPORT,Jackson,0,0,2,0,68,0,1,0
"PRAIRIE GROVE HEALTH AND REHABILITATION, LLC",045409,621 SOUTH MOCK STREET,PRAIRIE GROVE,Washington,0,0,0,0,57,0,5,0
SOUTHERN PINES HEALTH AND REHAB,045470,700 MANOR RD,PRESCOTT,Nevada,0,0,0,0,56,0,0,0
THE VILLAGES OF GENERAL BAPTIST HEALTH CARE  EAST,045311,6811 SOUTH HAZEL STREET,PINE BLUFF,Jefferson,0,0,0,0,1,0,0,0
PINK BUD HOME FOR THE GOLDEN YEARS,045456,400 SO COKER,GREENWOOD,Sebastian,0,0,2,0,76,0,2,0
CORNING THERAPY AND LIVING CENTER,045433,831 NORTH MISSOURI,CORNING,Clay,0,1,1,0,57,0,0,0
"DARDANELLE NURSING AND REHABILITATION CENTER,INC",045290,2199 STATE HWY 7 NORTH,DARDANELLE,Yell,0,0,0,0,99,0,0,0
LAKEWOOD THERAPY AND LIVING CENTER,045404,260 LAKEPARK DRIVE,HOT SPRINGS,Garland,0,1,0,0,54,0,1,0
MIDTOWN POST ACUTE AND REHABILITATION - A WATERS C,045450,5720 WEST MARKHAM STREET,LITTLE ROCK,Pulaski,2,0,0,0,83,3,0,0
ST ANDREWS HEALTHCARE,045313,3501 COLLEGE AVENUE,CONWAY,Faulkner,0,0,0,0,68,0,0,0
THREE RIVERS HEALTHCARE AND REHABILITATION,045391,33904 HIGHWAY 63 E,MARKED TREE,Poinsett,0,0,0,0,99,0,8,0
THE VILLAGES OF GENERAL BAPTIST HEALTH CARE WEST,045379,6810 SOUTH HAZEL STREET,PINE BLUFF,Jefferson,0,0,1,0,130,0,0,0
METHODIST HEALTH AND REHAB,045413,7425 EUPER LANE,FORT SMITH,Sebastian,0,10,16,0,118,0,7,0
BAILEY CREEK HEALTH AND REHAB,045241,1621 EAST 42ND ST,TEXARKANA,Miller,0,0,0,0,88,0,0,0
"LEGACY HEIGHTS NURSING AND REHAB, LLC",045410,900 WEST 12TH ST,RUSSELLVILLE,Pope,2,8,0,0,67,3,23,0
ARKANSAS CONVALESCENT CENTER,045277,6301 SOUTH  HAZEL STREET,PINE BLUFF,Jefferson,,,,,,,,
ARKANSAS HEALTH CENTER,04A293,6701 HWY 67,BENTON,Saline,0,0,0,0,237,0,0,0
SUMMIT HEALTH & REHAB CENTER,045411,506 NORTH LONG AVENUE,TAYLOR,Columbia,5,1,6,2,41,5,0,0
WINDCREST HEALTH AND REHAB INC,045367,2455 LOWELL ROAD,SPRINGDALE,Washington,0,0,0,0,57,0,0,0
KATHERINE'S PLACE AT WEDINGTON,045434,4405 WEST PERSIMMON STREET,FAYETTEVILLE,Washington,1,0,0,0,104,0,0,0
"NASHVILLE NURSING AND REHAB, INC",045342,810 NORTH 8TH ST,NASHVILLE,Howard,0,0,0,0,49,0,0,0
CHAPEL RIDGE HEALTH AND REHAB,045364,4623 ROGERS AVE,FORT SMITH,Sebastian,0,0,16,0,79,0,0,0
TWIN LAKES THERAPY AND LIVING,045280,6152 HIGHWAY 202 EAST,FLIPPIN,Marion,0,0,0,0,64,0,0,0
BATESVILLE HEALTHCARE LLC,045203,1975 WHITE DRIVE,BATESVILLE,Independence,0,0,0,0,90,2,0,0
"JAMESTOWN NURSING AND REHAB, LLC",045435,2001 HAMPTON PLACE,ROGERS,Benton,0,2,0,0,118,0,6,0
COMMUNITY COMPASSION CENTER OF YELLVILLE,045451,620 NORTH PANTHER AVENUE,YELLVILLE,Marion,,,,,,,,
"THE WATERS OF FORT SMITH, LLC",045345,5301 WHEELER AVENUE,FORT SMITH,Sebastian,0,0,0,0,110,0,0,0
"CLA-CLIF NURSING AND REHAB CENTER, INC",045430,1214 NORTH MAIN,BRINKLEY,Monroe,0,0,1,0,47,0,0,0
OZARK NURSING HOME INC,045386,600 NORTH 12TH ST,OZARK,Franklin,0,2,0,0,93,0,21,0
BRIGHTON RIDGE,045242,235 HUNTSVILLE ROAD,EUREKA SPRINGS,Carroll,0,0,0,0,31,0,0,0
"HICKORY HEIGHTS HEALTH AND REHAB, LLC",045455,#3 CHENAL HEIGHTS DRIVE,LITTLE ROCK,Pulaski,0,0,0,0,83,0,1,0
ALMA HEALTHCARE AND REHABILITATION CENTER,045370,401 HEATHER LANE,ALMA,Crawford,0,0,1,0,72,0,0,0
CAVE CITY NURSING HOME INC,045148,442 TAYLOR CIRCLE,CAVE CITY,Sharp,0,0,0,0,72,1,0,0
PROMENADE HEALTH AND REHABILITATION,045361,1101 S PROMENADE BOULEVARD,ROGERS,Benton,0,1,2,0,79,0,6,0
LAKESIDE HEALTH AND REHAB,045315,1207 WILLOW RUN ROAD,LAKE CITY,Craighead,0,0,10,0,64,0,0,0
HEATHER MANOR NURSING AND REHABILITATION CENTER,045337,400 WEST 23RD STREET,HOPE,Hempstead,0,5,12,0,99,0,6,0
"ST JOHNS PLACE OF ARKANSAS, LLC",045396,1400 HWY 79/167 BYPASS,FORDYCE,Dallas,0,0,7,0,52,0,0,0
POCAHONTAS HEALTHCARE AND REHABILITATION CENTER,045284,105 COUNTRY CLUB ROAD,POCAHONTAS,Randolph,0,2,9,0,55,0,0,0
ST ELIZABETH'S PLACE,045380,3010 MIDDLEFIELD DRIVE,JONESBORO,Craighead,0,0,0,0,90,0,1,0
WOOD-LAWN HEIGHTS,045317,2800 NEELEY STREET,BATESVILLE,Independence,0,0,2,0,130,0,8,0
OAK MANOR NURSING AND REHABILITATION CENTER INC,045301,150 MORTON AVENUE,BOONEVILLE,Logan,0,1,12,0,58,0,5,0
LAKE VILLAGE REHABILITATION AND CARE CENTER,045184,903 BORGOGNONI DRIVE,LAKE VILLAGE,Chicot,0,4,7,0,45,0,0,0
LAKE HAMILTON HEALTH AND REHAB,045445,120 PITTMAN ROAD,HOT SPRINGS,Garland,0,0,0,0,63,0,0,0
WOODBRIAR NURSING HOME,045384,204 CATHERINE ST,HARRISBURG,Poinsett,0,0,0,0,67,0,0,0
RIVER RIDGE REHABILITATION AND CARE CENTER,045157,1100 EAST MARTIN DRIVE,WYNNE,Cross,0,0,10,0,59,0,1,0
CONWAY HEALTHCARE AND REHABILITATION CENTER,045245,2603 DAVE WARD DRIVE,CONWAY,Faulkner,0,0,3,0,73,1,0,0
HIGHLAND HEALTHCARE AND REHABILITATION CENTER,045402,670 ROGERS ROAD,BELLA VISTA,Benton,0,0,0,0,49,0,0,0
"CHAMBERS NURSING HOME CENTER, INC",045318,1001 EAST PARK STREET,CARLISLE,Lonoke,0,8,1,0,69,0,0,0
ROBINSON NURSING AND REHABILITATION CENTER LLC,045374,519 DONOVAN BRILEY BLVD.,NORTH LITTLE ROCK,Pulaski,0,0,3,0,75,1,0,0
GENERAL BAPTIST NURSING HOME OF PIGGOTT,045178,450 S 9TH AVE,PIGGOTT,Clay,0,0,0,0,34,0,0,0
"THE WATERS OF WHITE HALL, LLC",045372,9209 DOLLARWAY ROAD,WHITE HALL,Jefferson,43,3,32,13,61,33,3,0
STELLA MANOR NURSING AND REHABILITATION CENTER,045247,400 NORTH VANCOUVER AVENUE,RUSSELLVILLE,Pope,0,0,0,0,73,0,0,0
BARNES HEALTHCARE,045314,1010 BARNES STREET,LONOKE,Lonoke,0,0,1,0,54,0,0,0
LONGMEADOW NURSING CENTER - CAMDEN,045348,365 ALPHA STREET,CAMDEN,Ouachita,,,,,,,,
EDGEWOOD HEALTH AND REHAB,045428,1393 E DON TYSON PARKWAY,SPRINGDALE,Washington,1,0,2,0,74,0,0,0
ARKANSAS NURSING AND REHABILITATION CENTER,045211,2107 DUDLEY STREET,TEXARKANA,Miller,0,0,1,0,98,0,0,0
HUDSON MEMORIAL NURSING HOME,045214,700 N. COLLEGE AVENUE,EL DORADO,Union,0,0,1,0,76,0,0,0
ALLAY HEALTH AND REHAB,045288,3115 BOWMAN ROAD,LITTLE ROCK,Pulaski,0,0,2,2,22,0,0,0
OAK RIDGE HEALTH AND REHABILITATION,045271,501 HUDSON ST,EL DORADO,Union,0,0,1,0,85,0,1,0
ALCOA PINES HEALTH AND REHABILITATION,045408,3300 ALCOA ROAD,BENTON,Saline,0,0,3,0,89,0,0,0
CRAWFORD HEALTHCARE AND REHABILITATION CENTER,045326,2010 MAIN STREET,VAN BUREN,Crawford,0,0,0,0,86,0,0,0
SOMERSET SENIOR LIVING AT CANYON SPRINGS,045142,1401 PARK AVENUE,HOT SPRINGS,Garland,,,,,,,,
COURTYARD GARDENS HEALTH AND REHABILITATION CENTER,045350,2701 TWIN RIVERS DRIVE,ARKADELPHIA,Clark,0,0,8,0,81,0,3,0
CARE MANOR NURSING AND REHAB,045351,804 BURNETT DRIVE,MOUNTAIN HOME,Baxter,0,0,0,0,69,0,0,0
SOUTHFORK RIVER THERAPY AND LIVING,045248,624 HWY 62/412 WEST,SALEM,Fulton,1,2,1,0,69,0,3,0
"SHILOH NURSING AND REHAB, LLC",045427,1092 WEST STULTZ ROAD,SPRINGDALE,Washington,0,2,2,0,72,0,0,0
"HIGHLAND COURT, A REHABILITATION AND RESIDENT CARE",045353,942 NORTH HIGHWAY 65,MARSHALL,Searcy,0,4,16,0,44,0,0,0
OAKDALE NURSING FACILITY,045418,101 CYNTHIA STREET,JUDSONIA,White,0,0,4,0,92,0,0,0
"CRESTPARK MARIANNA, L L C",045449,700 WEST CHESTNUT,MARIANNA,Lee,0,0,0,0,56,0,0,0
CAVALIER HEALTHCARE OF ENGLAND,045442,400 STUTTGART HIGHWAY,ENGLAND,Lonoke,0,0,0,0,50,0,0,0
ASH FLAT HEALTHCARE AND REHABILITATION CENTER,045155,66 OZBIRN LANE,ASH FLAT,Sharp,32,7,18,3,65,15,0,0
"GLENWOOD HEALTH AND REHABILITATION, LLC",045403,615 MOUNTAIN VIEW ROAD,GLENWOOD,Pike,0,0,5,0,50,0,0,0
"ASHTON PLACE HEALTH AND REHAB, LLC",045419,318 STROZIER LANE,BARLING,Sebastian,0,0,14,0,103,0,0,0
AUTUMN HILL,045295,500 HAMMOND AVENUE,BERRYVILLE,Carroll,0,0,0,0,55,0,0,0
"THE WATERS OF WOODLAND HILLS, LLC",045259,8701 RILEY DRIVE,LITTLE ROCK,Pulaski,0,0,0,0,10,0,0,0
"BRADFORD HOUSE NURSING AND REHAB, LLC",045373,1202 S E 30TH STREET,BENTONVILLE,Benton,0,0,0,0,81,0,0,0
THE GREEN HOUSE COTTAGES OF SOUTHERN HILLS,045377,701 SOUTH MAIN STREET,RISON,Cleveland,0,0,8,0,71,0,1,0
GOOD SAMARITAN SOCIETY - HOT SPRINGS VILLAGE,045191,121 CORTEZ RD,HOT SPRINGS VILLAGE,Garland,0,0,0,0,34,0,0,0
"INNISFREE HEALTH AND REHAB, LLC",045302,301 SOUTH 24TH STREET,ROGERS,Benton,0,0,0,0,66,0,0,0
SOMERSET SENIOR LIVING AT PREMIER,045357,3600 RICHARDS ROAD,NORTH LITTLE ROCK,Pulaski,0,0,0,0,113,0,0,0
RANDOLPH COUNTY NURSING HOME,045443,500 CAMP ROAD,POCAHONTAS,Randolph,1,11,3,0,130,0,6,0
NORTH HILLS LIFE CARE AND REHAB,045398,27 E APPLEBY ROAD,FAYETTEVILLE,Washington,0,0,5,0,71,2,1,0
"THE WATERS OF WEST DIXON, LLC",045446,2821 W DIXON RD,LITTLE ROCK,Pulaski,0,0,0,0,87,0,0,0
AMBERWOOD HEALTH AND REHABILITATION,045464,6420 ALCOA ROAD,BENTON,Saline,0,4,0,0,88,1,5,0
BENTLEY REHABILITATION AND HEALTH CENTER,045194,1100 EAST 36TH STREET,TEXARKANA,Miller,0,3,5,0,39,0,2,0
"JOHNSON COUNTY HEALTH AND REHAB, LLC",045168,1451 EAST POPLAR STREET,CLARKSVILLE,Johnson,0,0,7,0,109,0,3,0
THE GREEN HOUSE COTTAGES OF WENTWORTH PLACE,045187,26 WARNOCK SPRINGS ROAD,MAGNOLIA,Columbia,0,2,15,0,95,0,0,0
SOMERSET SENIOR LIVING AT MOUNT VISTA,045192,202 TIMS AVENUE,HARRISON,Boone,,,,,,,,
"APPLE CREEK HEALTH AND REHAB, LLC",045465,1570 W CENTERTON BLVD,CENTERTON,Benton,0,3,0,0,96,0,5,0
TWIN RIVERS HEALTH AND REHABILITATION,045216,3021 TWIN RIVERS DRIVE,ARKADELPHIA,Clark,0,1,0,0,84,0,0,0
"CABOT HEALTH AND REHAB, LLC",045208,200 NORTHPORT DRIVE,CABOT,Lonoke,0,1,1,0,69,0,1,0
ASHLEY REHABILITATION AND HEALTH CARE CENTER,045421,2600 N 22ND STREET,ROGERS,Benton,0,0,0,0,65,0,0,0
FAYETTEVILLE HEALTH AND REHABILITATION CENTER,045220,3100 OLD MISSOURI RD,FAYETTEVILLE,Washington,0,1,15,0,106,0,0,0
EAST POINT HEALTH AND REHAB,045469,505 E VICTORY ST,STAR CITY,Lincoln,0,0,0,0,43,0,0,0
"CRESTPARK FORREST CITY, LLC",045219,500 KITTLE RD,FORREST CITY,St. Francis,0,0,0,0,57,0,0,0
SHERIDAN HEALTHCARE AND REHABILITATION CENTER,045256,113 SOUTH BRIARWOOD DRIVE,SHERIDAN,Grant,0,1,11,0,68,0,1,0
THE PINES NURSING AND REHABILITATION CENTER,045243,524 CARPENTER DAM ROAD,HOT SPRINGS,Garland,0,1,14,0,96,0,1,0
SOMERSET SENIOR LIVING AT SEVEN SPRINGS,045158,1040 WEDDING FORD ROAD,HEBER SPRINGS,Cleburne,0,0,0,0,58,0,0,0
THE LAKES AT MAUMELLE HEALTH AND REHABILITATION,045422,103 ALEXANDRIA DRIVE,MAUMELLE,Pulaski,42,15,15,7,46,13,0,0
THE GREEN HOUSE COTTAGES OF POPLAR GROVE,045466,7801 KANIS RD,LITTLE ROCK,Pulaski,2,10,6,0,76,3,2,0
"WEST MEMPHIS WELLNESS, LLC",045195,800 WEST BROADWAY,WEST MEMPHIS,Crittenden,0,0,12,0,85,1,27,0
"WESTWOOD HEALTH AND REHAB, INC",045371,802 S WEST END STREET,SPRINGDALE,Washington,0,0,0,0,60,0,0,0
SOMERSET SENIOR LIVING AT CROSSETT,045190,1101 WATERWELL RD,CROSSETT,Ashley,,,,,,,,
RECTOR NURSING AND REHAB,045394,1023 HIGHWAY 119,RECTOR,Clay,2,0,4,0,46,0,0,0
QUAPAW CARE AND REHABILITATION CENTER LLC,045338,138 BRIGHTON TERRACE,HOT SPRINGS,Garland,0,0,0,0,82,0,0,0
RIVER CHASE REHABILITATION AND CARE CENTER,045149,# 12 HOSPITAL DRIVE,MORRILTON,Conway,0,0,5,0,46,0,5,0
COVINGTON COURT HEALTH AND REHABILITATION CENTER,045363,4500 OLD GREENWOOD RD,FORT SMITH,Sebastian,0,0,3,0,114,0,0,0
WOODRUFF COUNTY HEALTH CENTER,045222,139 WEST HIGHWAY 64,MCCRORY,Woodruff,0,0,17,0,86,0,0,0
GASSVILLE THERAPY AND LIVING,045218,203 COTTER ROAD,GASSVILLE,Baxter,0,0,3,0,65,0,1,0
"BEEBE RETIREMENT CENTER, INC.",045304,709 MCAFEE LANE,BEEBE,White,,,,,,,,
HEARTLAND REHABILITATION AND CARE CENTER,045199,19701 INTERSTATE 30,BENTON,Saline,0,3,27,0,75,0,0,0
MONETTE MANOR LLC,045312,669 HWY 139 NORTH,MONETTE,Craighead,0,0,0,0,78,0,0,0
DEWITT NURSING HOME,045365,1605 SOUTH MADISON ST,DE WITT,Arkansas,0,0,1,0,32,0,0,0
RUSSELLVILLE NURSING AND REHABILITATION CENTER,045340,215 SOUTH PORTLAND AVENUE,RUSSELLVILLE,Pope,0,0,1,0,82,0,0,0
THE GREEN HOUSE COTTAGES OF BELLE MEADE,045170,2200 CHATEAU BOULEVARD,PARAGOULD,Greene,0,0,15,0,123,1,0,0
DIERKS HEALTH & REHAB,045346,402 S ARKANSAS AVENUE,DIERKS,Howard,,,,,,,,
INDIAN ROCK VILLAGE HEALTH CENTER,045153,265 DAVE CREEK PARKWAY,FAIRFIELD BAY,Van Buren,0,0,0,0,23,0,0,0
HERITAGE LIVING CENTER,045308,1175 MORNINGSIDE DRIVE,CONWAY,Faulkner,0,16,2,0,126,1,1,0
ARBOR OAKS HEALTHCARE AND REHABILITATION CENTER,045270,105 RUSSELLVILLE ROAD,MALVERN,Hot Spring,0,1,4,0,58,0,0,0
"SHERWOOD NURSING & REHABILITATION CENTER, INC",045376,245 INDIAN BAY DRIVE,SHERWOOD,Pulaski,0,2,11,0,78,0,2,0
"CRESTPARK WYNNE, LLC",045166,400 ARKANSAS STREET,WYNNE,Cross,1,0,1,0,52,1,3,0
GREENE ACRES NURSING HOME,045424,2402 COUNTRY CLUB ROAD,PARAGOULD,Greene,2,0,1,0,122,0,0,0
GREENHURST NURSING CENTER,045447,226 SKYLER DRIVE,CHARLESTON,Franklin,0,0,17,0,94,0,6,0
"THE WATERS OF STAMPS, LLC",045232,826 NORTH STREET,STAMPS,Lafayette,0,0,0,0,50,0,0,0
"COLONEL GLENN HEALTH AND REHAB, LLC",045460,13700 DAVID O DODD ROAD,LITTLE ROCK,Pulaski,,,,,,,,
NURSING AND REHABILITATION CENTER AT GOOD SHEPHERD,045343,3001 ALDERSGATE ROAD,LITTLE ROCK,Pulaski,0,0,3,0,105,0,0,0
BELLE VIEW ESTATES REHABILITATION AND CARE CENTER,045239,1052 OLD WARREN ROAD,MONTICELLO,Drew,0,0,2,0,52,0,0,0
CHAPEL WOODS HEALTH AND REHABILITATION,045201,1440 EAST CHURCH,WARREN,Bradley,0,2,0,0,78,0,2,0
WHITE RIVER HEALTHCARE,045401,1569 AR HIGHWAY 56,CALICO ROCK,Izard,0,0,0,0,58,0,0,0
QUAIL RUN HEALTH AND REHAB,045468,333 MELODY DRIVE,TRUMANN,Poinsett,0,0,0,0,54,0,0,0
LEGACY HEALTH AND REHABILITATION CENTER,045267,3310 NORTH 50TH STREET,FORT SMITH,Sebastian,0,3,12,0,90,1,5,0
"THE WATERS OF MOUNTAIN VIEW, LLC",045146,706 OAK GROVE ST,MOUNTAIN VIEW,Stone,0,2,0,0,79,0,0,0
DERMOTT CITY NURSING HOME,045172,702 WEST GAINES ST,DERMOTT,Chicot,,,,,,,,
GOSNELL HEALTH AND REHAB,045439,700 MOODY STREET,GOSNELL,Mississippi,0,0,10,0,65,0,0,0
"LAKEWOOD HEALTH AND REHAB, LLC",045202,2323 MCCAIN BOULEVARD,NORTH LITTLE ROCK,Pulaski,,,,,,,,
"MURFREESBORO REHAB AND NURSING, INC",045415,110 W 13TH STREET,MURFREESBORO,Pike,0,0,0,0,42,0,0,0
EAGLECREST NURSING AND REHAB,045352,916 HIGHWAY 62/412,ASH FLAT,Sharp,0,0,2,0,81,0,0,0
SILVER OAKS HEALTH AND REHABILITATION,045173,1875 OLD WIRE ROAD,CAMDEN,Ouachita,1,1,0,0,79,0,0,0
ADVANCED HEALTH AND REHAB OF UNION COUNTY,045275,1700 EAST SHORT HILLSBORO,EL DORADO,Union,0,144,0,0,63,0,2,0
"COURTYARD REHABILITATION AND HEALTH CENTER, LLC",045182,2415 W HILLSBORO,EL DORADO,Union,34,3,11,0,71,7,0,0
OUACHITA NURSING AND REHABILITATION CENTER,045207,1411 COUNTRY CLUB ROAD,CAMDEN,Ouachita,0,1,8,0,75,0,0,0
FIANNA HILLS NURSING AND REHABILITATION CENTER,045354,8411 SOUTH 28TH STREET,FORT SMITH,Sebastian,,,,,,,,
ARKANSAS STATE VETERANS HOME AT NORTH LITTLE ROCK,045462,2401 JOHN ASHLEY DRIVE,NORTH LITTLE ROCK,Pulaski,0,0,0,0,91,1,0,0
BEAR CREEK HEALTHCARE LLC,045287,322 WEST COLLIN RAYE DRIVE,DE QUEEN,Sevier,0,0,0,0,47,0,0,0
"CRESTPARK DEWITT, LLC",045177,1325 LIBERTY DRIVE,DE WITT,Arkansas,0,0,1,0,48,0,0,0
LITTLE RIVER NURSING & REHAB,045244,162 HWY 32-2A,ASHDOWN,Little River,0,7,18,0,77,0,5,0
MOUNTAIN MEADOWS HEALTH AND REHABILITATION,045369,1680 BATESVILLE BOULEVARD,BATESVILLE,Independence,0,0,1,0,96,0,0,0
WALDRON NURSING CENTER INC,045383,1369 WEST 6TH STREET,WALDRON,Scott,0,4,1,0,62,0,5,0
EVERGREEN LIVING CENTER AT STAGECOACH,045457,6907 HIGHWAY 5 NORTH,BRYANT,Saline,0,5,0,0,73,0,2,0
THE CROSSING AT RIVERSIDE HEALTH AND REHABILITATIO,045209,2500 EAST MOORE AVENUE,SEARCY,White,0,0,2,0,108,0,0,0
PERRY COUNTY NURSING AND REHABILITATION CENTER,045246,1321 SCENIC DRIVE,PERRYVILLE,Perry,0,0,0,0,62,0,0,0
WALNUT RIDGE NURSING AND REHABILITATION CENTER,045151,1500 WEST MAIN STREET,WALNUT RIDGE,Lawrence,50,12,18,6,57,25,0,0
SPRING CREEK HEALTH & REHAB,045392,804 N 2ND ST,CABOT,Lonoke,2,79,1,0,79,0,0,0
DES ARC NURSING AND REHABILITATION CENTER,045236,2216 WEST MAIN STREET,DES ARC,Prairie,0,1,5,0,54,0,1,0
COTTAGE LANE HEALTH AND REHAB,045458,800 BROOKSIDE DRIVE,LITTLE ROCK,Pulaski,0,4,2,0,89,0,31,0
SOMERSET SENIOR LIVING AT PINE HILLS,045189,900 MAGNOLIA RD,CAMDEN,Ouachita,,,,,,,,
"BELVEDERE NURSING AND REHABILITATION CENTER, LLC",045463,2600 PARK AVE,HOT SPRINGS,Garland,0,0,0,0,64,0,0,0
"NASHVILLE WELLNESS, LLC",045180,1407 NORTH MAIN STREET,NASHVILLE,Howard,0,0,0,0,60,0,0,0
"PRESBYTERIAN VILLAGE, INC",045436,500 BROOKSIDE DRIVE,LITTLE ROCK,Pulaski,0,0,0,0,52,1,0,0
"THE WATERS OF ROGERS, LLC",045212,1513 SOUTH DIXIELAND RD,ROGERS,Benton,,,,,,,,
"LONOKE HEALTH AND REHAB CENTER, LLC",045289,1501 LINCOLN STREET,LONOKE,Lonoke,0,0,0,0,65,0,0,0
SOUTHERN TRACE REHABILITATION AND CARE CENTER,045305,22515 I 30,BRYANT,Saline,0,1,12,0,96,0,0,0
WILLOWBEND HEALTHCARE AND REHABILITATION,045412,830 CANAL ST,MARION,Crittenden,31,1,8,5,94,18,2,0
"CONCORDIA NURSING & REHAB, LLC",045143,7 PROFESSIONAL DRIVE,BELLA VISTA,Benton,,,,,,,,
HILLCREST HOME,045441,1111 MAPLEWOOD RD,HARRISON,Boone,0,8,3,0,97,0,4,0
RIDGECREST HEALTH AND REHABILITATION,045327,5504 E JOHNSON AVE,JONESBORO,Craighead,0,5,2,0,117,0,0,0
ARKANSAS VETERANS HOME AT FAYETTEVILLE,045417,1179 NORTH COLLEGE AVENUE,FAYETTEVILLE,Washington,0,0,4,0,73,0,0,0
LAWRENCE HALL HEALTH & REHABILITATION,045452,1051 WEST FREE STREET,WALNUT RIDGE,Lawrence,0,28,0,0,124,0,11,0
CRAIGHEAD NURSING CENTER,04A158,5101 HARRISBURG RD,JONESBORO,Craighead,0,9,20,0,93,1,17,0
"SALEM PLACE NURSING AND REHABILITATION CENTER, INC",045183,2401 CHRISTINA LANE,CONWAY,Faulkner,,,,,,,,
"BRIARWOOD NURSING AND REHABILITATION CENTER,INC",045387,516 SO RODNEY PARHAM RD,LITTLE ROCK,Pulaski,42,0,18,5,72,19,0,0
GOOD SAMARITAN SOCIETY - MOUNTAIN HOME,045250,300 GOOD SAMARITAN DRIVE,MOUNTAIN HOME,Baxter,0,0,0,0,37,0,0,0
WEST MEMPHIS HEALTH AND REHAB,045217,610 SOUTH AVALON ST,WEST MEMPHIS,Crittenden,6,0,2,0,55,8,0,0
MANILA HEALTHCARE CENTER,045297,814 NORTH DAVIS ST,MANILA,Mississippi,0,0,6,0,61,0,0,0
"THE WATERS OF NORTH LITTLE ROCK, LLC",045385,2501 JOHN ASHLEY DRIVE,NORTH LITTLE ROCK,Pulaski,0,0,0,0,109,0,0,0
TRINITY VILLAGE MEDICAL CENTER,045438,6400 TRINITY DRIVE,PINE BLUFF,Jefferson,0,0,1,0,67,0,0,0
MEADOWVIEW HEALTHCARE AND REHAB,045341,825 NORTH GASKILL,HUNTSVILLE,Madison,0,0,0,0,45,0,0,0
HERITAGE SQUARE HEALTHCARE CENTER,045366,710 NO RUDDLE ROAD,BLYTHEVILLE,Mississippi,0,0,2,0,72,0,0,0
OZARK HEALTH NURSING AND REHAB  CENTER,045414,2500 HIGHWAY 65 SOUTH,CLINTON,Van Buren,0,0,0,0,76,0,0,0
THE MAPLES AT HAR-BER MEADOWS,045407,6456 LYNCHS PRAIRIE COVE,SPRINGDALE,Washington,1,1,2,0,116,1,0,0
BROOKRIDGE COVE REHABILITATION AND CARE  CENTER,045147,1000 BROOKRIDGE LANE,MORRILTON,Conway,0,0,16,0,62,0,0,0
ENCORE HEALTHCARE AND REHABILITATION OF WEST LITTL,045390,12111 HINSON RD,LITTLE ROCK,Pulaski,0,0,0,0,76,0,0,0
VILLAGE SPRINGS HEALTH AND REHABILITATION,045254,1208 NORTH HIGHWAY 7,HOT SPRINGS,Garland,0,0,0,0,93,0,0,0
HAPPY VALLEY NURSING & REHABILITATION,045459,955 DIVISION STREET,MALVERN,Hot Spring,,,,,,,,
HARRIS HEALTH AND REHAB,045440,287 SOUTH COUNTRY CLUB ROAD,OSCEOLA,Mississippi,17,1,9,1,65,6,0,0
PIONEER THERAPY AND LIVING,045322,1506 EAST MAIN STREET,MELBOURNE,Izard,0,0,1,0,77,0,0,0
THE VILLAGE AT VALLEY RANCH,045431,6411 VALLEY RANCH DRIVE,LITTLE ROCK,Pulaski,0,0,0,0,74,1,1,0
