Provider Name,Federal Provider Number,Provider Address,Provider City,County,Residents Total Confirmed COVID-19,Residents Total Suspected COVID-19,Residents Total All Deaths,Residents Total COVID-19 Deaths,Total Number of Occupied Beds,Staff Total Confirmed COVID-19,Staff Total Suspected COVID-19,Staff Total COVID-19 Deaths
"NORTH HILL NURSING AND REHABILITATION CTR, LLC",015091,200 NORTH PINE HILL ROAD,BIRMINGHAM,Jefferson,24,17,27,6,171,12,5,0
AHC MILLENIUM,015458,5275 MILLENNIUM DRIVE,HUNTSVILLE,Madison,0,9,23,0,74,6,5,0
AZALEA GARDENS OF MOBILE,015151,1758 SPRINGHILL AVE,MOBILE,Mobile,29,3,11,1,84,20,5,0
CROWNE HEALTH CARE OF MOBILE,015100,954 NAVCO ROAD,MOBILE,Mobile,8,1,12,5,117,15,2,1
REGENCY HEALTH CARE AND REHABILITATION CENTER,015372,"2061 POOLE DRIVE, NW",HUNTSVILLE,Madison,2,4,3,0,71,4,2,0
SUNSET MANOR,015149,251 SUNSET PLACE,GUIN,Marion,3,8,6,0,61,5,6,0
FATHER PURCELL MEMORIAL EXCEPTIONAL CHILDREN'S CTR,01A193,2048 W FAIRVIEW AVE,MONTGOMERY,Montgomery,11,0,1,0,47,15,0,0
WIREGRASS REHABILITATION CENTER & NURSING HOME,015150,1200 MAPLE AVENUE WEST,GENEVA,Geneva,33,4,26,11,75,51,33,0
"LUVERNE HEALTH AND REHABILITATION, LLC",015336,142 WEST THIRD STREET,LUVERNE,Crenshaw,80,16,48,17,114,54,31,0
WESLEY PLACE ON HONEYSUCKLE,015175,718 HONEYSUCKLE ROAD,DOTHAN,Houston,92,4,41,27,133,69,20,0
"NHC HEALTHCARE, MOULTON",015128,300 HOSPITAL STREET,MOULTON,Lawrence,76,1,30,25,92,60,2,0
SOUTHERN SPRINGS HEALTHCARE FACILITY,015171,745 SOUTHERN SPRINGS ROAD,UNION SPRINGS,Bullock,60,42,20,10,86,47,6,0
"CROSSVILLE HEALTH AND REHABILITATION, LLC",015176,8922 HIGHWAY 227,CROSSVILLE,DeKalb,77,4,39,5,127,70,10,0
BROOKSHIRE HEALTHCARE CENTER,015127,4320 JUDITH LANE,HUNTSVILLE,Madison,39,1,10,4,96,16,7,0
"CAREGIVERS OF PLEASANT GROVE, INC",015044,700 FIRST AVENUE,PLEASANT GROVE,Jefferson,35,21,15,11,47,18,3,0
SOUTH HAMPTON NURSING & REHABILITATION CENTER,015448,213 WILSON MANN ROAD,OWENS CROSS ROADS,Madison,0,1,3,0,54,4,6,0
"FOLSOM CENTER FOR REHABILITATION AND HEALTHCARE, T",015437,401 ARNOLD STREET N.E.,CULLMAN,Cullman,56,37,25,1,69,45,97,2
ALLEN HEALTH AND REHABILITATION,015098,735 SOUTH WASHINGTON AVENUE,MOBILE,Mobile,49,26,24,18,65,51,6,1
CROWNE HEALTH CARE OF GREENVILLE,015193,408 COUNTRY CLUB DRIVE,GREENVILLE,Butler,58,17,26,19,71,40,41,0
OAKVIEW MANOR HEALTH CARE CENTER,015216,929 MIXON SCHOOL ROAD,OZARK,Dale,78,21,34,18,90,41,56,0
TWIN OAKS REHABILITATION AND HEALTHCARE CENTER,015211,857 CRAWFORD LANE,MOBILE,Mobile,92,2,16,11,89,71,7,0
MADISON MANOR NURSING HOME,015214,3891 SULLIVAN ST,MADISON,Madison,0,7,14,0,68,6,22,0
EAMC LANIER NURSING HOME,015045,4800 48TH STREET,VALLEY,Chambers,2,42,24,1,82,19,85,0
TRUSSVILLE HEALTH & REHABILITATION CENTER,015467,119 WATTERSON PARKWAY,TRUSSVILLE,Jefferson,25,3,21,6,87,12,12,0
VILLAGE AT COOK SPRINGS SKILLED NURSING FACILITY,015195,415 COOK SPRINGS,PELL CITY,St. Clair,78,11,40,22,96,46,36,0
"PARK MANOR HEALTH AND REHABILITATION, LLC",015326,2201 MCFARLAND BOULEVARD,NORTHPORT,Tuscaloosa,73,12,32,9,124,44,30,0
LEGACY HEALTH AND REHABILITATION OF PLEASANT GROVE,015461,30 7TH STREET,PLEASANT GROVE,Jefferson,10,32,19,0,117,15,12,1
ATMORE NURSING CENTER,015129,715 EAST LAUREL STREET,ATMORE,Escambia,38,3,18,7,82,23,9,0
"NORTHWAY HEALTH AND REHABILITATION, LLC",015047,1424 NORTH 25TH STREET,BIRMINGHAM,Jefferson,10,5,12,0,103,12,3,0
HERITAGE HEALTH CARE & REHAB INC,015371,1101 SNOWS MILL AVENUE,TUSCALOOSA,Tuscaloosa,75,31,47,14,114,58,24,0
"BURNS NURSING HOME, INC.",015009,701 MONROE STREET NW,RUSSELLVILLE,Franklin,47,2,6,5,51,43,14,0
CHERRY HILL REHABILITATION & HEALTHCARE CENTER,015445,1250 JEFF GERMANY PARKWAY,BIRMINGHAM,Jefferson,,,,,,,,
COOSA VALLEY HEALTHCARE CENTER,015010,260 WEST WALNUT STREET,SYLACAUGA,Talladega,7,33,2,2,74,11,43,0
WOODHAVEN MANOR NURSING HOME,015177,105 WEST WINDSOR ST,DEMOPOLIS,Marengo,10,17,8,1,64,12,23,0
EASTERN SHORE REHABILITATION AND HEALTH CENTER,015049,"101 VILLA DRIVE, P O BOX 1090",DAPHNE,Baldwin,17,43,37,1,82,19,18,0
ARLINGTON REHABILITATION & HEALTHCARE CENTER,015153,"1020 TUSCALOOSA AVENUE, SW",BIRMINGHAM,Jefferson,80,0,25,17,95,55,3,0
ROANOKE REHABILITATION & HEALTHCARE CENTER,015424,680 SEYMOUR DRIVE,ROANOKE,Randolph,42,22,6,6,49,35,10,0
ALTOONA  HEALTH & REHAB,015101,6532 WALNUT GROVE ROAD,ALTOONA,Etowah,34,3,5,5,47,34,1,0
EXTENDICARE HEALTH CENTER,015152,950 SOUTH ST. ANDREWS STREET,DOTHAN,Houston,60,71,51,14,133,70,102,0
CAPITOL HILL HEALTHCARE CENTER,015390,520 SOUTH HULL STREET,MONTGOMERY,Montgomery,64,33,42,16,202,40,28,1
ANDALUSIA MANOR,015416,670 MOORE RD,ANDALUSIA,Covington,60,24,22,9,95,54,27,0
MONROE MANOR HEALTH & REHABILITATION CENTER,015398,236 WEST CLAIBORNE STREET,MONROEVILLE,Monroe,54,18,9,5,65,58,29,0
MEADOWVIEW NURSING CENTER,015400,7300 OLD HIGHWAY 78 EAST,PELL CITY,St. Clair,28,34,8,5,50,15,53,0
FAIRHOPE HEALTH & REHAB,015222,108 SOUTH CHURCH STREET,FAIRHOPE,Baldwin,3,4,0,0,62,16,0,0
CROWNE HEALTH CARE OF THOMASVILLE,015220,1425 MOSLEY DRIVE,THOMASVILLE,Clarke,4,1,14,0,70,16,0,0
"HUNTER CREEK HEALTH AND REHABILITATION, LLC",015034,600 34TH ST,NORTHPORT,Tuscaloosa,43,6,17,4,69,14,9,0
OAK TRACE CARE & REHABILITATION CENTER,015050,325 SELMA ROAD,BESSEMER,Jefferson,12,0,13,1,61,24,0,0
EASTVIEW REHABILITATION & HEALTHCARE CENTER,015014,7755 FOURTH AVENUE SOUTH,BIRMINGHAM,Jefferson,31,6,7,0,68,37,1,0
"SOUTH HEALTH AND REHABILITATION, LLC",015097,1220 SOUTH 17TH STREET,BIRMINGHAM,Jefferson,47,1,13,2,62,45,4,1
NORTH MOBILE NURSING AND REHABILITATION CTR,015183,4525 ST STEPHENS ROAD,EIGHT MILE,Mobile,46,36,31,13,122,43,26,0
CUMBERLAND HEALTH AND REHAB,015420,47065 AL HIGHWAY 277,BRIDGEPORT,Jackson,8,0,10,0,71,26,13,0
LAFAYETTE EXTENDED CARE,015197,805 HOSPITAL STREET SOUTHWEST,LAFAYETTE,Chambers,1,1,9,1,53,3,1,0
PLANTATION MANOR NURSING HOME,015015,6450 OLD TUSCALOOSA HIGHWAY   P O BOX 97,MC CALLA,Jefferson,0,0,11,0,85,1,0,0
CHEROKEE COUNTY HEALTH AND REHABILITATION CENTER,015200,877 CEDAR BLUFF ROAD,CENTRE,Cherokee,77,3,48,16,143,86,2,0
CROWNE HEALTH CARE OF MONTGOMERY,015393,1837 UPPER WETUMPKA ROAD,MONTGOMERY,Montgomery,44,6,56,8,133,27,16,0
CROWNE HEALTH CARE OF EUFAULA,015199,430 RIVERS AVENUE,EUFAULA,Barbour,118,27,38,11,131,53,28,0
OAK PARK,015452,1365 GATEWOOD DRIVE,AUBURN,Lee,8,14,8,0,72,7,23,0
TRAYLOR RETIREMENT COMMUNITY,015126,1235 YANCEY STREET  P O BOX 467,ROANOKE,Randolph,58,0,23,10,79,34,8,0
EAST GLEN,015388,53 MEDICAL PARK DRIVE EAST,BIRMINGHAM,Jefferson,4,0,8,0,89,19,5,0
MCGUFFEY HEALTH & REHABILITATION CENTER,015202,2301 RAINBOW DRIVE,GADSDEN,Etowah,25,28,40,1,145,23,75,0
"LINEVILLE HEALTH AND REHABILITATION, LLC",015142,88073 HIGHWAY 9,LINEVILLE,Clay,60,46,27,12,77,41,32,0
ALBERTVILLE NURSING HOME,015163,750 ALABAMA HIGHWAY 75 NORTH,ALBERTVILLE,Marshall,67,37,37,13,151,64,31,0
"HANCEVILLE NURSING & REHAB CENTER, INC",015073,420 MAIN STREET NE,HANCEVILLE,Cullman,32,25,24,3,194,21,21,0
DIVERSICARE OF FOLEY,015032,1701 NORTH ALSTON STREET,FOLEY,Baldwin,54,1,11,8,103,76,8,1
ATHENS HEALTH AND REHABILITATION LLC,015016,611 WEST MARKET STREET,ATHENS,Limestone,18,8,48,0,115,21,27,0
"ARBOR SPRINGS HEALTH AND REHAB CENTER, LTD",015192,1910 PEPPERELL PKWY,OPELIKA,Lee,70,0,63,19,118,63,3,0
MARENGO NURSING HOME,015330,608 NORTH MAIN STREET,LINDEN,Marengo,2,3,10,0,56,9,8,0
BARFIELD HEALTH CARE,015225,22444 HIGHWAY 431,GUNTERSVILLE,Marshall,73,36,59,11,91,51,63,0
FAIR HAVEN,015076,1424 MONTCLAIR ROAD,BIRMINGHAM,Jefferson,38,1,50,5,201,36,2,0
"SUMTER HEALTH AND REHABILITATION, L L C",015042,1505 EAST 4TH AVENUE,YORK,Sumter,85,1,17,3,82,83,12,0
ARBOR WOODS HEALTH AND REHAB,015141,515 2ND AVENUE NORTHWEST,REFORM,Pickens,0,0,7,0,51,4,2,0
SUMMERFORD NURSING HOME INC,015075,4087 HIGHWAY 31 SOUTHWEST,FALKVILLE,Morgan,9,28,48,0,185,25,127,0
"ASHLAND PLACE HEALTH AND REHABILITATION, LLC",015103,148 TUSCALOOSA ST,MOBILE,Mobile,82,19,47,21,114,28,5,0
TROY HEALTH & REHABILITATION CENTER,015213,515 ELBA HIGHWAY,TROY,Pike,25,45,18,3,140,22,35,0
"OAK KNOLL HEALTH AND REHABILITATION, LLC",015117,824 SIXTH AVENUE WEST,BIRMINGHAM,Jefferson,74,25,15,3,75,44,8,0
SIGNATURE HEALTHCARE OF WHITESBURG GARDENS,015116,105 TEAKWOOD DRIVE SW,HUNTSVILLE,Madison,79,2,26,8,94,62,0,0
"PHENIX CITY HEALTH CARE, INC",015331,3900 LAKEWOOD DRIVE,PHENIX CITY,Russell,51,0,21,8,55,45,12,0
WEST GATE VILLAGE,015035,100 PINEVIEW AND THIRD P.O. BOX 49,BREWTON,Escambia,68,11,11,8,105,42,15,0
MARION REGIONAL NURSING HOME,015167,184 SASSER DRIVE,HAMILTON,Marion,34,37,25,7,56,36,59,1
DIVERSICARE OF OXFORD,015132,1130 SOUTH HALE STREET,OXFORD,Calhoun,85,0,19,11,119,33,0,0
DIVERSICARE OF WINFIELD,015376,144 COUNTY HWY 14,WINFIELD,Marion,72,17,31,15,104,43,19,1
KIRKWOOD BY THE RIVER,015457,3605 RATLIFF ROAD,BIRMINGHAM,Jefferson,22,0,7,7,40,16,0,0
GLENWOOD CENTER,015147,211 ANA DRIVE,FLORENCE,Lauderdale,10,7,24,0,104,9,24,0
FOREST MANOR HEALTH AND REHAB,015143,2215 32ND STREET,NORTHPORT,Tuscaloosa,77,27,45,26,124,44,36,1
"ASPIRE PHYSICAL RECOVERY CENTER AT HOOVER, LLC",015464,575 SOUTHLAND DRIVE,HOOVER,Jefferson,10,17,26,0,92,19,25,0
CHOCTAW HEALTH AND REHAB,015164,1406 EAST PUSHMATAHA STREET,BUTLER,Choctaw,50,50,15,9,55,25,24,0
"PALM GARDENS HEALTH AND REHABILITATION, LLC",015403,3104 DAUPHIN SQUARE CONNECTOR,MOBILE,Mobile,42,6,29,7,68,34,6,0
KENSINGTON HEALTH AND REHABILITATION,015429,550 CONGRESS STREET,MOBILE,Mobile,70,2,20,5,107,41,8,0
BIRMINGHAM NURSING AND REHABILITATION CTR LLC,015217,1000 DUGAN AVENUE,BIRMINGHAM,Jefferson,36,13,19,2,117,21,14,0
PARK PLACE,015084,100 PARK PLACE,SELMA,Dallas,48,0,13,13,81,52,1,0
"GRAND BAY CONVALESCENT HOME, INC.",015406,13750 HIGHWAY 90 WEST P.O. BOX 328,GRAND BAY,Mobile,1,2,10,0,64,12,0,0
DIVERSICARE OF PELL CITY,015189,"510 WOLF CREEK ROAD, NORTH",PELL CITY,St. Clair,84,2,28,19,65,43,3,0
ST MARTIN'S IN THE PINES,015433,4941 MONTEVALLO ROAD,BIRMINGHAM,Jefferson,14,0,28,0,89,26,0,0
EVERGREEN NURSING HOME,015089,100 SANDERS DRIVE,EVERGREEN,Conecuh,41,1,8,6,56,23,1,0
LITTLE SISTERS OF THE POOR SACRED HEART RESIDENCE,015168,1655 MCGILL AVENUE,MOBILE,Mobile,25,1,11,3,58,53,1,0
"NHC HEALTHCARE, ANNISTON",015120,2300 COLEMAN RD,ANNISTON,Calhoun,77,64,80,12,111,94,133,0
DIVERSICARE OF MONTGOMERY,015040,2020 NORTH COUNTRY CLUB DRIVE,MONTGOMERY,Montgomery,90,1,16,13,77,37,15,0
CAMDEN NURSING FACILITY INC.,015374,210 PONDEROSA DRIVE,CAMDEN,Wilcox,32,4,11,6,47,40,13,0
MOUNT ROYAL TOWERS,015455,300 ROYAL TOWER DRIVE,BIRMINGHAM,Jefferson,1,1,13,0,113,9,7,0
"SELMA HEALTH AND REHAB, LLC",015119,11 BELL ROAD,SELMA,Dallas,72,11,4,0,111,40,9,0
ENGLEWOOD HEALTH CARE CENTER,015322,2046 SOUTH ALABAMA AVE,MONROEVILLE,Monroe,25,5,14,3,72,21,9,0
DADEVILLE HEALTHCARE CENTER,015166,351 NORTH EAST STREET,DADEVILLE,Tallapoosa,54,2,19,8,93,22,1,0
ORCHARD REHABILITATION & HEALTHCARE CENTER,015442,629 STATE HIGHWAY 21 SOUTH,HAYNEVILLE,Lowndes,10,0,4,4,54,25,0,0
"OPP HEALTH AND REHABILITATION, LLC",015210,115 PAULK AVENUE  P O BOX 730,OPP,Covington,90,14,52,21,128,56,15,0
LAFAYETTE NURSING HOME,015414,555 B STREET SW,LAFAYETTE,Chambers,23,2,6,0,43,18,13,0
WESTSIDE TERRACE HEALTH & REHABILITATION CENTER,015425,501 NORTH WOODBURN DRIVE,DOTHAN,Houston,6,13,14,0,143,17,26,0
SELF HEALTH CARE & REHAB CENTER INC,015212,131 EAST CREST ROAD,HUEYTOWN,Jefferson,2,1,16,0,61,9,6,0
BROWN NURSING HOME,015191,2334 WASHINGTON STREET,ALEXANDER CITY,Tallapoosa,2,9,8,0,64,1,28,0
COOSA VALLEY HEALTH AND REHAB,015174,513 PINEVIEW AVENUE,GLENCOE,Etowah,55,60,15,9,88,35,35,0
DIVERSICARE OF RIVERCHASE,015145,2500 RIVERHAVEN DRIVE,BIRMINGHAM,Jefferson,62,26,16,13,105,39,11,0
WASHINGTON COUNTY NURSING HOME,015123,14600 ST STEPHENS AVENUE,CHATOM,Washington,26,22,12,4,78,29,16,1
DIVERSICARE OF LANETT,015196,702 SOUTH 13TH STREET,LANETT,Chambers,14,1,40,1,72,25,6,0
"COLUMBIANA HEALTH AND REHABILITATION, LLC",015453,22969 HIGHWAY 25,COLUMBIANA,Shelby,52,18,31,10,49,50,14,0
"CRIMSON HEALTH AND REHAB, LLC",015037,3312 WOODLEY ROAD,MONTGOMERY,Montgomery,3,0,2,0,50,14,0,0
CROWNE HEALTH CARE OF CITRONELLE,015121,19225 NORTH 4TH STREET,CITRONELLE,Mobile,46,2,12,5,64,42,1,1
JACKSON HEALTH CARE FACILITY,015188,2616 NORTH COLLEGE AVENUE,JACKSON,Clarke,1,10,25,0,70,13,30,0
ADAMS NURSING HOME,015386,1555 HILLABEE STREET,ALEXANDER CITY,Tallapoosa,0,5,6,0,54,5,7,0
GOODWATER HEALTHCARE CENTER,015204,16 JONES HILL ROAD,GOODWATER,Coosa,0,0,5,0,62,2,0,0
"GEORGIANA HEALTH AND REHABILITATION, LLC",015182,206 PALMER AVENUE,GEORGIANA,Butler,29,1,17,2,84,11,4,0
ASPIRE PHYSICAL RECOVERY CENTER OF WEST ALABAMA,015465,2400 HOSPITAL DRIVE,NORTHPORT,Tuscaloosa,4,0,7,0,59,12,13,0
KNOLLWOOD HEALTHCARE,015463,3151-A KNOLLWOOD DRIVE,MOBILE,Mobile,26,18,16,14,65,53,35,0
NORTHSIDE HEALTH CARE,015223,700 HUTCHINS AVENUE,GADSDEN,Etowah,34,4,4,1,89,43,8,0
HALEYVILLE HEALTH CARE CENTER,015157,2201 11TH AVENUE,HALEYVILLE,Winston,5,5,20,1,51,15,21,0
"MONTGOMERY HEALTH AND REHAB, LLC",015228,4490 VIRGINIA LOOP ROAD,MONTGOMERY,Montgomery,74,3,11,5,64,46,14,0
MERRY WOOD LODGE,015019,P O BOX 130,ELMORE,Elmore,56,43,25,5,79,54,14,0
ROBERTSDALE REHABILITATION & HEALTHCARE CTR,015443,18700 U S HIGHWAY 90,ROBERTSDALE,Baldwin,48,5,5,0,114,42,7,0
"GENERATIONS OF RED BAY, LLC",015201,106 TENTH AVENUE NORTHWEST,RED BAY,Franklin,3,19,11,0,57,7,66,0
AHAVA HEALTHCARE OF ALABASTER,015144,"850 9TH STREET, NORTHWEST",ALABASTER,Shelby,59,5,13,5,121,25,18,0
ANNISTON HEALTH AND REHAB SERVICES,015375,600 E 8TH STREET,ANNISTON,Calhoun,1,0,8,0,57,12,0,0
TERRACE OAKS CARE & REHABILITATION CENTER,015060,4201 BESSEMER SUPER HIGHWAY,BESSEMER,Jefferson,6,0,0,0,53,20,0,0
"ELBA NURSING AND REHABILITATION CENTER, LLC",015083,987 DRAYTON STREET,ELBA,Coffee,24,8,19,3,96,12,12,0
SPRINGHILL MANOR NURSING HOME,015415,3900 OLD SHELL ROAD,MOBILE,Mobile,4,2,2,0,0,8,2,0
GREENE COUNTY NURSING HOME,015178,509 WILSON AVE,EUTAW,Greene,22,2,13,12,36,4,0,0
"TALLADEGA HEALTHCARE CENTER, INC",015162,616 CHAFFEE STREET,TALLADEGA,Talladega,117,222,14,5,193,71,59,0
MAGNOLIA RIDGE,015133,420 DEAN DRIVE,GARDENDALE,Jefferson,27,1,16,0,128,18,0,0
FAYETTE MEDICAL CENTER LONG TERM CARE UNIT,015154,1653 TEMPLE AVENUE NORTH,FAYETTE,Fayette,21,32,17,3,90,34,41,0
"CIVIC CENTER HEALTH AND REHABILITATION, LLC",015109,1201 22ND STREET NORTH,BIRMINGHAM,Jefferson,0,15,13,0,88,3,2,0
WILLOWBROOKE CT SKILLED CARE CTR AT MAGNOLIA TRACE,015450,ONE CROWN CIRCLE,HUNTSVILLE,Madison,4,0,12,1,40,11,0,0
PARKWOOD HEALTH CARE FACILITY,015179,3301 STADIUM DRIVE,PHENIX CITY,Russell,2,3,29,0,69,14,16,0
BIRMINGHAM NURSING AND REHABILITATION CENTER EAST,015134,733 MARY VANN LANE,BIRMINGHAM,Jefferson,7,0,8,0,123,25,0,0
SENIOR REHAB & RECOVERY AT LIMESTONE HEALTH FACILI,015024,1600 WEST HOBBS STREET,ATHENS,Limestone,80,65,58,11,117,37,47,0
WOODLAND VILLAGE REHABILITATION AND HEALTHCARE CEN,015383,1900 OLIVE STREET,CULLMAN,Cullman,44,13,53,7,100,36,30,0
"RIDGEVIEW HEALTH SERVICES, INC",015155,"907 11TH STREET, NE",JASPER,Walker,112,57,52,20,95,112,81,0
MONTROSE BAY HEALTH AND REHAB,015447,22670 MAIN STREET,FAIRHOPE,Baldwin,39,0,2,2,53,20,0,0
"MOUNDVILLE HEALTH AND REHABILITATION, LLC",015187,THIRD AVENUE    P O BOX 607,MOUNDVILLE,Hale,0,7,22,0,57,10,15,0
DIVERSICARE OF BESSEMER,015209,820 GOLF COURSE ROAD,BESSEMER,Jefferson,78,2,42,26,126,54,3,1
"PRATTVILLE HEALTH AND REHABILITATION, LLC",015065,601 JASMINE TRAIL,PRATTVILLE,Autauga,25,11,37,2,118,37,16,0
ATTALLA HEALTH AND REHAB,015203,915 STEWART AVENUE SOUTHEAST,ATTALLA,Etowah,43,1,17,7,84,88,14,0
SANCTUARY AT THE WOODLANDS,015471,1910 CHEROKEE  AVENUE SW,CULLMAN,Cullman,,,,,,,,
"HUNTSVILLE HEALTH & REHABILITATION, LLC",015440,4010 CHRIS DRIVE,HUNTSVILLE,Madison,27,9,17,1,91,17,12,0
OAKWOOD-NORTH BALDWIN'S CENTER FOR LIVING,015417,2010 MEDICAL CENTER DRIVE,BAY MINETTE,Baldwin,46,19,13,4,62,34,38,0
KELLER LANDING,015028,813 KELLER LANE,TUSCUMBIA,Colbert,13,2,13,0,64,33,5,0
ENTERPRISE HEALTH & REHABILITATION CENTER,015320,300 PLAZA DRIVE P O BOX 311227,ENTERPRISE,Coffee,46,0,57,0,158,67,33,0
LIGHTHOUSE REHABILITATION & HEALTHCARE CENTER,015413,2911 EARL GOODWIN PARKWAY,SELMA,Dallas,23,13,8,3,60,22,6,0
"JACKSONVILLE HEALTH AND REHABILITATION, LLC",015391,410 WILSON DRIVE SOUTHWEST,JACKSONVILLE,Calhoun,78,9,33,15,157,57,10,0
HARTFORD HEALTH CARE,015419,217 TORO ROAD,HARTFORD,Geneva,89,2,6,5,63,19,1,0
FALKVILLE HEALTH CARE CENTER,015136,10 WEST 3RD STREET  PO BOX 409,FALKVILLE,Morgan,70,21,17,10,79,36,25,0
JOHN KNOX MANOR INC  I I,015135,4401 NARROW LANE ROAD,MONTGOMERY,Montgomery,0,1,9,0,56,8,14,0
MAGNOLIA HAVEN HEALTH AND REHABILITATION CENTER,015112,603 WRIGHT STREET,TUSKEGEE,Macon,35,8,10,2,82,50,7,0
CYPRESS COVE CARE CENTER,015392,200 ALABAMA AVENUE,MUSCLE SHOALS,Colbert,33,9,13,0,67,24,10,0
CLEBURNE COUNTY NURSING HOME,015053,122 BROCKFORD ROAD,HEFLIN,Cleburne,,,,,,,,
"SOUTH HAVEN HEALTH AND REHABILITATION, LLC",015321,3141 OLD COLUMBIANA ROAD,BIRMINGHAM,Jefferson,60,18,30,18,80,45,2,0
SOUTHLAND NURSING HOME,015104,500 SHIVERS TERRACE,MARION,Perry,,,,,,,,
GREENBRIAR AT THE ALTAMONT SKILLED NURSING FACILIT,015446,2831 HIGHLAND AVENUE SOUTH,BIRMINGHAM,Jefferson,40,0,14,5,82,38,0,0
COTTAGE OF THE SHOALS,015067,500 JOHN ALDRIDGE DRIVE,TUSCUMBIA,Colbert,18,8,15,1,74,31,19,0
"CHAPMAN HEALTHCARE CENTER, INC",015221,3701 DADEVILLE ROAD,ALEXANDER CITY,Tallapoosa,12,0,25,1,143,7,0,0
ASPIRE PHYSICAL RECOVERY CENTER AT CAHABA RIVER,015468,3070 HEALTHY WAY,VESTAVIA,Jefferson,11,9,26,0,91,15,4,0
PERRY COUNTY NURSING HOME,015158,505 EAST LAFAYETTE STREET,MARION,Perry,37,1,6,2,60,35,12,0
DIVERSICARE OF BOAZ,015063,600 CORLEY AVENUE,BOAZ,Marshall,45,0,13,2,91,43,0,0
CLOVERDALE REHABILITATION AND NURSING CENTER,015184,412 CLOVERDALE ROAD,SCOTTSBORO,Jackson,40,15,29,7,122,29,59,0
CROWNE HEALTH CARE OF FT PAYNE,015156,403 13TH STREET NORTHWEST,FORT PAYNE,DeKalb,27,0,8,2,97,30,5,1
DIVERSICARE OF BIG SPRINGS,015111,500 ST. CLAIR AVENUE SOUTHWEST,HUNTSVILLE,Madison,93,4,14,10,104,33,7,1
"OZARK HEALTH AND REHABILITATION, LLC",015208,312 BRYAN DRIVE,OZARK,Dale,82,7,46,21,123,79,5,0
BIBB MED CENTER NURSING HOME,015215,208 PIERSON AVE,CENTREVILLE,Bibb,102,8,30,15,99,42,0,0
FAIRVIEW AT REDSTONE VILLAGE,015454,12000 TURNMEYER DRIVE,HUNTSVILLE,Madison,9,2,10,0,44,13,17,0
SHADESCREST HEALTH CARE CENTER,015114,331 WEST 25TH STREET,JASPER,Walker,47,9,14,5,79,47,50,0
HENDRIX HEALTH AND REHABILITATION,015138,1000 HIGHWAY 33,DOUBLE SPRINGS,Winston,48,16,28,3,93,22,35,0
DIVERSICARE OF ONEONTA,015159,215 VALLEY ROAD,ONEONTA,Blount,33,1,16,0,104,53,7,1
LAUDERDALE CHRISTIAN NURSING HOME,015361,2019 COUNTY ROAD 394,KILLEN,Lauderdale,16,7,11,1,56,17,12,0
DECATUR HEALTH & REHAB CENTER,015206,2326 MORGAN AVENUE SOUTHWEST,DECATUR,Morgan,58,82,24,9,71,33,19,0
ALICEVILLE MANOR NURSING HOME,015137,703 17TH STREET NORTHWEST,ALICEVILLE,Pickens,42,27,13,4,69,37,27,0
COLONIAL HAVEN CARE & REHABILITATION CENTER,015396,616 ARMORY STREET,GREENSBORO,Hale,44,0,14,11,66,56,0,1
WEST HILL HEALTH AND REHAB,015303,1028 BESSEMER RD,BIRMINGHAM,Jefferson,61,1,12,1,57,26,0,0
"TERRACE MANOR NURSING & REHABILITATION CENTER, INC",015066,390 UNDERWOOD ROAD,RUSSELLVILLE,Franklin,0,3,5,0,52,6,27,0
"TALLASSEE HEALTH AND REHABILITATION, LLC",015139,2639 GILMER AVENUE  P O BOX 780277,TALLASSEE,Elmore,3,1,29,0,80,16,8,0
RIVER CITY CENTER,015113,1350 FOURTEENTH AVENUE SOUTHEAST,DECATUR,Morgan,52,10,35,0,137,32,2,0
TLC NURSING CENTER,015422,212 ELLEN STREET,ONEONTA,Blount,56,7,28,10,68,28,0,0
WILLOWBROOKE CT SKILLED CARE CTR WESTMINSTER VLG,015381,500 SPANISH FORT BLVD,SPANISH FORT,Baldwin,9,0,14,1,30,17,2,0
GADSDEN HEALTH AND REHAB CENTER,015180,1945 DAVIS DRIVE,GADSDEN,Etowah,90,108,31,17,120,57,16,1
HATLEY HEALTH CARE INC,015023,300 MEDICAL CENTER DRIVE,CLANTON,Chilton,104,20,35,25,98,87,55,0
SYLACAUGA HEALTH AND REHAB SERVICES,015160,1007 W FORT WILLIAMS ST,SYLACAUGA,Talladega,49,60,51,11,117,49,17,0
"CORDOVA HEALTH AND REHABILITATION, LLC",015115,70 HIGHLAND STREET WEST,CORDOVA,Walker,16,5,29,3,100,16,23,0
CANTERBURY HEALTH CARE FACILITY,015382,1720 KNOWLES ROAD,PHENIX CITY,Russell,22,0,15,5,105,25,0,0
RUSSELLVILLE HEALTH CARE INC,015071,705 NORTHEAST GANDY STREET,RUSSELLVILLE,Franklin,34,22,10,4,39,37,43,0
COLLINSVILLE HEALTHCARE & REHAB,015207,685 NORTH VALLEY AVE,COLLINSVILLE,DeKalb,94,52,40,15,133,83,38,1
GALLERIA WOODS SKILLED NURSING FACILITY,015459,3850 GALLERIA WOODS DRIVE,BIRMINGHAM,Jefferson,0,1,2,0,30,5,0,0
SPRINGHILL SENIOR RESIDENCE,015435,3717 DAUPHIN STREET,MOBILE,Mobile,0,30,18,0,78,4,63,0
DIVERSICARE OF ARAB,015148,235 THIRD STREET SE,ARAB,Marshall,16,6,8,0,86,14,10,0
EAST ALABAMA MEDICAL CENTER SKILLED NURSING FACILI,015410,2000 PEPPERELL PARKWAY,OPELIKA,Lee,4,1,5,0,12,8,13,0
HILLVIEW TERRACE,015436,100 PERRY HILL RD,MONTGOMERY,Montgomery,65,7,48,13,110,45,0,0
BARON HOUSE OF HUEYTOWN,015404,190 BROOKLANE DRIVE,HUEYTOWN,Jefferson,13,0,23,12,29,26,23,0
MONTGOMERY CHILDREN'S SPECIALTY CENTER,01A208,2853 FORBES DRIVE,MONTGOMERY,Montgomery,7,0,0,0,46,18,1,1
HENRY COUNTY HEALTH AND REHABILITATION FACILITY,015373,212 DOTHAN ROAD,ABBEVILLE,Henry,31,75,34,5,83,40,74,0
"WETUMPKA HEALTH AND REHABILITATION, LLC",015027,1825 HOLTVILLE ROAD,WETUMPKA,Elmore,60,3,39,5,100,39,6,0
"VALLEY VIEW HEALTH AND REHABILITATION, LLC",015431,5968 WALL TRIANA HIGHWAY,MADISON,Madison,17,3,20,1,140,22,21,0
HIGHLANDS HEALTH AND REHAB,015012,380 WOODS COVE ROAD,SCOTTSBORO,Jackson,2,37,14,0,41,9,37,0
SHELBY RIDGE NURSING HOME,015411,881 3RD STREET NORTHEAST,ALABASTER,Shelby,61,72,53,13,124,46,76,0
"GENERATIONS OF VERNON, LLC",015227,1050 CONVALESCENT ROAD,VERNON,Lamar,71,24,14,10,93,58,61,0
MARSHALL MANOR NURSING HOME,015378,3120 NORTH STREET,GUNTERSVILLE,Marshall,17,4,20,0,69,17,22,0
OAKS ON PARKWOOD SKILLED NURSING FACILITY,015369,2625 LAUREL OAK DRIVE,BESSEMER,Jefferson,11,0,58,1,107,14,7,0
"GULF COAST HEALTH AND REHABILITATION, LLC",015456,8002 GRELOT ROAD,MOBILE,Mobile,32,12,13,1,72,35,3,0
FLORALA HEALTH AND REHABILITATION LLC,015451,23621 GOLDENROD AVENUE,FLORALA,Covington,27,4,15,1,74,27,18,0
CLAY COUNTY NURSING HOME,015124,83825 HIGHWAY 9   P O BOX 1270,ASHLAND,Clay,59,22,19,13,57,38,39,1
HEALTH CARE INC,015407,P O BOX 130,ASHVILLE,St. Clair,0,0,4,0,47,4,5,0
"RIDGEWOOD HEALTH SERVICES, INC.",015315,201 OAKHILL ROAD,JASPER,Walker,13,1,28,1,79,28,0,0
CROWNE HEALTH CARE OF SPRINGHILL,015426,3712 DAUPHIN ST,MOBILE,Mobile,3,1,5,0,24,5,0,0
PIEDMONT HEALTH CARE CENTER,015194,30 ROUNDTREE DRIVE,PIEDMONT,Calhoun,38,4,28,11,68,16,11,0
MOBILE NURSING AND REHABILITATION CENTER,015379,7020 BRUNS DRIVE,MOBILE,Mobile,41,17,6,3,90,30,11,0
LYNWOOD NURSING HOME,015434,4164 HALLS MILL ROAD,MOBILE,Mobile,55,0,20,18,103,42,10,0
MITCHELL-HOLLINGSWORTH NURSING & REHABILITATION,015031,805 FLAGG CIRCLE,FLORENCE,Lauderdale,12,57,38,0,166,36,130,1
BROOKDALE UNIVERSITY PARK SNF (AL),015423,501 UNIVERSITY PARK DRIVE,BIRMINGHAM,Jefferson,6,2,28,0,51,13,15,0
WINDSOR HOUSE,015397,4411 MCALLISTER DRIVE,HUNTSVILLE,Madison,28,0,8,0,101,39,1,0
"FLORENCE NURSING AND REHABILITATION CTR,  LLC",015169,2107 CLOYD BLVD,FLORENCE,Lauderdale,68,32,70,22,114,61,41,0
EL REPOSO NURSING FACILITY,015402,260 MILNER CHAPEL ROAD,FLORENCE,Lauderdale,9,3,17,1,56,9,14,0
"GLEN HAVEN HEALTH AND REHABILITATION, LLC",015186,2201 32ND STREET,NORTHPORT,Tuscaloosa,33,16,29,7,176,41,7,2
CULLMAN HEALTH CARE CENTER,015048,1607 MAIN AVE NE,CULLMAN,Cullman,1,1,7,0,74,10,103,0
"WALKER REHABILITATION CENTER, INC",015408,350 NORTHEAST 4TH STREET     P O BOX 30,CARBON HILL,Walker,18,8,4,4,43,30,4,0
CHARLTON PLACE REHAB AND HEALTHCARE CENTER,015460,65 CHARLTON PLACE,DEATSVILLE,Elmore,7,1,0,0,57,20,2,0
