Provider Name,Federal Provider Number,Provider Address,Provider City,County,Residents Total Confirmed COVID-19,Residents Total Suspected COVID-19,Residents Total All Deaths,Residents Total COVID-19 Deaths,Total Number of Occupied Beds,Staff Total Confirmed COVID-19,Staff Total Suspected COVID-19,Staff Total COVID-19 Deaths
ATLANTIC COAST REHAB & HEALTH,315115,485 RIVER AVE,LAKEWOOD,Ocean,97,15,32,19,111,24,0,0
ALARIS HEALTH AT JERSEY CITY,315083,198 STEVENS AVE,JERSEY CITY,Hudson,2,29,17,5,105,42,3,0
EAGLEVIEW HEALTH AND REHABILITATION,315014,849 BIG OAK ROAD,PITTSGROVE,Salem,4,0,5,0,68,4,1,0
ATRIUM POST ACUTE CARE OF WAYNEVIEW,315291,2020 ROUTE 23 NORTH,WAYNE,Passaic,76,4,55,21,105,41,2,3
ROLLING HILLS CARE CENTER,315302,16 CRATETOWN ROAD,LEBANON,Hunterdon,8,10,14,6,45,15,8,0
BERGEN NEW BRIDGE MEDICAL CENTER,315017,230 E RIDGEWOOD AVE,PARAMUS,Bergen,254,41,16,64,397,119,2,1
JFK HARTWYCK AT CEDAR BROOK,315101,1340 PARK AVE,PLAINFIELD,Union,51,0,23,15,86,23,6,0
PREFERRED CARE AT ABSECON,315244,1020 PITNEY ROAD,ABSECON,Atlantic,93,0,32,16,128,38,5,0
COUNTRY ARCH CARE CENTER,315433,114 PITTSTOWN ROAD,PITTSTOWN,Hunterdon,24,0,12,5,76,0,0,0
EASTERN PINES CONV CTR,315317,29 NORTH VERMONT AVE,ATLANTIC CITY,Atlantic,5,0,4,0,85,8,0,0
BARN HILL CARE CENTER,315137,249 HIGH STREET,NEWTON,Sussex,5,0,24,2,119,14,0,1
ARBOR GLEN CENTER,315036,25 E LINDSLEY ROAD,CEDAR GROVE,Essex,38,0,31,10,93,22,2,0
NEW COMMUNITY EXTENDED CARE FACILITY,315393,266 S ORANGE AVE,NEWARK,Essex,55,6,47,12,99,27,0,2
CREST HAVEN NURSING AND REHABILITATION CENTER,315294,4 MOORE ROAD,CAPE MAY COURT HOUSE,Cape May,1,2,11,0,83,11,170,0
REFORMED CHURCH HOME,315417,1990 ROUTE 18 NORTH,OLD BRIDGE,Middlesex,48,0,23,1,77,22,0,0
GOLDEN REHABILITATION AND NURSING CENTER,315058,438 SALEM-WOODSTOWN ROAD,SALEM,Salem,2,0,0,0,68,7,0,0
SOUTH JERSEY EXTENDED CARE,315061,99 MANHEIM AVENUE,BRIDGETON,Cumberland,62,3,2,2,113,37,4,0
ATRIUM POST ACUTE CARE OF PRINCETON,315370,5000 WINDROW DRIVE,PRINCETON,Mercer,71,108,39,19,101,24,2,0
PARK CRESCENT HEALTHCARE & REHABILITATION CENTER,315266,480 PARKWAY DRIVE,EAST ORANGE,Essex,90,2,58,41,143,34,0,1
CHATHAM HILLS SUBACUTE CARE CENTER,315120,415 SOUTHERN BLVD,CHATHAM,Morris,14,46,13,4,84,10,4,0
COMPLETE CARE AT GREEN ACRES,315265,1931 LAKEWOOD ROAD,TOMS RIVER,Ocean,72,5,51,14,115,48,0,0
CLARK NURSING AND REHAB CNTR,315341,1213 WESTFIELD AVENUE,CLARK,Union,64,3,31,23,92,27,13,5
PREFERRED CARE AT HAMILTON,315111,1501 STATE HWY 33,HAMILTON SQUARE,Mercer,24,26,44,8,89,5,3,1
CHESHIRE HOME,315383,9 RIDGEDALE AVE,FLORHAM PARK,Morris,0,0,0,0,35,0,0,0
WOODCLIFF LAKE HEALTH & REHABILITATION CENTER,315133,555 CHESTNUT RIDGE ROAD,WOODCLIFF LAKE,Bergen,13,5,27,5,71,50,0,2
MORRISTOWN POST ACUTE REHAB AND NURSING CENTER,315157,77 MADISON AVENUE,MORRISTOWN,Morris,127,43,55,32,149,25,28,0
BROOKHAVEN HEALTH CARE CENTER,315268,120 PARK END PLACE,EAST ORANGE,Essex,6,0,1,0,110,3,0,0
HEATH VILLAGE,315072,430 SCHOOLEY'S MOUNTAIN RD,HACKETTSTOWN,Morris,42,100,31,9,79,45,61,0
UNITED METHODIST COMMUNITIES AT PITMAN,315427,535 N OAK AVE,PITMAN,Gloucester,3,0,31,0,59,10,8,0
PREFERRED CARE AT WALL,315397,2350 HOSPITAL ROAD,ALLENWOOD,Monmouth,60,17,22,17,91,7,5,0
MANORCARE HEALTH SERVICES-WEST DEPTFORD,315246,550 JESSUP ROAD,WEST DEPTFORD,Gloucester,47,3,39,27,101,43,2,2
CORAL HARBOR REHABILITATION AND HEALTHCARE CENTER,315105,2050 SIXTH AVE,NEPTUNE CITY,Monmouth,10,7,22,0,88,6,14,0
OUR LADY'S CENTER FOR REHABILITATION & HC,315054,1100 CLEMATIS AVE,PLEASANTVILLE,Atlantic,14,10,19,9,123,10,8,0
N J VETERANS MEM HOME PARAMUS,315346,1 VETERANS DRIVE,PARAMUS,Bergen,126,5,135,79,190,91,0,1
DELLRIDGE HEALTH & REHABILITATION CENTER,315129,532 FARVIEW AVE,PARAMUS,Bergen,,,,,,,,
ARISTACARE AT NORWOOD TERRACE,315217,40 NORWOOD AVENUE,PLAINFIELD,Union,7,5,12,4,77,3,2,0
INGLEMOOR REHABILITATION AND CARE CENTER OF LIVING,315322,311 S LIVINGSTON AVE,LIVINGSTON,Essex,10,2,7,3,83,17,2,0
HAMILTON PLACE AT THE PINES AT WHITING,315347,507 ROUTE 530,WHITING,Ocean,0,0,7,2,50,3,2,0
AMBOY CARE CENTER,315305,1 LINDBERG AVENUE,PERTH AMBOY,Middlesex,42,4,11,16,116,5,0,0
ROSE MOUNTAIN CARE CENTER,315384,ROUTE 1 & 18,NEW BRUNSWICK,Middlesex,42,0,30,20,65,20,0,0
WATERS EDGE HEALTHCARE & REHAB,315324,512 UNION STREET,TRENTON,Mercer,113,0,33,29,104,69,0,1
ALARIS HEALTH AT ESSEX,315359,155 FORTIETH STREET,IRVINGTON,Essex,14,0,7,1,131,12,0,0
AUTUMN LAKE HEALTHCARE AT BERKELEY HEIGHTS,315195,35 COTTAGE STREET,BERKELEY HEIGHTS,Union,2,0,9,0,65,5,0,0
ARISTACARE AT MANCHESTER,315196,1770 TOBIAS AVENUE,MANCHESTER,Ocean,97,9,53,23,123,34,9,0
"COMPLETE CARE AT HAMILTON, LLC",315221,56 HAMILTON AVENUE,PASSAIC,Passaic,,,,,,,,
WATERVIEW CENTER,315216,536 RIDGE ROAD,CEDAR GROVE,Essex,68,4,58,24,122,29,2,0
ALAMEDA CENTER FOR REHABILITATION AND HEALTHCARE,315180,303 ELM STREET,PERTH AMBOY,Middlesex,81,10,53,25,162,76,2,2
"MANOR, THE",315153,689 WEST MAIN ST,FREEHOLD,Monmouth,12,0,37,29,87,12,0,2
MCAULEY HALL HEALTH CARE CENTE,315337,1633 HIGHWAY 22,WATCHUNG,Somerset,28,1,23,6,56,29,0,0
PINE BROOK CARE CENTER,315282,104 PENSION ROAD,ENGLISHTOWN,Monmouth,6,0,8,4,62,2,0,0
MORRIS HALL/ST JOSEPH'S NURSING CENTER,315338,1 BISHOPS DRIVE,LAWRENCEVILLE,Mercer,71,30,42,28,133,33,0,0
MEADOWVIEW NURSING AND REHABILITATION CENTER,315358,235 DOLPHIN AVE,NORTHFIELD,Atlantic,99,1,161,145,110,31,0,0
VOORHEES CENTER,315219,3001 EVESHAM ROAD,VOORHEES,Camden,124,0,57,42,141,42,2,0
HOLLY MANOR CENTER,315143,84 COLD HILL ROAD,MENDHAM,Morris,58,0,37,23,79,18,1,1
ALARIS HEALTH AT KEARNY,315192,206 BERGEN AVE,KEARNY,Hudson,13,11,10,6,99,24,1,0
FRIENDS VILLAGE AT WOODSTOWN,315161,ONE FRIENDS DRIVE,WOODSTOWN,Salem,16,0,18,9,32,22,1,0
COMPLETE CARE AT WILLOW CREEK,315131,1165 EASTON AVE,SOMERSET,Somerset,59,0,29,15,89,17,27,0
REGENCY GARDENS NURSING CENTER,315103,296 HAMBURG TURNPIKE,WAYNE,Passaic,0,0,1,1,104,1,0,0
HACKENSACK MERIDIAN HEALTH WEST CALDWELL C,315247,165 FAIRFIELD AVE,WEST CALDWELL,Essex,6,1,11,4,109,5,0,0
HAMPTON RIDGE HEALTHCARE AND REHABILITATION,315312,94 STEVENS ROAD,TOMS RIVER,Ocean,101,8,44,18,158,43,16,0
OCEANA REHABILITATION AND NC,315193,502 ROUTE 9 NORTH,CAPE MAY COURT HOUSE,Cape May,24,4,8,1,97,10,1,0
MILLVILLE CENTER,315243,54 N SHARP STREET,MILLVILLE,Cumberland,106,1,54,27,101,35,22,0
ROSE GARDEN NURSING AND REHABILITATION CENTER,315421,1579 OLD FREEHOLD ROAD,TOMS RIVER,Ocean,51,1,3,9,101,32,6,0
ALARIS HEALTH AT BELGROVE,315366,195 BELGROVE DRIVE,KEARNY,Hudson,7,5,7,0,48,19,0,0
NORTH CAPE CENTER,315350,700 TOWNBANK ROAD,CAPE MAY,Cape May,57,7,30,13,75,33,13,0
CARE ONE AT CRESSKILL,315313,221 COUNTY ROAD,CRESSKILL,Bergen,2,3,5,2,56,6,1,0
GREEN HILL,315416,103 PLEASANT VALLEY WAY,WEST ORANGE,Essex,14,5,19,3,75,20,3,1
STRATFORD MANOR REHABILITATION AND CARE CENTER,315066,787 NORTHFIELD AVE,WEST ORANGE,Essex,63,1,33,21,111,17,7,0
CARE ONE AT THE HIGHLANDS,315132,1350 INMAN AVENUE,EDISON,Middlesex,7,2,8,1,95,5,1,0
CARE ONE AT ORADELL,315339,600 KINDERKAMACK ROAD,ORADELL,Bergen,6,37,3,2,91,14,6,0
ST JOSEPH'S HEALTHCARE AND REHAB CENTER,315194,315 EAST LINDSLEY ROAD,CEDAR GROVE,Essex,85,0,46,26,87,54,0,1
DAUGHTERS OF MIRIAM CENTER,315021,155 HAZEL STREET,CLIFTON,Passaic,24,6,12,13,133,40,0,0
ALLAIRE REHAB & NURSING,315387,115 DUTCH LANE ROAD,FREEHOLD,Monmouth,45,16,13,7,112,21,9,0
MAPLE GLEN CENTER,315328,12-15 SADDLE RIVER ROAD,FAIRLAWN,Bergen,78,10,44,29,87,43,0,0
ELMWOOD HILLS HEALTHCARE CENTER LLC,315159,425 WOODBURY-TURNERSVILLE ROAD,BLACKWOOD,Camden,154,13,59,38,255,51,15,0
RIDGEWOOD CENTER,315158,330 FRANKLIN TPK,RIDGEWOOD,Bergen,61,5,21,12,58,28,3,0
"OAKS AT DENVILLE, THE",315329,21 POCONO ROAD,DENVILLE,Morris,15,5,22,4,47,7,0,0
COMPLETE CARE AT SUMMIT RIDGE,315038,20 SUMMIT STREET,WEST ORANGE,Essex,64,0,45,24,96,21,17,0
PREAKNESS HEALTHCARE CENTER,315361,305 OLDHAM ROAD,WAYNE,Passaic,14,2,30,12,278,52,5,0
ANCHOR CARE AND REHABILITATION CENTER,315314,3325 HIGHWAY 35,HAZLET,Monmouth,64,23,31,18,129,34,3,3
MANOR CARE MOUNTAINSIDE,315259,1180 ROUTE 22 WEST,MOUNTAINSIDE,Union,55,1,29,14,94,20,0,0
BARCLAYS REHABILITATION AND HEALTHCARE CENTER,315013,1412 MARLTON PIKE,CHERRY HILL,Camden,29,0,22,12,86,8,0,0
ALLEGRIA AT THE FOUNTAINS,315297,114 HAYES MILL ROAD,ATCO,Camden,0,0,14,0,56,14,0,0
"BUCKINGHAM AT NORWOOD, THE",315290,100 MCCLELLAN STREET,NORWOOD,Bergen,49,0,26,3,158,27,3,1
APPLEWOOD ESTATES,315292,APPLEWOOD DRIVE,FREEHOLD,Monmouth,5,0,21,2,36,4,0,0
LINCOLN PARK CARE CENTER,315249,499 PINE BROOK ROAD,LINCOLN PARK,Morris,148,172,102,63,424,82,88,0
CORNELL HALL CARE & REHABILITATION CENTER,315104,234 CHESTNUT STREET,UNION,Union,7,0,15,3,92,3,1,0
CHESTNUT HILL CONV CENTER,315085,360 CHESTNUT STREET,PASSAIC,Passaic,17,8,16,7,55,13,6,2
SOUTH MOUNTAIN HC,315283,2385 SPRINGFIELD AVENUE,VAUXHALL,Union,52,6,8,1,132,14,0,1
INGLEMOOR CENTER,315349,333 GRAND AVE,ENGLEWOOD,Bergen,19,3,13,10,39,12,0,0
ALARIS HEALTH AT RIVERTON,315198,1777 LAWRENCE STREET,RAHWAY,Union,4,0,9,0,64,13,1,0
CARE ONE AT KING JAMES,315087,1040 ROUTE 36,ATLANTIC HIGHLANDS,Monmouth,11,0,18,10,92,11,2,0
VILLAGE POINT,315269,THREE DAVID BRAINERD DRIVE,MONROE TOWNSHIP,Middlesex,25,3,13,18,79,20,0,0
"COMPLETE CARE AT BEY LEA, LLC",315264,1351 OLD FREEHOLD ROAD,TOMS RIVER,Ocean,73,49,45,23,75,32,26,0
PINE ACRES CONVALESCENT CENTER,315053,51 MADISON AVE,MADISON,Morris,38,0,12,4,77,7,0,1
COMPLETE CARE AT WOODLANDS,315273,1400 WOODLAND AVE,PLAINFIELD,Union,1,1,3,0,79,4,0,0
VIRTUA HEALTH & REHAB MT HOLLY,315128,62 RICHMOND AVENUE,LUMBERTON,Burlington,72,0,22,19,103,36,0,1
LINCOLN SPECIALTY CARE CENTER,315233,1640 SOUTH LINCOLN AVENUE,VINELAND,Cumberland,2,1,13,0,150,16,3,2
WILEY MISSION,315418,99 EAST MAIN STREET,MARLTON,Burlington,4,1,4,0,47,3,6,0
CAREPOINT HEALTH - BAYONNE HOSPITAL CENTER TCU,315431,29 EAST 29TH STREET,BAYONNE,Hudson,0,0,1,0,7,2,0,0
ROOSEVELT CARE CENTER,315039,118 PARSONAGE ROAD,EDISON,Middlesex,31,3,19,7,151,14,0,2
MERRY HEART NURSING HOME,315057,200 RT 10 WEST,SUCCASUNNA,Morris,2,0,32,0,83,2,0,0
CHILDRENS SPECIALIZED HOSPITAL MOUNTAINSIDE,315239,150 NEW PROVIDENCE ROAD,MOUNTAINSIDE,Union,2,9,0,0,42,20,13,0
PROVIDENCE NURSING AND REHABILITATION CENTER,315124,439 BELLEVUE AVENUE,TRENTON,Mercer,0,0,0,0,85,1,0,2
HACKENSACK MERIDIAN HEALTH NURSING & REHAB,315295,50 POLIFLY ROAD,HACKENSACK,Bergen,0,3,14,2,134,7,0,1
KRESSON VIEW CENTER,315207,2601 EVESHAM ROAD,VOORHEES,Camden,74,5,42,11,152,49,5,0
HAMILTON CONTINUING CARE,315223,1059 EDINBURG ROAD,HAMILTON,Mercer,104,2,56,40,111,47,2,0
"SPRINGPOINT AT CRESTWOOD, INC",315298,50 LACEY ROAD,WHITING,Ocean,33,9,38,23,49,18,7,0
LAUREL MANOR HEALTHCARE AND REHABILITATION CENTER,315008,18 W LAUREL ROAD,STRATFORD,Camden,12,0,15,3,90,8,0,0
CUMBERLAND MANOR NURSING AND REHABILITATION CENTER,315396,154 SUNNY SLOPE DRIVE,BRIDGETON,Cumberland,3,0,1,0,156,9,2,0
"DOCTORS SUBACUTE HEALTHCARE, LLC",315096,59 BIRCH STREET,PATERSON,Passaic,38,0,10,1,42,32,0,0
PREMIER CADBURY OF CHERRY HILL,315183,2150 ROUTE 38,CHERRY HILL,Camden,5,0,13,3,104,9,0,0
CARE CONNECTION RAHWAY,315146,865 STONE STREET,RAHWAY,Union,10,60,35,2,21,2,0,0
SPRING GROVE REHABILITATION AND HEALTHCARE CENTER,315005,144 GALES DRIVE,NEW PROVIDENCE,Union,41,7,27,7,76,3,0,0
RIVERSIDE NURSING AND REHABILITATION CENTER,315235,325 JERSEY STREET,TRENTON,Mercer,58,120,42,13,99,65,53,1
PRINCETON CARE CENTER,315108,728 BUNN DRIVE,PRINCETON,Mercer,8,0,36,12,81,7,1,0
CREST POINTE REHABILITATION AND HEALTHCARE CENTER,315135,1515 HULSE ROAD,PT PLEASANT,Ocean,85,17,18,14,93,21,2,0
MERIDIAN NURSING AND REHABILITATION AT OCEAN GROVE,315365,160 MAIN STREET,OCEAN GROVE,Monmouth,42,5,12,10,107,21,3,0
BURLINGTON WOODS,315050,115 SUNSET ROAD,BURLINGTON,Burlington,85,1,49,23,121,39,1,0
CHRISTIAN HEALTH CARE CENTER,315376,301 SICOMAC AVE,WYCKOFF,Bergen,17,0,40,11,225,55,0,0
"HEALTH CENTER AT GALLOWAY, THE",315210,66 WEST JIMMIE LEEDS ROAD,GALLOWAY TOWNSHIP,Atlantic,50,22,25,22,85,15,11,0
JOB HAINES HOME FOR AGED PEOPL,315392,250 BLOOMFIELD AVE,BLOOMFIELD,Essex,,,,,,,,
BARNEGAT REHABILITATION AND NURSING CENTER,315222,859 WEST BAY AVE,BARNEGAT,Ocean,1,1,10,0,74,5,0,0
ANDOVER SUBACUTE AND REHAB II,315248,99 MULFORD ROAD,ANDOVER,Sussex,146,31,114,67,367,92,40,1
VALLEY VIEW REHABILITATION AND HEALTHCARE CTR,315409,1 SUMMIT AVENUE,NEWTON,Sussex,8,6,1,0,14,6,1,0
CARE ONE AT NEW MILFORD,315306,800 RIVER ROAD,NEW MILFORD,Bergen,15,5,22,3,182,8,1,1
CARE ONE AT SOMERSET VALLEY,315002,1621 ROUTE 22 WEST,BOUND BROOK,Somerset,6,0,7,0,50,5,1,1
CLOVER REST HOME,315429,28 WASHINGTON STREET,COLUMBIA,Warren,0,0,0,0,30,0,6,0
IMPERIAL CARE CENTER,315199,919 GREEN GROVE ROAD,NEPTUNE,Monmouth,1,1,9,1,76,1,0,0
CARE ONE AT RIDGEWOOD AVENUE,315426,W-90 RIDGEWOOD AVE,PARAMUS,Bergen,14,9,22,9,76,7,2,0
CARNEYS POINT REHABILITATION AND NURSING CENTER,315271,201 FIFTH AVENUE,CARNEYS POINT,Salem,77,38,0,0,106,80,34,0
WHITE HOUSE HLTHCR & REHAB CTR,315372,560 BERKELEY AVENUE,ORANGE,Essex,17,0,12,1,126,3,0,0
CARE ONE AT EVESHAM,315464,870 EAST ROUTE 70,MARLTON,Burlington,,,,,,,,
BRIGHTON GARDENS OF EDISON,315351,1801 OAKTREE ROAD,EDISON,Middlesex,15,2,11,8,22,13,1,0
MASONIC VILLAGE AT BURLINGTON,315166,902 JACKSONVILLE ROAD,BURLINGTON,Burlington,42,31,26,15,96,55,9,0
MARCELLA CENTER,315330,2305 RANCOCAS ROAD,BURLINGTON,Burlington,75,2,64,22,80,40,4,1
WYNWOOD REHABILITATION AND HEALTHCARE CENTER,315047,1700 WYNWOOD DRIVE,CINNAMINSON,Burlington,64,0,26,20,104,16,0,0
JFK HARTWYCK AT EDISON ESTATES,315279,10 BRUNSWICK AVENUE,EDISON,Middlesex,134,0,29,27,167,37,4,0
MADISON CENTER,315015,625 STATE HIGHWAY 34,MATAWAN,Monmouth,89,1,38,21,108,17,2,0
WILLOW SPRINGS REHABILITATION AND HEALTHCARE CTR,315213,1049 BURNT TAVERN ROAD,BRICK,Ocean,99,44,73,36,120,57,3,0
HACKENSACK-UMC MOUNTAINSIDE,315389,ONE BAY AVE,MONTCLAIR,Essex,0,0,0,0,8,0,0,0
"PALACE REHABILITATION AND CARE CENTER, THE",315263,315 WEST MILL ROAD,MAPLE SHADE,Burlington,108,24,21,15,156,30,0,0
FOREST HILL HEALTHCARE CENTER,315375,497 MT PROSPECT AVE,NEWARK,Essex,1,0,3,0,65,4,0,0
ALARIS HEALTH AT ROCHELLE PARK,315308,96 PARKWAY AVENUE,ROCHELLE PARK,Bergen,25,7,40,15,130,49,3,0
LAKELAND HEALTH CARE CENTER,315261,25 FIFTH AVENUE,HASKELL,Passaic,0,1,4,0,91,3,1,0
MORRIS VIEW HEALTHCARE CENTER,315303,540 WEST HANOVER AVENUE,MORRISTOWN,Morris,120,42,109,28,220,33,31,0
REGENCY HERITAGE NURSING AND REHABILITATION CENTER,315367,380 DEMOTT LANE,SOMERSET,Somerset,69,40,75,35,166,24,32,0
"ACTORS FUND HOME, THE",315377,175 WEST HUDSON AVE,ENGLEWOOD,Bergen,26,38,26,13,124,20,5,0
REGENCY GRANDE NURS & REHAB CE,315355,65 NORTH SUSSEX STREET,DOVER,Morris,27,0,37,18,122,18,0,0
SOUTHGATE HEALTH CARE CTR,315237,449 S PENNSVILLE-AUBURN ROAD,CARNEYS POINT,Salem,59,12,38,28,93,33,13,0
UNITED METHODIST COMMUNITIES AT COLLINGSWOOD,315404,460 HADDON AVE,COLLINGSWOOD,Camden,34,7,24,14,40,47,11,0
CRANBURY CENTER,315353,292 APPLEGARTH ROAD,MONROE TOWNSHIP,Middlesex,58,5,39,29,90,30,1,1
ARISTACARE AT WHITING,315309,23 SCHOOLHOUSE ROAD,WHITING,Ocean,80,48,21,19,104,31,0,0
ARMENIAN NURSING AND REHABILITATION CENTER,315402,70 MAIN STREET,EMERSON,Bergen,23,11,26,13,27,33,0,0
FAMILY OF CARING HEALTHCARE AT RIDGEWOOD,315434,304 S. VAN DIEN AVE,RIDGEWOOD,Bergen,45,2,35,17,68,37,2,0
MONMOUTH CARE CENTER,315284,229 BATH AVENUE,LONG BRANCH,Monmouth,6,0,23,13,80,10,0,0
MERCERVILLE CENTER,315094,2240 WHITEHORSE-MERCERVILLE ROAD,MERCERVILLE,Mercer,62,3,29,18,76,45,1,0
COMPLETE CARE AT FAIR LAWN EDGE,315331,77 EAST 43RD STREET,PATERSON,Passaic,29,7,22,12,114,10,2,0
VOORHEES PEDIATRIC FACILITY,315289,1304 LAUREL OAK ROAD,VOORHEES,Camden,4,12,4,0,109,15,5,0
MONTCLAIR CARE CENTER,315363,111-115 GATES AVENUE,MONTCLAIR,Essex,1,0,1,1,48,5,0,0
UNITED METHODIST COMMUNITIES AT THE SHORES,315394,2201 BAY AVENUE,OCEAN CITY,Cape May,2,1,6,1,50,7,8,0
ALARIS HEALTH AT ST MARY'S,315352,135 SOUTH CENTER STREET,ORANGE,Essex,10,11,13,13,133,43,16,0
HACKENSACK MERIDIAN HEALTH NURSING & REHAB,315286,100 CHAPIN AVENUE,RED BANK,Monmouth,8,0,10,4,129,46,7,0
ARISTACARE AT CEDAR OAKS,315214,1311 DURHAM AVENUE,SOUTH PLAINFIELD,Middlesex,11,1,25,3,166,4,0,0
COURT HOUSE CENTER,315228,144 MAGNOLIA DRIVE,CAPE MAY COURT HOUSE,Cape May,5,9,28,0,102,3,0,0
SUNNYSIDE MANOR,315354,2500 RIDGEWOOD ROAD,WALL,Monmouth,0,0,14,0,41,3,2,0
COMPLETE CARE AT ARBORS,315333,1750 ROUTE 37 WEST,TOMS RIVER,Ocean,37,0,12,8,56,21,24,0
DE LA SALLE HALL,315374,810 NEWMAN SPRINGS RD,LINCROFT,Monmouth,0,0,3,0,24,0,0,0
ALARIS HEALTH AT HARBOR VIEW,315310,178-198 OGDEN AVE,JERSEY CITY,Hudson,3,14,4,0,117,4,0,0
ASPEN HILLS HEALTHCARE CENTER,315260,600 PEMBERTON BROWN MILLS RD,PEMBERTON,Burlington,47,0,20,9,151,18,1,1
MERIDIAN NURSING AND REHABILITATION AT BRICK,315342,415 JACK MARTIN BLVD,BRICK,Ocean,56,86,14,19,90,36,43,0
"ST JOSEPH'S HOME AL & NC, INC",315318,1-3 ST JOSEPH'S TERRACE,WOODBRIDGE,Middlesex,2,0,4,0,28,3,2,0
"PREFERRED CARE AT OLD BRIDGE, LLC",315321,6989 RT18,OLD BRIDGE,Middlesex,52,30,31,27,92,42,2,0
BROADWAY HOUSE FOR CONTINUING,315343,298 BROADWAY,NEWARK,Essex,18,0,19,9,66,28,0,0
ATRIUM POST ACUTE CARE OF WAYNE,315335,1120 ALPS ROAD,WAYNE,Passaic,115,2,50,36,120,36,0,0
COMPLETE CARE AT GREEN KNOLL,315134,875 ROUTE 202-206 NORTH,BRIDGEWATER,Somerset,49,11,9,3,104,6,23,2
LAKEVIEW REHABILITATION AND CARE CENTER,315110,130 TERHUNE DRIVE,WAYNE,Passaic,34,5,35,20,82,22,15,0
COMPLETE CARE AT HOLIDAY CITY,315320,4 PLAZA DRIVE,TOMS RIVER,Ocean,47,18,85,20,110,33,10,0
ALARIS HEALTH AT BOULEVARD EAST,315254,6819 BOULEVARD EAST,GUTTENBERG,Hudson,3,0,2,0,14,2,0,0
SINAI POST ACUTE NURSING AND REHAB CENTER,315236,65 JAY STREET,NEWARK,Essex,127,68,79,19,299,75,33,1
PARK PLACE CENTER,315362,2 DEER PARK DRIVE,MONMOUTH JUNCTION,Middlesex,44,5,31,19,68,23,1,1
PHILLIPSBURG CENTER,315311,843 WILBUR AVENUE,PHILLIPSBURG,Warren,3,4,7,0,49,2,1,0
MEADOW LAKES,315022,300 MEADOW LAKES,EAST WINDSOR,Mercer,18,9,37,10,49,38,1,0
"GARDENS AT MONROE HEALTHCARE AND REHABILITATION, T",315336,189 APPLEGARTH ROAD,MONROE TOWNSHIP,Middlesex,44,1,16,16,81,29,2,0
LEISURE CHATEAU REHABILITATION,315190,962 RIVER AVE,LAKEWOOD,Ocean,79,73,27,21,183,44,2,0
GREENWOOD HOUSE HOME FOR THE JEWISH AGED,315215,53 WALTER STREET,TRENTON,Mercer,,,,,,,,
FOREST MANOR HCC,315224,145 STATE PARK ROAD,HOPE,Warren,82,92,38,25,76,29,38,0
SKILLED NURSING AT FELLOWSHIP VILLAGE,315356,8000 FELLOWSHIP DRIVE,BASKING RIDGE,Somerset,8,8,0,12,23,11,4,0
BRIDGEWAY CARE AND REHAB CENTER AT BRIDGEWATER,315182,270 ROUTE 28,BRIDGEWATER,Somerset,77,37,57,21,116,27,74,0
HAMMONTON CENTER FOR REHABILITATION AND HEALTHCARE,315209,43 N WHITE HORSE PIKE,HAMMONTON,Atlantic,57,13,36,26,196,19,5,0
HEALTH CENTER AT BLOOMINGDALE,315348,255 UNION AVE,BLOOMINGDALE,Passaic,55,59,38,18,78,17,29,0
MERIDIAN NURSING & REHAB AT SHREWSBURY,315136,89 AVENUE AT THE COMMON,SHREWSBURY,Monmouth,3,11,23,0,105,8,14,0
CARE ONE AT HOLMDEL,315092,188 HIGHWAY 34,HOLMDEL,Monmouth,31,9,38,10,94,11,2,0
JERSEY SHORE CENTER,315364,3 INDUSTRIAL WAY EAST,EATONTOWN,Monmouth,15,2,37,1,131,10,0,0
HARROGATE,315262,400 LOCUST STREET,LAKEWOOD,Ocean,0,0,7,2,54,0,0,0
COUNTY MANOR REHABILITATION & HCC,315164,133 COUNTY ROAD,TENAFLY,Bergen,31,21,16,11,44,13,14,0
SHADY LANE GLOUCESTER CO HOME,315405,256 COUNTY HOUSE ROAD,CLARKSBORO,Gloucester,,,,,,,,
BERGEN COUNTY HEALTH CARE CTR,315436,35 B PIERMONT ROAD,ROCKLEIGH,Bergen,3,2,6,2,54,11,0,0
ALARIS HEALTH AT CASTLE HILL,315344,615 23RD STREET,UNION CITY,Hudson,5,22,8,13,123,11,3,3
BARTLEY HEALTHCARE NURSING & REHABILITATION,315288,175 BARTLEY ROAD,JACKSON,Ocean,14,2,29,13,119,14,3,0
FOUNTAIN VIEW CARE CENTER,315327,527 RIVER AVE,LAKEWOOD,Ocean,72,13,27,9,95,25,7,0
BISHOP MCCARTHY CENTER FOR REHABILITATION & HC,315126,1045 E CHESTNUT AVE,VINELAND,Cumberland,86,13,25,17,133,57,7,4
ARISTACARE AT DELAIRE,315200,400 W STIMPSON AVE,LINDEN,Union,131,4,53,79,186,45,0,0
ST LAWRENCE REHAB CENTER,315127,2381 LAWRENCEVILLE ROAD,LAWRENCEVILLE,Mercer,6,0,0,0,35,23,6,0
FAMILY OF CARING HEALTHCARE AT MONTCLAIR,315435,42 NORTH MOUNTAIN AVE,MONTCLAIR,Essex,26,0,21,18,45,2,0,0
HOMESTEAD REHABILITATION & HEALTH CARE CENTER,315378,129 MORRIS TURNPIKE,NEWTON,Sussex,55,12,34,18,82,12,10,0
SOUTHERN OCEAN CENTER,315332,1361 ROUTE 72 WEST,MANAHAWKIN,Ocean,58,5,43,15,101,19,0,0
DAUGHTERS OF ISRAEL PLEASANT VALLEY HOME,315029,1155 PLEASANT VALLEY WAY,WEST ORANGE,Essex,6,55,28,18,174,49,0,0
OAKLAND REHABILITATION AND HEALTHCARE  CENTER,315171,20 BREAKNECK ROAD,OAKLAND,Bergen,117,19,46,44,150,66,13,4
"HAMILTON GROVE HEALTHCARE AND REHABILITATION, LLC",315423,2300 HAMILTON AVE,HAMILTON,Mercer,58,7,43,25,145,19,10,0
"VOORHEES CARE & REHABILITATION CENTER, THE",315187,1302 LAUREL OAK ROAD,VOORHEES,Camden,119,64,37,25,157,37,30,0
WESTFIELD CENTER,315122,1515 LAMBERTS MILL ROAD,WESTFIELD,Union,61,3,55,16,125,55,1,2
"COMPLETE CARE AT LINWOOD, LLC",315185,201 NEW ROAD AND CENTRAL AVE,LINWOOD,Atlantic,20,8,41,27,114,34,4,0
WARDELL GARDENS AT TINTON FALLS,315414,524 WARDELL ROAD,TINTON FALLS,Monmouth,5,8,5,0,49,7,1,0
CARE ONE AT WELLINGTON,315152,301 UNION STREET,HACKENSACK,Bergen,12,0,11,6,85,5,2,0
STERLING MANOR,315149,794 N FORKLANDING ROAD,MAPLE SHADE,Burlington,6,1,0,0,77,10,0,0
LINCOLN PARK RENAISSANCE REHAB & NURSING,315042,521 PINE BROOK ROAD,LINCOLN PARK,Morris,10,4,20,13,129,33,1,0
ELIZABETH NURSING AND REHAB,315106,1048 GROVE STREET,ELIZABETH,Union,6,0,33,20,52,18,0,0
ST MARY'S CENTER FOR REHABILITATION & HEALTHCARE,315060,210 ST MARY'S DRIVE,CHERRY HILL,Camden,1,8,22,22,162,36,0,10
TOWER LODGE CARE CENTER,315069,1506 GULLY ROAD,WALL,Monmouth,1,4,1,0,54,4,4,0
CRANFORD PARK REHABILITATION & HEALTHCARE CENTER,315390,600 LINCOLN PARK EAST,CRANFORD,Union,2,0,5,3,48,75,0,0
MEDFORD LEAS,315144,ONE MEDFORD LEAS WAY,MEDFORD,Burlington,2,0,3,2,8,4,0,0
PEACE CARE ST ANN'S,315413,198 OLD BERGEN ROAD,JERSEY CITY,Hudson,44,0,29,11,88,34,0,0
CARE ONE AT VALLEY,315369,300 OLD HOOK ROAD,WESTWOOD,Bergen,5,0,8,1,72,7,0,0
FOOTHILL ACRES REHABILITATION & NURSING CENTER,315425,39 EAST MOUNTAIN ROAD,HILLSBOROUGH,Somerset,86,4,53,36,115,21,0,0
NEW GROVE MANOR,315147,101 NORTH GROVE STREET,EAST ORANGE,Essex,108,11,45,20,114,9,39,2
BRAKELEY PARK CENTER,315316,290 RED SCHOOL LANE,PHILLIPSBURG,Warren,99,1,44,26,94,35,0,0
AUTUMN LAKE HEALTHCARE AT OCEANVIEW,315179,2721 ROUTE 9,OCEAN VIEW,Cape May,35,18,21,13,98,12,14,0
SEACREST VILLAGE,315218,1001 CENTER ST,LITTLE EGG HARBOR TW,Ocean,0,15,16,0,150,4,4,0
CRYSTAL LAKE HLTHCARE & REHAB,315125,395 LAKESIDE BLVD,BAYVILLE,Ocean,75,0,42,126,155,50,2,0
KING MANOR CARE AND REHABILITATION CENTER,315299,2303 WEST BANGS AVE,NEPTUNE,Monmouth,6,0,3,0,77,7,0,0
MERWICK CARE & REHABILITATION CENTER,315001,100 PLAINSBORO ROAD,PLAINSBORO,Middlesex,20,18,50,27,153,21,5,0
LLANFAIR HOUSE CARE & REHABILITATION CENTER,315142,1140 BLACK OAK RIDGE ROAD,WAYNE,Passaic,23,2,27,13,108,11,5,0
WARREN HAVEN REHAB AND NURSING CENTER,315304,350 OXFORD ROAD,OXFORD,Warren,56,64,41,17,73,11,12,0
RIVERFRONT REHABILITATION AND HEALTHCARE CENTER,315225,5101 NORTH PARK DRIVE,PENNSAUKEN,Camden,66,16,26,11,158,33,3,0
COMPLETE CARE AT WHITING,315293,3000 HILLTOP ROAD,WHITING,Ocean,50,10,22,16,99,42,14,0
ARNOLD WALTER NURSING HOME,315119,622 S LAUREL AVENUE,HAZLET,Monmouth,13,8,15,8,79,20,2,1
ABIGAIL HOUSE FOR NURSING & REHABILITATION,315267,1105 -1115 LINDEN STREET,CAMDEN,Camden,61,0,14,4,142,21,2,0
ARISTACARE AT CHERRY HILL,315245,1399 CHAPEL AVE WEST,CHERRY HILL,Camden,14,1,19,15,87,19,0,0
BAYSHORE HEALTH CARE CENTER,315252,715 NORTH BEERS STREET,HOLMDEL,Monmouth,4,0,23,12,152,10,15,0
JEFFERSON HEALTH CARE CENTER,315231,535 EGG HARBOR ROAD,SEWELL,Gloucester,30,5,14,4,128,12,13,0
TEANECK NURSING CENTER,315037,1104 TEANECK ROAD,TEANECK,Bergen,10,0,3,1,82,0,0,0
SILVER HEALTHCARE CENTER,315280,1417 BRACE ROAD,CHERRY HILL,Camden,120,143,35,24,123,32,32,0
LEISURE PARK HEALTH CENTER,315256,1400 ROUTE 70,LAKEWOOD,Ocean,1,0,4,4,36,2,0,2
DEPTFORD CENTER FOR REHABILITATION AND HEALTHCARE,315174,1511 CLEMENTS BRIDGE RD,DEPTFORD,Gloucester,52,27,55,33,201,19,2,1
CRANFORD REHAB & NURSING CENTER,315091,205 BIRCHWOOD AVE,CRANFORD,Union,15,1,20,6,131,6,0,0
MEDFORD CARE CENTER,315176,185 TUCKERTON ROAD,MEDFORD,Burlington,58,46,13,8,95,12,6,0
SUMMER HILL NURSING HOME,315381,111 ROUTE 516,OLD BRIDGE,Middlesex,28,0,8,4,89,29,1,1
ALARIS HEALTH AT CEDAR GROVE,315357,110 GROVE AVE,CEDAR GROVE,Essex,14,0,0,0,135,19,1,0
CAMBRIDGE REHABILITATION AND HEALTHCARE CENTER,315201,255 EAST MAIN ST,MOORESTOWN,Burlington,67,7,23,17,70,27,0,0
LOPATCONG CENTER,315202,390 RED SCHOOL LANE,PHILLIPSBURG,Warren,98,4,42,33,108,27,1,0
HARTWYCK AT OAK TREE,315251,2048 OAK TREE ROAD,EDISON,Middlesex,47,38,25,1,92,70,22,0
AVISTA HEALTHCARE,315068,3025 CHAPEL AVENUE WEST,CHERRY HILL,Camden,3,0,3,0,68,3,0,1
"COMPLETE CARE AT LAURELTON, LLC",315274,475 JACK MARTIN BLVD,BRICK,Ocean,71,1,26,14,78,24,0,0
WILLOWBROOKE COURT SKILLED CARE AT EVERGREENS,315077,309 BRIDGEBORO ROAD,MOORESTOWN,Burlington,1,0,4,1,19,11,1,0
CEDAR GROVE RESPIRATORY AND NURSING CENTER,315257,1420 SOUTH BLACK HORSE PIKE,WILLIAMSTOWN,Gloucester,16,6,73,3,154,19,0,0
ALARIS HEALTH AT HAMILTON PARK,315300,525 MONMOUTH STREET,JERSEY CITY,Hudson,0,0,6,4,152,32,0,0
ARBOR RIDGE REHABILITATION AND HEALTHCARE CENTER,315234,261 TERHUNE DRIVE,WAYNE,Passaic,42,3,28,6,92,11,0,0
ELMORA HILLS HEALTH & REHABILITATION CENTER,315010,225 W JERSEY STREET,ELIZABETH,Union,77,0,44,18,133,7,0,0
ST JOSEPH'S HOME FOR ELDERLY,315388,140 SHEPHERD LANE,TOTOWA,Passaic,8,5,9,4,63,17,4,0
RUNNELLS CENTER FOR REHABILITATION & HEALTHCARE,315009,40 WATCHUNG WAY,BERKELEY HEIGHTS,Union,25,4,226,5,178,88,19,0
GATEWAY CARE CENTER,315177,139 GRANT AVE,EATONTOWN,Monmouth,41,1,0,12,110,21,0,0
CONCORD HEALTHCARE & REHABILITATION CENTER,315275,963 OCEAN AVE,LAKEWOOD,Ocean,31,14,11,8,75,32,13,0
NEPTUNE GARDENS NURSING AND REHAB LLC,315056,101 WALNUT ST,NEPTUNE,Monmouth,62,150,6,0,75,53,0,0
N J EASTERN STAR HOME,315419,111 FINDERNE AVENUE,BRIDGEWATER,Somerset,35,122,25,13,57,32,5,0
TROY HILLS CENTER,315138,200 REYNOLDS AVE,PARSIPPANY,Morris,48,1,32,10,80,16,0,0
