Provider Name,Federal Provider Number,Provider Address,Provider City,County,Residents Total Confirmed COVID-19,Residents Total Suspected COVID-19,Residents Total All Deaths,Residents Total COVID-19 Deaths,Total Number of Occupied Beds,Staff Total Confirmed COVID-19,Staff Total Suspected COVID-19,Staff Total COVID-19 Deaths
HERITAGE PARK HEALTH AND REHABILITATION CENTER,105320,37135 COLEMAN AVE,DADE CITY,Pasco,4,8,1,1,103,13,3,0
SIGNATURE HEALTHCARE AT COLLEGE PARK,105387,13755 GOLF CLUB PKWY,FORT MYERS,Lee,49,7,14,3,95,40,0,0
MIAMI SHORES NURSING AND REHAB CENTER,105449,9380 NW 7TH AVENUE,MIAMI,Miami-Dade,47,0,6,3,74,42,22,0
TALLAHASSEE MEMORIAL HOSPITAL EXTENDED CARE,105158,1609 MEDICAL DR,TALLAHASSEE,Leon,0,0,0,0,48,5,4,0
RIVER GARDEN HEBREW HOME FOR THE AGED,105016,11401 OLD SAINT AUGUSTINE RD,JACKSONVILLE,Duval,13,5,13,6,118,22,27,0
VILLAGE ON THE ISLE,105472,910 TAMIAMI TRAIL SOUTH,VENICE,Sarasota,0,0,0,0,53,2,0,0
HERON POINTE HEALTH AND REHABILITATION,105413,1445 HOWELL AVE,BROOKSVILLE,Hernando,15,3,14,7,98,28,0,0
MAJESTIC OAKS,105374,901 VETERAN'S MEMORIAL PARKWAY,ORANGE CITY,Volusia,1,4,16,1,116,12,1,0
"WATERFORD, THE",105404,601 UNIVERSE BLVD,JUNO BEACH,Palm Beach,0,0,8,0,55,3,0,0
SIGNATURE HEALTHCARE OF PORT CHARLOTTE,105363,4033 BEAVER LANE,PORT CHARLOTTE,Charlotte,47,3,19,15,113,23,0,0
LIFE CARE CENTER OF PUNTA GORDA,105289,450 SHREVE STREET,PUNTA GORDA,Charlotte,27,21,51,3,122,15,8,0
REGENTS PARK NURSING & REHABILITATION CENTER,105476,6363 VERDE TRAIL,BOCA RATON,Palm Beach,45,29,22,12,134,43,26,0
KENILWORTH CARE & REHABILITATION CENTER,105352,3011 KENILWORTH BLVD,SEBRING,Highlands,20,42,4,3,71,17,43,0
FIRST COAST HEALTH & REHABILITATION CENTER,105429,7723 JASPER AVENUE,JACKSONVILLE,Duval,15,2,2,2,84,61,0,0
REHABILITATION AND HEALTHCARE CENTER OF TAMPA,105234,4411 N HABANA AVE,TAMPA,Hillsborough,43,17,15,6,154,27,8,0
TERRACES OF LAKE WORTH CARE CENTER,105125,1711 6TH AVENUE SOUTH,LAKE WORTH,Palm Beach,9,0,8,3,75,23,5,0
"AVANTE AT LEESBURG, INC",105304,2000 EDGEWOOD AVE,LEESBURG,Lake,41,5,4,4,84,36,0,1
SOUTHERN PINES HEALTHCARE CENTER,105275,6140 CONGRESS ST,NEW PORT RICHEY,Pasco,7,0,3,0,96,21,0,0
REHAB & HEALTHCARE CENTER OF CAPE CORAL,105342,2629 DEL PRADO BLVD,CAPE CORAL,Lee,50,125,12,7,90,39,23,1
HEARTLAND HEALTH CARE CENTER - NORTH SARASOTA,105389,3250 12TH ST,SARASOTA,Sarasota,2,12,9,0,72,7,5,0
"REHABILITATION CENTER OF WINTER PARK, THE",105430,1700 MONROE AVE,MAITLAND,Orange,4,37,15,0,136,12,1,0
HUNTINGTON PLACE,105250,1775 HUNTINGTON LANE,ROCKLEDGE,Brevard,7,8,13,3,81,12,8,0
JOHN KNOX VILLAGE OF POMPANO BEACH,105255,700 SW 4TH STREET,POMPANO BEACH,Broward,0,3,30,0,152,16,2,0
WEST MELBOURNE HEALTH & REHABILITATION CENTER,105376,2125 WEST NEW HAVEN AVE,WEST MELBOURNE,Brevard,43,15,29,0,134,40,3,0
LOURDES-NOREEN MCKEEN RESIDENCE FOR GERIATRIC CARE,105420,315 S FLAGLER DR,WEST PALM BEACH,Palm Beach,13,1,10,1,98,28,11,0
HERITAGE HEALTHCARE & REHABILITATION CENTER,105178,777 9TH ST N,NAPLES,Collier,1,0,2,0,68,3,0,0
LAKELAND HILLS CENTER,105283,610 E BELLA VISTA DR,LAKELAND,Polk,49,37,67,60,115,23,18,0
PLANTATION NURSING & REHABILITATION CENTER,105175,4250 NW 5TH ST,PLANTATION,Broward,2,0,0,0,83,21,0,0
FOUNTAIN MANOR HEALTH & REHABILITATION CENTER,105172,390 NE 135TH ST,NORTH MIAMI,Miami-Dade,71,1,25,13,131,84,0,0
ROCKLEDGE HEALTH AND REHABILITATION CENTER,105251,587 BARTON BLVD,ROCKLEDGE,Brevard,57,6,40,27,63,41,9,2
SOUTH HERITAGE HEALTH & REHABILITATION CENTER,105117,718 LAKEVIEW AVE S,SAINT PETERSBURG,Pinellas,12,4,4,3,60,22,7,0
"CRESTVIEW REHABILITATION CENTER, LLC",105190,1849 FIRST AVENUE EAST,CRESTVIEW,Okaloosa,0,0,8,0,136,8,0,0
EVERGREEN WOODS,105397,7045 EVERGREEN WOODS TRL,SPRING HILL,Hernando,28,7,0,0,101,45,10,0
HERITAGE HEALTHCARE CENTER AT TALLAHASSEE,105433,3101 GINGER DR,TALLAHASSEE,Leon,47,30,16,0,136,32,6,0
WOODBRIDGE CARE CENTER,105426,8720 JACKSON SPRINGS RD,TAMPA,Hillsborough,27,16,2,0,98,24,5,0
JACKSON MEMORIAL PERDUE MEDICAL CENTER,105252,19590 OLD CUTLER ROAD,CUTLER BAY,Miami-Dade,26,34,3,0,149,30,22,1
SUNSET POINT,105373,1980 SUNSET POINT RD,CLEARWATER,Pinellas,32,16,12,4,85,23,11,0
MANORCARE HEALTH SERVICES SARASOTA,105454,5511 SWIFT ROAD,SARASOTA,Sarasota,1,18,12,0,151,8,18,0
"AVANTE AT ORMOND BEACH, INC",105310,170 N KINGS ROAD,ORMOND BEACH,Volusia,47,4,15,7,89,51,6,0
BAY TREE CENTER,105394,2600 HIGHLANDS BLVD N,PALM HARBOR,Pinellas,8,7,14,1,98,9,3,0
BARTOW CENTER,105286,2055 E GEORGIA ST,BARTOW,Polk,69,68,18,11,99,38,20,0
TIERRA PINES CENTER,105398,7380 ULMERTON RD,LARGO,Pinellas,7,10,6,3,86,24,13,0
MORTON PLANT REHABILITATION CENTER,105128,400 CORBETT ST,BELLEAIR,Pinellas,7,4,2,0,56,8,11,0
GROVES CENTER,105269,512 S 11TH ST,LAKE WALES,Polk,21,12,5,2,96,15,0,0
ST AUGUSTINE HEALTH AND REHABILITATION CENTER,105315,51 SUNRISE BLVD,SAINT AUGUSTINE,St. Johns,31,3,14,4,101,24,14,0
SEA BREEZE REHAB AND NURSING CENTER,105399,3663 15TH AVE,VERO BEACH,Indian River,48,0,4,4,81,44,0,2
WILTON MANORS HEALTH & REHABILITATION CENTER,105119,2675 N ANDREWS AVE,WILTON MANORS,Broward,7,4,0,0,133,37,0,0
ST MARK VILLAGE,105378,2655 NEBRASKA AVE,PALM HARBOR,Pinellas,0,0,6,1,52,8,1,0
UNIVERSITY HILLS HEALTH AND REHABILITATION,105445,10040 HILLVIEW ROAD,PENSACOLA,Escambia,3,11,5,0,108,9,22,0
THE LODGE HEALTH AND REHABILITATION CENTER,105196,635 SE 17TH STREET,OCALA,Marion,2,0,1,0,89,10,0,0
JACARANDA MANOR,105390,4250 66TH ST N,SAINT PETERSBURG,Pinellas,244,44,105,84,187,86,49,0
BAY POINTE NURSING PAVILION,105477,4201 31ST ST S,SAINT PETERSBURG,Pinellas,20,14,7,3,105,35,4,0
RIVERWOOD CENTER,105135,2802 PARENTAL HOME ROAD,JACKSONVILLE,Duval,23,7,13,3,156,34,26,0
SIGNATURE HEALTHCARE OF JACKSONVILLE,105287,2061 HYDE PARK RD,JACKSONVILLE,Duval,97,0,24,24,126,47,28,0
GOLFCREST HEALTHCARE CENTER,105009,600 NORTH 17TH AVE,HOLLYWOOD,Broward,32,0,10,6,47,17,0,0
LAURELLWOOD CARE CENTER,105228,3127 57TH AVE N,SAINT PETERSBURG,Pinellas,2,0,1,0,42,8,10,0
COMMUNITY CONVALESCENT CENTER,105029,2202 W OAK AVE,PLANT CITY,Hillsborough,20,9,49,20,107,7,7,0
SOUTH CAMPUS CARE CENTER,105375,715 E DIXIE AVE,LEESBURG,Lake,24,2,0,0,115,27,0,0
BENEVA LAKES HEALTHCARE AND REHABILITATION CENTER,105416,741 SOUTH BENEVA ROAD,SARASOTA,Sarasota,8,1,7,0,107,30,0,0
SANTA ROSA CENTER FOR REHABILITATION AND HEALING,105328,5386 BROAD ST,MILTON,Santa Rosa,19,17,23,3,82,24,11,0
DELTONA HEALTH CARE,105447,1851 ELKCAM BLVD,DELTONA,Volusia,16,61,45,20,80,41,59,0
WILLOWBROOKE COURT AT ST ANDREWS,105355,6152 N VERDE TRAIL,BOCA RATON,Palm Beach,26,3,16,3,61,45,0,0
HEARTLAND HEALTH CARE CENTER OF SOUTH JACKSONVILLE,105366,3648 UNIVERSITY BLVD S,JACKSONVILLE,Duval,29,8,2,2,72,33,13,0
BRIDGEVIEW CENTER,105402,350 S RIDGEWOOD AVENUE,ORMOND BEACH,Volusia,2,0,12,0,92,12,4,0
CASA MORA REHABILITATION AND EXTENDED CARE,105327,1902 59TH ST W,BRADENTON,Manatee,19,48,15,0,166,7,0,0
OAK MANOR HEALTHCARE & REHABILITATION CENTER,105248,3500 OAK MANOR LANE,LARGO,Pinellas,50,66,9,3,70,29,50,0
"MIAMI JEWISH HEALTH SYSTEMS, INC",105030,5200 NE 2ND AVENUE,MIAMI,Miami-Dade,96,83,29,15,356,128,168,0
FORT MYERS REHABILITATION AND NURSING CENTER,105427,7173 CYPRESS DRIVE SW,FORT MYERS,Lee,22,0,10,7,119,19,1,0
"PALMS OF SEBRING, THE",105037,725 S PINE ST,SEBRING,Highlands,3,17,5,0,74,23,21,1
HARDEE MANOR HEALTHCARE CENTER,105362,401 ORANGE PLACE,WAUCHULA,Hardee,3,1,10,2,59,7,2,0
ORCHARD RIDGE,105438,4927 VOORHEES RD,NEW PORT RICHEY,Pasco,32,43,31,5,96,16,26,0
ALLIANCE HEALTH AND REHABILITATION CENTER,105349,130 W ARMSTRONG AVENUE,DELAND,Volusia,0,0,18,0,58,25,2,0
LAKESIDE OAKS CARE CENTER,105132,1061 VIRGINIA ST,DUNEDIN,Pinellas,,,,,,,,
"AVANTE AT MT DORA, INC",105333,3050 BROWN AVE,MOUNT DORA,Lake,38,17,18,10,89,27,5,0
LONGWOOD HEALTH AND REHABILITATION CENTER,105377,1520 S GRANT ST,LONGWOOD,Seminole,10,59,18,3,101,9,0,0
EDEN SPRINGS NURSING AND REHAB CENTER,105282,4679 CRAWFORDVILLE HWY,CRAWFORDVILLE,Wakulla,1,7,31,0,99,15,12,0
AVANTE AT INVERNESS INC,105308,304 S CITRUS AVE,INVERNESS,Citrus,,,,,,,,
"TERRACE AT HOBE SOUND, THE",105300,9555 SE FEDERAL HWY,HOBE SOUND,Martin,24,10,17,11,88,91,6,0
CYPRESS COVE CARE CENTER,105437,700 SE 8TH AVE,CRYSTAL RIVER,Citrus,0,1,1,0,100,2,0,0
CRYSTAL RIVER HEALTH AND REHABILITATION CENTER,105317,136 NORTHEAST 12TH AVENUE,CRYSTAL RIVER,Citrus,3,4,30,0,128,3,13,0
ADVANCED CARE CENTER,105478,401 FAIRWOOD AVE,CLEARWATER,Pinellas,8,0,6,0,105,5,3,0
VALENCIA HILLS HEALTH AND REHABILITATION CENTER,105301,1350 SLEEPY HILL RD,LAKELAND,Polk,70,3,31,20,169,24,66,0
PINES NURSING HOME,105057,301 NE 141 STREET,MIAMI,Miami-Dade,7,1,5,0,40,5,1,0
FERNANDINA BEACH REHABILITATION AND NURSING CENTER,105470,1625 LIME STREET,FERNANDINA BEACH,Nassau,40,17,14,0,87,16,14,0
VILLA MARIA NURSING CENTER,105232,1050 NE 125TH STREET,NORTH MIAMI,Miami-Dade,33,7,5,3,173,29,9,0
NORTH REHABILITATION CENTER,105149,1301 16TH ST N,SAINT PETERSBURG,Pinellas,28,0,22,8,36,26,42,0
CROSS TERRACE REHABILITATION CENTER,105350,1351 SAN CHRISTOPHER DR,DUNEDIN,Pinellas,8,0,0,0,74,8,0,0
RIVER VALLEY REHABILITATION CENTER,105473,17884 NE CROZIER ST,BLOUNTSTOWN,Calhoun,0,0,21,0,123,14,3,0
BOCA CIEGA CENTER,105271,1414 59TH ST S,GULFPORT,Pinellas,74,16,16,11,82,41,3,0
NORTH FLORIDA REHABILITATION AND SPECIALTY CARE,105460,6700 NW 10TH PLACE,GAINESVILLE,Alachua,64,23,24,11,76,34,11,0
STUART REHABILITATION AND HEALTHCARE,105277,1500 SE PALM BEACH RD,STUART,Martin,5,0,11,2,82,15,4,0
AVENTURA REHAB AND NURSING CENTER,105331,1800 N E 168TH STREET,NORTH MIAMI BEACH,Miami-Dade,11,9,10,9,73,15,1,2
SARASOTA HEALTH AND REHABILITATION CENTER,105155,1524 EAST AVENUE SOUTH,SARASOTA,Sarasota,78,53,15,5,97,36,12,0
ROSEWOOD HEALTH AND REHABILITATION CENTER,105480,3920 ROSEWOOD WAY,ORLANDO,Orange,17,1,10,3,89,20,0,0
SEVEN HILLS HEALTH & REHABILITATION CENTER,105364,3333 CAPITAL MEDICAL BLVD,TALLAHASSEE,Leon,14,4,13,0,124,20,15,0
BAYSIDE CARE CENTER,105071,811 JACKSON ST N,SAINT PETERSBURG,Pinellas,10,0,8,0,80,16,1,0
WEST BROWARD REHABILITATION AND HEALTHCARE,105237,7751 W BROWARD BLVD,PLANTATION,Broward,34,6,10,4,94,57,6,0
"PONCE THERAPY CARE CENTER, THE",105468,1999 OLD MOULTRIE ROAD,SAINT AUGUSTINE,St. Johns,4,1,9,0,78,8,6,0
LAKE PLACID HEALTH AND REHABILITATION CENTER,105455,125 TOMOKA BLVD S,LAKE PLACID,Highlands,7,4,6,1,147,12,0,0
EAGLE LAKE NURSING AND REHAB CARE CENTER,105292,1100 66TH ST N,SAINT PETERSBURG,Pinellas,26,7,14,14,39,15,4,0
PLAZA HEALTH AND REHAB,105434,4842 SW ARCHER ROAD,GAINESVILLE,Alachua,28,6,20,0,130,26,36,0
LEXINGTON HEALTH AND REHABILITATION CENTER,105072,6300 46TH AVE N,SAINT PETERSBURG,Pinellas,47,125,21,8,118,43,126,0
BROWARD NURSING & REHABILITATION CENTER,105083,1330 S ANDREWS AVE,FORT LAUDERDALE,Broward,12,2,4,0,114,47,0,0
GREENBRIAR REHABILITATION AND NURSING CENTER,105159,210 21ST AVE W,BRADENTON,Manatee,1,0,5,0,67,13,8,0
ARCH PLAZA NURSING & REHABILITATION CENTER,105008,12505 NE 16TH AVE,NORTH MIAMI,Miami-Dade,4,0,15,1,78,13,0,0
GOLFVIEW HEALTHCARE CENTER,105409,3636 10TH AVE N,SAINT PETERSBURG,Pinellas,5,0,2,0,48,6,4,0
CORAL GABLES NURSING AND REHABILITATION CENTER,105005,7060 SW 8TH STREET,MIAMI,Miami-Dade,25,20,8,4,71,30,5,0
SEAVIEW NURSING AND REHABILITATION CENTER,105258,2401 NE 2ND STREET,POMPANO BEACH,Broward,0,0,0,0,76,1,0,0
MANOR PINES CONVALESCENT CENTER,105089,1701 NE 26TH ST,FORT LAUDERDALE,Broward,2,1,4,3,109,11,3,0
SANDGATE GARDENS REHAB AND NURSING CENTER,105382,703 S 29TH ST,FORT PIERCE,St. Lucie,34,5,8,2,67,27,7,1
PORT ST LUCIE REHABILITATION AND HEALTHCARE,105410,7300 OLEANDER AVE,PORT SAINT LUCIE,St. Lucie,70,0,8,8,93,156,0,1
HEALTH CENTRAL PARK,105479,411 NORTH DILLARD STREET,WINTER GARDEN,Orange,4,0,4,0,107,8,0,0
CONSULATE HEALTH CARE OF NEW PORT RICHEY,105459,8417 OLD COUNTY RD 54,NEW PORT RICHEY,Pasco,1,0,41,0,111,46,7,0
BOULEVARD REHABILITATION CENTER,105067,2839 S SEACREST BLVD,BOYNTON BEACH,Palm Beach,6,0,19,4,122,23,0,0
PENINSULA CARE AND REHABILITATION CENTER,105451,900 BECKETT WAY,TARPON SPRINGS,Pinellas,82,0,19,16,114,20,2,0
CALUSA HARBOUR,105384,2525 FIRST ST,FORT MYERS,Lee,2,0,0,0,44,11,0,0
HERITAGE PARK REHABILITATION AND HEALTHCARE,105238,2826 CLEVELAND AVE,FORT MYERS,Lee,,,,,,,,
LAKE EUSTIS HEALTH AND REHABILITATION CENTER,105001,411 W WOODWARD AVE,EUSTIS,Lake,1,0,0,0,80,8,2,0
CLEARWATER CENTER,105274,1270 TURNER ST,CLEARWATER,Pinellas,0,5,4,1,94,5,9,0
MANORCARE HEALTH SERVICES DUNEDIN,105436,870 PATRICIA AVE,DUNEDIN,Pinellas,1,12,15,0,102,4,19,0
SANDALWOOD REHABILITATION AND NURSING CENTER,105002,1001 S BEACH STREET,DAYTONA BEACH,Volusia,0,0,0,0,87,2,0,0
HEATHER HILL HEALTHCARE CENTER,105343,6630 KENTUCKY AVE,NEW PORT RICHEY,Pasco,0,2,31,0,79,4,33,0
MADISON POINTE CARE CENTER,105166,6020 INDIANA AVE,NEW PORT RICHEY,Pasco,26,2,2,1,104,14,8,0
SEMINOLE PAVILION REHABILITATION & NURSING SERVICE,105412,10800 TEMPLE TERRACE,SEMINOLE,Pinellas,5,52,3,1,71,12,26,0
"SANDS AT SOUTH BEACH CARE CENTER, THE",105229,42 COLLINS AVENUE,MIAMI BEACH,Miami-Dade,72,12,22,9,173,46,11,1
"FORT WALTON REHABILITATION CENTER, LLC",105295,1 LBJ SR DRIVE,FORT WALTON BEACH,Okaloosa,12,0,7,2,101,24,4,0
WEST BAY OF TAMPA,105419,3865 TAMPA RD,OLDSMAR,Pinellas,32,3,8,1,89,14,1,0
LAKE VIEW CARE CENTER AT DELRAY,105475,5430 LINTON BLVD,DELRAY BEACH,Palm Beach,25,27,23,10,81,44,7,0
TREASURE ISLE CARE CENTER,105408,1735 N TREASURE DRIVE,NORTH BAY VILLAGE,Miami-Dade,3,2,2,2,162,15,0,0
HEALTHCARE CENTER OF JACKSONVILLE,105138,5377 MONCRIEF ROAD,JACKSONVILLE,Duval,10,2,6,0,120,31,4,0
UNIVERSITY WEST REHABILITATION CENTER,105261,545 WEST EUCLID AVENUE,DELAND,Volusia,55,2,6,4,39,22,0,0
"OCEAN VIEW NURSING & REHABILITATION CENTER, LLC",105038,2810 SOUTH ATLANTIC AVENUE,NEW SMYRNA BEACH,Volusia,31,42,14,1,99,21,13,0
TARPON BAYOU CENTER,105280,515 CHESAPEAKE DR,TARPON SPRINGS,Pinellas,2,26,0,0,94,44,39,0
COURTENAY SPRINGS VILLAGE,105463,1100 SOUTH COURTENAY PARKWAY,MERRITT ISLAND,Brevard,15,0,0,0,45,8,0,0
PINECREST REHABILITATION CENTER,105153,13650 NE 3RD COURT,NORTH MIAMI,Miami-Dade,20,0,8,3,64,24,1,0
"AVANTE AT LAKE WORTH, INC.",105372,2501 N A ST,LAKE WORTH,Palm Beach,0,0,2,4,93,15,0,0
KENSINGTON GARDENS REHAB AND NURSING CENTER,105453,2055 PALMETTO ST,CLEARWATER,Pinellas,51,1,8,1,106,58,5,0
COLONIAL LAKES HEALTH CARE,105440,15204 W COLONIAL DR,WINTER GARDEN,Orange,55,21,34,9,135,41,1,0
RIVERSIDE CARE CENTER,105432,899 NW 4TH STREET,MIAMI,Miami-Dade,40,41,11,7,84,83,32,1
OKEECHOBEE HEALTH CARE FACILITY,105484,1646 HIGHWAY 441 N,OKEECHOBEE,Okeechobee,25,5,22,9,150,39,13,0
PALMS CARE CENTER,105336,3370 NW 47TH TERRACE,LAUDERDALE LAKES,Broward,29,0,12,7,95,24,0,0
APOLLO HEALTH AND REHABILITATION CENTER,105202,1000 24TH ST N,SAINT PETERSBURG,Pinellas,,,,,,,,
PARKVIEW REHABILITATION CENTER AT WINTER PARK,105307,2075 LOCH LOMOND DRIVE,WINTER PARK,Orange,9,0,16,2,84,17,1,0
MEDICANA NURSING AND REHAB CENTER,105259,1710 LAKE WORTH ROAD,LAKE WORTH,Palm Beach,15,0,19,8,89,13,0,0
BAY BREEZE HEALTH AND REHABILITATION CENTER,105443,1026 ALBEE FARM RD,VENICE,Sarasota,0,0,8,0,113,7,1,0
LIFE CARE CENTER OF ALTAMONTE SPRINGS,105365,989 ORIENTA AVE,ALTAMONTE SPRINGS,Seminole,125,203,42,37,122,48,25,0
BRISTOL AT TAMPA REHAB AND NURSING CENTER LLC,105140,1818 E FLETCHER AVE,TAMPA,Hillsborough,22,3,16,7,170,20,0,0
SIGNATURE HEALTHCARE OF PALM BEACH,105466,4405 LAKEWOOD ROAD,LAKE WORTH,Palm Beach,46,15,19,15,83,34,4,0
JUPITER MEDICAL CENTER PAVILION INC,105047,1230 SOUTH OLD DIXIE HWY,JUPITER,Palm Beach,0,0,0,0,2,2,1,0
MANOR OAKS NURSING & REHABILITATION CENTER,105205,2121 E COMMERCIAL BLVD,FORT LAUDERDALE,Broward,4,1,3,1,73,11,0,0
ABBEY DELRAY SOUTH,105411,1717 HOMEWOOD BLVD,DELRAY BEACH,Palm Beach,13,0,13,2,57,15,6,0
"CHATEAU AT MOORINGS PARK, THE",105396,130 MOORINGS PARK DRIVE,NAPLES,Collier,1,4,1,0,86,14,5,0
LAKELAND NURSING & REHABILITATION,105354,1919 LAKELAND HILLS BLVD,LAKELAND,Polk,8,0,21,3,148,10,2,1
"REHABILITATION CENTER OF THE PALM BEACHES,THE",105039,301 NORTHPOINTE PARKWAY,WEST PALM BEACH,Palm Beach,3,2,10,1,98,17,2,0
FAIRWAY OAKS CENTER,105305,13806 N 46TH ST,TAMPA,Hillsborough,20,4,20,9,68,22,2,0
"CARE CENTER AT PINELLAS PARK, THE",105422,8701 49TH ST N,PINELLAS PARK,Pinellas,34,2,3,3,99,26,5,0
W FRANK WELLS NURSING HOME,105210,210 N 2ND ST,MACCLENNY,Baker,1,11,12,1,43,5,22,0
CROSS SHORES CARE CENTER,105435,220 NINTH STREET,PORT SAINT JOE,Gulf,0,0,1,0,65,12,2,0
WINTER PARK CARE & REHABILITATION CENTER,105332,2970 SCARLETT RD,WINTER PARK,Orange,2,0,3,0,89,8,9,0
ABBEY DELRAY,105335,2105 SW 11TH COURT,DELRAY BEACH,Palm Beach,7,0,2,0,89,17,0,0
SIGNATURE HEALTHCARE OF ORMOND,105458,103 NORTH CLYDE MORRIS BLVD,ORMOND BEACH,Volusia,0,0,14,0,52,11,7,0
VENTURA HEALTH AND REHABILITATION CENTER,105146,7900 VENTURE CENTER WAY,BOYNTON BEACH,Palm Beach,21,8,16,5,80,25,1,0
"OAKS OF CLEARWATER, THE",105323,420 BAY AVE,CLEARWATER,Pinellas,46,0,37,8,42,18,0,0
SIGNATURE HEALTHCARE OF ORANGE PARK,105381,2029 PROFESSIONAL CENTER DR,ORANGE PARK,Clay,55,29,6,6,78,43,22,0
OAK HAVEN REHAB AND NURSING CENTER,105302,919 OLD WINTER HAVEN RD,AUBURNDALE,Polk,39,6,13,5,72,44,18,0
ROYAL OAK NURSING CENTER,105385,37300 ROYAL OAK LANE,DADE CITY,Pasco,19,4,21,7,89,20,2,0
BEAR CREEK NURSING CENTER,105393,8041 STATE RD 52,HUDSON,Pasco,36,121,31,4,83,16,65,0
EMERALD COAST CENTER,105265,114 THIRD STREET SE,FORT WALTON BEACH,Okaloosa,30,41,10,10,90,48,29,1
HEALTH CENTER AT BRENTWOOD,105461,2333 N BRENTWOOD CIR,LECANTO,Citrus,10,55,12,1,88,19,12,0
BAYVIEW CENTER,105324,301 S BAY ST,EUSTIS,Lake,21,12,5,4,78,17,18,0
SUN TERRACE HEALTH CARE CENTER,105319,105 TRINITY LAKES DR,SUN CITY CENTER,Hillsborough,2,2,2,0,99,8,8,0
BOCA RATON REHABILITATION CENTER,105219,755 MEADOWS ROAD,BOCA RATON,Palm Beach,28,6,0,0,95,26,2,0
PARK MEADOWS HEALTH AND REHABILITATION CENTER,105193,3250 SW 41ST PLACE,GAINESVILLE,Alachua,0,0,26,0,123,6,0,0
ST JOHNS NURSING CENTER,105371,3075 NW 35TH AVE,LAUDERDALE LAKES,Broward,14,14,11,3,155,25,47,0
CROSS POINTE CARE CENTER,105296,440 PHIPPEN WAITERS ROAD,DANIA BEACH,Broward,0,0,1,0,85,10,0,0
LAKESIDE HEALTH CENTER,105268,2501 N AUSTRALIAN AVENUE,WEST PALM BEACH,Palm Beach,37,0,15,11,73,26,0,0
SPRINGWOOD CENTER,105407,4602 NORTHGATE COURT,SARASOTA,Sarasota,14,0,10,1,87,18,1,0
WESTWOOD NURSING AND REHABILITATION CENTER,105395,1001 MAR-WALT DRIVE,FORT WALTON BEACH,Okaloosa,38,11,17,6,40,14,10,0
WAVE CREST HEALTH AND REHABILITATION CENTER,105207,1415 S HICKORY ST,MELBOURNE,Brevard,16,4,14,2,81,22,1,0
WHISPERING OAKS,105299,1514 E CHELSEA ST,TAMPA,Hillsborough,75,26,8,8,210,62,9,0
SHORE ACRES CARE CENTER,105050,4500 INDIANAPOLIS ST NE,SAINT PETERSBURG,Pinellas,15,1,26,2,79,22,27,0
BROOKSVILLE HEALTHCARE CENTER,105297,1114 CHATMAN BLVD,BROOKSVILLE,Hernando,8,24,41,10,113,14,0,0
CLEWISTON NURSING & REHABILITATION,105462,301 SOUTH GLORIA ST,CLEWISTON,Hendry,4,1,16,13,104,8,5,0
LIFE CARE CENTER OF MELBOURNE,105291,606 E SHERIDAN RD,MELBOURNE,Brevard,42,0,9,9,64,40,2,0
EMERALD SHORES HEALTH AND REHABILITATION,105148,626 N TYNDALL PKWY,CALLAWAY,Bay,4,0,6,0,72,8,0,0
OAKS OF KISSIMMEE HEALTH AND REHABILITATION CENTER,105379,320 N MITCHELL ST,KISSIMMEE,Osceola,2,1,6,0,53,3,2,0
ISLAND HEALTH AND REHABILITATION CENTER,105325,125 ALMA BLVD,MERRITT ISLAND,Brevard,31,8,12,0,91,35,0,0
HAINES CITY REHABILITATION AND NURSING CENTER,105442,409 S 10TH ST,HAINES CITY,Polk,71,19,10,6,89,36,5,0
FORT PIERCE HEALTH CARE,105257,611 S 13TH ST,FORT PIERCE,St. Lucie,12,4,24,15,111,42,9,0
"ST CATHERINE LABOURE MANOR, INC",105358,1750 STOCKTON ST,JACKSONVILLE,Duval,61,6,32,7,137,37,2,0
JACKSON MEMORIAL LONG TERM CARE CENTER,105392,2500 NW 22ND AVE,MIAMI,Miami-Dade,33,30,13,5,161,58,5,0
ENGLEWOOD HEALTHCARE AND REHAB,105452,1111 DRURY LN,ENGLEWOOD,Sarasota,4,0,12,0,117,1,0,0
BAY BREEZE SENIOR LIVING AND REHABILITATION CENTER,105487,3387 GULF BREEZE PARKWAY,GULF BREEZE,Santa Rosa,18,1,4,3,104,28,3,0
ANCHOR CARE AND REHABILITATION CENTER,105464,1515 PORT MALABAR BLVD NE,PALM BAY,Brevard,7,0,16,9,74,20,0,0
UNIVERSITY EAST REHABILITATION CENTER,105262,991 E NEW YORK AVE,DELAND,Volusia,,,,,,,,
BAYSIDE HEALTH AND REHABILITATION CENTER,105267,4343 LANGLEY AVENUE,PENSACOLA,Escambia,50,12,15,15,104,13,0,0
HABANA HEALTH CARE CENTER,105417,2916 HABANA WAY,TAMPA,Hillsborough,53,0,14,14,112,22,3,0
MANORCARE NURSING AND REHABILITATION CENTER,105421,3601 LAKEWOOD BLVD,NAPLES,Collier,21,63,4,3,65,17,3,0
LAKESIDE PAVILION,105439,2900 12TH STREET N,NAPLES,Collier,2,0,10,0,88,7,2,0
COURTYARDS OF ORLANDO CARE CENTER,105431,1900 MERCY DRIVE,ORLANDO,Orange,9,2,5,0,91,15,4,0
BRANDYWYNE HEALTH CARE CENTER,105428,1801 N LAKE MARIAM DR,WINTER HAVEN,Polk,35,0,18,6,110,50,4,0
WINTER HAVEN HEALTH AND REHABILITATION CENTER,105176,202 AVE O NE,WINTER HAVEN,Polk,67,61,25,20,103,66,20,2
WILLISTON CARE CENTER,105467,300 NW 1ST AVE,WILLISTON,Levy,3,0,13,1,102,10,5,0
NORTH BEACH REHABILITATION CENTER,105217,2201 NE 170TH STREET,NORTH MIAMI BEACH,Miami-Dade,22,1,24,7,82,32,3,0
FT LAUDERDALE HEALTH & REHABILITATION CENTER,105298,2000 EAST COMMERCIAL BLVD,FORT LAUDERDALE,Broward,36,38,19,5,134,48,3,0
CANTERBURY TOWERS INC,105326,3501 BAYSHORE BLVD,TAMPA,Hillsborough,0,1,1,0,31,0,7,0
CONSULATE HEALTH CARE OF VERO BEACH,105474,1310 37TH ST,VERO BEACH,Indian River,55,29,11,7,102,16,30,0
SUNRISE HEALTH & REHABILITATION CENTER,105441,4800 N NOB HILL RD,SUNRISE,Broward,28,13,14,1,143,28,0,0
AYERS HEALTH AND REHABILITATION CENTER,105401,606 NE 7TH ST,TRENTON,Gilchrist,56,34,21,9,76,32,118,0
PARKSIDE HEALTH AND REHABILITATION CENTER,105145,451 S AMELIA AVE,DELAND,Volusia,5,24,1,0,107,16,3,0
RIVERWOOD HEALTH & REHABILITATION CENTER,105488,808 S COLLEY RD,STARKE,Bradford,16,18,12,0,106,18,2,0
WILLOWBROOKE COURT AT AZALEA TRACE,105444,10100 HILLVIEW DR,PENSACOLA,Escambia,23,1,10,6,40,39,0,0
"TERRACE OF JACKSONVILLE, THE",105423,10680 OLD ST AUGUSTINE RD,JACKSONVILLE,Duval,67,4,29,7,148,45,2,0
EGRET COVE CENTER,105293,550 62ND ST S,SAINT PETERSBURG,Pinellas,16,7,4,1,94,15,7,0
OAKHURST CENTER,105465,1501 SE 24TH RD,OCALA,Marion,34,5,16,0,110,12,2,0
OCALA HEALTH AND REHABILITATION CENTER,105321,1201 SE 24TH RD,OCALA,Marion,12,9,44,0,151,4,2,0
KRYSTAL BAY NURSING AND REHABILITATION,105120,16650 W DIXIE HWY,NORTH MIAMI BEACH,Miami-Dade,4,0,10,6,91,10,0,0
TITUSVILLE REHABILITATION & NURSING CENTER,105448,1705 JESS PARRISH CT,TITUSVILLE,Brevard,34,1,14,7,116,127,0,0
SEASIDE HEALTH AND REHABILITATION CENTER,105052,324 WILDER BLVD,DAYTONA BEACH,Volusia,1,1,7,0,135,13,10,0
ADVENTHEALTH CARE CENTER APOPKA SOUTH,105353,3355 E SEMORAN BLVD,APOPKA,Seminole,25,10,18,5,171,38,11,0
AVALON HEALTHCARE CENTER,105346,1270 SW MAIN BLVD,LAKE CITY,Columbia,56,0,33,5,62,24,4,0
MANORCARE HEALTH SERVICES,105481,375 NW 51ST STREET,BOCA RATON,Palm Beach,24,17,19,7,143,28,3,1
PARKS HEALTHCARE AND REHABILITATION CENTER,105471,9311 S ORANGE BLOSSOM TRL,ORLANDO,Orange,2,0,1,1,98,25,0,0
HAMLIN PLACE OF BOYNTON BEACH,105485,2180 HYPOLUXO ROAD,LANTANA,Palm Beach,8,0,60,37,80,24,0,0
HEALTH AND REHABILITATION CENTRE AT DOLPHINS VIEW,105012,1820 SHORE DR S,SOUTH PASADENA,Pinellas,12,3,11,7,43,21,4,0
TAMARAC REHABILITATION AND HEALTH CENTER,105360,7901 NW 88TH AVENUE,TAMARAC,Broward,48,5,12,8,60,36,5,1
BRADEN RIVER REHABILITATION CENTER LLC,105045,2010 MANATEE AVE E,BRADENTON,Manatee,8,0,13,0,109,14,0,0
PINES OF SARASOTA,105147,1501 N ORANGE AVE,SARASOTA,Sarasota,34,34,5,0,139,18,13,0
CONCORDIA VILLAGE OF TAMPA,105351,4100 E FLETCHER AVE,TAMPA,Hillsborough,63,2,35,10,99,56,7,0
DAYTONA BEACH HEALTH AND REHABILITATION CENTER,105311,1055 3RD STREET,DAYTONA BEACH,Volusia,14,20,24,5,122,10,10,0
GATEWAY CARE CENTER,105486,8600 US HWY 19 N,PINELLAS PARK,Pinellas,31,0,8,2,96,43,2,0
CONSULATE HEALTH CARE OF LAKELAND,105482,5245 N SOCRUM LOOP RD,LAKELAND,Polk,2,4,12,4,108,4,12,0
RIDGECREST NURSING AND REHABILITATION CENTER,106061,1200 NORTH STONE STREET,DELAND,Volusia,92,40,66,12,134,62,30,0
"CROSSROADS, THE",105777,206 W ORANGE ST,DAVENPORT,Polk,27,0,8,3,38,14,2,0
BRYNWOOD HEALTH AND REHABILITATION CENTER,106045,1656 SOUTH JEFFERSON STREET,MONTICELLO,Jefferson,3,0,0,0,80,3,0,0
"MANOR AT CARPENTERS, THE",105660,1001 CARPENTERS WAY,LAKELAND,Polk,0,2,14,0,52,6,4,0
BON SECOURS MARIA MANOR NURSING CARE CENTER,105688,10300 4TH ST N,SAINT PETERSBURG,Pinellas,76,45,63,23,188,65,26,0
SOLARIS HEALTHCARE PALATKA,105652,110 KAY LARKIN DR,PALATKA,Putnam,9,6,12,0,156,35,3,0
FRANCO NURSING & REHABILITATION CENTER,105903,800 NW 95TH STREET,MIAMI,Miami-Dade,34,8,15,10,99,30,0,0
PALM GARDEN OF WEST PALM BEACH,105607,300 EXECUTIVE CENTER DRIVE,WEST PALM BEACH,Palm Beach,69,9,49,57,110,101,43,0
EMORY L BENNETT MEMORIAL VETERANS NURSING HOME,105840,1920 MASON AVENUE,DAYTONA BEACH,Volusia,11,0,11,0,95,15,3,0
MAGNOLIA HEALTH AND REHABILITATION CENTER,106032,1507 S TUTTLE AVE,SARASOTA,Sarasota,13,1,14,4,116,18,4,0
NORTH PORT REHABILITATION AND NURSING CENTER,105523,6940 OUTREACH WAY,NORTH PORT,Sarasota,0,0,10,0,68,11,3,0
SOLARIS HEALTHCARE CHARLOTTE HARBOR,105859,4000 KINGS HWY,PORT CHARLOTTE,Charlotte,19,33,31,19,142,21,66,0
DESTIN HEALTHCARE AND REHABILITATION CENTER,105862,195 MATTIE M KELLY BLVD,DESTIN,Okaloosa,52,0,9,2,112,21,0,0
MARSHALL HEALTH AND REHABILITATION CENTER,105631,207 MARSHALL DR,PERRY,Taylor,8,5,47,2,107,12,4,0
CORAL REEF NURSING & REHABILITATION CENTER,105910,9869 SW 152ND STREET,MIAMI,Miami-Dade,69,56,28,23,144,67,16,0
HEARTLAND HEALTH CARE CENTER JACKSONVILLE,105684,8495 NORMANDY BLVD,JACKSONVILLE,Duval,23,31,17,7,71,34,21,0
CONSULATE HEALTH CARE OF SAFETY HARBOR,105549,1410 DR MARTIN LUTHER KING JR ST N,SAFETY HARBOR,Pinellas,26,19,20,5,101,27,1,0
PALM CITY NURSING & REHAB CENTER,105831,2505 SW MARTIN HWY,PALM CITY,Martin,32,3,11,4,81,30,3,0
MELBOURNE TERRACE REHABILITATION CENTER,105635,251 FLORIDA AVE,MELBOURNE,Brevard,35,0,15,14,145,63,0,0
GOOD SAMARITAN SOCIETY-KISSIMMEE VILLAGE,105559,1500 SOUTHGATE DRIVE,KISSIMMEE,Osceola,11,31,17,5,116,12,10,0
STRATFORD COURT OF PALM HARBOR,105758,45 KATHERINE BLVD,PALM HARBOR,Pinellas,9,4,24,9,32,11,10,0
ROSEWOOD HEALTHCARE AND REHABILITATION CENTER,105747,3107 NORTH H STREET,PENSACOLA,Escambia,34,5,15,7,126,39,5,0
