ROSELANE HEALTH AND REHABILITATION CENTER,115660,613 ROSELANE STREET,MARIETTA,Cobb,91,2,22,7,112,27,0,0
KENTWOOD NURSING FACILITY,115147,1227 WEST WHEELER PARKWAY,AUGUSTA,Richmond,0,0,1,0,63,2,0,0
DAWSON HEALTH AND REHABILITATION,115483,1159 GEORGIA  AVE. S.E.,DAWSON,Terrell,0,0,1,1,44,2,0,0
"CENTER FOR ADVANCED REHAB AT PARKSIDE, THE",115040,110 PARK CITY ROAD,ROSSVILLE,Catoosa,0,1,47,0,118,2,1,0
PRUITTHEALTH - FORSYTH,115418,521 CABINESS ROAD,FORSYTH,Monroe,3,0,18,12,46,10,0,0
FOUR COUNTY HEALTH AND REHABILITATION,115481,124 OVERBY DRIVE,RICHLAND,Stewart,45,31,7,6,66,34,18,0
EAGLE HEALTH & REHABILITATION,115618,405 S COLLEGE ST,STATESBORO,Bulloch,0,0,1,0,50,4,0,0
HEARDMONT HEALTH AND REHABILITATION,115685,1043 LONGSTREET ROAD,ELBERTON,Elbert,0,4,1,0,47,1,3,0
GLENWOOD HEALTH AND REHABILITATION CENTER,115025,4115 GLENWOOD RD,DECATUR,DeKalb,96,0,27,5,187,35,0,0
PRUITTHEALTH - GREENVILLE,115658,99 HILLHAVEN RD.,GREENVILLE,Meriwether,0,0,44,0,92,6,4,0
CONDOR HEALTH LAFAYETTE,115360,110 BRANDYWINE BOULEVARD,FAYETTEVILLE,Fayette,34,29,9,8,122,17,3,0
SIGNATURE HEALTHCARE OF MARIETTA,115206,811 KENNESAW AVENUE,MARIETTA,Cobb,63,0,13,13,121,25,0,0
"WESTBURY MCDONOUGH, LLC",115463,198 HAMPTON STREET,MCDONOUGH,Henry,0,3,16,0,123,7,2,0
ARROWHEAD HEALTH AND REHAB,115539,239 ARROWHEAD BOULEVARD,JONESBORO,Clayton,24,17,7,6,90,6,17,0
AZALEA HEALTH AND REHABILITATION CENTER,115044,1600 ANTHONY ROAD,AUGUSTA,Richmond,1,0,18,0,77,1,0,0
HERITAGE INN HEALTH AND REHABILITATION,115597,307 JONES MILL ROAD,STATESBORO,Bulloch,12,11,5,4,59,9,11,0
AUTUMN BREEZE HEALTH AND REHAB,115580,1480 SANDTOWN ROAD SW,MARIETTA,Cobb,63,93,15,4,69,14,33,0
TAYLOR COUNTY HEALTH AND REHABILITATION,115507,165 SOUTH BROAD STREET,BUTLER,Taylor,0,0,3,0,65,1,0,0
TOWNSEND PARK HEALTH AND REHABILITATION,115461,196 NORTH DIXIE AVENUE,CARTERSVILLE,Bartow,55,2,24,12,88,19,13,0
RIVERVIEW HEALTH & REHAB CTR,115641,6711 LAROCHE AVENUE,SAVANNAH,Chatham,5,0,0,0,142,1,0,0
DELMAR GARDENS OF GWINNETT,115350,3100 CLUB DRIVE,LAWRENCEVILLE,Gwinnett,12,6,9,8,50,1,1,0
SPARTA HEALTH AND REHABILITATION,115382,11744 HIGHWAY 22 E,SPARTA,Hancock,35,32,15,14,42,8,1,0
PLEASANT VIEW NURSING CENTER,115411,475 WASHINGTON STREET,METTER,Candler,0,9,0,0,113,5,2,0
BRIAN CENTER HEALTH & REHABILITATION/CANTON,115508,150 HOSPITAL CIRCLE N.W.,CANTON,Cherokee,2,1,6,0,87,1,0,0
NEW HORIZONS LIMESTONE,115487,2020 BEVERLY ROAD NE,GAINESVILLE,Hall,62,50,9,7,95,34,15,0
EAST LAKE ARBOR,115482,304 FIFTH  AVENUE,DECATUR,DeKalb,0,0,3,2,82,0,0,0
TIFTON HEALTH AND REHABILITATION CENTER,115412,1451 NEWTON DRIVE,TIFTON,Tift,28,0,21,9,91,3,0,0
ROSS MEMORIAL HEALTH CARE CTR,115515,1780 OLD HIGHWAY 41,KENNESAW,Cobb,0,0,12,6,74,4,1,0
PRUITTHEALTH - AUGUSTA HILLS,115672,2122 CUMMING ROAD,AUGUSTA,Richmond,2,1,7,0,74,4,0,0
LIFE CARE CTR OF LAWRENCEVILLE,115659,210 COLLINS INDUSTRIAL WAY,LAWRENCEVILLE,Gwinnett,27,10,11,9,54,20,5,0
PRUITTHEALTH - MONROE,115379,4796 HIGHWAY 42 NORTH,FORSYTH,Monroe,1,2,11,0,72,1,6,0
"OAKS - ATHENS SKILLED NURSING, THE",115419,490 KATHWOOD DR,ATHENS,Clarke,0,0,26,0,119,3,1,0
TWIN VIEW HEALTH AND REHAB,115540,211 MATHIS AVENUE,TWIN CITY,Emanuel,0,0,4,0,92,1,0,0
HARBORVIEW HEALTH SYSTEMS JESUP,115414,1090 W ORANGE ST,JESUP,Wayne,2,0,0,0,88,37,0,0
TWIN OAKS CONVALESCENT CENTER,115513,301 S0UTH BAKER STREET,ALMA,Bacon,2,20,20,0,70,9,63,0
PRUITTHEALTH - ATHENS HERITAGE,115509,960 HAWTHORNE AVENUE,ATHENS,Clarke,1,9,17,0,88,2,0,0
PRUITTHEALTH - SHEPHERD HILLS,115452,800 PATTERSON RD,LA FAYETTE,Walker,1,0,2,0,101,0,0,0
LENBROOK,115296,"3747 PEACHTREE ROAD, NE",ATLANTA,DeKalb,3,6,6,2,42,2,5,0
KEYSVILLE NURSING HOME & REHAB,115644,1005 GA HIGHWAY 88,BLYTHE,Burke,1,0,0,0,58,1,2,0
HARBORVIEW SATILLA,115265,1600 RIVERSIDE AVE,WAYCROSS,Ware,7,8,6,1,156,9,22,0
SGMC LAKELAND VILLA,115707,138 WEST THIGPEN AVE,LAKELAND,Lanier,3,0,9,4,59,3,0,0
WINDER HEALTH CARE & REHAB CTR,115536,263 E MAY STREET,WINDER,Barrow,78,140,23,16,98,1,0,0
MITCHELL COUNTY NURSING HOMES,115266,37 SOUTH ELLIS STREET,CAMILLA,Mitchell,0,6,3,0,84,1,7,0
DELMAR GARDENS OF SMYRNA,115330,404 KING SPRINGS VILLAGE PKWY,SMYRNA,Cobb,25,15,25,3,79,9,1,0
RIVERSIDE HEALTH CARE CENTER,115375,5100 WEST ST NW,COVINGTON,Newton,,,,,,,,
FRIENDSHIP HEALTH AND REHAB,115559,161 FRIENDSHIP ROAD,CLEVELAND,White,0,24,6,0,67,5,29,0
"D SCOTT HUDGENS CENTER FOR SKILLED NURSING, THE",115690,3500 ANNANDALE LANE,SUWANEE,Gwinnett,0,0,2,0,31,0,0,0
MAGNOLIA MANOR OF MARION COUNTY,115599,349 GENEVA ROAD,BUENA VISTA,Marion,19,19,4,2,51,22,10,0
PROVIDENCE HEALTHCARE,115484,1011 SOUTH GREEN STREET,THOMASTON,Upson,13,40,6,4,76,32,0,0
EARLY MEMORIAL NURSING FACILITY,115271,11740 COLUMBIA STREET,BLAKELY,Early,1,1,14,5,79,1,0,0
SOUTHLAND HEALTH AND REHABILITATION,115460,151 WISDOM ROAD,PEACHTREE CITY,Fayette,16,8,7,3,103,8,3,0
NHC HEALTHCARE ROSSVILLE,115104,1425 MCFARLAND AVE,ROSSVILLE,Walker,60,8,33,10,70,34,4,0
RENAISSANCE CENTER FOR NURSING AND HEALING,115537,415 AIRPORT ROAD,GRIFFIN,Spalding,0,0,0,0,126,15,0,0
PRUITTHEALTH - TOOMSBORO,115455,210 MAIN STREET,TOOMSBORO,Wilkinson,16,1,2,1,50,15,0,0
BUDD TERRACE AT WESLEY WOODS,115682,"1833 CLIFTON ROAD, NE",ATLANTA,DeKalb,1,0,5,6,166,2,0,0
GREENE POINT HEALTH AND REHABILITATION,115488,1321 WASHINGTON HIGHWAY,UNION POINT,Greene,0,0,1,0,40,0,1,0
MADISON HEALTH AND REHAB,115457,2036 SOUTH MAIN STREET,MADISON,Morgan,21,0,1,1,57,3,3,0
EFFINGHAM CARE & REHABILITATION CENTER,115106,459 HIGHWAY 119 SOUTH,SPRINGFIELD,Effingham,2,1,0,0,94,6,8,0
PRUITTHEALTH - COVINGTON,115588,4148 CARROLL STREET,COVINGTON,Newton,0,0,1,0,65,2,0,0
BRYAN COUNTY HLTH & REHAB CTR,115621,127 CARTER ST,RICHMOND HILL,Bryan,13,1,6,1,72,2,0,0
SIGNATURE HEALTHCARE AT TOWER ROAD,115115,26 TOWER RD,MARIETTA,Cobb,16,6,15,15,104,9,4,0
ZEBULON PARK HEALTH AND REHABILITATION,115295,343 PLANTATION WAY,MACON,Bibb,1,3,15,2,61,4,9,0
ARCHWAY TRANSITIONAL CARE CENTER,115728,4373 HOUSTON AVENUE,MACON,Bibb,1,13,1,0,87,3,6,0
TWIN FOUNTAINS HOME,115709,1400 HOGANSVILLE ROAD,LAGRANGE,Troup,6,0,2,2,86,10,5,0
RELIABLE HEALTH & REHAB AT LAKEWOOD,115717,"1980 ARROW STREET, SW",ATLANTA,Fulton,41,18,8,5,73,23,9,0
MARSH'S EDGE,115718,111 RENEGAR WAY,SAINT SIMONS ISLAND,Glynn,0,0,0,0,7,0,0,0
EVERGREEN HEALTH AND REHABILITATION CENTER,115720,"139 MORAN LAKE ROAD, NE",ROME,Floyd,1,0,0,0,84,2,4,0
PRUITTHEALTH - ROME,115719,2 THREE MILE ROAD NE,ROME,Floyd,0,0,0,0,96,4,0,0
SENIOR CARE CENTER - BRUNSWICK,115721,2611 WILDWOOD DRIVE,BRUNSWICK,Glynn,7,0,10,0,174,17,3,0
ANSLEY PARK HEALTH AND REHABILITATION,115722,450 NEWNAN LAKES BLVD,NEWNAN,Coweta,0,0,0,0,40,0,1,0
HILL HAVEN NURSING HOME,115710,880 RIDGEWAY ROAD,COMMERCE,Jackson,0,2,3,0,61,2,0,0
MEMORIAL MANOR NURSING HOME,115711,1500 EAST SHOTWELL STREET,BAINBRIDGE,Decatur,,,,,,,,
ROCKMART HEALTH,115729,528 HUNTER STREET,ROCKMART,Polk,1,0,2,0,38,1,0,0
OCEANSIDE HEALTH AND REHAB,115730,7 ROSEWOOD AVENUE,TYBEE ISLAND,Chatham,0,1,0,0,69,3,1,0
SEMINOLE MANOR NURSING HOME,115712,100 FLORENCE STREET,DONALSONVILLE,Seminole,0,0,20,0,59,0,0,0
PALEMON GASKINS MEM NSG HOME,115713,710 NORTH IRWIN AVENUE,OCILLA,Irwin,1,0,1,0,25,4,0,0
BOSTICK NURSING CENTER,115732,1700 BOSTICK CIRCLE,MILLEDGEVILLE,Baldwin,1,0,1,1,198,2,0,0
NORTHRIDGE HEALTH AND REHABILITATION,115714,100 MEDICAL CENTER DRIVE,COMMERCE,Jackson,52,123,33,8,105,5,18,0
GLEN EAGLE HEALTHCARE AND REHAB,115733,206 MAIN STREET EAST,ABBEVILLE,Wilcox,0,0,2,0,66,2,0,0
CAMBRIDGE POST ACUTE CARE CENTER,115771,2020 MCGEE ROAD,SNELLVILLE,Gwinnett,44,0,8,6,112,10,2,0
OAKS HEALTH CTR AT THE MARSHES OF SKIDAWAY ISLAND,115715,95 SKIDAWAY ISLAND PARK ROAD,SAVANNAH,Chatham,0,0,2,0,18,2,22,0
GEORGIA REGIONAL ATLANTA LTC,11A186,"3073 PANTHERSVILLE RD, SNF BLDG. #17",DECATUR,DeKalb,0,0,0,0,21,2,0,0
SPRING HARBOR AT GREEN ISLAND,115716,200 SPRING HARBOR DRIVE,COLUMBUS,Muscogee,0,5,8,0,18,4,13,0
GRACEWOOD NSG FACILITY(UNIT 9),11A200,"100 MYRTLE BLVD., EAST CENTRAL REG HOSP",GRACEWOOD,Richmond,0,0,0,0,22,0,2,0
SALUDE - THE ART OF RECOVERY,115723,601 NORTHOLT PARKWAY,SUWANEE,Gwinnett,0,4,4,0,60,4,11,0
CHELSEY PARK HEALTH AND REHABILITATION,115724,200 MOUNTAIN PARK DRIVE,DAHLONEGA,Lumpkin,1,2,0,0,49,7,8,0
HARRINGTON PARK HEALTH AND REHABILITATION,115725,511 PLEASANT HOME ROAD,AUGUSTA,Richmond,1,21,7,0,46,2,9,0
MEADOWS PARK HEALTH AND REHABILITATION,115726,119 MEADOWS PARKWAY WEST,VIDALIA,Toombs,1,45,0,0,64,3,5,0
ADVANCED HEALTH AND REHAB OF TWIGGS COUNTY,115727,113 SPRING VALLEY ROAD,JEFFERSONVILLE,Twiggs,0,0,0,0,98,1,0,0
