Provider Name,Federal Provider Number,Provider Address,Provider City,County,Residents Total Confirmed COVID-19,Residents Total Suspected COVID-19,Residents Total All Deaths,Residents Total COVID-19 Deaths,Total Number of Occupied Beds,Staff Total Confirmed COVID-19,Staff Total Suspected COVID-19,Staff Total COVID-19 Deaths
DADE HEALTH AND REHAB,115558,1234 HIGHWAY 301 SOUTH,TRENTON,Dade,0,2,0,0,51,0,8,0
HART CARE CENTER,115449,261 FAIRVIEW AVENUE,HARTWELL,Hart,0,0,0,0,88,4,8,0
PRUITTHEALTH - SEASIDE,115547,1000 DORSET ROAD,PORT WENTWORTH,Chatham,1,0,0,0,74,1,0,0
BOLINGREEN HEALTH AND REHABILITATION,115346,529 BOLINGREEN DRIVE,MACON,Monroe,40,139,7,2,88,30,1,0
CUMMING NURSING CENTER,115551,2775 CASTLEBERRY ROAD,CUMMING,Forsyth,16,34,14,1,51,7,2,0
NORTHSIDE GWINNETT EXTENDED CARE CENTER,115645,650 PROFESSIONAL DRIVE,LAWRENCEVILLE,Gwinnett,0,0,3,0,40,4,0,0
QUIET OAKS HEALTH CARE CENTER,115396,125 QUIET OAKS DRIVE,CRAWFORD,Oglethorpe,40,0,5,5,46,7,0,0
CHATSWORTH HEALTH CARE CENTER,115280,102 HOSPITAL DRIVE,CHATSWORTH,Murray,0,0,6,0,105,0,0,0
PRUITTHEALTH - DECATUR,115647,3200 PANTHERSVILLE ROAD,DECATUR,DeKalb,94,27,9,6,123,23,3,0
WESTWOOD HEALTHCARE AND REHABILITATION,115601,101 STOCKYARD ROAD,STATESBORO,Bulloch,4,23,8,0,35,2,1,1
RIDGEWOOD MANOR HEALTH AND REHABILITATION,115341,1110 BURLEYSON DRIVE,DALTON,Whitfield,42,48,5,5,80,15,24,0
BAINBRIDGE HEALTH AND REHAB,115324,1155  WEST COLLEGE STREET,BAINBRIDGE,Decatur,2,0,10,0,82,2,0,0
ROSE CITY HEALTH AND REHABILITATION CENTER,115501,930 SOUTH BROAD ST.,THOMASVILLE,Thomas,3,0,13,0,63,3,0,0
THUNDERBOLT TRANSITIONAL CARE AND REHABILITATION,115624,3223 FALLIGANT AVENUE,THUNDERBOLT,Chatham,0,0,0,0,115,9,3,0
CAMELLIA GARDENS OF LIFE CARE,115570,804 SOUTH BROAD STREET BOX 1959,THOMASVILLE,Thomas,33,55,6,6,52,10,32,0
CARROLLTON NURSING & REHAB CTR,115368,2327 NORTH HIGHWAY 27,CARROLLTON,Carroll,3,0,4,5,112,3,4,0
MAGNOLIA MANOR OF ST SIMONS REHAB & NURSING CENTER,115582,2255 FREDERICA ROAD,SAINT SIMONS ISLAND,Glynn,0,0,0,0,94,5,0,0
CHRISTIAN CITY REHABILITATION CENTER,115573,7300 LESTER ROAD,UNION CITY,Fulton,104,46,41,32,161,37,60,0
VISTA PARK HEALTH AND REHABILITATION,115611,1310 WEST  GORDON STREET,DOUGLAS,Coffee,9,5,7,2,100,23,1,0
GLENWOOD HEALTHCARE,115703,PO BOX 869,GLENWOOD,Wheeler,7,1,0,0,44,12,2,0
PRUITTHEALTH - LAFAYETTE,115304,205 ROADRUNNER BOULEVARD,LAFAYETTE,Walker,0,0,5,0,87,0,0,0
WESTMINSTER COMMONS,115674,"560 ST CHARLES AVE, NE",ATLANTA,Fulton,0,0,1,0,69,7,0,0
DUNWOODY HEALTH AND REHABILITATION CENTER,115270,"5470 MERIDIAN MARK ROAD, BLDG E",ATLANTA,Fulton,58,0,22,0,165,27,0,0
CORDELE HEALTH AND REHABILITATION,115429,1106 NORTH 4TH STREET,CORDELE,Crisp,,,,,,,,
CEDAR SPRINGS HEALTH AND REHAB,115381,148 CASON ROAD,CEDARTOWN,Polk,0,5,1,0,59,2,10,0
HERITAGE INN OF SANDERSVILLE HEALTH AND REHAB,115369,652 FERNCREST DRIVE,SANDERSVILLE,Washington,0,0,0,0,57,0,22,0
PEBBLEBROOK HEALTH CENTER AT PARK SPRINGS,115694,5610 NEW BERMUDA ROAD,STONE MOUNTAIN,Gwinnett,3,0,8,0,32,0,0,0
GRANDVIEW HEALTH CARE CENTER,115502,618 GENNETT DRIVE,JASPER,Pickens,0,2,0,0,57,0,1,0
"PRUITTHEALTH - HOLLY HILL, LLC",115562,413 PENDLETON PLACE,VALDOSTA,Lowndes,0,7,18,0,72,8,0,0
DOUGLASVILLE NURSING AND REHABILITATION CENTER,115273,4028 HWY 5,DOUGLASVILLE,Douglas,33,5,19,5,190,4,2,0
UNION COUNTY NURSING HOME,115695,164 NURSING HOME CIRCLE,BLAIRSVILLE,Union,3,1,27,0,133,4,6,0
A.G. RHODES HOME WESLEY WOODS,115002,"1819 CLIFTON ROAD, N.E.",ATLANTA,DeKalb,30,52,11,3,107,20,23,0
ABERCORN REHABILITATION CENTER,115132,11800 ABERCORN STREET,SAVANNAH,Chatham,4,1,0,0,72,11,3,0
PINEWOOD MANOR NURSING HOME & REHABILITATION CNTR,115586,277 COMMERCE STREET,HAWKINSVILLE,Pulaski,0,0,3,0,84,1,0,0
LILLIAN G CARTER HEALTH AND REHABILITATION,115550,225 HOSPITAL STREET,PLAINS,Sumter,2,1,7,9,77,8,1,0
CALHOUN HEALTH CARE CENTER,115340,1387 HIGHWAY 41 NORTH,CALHOUN,Gordon,2,5,15,13,70,3,6,0
BROWN HEALTH AND REHABILITATION,115090,545 COOK STREET,ROYSTON,Franklin,0,1,6,0,83,6,3,0
FAIRBURN HEALTH CARE CENTER,115298,178 WEST CAMPBELLTON STREET,FAIRBURN,Fulton,13,2,13,1,83,15,0,0
PRUITTHEALTH - GRIFFIN,115529,619 NORTHSIDE DRIVE,GRIFFIN,Spalding,0,0,0,0,57,2,0,0
PRUITTHEALTH - MARIETTA,115276,70 SAINE DRIVE SW,MARIETTA,Cobb,116,13,4,3,87,10,7,0
NURSE CARE OF BUCKHEAD,115129,2920 PHARR COURT SOUTH NW,ATLANTA,Fulton,63,20,16,3,181,16,10,0
RIVERSIDE HEALTH AND REHABILITATION,115353,101 OLD TALBOTTON  RD,THOMASTON,Upson,20,0,10,0,65,7,0,0
AVALON HEALTH AND REHABILITATION,115528,120 SPRING STREET,NEWNAN,Coweta,12,0,0,0,65,6,1,0
QUINTON MEM HC & REHAB CENTER,115403,1115 PROFESSIONAL BLVD,DALTON,Whitfield,0,0,0,0,91,1,0,0
LAUREL PARK AT HENRY MED CTR,115673,1050 HOSPITAL DRIVE,STOCKBRIDGE,Henry,1,2,5,0,70,0,0,0
PRUITTHEALTH - SAVANNAH,115339,12825 WHITE BLUFF ROAD,SAVANNAH,Chatham,61,14,16,6,85,34,6,0
MONTEZUMA HEALTH CARE CENTER,115364,506 SUMTER ST,MONTEZUMA,Macon,0,30,0,0,55,2,0,0
MAGNOLIA MANOR OF COLUMBUS NURSING CENTER - EAST,115124,2010 WARM SPRINGS RD,COLUMBUS,Muscogee,45,21,8,7,102,24,3,0
SOUTHLAND HEALTHCARE AND REHAB CENTER,115376,606 SIMMONS ST,DUBLIN,Laurens,1,0,0,0,92,0,0,0
"OAKS - LIMESTONE, THE",115410,2560 FLINTRIDGE ROAD,GAINESVILLE,Hall,3,0,0,0,89,1,0,0
CHATUGE REGIONAL NURSING HOME,115701,386 BELAIRE DRIVE,HIAWASSEE,Towns,1,0,5,0,97,1,3,0
HARTWELL HEALTH AND REHABILITATION,115435,94 CADE STREET,HARTWELL,Hart,10,0,2,0,74,13,28,0
CAMELLIA HEALTH & REHABILITATION,115598,700 EAST LONG STREET,CLAXTON,Evans,0,0,0,0,50,0,0,0
PRUITTHEALTH - PALMYRA,115628,1904 PALMYRA ROAD,ALBANY,Dougherty,0,13,10,0,163,2,2,0
FIFTH AVENUE HEALTH CARE,115319,505 NORTH FIFTH  AVENUE,ROME,Floyd,4,19,1,0,75,7,0,0
SOCIAL CIRCLE NSG & REHAB CTR,115532,671 NORTH CHEROKEE ROAD,SOCIAL CIRCLE,Walton,1,0,0,0,59,0,1,0
THOMSON HEALTH AND REHABILITATION,115365,511 MT. PLEASANT ROAD,THOMSON,McDuffie,22,0,7,0,91,0,0,0
ETOWAH LANDING,115348,809 SOUTH BROAD STREET,ROME,Floyd,0,0,0,0,85,1,0,0
PROVIDENCE OF SPARTA HEALTH AND REHAB,115397,"60 PROVIDENCE STREET, PO BOX 86",SPARTA,Hancock,41,3,8,6,44,13,13,0
SANDY SPRINGS HEALTH AND REHABILITATION,115504,1500 S JOHNSON FERRY ROAD,ATLANTA,DeKalb,24,2,24,9,79,19,0,0
PRUITTHEALTH - SYLVESTER,115629,104 MONK STREET,SYLVESTER,Worth,12,15,27,12,85,13,1,0
CANTON NURSING CENTER,115606,321 HOSPITAL ROAD,CANTON,Cherokee,0,1,0,0,62,0,0,0
AZALEA TRACE NURSING CENTER,115478,910 TALBOTTON RD,COLUMBUS,Muscogee,9,0,3,0,68,10,1,0
"RETREAT, THE",115675,898 COLLEGE ST,MONTICELLO,Jasper,0,0,7,0,51,0,0,0
MAGNOLIA MANOR METHODIST NSG C,115004,2001 SOUTH LEE STREET,AMERICUS,Sumter,19,15,20,8,137,33,9,0
LIFE CARE CENTER,115654,176 LINCOLN AVE,FITZGERALD,Ben Hill,1,0,1,0,117,2,1,0
PRUITTHEALTH - BROOKHAVEN,115313,3535 ASHTON WOODS DRIVE NE,ATLANTA,DeKalb,2,0,1,0,137,4,0,0
SIGNATURE HEALTHCARE OF BUCKHEAD,115110,54 PEACHTREE PARK DRIVE N.E.,ATLANTA,Fulton,56,2,10,4,109,23,0,0
"BELL MINOR HOME, THE",115020,2200 OLD HAMILTON PLACE NE,GAINESVILLE,Hall,38,12,10,3,74,15,9,0
LYNN HAVEN HEALTH AND REHABILITATION,115474,747 MONTICELLO HIGHWAY,GRAY,Jones,0,3,1,0,62,3,5,0
TRADITIONS HEALTH AND REHABILITATION,115473,2816 EVANS MILL ROAD,LITHONIA,DeKalb,0,3,24,0,145,5,13,0
PINEWOOD NURSING CENTER,115607,433 NORTH MCGRIFF STREET,WHIGHAM,Grady,0,0,0,0,62,2,0,0
ANDERSON MILL HEALTH AND REHABILITATION CENTER,115145,2130 ANDERSON MILL RD,AUSTELL,Cobb,8,0,14,1,125,5,0,0
HEART OF GEORGIA NURSING HOME,115471,815 LEGION DRIVE,EASTMAN,Dodge,0,2,0,0,88,2,8,0
SUMMERHILL ELDERLIVING HOME & CARE,115430,500 STANLEY STREET,PERRY,Houston,0,0,5,0,134,5,3,0
FORT GAINES HEALTH AND REHAB,115696,"101 HARTFORD ROAD, WEST",FORT GAINES,Clay,0,3,0,0,53,5,8,0
"PRESBYTERIAN HOME, QUITMAN, IN",115498,1901 WEST SCREVEN STREET,QUITMAN,Brooks,5,5,3,0,180,13,28,0
OAKVIEW HEALTH AND REHABILITATION,115428,960  HIGHLAND AVENUE,SUMMERVILLE,Chattooga,0,4,1,0,125,0,4,0
COMFORT CREEK NURSING AND REHABILITATION CENTER,115679,10200 U.S. HWY 1 SOUTH,WADLEY,Jefferson,0,0,7,0,86,3,3,0
SAVANNAH BEACH HEALTH AND REHAB,115633,26 VAN HORNE STREET,TYBEE ISLAND,Chatham,5,1,2,0,35,2,0,0
GLENVUE HEALTH AND REHAB,115619,721 NORTH VETERANS BLVD,GLENNVILLE,Tattnall,1,7,3,0,115,0,35,0
CRESTVIEW HEALTH & REHAB CTR,115525,2800 SPRINGDALE ROAD,ATLANTA,Fulton,5,0,0,0,288,3,0,0
OXLEY PARK HEALTH AND REHABILITATION,115387,181 OXLEY DRIVE,LYONS,Toombs,0,2,1,0,81,1,5,0
SCOTT HEALTH & REHABILITATION,115671,12 SMITH LANE,ADRIAN,Johnson,0,0,3,0,50,1,0,0
BONTERRA TRANSITIONAL CARE & REHABILITATION,115555,2801 FELTON DRIVE,EAST POINT,Fulton,24,3,9,9,86,17,1,0
PRUITTHEALTH - MOULTRIE,115505,233 SUNSET CIRCLE,MOULTRIE,Colquitt,0,0,11,0,62,1,3,0
AZALEALAND NURSING HOME,115534,2040 COLONIAL DRIVE,SAVANNAH,Chatham,2,72,2,0,77,16,69,0
COBBLESTONE REHABILITATION AND HEALTHCARE CENTER,115667,101 COBBLESTONE TRACE SE,MOULTRIE,Colquitt,0,18,12,0,44,2,50,0
FULTON CENTER FOR REHABILITATION LLC,115569,2850 SPRINGDALE ROAD SW,ATLANTA,Fulton,38,13,8,8,97,13,11,0
PRUITTHEALTH - GRANDVIEW,115631,165 WINSTON DRIVE,ATHENS,Clarke,3,1,11,11,61,3,0,0
AMARA HEALTHCARE & REHAB,115150,2021 SCOTT ROAD,AUGUSTA,Richmond,0,0,0,0,91,0,0,0
NORTH DECATUR HEALTH AND REHABILITATION CENTER,115012,2787 NORTH DECATUR ROAD,DECATUR,DeKalb,2,0,8,0,64,5,0,0
CARLYLE PLACE,115680,5300 ZEBULON ROAD,MACON,Bibb,3,0,0,0,26,18,2,0
"OAK VIEW HOME, INC",115576,119 OAKVIEW STREET,WAVERLY HALL,Harris,66,23,7,6,85,12,3,0
PRUITTHEALTH - MACON,115288,2255 ANTHONY ROAD,MACON,Bibb,73,0,35,23,171,133,0,0
PRUITTHEALTH - FAIRBURN,115506,7560 BUTNER ROAD,FAIRBURN,Fulton,0,0,0,0,69,3,1,0
OCONEE HEALTH AND REHABILITATION,115357,107 RIDGEVIEW DR,OCONEE,Washington,0,0,0,0,40,0,2,0
ROME HEALTH AND REHABILITATION CENTER,115363,1345 REDMOND ROAD,ROME,Floyd,25,7,22,5,72,40,0,0
STEVENS PARK HEALTH AND REHABILITATION,115294,820 STEVENS CREEK ROAD,AUGUSTA,Richmond,0,0,0,0,30,5,4,0
GREEN ACRES HEALTH AND REHABILITATION,115578,"313 ALLEN MEMORIAL DRIVE,SW",MILLEDGEVILLE,Baldwin,0,0,3,0,74,1,0,0
NAVICENT HEALTH BALDWIN SKILLED NURSING UNIT,115649,821 NORTH COBB ST,MILLEDGEVILLE,Baldwin,0,0,0,0,7,0,0,0
CHURCH HOME REHABILITATION AND HEALTHCARE,115708,2470 HWY 41 N,FORT VALLEY,Houston,0,0,3,0,62,0,0,0
ALTAMAHA HEALTHCARE CENTER,115577,1311 WEST CHERRY STREET,JESUP,Wayne,0,2,29,0,60,0,1,0
FORT VALLEY HEALTH AND REHAB,115651,604 BLUEBIRD BOULEVARD,FORT VALLEY,Peach,0,0,1,0,57,1,0,0
TREUTLEN COUNTY HEALTH AND REHABILITATION,115358,"2249 COLLEGE STREET, NORTH",SOPERTON,Treutlen,1,11,20,0,42,2,11,0
THE PAVILION AT BRANDON WILDE,115524,4275 OWENS ROAD,EVANS,Columbia,0,0,0,0,55,1,0,0
WILLOWWOOD HEALTHCARE AND REHABILITATION,115327,4595 CANTRELL ROAD,FLOWERY BRANCH,Hall,0,0,0,0,86,4,0,0
WINTHROP HEALTH AND REHABILITATION,115395,12 CHATEAU DRIVE,ROME,Floyd,2,0,0,0,76,37,1,0
SAVANNAH SQUARE HEALTH CENTER,115546,1 SAVANNAH SQUARE DRIVE,SAVANNAH,Chatham,0,0,0,0,17,0,0,0
MIONA GERIATRIC & DEMENTIA CENTER,115338,201 POPLAR STREET,IDEAL,Macon,0,0,0,0,77,7,21,0
NANCY HART CENTER FOR NURSING AND HEALING LLC,115686,2117 DOCTOR WARD ROAD,ELBERTON,Elbert,0,2,14,0,41,3,10,0
PRUITTHEALTH - SWAINSBORO,115533,856 HIGHWAY 1 SOUTH,SWAINSBORO,Emanuel,0,0,8,0,70,0,1,0
MAGNOLIA MANOR OF MIDWAY,115553,652 NORTH COASTAL HIGHWAY 17,MIDWAY,Liberty,3,0,0,0,99,3,0,0
WASHINGTON CO EXTENDED CARE FACILITY,115702,610 SPARTA ROAD,SANDERSVILLE,Washington,6,4,1,0,54,10,7,0
PRUITTHEALTH - VIRGINIA PARK,115531,1000 BRIARCLIFF ROAD NE,ATLANTA,DeKalb,13,0,18,4,100,18,0,0
SMITH MEDICAL NURSING CARE CTR,115691,501 EAST MCCARTY ST,SANDERSVILLE,Washington,0,0,0,0,46,0,0,0
REHABILITATION CENTER OF SOUTH GEORGIA,115676,2002 TIFT AVENUE NORTH,TIFTON,Tift,60,9,7,2,123,40,3,0
CHERRY BLOSSOM HEALTH AND REHABILITATION,115652,3520 KENNETH DRIVE,MACON,Bibb,3,18,1,0,63,7,3,0
JESUP HEALTH AND REHAB,115503,3100 SAVANNAH HIGHWAY,JESUP,Wayne,0,12,0,0,49,0,1,0
CHAPLINWOOD NURSING HOME,115477,325 ALLEN MEMORIAL DRIVE SW,MILLEDGEVILLE,Baldwin,26,22,11,9,75,19,7,2
PRUITTHEALTH - AUGUSTA,115334,2541 MILLEDGEVILLE ROAD,AUGUSTA,Richmond,43,32,12,10,68,18,8,0
ROSWELL NURSING & REHAB CENTER,115422,1109 GREEN STREET,ROSWELL,Cobb,70,16,7,4,177,15,1,0
MILLER NURSING HOME,115039,206 GRACE ST,COLQUITT,Miller,1,23,7,0,132,4,38,0
WOOD DALE HEALTH AND REHABILITATION,115374,1102 BURLEYSON  ROAD,DALTON,Whitfield,0,0,0,0,74,8,4,0
RESORTS AT POOLER INC,115293,508 SOUTH ROGERS STREET,POOLER,Chatham,0,0,5,0,83,0,0,0
"A.G. RHODES HOME, INC - COBB",115521,900 WYLIE ROAD,MARIETTA,Cobb,13,5,11,6,102,8,0,0
AUTUMN LANE HEALTH AND REHABILITATION,115466,302 GEORGIA 18 EAST,GRAY,Jones,0,21,14,0,74,3,3,0
WRIGHTSVILLE MANOR HEALTH AND REHAB,115406,337 WEST COURT STREET,WRIGHTSVILLE,Johnson,2,1,7,0,78,8,12,0
GRACEMORE NURSING AND REHAB,115554,2708 LEE STREET,BRUNSWICK,Glynn,32,2,21,21,29,13,12,0
HABERSHAM HOME,115099,"HIGHWAY 441 NORTH, BOX 37",DEMOREST,Habersham,71,37,37,16,57,60,36,0
NHC HEALTHCARE FT OGLETHORPE,115492,2403 BATTLEFIELD PKWY,FORT OGLETHORPE,Catoosa,1,0,11,0,130,3,0,0
SOUTHWELL HEALTH AND REHABILITATION,115655,260 MJ TAYLOR ROAD,ADEL,Cook,1,0,16,0,94,2,0,0
CARTERSVILLE CENTER FOR NURSING AND HEALING,115571,78 OPAL STREET,CARTERSVILLE,Bartow,82,33,11,8,90,35,27,1
CALHOUN NURSING HOME,115264,265 TURNER STREET,EDISON,Calhoun,9,0,3,2,50,7,0,0
WINDERMERE HEALTH AND REHABILITATION CENTER,115291,3618 J DEWEY GRAY CIRCLE,AUGUSTA,Richmond,76,0,10,11,83,42,0,0
MOUNTAIN VIEW HEALTH CARE,115688,547 WARWOMAN ROAD,CLAYTON,Rabun,40,14,16,0,86,5,26,0
UNIVERSITY EXTENDED CARE/WESTW,115336,561 UNIVERSITY DRIVE,EVANS,Columbia,0,0,3,0,120,0,0,0
WELLSTAR PAULDING NURSING CTR,115258,600 WEST MEMORIAL DRIVE,DALLAS,Paulding,3,2,6,0,160,7,2,0
HARALSON NSG & REHAB CENTER,115431,315 FIELD STREET,BREMEN,Haralson,1,0,10,0,98,1,0,0
PRUITTHEALTH - SPRING VALLEY,115401,651 RHODES DRIVE,ELBERTON,Elbert,0,4,4,0,55,1,3,0
REGENCY PARK HEALTH AND REHABILITATION,115663,1212 BROADRICK DRIVE,DALTON,Whitfield,1,0,0,0,90,2,1,0
MAGNOLIA MANOR OF COLUMBUS NURSING CENTER - WEST,115045,2000 WARM SPRINGS RD,COLUMBUS,Muscogee,7,2,0,0,116,6,0,0
APPLING NURSING AND REHABILITATION PAVILION,115262,163 EAST TOLLISON STREET,BAXLEY,Appling,60,37,12,12,81,46,30,0
PRUITTHEALTH - BETHANY,115700,466 SOUTH GRAY STREET,MILLEN,Jenkins,64,71,58,14,66,26,12,0
PINE KNOLL NURSING & REHAB CTR,115443,156 PINE KNOLL DRIVE,CARROLLTON,Carroll,0,0,6,0,94,2,7,0
GLENN-MOR NURSING HOME,115480,10629  U.S. HIGHWAY 19 SOUTH,THOMASVILLE,Thomas,26,14,9,0,46,5,18,0
BRYANT HEALTH AND REHABILITATION CENTER,115479,134 S 6TH STREET,COCHRAN,Bleckley,0,0,10,0,66,1,0,0
BERRIEN NURSING CENTER,115343,405 LAUREL AVE.,NASHVILLE,Berrien,0,0,2,0,97,1,8,0
PRUITTHEALTH - JASPER,115677,1350 EAST CHURCH STREET,JASPER,Pickens,0,0,9,0,49,2,0,0
PRUITTHEALTH - LANIER,115600,2451 PEACHTREE INDUSTRIAL BLVD,BUFORD,Gwinnett,26,0,7,3,76,7,10,0
PARKSIDE POST ACUTE AND REHABILITATION,115643,3000 LENORA CHURCH DRIVE,SNELLVILLE,Gwinnett,41,35,11,2,144,15,0,0
LUMBER CITY NURSING & REHABILITATION CENTER,115404,93 HIGHWAY 19,LUMBER CITY,Telfair,2,2,0,0,61,11,4,0
CEDAR VALLEY NSG & REHAB CTR,115436,225 PHILPOT STREET,CEDARTOWN,Polk,0,0,12,1,82,7,5,0
MACON REHABILITATION AND HEALTHCARE,115362,505 COLISEUM DRIVE,MACON,Bibb,20,0,16,11,80,3,7,0
PRUITTHEALTH - WEST ATLANTA,115512,2645 WHITING STREET N.W.,ATLANTA,Fulton,1,1,1,0,98,6,3,0
PIONEER HEALTH OF CENTRAL GEORGIA,115564,712 PATTERSON STREET,BYROMVILLE,Dooly,43,1,9,9,77,15,0,0
EMANUEL COUNTY NURSING HOME,115704,117 KITE ROAD,SWAINSBORO,Emanuel,1,0,1,1,44,1,0,0
GIBSON HEALTH AND REHABILITATION,115613,434 BEALL SPRINGS ROAD,GIBSON,Glascock,2,10,0,0,72,1,0,0
PRUITTHEALTH - AUSTELL,115314,1700 MULKEY RD,AUSTELL,Cobb,0,61,9,5,115,0,5,0
EASTMAN HEALTHCARE & REHAB,115622,556 CHESTER HIGHWAY,EASTMAN,Dodge,1,1,4,0,92,1,28,0
"PLACE AT MARTINEZ, THE",115308,409 PLEASANT HOME ROAD,AUGUSTA,Richmond,0,0,40,0,72,1,0,0
BAYVIEW NURSING HOME,115593,12884 CLEVELAND STREET WEST,NAHUNTA,Brantley,26,6,2,1,49,4,4,0
WARM SPRINGS MEDICAL CENTER NURSING HOME,115603,5995 SPRING STREET,WARM SPRINGS,Meriwether,0,23,0,0,73,57,27,0
JOE-ANNE BURGIN NURSING HOME,115272,321 RANDOLPH STREET,CUTHBERT,Randolph,40,39,27,17,47,31,0,0
FOUNTAIN BLUE REHAB AND NURSING,115636,3051 WHITESIDE ROAD,MACON,Bibb,8,0,0,0,77,7,0,0
FOUNTAINVIEW CTR FOR ALZHEIMER,115697,2631 NORTH DRUID HILLS ROAD N E,ATLANTA,DeKalb,2,2,13,0,100,5,1,0
ORCHARD HEALTH AND REHABILITATION,115522,1321 PULASKI SCHOOL ROAD,PULASKI,Candler,5,36,2,0,76,4,3,0
POWDER SPRINGS TRANSITIONAL CARE AND REHAB,115538,3460 POWDER SPRINGS ROAD,POWDER SPRINGS,Cobb,6,0,24,24,146,38,0,0
GATEWAY HEALTH AND REHAB,115560,3201 WESTMORELAND ROAD,CLEVELAND,White,2,9,7,0,50,3,20,0
AZALEA HEALTH AND REHABILITATION,115642,300 CEDAR ROAD,METTER,Candler,1,0,7,0,70,1,2,0
BUCHANAN HEALTHCARE CENTER,115587,144 DEPOT STREET,BUCHANAN,Haralson,2,0,0,0,54,2,0,0
"BAPTIST VILLAGE, INC.",115615,2650 CARSWELL AVE,WAYCROSS,Ware,37,179,37,2,191,27,220,0
WYNFIELD PARK HEALTH AND REHABILITATION,115625,223 W.THIRD AVENUE,ALBANY,Dougherty,8,1,13,2,134,4,4,0
MAPLE RIDGE HEALTH CARE CENTER,115543,22 MAPLE RIDGE DRIVE S.E.,CARTERSVILLE,Bartow,0,0,0,0,63,0,0,0
"A.G. RHODES HOME, INC, THE",115275,"350 BOULVARD, S.E.",ATLANTA,Fulton,3,0,0,0,128,13,0,0
SIGNATURE HEALTHCARE OF SAVANNAH,115120,815 EAST 63 STREET,SAVANNAH,Chatham,31,8,10,6,96,0,0,0
BROWN'S HEALTH & REHAB CENTER,115604,226 SOUTH COLLEGE STREET,STATESBORO,Bulloch,0,0,0,0,57,1,0,0
ROCKDALE HEALTHCARE CENTER,115670,1510 RENIASSANCE DRIVE,CONYERS,Rockdale,0,0,6,0,90,6,1,0
SADIE G. MAYS HEALTH & REHABILITATION CENTER,115542,1821 ANDERSON AVENUE NW,ATLANTA,Fulton,56,5,31,8,152,41,0,0
LAKE CROSSING HEALTH CENTER,115424,6698 WASHINGTON ROAD,APPLING,Columbia,79,18,19,12,65,42,55,0
MEDICAL MANAGEMENT HEALTH AND REHAB CENTER,115692,1509 CEDAR AVE,MACON,Bibb,0,0,0,0,78,0,0,0
"PRUITTHEALTH - LAKEHAVEN, LLC",115373,410 EAST NORTHSIDE DRIVE,VALDOSTA,Lowndes,48,0,27,10,66,26,1,0
GORDON HEALTH AND REHABILITATION,115584,1280 MAULDIN ROAD NE,CALHOUN,Gordon,1,4,9,0,95,16,1,0
SYL-VIEW HEALTH CARE CENTER,115544,411 PINE STREET,SYLVANIA,Screven,35,79,8,4,52,10,17,0
SEARS MANOR NURSING HOME,115520,3311 LEE STREET,BRUNSWICK,Glynn,1,0,4,0,63,3,39,0
RIVER BROOK HEALTHCARE CENTER,115635,390 SWEAT STREET,HOMERVILLE,Clinch,48,0,23,8,73,36,0,0
WARNER ROBINS REHABILITATION CENTER,115612,1601 ELBERTA ROAD,WARNER ROBINS,Houston,22,2,7,6,84,19,2,0
ROSEMONT AT STONE MOUNTAIN,115565,5160 SPRING VIEW AVENUE,STONE MOUNTAIN,DeKalb,5,0,0,0,144,6,0,0
GRACE HEALTHCARE OF TUCKER,115596,2165 IDLEWOOD ROAD,TUCKER,DeKalb,47,0,13,6,90,15,0,0
LIFE CARE CENTER OF GWINNETT,115347,3850 SAFEHAVEN DRIVE,LAWRENCEVILLE,Gwinnett,61,48,27,18,47,24,13,1
HAZELHURST COURT CARE AND REHABILITATION CENTER,115626,180 BURKETT FERRY ROAD,HAZLEHURST,Jeff Davis,0,0,0,0,59,0,0,0
SOUTHERN PINES,115657,801 ELBERTA ROAD,WARNER ROBINS,Houston,12,0,3,0,49,2,0,0
"OAKS NURSING HOME, INC, THE",115627,777 NURSING HOME ROAD,MARSHALLVILLE,Macon,0,0,0,0,59,3,0,0
PRUITTHEALTH - BLUE RIDGE,115468,99 OUIDA STREET,BLUE RIDGE,Fannin,8,0,0,0,72,0,0,0
BRIARWOOD HEALTH AND REHABILITATION CENTER,115322,3888 LAVISTA ROAD,TUCKER,DeKalb,,,,,,,,
WAYCROSS HEALTH AND REHABILITATION,115605,1910 DOROTHY STREET,WAYCROSS,Ware,0,1,0,0,56,6,1,0
PRUITTHEALTH - TOCCOA,115345,633 FALLS ROAD,TOCCOA,Stephens,8,6,4,2,149,4,12,0
RIVER TOWNE CENTER,115566,5131 WARM SPRINGS RD,COLUMBUS,Muscogee,30,3,0,0,128,67,7,0
HARBORVIEW HEALTH SYSTEMS THOMASTON,115329,310 AVENUE F,THOMASTON,Upson,50,39,40,17,101,28,29,0
"PREMIER ESTATES OF DUBLIN, LLC",115495,1634 TELFAIR STREET,DUBLIN,Laurens,5,7,4,0,84,3,2,0
WARRENTON HEALTH AND REHAB,115321,813 ATLANTA HIGHWAY,WARRENTON,Warren,0,0,0,0,69,2,5,0
COUNTRYSIDE HEALTH CENTER,115592,233 CARROLLTON  STREET,BUCHANAN,Haralson,0,0,0,0,53,0,0,0
FLORENCE HAND HOME,115277,200 MEDICAL DRIVE,LAGRANGE,Troup,60,1,75,6,105,31,32,0
PRUITTHEALTH - ASHBURN,115491,441 INDUSTRIAL BLVD,ASHBURN,Turner,1,7,20,12,56,23,0,0
PRUITTHEALTH - LILBURN,115516,788 INDIAN TRAIL ROAD,LILBURN,Gwinnett,98,5,25,21,91,42,0,0
PARK PLACE NURSING FACILITY,115005,1865 BOLD SPRINGS ROAD,MONROE,Walton,107,148,29,23,119,31,13,0
LAKE CITY NURSING AND REHABILITATION CENTER LLC,115535,2055 REX ROAD,LAKE CITY,Clayton,1,0,7,1,211,1,0,0
"WILLIAM BREMAN JEWISH HOME, THE",115022,3150 HOWELL MILL ROAD N.W.,ATLANTA,Fulton,10,0,7,3,85,21,0,0
LEGACY HEALTH AND REHABILITATION,115496,1201 SILOAM ROAD,GREENSBORO,Greene,1,7,3,0,43,0,4,0
WILLOWBROOKE COURT AT LANIER VILLAGE ESTATES,115687,4145 MISTY MORNING WAY,GAINESVILLE,Hall,2,2,6,0,52,7,0,0
PRESBYTERIAN VILLAGE,115490,2000 EAST-WEST CONNECTOR,AUSTELL,Cobb,0,21,7,0,89,3,1,0
COMER HEALTH AND REHABILITATION,115289,2430 PAOLI ROAD,COMER,Madison,60,63,8,5,82,15,10,0
LEE COUNTY HEALTH AND REHABILITATION,115614,214 MAIN STREET,LEESBURG,Lee,2,0,3,0,49,2,0,0
"BRIGHTMOOR HEALTH CARE, INC",115556,3235 NEWNAN ROAD,GRIFFIN,Spalding,9,9,35,20,85,1,3,0
MUSCOGEE MANOR & REHABILITATION CTR,115351,7150 MANOR ROAD,COLUMBUS,Muscogee,34,2,22,21,94,22,0,0
ROBERTA HEALTH AND REHAB,115523,420 MYTLE DRIVE,ROBERTA,Crawford,0,0,1,0,80,0,1,0
"LODGE, THE",115552,200 SOUTH KIMBERLY ROAD,WARNER ROBINS,Houston,12,10,7,4,51,25,21,0
PRUITTHEALTH - FITZGERALD,115617,185 BOWEN'S MILL HIGHWAY,FITZGERALD,Ben Hill,0,0,1,0,73,0,0,0
"WESTBURY CONYERS, LLC",115469,1420 MILSTEAD ROAD,CONYERS,Rockdale,1,0,6,0,134,2,0,0
"CARROLLTON MANOR, INCORPORATED",115638,2455 OAK GROVE CHURCH ROAD,CARROLLTON,Carroll,14,3,2,0,76,3,2,0
RIVERDALE CENTER FOR NURSING AND HEALING,115144,315 UPPER RIVERDALE ROAD,RIVERDALE,Clayton,23,54,6,1,133,7,0,0
ORCHARD VIEW REHABILITATION & SKILLED NURSING CTR,115146,8414 WHITESVILLE ROAD,COLUMBUS,Muscogee,8,0,13,6,135,23,0,1
"THOMASVILLE HEALTH & REHAB, LLC",115427,120 SKYLINE DRIVE,THOMASVILLE,Thomas,27,0,9,3,33,7,2,0
EATONTON HEALTH AND REHABILITATION,115595,125 SPARTA HIGHWAY 16 EAST,EATONTON,Putnam,4,2,7,3,57,1,0,0
MCRAE MANOR NURSING HOME,115494,160 SOUTH FIRST AVENUE,MC RAE,Telfair,37,0,0,0,86,10,0,0
CROSSVIEW CARE CENTER,115541,402 E. BAY ST,PINEVIEW,Wilcox,,,,,,,,
"PRUITTHEALTH - CRESTWOOD, LLC",115385,415 PENDLETON PLACE,VALDOSTA,Lowndes,9,4,10,0,68,10,11,0
"OAKS - SCENIC VIEW SKILLED NURSING, THE",115393,205 PEACH ORCHARD ROAD,BALDWIN,Habersham,89,31,29,20,86,44,18,0
TATTNALL HEALTHCARE CENTER,115575,142 MEMORIAL DRIVE,REIDSVILLE,Tattnall,,,,,,,,
WESTBURY MEDICAL CARE AND REHAB,115563,922 MCDONOUGH ROAD,JACKSON,Butts,2,13,18,13,117,12,1,1
CRISP REGIONAL NSG & REHAB CTR,115568,902 BLACKSHEAR ROAD,CORDELE,Crisp,0,1,1,0,61,1,3,0
MANOR CARE REHABILITATION CENTER - MARIETTA,115283,4360 JOHNSON FERRY PLACE,MARIETTA,Cobb,52,3,8,1,71,22,28,0
PRUITTHEALTH - FRANKLIN,115616,360 SOUTH RIVER ROAD,FRANKLIN,Heard,3,0,3,0,69,0,0,0
PRUITTHEALTH - OCILLA,115608,209 WEST HUDSON STREET,OCILLA,Irwin,0,0,0,0,65,3,2,0
FOLKSTON PARK CARE AND REHABILITATION CENTER,115630,36261 NORTH OKEFENOKEE DRIVE,FOLKSTON,Charlton,,,,,,,,
UNIVERSITY NURSING & REHAB CTR,115467,180 EPPS BRIDGE RD,ATHENS,Clarke,9,38,6,0,94,10,9,0
HIGH SHOALS HEALTH AND REHABILITATION,115279,3450 NEW HIGH SHOALS RD,BISHOP,Oconee,47,3,11,8,70,11,0,0
COASTAL MANOR,115665,128 COASTAL MANOR DRIVE SE,LUDOWICI,Long,1,11,7,0,94,2,26,0
NEWNAN HEALTH AND REHABILITATION,115138,244 EAST BROAD STREET,NEWNAN,Coweta,11,9,12,12,57,17,0,0
BRENTWOOD HEALTH AND REHABILITATION,115361,115 BRENTWOOD DRIVE,WAYNESBORO,Burke,12,3,11,2,64,8,3,0
PRUITTHEALTH - PEAKE,115394,6190 PEAKE ROAD,MACON,Bibb,6,0,4,1,95,14,0,0
WOODSTOCK NURSING & REHAB CTR,115421,105 ARNOLD MILL ROAD,WOODSTOCK,Cherokee,2,0,12,0,141,2,1,0
JONESBORO NURSING AND REHABILITATION CENTER,115545,2650 HIGHWAY 138 SE,JONESBORO,Clayton,39,1,14,3,104,5,3,0
MANOR CARE REHABILITATION CENTER - DECATUR,115246,2722 NORTH DECATUR ROAD,DECATUR,DeKalb,42,18,11,3,88,5,21,0
CANDLER SKILLED NURSING UNIT,115610,5353 REYNOLDS STREET,SAVANNAH,Chatham,0,0,0,0,22,1,4,0
CHULIO HILLS HEALTH AND REHAB,115287,1170 CHULIO ROAD,ROME,Floyd,5,44,10,1,68,9,26,0
DUBLINAIR HEALTH & REHAB,115356,300 INDUSTRIAL BLVD,DUBLIN,Laurens,1,0,15,1,115,3,19,0
PRUITTHEALTH - SUNRISE,115668,2709 S MAIN STREET,MOULTRIE,Colquitt,1,0,0,0,46,0,0,0
CHESTNUT RIDGE NSG & REHAB CTR,115423,125 SAMARITAN DRIVE,CUMMING,Forsyth,0,0,0,0,123,6,7,0
PRUITTHEALTH - OLD CAPITOL,115681,310 HIGHWAY #1 BYPASS,LOUISVILLE,Burke,10,6,1,0,119,16,2,1
LAGRANGE HEALTH AND REHAB,115354,2111 WEST POINT ROAD,LAGRANGE,Troup,61,14,21,19,55,18,11,0
"PRUITTHEALTH - VALDOSTA, LLC",115377,2501 NORTH ASHLEY STREET,VALDOSTA,Lowndes,37,3,12,1,84,19,1,0
PARKSIDE CENTER FOR NURSING AND REHAB AT ELLIJAY,115683,1362 SOUTH MAIN STREET,ELLIJAY,Gilmer,1,0,21,0,89,1,12,0
PRUITTHEALTH - MAGNOLIA MANOR,115326,3003 VETERANS PARKWAY S,MOULTRIE,Colquitt,1,44,6,0,78,2,2,0
WILDWOOD HEALTH AND REHAB,115706,184 PIN HOOK ROAD,TALKING ROCK,Pickens,12,24,3,0,38,0,3,0
SENIOR CARE CENTER - ST MARYS,115684,805 DILWORTH STREET,SAINT MARYS,Camden,5,0,37,0,59,8,0,0
"OAKS - BETHANY SKILLED NURSING, THE",115705,1305 EAST NORTH STREET,VIDALIA,Toombs,4,0,25,0,134,6,0,0
PRUITTHEALTH - EASTSIDE,115391,2795 FINNEY CIRCLE,MACON,Bibb,0,0,4,0,83,0,0,0
PRUITTHEALTH - FORT OGLETHORPE,115409,1067 BATTLEFIELD PARKWAY,FORT OGLETHORPE,Catoosa,76,109,47,11,81,42,16,0
"PLACE AT DEANS BRIDGE, THE",115290,3235 DEANS BRIDGE ROAD,AUGUSTA,Richmond,0,0,1,0,75,0,0,0
HERITAGE INN OF BARNESVILLE HEALTH AND REHAB,115447,946 VETERANS PARKWAY,BARNESVILLE,Lamar,33,40,21,10,67,11,2,0
LEGACY TRANSITIONAL CARE & REHABILITATION,115585,460 AUBURN AVENUE N.E.,ATLANTA,Fulton,0,16,13,11,149,20,4,2
"OAKS - CARROLLTON SKILLED NURSING, THE",115384,921 OLD NEWNAN ROAD,CARROLLTON,Carroll,1,0,0,0,35,2,0,0
GOLD CITY HEALTH AND REHAB,115689,222 MOORE DRIVE,DAHLONEGA,Lumpkin,2,2,5,1,81,2,12,0
EASTVIEW NURSING CENTER,115656,3020 JEFFERSONVILLE ROAD,MACON,Bibb,0,0,42,0,53,12,8,0
"HEALTHCARE AT COLLEGE PARK, LLC",115579,1765 TEMPLE AVENUE,COLLEGE PARK,Fulton,,,,,,,,
PRUITTHEALTH - WASHINGTON,115325,112 HOSPITAL DRIVE,WASHINGTON,Wilkes,1,0,0,0,38,3,0,0
MEADOWBROOK HEALTH AND REHAB,115561,4608 LAWRENCEVILLE HIGHWAY,TUCKER,DeKalb,38,5,4,4,102,2,1,0
