ROYAL CARE OF AVON PARK,105812,1213 W STRATFORD RD,AVON PARK,Highlands,29,8,4,2,76,17,2,0
LIFE CARE CENTER OF WINTER HAVEN,105792,1510 CYPRESS GARDENS BLVD,WINTER HAVEN,Polk,7,0,16,1,136,9,4,0
SURREY PLACE CARE CENTER,105597,110 SE LEE AVE,LIVE OAK,Suwannee,38,19,25,24,41,18,19,0
SIGNATURE HEALTHCARE OF NORTH FLORIDA,105662,1083 SANDERS AVENUE,GRACEVILLE,Jackson,74,50,21,13,115,23,28,0
JACKSON PLAZA NURSING AND REHABILITATION CENTER,106034,1861 NW 8TH AVENUE,MIAMI,Miami-Dade,43,31,21,5,91,36,0,0
"WINDSOR CARE & REHAB, LLC",105805,501 S PALM AVE,PALATKA,Putnam,0,0,2,0,39,10,5,0
COMMUNITY HEALTH AND REHABILITATION CENTER,105975,3611 TRANSMITTER ROAD,PANAMA CITY,Bay,0,0,0,0,0,0,0,0
UNIVERSITY CROSSING,105820,6210 BEACH BLVD,JACKSONVILLE,Duval,7,3,11,0,100,25,25,0
CONSULATE HEALTH CARE OF BAYONET POINT,105786,8132 HUDSON AVENUE,HUDSON,Pasco,40,53,19,8,85,24,6,0
EDWARD J HEALEY REHABILITATION AND NURSING CENTER,105838,5101 WEST BLUE HERON BLVD,RIVIERA BEACH,Palm Beach,1,4,1,0,108,49,10,0
PALM GARDEN OF CLEARWATER,105581,3480 MCMULLEN BOOTH RD,CLEARWATER,Pinellas,12,0,2,2,149,13,9,0
NSPIRE HEALTHCARE LAUDERHILL,105680,2599 NW 55TH AVE,LAUDERHILL,Broward,,,,,,,,
CLIFFORD CHESTER SIMS STATE VETERANS NURSING HOME,106056,4419 TRAM ROAD,PANAMA CITY,Bay,36,0,28,9,78,49,0,0
"TERRACE OF ST CLOUD, THE",105528,3855 OLD CANOE CREEK ROAD,SAINT CLOUD,Osceola,28,1,13,10,108,22,0,0
ADVENTHEALTH CARE CENTER APOPKA NORTH,105782,305 EAST OAK STREET,APOPKA,Orange,9,7,4,1,115,85,33,0
SOLARIS HEALTHCARE PARKWAY,105687,800 SE CENTRAL PKWY,STUART,Martin,15,3,37,5,159,26,1,0
INDIGO MANOR,105570,595 N WILLIAMSON BLVD,DAYTONA BEACH,Volusia,2,1,0,0,114,24,17,2
OSPREY POINT NURSING CENTER,106008,1104 NORTH MAIN STREET,BUSHNELL,Sumter,0,0,5,0,45,4,0,0
LIFE CARE CENTER OF ESTERO,106057,3850 WILLIAMS ROAD,ESTERO,Lee,33,0,12,9,103,34,0,0
HEARTLAND HEALTH CARE CENTER BOYNTON BEACH,105755,3600 OLD BOYNTON ROAD,BOYNTON BEACH,Palm Beach,26,16,17,7,99,11,3,0
"ALEXANDER ""SANDY"" NININGER STATE VETERANS NURSING",106038,8401 W CYPRESS DR,PEMBROKE PINES,Broward,86,5,48,28,82,60,14,0
SILVERCREST HEALTH AND REHABILITATION CENTER,105612,910 BROOKMEADE DRIVE,CRESTVIEW,Okaloosa,2,1,1,0,52,2,3,0
INN AT SARASOTA BAY CLUB,106035,1303 NORTH TAMIAMI TRAIL,SARASOTA,Sarasota,0,0,3,0,34,5,0,0
FLETCHER HEALTH AND REHABILITATION CENTER,105644,518 W FLETCHER AVE,TAMPA,Hillsborough,20,3,8,2,106,24,2,0
CONSULATE HEALTH CARE OF NORTH FORT MYERS,105507,991 PONDELLA RD,FORT MYERS,Lee,37,4,1,0,94,42,5,0
ADVENTHEALTH CARE CENTER ZEPHYRHILLS SOUTH,105658,38250 A AVE,ZEPHYRHILLS,Pasco,43,8,13,7,60,24,10,0
PALM GARDEN OF PINELLAS,105733,200 16TH AVE SE,LARGO,Pinellas,5,0,1,0,99,33,1,0
EMERALD HEALTH CARE CENTER,105579,1655 SE WALTON ROAD,PORT SAINT LUCIE,St. Lucie,,,,,,,,
EDGEWATER AT WATERMAN VILLAGE,105796,300 BROOKFIELD AVE,MOUNT DORA,Lake,0,0,6,0,77,8,0,0
AVANTE AT ST CLOUD INC,105670,1301 KANSAS AVE,SAINT CLOUD,Osceola,44,36,10,8,103,39,0,0
HARTS HARBOR HEALTH CARE CENTER,105632,11565 HARTS RD,JACKSONVILLE,Duval,5,0,4,0,166,16,1,0
VILLAGE ON THE GREEN,105556,500 VILLAGE PLACE,LONGWOOD,Seminole,38,18,104,6,30,40,5,0
CARROLLWOOD CARE CENTER,105553,15002 HUTCHINSON RD,TAMPA,Hillsborough,,,,,,,,
BRIGHTON GARDENS OF TAMPA,106015,16702 NORTH DALE MABRY HWY,TAMPA,Hillsborough,1,0,3,0,32,3,0,0
DOUGLAS JACOBSON STATE VETERANS NURSING HOME,106059,21281 GRAYTON TERRACE,PORT CHARLOTTE,Charlotte,44,27,7,0,62,47,11,1
CENTRE POINTE HEALTH AND REHAB CENTER,105563,2255 CENTERVILLE ROAD,TALLAHASSEE,Leon,0,0,3,0,102,6,0,0
BELLEAIR HEALTH CARE CENTER,105636,1150 PONCE DE LEON BLVD,CLEARWATER,Pinellas,0,0,0,0,103,4,0,0
LAKE HARRIS HEALTH CENTER,105705,701 LAKE PORT BLVD,LEESBURG,Lake,0,3,10,0,88,5,0,0
WASHINGTON REHABILITATION AND NURSING CENTER,105727,879 USERY ROAD,CHIPLEY,Washington,52,38,23,13,116,29,50,0
LIFE CARE CENTER OF PORT SAINT LUCIE,106012,3720 SE JENNINGS RD,PORT SAINT LUCIE,St. Lucie,44,11,21,11,75,26,99,0
SINAI PLAZA NURSING & REHAB CENTER,105711,201 NE 112TH STREET,MIAMI,Miami-Dade,2,0,14,1,119,28,0,0
NORTH CAMPUS REHABILITATION AND NURSING CENTER,105621,700 N PALMETTO ST,LEESBURG,Lake,0,0,9,0,85,8,2,0
ALHAMBRA HEALTH AND REHABILITATION CENTER,105712,7501 38TH AVE N,SAINT PETERSBURG,Pinellas,3,0,7,1,46,10,3,0
CENTURY CENTER FOR REHABILITATION AND HEALING,105860,6020 INDUSTRIAL BLVD,CENTURY,Escambia,49,64,11,4,68,25,11,0
PALMETTO CARE CENTER,105575,6750 WEST 22ND COURT,HIALEAH,Miami-Dade,22,5,6,5,71,25,4,0
CITRUS HEALTH AND REHABILITATION CENTER,105858,701 MEDICAL COURT EAST,INVERNESS,Citrus,6,0,3,0,106,12,12,0
HAWTHORNE HEALTH AND REHAB OF OCALA,105602,4100 SW 33RD AVE,OCALA,Marion,1,0,8,1,85,6,2,0
"CROSSINGS, THE",105835,4445 PINE FOREST DR,LAKE WORTH,Palm Beach,30,0,29,7,37,20,1,0
REGENTS PARK OF JACKSONVILLE,105533,8700 A C SKINNER PARKWAY,JACKSONVILLE,Duval,17,66,58,1,102,65,11,0
SAMANTHA WILSON CARE CENTER,105816,161A MARINE STREET,SAINT AUGUSTINE,St. Johns,12,9,0,0,89,10,33,0
SAN JOSE HEALTH AND REHABILITATION CENTER,105531,9355 SAN JOSE BLVD,JACKSONVILLE,Duval,20,4,11,0,89,29,0,0
SARASOTA MEMORIAL NURSING AND REHABILITATION CENTE,105584,5640 RAND BLVD,SARASOTA,Sarasota,3,0,22,0,101,11,0,0
HIALEAH SHORES NURSING AND REHAB CENTER,105511,8785 NW 32ND AVENUE,MIAMI,Miami-Dade,71,50,10,5,90,56,2,0
"COURT AT PALM AIRE, THE",105627,2701 N COURSE DR,POMPANO BEACH,Broward,26,0,1,7,44,17,0,0
GOOD SAMARITAN CENTER,105809,10676 MARVIN JONES BLVD,LIVE OAK,Suwannee,69,10,41,24,107,50,17,0
SPRING LAKE REHABILITATION CENTER,105730,1540 6TH ST NW,WINTER HAVEN,Polk,28,11,7,7,99,85,0,0
CONSULATE HEALTH CARE OF ST PETERSBURG,105895,9393 PARK BLVD,SEMINOLE,Pinellas,30,11,8,6,74,38,9,0
UNITY HEALTH AND REHABILITATION CENTER,105510,1404 NW 22ND STREET,MIAMI,Miami-Dade,26,0,10,4,221,68,2,0
LAKE PARK OF MADISON NURSING AND REHABILITATION CE,105892,259 SW CAPTAIN BROWN RD,MADISON,Madison,45,27,31,11,76,53,54,0
GRAND BOULEVARD HEALTH AND REHABILITATION CENTER,105601,138 SANDESTIN LANE,MIRAMAR BEACH,Walton,2,0,19,1,72,7,0,0
CORAL TRACE HEALTH CARE,105588,216 SANTA BARBARA BLVD,CAPE CORAL,Lee,8,1,17,1,95,15,1,0
MANORCARE HEALTH SERVICES PALM HARBOR,105708,2851 TAMPA RD,PALM HARBOR,Pinellas,0,19,19,0,161,3,8,0
CLERMONT HEALTH AND REHABILITATION CENTER,105512,151 E MINNEHAHA AVE,CLERMONT,Lake,2,24,8,0,168,35,16,0
NSPIRE HEALTHCARE TAMARAC,105609,5901 NW 79TH AVENUE,TAMARAC,Broward,1,0,1,1,128,7,0,0
YBOR CITY CENTER FOR REHABILITATION AND HEALING,105891,1709 TALIAFERRO AVE,TAMPA,Hillsborough,29,2,7,1,65,23,2,0
CONSULATE HEALTH CARE OF TALLAHASSEE,105764,1650 PHILLIPS RD,TALLAHASSEE,Leon,14,8,2,0,93,18,1,0
LIFE CARE CENTER OF JACKSONVILLE,106064,4813 LENOIR AVENUE,JACKSONVILLE,Duval,10,12,0,0,79,31,3,0
HARBOUR HEALTH CENTER,105538,23013 WESTCHESTER BLVD,PORT CHARLOTTE,Charlotte,13,4,6,0,75,21,4,0
BRADENTON HEALTH CARE,106017,6305 CORTEZ RD W,BRADENTON,Manatee,12,0,20,19,63,29,6,0
WATERS EDGE HEALTH AND REHABILITATION,105828,1500 SW CAPRI ST,PALM CITY,Martin,1,2,3,0,22,13,3,0
GOOD SAMARITAN SOCIETY-DAYTONA,105651,325 S SEGRAVE STREET,DAYTONA BEACH,Volusia,2,0,5,1,73,5,5,0
BONIFAY NURSING AND REHAB CENTER,105624,306 WEST BROCK AVENUE,BONIFAY,Holmes,13,0,11,1,158,25,0,0
BALDOMERO LOPEZ MEMORIAL VETERANS NURSING HOME,106006,6919 PARKWAY BLVD,LAND O LAKES,Pasco,42,0,22,11,85,17,3,0
BLOUNTSTOWN HEALTH AND REHABILITATION CENTER,105924,16690 SW CHIPOLA RD,BLOUNTSTOWN,Calhoun,14,2,19,8,58,7,1,0
GOVERNORS CREEK HEALTH AND REHABILITATION,105663,803 OAK ST,GREEN COVE SPRINGS,Clay,0,0,0,0,93,3,0,0
ARBOR TRAIL REHAB AND SKILLED NURSING CENTER,105703,611 TURNER CAMP RD,INVERNESS,Citrus,16,0,9,0,89,6,10,0
WESTCHESTER GARDENS HEALTH & REHABILITATION,105654,3301 N MCMULLEN BOOTH RD,CLEARWATER,Pinellas,0,6,11,0,105,5,7,0
MARTIN NURSING AND REHABILITATION,105972,6011 SE TOWER DR,STUART,Martin,32,13,15,8,82,28,6,0
PRUITTHEALTH - SANTA ROSA,106048,5530 NORTHROP ROAD,MILTON,Santa Rosa,11,2,26,1,98,17,1,0
CLARIDGE HOUSE NURSING & REHABILITATION CENTER,105513,13900 NE 3RD COURT,NORTH MIAMI,Miami-Dade,10,1,84,63,188,67,5,0
ROYAL PALM BEACH HEALTH AND REHABILITATION CENTER,105494,600 BUSINESS PARK WAY,ROYAL PALM BEACH,Palm Beach,3,15,16,0,103,64,2,1
"PALMS REHABILITATION AND HEALTHCARE CENTER, THE",105985,5405 BABCOCK ST NE,PALM BAY,Brevard,23,9,12,5,95,24,18,0
SPRINGS AT BOCA CIEGA BAY,105537,"1255 PASADENA AVE S, SUITE C",SOUTH PASADENA,Pinellas,1,0,10,0,87,13,10,0
NORTH LAKE CARE CENTER,105640,750 BAYBERRY DRIVE,LAKE PARK,Palm Beach,5,0,1,1,63,33,0,0
SUNRISE CITY POST-ACUTE AND REHABILITATION CENTER,105804,700 S 29TH STREET,FORT PIERCE,St. Lucie,21,0,13,3,44,24,0,0
BRANDON HEALTH AND REHABILITATION CENTER,105951,1465 OAKFIELD DR,BRANDON,Hillsborough,6,1,0,0,92,28,0,0
DEBARY HEALTH AND REHABILITATION CENTER,105514,60 N HWY 17/92,DEBARY,Volusia,18,3,4,0,104,20,4,0
CHAUTAUQUA REHABILITATION AND NURSING CENTER,105626,785 S 2ND STREET,DEFUNIAK SPRINGS,Walton,44,72,29,17,118,35,19,0
WILLOWBROOKE COURT SKILLED CARE CENTER - EDGEWATER,105489,23305 BLUE WATER CIRCLE,BOCA RATON,Palm Beach,3,0,7,0,53,11,0,0
LIFE CARE CENTER OF SARASOTA,106025,8104 TUTTLE AVE,SARASOTA,Manatee,1,0,9,0,92,14,0,0
MARIANNA HEALTH AND REHABILITATION CENTER,105637,4295 FIFTH AVENUE,MARIANNA,Jackson,86,0,37,37,110,25,9,0
PALM GARDEN OF JACKSONVILLE,105682,5725 SPRING PARK ROAD,JACKSONVILLE,Duval,2,0,36,0,109,4,2,0
SOLARIS HEALTHCARE LAKE BENNET,105967,1091 KELTON AVE,OCOEE,Orange,2,17,32,1,103,10,11,0
"ST ANNES NURSING CENTER, ST ANNES RESIDENCE INC",105560,11855 QUAIL ROOST DRIVE,MIAMI,Miami-Dade,53,4,5,5,150,49,4,0
PALM GARDEN OF ORLANDO,105577,654 N ECONLOCKHATCHEE TRAIL,ORLANDO,Orange,31,8,7,3,109,23,0,0
GRAND OAKS HEALTH AND REHABILITATION CENTER,105952,3001 PALM COAST PARKWAY SE,PALM COAST,Flagler,0,0,8,0,93,17,10,0
COQUINA CENTER,105589,170 N CENTER STREET,ORMOND BEACH,Volusia,3,1,9,6,63,3,5,0
HOMESTEAD MANOR A PALACE COMMUNITY,105541,1330 NW 1ST AVE,HOMESTEAD,Miami-Dade,0,1,8,0,88,6,0,0
FOUNTAINS REHABILITATION AT MILL COVE,105927,9960 ATRIUM WAY,JACKSONVILLE,Duval,27,12,1,1,62,29,3,0
HARBORCHASE OF VENICE,105955,950 PINEBROOK ROAD,VENICE,Sarasota,8,3,32,3,25,9,4,1
CROSSWINDS HEALTH AND REHABILITATION CENTER,105824,13455 W US HWY 90,GREENVILLE,Madison,1,0,0,0,47,10,0,0
GULF COAST VILLAGE,105672,1333 SANTA BARBARA BLVD,CAPE CORAL,Lee,0,0,12,0,97,20,1,0
LIFE CARE CENTER OF ORANGE PARK,105928,2145 KINGSLEY AVE,ORANGE PARK,Clay,18,0,16,2,147,24,1,0
OAK VIEW REHABILITATION CENTER,105586,833 KINGSLEY AVE,ORANGE PARK,Clay,5,0,2,0,103,29,0,0
CONSULATE HEALTH CARE OF SARASOTA,105983,4783 FRUITVILLE ROAD,SARASOTA,Sarasota,13,1,13,4,60,0,0,0
MANORCARE HEALTH SERVICES BOYNTON BEACH,105496,3001 SOUTH CONGRESS AVENUE,BOYNTON BEACH,Palm Beach,2,9,28,0,129,27,6,0
DARCY HALL OF LIFE CARE,105516,2170 PALM BEACH LAKES BLVD,WEST PALM BEACH,Palm Beach,129,31,36,19,123,72,2,0
OAKBROOK HEALTH AND REHABILITATION CENTER,105683,250 BROWARD AVE,LABELLE,Hendry,18,2,8,7,78,17,8,0
SOLARIS HEALTHCARE PENSACOLA,105561,8475 UNIVERSITY PARKWAY,PENSACOLA,Escambia,17,2,10,3,150,38,6,0
SUWANNEE HEALTH AND REHABILITATION CENTER,105613,1620 HELVENSTON ST SE,LIVE OAK,Suwannee,82,35,34,18,113,79,45,0
SIGNATURE HEALTHCARE CENTER OF WATERFORD,105554,8333 W OKEECHOBEE ROAD,HIALEAH GARDENS,Miami-Dade,72,3,44,24,172,80,13,0
GUARDIAN CARE NURSING & REHABILITATION CENTER,105797,2500 W CHURCH STREET,ORLANDO,Orange,45,36,5,4,72,60,15,0
SIGNATURE HEALTHCARE AT THE COURTYARD,105970,2600 FOREST GLEN TRAIL,MARIANNA,Jackson,3,2,1,0,108,13,4,0
AVANTE AT ORLANDO INC,106027,2000 NORTH SEMORAN BOULEVARD,ORLANDO,Orange,87,11,10,5,108,28,11,0
SURREY PLACE HEALTHCARE AND REHABILITATION,105629,5525 21ST AVE W,BRADENTON,Manatee,5,8,6,0,38,8,18,0
CONSULATE HEALTH CARE OF LAKE PARKER,105693,2020 W LAKE PARKER DR,LAKELAND,Polk,49,10,13,8,78,24,4,0
PORT ORANGE NURSING AND REHAB CENTER,105776,5600 VICTORIA GARDENS BLVD,PORT ORANGE,Volusia,0,0,0,0,90,2,0,0
EXCEL CARE CENTER,105884,2811 CAMPUS HILL DR,TAMPA,Hillsborough,37,1,3,0,95,38,1,0
ATLANTIC SHORES NURSING AND REHAB CENTER,105904,4251 STACK BLVD,MELBOURNE,Brevard,4,0,0,0,81,20,0,0
"GROVE HEALTH & REHABILITATION CENTER, THE",106036,124 W NORVELL BRYANT HWY,HERNANDO,Citrus,2,1,13,0,109,6,89,0
SOLARIS HEALTHCARE BAYONET POINT,105544,7210 BEACON WOODS DR,HUDSON,Pasco,0,1,4,0,153,17,8,0
"MANOR AT BLUE WATER BAY, THE",105784,1500 NORTH WHITE POINT ROAD,NICEVILLE,Okaloosa,41,15,16,6,72,28,10,0
WOODLAND GROVE HEALTH & REHABILITATION CENTER,106058,4325 SOUTHPOINT BOULEVARD,JACKSONVILLE,Duval,76,74,10,10,93,90,50,0
NSPIRE HEALTHCARE PLANTATION,105519,6931 W SUNRISE BLVD,PLANTATION,Broward,,,,,,,,
CONCORDIA MANOR,105714,321 13TH AVE N,SAINT PETERSBURG,Pinellas,1,0,0,0,29,2,0,0
PALM GARDEN OF SUN CITY,105736,3850 UPPER CREEK DR,SUN CITY CENTER,Hillsborough,40,0,0,0,75,39,31,0
WINTER GARDEN REHABILITATION AND NURSING CENTER,105518,12751 W COLONIAL DRIVE,WINTER GARDEN,Orange,9,5,9,3,71,6,3,0
PALM GARDEN OF AVENTURA,105610,21251 E DIXIE HIGHWAY,NORTH MIAMI BEACH,Miami-Dade,0,0,0,5,107,11,0,0
ST ANDREWS BAY SKILLED NURSING AND REHABILITATION,105543,2100 JENKS AVE,PANAMA CITY,Bay,11,16,11,8,84,41,3,0
TIMBERRIDGE NURSING & REHABILITATION CENTER,105717,9848 SW 110TH ST,OCALA,Marion,33,0,6,4,137,20,9,0
SOLARIS HEALTHCARE IMPERIAL,105738,900 IMPERIAL GOLF COURSE BLVD,NAPLES,Collier,51,5,12,9,71,44,12,0
WINDSOR WOODS REHAB AND HEALTHCARE CENTER,105568,13719 DALLAS DR,HUDSON,Pasco,0,26,3,0,92,4,2,0
MOULTRIE CREEK NURSING AND REHAB CENTER,105548,200 MARINER HEALTH WAY,SAINT AUGUSTINE,St. Johns,29,0,6,5,83,17,0,0
GLEN OAKS HEALTH AND REHABILITATION CENTER,105634,1100 N PINE ST,CLEARWATER,Pinellas,3,12,4,0,70,12,7,0
RIO PINAR HEALTH CARE,105564,7950 LAKE UNDERHILL ROAD,ORLANDO,Orange,37,0,7,7,147,92,2,0
CONSULATE HEALTH CARE OF KISSIMMEE,106011,2511 JOHN YOUNG PARKWAY NORTH,KISSIMMEE,Osceola,58,7,24,14,84,89,18,0
LIFE CARE CENTER OF NEW PORT RICHEY,106049,7400 TROUBLE CREEK ROAD,NEW PORT RICHEY,Pasco,1,0,27,0,113,4,37,0
COVENANT VILLAGE CARE CENTER,105604,9211 W BROWARD BLVD,PLANTATION,Broward,0,1,2,0,50,10,1,0
FORUM AT DEER CREEK,105691,3001 DEER CREEK COUNTRY CLUB,DEERFIELD BEACH,Broward,13,2,3,1,41,13,1,1
TRI-COUNTY NURSING HOME,105770,7280 SW STATE RD 26,TRENTON,Gilchrist,1,10,0,0,71,1,4,0
HILLCREST HEALTH CARE AND REHABILITATION CENTER,105495,4200 WASHINGTON ST,HOLLYWOOD,Broward,119,6,60,32,180,79,2,0
HEARTLAND HEALTH CARE AND REHABILITATION CENTER OF,105852,7225 BOCA DEL MAR DRIVE,BOCA RATON,Palm Beach,1,1,9,0,70,15,1,0
REGENTS PARK OF SUNRISE,105679,9711 W OAKLAND PARK BLVD,SUNRISE,Broward,27,77,1,0,92,46,4,0
HEARTLAND OF ZEPHYRHILLS,105599,38220 HENRY DR,ZEPHYRHILLS,Pasco,5,31,7,1,82,2,18,0
SOLARIS HEALTHCARE COCONUT CREEK,105979,4125 WEST SAMPLE RD,COCONUT CREEK,Broward,12,36,54,5,96,20,22,0
SPECIALTY HEALTH AND REHABILITATION CENTER,105751,6984 PINE FOREST ROAD,PENSACOLA,Escambia,20,40,37,2,94,32,9,0
POMPANO HEALTH AND REHABILITATION CENTER,105572,51 W SAMPLE ROAD,POMPANO BEACH,Broward,33,0,7,1,107,50,0,0
MANORCARE AT LELY PALMS,105499,6135 RATTLESNAKE HAMMOCK ROAD,NAPLES,Collier,2,66,11,3,99,24,1,0
HAVEN OF OUR LADY OF PEACE,106052,1900 SUMMIT BOULEVARD,PENSACOLA,Escambia,14,0,7,2,86,32,12,0
PALM GARDEN OF TAMPA,105591,3612 E 138TH AVE,TAMPA,Hillsborough,25,16,25,7,96,41,24,0
CONSULATE HEALTH CARE OF PORT CHARLOTTE,105982,18480 COCHRAN BLVD,PORT CHARLOTTE,Charlotte,4,0,0,0,113,2,0,0
OCALA OAKS REHABILITATION CENTER,105724,3930 E SILVER SPRINGS BLVD,OCALA,Marion,48,14,18,8,74,45,19,0
COASTAL HEALTH AND REHABILITATION CENTER,105565,820 N CLYDE MORRIS BLVD,DAYTONA BEACH,Volusia,21,1,13,3,86,32,6,0
WEST GABLES HEALTH CARE CENTER,105623,2525 SW 75TH AVENUE,MIAMI,Miami-Dade,58,36,17,9,83,49,42,0
PALMETTO SUBACUTE CARE CENTER,105939,7600 SW 8TH STREET,MIAMI,Miami-Dade,48,53,17,12,62,43,31,0
WESTMINSTER ST AUGUSTINE,106040,230 TOWERVIEW DRIVE,SAINT AUGUSTINE,St. Johns,0,0,0,0,19,0,0,0
AVANTE VILLA AT JACKSONVILLE BEACH INC,105617,1504 SEABREEZE AVE,JACKSONVILLE BEACH,Duval,17,7,3,2,106,38,2,0
OASIS HEALTH AND REHABILITATION CENTER,105659,1201 12TH AVENUE SOUTH,LAKE WORTH,Palm Beach,3,0,12,4,84,14,0,0
SOLARIS HEALTHCARE OSCEOLA,105734,4201 W NEW NOLTE ROAD,SAINT CLOUD,Osceola,54,18,7,5,93,38,34,0
PALM GARDEN OF VERO BEACH,105592,1755 37TH STREET,VERO BEACH,Indian River,21,7,7,3,121,28,3,0
LEHIGH ACRES HEALTH AND REHABILITATION CENTER,105522,1550 LEE BOULEVARD,LEHIGH ACRES,Lee,56,36,26,10,116,64,72,0
CROSS GARDENS CARE CENTER,105765,190 NE 191ST STREET,MIAMI,Miami-Dade,25,5,9,4,101,16,4,0
CHATSWORTH AT PGA NATIONAL,106013,347 HIATT DRIVE,PALM BEACH GARDENS,Palm Beach,8,4,5,2,30,14,9,0
PARK SUMMIT AT CORAL SPRINGS,105503,8500 ROYAL PALM BLVD,CORAL SPRINGS,Broward,10,0,6,3,20,12,5,0
LAKESIDE NEUROLOGIC,106054,1962 VANDOLAH RD,WAUCHULA,Hardee,0,0,0,0,11,4,0,0
WESTMINSTER POINT PLEASANT,106030,1533 4TH AVE W,BRADENTON,Manatee,30,0,18,0,105,7,0,0
CYPRESS CARE CENTER,105649,490 S OLD WIRE RD,WILDWOOD,Sumter,25,1,18,4,136,46,11,0
TARPON POINT NURSING AND REHABILITATION CENTER,105702,5157 PARK CLUB DRIVE,SARASOTA,Sarasota,61,28,25,20,93,31,9,0
LIFE CARE CENTER OF PALM BAY,106060,175 VILLA NUEVA AVE,PALM BAY,Brevard,0,0,27,0,120,11,2,0
PARKLANDS CARE CENTER,105638,1000 SW 16TH AVE,GAINESVILLE,Alachua,44,5,20,7,108,24,0,0
SAVANNAH COVE OF THE PALM BEACHES,105875,2090 N CONGRESS AVE,WEST PALM BEACH,Palm Beach,0,0,5,0,28,0,0,0
CONSULATE HEALTH CARE OF ORANGE PARK,105653,1215 KINGSLEY AVE,ORANGE PARK,Clay,13,0,2,1,104,26,0,0
PALM GARDEN OF LARGO,105574,10500 STARKEY RD,LARGO,Pinellas,14,0,18,2,136,13,1,0
MARION AND BERNARD L SAMSON NURSING CENTER,105504,255 59TH ST N,SAINT PETERSBURG,Pinellas,30,2,16,2,129,75,2,0
REHABILITATION CENTER AT PARK PLACE,105628,1717 W AVERY ST,PENSACOLA,Escambia,57,33,21,16,82,22,28,0
WRIGHTS HEALTHCARE AND REHABILITATION CENTER,105849,11300 110TH AVE N,SEMINOLE,Pinellas,1,7,0,0,44,2,2,0
WESTMINSTER WOODS ON JULINGTON CREEK,105901,25 STATE ROAD 13,JACKSONVILLE,St. Johns,1,1,1,1,47,22,0,0
THE GARDENS AT DEPUGH,105785,550 W MORSE BLVD,WINTER PARK,Orange,0,0,4,0,33,0,0,0
HARBOR BEACH NURSING AND REHABILITATION CENTER,105578,1615 MIAMI RD,FORT LAUDERDALE,Broward,0,0,2,0,51,9,0,0
SAVANNAH COVE,105886,1301 W MAITLAND BLVD,MAITLAND,Orange,3,1,3,0,38,9,0,0
ADVENTHEALTH CARE CENTER ORLANDO EAST,105783,250 SOUTH CHICKASAW TRAIL,ORLANDO,Orange,38,0,27,1,86,66,29,0
"CATHEDRAL GERONTOLOGY CENTER, INC",105834,333 E ASHLEY ST,JACKSONVILLE,Duval,17,2,10,0,96,16,1,0
CONSULATE HEALTH CARE OF JACKSONVILLE,105917,4101 SOUTHPOINT DRIVE EAST,JACKSONVILLE,Duval,2,0,0,0,103,27,0,0
SANDY RIDGE CENTER FOR REHABILITATION AND HEALING,105552,5360 GLOVER LANE,MILTON,Santa Rosa,17,9,5,0,47,17,1,0
SUNNYSIDE NURSING HOME,106053,5201 BAHIA VISTA STREET,SARASOTA,Sarasota,0,0,4,0,48,4,2,0
TAYLOR CARE CENTER,105821,6535 CHESTER AVENUE,JACKSONVILLE,Duval,40,31,30,16,66,45,11,0
PARK RIDGE NURSING CENTER,105813,730 COLLEGE STREET,JACKSONVILLE,Duval,89,12,20,16,63,60,25,1
LAFAYETTE NURSING AND REHABILITATION CENTER,105963,512 W MAIN ST,MAYO,Lafayette,33,1,14,5,41,39,3,0
CONSULATE HEALTH CARE OF WINTER HAVEN,105998,2701 LAKE ALFRED RD,WINTER HAVEN,Polk,53,7,21,10,78,40,9,0
BOYNTON BEACH REHABILITATION CENTER,105837,9600 LAWRENCE RD,BOYNTON BEACH,Palm Beach,9,0,13,1,123,27,0,0
PORT CHARLOTTE REHABILITATION CENTER,105524,25325 RAMPART BLVD,PORT CHARLOTTE,Charlotte,,,,,,,,
RULEME CENTER,105855,2810 RULEME ST,EUSTIS,Lake,22,18,4,3,67,23,23,0
"MIRACLE HILL NURSING & REHABILITATION CENTER, INC",105810,1329 ABRAHAM STREET,TALLAHASSEE,Leon,42,4,16,3,77,39,0,0
TERRA VISTA REHAB AND HEALTH CENTER,105546,1730 LUCERNE TERRACE,ORLANDO,Orange,39,2,6,2,71,41,0,0
CARRINGTON PLACE OF ST PETE,105616,10501 ROOSEVELT BLVD N,SAINT PETERSBURG,Pinellas,,,,,,,,
MANATEE SPRINGS REHABILITATION AND NURSING CENTER,105525,5627 9TH ST E,BRADENTON,Manatee,58,0,23,14,112,42,4,0
TIFFANY HALL NURSING AND REHAB CENTER,105819,1800 SE HILLMOOR DRIVE,PORT SAINT LUCIE,St. Lucie,77,0,11,3,68,35,2,0
RIVIERA PALMS REHABILITATION CENTER,105603,926 HABEN BLVD,PALMETTO,Manatee,3,0,15,0,80,1,0,0
CONWAY LAKES HEALTH & REHABILITATION CENTER,105754,5201 CURRY FORD ROAD,ORLANDO,Orange,33,28,5,3,95,58,22,1
TERRACE HEALTH & REHABILITATION CENTER,106046,7207 SW 24TH AVE,GAINESVILLE,Alachua,4,0,4,0,124,19,3,0
PALM GARDEN OF WINTER HAVEN,105566,1120 CYPRESS GARDENS BLVD,WINTER HAVEN,Polk,14,0,33,6,95,19,1,0
MARGATE HEALTH AND REHABILITATION CENTER,105505,5951 COLONIAL DRIVE,MARGATE,Broward,46,0,28,9,147,20,0,0
CROSS LANDINGS HEALTH AND REHABILITATION CENTER,105802,1780 N JEFFERSON ST,MONTICELLO,Jefferson,1,0,2,0,32,19,0,0
DEERFIELD BEACH HEALTH AND REHABILITATION CENTER,105622,401 EAST SAMPLE ROAD,POMPANO BEACH,Broward,27,60,4,2,184,61,5,0
HIGHLANDS LAKE CENTER,105620,4240 LAKELAND HIGHLANDS RD,LAKELAND,Polk,7,7,14,5,73,8,12,0
ROYAL OAKS NURSING AND REHAB CENTER,105793,2225 KNOX MCRAE DR,TITUSVILLE,Brevard,0,0,1,0,109,7,0,0
PAGE REHABILITATION AND HEALTHCARE CENTER,105864,2310 N AIRPORT ROAD,FORT MYERS,Lee,69,39,31,14,143,38,73,0
SIGNATURE HEALTHCARE OF GAINESVILLE,105664,4000 SW 20TH AVE,GAINESVILLE,Alachua,2,0,0,0,80,16,15,0
ENCORE AT BOCA RATON REHABILITATION AND NURSING CE,105506,7300 DEL PRADO CIRCLE SOUTH,BOCA RATON,Palm Beach,48,13,19,8,99,34,1,0
BISHOPS GLEN RETIREMENT CENTER,105526,900 LPGA BLVD,HOLLY HILL,Volusia,22,0,0,0,31,13,0,0
HARBOURS EDGE,105598,401 E LINTON BLVD,DELRAY BEACH,Palm Beach,2,0,8,0,51,5,3,0
BROOKDALE PALMER RANCH SNF,106022,5111 PALMER RANCH PARKWAY,SARASOTA,Sarasota,1,5,4,0,52,12,7,0
HEARTLAND HEALTH CARE CENTER ORANGE PARK,105692,570 WELLS RD,ORANGE PARK,Clay,8,2,3,0,86,10,8,0
BAY VUE NURSING AND REHABILITATION CENTER,105551,105 15TH ST E,BRADENTON,Manatee,0,0,10,0,91,7,0,0
REGENTS PARK AT AVENTURA,105596,18905 NE 25TH AVE,AVENTURA,Miami-Dade,40,3,18,5,148,77,0,0
EDGEWOOD NURSING CENTER,105826,1771 EDGEWOOD AVE W,JACKSONVILLE,Duval,16,0,12,5,47,24,0,0
CONSULATE HEALTH CARE OF MELBOURNE,105861,3033 SARNO RD,MELBOURNE,Brevard,41,22,48,12,132,52,2,0
"HOME ASSOCIATION, THE",105725,1203 E 22ND AVE,TAMPA,Hillsborough,10,0,1,1,74,20,11,0
HERITAGE PARK CARE AND REHABILITATION CENTER,105529,2302 59TH ST W,BRADENTON,Manatee,50,0,17,6,94,32,0,0
"LODGE AT CYPRESS COVE, THE",106019,10500 CYPRESS COVE DR,FORT MYERS,Lee,1,0,16,1,53,19,1,0
EAST RIDGE RETIREMENT VILLAGE INC,105508,19225 SW 87TH AVE,CUTLER BAY,Miami-Dade,4,1,2,0,61,10,1,0
BAYSHORE POINTE NURSING AND REHAB CENTER,105650,3117 W GANDY BLVD,TAMPA,Hillsborough,11,0,12,4,85,24,0,0
SHELL POINT NURSING PAVILION,105966,15071 SHELL POINT BLVD,FORT MYERS,Lee,1,0,34,1,126,24,3,0
SUNSET LAKE HEALTH AND REHABILITATION CENTER,105761,832 SUNSET LAKE BOULEVARD,VENICE,Sarasota,3,6,2,0,100,27,7,0
DELANEY PARK HEALTH AND REHABILITATION CENTER,105791,215 ANNIE STREET,ORLANDO,Orange,5,26,2,1,77,20,5,1
METRO WEST NURSING AND REHAB CENTER,105868,5900 WESTGATE DRIVE,ORLANDO,Orange,2,0,14,0,86,10,2,0
HUNTERS CREEK NURSING AND REHAB CENTER,105987,14155 TOWN LOOP BLVD,ORLANDO,Orange,30,0,6,5,85,11,0,0
SOLARIS HEALTHCARE MERRITT ISLAND,105701,500 CROCKETT BLVD,MERRITT ISLAND,Brevard,17,3,27,0,153,27,10,0
WESTMINSTER TOWERS,105757,70 WEST LUCERNE CIRCLE,ORLANDO,Orange,0,0,0,0,109,56,0,0
SALERNO BAY HEALTH AND REHABILITATION CENTER,105509,4801 SE COVE RD,STUART,Martin,20,17,19,4,99,25,9,0
INDIAN RIVER CENTER,105673,7201 GREENBORO DR,WEST MELBOURNE,Brevard,3,0,12,0,144,11,3,0
WEDGEWOOD HEALTHCARE CENTER,106002,1010 CARPENTERS WAY,LAKELAND,Polk,9,10,0,0,94,16,10,0
LAKE MARY HEALTH AND REHABILITATION CENTER,106029,710 NORTH SUN DRIVE,LAKE MARY,Seminole,30,1,0,0,101,75,4,0
VISTA MANOR,105530,1550 JESS PARRISH CT,TITUSVILLE,Brevard,0,0,0,0,89,3,0,0
EVANS HEALTH CARE,106000,3735 EVANS AVE,FORT MYERS,Lee,22,1,10,7,100,9,0,0
SOUTHERN OAKS CARE CENTER,106051,600 W GREGORY ST,PENSACOLA,Escambia,95,0,18,6,167,27,3,0
ABBEY REHABILITATION AND NURSING CENTER,105749,7101 DR MARTIN LUTHER KING JR ST N,SAINT PETERSBURG,Pinellas,18,3,1,0,117,35,11,0
ORLANDO HEALTH AND REHABILITATION CENTER,105728,830 WEST 29TH STREET,ORLANDO,Orange,137,73,25,2,313,78,14,0
GANDY CROSSING CARE CENTER,105491,4610 S MANHATTAN AVE,TAMPA,Hillsborough,53,12,6,3,116,38,15,0
ISLAND LAKE CENTER,105643,155 LANDOVER PLACE,LONGWOOD,Seminole,2,0,2,1,92,10,9,0
PALM GARDEN OF PORT SAINT LUCIE,105600,1751 SE HILLMOOR DRIVE,PORT SAINT LUCIE,St. Lucie,20,1,7,3,89,27,1,0
VIERA HEALTH AND REHABILITATION CENTER,105885,8050 SPYGLASS HILL RD,VIERA,Brevard,29,6,20,7,108,31,10,0
HEARTLAND HEALTH CARE CENTER FORT MYERS,105723,1600 MATTHEW DRIVE,FORT MYERS,Lee,35,31,11,5,79,34,6,0
OCOEE HEALTH CARE CENTER,105706,1556 MAGUIRE RD,OCOEE,Orange,67,36,20,10,65,78,31,0
CHIPOLA HEALTH AND REHABILITATION CENTER,105729,4294 3RD AVENUE,MARIANNA,Jackson,5,8,4,1,52,8,5,0
"TERRACE OF KISSIMMEE, THE",105839,221 PARK PLACE BLVD,KISSIMMEE,Osceola,8,2,10,2,111,35,3,0
ARCADIA HEALTH & REHABILITATION CENTER,105532,10095 HILLVIEW ROAD,PENSACOLA,Escambia,22,4,15,1,115,40,0,0
BENTLEY CARE CENTER,106062,875 RETREAT DRIVE,NAPLES,Collier,12,5,7,6,52,17,11,0
FREEDOM SQUARE HEALTH CARE CENTER,106042,10801 JOHNSON BLVD,SEMINOLE,Pinellas,0,5,9,3,86,6,10,2
FOURAKER HILLS REHAB AND NURSING CENTER,105707,1650 FOURAKER RD,JACKSONVILLE,Duval,57,28,11,5,79,32,4,0
JUPITER REHABILITATION AND HEALTHCARE CENTER,105555,17781 THELMA AVE,JUPITER,Palm Beach,101,9,39,15,81,69,41,0
WESTMINSTER WINTER PARK,105879,1111 S LAKEMONT AVE,WINTER PARK,Orange,0,0,0,0,65,58,0,0
ISLE HEALTH & REHABILITATION CENTER,106065,1125 FLEMING PLANTATION BLVD,ORANGE PARK,Clay,4,2,14,2,102,16,2,0
LIFE CARE CENTER OF HILLIARD,105756,3756 W THIRD ST,HILLIARD,Nassau,48,9,0,0,87,37,0,0
LANIER REHABILITATION CENTER,105666,12740 LANIER ROAD,JACKSONVILLE,Duval,3,0,15,1,97,5,0,0
OAKTREE HEALTHCARE,105665,650 REED CANAL RD,SOUTH DAYTONA,Volusia,0,0,1,0,58,5,1,0
SIGNATURE HEALTHCARE OF BROOKWOOD GARDENS,105550,1990 S CANAL DRIVE,HOMESTEAD,Miami-Dade,91,41,25,15,103,53,18,0
PALM GARDEN OF GAINESVILLE,105571,227 SW 62ND BLVD,GAINESVILLE,Alachua,2,14,9,0,133,25,16,0
