Provider Name,Federal Provider Number,Provider Address,Provider City,County,Residents Total Confirmed COVID-19,Residents Total Suspected COVID-19,Residents Total All Deaths,Residents Total COVID-19 Deaths,Total Number of Occupied Beds,Staff Total Confirmed COVID-19,Staff Total Suspected COVID-19,Staff Total COVID-19 Deaths
CAROLINA RIVERS NURSING AND REHABILITATION CENTER,345072,1839 ONSLOW DRIVE EXTENSION,JACKSONVILLE,Onslow,1,0,7,0,79,1,0,0
"ACCORDIUS HEALTH AT GREENSBORO, LLC",345014,1201 CAROLINA STREET,GREENSBORO,Guilford,0,0,1,0,77,0,1,0
THE FOLEY CENTER AT CHESTNUT RIDGE,345045,621 CHESTNUT RIDGE PARKWAY,BLOWING ROCK,Watauga,0,29,8,0,70,0,25,0
CLAPP'S CONVALESCENT NURSING HOME INC,345015,500 MOUNTAIN TOP DRIVE,ASHEBORO,Randolph,0,0,3,0,76,3,2,0
SUNNYBROOK REHABILITATION CENTER,345077,25 SUNNYBROOK ROAD,RALEIGH,Wake,3,1,8,3,63,1,4,0
HIGHLAND FARMS,345078,200 TABERNACLE ROAD,BLACK MOUNTAIN,Buncombe,0,0,2,0,63,0,9,0
WHITE OAK MANOR - TRYON,345127,70 OAK STREET,TRYON,Polk,0,16,2,0,52,6,3,0
BRIAN CENTER HEALTH & REHAB HICKORY VIEWMONT,345080,220 13TH AVENUE PLACE NW,HICKORY,Catawba,43,4,17,9,63,10,0,0
CLAPPS NURSING CENTER INC,345024,5229 APPOMATTOX ROAD,PLEASANT GARDEN,Guilford,75,6,27,22,59,43,1,0
ALSTON BROOK,345066,4748 OLD SALISBURY ROAD,LEXINGTON,Davidson,44,5,25,17,69,20,22,0
ACCORDIUS HEALTH AT ASHEVILLE,345010,500 BEAVERDAM ROAD,ASHEVILLE,Buncombe,0,1,0,0,61,0,7,0
RALEIGH REHABILITATION CENTER,345049,616 WADE AVENUE,RALEIGH,Wake,2,0,7,0,98,3,0,0
ST JOSEPH OF THE PINES HEALTH CENTER,345044,103 GOSSMAN DRIVE,PINEHURST,Moore,0,14,8,0,96,2,13,0
PEAK RESOURCES - CHARLOTTE,345013,3223 CENTRAL AVENUE,CHARLOTTE,Mecklenburg,88,16,35,26,91,54,2,0
ACCORDIUS HEALTH AT LEXINGTON,345011,279 BRIAN CENTER DRIVE,LEXINGTON,Davidson,0,0,5,0,80,0,0,0
DURHAM NURSING & REHABILITATION CENTER,345070,411 S LASALLE STREET,DURHAM,Durham,0,0,4,3,75,0,0,0
HILLCREST CONVALESCENT CENTER,345001,1417 W PETTIGREW STREET,DURHAM,Durham,0,0,7,0,131,0,0,0
THE OAKS AT WHITAKER GLEN-MAYVIEW,345009,513 EAST WHITAKER MILL ROAD,RALEIGH,Wake,0,0,3,0,107,3,0,0
JACOB'S CREEK NURSING AND REHABILITATION CENTER,345050,1721 BALD HILL LOOP,MADISON,Rockingham,1,0,5,0,144,1,0,0
CYPRESS POINTE REHABILITATION CENTER,345002,2006 SOUTH 16TH STREET,WILMINGTON,New Hanover,2,1,1,0,76,2,0,0
PERSON MEMORIAL HOSPITAL,345004,615 RIDGE ROAD,ROXBORO,Person,0,0,4,0,54,3,0,0
AUTUMN CARE OF BISCOE,345000,401 LAMBERT ROAD,BISCOE,Montgomery,7,0,0,0,101,8,0,0
SILAS CREEK REHABILITATION CENTER,345003,3350 SILAS CREEK PARKWAY,WINSTON-SALEM,Forsyth,11,1,1,1,71,10,0,0
PETTIGREW REHABILITATION CENTER,345053,1515 W PETTIGREW STREET,DURHAM,Durham,1,0,0,0,65,1,0,0
BLUMENTHAL NURSING & REHABILITATION CENTER,345006,3724 WIRELESS DRIVE,GREENSBORO,Guilford,0,7,34,0,113,2,0,0
THE LAURELS OF PENDER,345298,311 S CAMPBELL STREET,BURGAW,Pender,0,0,1,0,88,0,0,0
WOODHAVEN NURS & ALZHEIMER'S C,345054,1150 PINE RUN DRIVE,LUMBERTON,Robeson,25,1,12,8,84,11,3,0
ANSON HEALTH AND REHABILITATION,345051,405 SOUTH GREENE STREET,WADESBORO,Anson,1,3,0,0,85,0,3,0
ELIZABETH CITY HEALTH AND REHABILITATION,345036,1075 US HIGHWAY 17 SOUTH,ELIZABETH CITY,Pasquotank,37,0,15,14,109,19,0,0
ROYAL PARK REHAB & HEALTH CTR OF MATTHEWS,345026,2700 ROYAL COMMONS LANE,MATTHEWS,Mecklenburg,74,50,14,14,99,23,10,0
"THE CITADEL AT MYERS PARK, LLC",345008,300 PROVIDENCE ROAD,CHARLOTTE,Mecklenburg,0,2,0,0,76,0,2,0
ACCORDIUS HEALTH AT WILSON,345063,1804 FOREST HILLS ROAD W,WILSON,Wilson,0,0,0,0,66,0,0,0
SUMMERSTONE HEALTH AND REHABILITATION CENTER,345039,485 VETERANS WAY,KERNERSVILLE,Forsyth,0,0,8,1,85,3,9,0
PRUITTHEALTH-DURHAM,345061,3100 ERWIN ROAD,DURHAM,Durham,1,0,0,0,111,0,0,0
MOUNTAIN RIDGE HEALTH AND REHAB,345048,611 OLD US HIGHWAY 70 EAST,BLACK MOUNTAIN,Buncombe,2,2,1,0,88,0,4,0
WILKESBORO HEALTH AND REHABILITATION,345401,204 OLD BRICKYARD ROAD,NORTH WILKESBORO,Wilkes,3,11,14,0,109,2,5,0
BLUE RIDGE HEALTH AND REHABILITATION CENTER,345223,1510 HEBRON STREET,HENDERSONVILLE,Henderson,1,0,9,0,77,2,0,0
ASTON PARK HEALTH CARE CENTER,345198,380 BREVARD ROAD,ASHEVILLE,Buncombe,83,26,53,26,66,53,28,0
WILORA LAKE HEALTHCARE CENTER,345473,6001 WILORA LAKE ROAD,CHARLOTTE,Mecklenburg,5,0,4,2,55,13,0,0
PELICAN HEALTH THOMASVILLE,345520,1028 BLAIR STREET,THOMASVILLE,Davidson,0,0,2,0,78,0,1,0
WOODLAND HILL CENTER,345277,400 VISION DRIVE,ASHEBORO,Randolph,39,3,15,5,71,16,5,0
LOUISBURG HEALTHCARE & REHABILITATION CENTER,345358,202 SMOKETREE WAY,LOUISBURG,Franklin,1,1,4,1,40,0,1,0
ACCORDIUS HEALTH AT ROSE MANOR LLC,345081,4230 NORTH ROXBORO STREET,DURHAM,Durham,0,0,1,0,83,0,0,0
TRINITY GROVE,345554,631 JUNCTION CREEK DRIVE,WILMINGTON,New Hanover,1,7,6,0,93,0,16,0
BRIAN CENTER HEALTH AND REHABILITATION/GOLDSBORO,345343,1700 WAYNE MEMORIAL DRIVE,GOLDSBORO,Wayne,0,0,15,0,98,0,0,0
UNC REX REHAB & NURSING CARE CENTER OF APEX,345508,911 SOUTH HUGHES STREET,APEX,Wake,20,21,6,4,80,12,1,0
MAGNOLIA LANE NURSING AND REHABILITATION CENTER,345219,107 MAGNOLIA DRIVE,MORGANTON,Burke,0,0,0,0,48,0,0,0
SIGNATURE HEALTHCARE OF ROANOKE RAPIDS,345336,305 FOURTEENTH STREET,ROANOKE RAPIDS,Halifax,0,0,0,0,84,7,0,0
GLENAIRE,345445,4000 GLENAIRE CIRCLE,CARY,Wake,1,1,0,0,64,4,16,0
ARBOR ACRES UNITED METHODIST RETIREMENT COMMUNITY,345573,1250 ARBOR ROAD,WINSTON SALEM,Forsyth,0,0,0,0,74,1,0,0
AUTUMN CARE OF NASH,345514,1210 EASTERN AVENUE,NASHVILLE,Nash,0,13,3,0,69,1,1,0
TRINITY ELMS,345565,7449 FAIR OAKS DRIVE,CLEMMONS,Forsyth,0,0,7,0,86,0,0,0
EMERALD HEALTH & REHAB CENTER,345173,54 RED MULBERRY WAY,LILLINGTON,Harnett,1,25,3,0,81,1,6,0
THE LAURELS OF CHATHAM,345421,72 CHATHAM BUSINESS PARK,PITTSBORO,Chatham,4,27,12,4,94,3,2,0
COUNTRYSIDE,345390,7700 US 158 EAST,STOKESDALE,Guilford,0,2,2,0,54,0,0,0
TRINITY OAKS,345153,820 KLUMAC ROAD,SALISBURY,Rowan,0,16,9,0,97,1,8,0
FRANKLIN OAKS NURSING AND REHABILITATION CENTER,345335,1704 NC HIGHWAY 39 N,LOUISBURG,Franklin,0,0,10,0,115,4,0,0
CITADEL ELIZABETH CITY LLC,345184,901 SOUTH HALSTEAD BOULEVARD,ELIZABETH CITY,Pasquotank,0,0,1,0,79,0,15,0
HICKORY FALLS HEALTH AND REHABILITATION,345246,100 SUNSET STREET,GRANITE FALLS,Caldwell,0,0,0,0,115,3,0,0
WADESBORO HEALTH & REHAB CENTER,345392,2051 COUNTRY CLUB ROAD,WADESBORO,Anson,1,15,6,0,57,5,5,0
REX REHAB & NSG CARE CENTER,345369,4420 LAKE BOONE TRAIL,RALEIGH,Wake,13,25,4,2,67,14,24,0
VALLEY NURSING CENTER,345247,581 NC HIGHWAY 16 SOUTH,TAYLORSVILLE,Alexander,0,10,4,0,92,1,0,0
COURTLAND TERRACE,345350,2300 ABERDEEN BOULEVARD,GASTONIA,Gaston,0,0,0,0,87,2,0,0
BRANTWOOD NH & RETIREMENT CENT,345412,1038 COLLEGE STREET,OXFORD,Granville,1,0,2,0,58,6,0,0
CLEAR CREEK NURSING & REHABILITATION CENTER,345562,10506 CLEAR CREEK COMMERCE DRIVE,MINT HILL,Mecklenburg,,,,,,,,
EMERALD RIDGE REHAB AND CARE CENTER,345447,25 REYNOLDS MOUNTAIN BOULEVARD,ASHEVILLE,Buncombe,0,0,4,0,92,0,4,0
KINDRED HOSPITAL EAST GREENSBORO,345273,2401 SOUTH SIDE BOULEVARD,GREENSBORO,Guilford,0,0,0,0,16,2,0,0
LITCHFORD FALLS HEALTHCARE,345499,8200 LITCHFORD ROAD,RALEIGH,Wake,51,25,6,2,71,58,4,0
SHAIRE NURSING CENTER,345483,1450 SHAIRE CENTER DRIVE,LENOIR,Caldwell,0,0,1,0,36,1,0,0
LENOIR HEALTHCARE CENTER,345138,322 NUWAY CIRCLE,LENOIR,Caldwell,0,14,21,0,91,0,3,0
WELLINGTON REHABILITATION AND HEALTHCARE,345436,1000 TANDAL PLACE,KNIGHTDALE,Wake,40,0,14,13,43,40,1,1
CROSS CREEK HEALTH CARE,345407,1719 QUARTER ROAD,SWANQUARTER,Hyde,0,5,0,0,31,0,0,0
GLENBRIDGE HEALTH AND REHABILTATION CENTER,345163,211 MILTON BROWN HEIRS ROAD,BOONE,Watauga,0,0,2,0,77,0,0,0
ELDERBERRY HEALTH CARE,345319,415 ELDERBERRY LANE,MARSHALL,Madison,0,0,1,0,98,0,0,0
BRIAN CTR HEALTH & REHAB/SPRUCE PINES,345270,218 LAUREL CREEK COURT,SPRUCE PINE,Mitchell,0,0,21,0,84,2,0,0
SMITHFIELD MANOR NURSING AND REHAB,345175,902 BERKSHIRE ROAD,SMITHFIELD,Johnston,0,0,0,0,121,3,0,0
CURRITUCK HEALTH & REHAB CENTER,345289,3907 CARATOKE HIGHWAY,BARCO,Currituck,0,0,8,0,57,0,0,0
PARKVIEW HEALTH & REHAB CENTER,345576,1716 LEGION ROAD,CHAPEL HILL,Durham,2,1,0,0,63,3,1,0
ACCORDIUS HEALTH AT SCOTLAND MANOR,345375,920 JR HIGH SCHOOL ROAD,SCOTLAND NECK,Halifax,0,0,0,0,43,0,0,0
PRUITTHEATH-FARMVILLE,345384,4351 SOUTH MAIN STREET,FARMVILLE,Pitt,0,0,0,0,49,6,0,0
SIGNATURE HEALTHCARE OF CHAPEL HILL,345225,1602 E FRANKLIN STREET,CHAPEL HILL,Orange,3,1,21,18,63,2,0,0
CONOVER NURSING AND REHAB CTR,345516,920 4TH STREET SOUTHWEST,CONOVER,Catawba,0,0,3,0,75,1,1,0
"ACCORDIUS HEALTH AT MIDWOOD, LLC",345304,2727 SHAMROCK DRIVE,CHARLOTTE,Mecklenburg,0,0,1,0,63,2,1,0
THREE RIVERS HEALTH AND REHAB,345404,1403 CONNER DRIVE,WINDSOR,Bertie,1,0,1,0,43,0,3,0
HARMONY HALL NURSING AND REHABILITATION CENTER,345156,312 WARREN AVENUE,KINSTON,Lenoir,0,0,6,0,106,9,0,0
GATEWAY REHABILITATION AND HEALTHCARE,345329,2030 HARPER AVENUE NW,LENOIR,Caldwell,0,0,0,0,86,1,0,0
TSALI CARE CENTER,345475,55 ECHOTA CHURCH ROAD,CHEROKEE,Swain,0,1,4,0,47,0,0,0
HUNTER HILLS NURSING AND REHABILITATION CENTER,345279,7369 HUNTER HILL ROAD,ROCKY MOUNT,Nash,2,0,18,0,119,0,0,0
BERMUDA COMMONS NURSING AND REHABILITATION CENTER,345543,316 NC HIGHWAY 801 SOUTH,ADVANCE,Davie,1,12,0,0,79,1,4,0
AUTUMN CARE OF FAYETTEVILLE,345553,1401 71ST SCHOOL ROAD,FAYETTEVILLE,Cumberland,0,53,5,0,77,2,8,0
SCOTIA VILLAGE-SNF,345297,2200 ELM DRIVE,LAURINBURG,Scotland,0,0,3,0,51,2,3,0
LAKE PARK NURSING AND REHABILITATION CENTER,345502,3315 FAITH CHURCH ROAD,INDIAN TRAIL,Union,0,0,2,0,79,1,0,0
LIFE CARE CENTER OF BANNER ELK,345203,185 NORWOOD HOLLOW ROAD,BANNER ELK,Avery,0,0,8,0,69,0,0,0
MARYFIELD NURSING HOME,345093,1315 GREENSBORO ROAD,HIGH POINT,Guilford,0,0,8,0,112,2,0,0
IREDELL MEMORIAL HOSPITAL INC,345306,557 BROOKDALE DRIVE,STATESVILLE,Iredell,0,0,5,0,24,0,2,0
WILSON REHABILITATION AND NURSING CENTER,345423,1705 SOUTH TARBORO STREET,WILSON,Wilson,32,1,9,9,47,24,3,0
BELAIRE HEALTH CARE CENTER,345457,2065 LYON STREET,GASTONIA,Gaston,1,8,8,0,72,0,13,0
UNIVERSAL HEALTH CARE / GREENVILLE,345181,2578 WEST FIFTH STREET,GREENVILLE,Pitt,1,24,33,0,99,0,4,0
THE OAKS AT SWEETEN CREEK,345477,3864 SWEETEN CREEK ROAD,ARDEN,Buncombe,0,0,0,0,82,0,2,0
WILLOWBROOKE COURT SC CTR AT TRYON ESTATES,345459,619 LAUREL LAKE DRIVE,COLUMBUS,Polk,1,0,1,0,37,0,0,0
BERMUDA VILLAGE RETIREMENT CENTER,345416,142 BERMUDA VILLAGE DRIVE,BERMUDA RUN,Davie,0,0,0,0,34,0,1,0
ALEXANDRIA PLACE,345441,1770 OAK HOLLOW ROAD,GASTONIA,Gaston,1,0,6,0,84,2,0,0
WILLOWBROOKE COURT SC CTR AT PLANTATION ESTATES,345326,701 PLANTATION ESTATES DRIVE,MATTHEWS,Mecklenburg,0,0,4,0,76,2,0,0
OAK GROVE HEALTH CARE CENTER,345464,518 OLD US HIGHWAY 221,RUTHERFORDTON,Rutherford,0,0,3,0,58,0,3,0
FAIR HAVEN HOME INC,345425,149 FAIR HAVEN DRIVE,BOSTIC,Rutherford,0,0,3,0,25,0,0,0
LIBERTY COMMONS NSG AND REHAB CTR OF LEE COUNTY,345532,310 COMMERCE DRIVE,SANFORD,Lee,0,6,5,0,51,1,5,1
CHATHAM NURSING & REHABILITATION,345095,700 JOHNSTON RIDGE ROAD,ELKIN,Surry,1,5,5,0,76,0,4,0
AZALEA HEALTH & REHAB CENTER,345557,3800 INDEPENDENCE BOULEVARD,WILMINGTON,New Hanover,0,0,4,0,71,1,0,0
DAVIE NURSING AND REHABILITATION CENTER,345129,498 MADISON ROAD,MOCKSVILLE,Davie,0,16,4,0,80,2,3,0
THE LAURELS OF SALISBURY,345428,215 LASH DRIVE,SALISBURY,Rowan,0,0,4,0,54,1,0,0
CAROLINA REHAB CENTER OF CUMBERLAND,345505,4600 CUMBERLAND ROAD,FAYETTEVILLE,Cumberland,1,16,3,0,129,0,1,0
BROOK STONE LIVING CENTER,345394,8990 HIGHWAY 17 SOUTH,POLLOCKSVILLE,Jones,0,0,6,0,52,0,0,0
AUTUMN CARE OF RAEFORD,345280,1206 N FULTON STREET,RAEFORD,Hoke,0,0,5,0,114,0,2,0
PEAK RESOURCES - PINELAKE,345429,801 PINEHURST AVENUE,CARTHAGE,Moore,1,0,16,0,83,0,0,0
ACCORDIUS HEALTH AT CREEKSIDE CARE,345359,604 STOKES STREET EAST,AHOSKIE,Hertford,0,0,0,0,116,4,3,0
NC STATE VETERANS HOME - FAYETTEVILLE,345492,214 COCHRAN AVENUE,FAYETTEVILLE,Cumberland,46,27,31,21,105,12,0,0
HIGHLAND HOUSE REHABILITATION AND HEALTHCARE,345353,1700 PAMALEE DRIVE,FAYETTEVILLE,Cumberland,5,0,3,1,87,5,1,0
THE LODGE AT MILLS RIVER,345253,5593 OLD HAYWOOD ROAD,MILLS RIVER,Henderson,0,1,0,0,42,0,0,0
THE ROSEWOOD HEALTH CENTER,345546,8710 CYPRESS CLUB DRIVE,RALEIGH,Wake,0,0,2,0,34,0,1,0
DAVIS HEALTH CARE CENTER,345160,1011 PORTERS NECK ROAD,WILMINGTON,New Hanover,0,4,0,0,147,4,1,0
PEAK RESOURCES -  GASTONIA,345494,2780 X-RAY DRIVE,GASTONIA,Gaston,0,0,16,0,79,0,0,0
WHITE OAK MANOR - KINGS MOUNTAIN,345151,716 SIPES STREET,KINGS MOUNTAIN,Cleveland,1,1,9,0,123,4,5,0
ACCORDIUS HEALTH AND REHABILITATION,345406,38 CARTERS ROAD,GATESVILLE,Gates,0,0,1,0,50,0,0,0
THE CEDARS OF CHAPEL HILL,345533,101 GREEN CEDAR LANE,CHAPEL HILL,Durham,0,8,9,0,53,3,2,0
THE LAURELS OF GREENTREE RIDGE,345303,70 SWEETEN CREEK ROAD,ASHEVILLE,Buncombe,0,20,5,0,70,2,26,0
PRUITTHEALTH-TRENT,345371,836 HOSPITAL DRIVE,NEW BERN,Craven,2,0,29,0,102,5,0,0
"PEAK RESOURCES-WILMINGTON, INC",345537,2305 SILVER STREAM LANE,WILMINGTON,New Hanover,0,0,0,0,81,2,0,0
UNIVERSAL HEALTH CARE/RAMSEUR,345523,7166 JORDON ROAD,RAMSEUR,Randolph,47,59,195,11,57,19,14,0
HUNTERSVILLE OAKS,345096,12019 VERHOEFF DRIVE,HUNTERSVILLE,Mecklenburg,,,,,,,,
EAST CAROLINA REHAB AND WELLNESS,345377,2575 W 5TH STREET,GREENVILLE,Pitt,32,0,15,12,72,17,0,0
TREYBURN REHABILITATION CENTER,345458,2059 TORREDGE ROAD,DURHAM,Durham,23,6,17,15,64,6,0,0
TRINITY VILLAGE,345152,1265 21 STREET NE,HICKORY,Catawba,0,22,21,0,97,0,35,0
MAPLE GROVE HEALTH AND REHABILITATION CENTER,345448,308 WEST MEADOWVIEW ROAD,GREENSBORO,Guilford,69,39,16,10,77,27,25,0
VILLAGE GREEN HEALTH AND REHABILITATION,345380,1601 PURDUE DRIVE,FAYETTEVILLE,Cumberland,6,0,8,5,103,8,0,0
SALEMTOWNE,345479,1550 BABCOCK DRIVE,WINSTON SALEM,Forsyth,0,23,11,0,75,0,35,0
WARSAW NURSING AND REHABILITATION CENTER,345252,214 LANEFIELD ROAD,WARSAW,Duplin,3,1,0,0,72,2,0,0
WESLEY PINES RETIREMENT COMM,345180,1000 WESLEY PINES ROAD,LUMBERTON,Robeson,1,0,0,0,56,0,0,0
"PEAK RESOURCES - BROOKSHIRE, INC",345439,300 MEADOWLANDS DRIVE,HILLSBOROUGH,Orange,0,0,2,0,63,2,0,0
THE GRAYBRIER NURS & RETIREMENT CT,345330,116 LANE DRIVE,TRINITY,Randolph,0,0,6,0,89,0,1,0
CAROLINA CARE HEALTH AND REHABILITATION,345255,111 HARRILSON STREET,CHERRYVILLE,Gaston,2,2,0,0,100,3,3,0
PRUITTHEALTH-ROCKINGHAM,345378,804 SOUTH LONG DRIVE,ROCKINGHAM,Richmond,0,4,5,0,98,1,3,0
LIBERTY COMMONS N&R ALAMANCE,345496,791 BOONE STATION DRIVE,BURLINGTON,Alamance,0,5,6,0,75,1,0,0
NOVANT HEALTH PRESBYTERIAN MEDICAL CENTER-SNU,345467,200 HAWTHORNE LANE,CHARLOTTE,Mecklenburg,0,0,0,0,0,0,0,0
PRUITTHEALTH-NEUSE,345357,1303 HEALTH DRIVE,NEW BERN,Craven,0,0,3,0,95,0,0,0
JESSE HELMS NURSING CENTER,345097,1411 DOVE STREET,MONROE,Union,1,0,4,0,50,0,0,0
BETHESDA HEALTH CARE FACILITY,345212,3532 DUNN ROAD,EASTOVER,Cumberland,0,0,1,0,72,0,0,0
GRAHAM HEALTHCARE AND REHABILITATION CENTER,345355,811 SNOWBIRD ROAD,ROBBINSVILLE,Graham,0,1,4,0,58,0,2,0
BARBOUR COURT NURSING AND REHABILITATION CENTER,345237,515 BARBOUR ROAD,SMITHFIELD,Johnston,0,0,5,0,129,2,0,0
SMOKY MOUNTAIN HEALTH AND REHABILITATION CENTER,345396,1349 CRABTREE ROAD,WAYNESVILLE,Haywood,1,0,2,0,30,1,0,0
ACCORDIUS HEALTH AT CLEMMONS,345131,3905 CLEMMONS ROAD,CLEMMONS,Davidson,0,0,3,0,0,0,0,0
UNIVERSAL HEALTH CARE/FLETCHER,345522,86 OLD AIRPORT ROAD,FLETCHER,Henderson,0,50,25,0,74,0,37,0
TRANSYLVANIA REGIONAL HOSPITAL,345484,260 HOSPITAL DRIVE,BREVARD,Transylvania,0,0,0,0,2,0,0,0
THE STEWART HEALTH CENTER,345495,6920 MARCHING DUCK DRIVE,CHARLOTTE,Mecklenburg,0,0,0,0,48,2,0,0
WOODBURY WELLNESS CENTER INC,345349,2778 COUNTRY CLUB DRIVE,HAMPSTEAD,Pender,0,0,11,0,99,0,0,0
UNIVERSAL HEALTH CARE LILLINGTON,345213,1995 EAST CORNELIUS HARNETT BOULEVARD,LILLINGTON,Harnett,145,4,37,32,148,34,0,0
CORNERSTONE NURSING AND REHABILITATION CENTER,345325,711 SUSAN TART ROAD,DUNN,Harnett,1,1,6,0,88,1,13,0
BROOKDALE CARRIAGE CLUB PROVIDENCE,345482,5804 OLD PROVIDENCE ROAD,CHARLOTTE,Mecklenburg,0,0,0,0,2,4,4,3
TWIN LAKES COMMUNITY MEMORY CARE,345545,3810 HERITAGE DRIVE,BURLINGTON,Alamance,0,0,0,0,13,0,2,0
PINEY GROVE NURSING AND REHABILITATION CENTER,345354,728 PINEY GROVE ROAD,KERNERSVILLE,Forsyth,4,1,5,0,74,1,1,0
SCOTTISH PINES REHABILITATION AND NURSING CENTER,345383,620 JOHNS ROAD,LAURINBURG,Scotland,0,3,11,0,115,1,2,0
ACCORDIUS HEALTH AT ABERDEEN,345509,915 PEE DEE ROAD,ABERDEEN,Moore,0,0,3,0,82,2,5,0
LONGLEAF NEURO-MEDICAL TREATMENT CENTER,345192,4761 WARD BOULEVARD,WILSON,Wilson,29,48,14,3,124,31,102,0
AUTUMN CARE OF MYRTLE GROVE,345507,5725 CAROLINA BEACH ROAD,WILMINGTON,New Hanover,0,9,12,0,81,1,2,0
MAGGIE VALLEY NURSING AND REHABILITATION,345102,75 FISHER LOOP,MAGGIE VALLEY,Haywood,0,0,0,0,91,0,0,0
INN AT QUAIL HAVEN VILLAGE,345518,155 BLAKE BOULEVARD,PINEHURST,Moore,0,0,1,0,44,0,0,0
CARY HEALTH AND REHABILITATION,345403,6590 TRYON ROAD,CARY,Wake,2,0,2,0,86,6,1,0
ACCORDIUS HEALTH AT STATESVILLE,345128,520 VALLEY STREET,STATESVILLE,Iredell,0,2,0,0,78,0,2,0
TRANSITIONAL HEALTH SERVICES OF KANNAPOLIS,345258,1810 CONCORD LAKE ROAD,KANNAPOLIS,Cabarrus,0,1,0,0,92,5,2,0
ROXBORO HEALTHCARE & REHAB CENTER,345311,901 RIDGE ROAD,ROXBORO,Person,0,9,1,0,108,1,22,0
BROOKRIDGE RETIREMENT COMMUNITY,345209,1199 HAYES FOREST DRIVE,WINSTON-SALEM,Forsyth,0,24,10,0,36,0,71,0
ALPINE HEALTH AND REHABILITATION OF ASHEBORO,345155,230 EAST PRESNELL STREET,ASHEBORO,Randolph,0,4,10,0,116,4,1,0
FRIENDS HOMES WEST,345474,6100 W FRIENDLY AVENUE,GREENSBORO,Guilford,0,0,0,0,18,2,1,0
LIBERTY COMMONS NRSG & REHAB CNTR OF SOUTHPORT LLC,345373,630 FODALE AVENUE,SOUTHPORT,Brunswick,0,4,0,0,79,0,14,0
ACCORDIUS HEALTH AT MOORESVILLE,345179,752 E CENTER AVENUE,MOORESVILLE,Iredell,0,0,0,0,62,0,0,0
AUTUMN CARE OF STATESVILLE,345511,2001 VANHAVEN DRIVE,STATESVILLE,Iredell,0,0,14,0,85,0,0,0
SHARON TOWERS,345564,5100 SHARON ROAD,CHARLOTTE,Mecklenburg,0,0,24,5,6,3,0,0
CLEVELAND PINES,345282,1404 N LAFAYETTE STREET,SHELBY,Cleveland,1,0,1,0,106,1,0,0
LUMBERTON HEALTH AND REHAB CENTER,345234,1555 WILLIS AVENUE,LUMBERTON,Robeson,0,0,15,0,108,2,0,0
CARRINGTON PLACE,345103,600 FULLWOOD LANE,MATTHEWS,Mecklenburg,25,0,7,5,128,9,0,0
THE FOREST AT DUKE INC,345542,2701 PICKETT ROAD,DURHAM,Durham,0,0,15,0,71,0,0,0
LIBERTY COMMONS REHABILITATION CENTER,345468,121 RACINE DRIVE,WILMINGTON,New Hanover,1,5,6,0,69,3,6,0
LINCOLNTON REHABILITATION CENTER,345159,1410 EAST GASTON STREET,LINCOLNTON,Lincoln,1,0,10,0,83,4,4,0
WINDSOR POINT CONTINUING CARE,345500,1221 BROAD STREET,FUQUAY VARINA,Harnett,24,13,5,5,46,8,15,1
BRIAN CENTER HEALTH & REHAB/HERTFORD,345262,1300 DON JUAN ROAD,HERTFORD,Perquimans,0,0,6,0,44,0,0,0
ABBOTTS CREEK CENTER,345333,877 HILL EVERHART ROAD,LEXINGTON,Davidson,0,6,6,0,58,2,7,0
UNIVERSAL HEALTH CARE/FUQUAY-VARINA,345561,410 S JUDD PARKWAY SE,FUQUAY VARINA,Wake,0,25,1,0,96,2,4,0
SATURN NURSING AND REHABILITATION CENTER,345489,1930 WEST SUGAR CREEK ROAD,CHARLOTTE,Mecklenburg,0,15,0,0,102,19,2,0
MAPLE LEAF HEALTH CARE,345340,1101 MAPLE CARE LANE,STATESVILLE,Iredell,0,0,15,0,88,0,0,0
DEER PARK HEALTH & REHABILITATION,345233,306 DEER PARK ROAD,NEBO,McDowell,0,3,0,0,103,4,2,0
CAROLINA PINES AT ASHEVILLE,345174,91 VICTORIA ROAD,ASHEVILLE,Buncombe,0,0,0,0,91,7,0,0
ACCORDIUS HEALTH AT CONCORD,345130,515 LAKE CONCORD ROAD NE,CONCORD,Cabarrus,0,0,2,0,83,0,0,0
WILLOW RIDGE OF NC,345197,237 TRYON ROAD,RUTHERFORDTON,Rutherford,0,11,23,0,113,1,9,0
GRANTSBROOK NURSING AND REHABILITATION CENTER,345292,290 KEEL ROAD,GRANTSBORO,Pamlico,1,0,4,0,77,3,0,0
PELICAN HEALTH AT ASHEVILLE,345418,1984 US HIGHWAY 70,SWANNANOA,Buncombe,0,0,0,0,92,0,0,0
SENIOR CITIZENS HOME,345316,2275 RUIN CREEK ROAD,HENDERSON,Vance,13,0,3,1,87,6,1,0
SKYLAND CARE CENTER,345400,193 ASHEVILLE HIGHWAY,SYLVA,Jackson,0,4,6,0,87,1,14,0
PELICAN HEALTH AT CHARLOTTE,345201,2616 EAST 5TH STREET,CHARLOTTE,Mecklenburg,0,0,0,0,95,0,0,0
THE FOUNTAINS AT THE ALBEMARLE,345242,200 TRADE STREET,TARBORO,Edgecombe,0,5,9,0,22,1,11,0
MECKLENBURG HEALTH & REHABILITATION,345471,2415 SANDY PORTER ROAD,CHARLOTTE,Mecklenburg,0,0,0,0,82,0,0,0
MARY GRAN NURSING CENTER,345218,120 SOUTHWOOD DRIVE,CLINTON,Sampson,0,25,6,0,92,2,12,0
GREENHAVEN HEALTH AND REHABILITATION CENTER,345132,801 GREENHAVEN DRIVE,GREENSBORO,Guilford,0,0,0,0,82,2,0,0
COLLEGE PINES HEALTH AND REHABILITATION,345446,95 LOCUST STREET,CONNELLY SPG,Burke,0,0,0,0,98,0,3,0
PELICAN HEALTH HENDERSON LLC,345344,280 SOUTH  BECKFORD DRIVE,HENDERSON,Vance,1,0,10,9,45,1,0,0
STOKES COUNTY NURSING HOME,345166,1570 NC 8 AND 89 HIGHWAY,DANBURY,Stokes,0,0,3,0,35,2,0,0
CUMBERLAND NURSING AND REHABILITATION CENTER,345376,2461 LEGION ROAD,FAYETTEVILLE,Cumberland,0,0,0,0,0,0,0,0
FORREST OAKES HEALTHCARE CENTER,345442,620 HEATHWOOD DRIVE,ALBEMARLE,Stanly,0,0,4,0,54,3,0,0
WHITE OAK MANOR - BURLINGTON,345301,323 BALDWIN ROAD,BURLINGTON,Alamance,85,88,33,31,69,49,44,0
UNIVERSAL HEALTH CARE/KING,345449,115 WHITE ROAD,KING,Stokes,0,4,0,0,89,1,11,0
RICHMOND PINES HEALTHCARE AND REHABILITATION CENTE,345293,HIGHWAY 177 S BOX 1489,HAMLET,Richmond,0,0,9,0,74,2,0,0
OAK FOREST HEALTH AND REHABILITATION,345443,5680 WINDY HILL DRIVE,WINSTON SALEM,Forsyth,1,27,7,0,144,13,18,0
LIBERTY COMMONS NSG & REHAB  CTR OF ROWAN COUNTY,345503,4412 SOUTH MAIN STREET,SALISBURY,Rowan,6,0,1,0,74,4,0,0
AUTUMN CARE OF DREXEL,345222,307 OAKLAND AVENUE,MORGANTON,Burke,0,15,8,0,105,1,0,0
GRACE HEIGHTS HEALTH & REHABILITATION,345187,109 FOOTHILLS DRIVE,MORGANTON,Burke,5,1,2,1,75,5,0,0
SOUTHWOOD NURSING AND RETIREMENT,345472,180 SOUTHWOOD DRIVE,CLINTON,Sampson,0,4,6,0,63,2,18,0
PINEVILLE REHABILITATION AND LIVING CTR,345415,1010 LAKEVIEW DRIVE,PINEVILLE,Mecklenburg,0,0,6,0,76,0,0,0
"BLADEN EAST HEALTH AND REHAB, LLC",345267,804 S POPLAR STREET,ELIZABETHTOWN,Bladen,0,0,3,0,65,0,6,0
THE IVY AT GASTONIA LLC,345307,4414 WILKINSON BLVD,GASTONIA,Gaston,0,0,6,0,38,0,0,0
THE CITADEL SALISBURY,345286,710 JULIAN ROAD,SALISBURY,Rowan,2,0,6,4,94,0,1,0
HENDERSONVILLE HEALTH AND REHABILITATION,345493,104 COLLEGE DRIVE,FLAT ROCK,Henderson,,,,,,,,
ACCORDIUS HEALTH AT CHARLOTTE,345243,5939 REDDMAN ROAD,CHARLOTTE,Mecklenburg,20,10,6,2,65,10,3,0
HARNETT WOODS NURSING AND REHABILITATION CENTER,345478,604 LUCAS ROAD,DUNN,Harnett,0,0,4,0,79,1,0,0
SILER CITY CENTER,345143,900 W DOLPHIN STREET,SILER CITY,Chatham,88,3,34,18,97,22,2,0
HILLSIDE NURSING CENTER OF WAKE FOREST,345417,968 EAST WAIT AVENUE,WAKE FOREST,Wake,53,13,16,10,105,17,4,0
THE LAURELS OF HENDERSONVILLE,345322,290 CLEAR CREEK ROAD,HENDERSONVILLE,Henderson,27,8,27,24,54,6,0,0
ROANOKE LANDING NURSING AND REHABILITATION CENTER,345266,1084 US 64 EAST,PLYMOUTH,Washington,0,0,0,0,98,0,0,0
THE CITADEL MOORESVILLE,345283,550 GLENWOOD DRIVE,MOORESVILLE,Iredell,1,3,7,0,119,2,1,0
PISGAH MANOR HEALTH CARE CENTER,345393,104 HOLCOMBE COVE ROAD,CANDLER,Buncombe,0,1,6,0,99,1,12,0
WILLOW CREEK NURSING AND REHABILITATION CENTER,345113,2401 WAYNE MEMORIAL DRIVE,GOLDSBORO,Wayne,1,1,0,0,143,7,2,0
LEXINGTON HEALTH CARE CENTER,345419,17 CORNELIA DRIVE,LEXINGTON,Davidson,0,1,5,0,90,0,3,0
SHORELAND HLTH CARE & RETIREME,345397,200 FLOWER-PRIDGEN DRIVE,WHITEVILLE,Columbus,0,0,0,0,0,0,0,0
PEAK RESOURCES-CHERRYVILLE,345395,7615 DALLAS CHERRYVILLE HIGHWAY,CHERRYVILLE,Gaston,8,4,5,0,55,2,2,0
ACCORDIUS HEALTH AT MONROE,345345,204 OLD HIGHWAY 74 EAST,MONROE,Union,0,1,0,0,49,0,0,0
ALAMANCE HEALTH CARE CENTER,345420,1987 HILTON STREET,BURLINGTON,Alamance,0,7,9,0,157,0,6,0
PRUITTHEALTH-UNION POINTE,345566,3510 WEST HIGHWAY 74,MONROE,Union,0,2,19,0,85,3,21,0
PENDER MEMORIAL HOSP SNF,345245,507 E FREMONT STREET,BURGAW,Pender,0,0,3,0,31,0,0,0
AUTUMN CARE OF SALISBURY,345269,1505 BRINGLE FERRY ROAD,SALISBURY,Rowan,1,14,5,0,91,0,3,0
PRUITTHEALTH-TOWN CENTER,345515,6300 ROBERTA ROAD,HARRISBURG,Cabarrus,0,0,13,0,67,2,0,0
CAPITAL NURSING AND REHABILITATION CENTER,345202,3000 HOLSTON LANE,RALEIGH,Wake,15,9,1,0,78,15,3,0
SILVER BLUFF INC,345341,100 SILVER BLUFF DRIVE,CANTON,Haywood,0,0,10,0,124,0,0,0
LIFE CARE CENTER OF HENDERSONV,345463,400 THOMPSON STREET,HENDERSONVILLE,Henderson,0,0,0,0,66,2,0,0
WESTFIELD REHABILITATION AND HEALTH CENTER,345216,3100 TRAMWAY ROAD,SANFORD,Lee,0,4,1,0,59,0,3,0
PELICAN HEALTH REIDSVILLE,345227,543 MAPLE AVENUE,REIDSVILLE,Rockingham,0,0,0,0,91,0,1,0
STANLY MANOR,345281,625 BETHANY CHURCH ROAD,ALBEMARLE,Stanly,1,0,4,0,71,3,1,0
WARREN HILLS NURSING CENTER,345240,864 US HWY 158 BUSINESS WEST,WARRENTON,Warren,0,0,3,0,88,2,7,0
BRIAN CTR HEALTH & REHAB/GASTONIA,345169,969 COX ROAD,GASTONIA,Gaston,1,0,26,0,125,1,0,0
GOLDEN YEARS NURSING HOME,345367,7348 NORTH WEST STREET,FALCON,Cumberland,0,0,0,0,45,1,1,0
HOMESTEAD HILLS,345559,2101 HOMESTEAD HILLS DRIVE,WINSTON SALEM,Forsyth,0,3,0,0,26,0,0,0
MERIDIAN CENTER,345172,707 NORTH ELM STREET,HIGH POINT,Guilford,1,3,11,0,154,0,0,0
SMOKY RIDGE HEALTH & REHABILITATION,345305,310 PENSACOLA ROAD,BURNSVILLE,Yancey,0,0,1,0,85,0,0,0
NC STATE VETERANS HOME-KINSTON,345560,2150 HULL ROAD,KINSTON,Lenoir,2,0,0,1,79,5,0,0
BRIAN CTR HLTH & REHABILITATION WALLACE,345323,647 S RAILROAD STREET BOX 966,WALLACE,Duplin,0,0,8,0,68,0,0,0
ACCORDIUS HEALTH AT RUTHERFORD LLC,345083,188 OSCAR JUSTICE ROAD,RUTHERFORDTON,Rutherford,2,0,3,0,60,7,0,0
WHITE OAK MANOR - CHARLOTTE,345238,4009 CRAIG AVENUE,CHARLOTTE,Mecklenburg,6,22,1,0,139,3,22,1
WHISPERING PINES NURSING & REHAB CENTER,345348,523 COUNTRY CLUB DRIVE,FAYETTEVILLE,Cumberland,0,0,2,0,71,0,3,0
BIG ELM RETIREMENT AND NURSING CENTERS,345342,1285 WEST A STREET,KANNAPOLIS,Rowan,0,0,0,0,105,0,1,0
CARVER LIVING CENTER,345434,303 EAST CARVER STREET,DURHAM,Durham,75,6,20,9,128,28,0,0
THE ARBOR,345539,300 CLYNELISH CLOSE,PITTSBORO,Chatham,0,0,0,0,9,1,1,0
TRINITY GLEN,345088,849 WATERWORKS ROAD,WINSTON-SALEM,Forsyth,1,0,6,0,104,4,0,0
BRIAN CTR HEALTH & REHAB HICKORY,345232,3031 TATE BOULEVARD SE,HICKORY,Catawba,0,0,15,0,123,1,0,0
MACON VALLEY NURSING AND REHABILITATION CENTER,345263,3195 OLD MURPHY ROAD,FRANKLIN,Macon,1,32,1,0,70,4,5,0
ADAMS FARM LIVING & REHABILITATION,345535,5100 MACKAY ROAD,JAMESTOWN,Guilford,6,6,2,1,79,10,9,0
"COMPASS HEALTHCARE AND REHAB HAWFIELDS, INC",345363,2502 S NC 119,MEBANE,Alamance,0,0,1,0,86,7,0,0
BETHANY WOODS NURSING AND REHABILITATION CENTER,345146,33426 OLD SALISBURY ROAD BOX 1250,ALBEMARLE,Stanly,1,0,1,0,122,3,1,0
CAMDEN HEALTH AND REHABILITATION,345547,1 MARITHE COURT,GREENSBORO,Guilford,47,11,11,7,109,20,0,0
