BRADFORD HEIGHTS NURSING & REHABILITATION,185076,950 HIGHPOINT DRIVE,HOPKINSVILLE,Christian,3,0,0,0,90,8,0,0
KINGS DAUGHTERS MEDICAL CENTER,185480,2201 LEXINGTON AVENUE,ASHLAND,Boyd,0,0,0,0,0,0,0,0
SENECA PLACE,185456,3526 DUTCHMANS LANE,LOUISVILLE,Jefferson,0,0,4,0,98,14,1,0
EMERALD TRACE,185481,3802 TURKEYFOOT ROAD,ELSMERE,Kenton,2,4,2,0,48,14,18,0
GLEN RIDGE HEALTH CAMPUS,185461,6415 CALM RIVER WAY,LOUISVILLE,Jefferson,0,0,8,0,42,4,0,0
CLINTON PLACE,185469,106 PADGETT DRIVE,CLINTON,Hickman,1,0,4,0,77,4,0,0
THE WILLOWS AT HAMBURG,185470,2531 OLD ROSEBUD ROAD,LEXINGTON,Fayette,0,0,11,0,61,5,0,0
PAUL E PATTON EASTERN KY VETERANS CENTER,185471,200 VETERANS DRIVE,HAZARD,Perry,9,2,13,1,90,7,7,0
JOSEPH EDDIE BALLARD WESTERN KENTUCKY VETERANS CEN,185472,926 VETERANS DRIVE,HANSON,Hopkins,0,68,19,0,71,2,49,0
THOMSON-HOOD VETERANS CENTER,185473,100 VETERANS DRIVE,WILMORE,Jessamine,9,0,0,0,133,11,2,0
THE WILLOWS AT CITATION,185474,1376 SILVER SPRINGS DRIVE,LEXINGTON,Fayette,0,0,11,0,46,5,0,0
PARK TERRACE HEALTH CAMPUS,185462,9700 STONESTREET ROAD,LOUISVILLE,Jefferson,7,1,18,1,58,9,0,0
THE WILLOWS AT FRITZ FARM,185482,2710 MAN O' WAR BOULEVARD,LEXINGTON,Fayette,10,0,11,4,37,17,0,0
"BEDROCK HC AT GREEN MEADOWS, LLC",185464,310 BOXWOOD RUN ROAD,MOUNT WASHINGTON,Bullitt,45,10,1,0,73,23,14,2
RADCLIFF VETERANS CENTER,185483,100 VETERANS DRIVE,RADCLIFF,Hardin,0,3,5,0,57,5,9,0
WESTPORT PLACE HEALTH CAMPUS,185466,4247 WESTPORT ROAD,LOUISVILLE,Jefferson,6,2,7,3,49,6,0,1
THE SEASONS AT ALEXANDRIA,185484,7341 E ALEXANDRIA PIKE,ALEXANDRIA,Campbell,1,6,17,2,111,3,2,0
BROOKDALE RICHMOND PLACE SNF,185463,2770 PALUMBO DRIVE,LEXINGTON,Fayette,0,0,12,0,78,3,0,0
SANDERS RIDGE HEALTH CAMPUS,185487,119 EAST SANDERS LANE,MOUNT WASHINGTON,Bullitt,,,,,,,,
"BOONESPRING TRANSITIONAL CARE CENTER, LLC",185486,10250 US HWY 42,UNION,Boone,1,0,24,0,120,3,4,0
LANDMARK OF RIVER CITY REHABILITATION AND NURSING,185468,1015 WEST MAGAZINE STREET,LOUISVILLE,Jefferson,,,,,,,,
THE SPRINGS AT STONY BROOK,185485,2200 STONY BROOK DRIVE,LOUISVILLE,Jefferson,1,1,2,0,46,4,0,0
BRECKINRIDGE PLACE,185465,170 SYKES BOULEVARD,MORGANFIELD,Union,0,0,0,0,21,3,0,0
CARDINAL HILL SKILLED REHABILITATION UNIT,185467,2050 VERSAILLES ROAD,LEXINGTON,Fayette,0,0,0,0,26,1,3,0
COLDSPRING TRANSITIONAL CARE CENTER,185476,300 PLAZA DRIVE,COLD SPRING,Campbell,29,0,33,8,117,19,18,0
SIGNATURE HEALTHCARE AT STS MARY & ELIZABETH HOSPI,185477,"1850 BLUEGRASS AVENUE, UNIT 3C",LOUISVILLE,Jefferson,0,0,1,0,21,4,4,0
FOREST SPRINGS HEALTH CAMPUS,185478,4120 WOODED ACRE LANE,LOUISVILLE,Jefferson,4,0,9,0,41,8,0,0
THE HOME PLACE AT MIDWAY,185479,101 SEXTON WAY,MIDWAY,Woodford,0,0,3,0,26,2,0,0
