WINDSOR CARE CENTER,185242,125 STERLING WAY,MOUNT STERLING,Montgomery,30,0,12,2,100,18,0,0
SIGNATURE HEALTHCARE OF ELIZABETHTOWN,185118,1117 WOODLAND DRIVE,ELIZABETHTOWN,Hardin,1,0,0,0,82,6,2,0
PARK TERRACE HEALTH CAMPUS,185462,9700 STONESTREET ROAD,LOUISVILLE,Jefferson,18,1,20,1,61,9,0,0
EMERALD TRACE,185481,3802 TURKEYFOOT ROAD,ELSMERE,Kenton,10,7,2,0,36,21,32,0
THE WILLOWS AT FRITZ FARM,185482,2710 MAN O' WAR BOULEVARD,LEXINGTON,Fayette,10,0,12,4,47,19,0,0
GLEN RIDGE HEALTH CAMPUS,185461,6415 CALM RIVER WAY,LOUISVILLE,Jefferson,1,0,9,0,38,5,0,0
PAUL E PATTON EASTERN KY VETERANS CENTER,185471,200 VETERANS DRIVE,HAZARD,Perry,9,2,15,1,88,7,7,0
THOMSON-HOOD VETERANS CENTER,185473,100 VETERANS DRIVE,WILMORE,Jessamine,87,1,21,19,111,63,5,0
THE WILLOWS AT HAMBURG,185470,2531 OLD ROSEBUD ROAD,LEXINGTON,Fayette,0,0,15,0,61,8,0,0
COLDSPRING TRANSITIONAL CARE CENTER,185476,300 PLAZA DRIVE,COLD SPRING,Campbell,29,0,37,9,120,32,18,0
JOSEPH EDDIE BALLARD WESTERN KENTUCKY VETERANS CEN,185472,926 VETERANS DRIVE,HANSON,Hopkins,0,71,21,0,73,9,72,0
BROOKDALE RICHMOND PLACE SNF,185463,2770 PALUMBO DRIVE,LEXINGTON,Fayette,1,0,14,0,75,14,5,0
THE WILLOWS AT CITATION,185474,1376 SILVER SPRINGS DRIVE,LEXINGTON,Fayette,1,0,15,0,31,7,0,0
CARDINAL HILL SKILLED REHABILITATION UNIT,185467,2050 VERSAILLES ROAD,LEXINGTON,Fayette,1,0,0,0,27,4,3,0
RADCLIFF VETERANS CENTER,185483,100 VETERANS DRIVE,RADCLIFF,Hardin,0,3,5,0,58,13,9,0
THE SEASONS AT ALEXANDRIA,185484,7341 E ALEXANDRIA PIKE,ALEXANDRIA,Campbell,1,7,20,2,107,6,3,0
THE SPRINGS AT STONY BROOK,185485,2200 STONY BROOK DRIVE,LOUISVILLE,Jefferson,10,1,7,1,53,5,0,0
"BEDROCK HC AT GREEN MEADOWS, LLC",185464,310 BOXWOOD RUN ROAD,MOUNT WASHINGTON,Bullitt,54,10,3,2,73,33,14,2
"BOONESPRING TRANSITIONAL CARE CENTER, LLC",185486,10250 US HWY 42,UNION,Boone,2,0,25,0,132,11,4,0
SANDERS RIDGE HEALTH CAMPUS,185487,119 EAST SANDERS LANE,MOUNT WASHINGTON,Bullitt,5,0,0,0,15,0,0,0
BRECKINRIDGE PLACE,185465,170 SYKES BOULEVARD,MORGANFIELD,Union,0,0,0,0,21,7,0,0
WESTPORT PLACE HEALTH CAMPUS,185466,4247 WESTPORT ROAD,LOUISVILLE,Jefferson,6,2,8,3,39,8,0,1
LANDMARK OF RIVER CITY REHABILITATION AND NURSING,185468,1015 WEST MAGAZINE STREET,LOUISVILLE,Jefferson,,,,,,,,
CLINTON PLACE,185469,106 PADGETT DRIVE,CLINTON,Hickman,1,0,9,0,75,10,0,0
SIGNATURE HEALTHCARE AT STS MARY & ELIZABETH HOSPI,185477,"1850 BLUEGRASS AVENUE, UNIT 3C",LOUISVILLE,Jefferson,4,0,1,0,18,11,4,0
FOREST SPRINGS HEALTH CAMPUS,185478,4120 WOODED ACRE LANE,LOUISVILLE,Jefferson,4,0,12,0,38,8,0,0
KINGS DAUGHTERS MEDICAL CENTER,185480,2201 LEXINGTON AVENUE,ASHLAND,Boyd,0,0,0,0,0,0,0,0
SENECA PLACE,185456,3526 DUTCHMANS LANE,LOUISVILLE,Jefferson,41,0,5,1,84,29,1,0
THE HOME PLACE AT MIDWAY,185479,101 SEXTON WAY,MIDWAY,Woodford,1,0,4,0,28,4,1,0
