MANORCARE HEALTH SERVICES WEST PALM BEACH,105911,2300 VILLAGE BLVD,WEST PALM BEACH,Palm Beach,18,26,15,0,74,22,3,0
MEMORIAL MANOR,105668,777 SOUTH DOUGLAS ROAD,PEMBROKE PINES,Broward,2,0,5,0,88,19,0,0
MANORCARE HEALTH SERVICES,106005,16200 JOG ROAD,DELRAY BEACH,Palm Beach,9,7,11,0,87,7,6,0
GARDENS COURT,105921,3803 PGA BOULEVARD,PALM BEACH GARDENS,Palm Beach,20,3,11,7,72,36,2,0
SOLARIS SENIOR LIVING NORTH NAPLES,105790,10949 PARNU STREET,NAPLES,Collier,20,0,10,4,56,16,1,0
BARRINGTON TERRACE OF BOYNTON BEACH,105850,1425 S CONGRESS AVE,BOYNTON BEACH,Palm Beach,5,0,0,0,20,9,0,0
PREMIER PLACE AT THE GLENVIEW,105856,100 GLENVIEW PLACE,NAPLES,Collier,,,,,,,,
JOSEPH L MORSE HEALTH CENTER INC THE,105801,4847 FRED GLADSTONE DRIVE,WEST PALM BEACH,Palm Beach,30,45,73,7,248,80,31,0
SPRING HILL HEALTH AND REHABILITATION CENTER,105996,12170 CORTEZ BLVD,BROOKSVILLE,Hernando,18,22,28,2,86,28,0,0
SUWANNEE VALLEY NURSING CENTER,105825,427 15TH AVENUE NORTHWEST,JASPER,Hamilton,0,0,0,0,53,4,0,0
LIFE CARE CENTER OF CITRUS COUNTY,105870,3325 W JERWAYNE LN,LECANTO,Citrus,8,44,37,0,96,12,15,0
RENAISSANCE HEALTH AND REHABILITATION,105558,5065 WALLIS ROAD,WEST PALM BEACH,Palm Beach,2,0,0,0,106,10,0,0
SPRINGS AT LAKE POINTE WOODS,105567,3280 LAKE POINTE BLVD,SARASOTA,Sarasota,8,0,18,0,79,6,0,0
GLENRIDGE ON PALMER RANCH INC.,106063,7333 SCOTLAND WAY,SARASOTA,Sarasota,0,0,0,0,41,15,0,0
TUSKAWILLA NURSING AND REHAB CENTER,105872,1024 WILLA SPRINGS DR,WINTER SPRINGS,Seminole,3,5,5,0,78,6,2,0
FLORIDA PRESBYTERIAN HOMES INC,105949,909 LAKESIDE AVE,LAKELAND,Polk,7,7,15,4,51,6,1,0
LIFE CARE CENTER OF INVERRARY,106047,4300 ROCK ISLAND ROAD,LAUDERHILL,Broward,22,0,5,5,82,27,0,0
RIVERCHASE HEALTH AND REHABILITATION CENTER,106043,1017 STRONG RD,QUINCY,Gadsden,26,5,7,3,96,32,11,1
MANORCARE HEALTH SERVICES,106020,13881 EAGLE RIDGE DRIVE,FORT MYERS,Lee,33,50,27,9,90,37,21,0
HAWTHORNE HEALTH AND REHAB OF BRANDON,105881,851 WEST LUMSDEN RD,BRANDON,Hillsborough,23,4,17,10,66,24,11,0
NSPIRE HEALTHCARE KENDALL,105641,9400 SW 137TH AVENUE,KENDALL,Miami-Dade,41,5,20,9,101,50,10,0
STRATFORD COURT OF BOCA RATON,105851,6343 VIA DE SONRISA DEL SUR,BOCA RATON,Palm Beach,14,0,9,7,30,10,0,0
HEARTLAND HEALTH CARE & REHABILITATION CENTER,105842,5401 SAWYER RD,SARASOTA,Sarasota,1,22,7,0,87,8,6,0
SOLARIS HEALTHCARE LAKE CITY,105769,560 SW MCFARLANE AVE,LAKE CITY,Columbia,32,30,21,5,96,51,20,0
PONCE PLAZA NURSING & REHABILITATION CENTER,106021,335 SW 12 AVENUE,MIAMI,Miami-Dade,57,1,18,9,117,66,4,0
"ROHR HOME, THE",105823,2120 MARSHALL EDWARDS DR,BARTOW,Polk,2,0,4,0,44,3,11,0
WESTMINSTER SUNCOAST,105926,1095 PINELLAS POINT DR S,SAINT PETERSBURG,Pinellas,17,0,0,0,109,6,0,0
LAKESIDE NURSING AND REHABILITATION CENTER,105980,11411 ARMSDALE ROAD,JACKSONVILLE,Duval,5,6,21,0,104,15,9,0
WESTMINSTER OAKS,105854,4449 MEANDERING WAY,TALLAHASSEE,Leon,14,16,20,1,101,20,12,0
MENORAH HOUSE,105685,9945 CENTRAL PARK BLVD N,BOCA RATON,Palm Beach,25,19,19,9,82,25,3,0
FLORIDA HOSPITAL NORTH PINELLAS,105912,1395 S PINELLAS AVE,TARPON SPRINGS,Pinellas,0,0,0,0,19,5,1,0
REGENTS PARK OF WINTER PARK,105618,558 N SEMORAN BLVD,WINTER PARK,Orange,6,0,12,0,103,18,6,0
SOLARIS HEALTHCARE PLANT CITY,105515,701 N WILDER RD,PLANT CITY,Hillsborough,17,6,6,2,149,20,3,0
FINNISH-AMERICAN VILLAGE,105827,1800 SOUTH DRIVE,LAKE WORTH,Palm Beach,7,3,0,0,44,12,1,0
NSPIRE HEALTHCARE MIAMI LAKES,105709,5725 NW 186 STREET,HIALEAH,Miami-Dade,,,,,,,,
NORTHBROOK CENTER FOR REHABILITATION AND HEALING,105606,575 LAMAR AVE,BROOKSVILLE,Hernando,24,4,22,13,54,23,1,0
SOLARIS HEALTHCARE WINDERMERE,105960,4875 CASON COVE DRIVE,ORLANDO,Orange,10,14,16,2,114,8,1,0
HEALTHCARE AND REHAB OF SANFORD,105539,950 MELLONVILLE AVE,SANFORD,Seminole,31,0,34,6,83,58,5,0
BARTRAM CROSSING,105645,6209 BROOKS BARTRAM DRIVE,JACKSONVILLE,Duval,4,1,3,0,90,21,0,0
LIFE CARE CENTER OF ORLANDO,105974,3211 ROUSE ROAD,ORLANDO,Orange,9,13,13,0,103,11,1,0
ST PETERSBURG NURSING & REHABILITATION,106033,521 69TH AVE N,SAINT PETERSBURG,Pinellas,50,31,0,0,75,37,3,0
LIFE CARE CENTER OF OCALA,105999,2800 SW 41ST ST,OCALA,Marion,14,6,18,0,92,12,7,0
NORTHWEST FLORIDA COMMUNITY HOSPITAL (SNU),106055,1360 BRICKYARD RD,CHIPLEY,Washington,0,1,3,0,29,2,0,0
"GARDENS OF PORT ST LUCIE, THE",105832,1699 SE LYNGATE DRIVE,PORT SAINT LUCIE,St. Lucie,0,0,5,0,24,1,0,0
"GARDENS HEALTH & REHABILITATION CENTER, THE",105822,1704 HUNTINGTON VILLAGE CIRCLE,DAYTONA BEACH,Volusia,16,18,16,0,98,26,44,0
WILLOWBROOKE COURT AT INDIAN RIVER ESTATES,105593,2440 CITRUS BLOSSOM CIR,VERO BEACH,Indian River,2,0,11,0,97,11,0,0
CONSULATE HEALTH CARE OF WEST PALM BEACH,105492,1626 DAVIS RD,WEST PALM BEACH,Palm Beach,,,,,,,,
ADVENTHEALTH CARE CENTER ORLANDO NORTH,106024,730 COURTLAND STREET,ORLANDO,Orange,0,1,3,0,111,14,11,0
PLANTATION BAY REHABILITATION CENTER,105888,4641 OLD CANOE CREEK ROAD,SAINT CLOUD,Osceola,0,2,22,0,113,12,10,0
MADISON HEALTH AND REHABILITATION CENTER,105807,2481 WEST US 90,MADISON,Madison,9,8,2,2,45,12,15,1
CORAL BAY HEALTHCARE AND REHABILITATION,105795,2939 S HAVERHILL RD,WEST PALM BEACH,Palm Beach,11,0,13,1,115,21,0,0
DIAMOND RIDGE HEALTH AND REHABILITATION CENTER,105657,2730 W MARC KNIGHTON CT,LECANTO,Citrus,1,1,10,0,108,4,1,0
LIFE CARE CENTER AT WELLS CROSSING,105962,355 CROSSING BLVD,ORANGE PARK,Clay,20,18,29,7,78,28,20,0
WINKLER COURT,105882,3250 WINKLER AVENUE EXTENSION,FORT MYERS,Lee,35,47,14,5,82,38,11,0
CROSS CITY NURSING AND REHABILITATION CENTER,106009,583 NE 351 HWY,CROSS CITY,Dixie,0,2,0,0,51,15,12,0
PLYMOUTH HARBOR INCORPORATED,105817,700 JOHN RINGLING BLVD,SARASOTA,Sarasota,0,16,0,0,30,4,1,0
SHOAL CREEK REHABILITATION CENTER,106028,500 HOSPITAL DRIVE,CRESTVIEW,Okaloosa,94,8,12,7,87,59,5,0
COMMONS AT ORLANDO LUTHERAN TOWERS,105731,210 LAKE AVENUE,ORLANDO,Orange,9,2,24,6,133,11,2,0
EAST BAY REHABILITATION CENTER,105697,4470 E BAY DR,CLEARWATER,Pinellas,5,0,0,0,104,17,0,0
CARLTON SHORES HEALTH AND REHABILITATION CENTER,105580,1350 S NOVA RD,DAYTONA BEACH,Volusia,2,0,8,0,105,17,0,0
PALM GARDEN OF OCALA,105562,2700 SW 34TH ST,OCALA,Marion,3,2,0,0,153,13,1,0
VILLA HEALTH & REHABILITATION CENTER,105930,120 CHIPOLA AVE,DELAND,Volusia,3,0,10,0,107,72,0,0
CONSULATE HEALTH CARE AT WEST ALTAMONTE,105843,1099 WEST TOWN PARKWAY,ALTAMONTE SPRINGS,Seminole,2,0,2,0,83,4,0,1
NORTHDALE REHABILITATION CENTER,105700,3030 BEARSS AVE,TAMPA,Hillsborough,4,0,11,0,103,13,0,0
BAYA POINTE NURSING AND REHABILITATION CENTER,105846,587 SE ERMINE AVE,LAKE CITY,Columbia,0,0,0,0,90,10,7,0
PINELLAS POINT NURSING AND REHAB CENTER,105878,5601 31ST ST S,SAINT PETERSBURG,Pinellas,25,0,0,0,37,17,1,0
GULF SHORE CARE CENTER,105978,6767 86TH AVE N,PINELLAS PARK,Pinellas,59,0,18,4,90,36,0,0
AVANTE AT MELBOURNE INC,105671,1420 SOUTH OAK STREET,MELBOURNE,Brevard,,,,,,,,
LUTHERAN HAVEN NURSING HOME,106050,1525 HAVEN DRIVE,OVIEDO,Seminole,0,0,5,0,43,4,0,0
PINEBROOK CENTER,105497,1240 PINEBROOK ROAD,VENICE,Sarasota,8,0,21,0,79,12,0,0
HEALTHPARK CARE CENTER,105779,16131 ROSERUSH COURT,FORT MYERS,Lee,16,20,5,4,53,23,15,0
SYLVAN HEALTH CENTER,105744,2770 REGENCY OAKS BLVD,CLEARWATER,Pinellas,3,3,142,1,34,11,13,0
MAYFLOWER HEALTHCARE CENTER,105720,1620 MAYFLOWER COURT,WINTER PARK,Orange,4,1,3,0,44,9,4,0
ADVENTHEALTH CARE CENTER ZEPHYRHILL NORTH,105986,7350 DAIRY RD,ZEPHYRHILLS,Pasco,2,20,4,2,104,5,4,0
CYPRESS VILLAGE,105745,4600 MIDDLETON PARK CIR E,JACKSONVILLE,Duval,0,1,5,0,98,62,0,0
CONSULATE HEALTH CARE OF PENSACOLA,105935,235 WEST AIRPORT BLVD,PENSACOLA,Escambia,68,8,7,5,85,38,2,0
SUSANNA WESLEY HEALTH CENTER,105498,5300 W 16TH AVENUE,HIALEAH,Miami-Dade,4,1,4,1,99,11,1,0
HAMPTON COURT NURSING AND REHABILITATION CENTER,105715,16100 NW 2ND AVENUE,NORTH MIAMI BEACH,Miami-Dade,2,0,6,0,113,13,0,0
"NURSING CENTER AT FREEDOM VILLAGE, THE",105655,6410 21ST AVE W,BRADENTON,Manatee,7,19,30,3,82,16,1,0
HIGHLAND PINES REHABILITATION CENTER,105690,1111 S HIGHLAND AVE,CLEARWATER,Pinellas,27,2,4,3,100,13,19,0
MACCLENNY NURSING AND REHAB CENTER,105737,755 S 5TH ST,MACCLENNY,Baker,2,2,18,0,90,15,0,0
KR AT COLLEGE HARBOR,105959,4600 54TH AVE S,SAINT PETERSBURG,Pinellas,2,0,0,0,41,7,3,0
GOOD SAMARITAN SOCIETY-FLORIDA LUTHERAN,105937,450 NORTH MCDONALD AVENUE,DELAND,Volusia,0,4,15,0,49,15,0,0
CROSS CARE CENTER,105721,5888 BLANDING BLVD,JACKSONVILLE,Duval,0,0,0,0,85,71,4,0
CONSULATE HEALTH CARE OF BRANDON,105520,701 VICTORIA ST,BRANDON,Hillsborough,48,6,13,7,99,31,9,0
VICAR'S LANDING NURSING HOME,105630,1003 YORK ROAD,PONTE VEDRA BEACH,St. Johns,0,1,37,0,31,5,2,0
SABAL PALMS HEALTH & REHABILITATION,105694,499 ALTERNATE KEENE RD NE,LARGO,Pinellas,5,13,45,0,215,16,53,0
MANORCARE HEALTH SERVICES,105965,1450 EAST VENICE AVENUE,VENICE,Sarasota,1,6,20,0,85,2,4,0
FLAGLER HEALTH AND REHABILITATION CENTER,105547,300 DR CARTER BOULEVARD,BUNNELL,Flagler,1,8,4,0,84,7,3,0
COUNTRYSIDE REHAB AND HEALTHCARE CENTER,105587,3825 COUNTRYSIDE BLVD N,PALM HARBOR,Pinellas,,,,,,,,
"FLORIDEAN NURSING AND REHABILITATION CENTER, THE",106007,47 NW 32ND PLACE,MIAMI,Miami-Dade,4,1,9,4,80,7,6,0
SPRINGTREE REHABILITATION & HEALTH CARE CENTER,105686,4251 SPRINGTREE DRIVE,SUNRISE,Broward,11,1,9,0,75,33,0,0
CROSSBREEZE CARE CENTER,105774,1755 18TH ST,SARASOTA,Sarasota,20,0,13,5,82,12,0,0
HIALEAH NURSING AND REHABILITATION CENTER,105803,190 W 28TH STREET,HIALEAH,Miami-Dade,130,0,27,25,184,106,26,0
HEARTLAND HEALTH CARE CENTER PROSPERITY OAKS,105762,11375 PROSPERITY FARMS ROAD,PALM BEACH GARDENS,Palm Beach,21,5,7,2,82,23,11,0
GLADES HEALTH CARE CENTER,106018,230 SOUTH BARFIELD HIGHWAY,PAHOKEE,Palm Beach,24,1,30,17,57,43,25,0
HARBORCHASE OF NAPLES,105995,7801 AIRPORT PULLING ROAD N,NAPLES,Collier,2,0,0,0,31,11,1,0
"AVANTE AT BOCA RATON, INC.",105521,1130 NW 15TH STREET,BOCA RATON,Palm Beach,45,2,7,4,109,34,5,0
CENTRAL PARK HEALTHCARE AND REHABILITATION CENTER,105718,702 S KINGS AVE,BRANDON,Hillsborough,25,15,12,4,97,25,18,0
ORANGE CITY NURSING AND REHAB CENTER,105735,2810 ENTERPRISE RD,DEBARY,Volusia,14,3,7,1,97,10,17,0
VI AT LAKESIDE VILLAGE,105968,2792 DONNELLY DRIVE,LANTANA,Palm Beach,2,0,0,0,40,6,1,0
WINDSOR HEALTH AND REHABILITATION CENTER,105696,602 E LAURA ST,STARKE,Bradford,18,7,5,6,78,26,4,0
FLEET LANDING,105743,ONE FLEET LANDING BLVD,ATLANTIC BEACH,Duval,10,0,2,2,47,4,0,2
LAKEWOOD NURSING CENTER,105808,100 N LAKE ST,CRESCENT CITY,Putnam,25,15,16,11,60,51,31,0
WOOD LAKE HEALTH AND REHABILITATION CENTER,105611,6414 13TH RD S,GREEN ACRES,Palm Beach,2,0,9,0,98,17,0,0
THE CEDAR AT MEASE LIFE,105732,910 NEW YORK AVE,DUNEDIN,Pinellas,0,0,9,0,48,7,5,0
SOLARIS HEALTHCARE DAYTONA,105915,550 NATIONAL HEALTHCARE DRIVE,DAYTONA BEACH,Volusia,0,0,0,0,61,26,2,0
JACKSONVILLE NURSING AND REHAB CENTER,105710,4134 DUNN AVENUE,JACKSONVILLE,Duval,91,0,14,13,78,70,0,0
PLAZA WEST,105866,912 AMERICAN EAGLE BLVD,SUN CITY CENTER,Hillsborough,13,2,15,4,69,22,0,0
ALPINE HEALTH AND REHABILITATION CENTER,105713,3456 21ST AVE S,SAINT PETERSBURG,Pinellas,23,24,3,3,42,17,38,0
WESTMINSTER COMMUNITIES OF BRADENTON WESTMINSTER,105919,1700 21ST AVE W,BRADENTON,Manatee,0,0,13,1,49,9,2,0
SHANDS JACKSONVILLE MEDICAL CENTER,105961,580 W 8TH STREET,JACKSONVILLE,Duval,2,0,0,0,33,4,1,0
"VICTORIA NURSING & REHABILITATION CENTER, INC.",106031,955 NW 3RD ST,MIAMI,Miami-Dade,25,7,23,0,240,41,0,0
LADY LAKE SPECIALTY CARE CENTER,106003,630 GRIFFIN AVENUE,LADY LAKE,Lake,50,8,26,15,102,43,8,0
PALACE AT KENDALL NURSING AND REHABILITATION CENTE,105719,11215 SW 84TH STREET,MIAMI,Miami-Dade,12,2,15,0,154,29,1,0
OAKS AT AVON,105780,1010 US 27 N,AVON PARK,Highlands,47,0,3,3,69,20,1,0
HARBOURWOOD CARE CENTER,106041,549 SKY HARBOR DR,CLEARWATER,Pinellas,12,10,14,0,108,11,2,0
VI AT AVENTURA,106076,19333 WEST COUNTRY CLUB DRIVE,AVENTURA,Miami-Dade,1,2,9,1,21,9,0,0
HAWTHORNE HEALTH AND REHAB OF SARASOTA,106098,5381 DESOTO ROAD,SARASOTA,Sarasota,10,1,10,1,66,18,4,0
"THE ARLINGTON OF NAPLES, INC,",106108,8000 ARLINGTON CIRCLE,NAPLES,Collier,0,14,6,1,34,15,19,0
MOOSEHAVEN,106077,1701 PARK AVENUE,ORANGE PARK,Clay,0,33,21,0,33,9,55,0
PRUITTHEALTH - FLEMING ISLAND,106124,2040 TOWN CENTER BLVD,FLEMING ISLAND,Clay,17,13,0,0,84,24,0,0
THE PRESERVE,106137,14750 HOPE CENTER LOOP,FORT MYERS,Lee,0,0,0,0,30,10,3,0
FREEDOM POINTE AT THE VILLAGES REHABILITATION AND,106083,1460 EL CAMINO REAL DRIVE,THE VILLAGES,Lake,0,7,6,0,51,7,0,0
WESTMINSTER BALDWIN PARK,106118,2653 LAKE BALDWIN LANE,ORLANDO,Orange,0,0,0,0,29,5,0,0
DE LUNA HEALTH AND REHABILITATION CENTER,106136,9310 FOWLER AVE,PENSACOLA,Escambia,0,0,9,9,58,4,2,0
ADVENTHEALTH CARE CENTER CELEBRATION,106127,1290 CELEBRATION BLVD,KISSIMMEE,Osceola,7,1,0,0,37,10,2,0
ST JAMES HEALTH AND REHABILITATION CENTER,106081,239 CROOKED RIVER ROAD,CARRABELLE,Franklin,0,10,6,0,71,2,8,0
CHILDRENS COMPREHENSIVE CARE CENTER INC,106110,200 SE 19TH AVENUE,POMPANO BEACH,Broward,0,0,1,0,32,1,0,0
FAIR HAVENS CENTER,106128,201 CURTISS PKWY,MIAMI SPRINGS,Miami-Dade,18,24,2,10,40,49,0,0
SARASOTA POINT REHABILITATION CENTER,106102,2600 COURTLAND STREET,SARASOTA,Sarasota,3,0,8,5,79,9,0,0
MIAMI CARE CENTER INC,106141,5959 NW 7TH ST,MIAMI,Miami-Dade,,,,,,,,
GARDENS AT TERRACINA HEALTH & REHABILITATION,106129,6869 DAVIS BOULEVARD,NAPLES,Collier,0,0,0,0,23,3,1,0
OAKBRIDGE HEALTHCARE CENTER,106138,3110 OAKBRIDGE BLVD E,LAKELAND,Polk,0,0,13,13,78,6,5,0
RENAISSANCE AT THE TERRACES,106104,26475 SOUTH TAMIAMI TRAIL,BONITA SPRINGS,Lee,0,0,2,0,23,24,0,0
CLYDE E LASSEN STATE VETERANS NURSING HOME,106088,4650 STATE RD 16,SAINT AUGUSTINE,St. Johns,1,1,16,0,98,11,33,1
ADVENTHEALTH CARE CENTER WATERMAN,106119,4501 WATERMAN WAY,TAVARES,Lake,1,1,0,0,93,17,9,0
VILLAGES REHABILITATION AND NURSING CENTER (THE),106099,900 HIGHWAY 466,LADY LAKE,Lake,5,0,6,0,104,1,0,0
GULF COAST MEDICAL CENTER SKILLED NURSING UNIT,106122,13960 PLANTATION ROAD,FORT MYERS,Lee,,,,,,,,
"AVANTE AT OCALA, INC",106084,2021 SW 1ST AVE,OCALA,Alachua,49,36,12,6,111,49,5,0
OAK HAMMOCK AT THE UNIVERSITY OF FLORIDA INC,106066,2660 SW 53RD LN,GAINESVILLE,Alachua,11,0,19,2,58,6,0,0
LAKEVIEW TERRACE REHAB AND HEALTH CARE CENTER,106068,110 LODGE TERRACE DR,ALTOONA,Lake,0,1,0,0,26,8,12,0
BENDERSON FAMILY SKILLED NURSING AND REHAB CENTER,106090,1959 N HONORE AVE,SARASOTA,Sarasota,0,0,7,0,31,3,0,0
PRUITTHEALTH - SOUTHWOOD,106140,2301 BLUFF OAK WAY,TALLAHASSEE,Leon,13,0,3,3,53,4,1,0
"NURSING CENTER AT LA POSADA, THE",106067,3600 MASTERPIECE WAY,PALM BEACH GARDENS,Palm Beach,1,1,3,0,36,9,6,0
KINDRED HOSPITAL SOUTH FLORIDA HOLLYWOOD,106109,1859 VAN BUREN ST,HOLLYWOOD,Broward,4,0,3,1,25,9,2,0
KEY WEST HEALTH AND REHABILITATION CENTER,106089,5860 W JUNIOR COLLEGE RD,KEY WEST,Monroe,0,2,7,0,101,11,12,0
VILLAGE PLACE HEALTH AND REHABILITATION CENTER,106072,2370 HARBOR BLVD,PORT CHARLOTTE,Charlotte,14,8,4,0,88,7,2,0
SCOTT LAKE HEALTH AND REHABILITATION CENTER,106120,800 E COUNTY RD 540A,LAKELAND,Polk,0,0,2,0,54,3,1,0
CHATHAM GLEN HEALTHCARE AND REHABILITATION CENTER,106139,16605 SE 74TH SOULLIERE AVENUE,THE VILLAGES,Marion,0,0,7,0,16,15,34,0
RIVIERA HEALTH RESORT,106094,6901 YUMURI STREET,CORAL GABLES,Miami-Dade,38,22,82,9,193,96,26,0
ORLANDO HEALTH CENTER FOR REHABILITATION,106130,1300 HEMPEL AVENUE,OCOEE,Orange,0,0,5,0,67,6,0,0
HEALTH CENTER AT SINAI RESIDENCES,106111,21044 95TH AVENUE SOUTH,BOCA RATON,Palm Beach,10,4,3,3,51,30,1,0
BUFFALO CROSSING HEALTHCARE AND REHABILITATION CEN,106114,3875 WEDGEWOOD LANE,THE VILLAGES,Alachua,1,1,7,0,82,10,0,0
NORTH DADE NURSING AND REHABILITATION CENTER,106133,1255 NE 135TH STREET,NORTH MIAMI,Miami-Dade,27,13,24,7,201,35,0,0
ADDINGTON PLACE AT WELLINGTON GREEN,106091,10330 NUVISTA AVENUE,WELLINGTON,Palm Beach,14,26,0,0,49,18,4,0
STEWARD SEBASTIAN RIVER MEDICAL CENTER,106101,13695 US 1,SEBASTIAN,Indian River,0,0,0,0,15,1,0,0
LAKES OF CLERMONT HEALTH AND REHABILITATION CENTER,106134,1775 HOOKS STREET,CLERMONT,Lake,8,0,0,0,35,48,3,0
ADVENTHEALTH DADE CITY,106125,13100 FORT KING RD,DADE CITY,Pasco,0,0,0,0,24,0,0,0
PRUITTHEALTH - PANAMA CITY,106121,3212 JENKS AVENUE,PANAMA CITY,Bay,1,1,1,0,71,6,0,0
BRIDGEWATER PARK HEALTH & REHABILITATION CENTER,106115,9280 SOUTH WEST 81ST CT,OCALA,Marion,0,1,0,0,109,7,13,0
CLUB HEALTH AND REHABILITATION CENTER AT THE VILLA,106095,16529 SE 86TH BELLE MEADE CIRCLE,THE VILLAGES,Alachua,2,0,8,0,59,12,0,0
TRINITY REGIONAL REHAB CENTER,106079,2144 WELBILT BLVD,TRINITY,Pasco,1,0,3,0,101,20,4,0
UNIVERSITY PLAZA REHABILITATION AND NURSING CENTER,106100,724 NW 19TH ST,MIAMI,Miami-Dade,19,16,15,6,141,32,1,0
VILLA MARIA WEST SKILLED NURSING FACILITY,106080,8850 NW 122 ST,HIALEAH GARDENS,Miami-Dade,2,1,1,1,17,3,0,0
TAMPA LAKES HEALTH AND REHABILITATION CENTER,106112,750 HAYES RD,LUTZ,Hillsborough,14,19,11,4,119,19,3,0
BAY VILLAGE OF SARASOTA,106085,8400 VAMO ROAD,SARASOTA,Sarasota,8,2,1,1,47,21,14,0
GOLDEN GLADES NURSING AND REHABILITATION CENTER,106131,220 SIERRA DRIVE,MIAMI,Miami-Dade,55,173,32,7,153,35,0,0
SKYTOP VIEW REHABILITATION CENTER,106105,2145 NORTH DON WICKHAM DRIVE,CLERMONT,Lake,1,1,0,0,22,3,1,0
RIVER CITY REHAB CENTER,106142,15480 MAX LEGGETT PARKWAY,JACKSONVILLE,Duval,,,,,,,,
BARDMOOR OAKS HEALTHCARE AND REHABILITATION CENTE,106116,9035 BRYAN DAIRY RD,LARGO,Pinellas,20,2,41,6,142,9,9,0
"CRYSTAL HEALTH AND REHAB CENTER, LLC",106092,48 HIGH POINT ROAD,TAVERNIER,Monroe,132,6,21,6,80,53,0,0
GLADES WEST REHABILITATION AND NURSING C,106106,15955 BASS CREEK ROAD,PEMBROKE PINES,Broward,17,1,17,3,105,20,0,0
LEE MEMORIAL HOSPITAL SKILLED NURSING UNIT,106113,2776 CLEVELAND AVENUE,FORT MYERS,Lee,0,0,0,0,17,3,5,0
ASTORIA HEALTH AND REHABILITATION CENTER,106086,701 OVERLOOK DR SE,WINTER HAVEN,Polk,15,36,3,2,113,25,25,0
KR AT HILLSBOROUGH LAKES,106093,19091 N DALE MABRY HWY,LUTZ,Hillsborough,8,4,0,0,68,24,52,0
GRACE HEALTHCARE OF LAKE WALES,106069,730 N SCENIC HWY,LAKE WALES,Polk,37,10,6,4,66,43,147,0
DOLPHIN POINTE HEALTH CARE CENTER,106135,5355 DOLPHIN POINT BLVD,JACKSONVILLE,Duval,0,0,0,0,66,9,0,0
DESOTO HEALTH AND REHAB,106070,475 NURSING HOME DR,ARCADIA,DeSoto,1,0,4,0,36,8,3,0
"REHABILITATION CENTER OF LAKE CITY, THE",106126,298 SW PROSPERITY PLACE,LAKE CITY,Columbia,8,10,8,0,70,14,0,0
LIFE CARE CENTER OF PENSACOLA,106073,3291 EAST OLIVE RD,PENSACOLA,Escambia,2,13,11,0,100,14,29,0
OLIVE BRANCH HEALTH AND REHAB CENTER,106117,8325 UNIVERSITY PARKWAY,PENSACOLA,Escambia,3,0,0,0,81,12,1,0
FLORIDA BAPTIST RETIREMENT CENTER,106097,1006 33RD ST,VERO BEACH,Indian River,4,0,7,0,11,6,0,0
KEYSTONE REHABILITATION AND HEALTH CENTER,106074,1120 W DONEGAN AVE,KISSIMMEE,Osceola,7,0,8,3,91,19,0,0
GULFPORT REHABILITATION CENTER,106103,1430 PASADENA AVE S,PASADENA,Pinellas,43,0,3,2,66,24,0,0
VIERA DEL MAR HEALTH AND REHABILITATION CENTER,106123,2355 VIDINA DRIVE,VIERA,Brevard,8,3,18,2,80,8,5,0
SOUTH DADE NURSING AND REHABILITATION CENTER,106132,17475 S DIXIE HWY,MIAMI,Miami-Dade,49,1,13,6,169,43,3,0
GRACE REHABILITATION CENTER OF VERO BEACH,106075,2180 10TH AVENUE,VERO BEACH,Indian River,15,2,10,2,45,12,4,0
"PAVILION FOR HEALTH CARE, THE",106096,3465 CAROLINE BLVD,PENNEY FARMS,Clay,0,0,3,0,36,1,0,0
KENDALL LAKES HEALTH AND REHABILITATION CENTER,686123,5280 SW 157 AVENUE,MIAMI,Miami-Dade,3,2,13,0,142,19,1,0
HARMONY HEALTH CENTER,686124,9820 N KENDALL DRIVE,MIAMI,Miami-Dade,11,2,10,1,182,18,5,0
