BARNEGAT REHABILITATION AND NURSING CENTER,315222,859 WEST BAY AVE,BARNEGAT,Ocean,1,1,12,0,72,5,0,0
JOB HAINES HOME FOR AGED PEOPL,315392,250 BLOOMFIELD AVE,BLOOMFIELD,Essex,,,,,,,,
INGLEMOOR REHABILITATION AND CARE CENTER OF LIVING,315322,311 S LIVINGSTON AVE,LIVINGSTON,Essex,10,2,8,3,84,17,2,0
SOUTH MOUNTAIN HC,315283,2385 SPRINGFIELD AVENUE,VAUXHALL,Union,52,6,9,1,141,14,0,1
MANORCARE HEALTH SERVICES-WEST DEPTFORD,315246,550 JESSUP ROAD,WEST DEPTFORD,Gloucester,47,3,41,27,90,43,2,2
MANOR CARE MOUNTAINSIDE,315259,1180 ROUTE 22 WEST,MOUNTAINSIDE,Union,55,1,30,14,90,20,0,0
SPRING GROVE REHABILITATION AND HEALTHCARE CENTER,315005,144 GALES DRIVE,NEW PROVIDENCE,Union,41,7,29,7,71,5,0,0
CARE CONNECTION RAHWAY,315146,865 STONE STREET,RAHWAY,Union,10,66,35,2,21,2,0,0
PREFERRED CARE AT ABSECON,315244,1020 PITNEY ROAD,ABSECON,Atlantic,93,0,34,16,123,39,5,0
CARNEYS POINT REHABILITATION AND NURSING CENTER,315271,201 FIFTH AVENUE,CARNEYS POINT,Salem,77,38,0,0,103,80,34,0
MERIDIAN NURSING AND REHABILITATION AT OCEAN GROVE,315365,160 MAIN STREET,OCEAN GROVE,Monmouth,42,5,14,10,111,21,4,0
N J VETERANS MEM HOME PARAMUS,315346,1 VETERANS DRIVE,PARAMUS,Bergen,126,5,135,79,196,91,0,1
COUNTRY ARCH CARE CENTER,315433,114 PITTSTOWN ROAD,PITTSTOWN,Hunterdon,24,0,12,5,78,0,0,0
LINCOLN SPECIALTY CARE CENTER,315233,1640 SOUTH LINCOLN AVENUE,VINELAND,Cumberland,2,1,14,0,155,18,3,2
BROOKHAVEN HEALTH CARE CENTER,315268,120 PARK END PLACE,EAST ORANGE,Essex,6,0,1,0,62,3,0,0
RIVERSIDE NURSING AND REHABILITATION CENTER,315235,325 JERSEY STREET,TRENTON,Mercer,58,120,42,13,95,72,53,1
WILEY MISSION,315418,99 EAST MAIN STREET,MARLTON,Burlington,4,1,5,0,48,4,6,0
CREST POINTE REHABILITATION AND HEALTHCARE CENTER,315135,1515 HULSE ROAD,PT PLEASANT,Ocean,85,17,18,14,97,21,2,0
WEDGWOOD GARDENS CARE CENTER,315504,3419 HIGHWAY 9,FREEHOLD,Monmouth,5,0,9,1,80,11,0,0
ALARIS HEALTH AT THE CHATEAU,315494,96 PARKWAY,ROCHELLE PARK,Bergen,0,0,3,2,52,6,0,0
LITTLE BROOK NURSING AND CONVALESCENT HOME,315467,78 SLIKER ROAD,CALIFON,Hunterdon,0,0,0,0,33,3,0,0
TRINITAS HOSPITAL,315442,655 EAST JERSEY STREET,ELIZABETH,Union,52,57,24,13,94,34,41,0
CONTINUING CARE AT LANTERN HILL,315523,537 MOUNTAIN AVENUE,NEW PROVIDENCE,Union,1,4,3,0,32,2,8,0
CHILDRENS SPECIALIZED HOSPITAL TOMS RIVER,315443,94 STEVENS ROAD,TOMS RIVER,Ocean,2,2,0,0,19,14,10,0
CARE ONE AT MORRIS,315468,100 MAZDABROOK ROAD,PARSIPPANY TROY HILL,Morris,24,7,24,2,76,3,1,0
LUTHERAN SOCIAL MINISTRIES CRANES MILL,315457,459 PASSAIC AVENUE,WEST CALDWELL,Essex,0,0,1,0,25,2,0,0
"ARBOR AT LAUREL CIRCLE, THE",315445,100 MONROE STREET,BRIDGEWATER,Somerset,21,0,10,6,37,12,2,0
ADVANCED SUBACUTE REHABILITATION CENTER AT SEWELL,315516,685 SALINA ROAD,SEWELL,Gloucester,,,,,,,,
NEW JERSEY VETERANS MEMORIAL VINELAND,315496,524 NORTH WEST BLVD,VINELAND,Cumberland,7,0,29,3,261,38,0,0
"VILLA AT FLORHAM PARK, INC THE",315480,190  PARK AVENUE,FLORHAM PARK,Morris,5,1,10,8,23,7,0,0
ST CATHERINE OF SIENA,315471,7 RYERSON AVENUE,CALDWELL,Essex,14,0,6,0,20,19,0,0
MERIDIAN SUBACUTE REHABILITATION,315501,1725 MERIDIAN TRAIL,WALL,Monmouth,29,0,17,13,93,39,10,1
ALARIS HEALTH AT WEST ORANGE,315449,5 BROOK END DRIVE,WEST ORANGE,Essex,6,0,15,0,88,3,1,0
CARE ONE AT WAYNE - SNF,315477,493 BLACK OAK RIDGE ROAD,WAYNE,Passaic,3,1,8,1,61,6,1,0
COMMUNITY MEDICAL CENTER TCU,315490,99 ROUTE 37 WEST,TOMS RIVER,Ocean,0,0,3,0,13,2,0,0
MANORCARE HEALTH SERVICES-WASHINGTON TOWNSHIP,315506,378 FRIES MILL ROAD,SEWELL,Gloucester,11,1,24,2,88,12,1,0
"HUDSON HILLS SENIOR LIVING, LLC",315525,3161 KENNEDY BLVD,NORTH BERGEN,Hudson,16,14,20,6,46,13,1,0
CARE ONE AT EVESHAM,315464,870 EAST ROUTE 70,MARLTON,Burlington,,,,,,,,
SOMERSET WOODS REHABILITATION & NURSING CENTER,315520,780 OLD NEW BRUNSWICK ROAD,SOMERSET,Somerset,88,2,10,10,88,27,0,0
UNITED METHODIST COMMUNITIES AT BRISTOL GLEN,315439,200 BRISTOL GLEN DRIVE,NEWTON,Sussex,0,0,0,0,49,20,0,0
CARE ONE AT HANOVER TOWNSHIP,315511,101 WHIPPANY ROAD,WHIPPANY,Morris,0,0,6,3,43,8,1,0
NEW JERSEY VETERANS MEMORIAL HOME MENLO,315459,132 EVERGREEN RD,EDISON,Middlesex,13,4,28,10,174,32,0,1
CLARA MAASS MEDICAL CENTER,315505,ONE CLARA MAASS DRIVE,BELLEVILLE,Essex,0,0,1,1,15,1,0,0
CARE ONE AT MOORESTOWN,315482,895 WESTFIELD ROAD,MOORESTOWN,Burlington,10,7,6,0,52,4,5,0
"ATRIUM AT NAVESINK HARBOR, THE",315515,40 RIVERSIDE AVENUE,RED BANK,Monmouth,4,4,129,3,36,19,1,0
PLAZA HEALTHCARE & REHABILITATION CENTER,315483,456 RAHWAY AVENUE,ELIZABETH,Union,55,0,30,19,82,22,0,0
VICTORIA MANOR,315508,3809 BAYSHORE ROAD,NORTH CAPE MAY,Cape May,52,1,31,17,70,25,0,0
WINCHESTER GARDENS HEALTH CARE CENTER,315527,333 ELMWOOD AVENUE,MAPLEWOOD,Essex,1,0,2,0,13,5,0,0
LAUREL BROOK REHABILITATION AND HEALTHCARE CENTER,315524,3718 CHURCH ROAD,MOUNT LAUREL,Burlington,83,97,51,19,152,45,29,0
VIRTUA H & R C AT BERLIN,315461,100 LONG-A-COMING LANE,BERLIN,Camden,4,0,12,0,88,12,0,0
CONTINUING CARE AT SEABROOK,315469,3002 ESSEX ROAD,TINTON FALLS,Monmouth,2,5,18,2,45,3,13,0
RENAISSANCE PAVILION,315495,61 W JIMMIE LEEDS ROAD,POMONA,Atlantic,7,2,0,0,13,21,0,0
BRIDGEWAY CARE AND REHAB CENTER AT HILLSBOROUGH,315510,395 AMWELL ROAD,HILLSBOROUGH,Somerset,38,30,38,11,100,55,7,0
POWERBACK REHABILITATION MOORESTOWN,315517,212 MARTER AVENUE,MOORESTOWN,Burlington,37,0,20,11,71,51,0,0
STONEBRIDGE AT MONTGOMERY HEALTH CARE CENTER,315486,100 HOLLINSHEAD SPRING ROAD,SKILLMAN,Somerset,,,,,,,,
BAPTIST HOME OF SOUTH JERSEY,315448,303 BANK AVE,RIVERTON,Burlington,29,46,25,5,40,24,17,0
ATRIUM POST ACUTE CARE OF MATAWAN,315463,38 FRENEAU AVENUE,MATAWAN,Monmouth,59,1,24,13,88,41,5,0
CEDAR CREST/MOUNTAINVIEW GARDENS,315491,4 CEDAR CREST VILLAGE DRIVE,POMPTON PLAINS,Morris,10,8,35,6,84,10,13,0
ALLENDALE NURSING HOME,315497,85 HARRETON ROAD,ALLENDALE,Bergen,77,2,34,22,165,37,1,0
CARE ONE AT MADISON AVENUE,315488,151 MADISON AVENUE,MORRISTOWN,Morris,7,17,24,5,81,5,3,0
HOBOKEN UNIVERSITY MEDICAL CENTER TCU,315512,308 WILLOW AVENUE,HOBOKEN,Hudson,0,0,0,0,6,6,2,0
NEW VISTA,315458,300 BROADWAY,NEWARK,Essex,318,72,3,2,204,10,0,0
ATRIUM POST ACUTE CARE OF PARK RIDGE,315438,120 NOYES DRIVE,PARK RIDGE,Bergen,96,9,61,31,81,63,3,1
MANHATTANVIEW NURSING HOME,315465,3200 HUDSON AVENUE,UNION CITY,Hudson,1,0,3,0,78,2,0,0
HACKENSACK MERIDIAN HEALTH PROSPECT HEIGHTS CARE C,315460,336 PROSPECT AVE,HACKENSACK,Bergen,,,,,,,,
POWERBACK REHABILITATION PISCATAWAY,315522,10 STERLING DRIVE,PISCATAWAY,Middlesex,,,,,,,,
CARE ONE AT WALL,315485,2621 HIGHWAY 138,WALL,Monmouth,15,14,37,17,89,16,13,0
CARE ONE AT EAST BRUNSWICK,315472,599 CRANBURY ROAD,EAST BRUNSWICK,Middlesex,11,0,7,3,84,14,0,0
"BARNERT SUBACUTE REHABILITATION CENTER, LLC",315507,680 BROADWAY SUITE 301,PATERSON,Passaic,0,0,0,0,26,0,0,0
LAUREL BAY HEALTH & REHABILITATION CENTER,315437,32 LAUREL AVENUE,KEANSBURG,Monmouth,14,2,9,2,91,3,1,0
TALLWOODS CARE CENTER,315462,18 BUTLER BOULEVARD,BAYVILLE,Ocean,40,3,24,11,157,17,0,0
SYCAMORE LIVING AT EAST HANOVER,315529,ONE SOUTH RIDGEDALE AVENUE,EAST HANOVER,Morris,2,0,1,0,39,0,0,0
"ELMS OF CRANBURY, THE",315451,61 MAPLEWOOD AVENUE,CRANBURY,Middlesex,27,14,9,3,97,13,3,0
ATRIUM POST ACUTE CARE OF LIVINGSTON,315526,348 EAST CEDAR STREET,LIVINGSTON,Essex,26,0,10,10,30,26,0,0
ROYAL HEALTH GATE NRSG REHAB,315455,1314 BRUNSWICK AVENUE,TRENTON,Mercer,16,5,12,8,89,9,1,0
BOONTON CARE CENTER,315492,199 POWERVILLE ROAD,BOONTON,Morris,47,1,38,16,51,31,5,0
PEACE CARE ST JOSEPH'S,315452,537 PAVONIA AVENUE,JERSEY CITY,Hudson,9,5,14,2,86,7,1,0
"POWERBACK REHABILITATION, ROUTE 73",315513,113 SOUTH ROUTE 73,VOORHEES,Camden,8,0,8,0,100,7,5,0
SOUTHERN OCEAN MEDICAL CENTER,315478,1140 ROUTE 72 WEST,MANAHAWKIN,Ocean,0,2,0,0,9,0,1,0
LIONS GATE,315499,1100 LAUREL OAK ROAD,VOORHEES,Camden,56,0,33,14,73,53,41,1
SHORE MEADOWS REHAB & NURSING CENTER,315454,231 WARNER STREET,TOMS RIVER,Ocean,7,1,3,0,107,12,0,0
JEWISH HOME AT ROCKLEIGH,315473,10 LINK DRIVE,ROCKLEIGH,Bergen,92,0,75,23,148,71,12,0
ROOSEVELT CARE CENTER AT OLD BRIDGE,315509,1133 MARLBORO ROAD,OLD BRIDGE,Middlesex,10,0,39,0,152,6,0,1
MANORCARE HEALTH SERVICES - VOORHEES,315500,1086 DUMONT CIRCLE,VOORHEES,Camden,46,10,80,16,85,21,6,0
ALARIS HEALTH AT THE FOUNTAINS,315476,595 COUNTY AVENUE,SECAUCUS,Hudson,56,2,9,7,257,30,2,1
ATRIUM POST ACUTE CARE OF HAMILTON,315519,3 HAMILTON HEALTH PLACE,HAMILTON,Mercer,53,7,21,16,28,28,21,0
MYSTIC MEADOWS REHAB & NURSING CENTER,315456,151 NINTH AVENUE,LITTLE EGG HARBOR TW,Ocean,27,5,10,4,107,17,0,1
"VENETIAN CARE & REHABILITATION CENTER, THE",315518,275 JOHN T O'LEARY BOULEVARD,SOUTH AMBOY,Middlesex,15,0,1,0,138,10,0,0
PREFERRED CARE AT MERCER,315487,1201 PARKWAY AVENUE,EWING,Mercer,,,,,,,,
ROYAL SUITES HEALTH CARE & REHABILITATION,315503,214 WEST JIMMIE LEEDS ROAD,GALLOWAY TOWNSHIP,Atlantic,61,0,32,6,142,23,0,0
CARE ONE AT TEANECK,315502,544 TEANECK ROAD,TEANECK,Bergen,3,2,10,1,73,12,0,0
COMPLETE CARE AT SHORROCK,315453,75 OLD TOMS RIVER ROAD,BRICK,Ocean,12,2,14,4,98,7,0,0
CARE ONE AT LIVINGSTON,315479,68 PASSAIC AVENUE,LIVINGSTON,Essex,3,0,5,1,64,18,0,0
EGG HARBOR CARE CENTER,315514,6818 DELILAH ROAD,EGG HARBOR TOWNSHIP,Atlantic,28,12,62,28,70,14,20,2
"JEWISH HOME FOR REHABILITATION AND NURSING, THE",315528,1151 WEST MAIN STREET,FREEHOLD,Monmouth,15,6,35,8,90,23,6,0
ATRIUM POST ACUTE CARE OF WOODBURY,315521,467 COOPER STREET,WOODBURY,Gloucester,78,4,11,8,40,30,21,0
