Provider Name,Federal Provider Number,Provider Address,Provider City,County,Residents Total Confirmed COVID-19,Residents Total Suspected COVID-19,Residents Total All Deaths,Residents Total COVID-19 Deaths,Total Number of Occupied Beds,Staff Total Confirmed COVID-19,Staff Total Suspected COVID-19,Staff Total COVID-19 Deaths
HOUSE OF THE GOOD SHEPHERD,315422,798 WILLOW GROVE STREET,HACKETTSTOWN,Warren,,,,,,,,
MEADOWVIEW NURSING AND REHABILITATION CENTER,315358,235 DOLPHIN AVE,NORTHFIELD,Atlantic,96,0,37,32,109,30,0,0
UNITED METHODIST COMMUNITIES AT PITMAN,315427,535 N OAK AVE,PITMAN,Gloucester,2,0,25,0,56,7,8,0
"PALACE REHABILITATION AND CARE CENTER, THE",315263,315 WEST MILL ROAD,MAPLE SHADE,Burlington,107,23,14,14,143,30,0,0
TOWER LODGE CARE CENTER,315069,1506 GULLY ROAD,WALL,Monmouth,1,1,0,0,56,2,3,0
PREFERRED CARE AT HAMILTON,315111,1501 STATE HWY 33,HAMILTON SQUARE,Mercer,23,23,26,7,91,4,3,0
MILFORD MANOR,315276,69 MAPLE ROAD,WEST MILFORD,Passaic,1,0,36,19,76,2,0,0
REGENCY HERITAGE NURSING AND REHABILITATION CENTER,315367,380 DEMOTT LANE,SOMERSET,Somerset,67,40,60,35,151,23,32,0
LINCOLN SPECIALTY CARE CENTER,315233,1640 SOUTH LINCOLN AVENUE,VINELAND,Cumberland,1,1,1,0,146,6,0,2
COMPLETE CARE AT HOLIDAY CITY,315320,4 PLAZA DRIVE,TOMS RIVER,Ocean,45,18,78,17,102,30,10,0
NEW COMMUNITY EXTENDED CARE FACILITY,315393,266 S ORANGE AVE,NEWARK,Essex,54,3,44,11,99,27,0,1
COMPLETE CARE AT ARBORS,315333,1750 ROUTE 37 WEST,TOMS RIVER,Ocean,37,0,12,8,60,18,24,0
HOMESTEAD REHABILITATION & HEALTH CARE CENTER,315378,129 MORRIS TURNPIKE,NEWTON,Sussex,55,12,26,18,72,11,10,0
"VOORHEES CARE & REHABILITATION CENTER, THE",315187,1302 LAUREL OAK ROAD,VOORHEES,Camden,117,62,27,22,142,34,25,0
CANTERBURY AT CEDAR GROVE,315204,398 POMPTON AVENUE,CEDAR GROVE,Essex,36,10,6,6,114,26,6,0
WYNWOOD REHABILITATION AND HEALTHCARE CENTER,315047,1700 WYNWOOD DRIVE,CINNAMINSON,Burlington,63,0,20,19,98,12,0,0
ALARIS HEALTH AT BELGROVE,315366,195 BELGROVE DRIVE,KEARNY,Hudson,7,3,2,0,91,11,0,0
JFK HARTWYCK AT EDISON ESTATES,315279,10 BRUNSWICK AVENUE,EDISON,Middlesex,133,0,28,27,164,34,0,0
ALARIS HEALTH AT BOULEVARD EAST,315254,6819 BOULEVARD EAST,GUTTENBERG,Hudson,2,0,0,0,71,2,0,0
MANOR CARE MOUNTAINSIDE,315259,1180 ROUTE 22 WEST,MOUNTAINSIDE,Union,54,1,17,14,94,17,0,0
REFORMED CHURCH HOME,315417,1990 ROUTE 18 NORTH,OLD BRIDGE,Middlesex,47,0,8,1,70,10,0,0
SKILLED NURSING AT FELLOWSHIP VILLAGE,315356,8000 FELLOWSHIP DRIVE,BASKING RIDGE,Somerset,8,3,0,12,39,6,2,0
OUR LADY'S CENTER FOR REHABILITATION & HC,315054,1100 CLEMATIS AVE,PLEASANTVILLE,Atlantic,14,9,9,7,122,8,8,0
ROLLING HILLS CARE CENTER,315302,16 CRATETOWN ROAD,LEBANON,Hunterdon,8,10,12,6,35,14,8,0
WILLOW SPRINGS REHABILITATION AND HEALTHCARE CTR,315213,1049 BURNT TAVERN ROAD,BRICK,Ocean,95,44,54,28,136,39,3,0
MILLVILLE CENTER,315243,54 N SHARP STREET,MILLVILLE,Cumberland,105,0,41,25,83,29,17,0
REGENCY GRANDE NURS & REHAB CE,315355,65 NORTH SUSSEX STREET,DOVER,Morris,26,0,22,18,109,17,0,0
ATRIUM POST ACUTE CARE OF WAYNE,315335,1120 ALPS ROAD,WAYNE,Passaic,114,2,49,36,108,33,0,0
CHESHIRE HOME,315383,9 RIDGEDALE AVE,FLORHAM PARK,Morris,0,0,0,0,34,0,0,0
ALAMEDA CENTER FOR REHABILITATION AND HEALTHCARE,315180,303 ELM STREET,PERTH AMBOY,Middlesex,76,8,48,24,148,76,2,2
ARISTACARE AT WHITING,315309,23 SCHOOLHOUSE ROAD,WHITING,Ocean,80,47,21,19,84,31,0,0
HEALTH CENTER AT BLOOMINGDALE,315348,255 UNION AVE,BLOOMINGDALE,Passaic,53,59,31,18,67,16,29,0
SINAI POST ACUTE NURSING AND REHAB CENTER,315236,65 JAY STREET,NEWARK,Essex,121,63,63,19,272,67,33,1
OCEANA REHABILITATION AND NC,315193,502 ROUTE 9 NORTH,CAPE MAY COURT HOUSE,Cape May,19,4,1,1,105,8,1,0
ARISTACARE AT CEDAR OAKS,315214,1311 DURHAM AVENUE,SOUTH PLAINFIELD,Middlesex,10,1,9,3,158,2,0,0
INGLEMOOR REHABILITATION AND CARE CENTER OF LIVING,315322,311 S LIVINGSTON AVE,LIVINGSTON,Essex,6,1,4,3,63,11,2,0
FOUNTAIN VIEW CARE CENTER,315327,527 RIVER AVE,LAKEWOOD,Ocean,70,10,19,8,78,23,7,0
ALARIS HEALTH AT HARBOR VIEW,315310,178-198 OGDEN AVE,JERSEY CITY,Hudson,1,13,3,0,112,3,0,0
MERIDIAN NURSING AND REHABILITATION AT BRICK,315342,415 JACK MARTIN BLVD,BRICK,Ocean,56,86,7,19,72,31,43,0
SOUTHGATE HEALTH CARE CTR,315237,449 S PENNSVILLE-AUBURN ROAD,CARNEYS POINT,Salem,57,12,22,22,82,31,12,0
"GARDENS AT MONROE HEALTHCARE AND REHABILITATION, T",315336,189 APPLEGARTH ROAD,MONROE TOWNSHIP,Middlesex,44,1,16,16,165,26,2,0
MANORCARE HEALTH SERVICES-WEST DEPTFORD,315246,550 JESSUP ROAD,WEST DEPTFORD,Gloucester,45,3,37,27,95,43,0,2
MONTCLAIR CARE CENTER,315363,111-115 GATES AVENUE,MONTCLAIR,Essex,1,0,1,1,42,5,0,0
ELMORA HILLS HEALTH & REHABILITATION CENTER,315010,225 W JERSEY STREET,ELIZABETH,Union,76,0,38,18,133,7,0,0
ATRIUM POST ACUTE CARE OF WAYNEVIEW,315291,2020 ROUTE 23 NORTH,WAYNE,Passaic,76,3,50,20,110,41,2,3
KRESSON VIEW CENTER,315207,2601 EVESHAM ROAD,VOORHEES,Camden,4,1,17,0,194,4,1,0
COURT HOUSE CENTER,315228,144 MAGNOLIA DRIVE,CAPE MAY COURT HOUSE,Cape May,5,4,12,0,87,0,0,0
PHILLIPSBURG CENTER,315311,843 WILBUR AVENUE,PHILLIPSBURG,Warren,1,0,4,0,51,1,0,0
RUNNELLS CENTER FOR REHABILITATION & HEALTHCARE,315009,40 WATCHUNG WAY,BERKELEY HEIGHTS,Union,20,4,188,4,163,79,19,0
VOORHEES CENTER,315219,3001 EVESHAM ROAD,VOORHEES,Camden,120,0,48,39,114,39,2,0
BROADWAY HOUSE FOR CONTINUING,315343,298 BROADWAY,NEWARK,Essex,18,0,10,5,66,27,0,0
COMPLETE CARE AT GREEN ACRES,315265,1931 LAKEWOOD ROAD,TOMS RIVER,Ocean,65,5,43,14,112,37,0,0
MORRISTOWN POST ACUTE REHAB AND NURSING CENTER,315157,77 MADISON AVENUE,MORRISTOWN,Morris,126,42,48,32,149,24,28,0
"ST JOSEPH'S HOME AL & NC, INC",315318,1-3 ST JOSEPH'S TERRACE,WOODBRIDGE,Middlesex,2,0,0,0,26,3,2,0
SPRING GROVE REHABILITATION AND HEALTHCARE CENTER,315005,144 GALES DRIVE,NEW PROVIDENCE,Union,41,7,17,7,76,3,0,0
COMPLETE CARE AT GREEN KNOLL,315134,875 ROUTE 202-206 NORTH,BRIDGEWATER,Somerset,46,10,6,3,101,3,23,1
ALARIS HEALTH AT ESSEX,315359,155 FORTIETH STREET,IRVINGTON,Essex,12,0,4,1,134,7,0,0
BRIGHTON GARDENS OF EDISON,315351,1801 OAKTREE ROAD,EDISON,Middlesex,14,2,8,8,11,9,1,0
HACKENSACK-UMC MOUNTAINSIDE,315389,ONE BAY AVE,MONTCLAIR,Essex,0,0,0,0,0,0,0,0
VIRTUA HEALTH & REHAB MT HOLLY,315128,62 RICHMOND AVENUE,LUMBERTON,Burlington,72,0,18,19,84,33,0,1
"MANOR, THE",315153,689 WEST MAIN ST,FREEHOLD,Monmouth,12,0,30,26,76,8,0,2
CARE ONE AT ORADELL,315339,600 KINDERKAMACK ROAD,ORADELL,Bergen,4,11,1,1,87,12,2,0
JFK HARTWYCK AT CEDAR BROOK,315101,1340 PARK AVE,PLAINFIELD,Union,49,0,21,15,83,21,5,0
"COMPLETE CARE AT LINWOOD, LLC",315185,201 NEW ROAD AND CENTRAL AVE,LINWOOD,Atlantic,9,6,31,26,115,6,3,0
ELMWOOD HILLS HEALTHCARE CENTER LLC,315159,425 WOODBURY-TURNERSVILLE ROAD,BLACKWOOD,Camden,100,6,22,17,247,39,14,0
AUTUMN LAKE HEALTHCARE AT BERKELEY HEIGHTS,315195,35 COTTAGE STREET,BERKELEY HEIGHTS,Union,2,0,1,0,64,4,0,0
DELLRIDGE HEALTH & REHABILITATION CENTER,315129,532 FARVIEW AVE,PARAMUS,Bergen,,,,,,,,
CARE ONE AT HOLMDEL,315092,188 HIGHWAY 34,HOLMDEL,Monmouth,30,2,15,7,100,9,0,0
NEW GROVE MANOR,315147,101 NORTH GROVE STREET,EAST ORANGE,Essex,108,11,40,20,119,8,39,2
STRATFORD MANOR REHABILITATION AND CARE CENTER,315066,787 NORTHFIELD AVE,WEST ORANGE,Essex,63,0,26,20,100,16,6,0
MARCELLA CENTER,315330,2305 RANCOCAS ROAD,BURLINGTON,Burlington,68,2,52,19,75,29,4,1
BURLINGTON WOODS,315050,115 SUNSET ROAD,BURLINGTON,Burlington,80,1,32,20,120,32,0,0
ELIZABETH NURSING AND REHAB,315106,1048 GROVE STREET,ELIZABETH,Union,0,0,33,20,47,18,0,0
REGENCY GARDENS NURSING CENTER,315103,296 HAMBURG TURNPIKE,WAYNE,Passaic,0,0,1,1,96,1,0,0
HAMPTON RIDGE HEALTHCARE AND REHABILITATION,315312,94 STEVENS ROAD,TOMS RIVER,Ocean,92,8,31,18,141,38,16,0
MORRIS VIEW HEALTHCARE CENTER,315303,540 WEST HANOVER AVENUE,MORRISTOWN,Morris,120,42,90,27,219,33,31,0
ALARIS HEALTH AT KEARNY,315192,206 BERGEN AVE,KEARNY,Hudson,13,5,8,6,70,21,1,0
CARE ONE AT NEW MILFORD,315306,800 RIVER ROAD,NEW MILFORD,Bergen,15,1,9,3,186,6,0,0
PREFERRED CARE AT ABSECON,315244,1020 PITNEY ROAD,ABSECON,Atlantic,88,0,17,12,116,35,4,0
CORNELL HALL CARE & REHABILITATION CENTER,315104,234 CHESTNUT STREET,UNION,Union,4,0,9,2,94,3,1,0
CARE ONE AT CRESSKILL,315313,221 COUNTY ROAD,CRESSKILL,Bergen,1,3,3,2,64,5,1,0
HARROGATE,315262,400 LOCUST STREET,LAKEWOOD,Ocean,0,0,4,2,56,0,0,0
"ACTORS FUND HOME, THE",315377,175 WEST HUDSON AVE,ENGLEWOOD,Bergen,24,38,20,13,119,19,5,0
DAUGHTERS OF MIRIAM CENTER,315021,155 HAZEL STREET,CLIFTON,Passaic,11,6,3,5,131,6,0,0
WATERVIEW CENTER,315216,536 RIDGE ROAD,CEDAR GROVE,Essex,66,1,46,24,116,27,2,0
COMPLETE CARE AT WILLOW CREEK,315131,1165 EASTON AVE,SOMERSET,Somerset,55,0,27,15,97,13,27,0
SOUTH MOUNTAIN HC,315283,2385 SPRINGFIELD AVENUE,VAUXHALL,Union,52,6,1,1,122,14,0,1
MADISON CENTER,315015,625 STATE HIGHWAY 34,MATAWAN,Monmouth,84,1,29,21,109,11,2,0
GREEN HILL,315416,103 PLEASANT VALLEY WAY,WEST ORANGE,Essex,14,1,18,3,77,20,1,1
"SPRINGPOINT AT CRESTWOOD, INC",315298,50 LACEY ROAD,WHITING,Ocean,31,6,29,22,44,13,5,0
WATERS EDGE HEALTHCARE & REHAB,315324,512 UNION STREET,TRENTON,Mercer,112,0,28,28,105,64,0,1
CARE ONE AT THE HIGHLANDS,315132,1350 INMAN AVENUE,EDISON,Middlesex,6,1,1,1,102,5,1,0
STERLING MANOR,315149,794 N FORKLANDING ROAD,MAPLE SHADE,Burlington,4,0,0,0,80,6,0,0
ANCHOR CARE AND REHABILITATION CENTER,315314,3325 HIGHWAY 35,HAZLET,Monmouth,52,23,22,18,129,33,3,3
PEACE CARE ST ANN'S,315413,198 OLD BERGEN ROAD,JERSEY CITY,Hudson,43,0,27,11,78,30,0,0
HAMILTON PLACE AT THE PINES AT WHITING,315347,507 ROUTE 530,WHITING,Ocean,0,0,0,0,51,1,0,0
MORRIS HALL/ST JOSEPH'S NURSING CENTER,315338,1 BISHOPS DRIVE,LAWRENCEVILLE,Mercer,63,30,32,27,128,32,0,0
ARISTACARE AT NORWOOD TERRACE,315217,40 NORWOOD AVENUE,PLAINFIELD,Union,4,5,6,3,73,1,2,0
BISHOP MCCARTHY CENTER FOR REHABILITATION & HC,315126,1045 E CHESTNUT AVE,VINELAND,Cumberland,61,13,6,5,125,37,6,0
ST MARY'S CENTER FOR REHABILITATION & HEALTHCARE,315060,210 ST MARY'S DRIVE,CHERRY HILL,Camden,0,8,13,13,162,35,0,7
RIDGEWOOD CENTER,315158,330 FRANKLIN TPK,RIDGEWOOD,Bergen,61,2,20,12,55,28,1,0
BARTLEY HEALTHCARE NURSING & REHABILITATION,315288,175 BARTLEY ROAD,JACKSON,Ocean,11,2,14,8,119,12,3,0
DAUGHTERS OF ISRAEL PLEASANT VALLEY HOME,315029,1155 PLEASANT VALLEY WAY,WEST ORANGE,Essex,6,55,23,17,176,49,0,0
FOOTHILL ACRES REHABILITATION & NURSING CENTER,315425,39 EAST MOUNTAIN ROAD,HILLSBOROUGH,Somerset,86,4,41,35,123,19,0,0
BARCLAYS REHABILITATION AND HEALTHCARE CENTER,315013,1412 MARLTON PIKE,CHERRY HILL,Camden,29,0,16,12,84,6,0,0
WILLOWBROOKE COURT SKILLED CARE AT EVERGREENS,315077,309 BRIDGEBORO ROAD,MOORESTOWN,Burlington,1,0,1,0,20,10,1,0
LEISURE PARK HEALTH CENTER,315256,1400 ROUTE 70,LAKEWOOD,Ocean,1,0,3,3,32,2,0,2
PINE ACRES CONVALESCENT CENTER,315053,51 MADISON AVE,MADISON,Morris,38,0,12,4,70,7,0,1
PARK CRESCENT HEALTHCARE & REHABILITATION CENTER,315266,480 PARKWAY DRIVE,EAST ORANGE,Essex,89,2,50,40,119,33,0,1
LLANFAIR HOUSE CARE & REHABILITATION CENTER,315142,1140 BLACK OAK RIDGE ROAD,WAYNE,Passaic,15,2,10,6,113,7,3,0
MERRY HEART NURSING HOME,315057,200 RT 10 WEST,SUCCASUNNA,Morris,,,,,,,,
CARE ONE AT KING JAMES,315087,1040 ROUTE 36,ATLANTIC HIGHLANDS,Monmouth,11,0,12,10,88,11,2,0
ROOSEVELT CARE CENTER,315039,118 PARSONAGE ROAD,EDISON,Middlesex,29,3,9,7,145,12,0,2
TEANECK NURSING CENTER,315037,1104 TEANECK ROAD,TEANECK,Bergen,10,0,1,1,75,0,0,0
WARREN HAVEN REHAB AND NURSING CENTER,315304,350 OXFORD ROAD,OXFORD,Warren,56,59,36,15,77,11,11,0
CRYSTAL LAKE HLTHCARE & REHAB,315125,395 LAKESIDE BLVD,BAYVILLE,Ocean,75,0,42,26,143,47,2,0
"DOCTORS SUBACUTE HEALTHCARE, LLC",315096,59 BIRCH STREET,PATERSON,Passaic,38,0,3,1,49,32,0,0
SILVER HEALTHCARE CENTER,315280,1417 BRACE ROAD,CHERRY HILL,Camden,118,143,29,23,106,25,32,0
ROSE MOUNTAIN CARE CENTER,315384,ROUTE 1 & 18,NEW BRUNSWICK,Middlesex,42,0,30,20,59,19,0,0
"HAMILTON GROVE HEALTHCARE AND REHABILITATION, LLC",315423,2300 HAMILTON AVE,HAMILTON,Mercer,54,7,35,25,143,17,10,0
MANAHAWKIN CONV CTR,315206,1211 RT 72 WEST,MANAHAWKIN,Ocean,10,3,6,6,104,5,2,0
JEFFERSON HEALTH CARE CENTER,315231,535 EGG HARBOR ROAD,SEWELL,Gloucester,30,3,4,4,110,9,8,0
PROVIDENCE NURSING AND REHABILITATION CENTER,315124,439 BELLEVUE AVENUE,TRENTON,Mercer,0,0,0,0,85,0,0,1
MERWICK CARE & REHABILITATION CENTER,315001,100 PLAINSBORO ROAD,PLAINSBORO,Middlesex,14,16,27,27,155,9,4,0
JOB HAINES HOME FOR AGED PEOPL,315392,250 BLOOMFIELD AVE,BLOOMFIELD,Essex,,,,,,,,
CLOVER MEADOWS HEALTHCARE AND REHABILITATION CENTE,315113,112 FRANKLIN CORNER ROAD,LAWRENCEVILLE,Mercer,53,0,24,21,53,18,9,0
CARE CONNECTION RAHWAY,315146,865 STONE STREET,RAHWAY,Union,10,0,11,2,8,1,0,0
REHAB AT RIVER'S EDGE,315140,633 ROUTE 28,RARITAN,Somerset,18,0,6,5,109,2,1,0
CRANFORD REHAB & NURSING CENTER,315091,205 BIRCHWOOD AVE,CRANFORD,Union,15,1,8,5,118,6,0,0
WILEY MISSION,315418,99 EAST MAIN STREET,MARLTON,Burlington,3,0,1,0,42,2,1,0
ATLANTIC COAST REHAB & HEALTH,315115,485 RIVER AVE,LAKEWOOD,Ocean,94,15,19,17,113,20,0,0
CARE ONE AT RIDGEWOOD AVENUE,315426,W-90 RIDGEWOOD AVE,PARAMUS,Bergen,13,9,11,8,77,6,1,0
PARK PLACE CENTER,315362,2 DEER PARK DRIVE,MONMOUTH JUNCTION,Middlesex,41,5,26,19,58,21,0,1
COMPLETE CARE AT SUMMIT RIDGE,315038,20 SUMMIT STREET,WEST ORANGE,Essex,59,0,38,24,93,19,17,0
ANDOVER SUBACUTE AND REHAB I,315044,1 O'BRIEN LANE,ANDOVER,Sussex,48,34,24,19,110,22,11,1
ST JOSEPH'S HOME FOR ELDERLY,315388,140 SHEPHERD LANE,TOTOWA,Passaic,7,5,8,4,61,15,4,0
LAUREL MANOR HEALTHCARE AND REHABILITATION CENTER,315008,18 W LAUREL ROAD,STRATFORD,Camden,12,0,5,3,88,6,0,0
ABINGDON CARE & REHABILITATION CENTER,315141,303 ROCK AVE,GREEN BROOK,Somerset,17,1,4,4,118,0,0,0
ALARIS HEALTH AT JERSEY CITY,315083,198 STEVENS AVE,JERSEY CITY,Hudson,1,0,17,5,111,36,3,0
HOLLY MANOR CENTER,315143,84 COLD HILL ROAD,MENDHAM,Morris,56,0,32,22,65,16,1,1
GATEWAY CARE CENTER,315177,139 GRANT AVE,EATONTOWN,Monmouth,41,0,0,12,111,17,0,0
N J VETERANS MEM HOME PARAMUS,315346,1 VETERANS DRIVE,PARAMUS,Bergen,123,2,116,78,200,91,0,1
BROOKHAVEN HEALTH CARE CENTER,315268,120 PARK END PLACE,EAST ORANGE,Essex,5,0,0,0,93,1,0,0
WARDELL GARDENS AT TINTON FALLS,315414,524 WARDELL ROAD,TINTON FALLS,Monmouth,3,7,1,0,51,2,0,0
WINDSOR GARDENS CARE CENTER,315178,140 PARK AVE,EAST ORANGE,Essex,61,0,17,13,141,12,1,0
ARNOLD WALTER NURSING HOME,315119,622 S LAUREL AVENUE,HAZLET,Monmouth,10,4,10,8,86,19,2,1
"HEALTH CENTER AT GALLOWAY, THE",315210,66 WEST JIMMIE LEEDS ROAD,GALLOWAY TOWNSHIP,Atlantic,46,20,21,21,74,15,11,0
PREMIER CADBURY OF CHERRY HILL,315183,2150 ROUTE 38,CHERRY HILL,Camden,3,0,2,1,86,4,0,0
APPLEWOOD ESTATES,315292,APPLEWOOD DRIVE,FREEHOLD,Monmouth,5,0,20,2,34,2,0,0
MAJESTIC CENTER FOR REHAB & SUB-ACUTE CARE,315205,TWO COOPER PLAZA,CAMDEN,Camden,51,0,8,8,86,11,0,0
MERIDIAN NURSING AND REHABILITATION AT OCEAN GROVE,315365,160 MAIN STREET,OCEAN GROVE,Monmouth,42,2,4,8,79,18,3,0
CREST HAVEN NURSING AND REHABILITATION CENTER,315294,4 MOORE ROAD,CAPE MAY COURT HOUSE,Cape May,0,1,3,0,92,4,148,0
VOORHEES PEDIATRIC FACILITY,315289,1304 LAUREL OAK ROAD,VOORHEES,Camden,0,1,3,0,109,1,1,0
CHATHAM HILLS SUBACUTE CARE CENTER,315120,415 SOUTHERN BLVD,CHATHAM,Morris,13,46,9,3,70,10,4,0
AUTUMN LAKE HEALTHCARE AT OCEANVIEW,315179,2721 ROUTE 9,OCEAN VIEW,Cape May,17,6,12,7,100,4,3,0
HARBORAGE (THE),315307,7600 RIVER ROAD,NORTH BERGEN,Hudson,136,5,56,37,152,55,47,2
ARBOR GLEN CENTER,315036,25 E LINDSLEY ROAD,CEDAR GROVE,Essex,37,0,28,10,80,21,2,0
HEATH VILLAGE,315072,430 SCHOOLEY'S MOUNTAIN RD,HACKETTSTOWN,Morris,39,78,23,9,68,36,44,0
ARMENIAN NURSING AND REHABILITATION CENTER,315402,70 MAIN STREET,EMERSON,Bergen,23,9,24,13,21,26,0,0
NORTH CAPE CENTER,315350,700 TOWNBANK ROAD,CAPE MAY,Cape May,53,2,22,12,60,31,8,0
MONMOUTH CARE CENTER,315284,229 BATH AVENUE,LONG BRANCH,Monmouth,3,0,14,13,84,8,0,0
RIVERSIDE NURSING AND REHABILITATION CENTER,315235,325 JERSEY STREET,TRENTON,Mercer,55,104,34,13,104,61,47,1
LAKELAND HEALTH CARE CENTER,315261,25 FIFTH AVENUE,HASKELL,Passaic,0,0,1,0,92,0,0,0
ASPEN HILLS HEALTHCARE CENTER,315260,600 PEMBERTON BROWN MILLS RD,PEMBERTON,Burlington,47,0,12,8,160,13,1,1
EAGLEVIEW HEALTH AND REHABILITATION,315014,849 BIG OAK ROAD,PITTSGROVE,Salem,3,0,1,0,71,4,0,0
PREFERRED CARE AT WALL,315397,2350 HOSPITAL ROAD,ALLENWOOD,Monmouth,55,8,13,11,86,6,5,0
COUNTRY ARCH CARE CENTER,315433,114 PITTSTOWN ROAD,PITTSTOWN,Hunterdon,22,0,7,5,67,0,0,0
WHITE HOUSE HLTHCR & REHAB CTR,315372,560 BERKELEY AVENUE,ORANGE,Essex,17,0,7,1,112,1,0,0
ALARIS HEALTH AT ROCHELLE PARK,315308,96 PARKWAY AVENUE,ROCHELLE PARK,Bergen,23,4,33,15,144,44,2,0
ALARIS HEALTH AT ST MARY'S,315352,135 SOUTH CENTER STREET,ORANGE,Essex,5,11,13,13,141,28,16,0
ATRIUM POST ACUTE CARE OF PRINCETON,315370,5000 WINDROW DRIVE,PRINCETON,Mercer,69,18,35,19,101,20,2,0
SHADY LANE GLOUCESTER CO HOME,315405,256 COUNTY HOUSE ROAD,CLARKSBORO,Gloucester,,,,,,,,
BERGEN NEW BRIDGE MEDICAL CENTER,315017,230 E RIDGEWOOD AVE,PARAMUS,Bergen,246,40,5,64,396,115,2,1
HACKENSACK MERIDIAN HEALTH NURSING & REHAB,315286,100 CHAPIN AVENUE,RED BANK,Monmouth,8,0,5,3,128,42,5,0
HAMMONTON CENTER FOR REHABILITATION AND HEALTHCARE,315209,43 N WHITE HORSE PIKE,HAMMONTON,Atlantic,55,13,26,23,192,13,4,0
DE LA SALLE HALL,315374,810 NEWMAN SPRINGS RD,LINCROFT,Monmouth,0,0,1,0,25,0,0,0
ARBOR RIDGE REHABILITATION AND HEALTHCARE CENTER,315234,261 TERHUNE DRIVE,WAYNE,Passaic,42,3,18,5,98,7,0,0
FAMILY OF CARING HEALTHCARE AT RIDGEWOOD,315434,304 S. VAN DIEN AVE,RIDGEWOOD,Bergen,43,1,27,17,62,29,2,0
LINCOLN PARK RENAISSANCE REHAB & NURSING,315042,521 PINE BROOK ROAD,LINCOLN PARK,Morris,9,3,20,13,116,33,1,0
HARTWYCK AT OAK TREE,315251,2048 OAK TREE ROAD,EDISON,Middlesex,35,38,18,1,89,61,22,0
FAMILY OF CARING HEALTHCARE AT MONTCLAIR,315435,42 NORTH MOUNTAIN AVE,MONTCLAIR,Essex,,,,,,,,
ARISTACARE AT DELAIRE,315200,400 W STIMPSON AVE,LINDEN,Union,131,0,52,79,188,45,0,0
"PREFERRED CARE AT OLD BRIDGE, LLC",315321,6989 RT18,OLD BRIDGE,Middlesex,49,30,20,18,84,42,2,0
VILLAGE POINT,315269,THREE DAVID BRAINERD DRIVE,MONROE TOWNSHIP,Middlesex,13,3,6,17,82,9,0,0
"OAKS AT DENVILLE, THE",315329,21 POCONO ROAD,DENVILLE,Morris,15,5,15,4,50,7,0,0
WESTFIELD CENTER,315122,1515 LAMBERTS MILL ROAD,WESTFIELD,Union,51,2,46,16,104,55,1,2
MEDFORD LEAS,315144,ONE MEDFORD LEAS WAY,MEDFORD,Burlington,2,0,2,2,5,3,0,0
OAKLAND REHABILITATION AND HEALTHCARE  CENTER,315171,20 BREAKNECK ROAD,OAKLAND,Bergen,112,17,42,42,132,63,13,4
ALARIS HEALTH AT CASTLE HILL,315344,615 23RD STREET,UNION CITY,Hudson,3,12,5,13,123,6,3,2
PINE BROOK CARE CENTER,315282,104 PENSION ROAD,ENGLISHTOWN,Monmouth,6,0,4,4,59,1,0,0
UNITED METHODIST COMMUNITIES AT COLLINGSWOOD,315404,460 HADDON AVE,COLLINGSWOOD,Camden,33,6,16,14,29,45,11,0
CHESTNUT HILL CONV CENTER,315085,360 CHESTNUT STREET,PASSAIC,Passaic,14,8,6,6,55,9,6,1
BRIDGEWAY CARE AND REHAB CENTER AT BRIDGEWATER,315182,270 ROUTE 28,BRIDGEWATER,Somerset,77,37,38,21,111,21,71,0
FOREST HILL HEALTHCARE CENTER,315375,497 MT PROSPECT AVE,NEWARK,Essex,1,0,1,0,62,4,0,0
CEDAR GROVE RESPIRATORY AND NURSING CENTER,315257,1420 SOUTH BLACK HORSE PIKE,WILLIAMSTOWN,Gloucester,10,4,51,3,163,10,0,0
CRANFORD PARK REHABILITATION & HEALTHCARE CENTER,315390,600 LINCOLN PARK EAST,CRANFORD,Union,2,0,5,3,56,74,0,0
PHOENIX CENTER FOR REHABILITATION AND PEDIATRICS,315229,1433 RINGWOOD AVE,HASKELL,Passaic,2,0,2,0,160,0,0,0
MERIDIAN NURSING & REHAB AT SHREWSBURY,315136,89 AVENUE AT THE COMMON,SHREWSBURY,Monmouth,3,7,8,0,103,6,3,0
HACKENSACK MERIDIAN HEALTH WEST CALDWELL C,315247,165 FAIRFIELD AVE,WEST CALDWELL,Essex,4,0,9,4,112,1,0,0
AMBOY CARE CENTER,315305,1 LINDBERG AVENUE,PERTH AMBOY,Middlesex,42,4,10,16,120,5,0,0
CRANBURY CENTER,315353,292 APPLEGARTH ROAD,MONROE TOWNSHIP,Middlesex,56,5,31,28,80,29,1,1
LAKEVIEW REHABILITATION AND CARE CENTER,315110,130 TERHUNE DRIVE,WAYNE,Passaic,34,5,26,13,84,22,15,0
JERSEY SHORE CENTER,315364,3 INDUSTRIAL WAY EAST,EATONTOWN,Monmouth,12,0,13,1,122,7,0,0
HACKENSACK MERIDIAN HEALTH NURSING & REHAB,315295,50 POLIFLY ROAD,HACKENSACK,Bergen,0,0,6,2,127,6,0,1
SOUTHERN OCEAN CENTER,315332,1361 ROUTE 72 WEST,MANAHAWKIN,Ocean,57,5,33,14,77,18,0,0
IMPERIAL CARE CENTER,315199,919 GREEN GROVE ROAD,NEPTUNE,Monmouth,1,1,1,0,73,1,0,0
SUMMER HILL NURSING HOME,315381,111 ROUTE 516,OLD BRIDGE,Middlesex,26,0,8,4,86,27,1,0
PREAKNESS HEALTHCARE CENTER,315361,305 OLDHAM ROAD,WAYNE,Passaic,7,0,8,6,297,29,3,0
"COMPLETE CARE AT LAURELTON, LLC",315274,475 JACK MARTIN BLVD,BRICK,Ocean,71,1,21,14,73,20,0,0
CARE ONE AT VALLEY,315369,300 OLD HOOK ROAD,WESTWOOD,Bergen,4,0,4,1,89,6,0,0
CARNEYS POINT REHABILITATION AND NURSING CENTER,315271,201 FIFTH AVENUE,CARNEYS POINT,Salem,74,10,0,0,104,73,18,0
BRAKELEY PARK CENTER,315316,290 RED SCHOOL LANE,PHILLIPSBURG,Warren,92,0,35,26,84,32,0,0
ARISTACARE AT MANCHESTER,315196,1770 TOBIAS AVENUE,MANCHESTER,Ocean,97,9,31,21,105,32,9,0
COMPLETE CARE AT WOODLANDS,315273,1400 WOODLAND AVE,PLAINFIELD,Union,0,1,1,0,66,4,0,0
CLOVER REST HOME,315429,28 WASHINGTON STREET,COLUMBIA,Warren,0,0,0,0,33,0,6,0
LINCOLN PARK CARE CENTER,315249,499 PINE BROOK ROAD,LINCOLN PARK,Morris,143,171,92,63,404,79,88,0
ST JOSEPH'S HEALTHCARE AND REHAB CENTER,315194,315 EAST LINDSLEY ROAD,CEDAR GROVE,Essex,85,0,46,26,98,51,0,1
ABIGAIL HOUSE FOR NURSING & REHABILITATION,315267,1105 -1115 LINDEN STREET,CAMDEN,Camden,61,0,8,4,139,17,0,0
CARE ONE AT SOMERSET VALLEY,315002,1621 ROUTE 22 WEST,BOUND BROOK,Somerset,6,0,3,0,45,4,1,1
CLARK NURSING AND REHAB CNTR,315341,1213 WESTFIELD AVENUE,CLARK,Union,64,3,29,23,66,26,13,1
DEPTFORD CENTER FOR REHABILITATION AND HEALTHCARE,315174,1511 CLEMENTS BRIDGE RD,DEPTFORD,Gloucester,41,25,32,29,196,11,2,1
SEASHORE GARDENS LIVING CENTER,315340,22 WEST JIMMIE LEEDS ROAD,GALLOWAY TOWNSHIP,Atlantic,2,0,2,0,115,3,0,0
KING MANOR CARE AND REHABILITATION CENTER,315299,2303 WEST BANGS AVE,NEPTUNE,Monmouth,5,0,3,0,78,1,0,0
"COMPLETE CARE AT HAMILTON, LLC",315221,56 HAMILTON AVENUE,PASSAIC,Passaic,,,,,,,,
CUMBERLAND MANOR NURSING AND REHABILITATION CENTER,315396,154 SUNNY SLOPE DRIVE,BRIDGETON,Cumberland,0,0,1,0,156,8,2,0
ARISTACARE AT CHERRY HILL,315245,1399 CHAPEL AVE WEST,CHERRY HILL,Camden,14,0,17,15,83,18,0,0
HUNTERDON CARE CENTER,315226,1 LEISURE COURT,FLEMINGTON,Hunterdon,3,1,2,2,126,0,0,2
ALLEGRIA AT THE FOUNTAINS,315297,114 HAYES MILL ROAD,ATCO,Camden,0,0,4,0,53,0,0,0
MEADOW LAKES,315022,300 MEADOW LAKES,EAST WINDSOR,Mercer,16,6,17,9,51,21,1,0
NEPTUNE GARDENS NURSING AND REHAB LLC,315056,101 WALNUT ST,NEPTUNE,Monmouth,62,148,4,0,73,46,0,0
FOREST MANOR HCC,315224,145 STATE PARK ROAD,HOPE,Warren,81,84,33,23,75,28,32,0
FRIENDS VILLAGE AT WOODSTOWN,315161,ONE FRIENDS DRIVE,WOODSTOWN,Salem,15,0,9,7,33,15,1,0
LOPATCONG CENTER,315202,390 RED SCHOOL LANE,PHILLIPSBURG,Warren,97,2,28,25,103,24,1,0
CAMBRIDGE REHABILITATION AND HEALTHCARE CENTER,315201,255 EAST MAIN ST,MOORESTOWN,Burlington,66,7,23,17,96,23,0,0
EMERSON HEALTH CARE CENTER,315360,100 KINDERKAMACK ROAD,EMERSON,Bergen,15,2,34,1,108,17,0,1
ALARIS HEALTH AT RIVERTON,315198,1777 LAWRENCE STREET,RAHWAY,Union,2,0,2,0,64,6,1,0
SEACREST VILLAGE,315218,1001 CENTER ST,LITTLE EGG HARBOR TW,Ocean,0,0,5,0,139,3,0,0
MCAULEY HALL HEALTH CARE CENTE,315337,1633 HIGHWAY 22,WATCHUNG,Somerset,22,1,20,6,53,24,0,0
RIVERFRONT REHABILITATION AND HEALTHCARE CENTER,315225,5101 NORTH PARK DRIVE,PENNSAUKEN,Camden,61,11,14,8,157,29,3,0
AVISTA HEALTHCARE,315068,3025 CHAPEL AVENUE WEST,CHERRY HILL,Camden,0,0,3,0,61,3,0,1
ALLAIRE REHAB & NURSING,315387,115 DUTCH LANE ROAD,FREEHOLD,Monmouth,45,15,10,7,113,19,9,0
ROSE GARDEN NURSING AND REHABILITATION CENTER,315421,1579 OLD FREEHOLD ROAD,TOMS RIVER,Ocean,51,1,3,9,88,29,6,0
MAYWOOD CENTER FOR HEALTH AND REHABILITATION,315386,100 WEST MAGNOLIA AVENUE,MAYWOOD,Bergen,79,5,21,19,89,25,2,0
MAPLE GLEN CENTER,315328,12-15 SADDLE RIVER ROAD,FAIRLAWN,Bergen,74,4,38,29,85,39,0,0
COUNTY MANOR REHABILITATION & HCC,315164,133 COUNTY ROAD,TENAFLY,Bergen,30,16,12,11,39,12,11,0
CAREPOINT HEALTH - BAYONNE HOSPITAL CENTER TCU,315431,29 EAST 29TH STREET,BAYONNE,Hudson,0,0,0,0,5,2,0,0
MEDFORD CARE CENTER,315176,185 TUCKERTON ROAD,MEDFORD,Burlington,57,44,13,8,93,10,6,0
WOODCLIFF LAKE HEALTH & REHABILITATION CENTER,315133,555 CHESTNUT RIDGE ROAD,WOODCLIFF LAKE,Bergen,10,4,18,4,71,47,0,2
INGLEMOOR CENTER,315349,333 GRAND AVE,ENGLEWOOD,Bergen,18,3,8,8,37,11,0,0
HAMILTON CONTINUING CARE,315223,1059 EDINBURG ROAD,HAMILTON,Mercer,104,0,51,39,99,45,1,0
ALARIS HEALTH AT CEDAR GROVE,315357,110 GROVE AVE,CEDAR GROVE,Essex,10,0,0,0,134,15,0,0
CONCORD HEALTHCARE & REHABILITATION CENTER,315275,963 OCEAN AVE,LAKEWOOD,Ocean,29,13,8,8,77,31,13,0
CORAL HARBOR REHABILITATION AND HEALTHCARE CENTER,315105,2050 SIXTH AVE,NEPTUNE CITY,Monmouth,3,7,11,0,93,2,14,0
CHILDRENS SPECIALIZED HOSPITAL MOUNTAINSIDE,315239,150 NEW PROVIDENCE ROAD,MOUNTAINSIDE,Union,2,9,0,0,44,19,13,0
TROY HILLS CENTER,315138,200 REYNOLDS AVE,PARSIPPANY,Morris,45,1,23,10,76,16,0,0
BAYSHORE HEALTH CARE CENTER,315252,715 NORTH BEERS STREET,HOLMDEL,Monmouth,4,0,15,11,143,9,15,0
HUDSONVIEW HEALTH CARE CENTER,315112,9020 WALL STREET,NORTH BERGEN,Hudson,21,24,7,3,197,21,0,0
CARE ONE AT WELLINGTON,315152,301 UNION STREET,HACKENSACK,Bergen,1,0,3,1,94,5,1,0
LEISURE CHATEAU REHABILITATION,315190,962 RIVER AVE,LAKEWOOD,Ocean,78,73,26,20,154,43,2,0
SOUTH JERSEY EXTENDED CARE,315061,99 MANHEIM AVENUE,BRIDGETON,Cumberland,54,0,2,2,113,33,2,0
BERGEN COUNTY HEALTH CARE CTR,315436,35 B PIERMONT ROAD,ROCKLEIGH,Bergen,1,0,2,2,58,4,0,0
GOLDEN REHABILITATION AND NURSING CENTER,315058,438 SALEM-WOODSTOWN ROAD,SALEM,Salem,1,0,0,0,64,4,0,0
N J EASTERN STAR HOME,315419,111 FINDERNE AVENUE,BRIDGEWATER,Somerset,34,122,20,12,39,18,5,0
GREENWOOD HOUSE HOME FOR THE JEWISH AGED,315215,53 WALTER STREET,TRENTON,Mercer,,,,,,,,
CREST POINTE REHABILITATION AND HEALTHCARE CENTER,315135,1515 HULSE ROAD,PT PLEASANT,Ocean,85,2,17,13,91,19,2,0
EASTERN PINES CONV CTR,315317,29 NORTH VERMONT AVE,ATLANTIC CITY,Atlantic,3,0,2,0,86,4,0,0
COMPLETE CARE AT FAIR LAWN EDGE,315331,77 EAST 43RD STREET,PATERSON,Passaic,23,7,11,7,123,10,2,0
